"location","source","target","id","fuzzy","context","translator_comments","developer_comments"
"Scripts/content/Story/MISSIONS/DIA_Vlk_538_Huno.d:76","Irgendwie hat der Typ ein Faible für Ornamente und so 'nen Weiberkram, und das hat natürlich seinen Preis.","A ese tipo le gustan las decoraciones y mariconadas de esas y, por supuesto, eso sale caro..","","","DIA_Huno_HowLong_09_06","",""
"Scripts/content/Story/MISSIONS/DIA_Vlk_538_Huno.d:77","Hey, du bist ganz schön neugierig, Freundchen.","Oye, eres curioso de verdad, amigo.","","","DIA_Huno_HowLong_09_07","",""
"Scripts/content/Story/MISSIONS/DIA_Vlk_538_Huno.d:90","Na, Schmied, wie läuft das Geschäft?","¿Qué tal va el negocio, herrero?","","","DIA_Huno_HowsYourBusiness.description","",""
"Scripts/content/Story/MISSIONS/DIA_Vlk_538_Huno.d:103","Na, Schmied, wie läuft das Geschäft?","Hola, herrero ¿cómo va el negocio?","","","DIA_Huno_HowsYourBusiness_15_00","",""
"Scripts/content/Story/MISSIONS/DIA_Vlk_538_Huno.d:104","Was geht dich das an?","¿Por qué quieres saberlo?","","","DIA_Huno_HowsYourBusiness_09_01","",""
"Scripts/content/Story/MISSIONS/DIA_Vlk_538_Huno.d:105","Vielleicht habe ich einen Auftrag für dich.","Puede que tenga un encargo para ti.","","","DIA_Huno_HowsYourBusiness_15_02","",""
"Scripts/content/Story/MISSIONS/DIA_Vlk_538_Huno.d:106","Ach ja? Was denn?","¿Oh? ¿De verdad? ¿Qué encargo?","","","DIA_Huno_HowsYourBusiness_09_03","",""
"Scripts/content/Story/MISSIONS/DIA_Vlk_538_Huno.d:107","Ich überleg's mir.","Me lo pensaré.","","","DIA_Huno_HowsYourBusiness_15_04","",""
"Scripts/content/Story/MISSIONS/DIA_Vlk_538_Huno.d:108","Komm wieder, wenn du was brauchst, und geh mir nicht auf die Nerven.","Vuelve cuando necesites algo de verdad y no me des el coñazo.","","","DIA_Huno_HowsYourBusiness_09_05","",""
"Scripts/content/Story/MISSIONS/DIA_Vlk_538_Huno.d:123","Ich würde mich selbst gern mal an deiner Schmiede versuchen.","También me gustaría intentar trabajar aquí.","","","DIA_Huno_LEARNSMITH.description","",""
"Scripts/content/Story/MISSIONS/DIA_Vlk_538_Huno.d:136","Ich würde mich selbst gern mal an deiner Schmiede versuchen.","A mí también me gustaría trabajar aquí.","","","DIA_Huno_LEARNSMITH_15_00","",""
"Scripts/content/Story/MISSIONS/DIA_Vlk_538_Huno.d:137","So so, aber glaub nur nicht, dass du tolle Klingen herstellen kannst!","¡Oh, pero no te creas que tú también puedes fabricar buenas espadas!","","","DIA_Huno_LEARNSMITH_09_01","",""
"Scripts/content/Story/MISSIONS/DIA_Vlk_538_Huno.d:138","Was muss ich tun?","¿Qué es lo que tengo que hacer?","","","DIA_Huno_LEARNSMITH_15_02","",""
"Scripts/content/Story/MISSIONS/DIA_Vlk_538_Huno.d:139","Okay, nimm den Rohstahl und halte ihn ins Schmiedefeuer.","Vale, coge el acero y ponlo en el fuego.","","","DIA_Huno_LEARNSMITH_09_03","",""
"Scripts/content/Story/MISSIONS/DIA_Vlk_538_Huno.d:140","Dann musst du den glühenden Stahl am Amboss schmieden.","Después tienes que depositar el acero al rojo sobre el yunque.","","","DIA_Huno_LEARNSMITH_09_04","",""
"Scripts/content/Story/MISSIONS/DIA_Vlk_538_Huno.d:141","Stecke dann die glühende Klinge dort drüben in den Wassereimer, um sie zu härten.","Cuando hayas acabado, pon la espada caliente en ese cubo para templarla.","","","DIA_Huno_LEARNSMITH_09_05","",""
"Scripts/content/Story/MISSIONS/DIA_Vlk_538_Huno.d:142","Am Ende muss die abgekühlte Klinge noch am Schleifstein geschärft werden.","Por último, una vez fría, la espada tiene que ser afilada en la piedra de afilar.","","","DIA_Huno_LEARNSMITH_09_06","",""
"Scripts/content/Story/MISSIONS/DIA_Vlk_538_Huno.d:143","Verstehe.","Entiendo.","","","DIA_Huno_LEARNSMITH_15_07","",""
"Scripts/content/Story/MISSIONS/DIA_Vlk_538_Huno.d:144","Allerdings brauchst du dafür ein paar Sachen. Ich kann sie dir verkaufen.","Pero para hacer eso te harán falta unas cuantas cosas. Yo podría vendértelas.","","","DIA_Huno_LEARNSMITH_09_08","",""
"Scripts/content/Story/MISSIONS/DIA_Vlk_538_Huno.d:160","Ich möchte Dinge fürs Schmieden kaufen!","¡Me gustaría comprar material de herrería!","","","DIA_Huno_BUYSMITH.description","",""
"Scripts/content/Story/MISSIONS/DIA_Vlk_538_Huno.d:173","Ich möchte Dinge fürs Schmieden kaufen!","¡Quiero comprar herramientas de herrería!","","","DIA_Huno_BUYSMITH_15_00","",""
"Scripts/content/Story/MISSIONS/DIA_Vlk_564_Jesse.d:33","Wie sieht's aus?","¿Qué tal?","","","DIA_Jesse_Hallo.description","",""
"Scripts/content/Story/MISSIONS/DIA_Vlk_564_Jesse.d:46","Wie sieht's aus?","¿Cómo van las cosas?","","","DIA_Jesse_Hallo_15_00","",""
"Scripts/content/Story/MISSIONS/DIA_Vlk_564_Jesse.d:47","Neu hier, was? Du solltest wissen, dass man sich hier besser nicht mit den Gardisten anlegt.","Eres nuevo aquí, ¿verdad? Será mejor que sepas que no debes meterte en problemas con los guardias.","","","DIA_Jesse_Hallo_03_01","",""
"Scripts/content/Story/MISSIONS/DIA_Vlk_564_Jesse.d:48","Wenn sie Schutzgeld wollen, zahlst du besser, sonst hast du bald das halbe Lager gegen dich.","Cuando te pidan el dinero de la protección, será mejor que se lo des; si no tendrás a medio Campamento en tu contra.","","","DIA_Jesse_Hallo_03_02","",""
"Scripts/content/Story/MISSIONS/DIA_Vlk_564_Jesse.d:73","Hey, du! Ich hab' gehört, du wolltest Bloodwyn kein Schutzgeld zahlen?","¡Eh, tú! He oído que no quieres pagarle dinero por protección a Bloodwyn. ¿Es eso cierto?","","","DIA_Jesse_Warn_03_00","",""
"Scripts/content/Story/MISSIONS/DIA_Vlk_564_Jesse.d:74","Was willst du?","¿Qué es lo que quieres?","","","DIA_Jesse_Warn_15_01","",""
"Scripts/content/Story/MISSIONS/DIA_Vlk_564_Jesse.d:75","Dich warnen! Bloodwyn hat einige Leute bezahlt, damit sie dir Ärger machen.","¡Prevenirte! Bloodwyn ha pagado a algunos tipos para que te liquiden.","","","DIA_Jesse_Warn_03_02","",""
"Scripts/content/Story/MISSIONS/DIA_Vlk_564_Jesse.d:76","Ich hab' zum Beispiel gesehen, wie er mit Herek da drüben geredet hat. Und nur die Götter wissen, mit wem noch!","¡Le he visto hablar con gente como Herek y Dios sabe a quién más ha contratado!","","","DIA_Jesse_Warn_03_03","",""
"Scripts/content/Story/MISSIONS/DIA_Vlk_564_Jesse.d:77","Was Herek betrifft, kommt deine Warnung etwas spät.","Tu aviso acerca de Herek llega un poco tarde.","","","DIA_Jesse_Warn_15_04","",""
"Scripts/content/Story/MISSIONS/DIA_Vlk_564_Jesse.d:78","Er muss noch mit jemand anderem geredet haben - so viel hab' ich mitgekriegt. Also pass auf dich auf.","Por lo que yo sé, también debe haber hablado con algunos más. Así que ten cuidado.","","","DIA_Jesse_Warn_03_05","",""
"Scripts/content/Story/MISSIONS/DIA_Vlk_564_Jesse.d:92","Warum hast du mir die Sache mit Bloodwyn erzählt?","¿Por qué me contaste la historia de Bloodwyn?","","","DIA_Jesse_Mission.description","",""
"Scripts/content/Story/MISSIONS/DIA_Vlk_564_Jesse.d:105","Warum hast du mir die Sache mit Bloodwyn erzählt?","¿Por qué me has contado lo de Bloodwyn?","","","DIA_Jesse_Mission_15_00","",""
"Scripts/content/Story/MISSIONS/DIA_Vlk_564_Jesse.d:106","Weil hier eine Hand die andere wäscht. Du siehst nicht so aus wie einer, der das nicht begreifen würde.","Porque los favores pueden devolverse. Y no pareces ser alguien que no comprenda eso.","","","DIA_Jesse_Mission_03_01","",""
"Scripts/content/Story/MISSIONS/DIA_Vlk_564_Jesse.d:107","Und weil ich DIR jetzt einen Gefallen getan habe, möchte ich dir Gelegenheit geben, dich zu revanchieren.","Y, dado que yo te he hecho un favor, quiero darte la oportunidad de devolverlo.","","","DIA_Jesse_Mission_03_02","",""
"Scripts/content/Story/MISSIONS/DIA_Vlk_564_Jesse.d:110","Vergiß es! Ich schulde dir gar nichts!","¡Olvídalo! ¡No te debo nada!","","","DIA_Jesse_Mission.DIA_Jesse_Mission_ForgetIt","Info_AddChoice",""
"Scripts/content/Story/MISSIONS/DIA_Vlk_564_Jesse.d:111","An was hattest du denn da gedacht?","¿Qué tienes pensado exactamente?","","","DIA_Jesse_Mission.DIA_Jesse_Mission_What","Info_AddChoice",""
"Scripts/content/Story/MISSIONS/DIA_Vlk_564_Jesse.d:116","Ich schulde dir GAR nichts!","¡No te debo nada!","","","DIA_Jesse_Mission_ForgetIt_15_00","",""
"Scripts/content/Story/MISSIONS/DIA_Vlk_564_Jesse.d:117","(sauer) Dann vergiss es doch einfach!","¡Oh! ¡Entonces, piérdete!","","","DIA_Jesse_Mission_ForgetIt_03_01","",""
"Scripts/content/Story/MISSIONS/DIA_Vlk_564_Jesse.d:125","An was hattest du denn da gedacht?","¿Qué es exactamente lo que tienes en mente?","","","DIA_Jesse_Mission_What_15_00","",""
"Scripts/content/Story/MISSIONS/DIA_Vlk_564_Jesse.d:126","Ich hab' kein Erz mehr, und Bloodwyn hat schon versucht, das letzte Bröckchen aus mir rauszupressen.","No me queda nada de mineral y además Bloodwyn también me ha esquilmado.","","","DIA_Jesse_Mission_What_03_01","",""
"Scripts/content/Story/MISSIONS/DIA_Vlk_564_Jesse.d:127","Jetzt, wo ich dir geholfen habe, könntest du ihm doch meine 10 Erz geben, oder? Sag ihm, sie kommen von mir.","Ahora que te he ayudado, podrías pagarle las 10 pepitas que le debo, ¿no? Dile que es de mi parte.","","","DIA_Jesse_Mission_What_03_02","",""
"Scripts/content/Story/MISSIONS/DIA_Vlk_564_Jesse.d:130","Ich für dich zahlen? Vergiß es!","¿Que yo te pague? ¡Ni hablar!","","","DIA_Jesse_Mission.DIA_Jesse_Mission_NO","Info_AddChoice",""
"Scripts/content/Story/MISSIONS/DIA_Vlk_564_Jesse.d:131","Ich werd sehen, was ich machen kann...","Veré lo que puedo hacer.","","","DIA_Jesse_Mission.DIA_Jesse_Mission_YES","Info_AddChoice",""
"Scripts/content/Story/MISSIONS/DIA_Vlk_564_Jesse.d:137","Ich werd sehen, was ich machen kann ...","Veré qué puedo hacer.","","","DIA_Jesse_Mission_YES_15_00","",""
"Scripts/content/Story/MISSIONS/DIA_Vlk_564_Jesse.d:138","Danke, Mann! Du bist meine Rettung! Sag mir Bescheid, wenn die Sache gelaufen ist, ja?","¡Gracias, tío! ¡Me has salvado el pellejo! Avísame cuando el asunto esté solucionado, por favor.","","","DIA_Jesse_Mission_YES_03_01","",""
"Scripts/content/Story/MISSIONS/DIA_Vlk_564_Jesse.d:146","Ich für dich zahlen? Vergiss es!","¿Que yo pague por ti? ¡Ni hablar!","","","DIA_Jesse_Mission_NO_15_00","",""
"Scripts/content/Story/MISSIONS/DIA_Vlk_564_Jesse.d:147","So kann man sich in jemandem irren. Mit meiner Hilfe rechnest du am besten nicht mehr.","Parece que me equivocaba respecto a ti. En el futuro, no cuentes conmigo.","","","DIA_Jesse_Mission_NO_03_01","",""
"Scripts/content/Story/MISSIONS/DIA_Vlk_564_Jesse.d:162","Ich habe Bloodwyn bezahlt!","¡Pagué a Bloodwyn!","","","DIA_Jesse_MisSuccess.description","",""
"Scripts/content/Story/MISSIONS/DIA_Vlk_564_Jesse.d:175","Ich habe Bloodwyn bezahlt!","¡He pagado a Bloodwyn!","","","DIA_Jesse_MisSuccess_15_00","",""
"Scripts/content/Story/MISSIONS/DIA_Vlk_564_Jesse.d:176","Ja? Gut! Dann sind wir ja jetzt quitt.","¿De veras? ¡Genial! Ahora estamos en paz.","","","DIA_Jesse_MisSuccess_03_01","",""
"Scripts/content/Story/MISSIONS/DIA_Vlk_564_Jesse.d:180","WAAAS?! Ich hab' 10 Erz ausgegeben für einen Tip, den ich sowieso schon kannte!?","¿QUEEEEEÉ? ¿He gastado 10 pepitas en una pista que ya sabía?","","","DIA_Jesse_MisSuccess.DIA_Jesse_MisSuccess_Waaas","Info_AddChoice",""
"Scripts/content/Story/MISSIONS/DIA_Vlk_564_Jesse.d:181","Genau. Eine Hand wäscht die andere...","Sí. Hoy por ti, mañana por mí.","","","DIA_Jesse_MisSuccess.DIA_Jesse_MisSuccess_Ok","Info_AddChoice",""
"Scripts/content/Story/MISSIONS/DIA_Vlk_564_Jesse.d:186","WAAAS?! Ich hab' 10 Erz ausgegeben für einen Tipp, den ich sowieso schon kannte!?","¿CÓMO? ¿Me he gastado 10 pepitas en una pista que ya conocía?","","","DIA_Jesse_MisSuccess_Waaas_15_00","",""
"Scripts/content/Story/MISSIONS/DIA_Vlk_564_Jesse.d:187","Sieht so aus.","Parece que sí...","","","DIA_Jesse_MisSuccess_Waaas_03_01","",""
"Scripts/content/Story/MISSIONS/DIA_Vlk_564_Jesse.d:192","Genau. Eine Hand wäscht die andere ...","Sí. Favor por favor.","","","DIA_Jesse_MisSuccess_Ok_15_00","",""
"Scripts/content/Story/MISSIONS/DIA_Vlk_572_Gravo.d:33","Wie steht's denn so?","¿Qué tal te va?","","","DIA_Gravo_Hallo.description","",""
"Scripts/content/Story/MISSIONS/DIA_Vlk_572_Gravo.d:43","Wie steht's denn so?","¿Cómo te va?","","","DIA_Gravo_Hallo_15_00","",""
"Scripts/content/Story/MISSIONS/DIA_Vlk_572_Gravo.d:44","Seit ich aufgehört habe, in der Mine zu arbeiten, lässt sich's hier richtig gut leben.","Dado que he dejado de trabajar en la mina, no puedo quejarme.","","","DIA_Gravo_Hallo_04_01","",""
"Scripts/content/Story/MISSIONS/DIA_Vlk_572_Gravo.d:45","Und woher kriegst du dein Erz?","¿Y de dónde sacas tu mineral?","","","DIA_Gravo_Hallo_15_02","",""
"Scripts/content/Story/MISSIONS/DIA_Vlk_572_Gravo.d:46","Ich helfe Leuten, die Probleme haben.","Ayudo a los que tienen problemas.","","","DIA_Gravo_Hallo_04_03","",""
"Scripts/content/Story/MISSIONS/DIA_Vlk_572_Gravo.d:47","Wenn du hier Ärger mit einflussreichen Leuten hast, kann ich dafür sorgen, dass die Sache wieder ins Lot kommt.","Si te metes en líos con la gente influyente de por aquí, puedo ayudarte a solucionar el asunto.","","","DIA_Gravo_Hallo_04_04","",""
"Scripts/content/Story/MISSIONS/DIA_Vlk_572_Gravo.d:59","Wenn ich hier Ärger habe, kannst DU mir also helfen? Wie?","¿Que me ayudarías si me metiese en un lío? ¿Cómo?","","","DIA_Gravo_HelpHow.description","",""
"Scripts/content/Story/MISSIONS/DIA_Vlk_572_Gravo.d:72","Wenn ich hier Ärger habe, kannst DU mir also helfen? Wie?","Si yo estuviera en problemas, ¿tú me ayudarías? ¿Cómo?","","","DIA_Gravo_HelpHow_15_00","",""
"Scripts/content/Story/MISSIONS/DIA_Vlk_572_Gravo.d:73","Nun - sagen wir mal, du hast Ärger mit Thorus. Du solltest es besser nie dazu kommen lassen, aber man weiß ja nie, was passiert.","Bueno, supongamos que tú tienes problemas con Thorus. Será mejor que no te metas nunca en problemas con él, pero nunca se sabe.","","","DIA_Gravo_HelpHow_04_01","",""
"Scripts/content/Story/MISSIONS/DIA_Vlk_572_Gravo.d:74","Thorus kann ziemlich stur sein - wenn du's dir einmal mit ihm verscherzt hast, redet er nicht mehr mit dir. Das ist schlecht.","Thorus puede ser muy terco; una vez se cabrea con alguien, no vuelve a hablar con él. Y eso es malo.","","","DIA_Gravo_HelpHow_04_02","",""
"Scripts/content/Story/MISSIONS/DIA_Vlk_572_Gravo.d:75","Denn als Neuer bist du auf ihn angewiesen. Also kommst du zu mir. Ich kenne 'ne Menge Leute hier, die Einfluss auf Thorus haben.","Al ser un novato, dependes de él. Así que vienes a verme. Conozco a mucha gente a la que Thorus hace caso.","","","DIA_Gravo_HelpHow_04_03","",""
"Scripts/content/Story/MISSIONS/DIA_Vlk_572_Gravo.d:76","Die legen ein gutes Wort für dich ein und Thorus ist wieder auf deiner Seite. Natürlich wollen die Jungs dafür Erz sehen. Dein Erz.","Entonces yo intercedo por ti y Thorus vuelve a ser tu amigo. Claro está que los muchachos quieren algo de mineral a cambio de este tipo de favores. Tu mineral.","","","DIA_Gravo_HelpHow_04_04","",""
"Scripts/content/Story/MISSIONS/DIA_Vlk_572_Gravo.d:77","Und ICH kümmere mich darum, dass dein Erz die richtigen Leute erreicht ...","Y yo me encargo de que el mineral llegue hasta la gente apropiada.","","","DIA_Gravo_HelpHow_04_05","",""
"Scripts/content/Story/MISSIONS/DIA_Vlk_572_Gravo.d:91","Stimmt, er ist nicht besonders gut auf dich zu sprechen.","Exacto, estás en su lista negra.","","","B_Gravo_HelpAttitude_ANGRY_04_00","",""
"Scripts/content/Story/MISSIONS/DIA_Vlk_572_Gravo.d:92","Ich werd' zusehen, dass sich ein paar Leute mal mit ihm unterhalten. 100 Erz und ich erledige die Sache.","Haré que alguien hable con él. Dame 100 pepitas y me hago cargo del problema.","","","B_Gravo_HelpAttitude_ANGRY_04_01","",""
"Scripts/content/Story/MISSIONS/DIA_Vlk_572_Gravo.d:95","Lass sehen, wie viel du hast ... Ah! Das sollte reichen. Betrachte die Sache als erledigt.","Veamos cuanto tienes... ¡Ah! Con esto debería bastar. Puedes dar por resuelto el asunto.","","","B_Gravo_HelpAttitude_ANGRY_04_02","",""
"Scripts/content/Story/MISSIONS/DIA_Vlk_572_Gravo.d:96","Und sprich mit keinem darüber. Tu einfach so, als wär' nichts passiert.","Y no le hables a nadie acerca de ello. Compórtate como si no hubiera pasado nada.","","","B_Gravo_HelpAttitude_ANGRY_04_03","",""
"Scripts/content/Story/MISSIONS/DIA_Vlk_572_Gravo.d:102","So viel hab' ich nicht.","I don't have that much.","","","B_Gravo_HelpAttitude_NoOre_15_01","",""
"Scripts/content/Story/MISSIONS/DIA_Vlk_572_Gravo.d:103","Dann kann ich nichts für dich tun - tut mir Leid, Junge.","Entonces no puedo solucionar tu problema, joven.","","","B_Gravo_HelpAttitude_NoOre_04_02","",""
"Scripts/content/Story/MISSIONS/DIA_Vlk_572_Gravo.d:108","Ärger ist gar kein Ausdruck, Junge. Er würde dir am liebsten den Kopf abreißen.","¿Y a eso le llamas un problema? Te quedas muy muy corto. Me parece que le gustaría cortarte en pedacitos, muchacho.","","","B_Gravo_HelpAttitude_HOSTILE_04_00","",""
"Scripts/content/Story/MISSIONS/DIA_Vlk_572_Gravo.d:109","Wenn ich ein paar Jungs davon überzeugen soll, ihn wieder gut zu stimmen, wird das nicht billig. 500 Erz musst du schon hinlegen.","No saldrá barato convencer a algunas personas para que lo tranquilicen. Te costará por lo menos 500 pepitas.","","","B_Gravo_HelpAttitude_HOSTILE_04_01","",""
"Scripts/content/Story/MISSIONS/DIA_Vlk_572_Gravo.d:112","Lass sehen, wie viel du hast ... Du scheinst ein reicher Bursche zu sein. Ich nehme die 500 und kümmere mich drum.","Veamos lo que tienes aquí... Parece que eres un ricachón. Me llevaré 500 pepitas y solucionaré el problema.","","","B_Gravo_HelpAttitude_HOSTILE_04_02","",""
"Scripts/content/Story/MISSIONS/DIA_Vlk_572_Gravo.d:113","Und noch was: Er darf nie erfahren, dass ICH die Sache für dich geregelt habe - also rede mit KEINEM darüber!","Y recuerda que nunca ha de saberse que yo me ocupé del problema, así que no le hables de ello a nadie. ¿Entendido?","","","B_Gravo_HelpAttitude_HOSTILE_04_03","",""
"Scripts/content/Story/MISSIONS/DIA_Vlk_572_Gravo.d:125","Soweit ich weiß, hat er kein Problem mit dir - mach dir keine Sorgen.","Por lo que yo sé, no tiene ningún problema contigo, así que tranquilo.","","","B_Gravo_HelpAttitude_NoProb_04_00","",""
"Scripts/content/Story/MISSIONS/DIA_Vlk_572_Gravo.d:137","Kannst du mir helfen - ich glaub, ich hab' Ärger.","Puedes ayudarme. Creo que estoy metido en un lío.","","","DIA_Gravo_HelpAngryNow.description","",""
"Scripts/content/Story/MISSIONS/DIA_Vlk_572_Gravo.d:150","Kannst du mir helfen - ich glaub, ich hab' Ärger.","¿Podrías ayudarme? Creo que tengo un problema.","","","DIA_Gravo_HelpAngryNow_15_00","",""
"Scripts/content/Story/MISSIONS/DIA_Vlk_572_Gravo.d:151","Ich denke schon, aber ich warne dich, die Sache kann dich zwischen 100 und 500 Erz kosten.","Creo que sí, pero mi ayuda podría costarte entre 100 y 500 pepitas.","","","DIA_Gravo_HelpAngryNow_04_01","",""
"Scripts/content/Story/MISSIONS/DIA_Vlk_572_Gravo.d:155","Mit Diego.","Ayúdame con Diego.","","","DIA_Gravo_HelpAngryNow.DIA_Gravo_HelpAngryNow_Diego","Info_AddChoice",""
"Scripts/content/Story/MISSIONS/DIA_Vlk_572_Gravo.d:156","Mit Thorus","Ayúdame con Thorus.","","","DIA_Gravo_HelpAngryNow.DIA_Gravo_HelpAngryNow_Thorus","Info_AddChoice",""
"Scripts/content/Story/MISSIONS/DIA_Vlk_572_Gravo.d:157","Mit Gomez","Ayúdame con Gómez.","","","DIA_Gravo_HelpAngryNow.DIA_Gravo_HelpAngryNow_Gomez","Info_AddChoice",""
"Scripts/content/Story/MISSIONS/DIA_Vlk_572_Gravo.d:167","Mit Diego.","Ayúdame con Diego.","","","DIA_Gravo_HelpAngryNow_Diego_15_00","",""
"Scripts/content/Story/MISSIONS/DIA_Vlk_572_Gravo.d:176","Mit Thorus.","Ayúdame con Thorus.","","","DIA_Gravo_HelpAngryNow_Thorus_15_00","",""
"Scripts/content/Story/MISSIONS/DIA_Vlk_572_Gravo.d:185","Mit Gomez.","Ayúdame con Gómez.","","","DIA_Gravo_HelpAngryNow_Gomez_15_00","",""
"Scripts/content/Story/MISSIONS/DIA_Vlk_572_Gravo.d:202","Kannst du mir sagen, wer hier zu den einflussreichen Leuten gehört?","¿Podrías decirme quiénes son las personas influyentes por aquí?","","","DIA_Gravo_Influence.description","",""
"Scripts/content/Story/MISSIONS/DIA_Vlk_572_Gravo.d:215","Kannst du mir sagen, wer von den Schatten hier zu den einflussreichen Leuten gehört?","¿Puedes decirme qué miembros de las Sombras son gente influyente por aquí?","","","DIA_Gravo_Influence_15_00","",""
"Scripts/content/Story/MISSIONS/DIA_Vlk_572_Gravo.d:216","Du willst die richtigen Leute beeindrucken, he?","Quieres impresionar a la gente apropiada, ¿verdad?","","","DIA_Gravo_Influence_04_01","",""
"Scripts/content/Story/MISSIONS/DIA_Vlk_572_Gravo.d:217","Diego hat von allen Schatten am meisten zu melden. Zu seinen Vertrauten zählen Fingers, Whistler und Sly.","Diego es el más poderoso entre las Sombras y confía en Fingers, Whistler y Sly.","","","DIA_Gravo_Influence_04_02","",""
"Scripts/content/Story/MISSIONS/DIA_Vlk_572_Gravo.d:218","Dexter und Fisk verscherbeln ihre Sachen auf dem Marktplatz. Sie haben viele Kunden, selbst unter den Gardisten und sind dementsprechend einflussreich.","Dexter y Fisk venden sus mercancías en el mercado. Tienen muchos clientes, incluso entre los guardias, y eso les hace ser muy influyentes.","","","DIA_Gravo_Influence_04_03","",""
"Scripts/content/Story/MISSIONS/DIA_Vlk_572_Gravo.d:219","Und dann wäre da noch Scatty, er leitet die Arena, bestimmt wer kämpft und so. Es gibt viele hier, die ihm noch Erz schulden - auch an ihn kannst du dich halten.","Y luego está Scatty. Está al mando de la arena y decide quién combate y todo eso. Mucha gente le debe mineral; él también es importante.","","","DIA_Gravo_Influence_04_04","",""
"Scripts/content/Story/MISSIONS/DIA_Vlk_573_Graham.d:33","Hi! Ich bin neu hier.","¡Hola! ¡Soy nuevo aquí!","","","DIA_Graham_Hello.description","",""
"Scripts/content/Story/MISSIONS/DIA_Vlk_573_Graham.d:43","Hi! Ich bin neu hier.","¡Hola! Soy nuevo aquí.","","","DIA_Graham_Hello_15_00","",""
"Scripts/content/Story/MISSIONS/DIA_Vlk_573_Graham.d:44","Ich bin Graham. Ich zeichne Karten. Dich hab' ich hier noch nie gesehen ... Was willst du?","Yo soy Graham. Hago mapas. Nunca te había visto por aquí... ¿Qué quieres?","","","DIA_Graham_Hello_02_01","",""
"Scripts/content/Story/MISSIONS/DIA_Vlk_573_Graham.d:62","Diego schickt mich. Er sagt, du sollst mir ne Karte geben.","Me manda Diego. Dice que me des un mapa de la Vieja Mina.","","","DIA_Graham_SellMap.description","",""
"Scripts/content/Story/MISSIONS/DIA_Vlk_573_Graham.d:75","Diego schickt mich. Er sagt, du sollst mir 'ne Karte geben, auf der der Weg zur Alten Mine verzeichnet ist.","Vengo de parte de Diego. Te pide que me des un mapa con el camino hasta la Vieja Mina.","","","DIA_Graham_SellMap_15_00","",""
"Scripts/content/Story/MISSIONS/DIA_Vlk_573_Graham.d:76","Kein Problem. Für dich nur 20 Erz.","No hay problema. Para ti serán 20 pepitas.","","","DIA_Graham_SellMap_02_01","",""
"Scripts/content/Story/MISSIONS/DIA_Vlk_573_Graham.d:78","Ich komme wieder.","Lo devolveré.","","","DIA_Graham_SellMap.DIA_Graham_SellMap_BACK","Info_AddChoice",""
"Scripts/content/Story/MISSIONS/DIA_Vlk_573_Graham.d:79","Gut - ich werde die Karte bezahlen. Hier, nimm das Erz.","Pagaré por el mapa. Ten, quédate con el mineral.","","","DIA_Graham_SellMap.DIA_Graham_SellMap_Pay","Info_AddChoice",""
"Scripts/content/Story/MISSIONS/DIA_Vlk_573_Graham.d:80","Rück die Karte raus, oder ich polier dir die Fresse!","¡Dame el mapa o te lo quitaré!","","","DIA_Graham_SellMap.DIA_Graham_SellMap_AufsMaul","Info_AddChoice",""
"Scripts/content/Story/MISSIONS/DIA_Vlk_573_Graham.d:81","Moment, Diego sagte, du sollst mir die Karte GEBEN, nicht verkaufen.","¡Espera, Diego dijo que me DIERAS el mapa, no que me lo VENDIERAS!","","","DIA_Graham_SellMap.DIA_Graham_SellMap_GiveNotSell","Info_AddChoice",""
"Scripts/content/Story/MISSIONS/DIA_Vlk_573_Graham.d:86","Ich komme wieder.","Volveré.","","","DIA_Graham_SellMap_BACK_15_00","",""
"Scripts/content/Story/MISSIONS/DIA_Vlk_573_Graham.d:92","Ich werde die Karte bezahlen. Hier, nimm das Erz.","Te pago por el mapa. Aquí tienes el mineral.","","","DIA_Graham_SellMap_Pay_15_00","",""
"Scripts/content/Story/MISSIONS/DIA_Vlk_573_Graham.d:95","Gut. So billig kommst du nie wieder an so eine Karte - glaub mir.","Bien. No encontrarás un mapa mejor y más barato que éste; puedes creerme.","","","DIA_Graham_SellMap_Pay_02_01","",""
"Scripts/content/Story/MISSIONS/DIA_Vlk_573_Graham.d:103","Beschaff dir erst mal ein bisschen Erz. Geh Tiere jagen oder Pilze sammeln - du kannst den Krempel dann hier im Lager zu Erz machen.","Primero vete a conseguir algo de mineral. Caza animales o recoge setas; luego podrás venderlo aquí, en el Campamento.","","","DIA_Graham_SellMap_Pay_NoOre_02_00","",""
"Scripts/content/Story/MISSIONS/DIA_Vlk_573_Graham.d:109","Rück die Karte raus, oder ich polier dir die Fresse!","¡Dame el mapa o me lo llevo a las malas!","","","DIA_Graham_SellMap_AufsMaul_15_00","",""
"Scripts/content/Story/MISSIONS/DIA_Vlk_573_Graham.d:110","Mach bloß keinen Mist, Mann. Ich will keinen Ärger. Hier, nimm die verdammte Karte und jetzt lass mich in Ruhe!","Eh, tranquilo, hombre. No quiero problemas. ¡Aquí tienes el mapa, llévatelo y déjame en paz!","","","DIA_Graham_SellMap_AufsMaul_02_01","",""
"Scripts/content/Story/MISSIONS/DIA_Vlk_573_Graham.d:120","Moment mal, Diego sagte, du sollst mir die Karte GEBEN, nicht verkaufen.","Un momento; Diego dijo que me dieras el mapa, no que me lo vendieras.","","","DIA_Graham_SellMap_GiveNotSell_15_00","",""
"Scripts/content/Story/MISSIONS/DIA_Vlk_573_Graham.d:121","Das interessiert mich aber nicht! Hast du eine Ahnung, wie viel Arbeit es macht, so eine Karte anzufertigen?","¡Pero no me interesa! ¿Sabes lo difícil que es hacer un mapa como éste?","","","DIA_Graham_SellMap_GiveNotSell_02_01","",""
