"location","source","target","id","fuzzy","context","translator_comments","developer_comments"
"Scripts/content/Story/MISSIONS/DIA_Vlk_581_Snaf.d:33","Wie steht's?","¿Qué tal?","","","DIA_Snaf_Hello.description","",""
"Scripts/content/Story/MISSIONS/DIA_Vlk_581_Snaf.d:43","Wie steht's?","¿Cómo van las cosas?","","","DIA_Snaf_Hello_15_00","",""
"Scripts/content/Story/MISSIONS/DIA_Vlk_581_Snaf.d:44","Nicht schlecht. Wenn man gut kochen kann, hat man viele Freunde hier.","No van mal. Si sabes cocinar bien, tendrás muchos amigos por aquí.","","","DIA_Snaf_Hello_01_01","",""
"Scripts/content/Story/MISSIONS/DIA_Vlk_581_Snaf.d:45","Willst du etwas von meinem Reiseintopf? Hier, nimm und lass es dir schmecken.","¿Quieres probar mi guiso de arroz?","","","DIA_Snaf_Hello_01_02","",""
"Scripts/content/Story/MISSIONS/DIA_Vlk_581_Snaf.d:46","Danke.","Gracias.","","","DIA_Snaf_Hello_15_03","",""
"Scripts/content/Story/MISSIONS/DIA_Vlk_581_Snaf.d:47","Du könntest mir einen Gefallen tun.","Podrías hacerme un favor.","","","DIA_Snaf_Hello_01_04","",""
"Scripts/content/Story/MISSIONS/DIA_Vlk_581_Snaf.d:65","Was kann ich für dich tun?","¿Qué puedo hacer por ti?","","","DIA_Snaf_Zutaten.description","",""
"Scripts/content/Story/MISSIONS/DIA_Vlk_581_Snaf.d:78","Was kann ich für dich tun?","¿Qué puedo hacer por ti?","","","DIA_Snaf_Zutaten_15_00","",""
"Scripts/content/Story/MISSIONS/DIA_Vlk_581_Snaf.d:79","Du bist sicher gutes Essen gewöhnt. Ich hab' da ein neues Rezept: Fleischwanzen-Ragout ŕ la Snaf, mit Reis und Pilzen.","Debes estar acostumbrado a la buena cocina. Tengo una nueva receta; estofado de sabandija de carne a la Snaf con setas y arroz.","","","DIA_Snaf_Zutaten_01_01","",""
"Scripts/content/Story/MISSIONS/DIA_Vlk_581_Snaf.d:80","Du kannst haben, so viel du willst, aber ich brauche aber noch 3 Fleischwanzen und einige Höllenpilze - 5 müssten reichen.","Puedes tomar todo lo que quieras, pero todavía me hacen falta 3 sabandijas y algunas setas del infierno; con 5 debería bastar.","","","DIA_Snaf_Zutaten_01_02","",""
"Scripts/content/Story/MISSIONS/DIA_Vlk_581_Snaf.d:83","Willst du, dass ich kotze?","¿Quieres que vomite?","","","DIA_Snaf_Zutaten.DIA_Snaf_Zutaten_KOTZ","Info_AddChoice",""
"Scripts/content/Story/MISSIONS/DIA_Vlk_581_Snaf.d:84","Hört sich gut an.","Tiene buena pinta.","","","DIA_Snaf_Zutaten.DIA_Snaf_Zutaten_DoIt","Info_AddChoice",""
"Scripts/content/Story/MISSIONS/DIA_Vlk_581_Snaf.d:89","Willst du, dass ich kotze?","¿Quieres hacerme vomitar?","","","DIA_Snaf_Zutaten_KOTZ_15_00","",""
"Scripts/content/Story/MISSIONS/DIA_Vlk_581_Snaf.d:90","Du musst es ja nicht essen, aber zumindest probieren solltest du es! Falls du an die Sachen rankommst, denk an mich.","¡No tienes que comértelo, pero podrías intentarlo! Si por casualidad consiguieras esas cosas, acuérdate de mí.","","","DIA_Snaf_Zutaten_KOTZ_01_01","",""
"Scripts/content/Story/MISSIONS/DIA_Vlk_581_Snaf.d:91","Ich hab' schon jemanden geschickt, aber der kommt einfach nicht wieder - ist bestimmt zum Neuen Lager übergelaufen.","Ya he enviado a alguien, pero todavía no ha vuelto; debe haber desertado al Campamento Nuevo.","","","DIA_Snaf_Zutaten_KOTZ_01_02","",""
"Scripts/content/Story/MISSIONS/DIA_Vlk_581_Snaf.d:103","Hört sich gut an.","Suena bien.","","","DIA_Snaf_Zutaten_DoIt_15_00","",""
"Scripts/content/Story/MISSIONS/DIA_Vlk_581_Snaf.d:104","Dann sieh mal zu, dass du die Sachen besorgst.","Entonces ve y asegúrate de conseguirme esas cosas.","","","DIA_Snaf_Zutaten_DoIt_01_01","",""
"Scripts/content/Story/MISSIONS/DIA_Vlk_581_Snaf.d:105","Der Letzte, den ich losgeschickt hab, kommt einfach nicht wieder - ist bestimmt zum Neuen Lager übergelaufen.","El último al que envié todavía no ha vuelto; debe haber desertado al Campamento Nuevo.","","","DIA_Snaf_Zutaten_DoIt_01_02","",""
"Scripts/content/Story/MISSIONS/DIA_Vlk_581_Snaf.d:125","Ich hab' die Sachen, die du von mir wolltest!","¡Tengo las cosas que querías!","","","DIA_Snaf_ZutatenSuccess.description","",""
"Scripts/content/Story/MISSIONS/DIA_Vlk_581_Snaf.d:138","Ich hab' die Sachen, die du von mir wolltest!","¡Tengo las cosas que querías que te consiguiera!","","","DIA_Snaf_ZutatenSuccess_15_00","",""
"Scripts/content/Story/MISSIONS/DIA_Vlk_581_Snaf.d:139","Gut, ich brauch sie nur noch dazuzugeben, dann ist der Eintopf fertig ... warte ...","Excelente. No tengo más que añadirlas y el guiso estará listo... Espera...","","","DIA_Snaf_ZutatenSuccess_01_01","",""
"Scripts/content/Story/MISSIONS/DIA_Vlk_581_Snaf.d:177","Du hast gesagt, ich kann soviel von dem Eintopf haben, wie ich will...","Me dijiste que podía comer todo el estofado que quisiese...","","","DIA_Snaf_AfterSuccess.description","",""
"Scripts/content/Story/MISSIONS/DIA_Vlk_581_Snaf.d:190","Du hast gesagt, ich kann so viel von den Eintopf haben, wie ich will ...","Me dijiste que podría tomar todo el que quisiera...","","","DIA_Snaf_AfterSuccess_15_00","",""
"Scripts/content/Story/MISSIONS/DIA_Vlk_581_Snaf.d:194","Und das stimmt auch. Hier, nimm 3 Portionen!","Y es verdad. Aquí tienes 3 raciones.","","","DIA_Snaf_AfterSuccess_01_01","",""
"Scripts/content/Story/MISSIONS/DIA_Vlk_581_Snaf.d:201","Klar! Heute ist aber alles schon auf. Komm morgen wieder!","¡Claro! Pero hoy no queda nada. ¡Vuelve mañana!","","","DIA_Snaf_AfterSuccess_01_02","",""
"Scripts/content/Story/MISSIONS/DIA_Vlk_581_Snaf.d:214","Wo finde ich Fleischwanzen?","¿Dónde puedo encontrar sabandijas de carne?","","","DIA_Snaf_WhereMeatbugs.description","",""
"Scripts/content/Story/MISSIONS/DIA_Vlk_581_Snaf.d:227","Wo finde ich Fleischwanzen?","¿Dónde puedo encontrar sabandijas de carne?","","","DIA_Snaf_WhereMeatbugs_15_00","",""
"Scripts/content/Story/MISSIONS/DIA_Vlk_581_Snaf.d:228","Überall da, wo Müll rumliegt. An der Burgmauer gibt es einige verlassene Hütten, da solltest du welche finden.","En cualquier parte en la que haya basura. Deberías encontrar alguna en las cabañas deshabitadas que hay cerca de la muralla de la ciudad.","","","DIA_Snaf_WhereMeatbugs_01_01","",""
"Scripts/content/Story/MISSIONS/DIA_Vlk_581_Snaf.d:229","Lass dich von ihrem fiesen Aussehen nicht täuschen. Gekocht sind sie lecker.","Que no te confunda su aspecto repelente. Una vez guisadas son muy sabrosas.","","","DIA_Snaf_WhereMeatbugs_01_02","",""
"Scripts/content/Story/MISSIONS/DIA_Vlk_581_Snaf.d:243","Wo finde ich Höllenpilze?","¿Dónde puedo encontrar setas del infierno?","","","DIA_Snaf_WhereMushrooms.description","",""
"Scripts/content/Story/MISSIONS/DIA_Vlk_581_Snaf.d:256","Wo finde ich Höllenpilze?","¿Dónde puedo encontrar setas del infierno?","","","DIA_Snaf_WhereMushrooms_15_00","",""
"Scripts/content/Story/MISSIONS/DIA_Vlk_581_Snaf.d:257","Wenn du aus dem Südtor rausgehst - das ist der umgestürzte Turm - findest du direkt vor dir eine Ebene, auf der Pilze wachsen.","Si sales por la puerta sur, es decir, la torre en ruinas, verás una pradera justo delante de ti. Allí crecen setas.","","","DIA_Snaf_WhereMushrooms_01_01","",""
"Scripts/content/Story/MISSIONS/DIA_Vlk_581_Snaf.d:271","Wer war der Typ, den du vor mir losgeschickt hast?","¿Quién era el tipo que me mandaste?","","","DIA_Snaf_WhereNek.description","",""
"Scripts/content/Story/MISSIONS/DIA_Vlk_581_Snaf.d:284","Wer war der Typ, den du vor mir losgeschickt hast?","¿A quién enviaste antes de mí?","","","DIA_Snaf_WhereNek_15_00","",""
"Scripts/content/Story/MISSIONS/DIA_Vlk_581_Snaf.d:285","Sein Name war Nek. Er war ziemlich unzufrieden hier - ich denke, er ist jetzt im Neuen Lager.","Se llamaba Nek. No estaba nada contento aquí; creo que ahora se encuentra en el Campamento Nuevo.","","","DIA_Snaf_WhereNek_01_01","",""
"Scripts/content/Story/MISSIONS/DIA_Vlk_581_Snaf.d:286","Hab ihn Pilze suchen geschickt - aber er kam nicht wieder ...","Le envié a recoger setas, pero no volvió.","","","DIA_Snaf_WhereNek_01_02","",""
"Scripts/content/Story/MISSIONS/DIA_Vlk_582_Melvin.d:33","Hi! Du bist nicht aus diesem Lager, oder?","¡Hola! No eres de este campamento, ¿verdad?","","","DIA_Melvin_Hello.description","",""
"Scripts/content/Story/MISSIONS/DIA_Vlk_582_Melvin.d:43","Hi! Du bist nicht aus diesem Lager, oder?","¡Hola! Tú no eres de este campamento, ¿verdad?","","","DIA_Melvin_Hello_15_00","",""
"Scripts/content/Story/MISSIONS/DIA_Vlk_582_Melvin.d:44","Jetzt schon! Ich bin vor 'ner Woche aus dem Alten Lager abgehauen. Hab' meinem Kumpel Dusty gesagt, er soll mitkommen, aber er wollte lieber noch warten.","¡Bueno, ahora sí lo soy! Abandoné el Campamento Viejo hace una semana. Le dije a mi amigo Dusty que viniera conmigo, pero prefirió esperar.","","","DIA_Melvin_Hello_03_01","",""
"Scripts/content/Story/MISSIONS/DIA_Vlk_582_Melvin.d:60","Ich kenne Dusty - hab' mich kurz mit ihm unterhalten.","Conozco a Dusty. Hablé con él un rato.","","","DIA_Melvin_MetDusty.description","",""
"Scripts/content/Story/MISSIONS/DIA_Vlk_582_Melvin.d:73","Ich kenne Dusty - hab' mich kurz mit ihm unterhalten.","Conozco a Dusty; hablé con él un rato.","","","DIA_Melvin_MetDusty_15_00","",""
"Scripts/content/Story/MISSIONS/DIA_Vlk_582_Melvin.d:74","Wenn du ihn noch mal triffst, sag ihm, er ist schön blöd, dass er dageblieben ist. Wenn das hier nicht zehnmal besser ist, als sich im Alten Lager von den Gardisten schikanieren zu lassen, dann weiß ich's auch nicht mehr.","Si vuelves a verle, dile que fue una tontería quedarse ahí. Esto es diez veces mejor que sufrir los abusos de los guardias del Campamento Viejo.","","","DIA_Melvin_MetDusty_03_01","",""
"Scripts/content/Story/MISSIONS/DIA_Vlk_582_Melvin.d:75","Werd's ihm ausrichten, wenn ich ihn noch mal sehe.","Se lo diré si vuelvo a verle.","","","DIA_Melvin_MetDusty_15_02","",""
"Scripts/content/Story/MISSIONS/DIA_Vlk_583_Glen.d:30","Worauf sollte ich in der Mine achten?","¿Qué debo tener presente cuando esté en la mina?","","","VLK_583_Glen_INFO.description","",""
"Scripts/content/Story/MISSIONS/DIA_Vlk_583_Glen.d:40","Worauf sollte ich in der Mine achten?","¿Qué debería tener presente cuando esté en la mina?","","","VLK_583_Glen_INFO_Info_15_01","",""
"Scripts/content/Story/MISSIONS/DIA_Vlk_583_Glen.d:41","Auf die Minecrawler.","Ten cuidado con los reptadores.","","","VLK_583_Glen_INFO_Info_02_02","",""
"Scripts/content/Story/MISSIONS/DIA_Vlk_583_Glen.d:42","Je weiter du nach unten kommst, desto näher bist den Viechern. Die Mistdinger kommen direkt aus Beliars Reich!","Cuanto más abajo llegues, más cerca estarás de las bestias. ¡Esas repugnantes criaturas vienen derechitas del reino de Beliar!","","","VLK_583_Glen_INFO_Info_02_03","",""
"Scripts/content/Story/MISSIONS/DIA_Vlk_583_Glen.d:43","Man kann sie schaben und kratzen hören. Sie lauern in der Dunkelheit und warten nur auf dich. Ich habe gesehen, wie sie getötet haben.","Se las puede oír raspar y rascar. Se quedan sentadas en la oscuridad, esperándote. Las he visto matar...","","","VLK_583_Glen_INFO_Info_02_04","",""
"Scripts/content/Story/MISSIONS/DIA_Vlk_583_Glen.d:44","Gnadenlos und schnell. Wenn du am Leben hängst, solltest du dich nicht hier unten aufhalten. Geh lieber, bevor dir noch was passiert.","Son despiadadas y veloces. Si te gusta la vida, no deberías estar aquí abajo. Será mejor que te marches antes de que te ocurra algo.","","","VLK_583_Glen_INFO_Info_02_05","",""
"Scripts/content/Story/MISSIONS/DIA_Vlk_583_Glen.d:54","Bei dir gibts Dietriche?","Tengo entendido que aquí puedo comprar ganzúas.","","","VLK_583_Glen_LOCKPICK.description","",""
"Scripts/content/Story/MISSIONS/DIA_Vlk_583_Glen.d:67","Ich hab' gehört, bei dir kann ich Dietriche kaufen.","Me dijeron que aquí abajo podría conseguir ganzúas.","","","VLK_583_Glen_LOCKPICK_15_01","",""
"Scripts/content/Story/MISSIONS/DIA_Vlk_583_Glen.d:68","Nun, wenn du schlau genug warst, das herauszufinden, dann kannst du welche haben. 10 Erz das Stück.","Bueno, dado que fuiste lo bastante listo como para averiguar eso, puedo venderte alguna. 10 pepitas cada una.","","","VLK_583_Glen_LOCKPICK_02_02","",""
"Scripts/content/Story/MISSIONS/DIA_Vlk_583_Glen.d:80","(Dietriche kaufen)","(Comprar ganzúas)","","","VLK_583_Glen_BUY.description","",""
"Scripts/content/Story/MISSIONS/DIA_Vlk_583_Glen.d:93","Ich will Dietriche kaufen.","Quiero comprar unas ganzúas.","","","VLK_583_Glen_BUY_Info_15_01","",""
"Scripts/content/Story/MISSIONS/DIA_Vlk_584_Snipes.d:19","Wir sehen uns.","Luego te veo.","","","Info_Exit_Info_15_001","",""
"Scripts/content/Story/MISSIONS/DIA_Vlk_584_Snipes.d:20","Na, aber sicher doch!","¡Vale, claro!","","","Info_Exit_Info_07_02","",""
"Scripts/content/Story/MISSIONS/DIA_Vlk_584_Snipes.d:32","Wie siehts aus?","¿Qué tal?","","","VLK_584_Snipes_DEAL.description","",""
"Scripts/content/Story/MISSIONS/DIA_Vlk_584_Snipes.d:42","Wie sieht's aus?","¿Cómo van las cosas?","","","VLK_584_Snipes_DEAL_Info_15_01","",""
"Scripts/content/Story/MISSIONS/DIA_Vlk_584_Snipes.d:43","Ich schlage dir ein Geschäft vor.","Tengo una proposición que hacerte.","","","VLK_584_Snipes_DEAL_Info_07_02","",""
"Scripts/content/Story/MISSIONS/DIA_Vlk_584_Snipes.d:44","Wenn du Aaron dazu kriegst, dass er von der Truhe abhaut, dann gebe ich dir 10 Erz!","¡Te daré 10 pepitas si consigues que Aaron deje en paz el cofre!","","","VLK_584_Snipes_DEAL_Info_07_03","",""
"Scripts/content/Story/MISSIONS/DIA_Vlk_584_Snipes.d:59","Du schuldest mir 10 Erz","¡Me debes 10 pepitas!","","","VLK_584_Snipes_DEAL_RUN.description","",""
"Scripts/content/Story/MISSIONS/DIA_Vlk_584_Snipes.d:72","Du schuldest mir 10 Erz","¡Me debes 10 pepitas!","","","VLK_584_Snipes_DEAL_RUN_Info_15_01","",""
"Scripts/content/Story/MISSIONS/DIA_Vlk_584_Snipes.d:73","Hier, die 10 Erz hast du dir verdient.","Toma, te has ganado las 10.","","","VLK_584_Snipes_DEAL_RUN_Info_07_02","",""
"Scripts/content/Story/MISSIONS/DIA_Vlk_584_Snipes.d:74","Ach noch was, den Schlüssel für seine Truhe hab' ich auch. Für dich nur 30 Erz!","Oh, una cosa más: también tengo la llave de su cofre. ¡Te las dejo en nada más que 30 pepitas!","","","VLK_584_Snipes_DEAL_RUN_Info_07_03","",""
"Scripts/content/Story/MISSIONS/DIA_Vlk_584_Snipes.d:92","(Schlüssel kaufen)","(Comprar llave)","","","VLK_584_Snipes_DEAL_2.description","",""
"Scripts/content/Story/MISSIONS/DIA_Vlk_584_Snipes.d:108","Gib mir den Schlüssel.","Dame la llave.","","","VLK_584_Snipes_DEAL_2_Info_15_01","",""
"Scripts/content/Story/MISSIONS/DIA_Vlk_584_Snipes.d:109","Du hast ein gutes Geschäft gemacht!","Has hecho una buena adquisición.","","","VLK_584_Snipes_DEAL_2_Info_07_02","",""
"Scripts/content/Story/MISSIONS/DIA_Vlk_584_Snipes.d:110","Ich frage mich, was dein Gewinn an der Sache ist.","Me pregunto qué sacas tú de ello.","","","VLK_584_Snipes_DEAL_2_Info_15_03","",""
"Scripts/content/Story/MISSIONS/DIA_Vlk_584_Snipes.d:111","Ich freue mich immer, wenn ich den Gardisten eins auswischen kann. Und wenn die den Inhalt der Truhe bei mir finden, bin ich dran!","Siempre me alegra meterles una por alto a los guardias. Y si hubieran encontrado los contenidos del cofre en mi posesión, sería hombre muerto.","","","VLK_584_Snipes_DEAL_2_Info_07_04","",""
"Scripts/content/Story/MISSIONS/DIA_Vlk_584_Snipes.d:121","Ich sagte 30 Erz! Gib mir das Erz und ich gebe dir den Schlüssel!","¡Dije 30 pepitas! ¡Dame las pepitas y yo te daré la llave!","","","VLK_584_Snipes_DEAL_2_Info_07_05","",""
"Scripts/content/Story/MISSIONS/DIA_Vlk_585_Aleph.d:21","Viel Glück noch.","¡Buena suerte!","","","VLK_585_Aleph_Exit_Info_15_01","",""
"Scripts/content/Story/MISSIONS/DIA_Vlk_585_Aleph.d:22","Du weißt ja, wo du mich findest.","Bueno, ya sabes dónde encontrarme.","","","VLK_585_Aleph_Exit_Info_05_02","",""
"Scripts/content/Story/MISSIONS/DIA_Vlk_585_Aleph.d:44","Hehehe, die Wachen erwischen mich nie!","¡Jejejeje; los guardias no me pillarán nunca!","","","VLK_585_Aleph_CLEVER_Info_05_01","",""
"Scripts/content/Story/MISSIONS/DIA_Vlk_585_Aleph.d:54","Wie meinst du das?","¿Qué quieres decir?","","","VLK_585_Aleph_GUARDS.description","",""
"Scripts/content/Story/MISSIONS/DIA_Vlk_585_Aleph.d:67","Wie meinst du das?","¿Qué quieres decir?","","","VLK_585_Aleph_GUARDS_Info_15_01","",""
"Scripts/content/Story/MISSIONS/DIA_Vlk_585_Aleph.d:68","Ich arbeite nur, wenn Wachen in der Nähe sind oder mich sehen können. Ansonsten häng' ich hier meine Zeit ab.","Sólo trabajo cuando los guardias están cerca o pueden verme. Si no, me limito a perder el tiempo.","","","VLK_585_Aleph_GUARDS_Info_05_02","",""
"Scripts/content/Story/MISSIONS/DIA_Vlk_585_Aleph.d:69","Werden sie nicht misstrauisch?","¿Y no sospechan nada?","","","VLK_585_Aleph_GUARDS_Info_15_03","",""
"Scripts/content/Story/MISSIONS/DIA_Vlk_585_Aleph.d:70","Nun ja, ich schürfe natürlich weniger Erz als alle anderen. Es reicht natürlich nicht immer, da muss ich halt mal ein bisschen geschickt tauschen.","Bueno, claro que extraigo menos mineral que los otros. No siempre es suficiente, así que tengo que hacer algún trapicheo.","","","VLK_585_Aleph_GUARDS_Info_05_04","",""
"Scripts/content/Story/MISSIONS/DIA_Vlk_585_Aleph.d:71","Ich halt immer meine Ohren offen und bekomme viele nützliche Dinge mit. Du hast nicht zufällig etwas Erz bei dir? So ungefähr 10 Erz?","Suelo mantener los ojos abiertos, así que me entero de cosas de interés. ¿No llevarás algo de mineral encima, por casualidad? ¿Digamos que unas 10 pepitas?","","","VLK_585_Aleph_GUARDS_Info_05_05","",""
"Scripts/content/Story/MISSIONS/DIA_Vlk_585_Aleph.d:88","(10 Erz geben)","(Entregar 10 pepitas)","","","VLK_585_Aleph_INFO.description","",""
"Scripts/content/Story/MISSIONS/DIA_Vlk_585_Aleph.d:101","In Ordnung, hier sind 10 Erz für dich.","De acuerdo, aquí tienes 10 pepitas.","","","VLK_585_Aleph_INFO_Info_15_01","",""
"Scripts/content/Story/MISSIONS/DIA_Vlk_585_Aleph.d:102","Danke. Wenn du zurück zum Hauptschacht gehst und den Stegen weiter nach unten folgst, kommst du bald an zwei Nebenhöhlen.","Gracias. Si vas al pozo principal y bajas por las pasarelas, enseguida llegarás a dos cuevas laterales.","","","VLK_585_Aleph_INFO_Info_05_02","",""
"Scripts/content/Story/MISSIONS/DIA_Vlk_585_Aleph.d:103","In der zweiten Höhle steht eine Wache. Da steht auch ein alter Stampfer.","En la segunda hay un guardia y también una trituradora vieja.","","","VLK_585_Aleph_INFO_Info_05_03","",""
"Scripts/content/Story/MISSIONS/DIA_Vlk_585_Aleph.d:104","Dort liegt noch irgendwo ein Heiltrank, aber sei vorsichtig und nimm dich vor den Crawlern in Acht!","Por ahí debe haber una poción de curación, ¡pero ten cuidado y mantente alerta por si los reptadores!","","","VLK_585_Aleph_INFO_Info_05_04","",""
"Scripts/content/Story/MISSIONS/DIA_Vlk_585_Aleph.d:105","Und wenn du mal wieder was brauchst oder hörst, dann komm ruhig zu mir, ich kann dir bestimmt weiterhelfen ...","Y si necesitas u oyes algo, vuelve a verme; seguro que podré serte de ayuda.","","","VLK_585_Aleph_INFO_Info_05_05","",""
"Scripts/content/Story/MISSIONS/DIA_Vlk_585_Aleph.d:129","Du hast mich bei Brandick angeschwärzt? Mach, dass du wegkommst!","¿Que me has puesto a parir delante de Brandick? ¡Vete por ahí!","","","VLK_585_Aleph_ANGRY_Info_05_01","",""
"Scripts/content/Story/MISSIONS/DIA_Vlk_585_Aleph.d:142","Hast du noch ein paar nützliche Informationen?","¿Tienes más información útil?","","","VLK_585_Aleph_KEY.description","",""
"Scripts/content/Story/MISSIONS/DIA_Vlk_585_Aleph.d:155","Hast du noch ein paar nützliche Informationen?","¿Tienes alguna otra información útil?","","","VLK_585_Aleph_KEY_Info_15_01","",""
"Scripts/content/Story/MISSIONS/DIA_Vlk_585_Aleph.d:156","Na klar, hast du noch 10 Erz?","Claro, ¿tienes 10 pepitas?","","","VLK_585_Aleph_KEY_Info_05_02","",""
"Scripts/content/Story/MISSIONS/DIA_Vlk_585_Aleph.d:166","(10 Erz geben)","(Entregar 10 pepitas)","","","VLK_585_Aleph_GLEN.description","",""
"Scripts/content/Story/MISSIONS/DIA_Vlk_585_Aleph.d:179","Für mein Erz erwarte ich auch eine gute Information!","¡Espero recibir buena información a cambio de mi mineral!","","","VLK_585_Aleph_GLEN_Info_15_01","",""
"Scripts/content/Story/MISSIONS/DIA_Vlk_585_Aleph.d:180","Hier gibt's eine Menge verschlossener Truhen. Glen, der Buddler, der ganz oben steht, kann dir ein paar Dietriche besorgen.","Aquí hay un montón de cofres cerrados con llave. Glen, el cavador de arriba, podría proporcionarte un par de ganzúas.","","","VLK_585_Aleph_GLEN_Info_05_02","",""
"Scripts/content/Story/MISSIONS/DIA_Vlk_585_Aleph.d:196","Weißt du was über den Schlüssel für die Truhen im Lagerschuppen?","¿Sabes algo de la llave de los cofres del almacén?","","","VLK_585_Aleph_SCHUPPEN.description","",""
"Scripts/content/Story/MISSIONS/DIA_Vlk_585_Aleph.d:209","Weißt du was über den Schlüssel für die Truhen im Lagerschuppen?","¿Sabes algo acerca de la llave de los cofres que hay en la cabaña de almacenamiento?","","","VLK_585_Aleph_SCHUPPEN_Info_15_01","",""
"Scripts/content/Story/MISSIONS/DIA_Vlk_585_Aleph.d:210","Nun, das kommt ganz darauf an ...","Bueno, eso depende.","","","VLK_585_Aleph_SCHUPPEN_Info_05_02","",""
"Scripts/content/Story/MISSIONS/DIA_Vlk_585_Aleph.d:211","Darauf, wieviel Erz ich dir gebe?","¿De cuántas pepitas te pague?","","","VLK_585_Aleph_SCHUPPEN_Info_15_03","",""
"Scripts/content/Story/MISSIONS/DIA_Vlk_585_Aleph.d:212","Du lernst schnell.","Aprendes rápido.","","","VLK_585_Aleph_SCHUPPEN_Info_05_04","",""
"Scripts/content/Story/MISSIONS/DIA_Vlk_585_Aleph.d:217","50 Erz zahlen","Pagar 50 pepitas.","","","VLK_585_Aleph_SCHUPPEN.VLK_585_Aleph_SCHUPPEN_50","Info_AddChoice",""
"Scripts/content/Story/MISSIONS/DIA_Vlk_585_Aleph.d:218","30 Erz zahlen","Pagar 30 pepitas.","","","VLK_585_Aleph_SCHUPPEN.VLK_585_Aleph_SCHUPPEN_30","Info_AddChoice",""
"Scripts/content/Story/MISSIONS/DIA_Vlk_585_Aleph.d:219","15 Erz zahlen","Pagar 15 pepitas.","","","VLK_585_Aleph_SCHUPPEN.VLK_585_Aleph_SCHUPPEN_15","Info_AddChoice",""
"Scripts/content/Story/MISSIONS/DIA_Vlk_585_Aleph.d:226","50 Erz sind mehr als genug für dich!","¡Por tratarse de ti, debería bastar con 50 pepitas!","","","VLK_585_Aleph_SCHUPPEN_50_15_01","",""
"Scripts/content/Story/MISSIONS/DIA_Vlk_585_Aleph.d:227","Überaus großzügig. Hier ist der Schlüssel. Und nimm auch diesen Ring. Mir hat er immer Glück gebracht.","¡Muy generoso! Aquí tienes la llave. Y llévate este anillo también. A mí siempre me ha traído suerte.","","","VLK_585_Aleph_SCHUPPEN_50_05_02","",""
"Scripts/content/Story/MISSIONS/DIA_Vlk_585_Aleph.d:245","So viel Erz hast du nicht!","¡No tienes pepitas suficientes!","","","VLK_585_Aleph_SCHUPPEN_50_05_03","",""
"Scripts/content/Story/MISSIONS/DIA_Vlk_585_Aleph.d:258","30 Erz sollten reichen.","Con 30 pepitas debería bastar.","","","VLK_585_Aleph_SCHUPPEN_30_15_01","",""
"Scripts/content/Story/MISSIONS/DIA_Vlk_585_Aleph.d:259","Nun gut, zufällig habe ich hier einen Schlüssel.","Vale; da la casualidad de que llevo la llave encima.","","","VLK_585_Aleph_SCHUPPEN_30_05_02","",""
"Scripts/content/Story/MISSIONS/DIA_Vlk_585_Aleph.d:265","So viel Erz hast du nicht!","No tienes pepitas suficientes.","","","VLK_585_Aleph_SCHUPPEN_30_05_03","",""
"Scripts/content/Story/MISSIONS/DIA_Vlk_585_Aleph.d:272","Bist du mit 15 Erz einverstanden?","¿Te parecen bien 15 pepitas?","","","VLK_585_Aleph_SCHUPPEN_15_15_01","",""
"Scripts/content/Story/MISSIONS/DIA_Vlk_585_Aleph.d:273","15 Erz? Ich weiß nichts von einem Schlüssel!","¿15 pepitas? ¡Yo no sé nada de ninguna llave!","","","VLK_585_Aleph_SCHUPPEN_15_05_02","",""
"Scripts/content/Story/MISSIONS/DIA_Vlk_585_Aleph.d:290","Weißt du was über den Schlüssel für die Truhen im Lagerschuppen?","¿Sabes algo de la llave de los cofres del almacén?","","","VLK_585_Aleph_DIRTY.description","",""
"Scripts/content/Story/MISSIONS/DIA_Vlk_585_Aleph.d:303","Weißt du was über den Schlüssel für die Truhen im Lagerschuppen?","¿Sabes algo acerca de la llave de los cofres que hay en la cabaña de almacenamiento?","","","VLK_585_Aleph_DIRTY_Info_15_01","",""
"Scripts/content/Story/MISSIONS/DIA_Vlk_585_Aleph.d:304","Nun, das kommt ganz darauf an ...","Bueno, eso depende.","","","VLK_585_Aleph_DIRTY_Info_05_02","",""
"Scripts/content/Story/MISSIONS/DIA_Vlk_585_Aleph.d:305","Darauf, wieviel Erz ich dir gebe?","¿De cuántas pepitas te pague?","","","VLK_585_Aleph_DIRTY_Info_15_03","",""
"Scripts/content/Story/MISSIONS/DIA_Vlk_585_Aleph.d:306","Du lernst schnell. Ich will 100 Erz.","Aprendes rápido. Quiero 100 pepitas.","","","VLK_585_Aleph_DIRTY_Info_05_04","",""
"Scripts/content/Story/MISSIONS/DIA_Vlk_585_Aleph.d:310","(100 Erz zahlen)","(Pagar 100 pepitas)","","","VLK_585_Aleph_DIRTY.VLK_585_Aleph_DIRTY_100","Info_AddChoice",""
"Scripts/content/Story/MISSIONS/DIA_Vlk_585_Aleph.d:311","(Nicht zahlen)","(No pagar)","","","VLK_585_Aleph_DIRTY.VLK_585_Aleph_DIRTY_NO","Info_AddChoice",""
"Scripts/content/Story/MISSIONS/DIA_Vlk_585_Aleph.d:318","Na gut, du Halsabschneider. Hier sind deine 100 Erz.","Vale, estafador. Aquí tienes las 100.","","","VLK_585_Aleph_DIRTY_100_Info_15_01","",""
"Scripts/content/Story/MISSIONS/DIA_Vlk_585_Aleph.d:319","Du hättest mich halt nicht verpfeifen sollen. Hier ist der Schlüssel.","No deberías haberme delatado. Aquí tienes la llave.","","","VLK_585_Aleph_DIRTY_100_Info_05_02","",""
"Scripts/content/Story/MISSIONS/DIA_Vlk_585_Aleph.d:329","Für wie blöd hältst du mich eigentlich? 100 Erz, nicht einen Brocken weniger!","¿Es que piensas que soy estúpido o qué? ¡100 pepitas, ni una menos!","","","VLK_585_Aleph_DIRTY_100_Info_05_03","",""
"Scripts/content/Story/MISSIONS/DIA_Vlk_585_Aleph.d:336","Ich werfe dir doch keine 100 Erz in den Rachen!","¡No voy a regalarte 100 pepitas!","","","VLK_585_Aleph_DIRTY_NO_Info_15_01","",""
