"location","source","target","id","fuzzy","context","translator_comments","developer_comments"
"Scripts/content/Story/MISSIONS/DIA_Vlk_573_Graham.d:122","20 ist schon mein Spezialpreis für Freunde von Diego. Normalerweise würde ich 50 nehmen.","20 pepitas es mi precio especial para amigos de Diego. Normalmente cobro 50.","","","DIA_Graham_SellMap_GiveNotSell_02_02","",""
"Scripts/content/Story/MISSIONS/DIA_Vlk_573_Graham.d:132","Ich würde gerne eine Karte kaufen.","Me gustaría comprar un mapa.","","","DIA_Graham_BuyMaps.description","",""
"Scripts/content/Story/MISSIONS/DIA_Vlk_573_Graham.d:145","Ich würde gerne eine Karte kaufen.","Querría comprar un mapa.","","","DIA_Graham_BuyMaps_15_00","",""
"Scripts/content/Story/MISSIONS/DIA_Vlk_573_Graham.d:146","Klar ... Was suchst du? Je mehr drauf zu sehen ist, desto teurer sind die Karten.","Claro... ¿Qué tenías pensado? Cuantas más cosas puedas ver en el mapa, más cuesta.","","","DIA_Graham_BuyMaps_02_01","",""
"Scripts/content/Story/MISSIONS/DIA_Vlk_574_Mud.d:55","Hey, Mann! Neu hier? Dich hab' ich hier noch nie gesehen.","¡Hola, hombre! ¿Eres nuevo aquí? No te había visto nunca.","","","DIA_Mud_FirstEXIT_07_00","",""
"Scripts/content/Story/MISSIONS/DIA_Vlk_574_Mud.d:56","Wenn du nichts dagegen hast, komme ich ein Stück mit. Du kannst sicher einen Freund brauchen.","Voy a hacerte compañía, si no te importa. Seguro que necesitarás un amigo.","","","DIA_Mud_FirstEXIT_07_01","",""
"Scripts/content/Story/MISSIONS/DIA_Vlk_574_Mud.d:58","Verpiss dich!","¡Lárgate!","","","DIA_Mud_FirstEXIT.DIA_Mud_FirstEXIT_Verpiss","Info_AddChoice",""
"Scripts/content/Story/MISSIONS/DIA_Vlk_574_Mud.d:59","Warum nicht - komm mit!","¿Por qué no? Date prisa.","","","DIA_Mud_FirstEXIT.DIA_Mud_FirstEXIT_Komm","Info_AddChoice",""
"Scripts/content/Story/MISSIONS/DIA_Vlk_574_Mud.d:64","Verpiss dich!","¡Piérdete!","","","DIA_Mud_FirstEXIT_Verpiss_15_00","",""
"Scripts/content/Story/MISSIONS/DIA_Vlk_574_Mud.d:65","Bist heute nicht so gut drauf, was? Ich glaub', ich komm' mal besser mit ...","No estás de muy buen humor hoy, ¿eh? Será mejor que te acompañe.","","","DIA_Mud_FirstEXIT_Verpiss_07_01","",""
"Scripts/content/Story/MISSIONS/DIA_Vlk_574_Mud.d:73","Warum nicht - komm mit!","¿Por qué no? ¡Ven conmigo!","","","DIA_Mud_FirstEXIT_Komm_15_00","",""
"Scripts/content/Story/MISSIONS/DIA_Vlk_574_Mud.d:74","Großartig! Wir können uns ja auf dem Weg etwas unterhalten.","¡Estupendo! Podemos hablar mientras andamos.","","","DIA_Mud_FirstEXIT_Komm_07_01","",""
"Scripts/content/Story/MISSIONS/DIA_Vlk_574_Mud.d:90","Kannst du mal BITTE einen Moment die Klappe halten?","¿Te puedes estar callado un minuto?","","","DIA_Mud_ShutUp.description","",""
"Scripts/content/Story/MISSIONS/DIA_Vlk_574_Mud.d:103","Kannst du mal BITTE einen Moment die Klappe halten?","¿Podrías callarte un minuto, POR FAVOR?","","","DIA_Mud_ShutUp_15_00","",""
"Scripts/content/Story/MISSIONS/DIA_Vlk_574_Mud.d:104","Klar.","Claro... ¿Qué tenías pensado? Cuantas más cosas puedas ver en el mapa, más cuesta.","","","DIA_Mud_ShutUp_07_01","",""
"Scripts/content/Story/MISSIONS/DIA_Vlk_574_Mud.d:118","Verpiss dich!","¡Lárgate!","","","DIA_Mud_GetLost.description","",""
"Scripts/content/Story/MISSIONS/DIA_Vlk_574_Mud.d:128","Verpiss dich!","¡Piérdete!","","","DIA_Mud_GetLost_15_00","",""
"Scripts/content/Story/MISSIONS/DIA_Vlk_574_Mud.d:129","Willst 'nen Moment allein sein, hm? Kann ich verstehen ... Ich halt mich im Hintergrund ...","Quieres estar solo un rato, ¿verdad? Lo comprendo. Me quedaré en un segundo plano.","","","DIA_Mud_GetLost_07_01","",""
"Scripts/content/Story/MISSIONS/DIA_Vlk_574_Mud.d:154","Hey, Mann, du hast mich geschlagen! Was sollte das?","¡Oye, tío, me has pegado! ¿A qué ha venido eso?","","","DIA_Mud_GetLost_07_00","",""
"Scripts/content/Story/MISSIONS/DIA_Vlk_574_Mud.d:155","Ich schlag' dich gleich noch mal! Ich steh' auf Schlagen!","¡En un segundo voy a volver a pegarte! ¡Me gusta hacerlo!","","","DIA_Mud_GetLost_15_01","",""
"Scripts/content/Story/MISSIONS/DIA_Vlk_574_Mud.d:156","Mann, was bist DU denn für'n Freak! Mit dir will ich nichts mehr zu tun haben!","¡Eres un lunático, tío! ¡No quiero tener nada que ver contigo!","","","DIA_Mud_GetLost_07_02","",""
"Scripts/content/Story/MISSIONS/DIA_Vlk_574_Mud.d:182","Sag mal, wohin geht es eigentlich? Oder ist das eine Überraschung für mich? Ich mag Überraschungen.","Dime una cosa; ¿adónde vamos? ¿O se supone que ha de ser una sorpresa? Me gustan las sorpresas.","","","DIA_Mud_Nerve_0_07_00","",""
"Scripts/content/Story/MISSIONS/DIA_Vlk_574_Mud.d:208","Lass dich von mir nicht stören. Ich bleib' einfach bei dir, keine Sorge.","No me hagas caso. Me quedaré contigo; no te preocupes.","","","DIA_Mud_Nerve_1_07_00","",""
"Scripts/content/Story/MISSIONS/DIA_Vlk_574_Mud.d:235","Hast du eigentlich keinen Plan, wo du hinwillst? Suchst du ein stilles Plätzchen? Wo wir ein bisschen reden können und so?","¿No tienes ningún plan sobre dónde quieres ir?","","","DIA_Mud_Nerve_2_07_00","",""
"Scripts/content/Story/MISSIONS/DIA_Vlk_574_Mud.d:261","Hast du eigentlich keinen Plan, wo du hinwillst? Suchst du ein stilles Plätzchen? Wo wir ein bisschen reden können und so?","¿Estás buscando un lugar tranquilo? ¿Donde podamos charlar un poco o algo así?","","","DIA_Mud_Nerve_3_07_00","",""
"Scripts/content/Story/MISSIONS/DIA_Vlk_574_Mud.d:287","Kann es sein, dass du im Kreis läufst? Ich meine, ich weiß ja nicht, wo du hin willst ...","¿Es posible que estemos andando en círculos? Quiero decir que no sé a dónde quieres ir.","","","DIA_Mud_Nerve_4_07_00","",""
"Scripts/content/Story/MISSIONS/DIA_Vlk_574_Mud.d:313","Das macht richtig Spaß mit dir. Schön, dass du mich mitnimmst. Das können wir öfter mal machen. Und heute ist ja auch noch viel Zeit.","Esto es muy divertido. Gracias por llevarme contigo. Podríamos hacerlo más a menudo; hoy todavía queda un montón de tiempo.","","","DIA_Mud_Nerve_5_07_00","",""
"Scripts/content/Story/MISSIONS/DIA_Vlk_574_Mud.d:339","Ich hab' mich schon richtig an dich gewöhnt. Wir werden sicher eine Menge Spaß miteinander haben. Nicht wahr? Wo schläfst du eigentlich? Du kannst gerne zu mir kommen.","Ya me he acostumbrado a ti. Nos lo vamos a pasar muy bien; estoy seguro de ello. ¿Tú no? Por cierto, ¿dónde duermes? Puedes venir a mi casa; sin problemas.","","","DIA_Mud_Nerve_6_07_00","",""
"Scripts/content/Story/MISSIONS/DIA_Vlk_574_Mud.d:365","Wegen was haben sie dich eigentlich hier reingeworfen? Hast du auch einen Faible für Tiere? Das haben sie ja gar nicht gerne. Da haben sie mich eingebuchtet.","¿Por qué te pusieron aquí? ¿Te gustan a ti también los animales? Eso no les gusta ni un pelo. Por eso me encerraron aquí.","","","DIA_Mud_Nerve_7_07_00","",""
"Scripts/content/Story/MISSIONS/DIA_Vlk_574_Mud.d:391","Es gibt da ein paar Leute, die versuchen ständig, mich zu verprügeln. Fiese Typen aus dem Neuen Lager. Richtige Brutalos. Ich werde ihnen beim nächsten Mal gleich sagen, dass sie es in Zukunft mir dir zu tun kriegen. Das wird sie sicher abschrecken.","Hay algunos que intentan darme palizas constantemente. Unos tipos horribles del Campamento Nuevo. Cuando vuelva a pasar les diré que la próxima vez tendrán que enfrentarse a ti. Eso les asustará muchísimo.","","","DIA_Mud_Nerve_8_07_00","",""
"Scripts/content/Story/MISSIONS/DIA_Vlk_574_Mud.d:417","Diese fiesen Schweine aus dem Neuen Lager werden staunen, wenn sie erfahren, dass ich einen Beschützer habe. Die werden sich in die Hosen machen. Das wird ein Spaß. Sonst machen sie ja mit allen kurzen Prozess, aber jetzt werden sie sich das zweimal überlegen.","Esos bastardos del Campamento Nuevo van a quedarse asombrados cuando sepan que tengo un protector. Van a mearse encima. Será divertido. Normalmente liquidan a la gente con rapidez, pero ahora se lo pensarán dos veces.","","","DIA_Mud_Nerve_9_07_00","",""
"Scripts/content/Story/MISSIONS/DIA_Vlk_574_Mud.d:443","Weißt du was? Ich tu dir einen Gefallen. Ich werde ein gutes Wort für dich einlegen. Dann nehmen sie dich vielleicht in das Lager auf. Dann können wir uns jeden Tag sehen.","¿Sabes una cosa? Voy a hacerte un favor. Voy a interceder por ti; quizá entonces te admitan en el Campamento. Entonces podríamos vernos todos los días.","","","DIA_Mud_Nerve_10_07_00","",""
"Scripts/content/Story/MISSIONS/DIA_Vlk_574_Mud.d:469","Manche halten mich ja für einen durchgeknallten Spinner. Aber jemand wie du würde sich hier ja niemals mit einem Spinner sehen lassen. So was spricht sich ja rum. Also werden sie einsehen, dass sie sich in mir getäuscht haben.","Alguna gente piensa que soy un completo lunático. Pero alguien como tú nunca pasaría el rato con un lunático. La gente hablaría de ello. Así que por fin se darán cuenta de que estaban equivocados acerca de mí.","","","DIA_Mud_Nerve_11_07_00","",""
"Scripts/content/Story/MISSIONS/DIA_Vlk_574_Mud.d:495","Du bist mein bester Freund hier drinnen. Die anderen wollen mich immer nur loswerden. Ich bin dir echt dankbar.","Eres el mejor amigo que tengo aquí. Los otros siempre andan queriendo librarse de mí. Te estoy agradecidísimo.","","","DIA_Mud_Nerve_12_07_00","",""
"Scripts/content/Story/MISSIONS/DIA_Vlk_574_Mud.d:521","Hör mal, die Rennerei wird langsam anstrengend. Wollen wir uns nicht irgendwo ein kuscheliges Plätzchen suchen und es uns gemütlich machen?","Mira, esto de correr todo el rato resulta agotador. ¿No deberíamos buscar algún lugar tranquilo y ponernos cómodos en alguna parte?","","","DIA_Mud_Nerve_13_07_00","",""
"Scripts/content/Story/MISSIONS/DIA_Vlk_574_Mud.d:547","Du bist wie ein großer Bruder für mich. Ich hatte nie einen großen Bruder. Auch keinen kleinen. Meine Eltern wollten mich nicht behalten. Ich bin sicher, das fiel ihnen nicht leicht.","Eres como un hermano mayor para mí. Nunca tuve un hermano mayor. Ni menor. Mis padres no me querían. Pero estoy seguro de que les resultó difícil.","","","DIA_Mud_Nerve_14_07_00","",""
"Scripts/content/Story/MISSIONS/DIA_Vlk_574_Mud.d:548","Bestimmt nicht.","Estoy seguro de ello.","","","DIA_Mud_Nerve_14_15_01","",""
"Scripts/content/Story/MISSIONS/DIA_Vlk_574_Mud.d:574","Wo kommst du denn her? Du freust dich sicher auch so, dass du jetzt endlich jemanden gefunden hast, der dich versteht. Ich komme aus Khorinis. Warst du schon mal dort? Ist ja eigentlich auch egal.","¿De dónde eres? Debes estar contento de haber encontrado por fin a alguien que te comprenda. Yo soy de Khorinis. ¿Has estado allí? Bueno, pero no importa.","","","DIA_Mud_Nerve_15_07_00","",""
"Scripts/content/Story/MISSIONS/DIA_Vlk_574_Mud.d:600","Hast du was zu essen für mich? Da ich ja so was wie Besuch bin, fände ich es toll, wenn du mir was geben würdest. Das gehört sich so. Das haben mir meine Freunde in Khorinis beigebracht. Die hatten mich echt gerne.","¿Tienes algo de comer para mí? Ya que soy una especie de visita, sería de buena educación darme algo. Eso son buenas maneras. Mis amigos en Khorinis me lo enseñaron. Me apreciaban mucho.","","","DIA_Mud_Nerve_16_07_00","",""
"Scripts/content/Story/MISSIONS/DIA_Vlk_574_Mud.d:626","Glaubst du, dass uns mal jemand von außerhalb besucht? Wohl kaum, was, weil die kommen ja dann nicht mehr raus, oder?","¿Crees que alguna vez nos visitará alguien? Es probable que no, porque no volverían a salir de aquí, ¿no?","","","DIA_Mud_Nerve_17_07_00","",""
"Scripts/content/Story/MISSIONS/DIA_Vlk_574_Mud.d:652","Jetzt, wo du bei mir bist, können wir ja mal einigen Arschlöchern aufs Maul hauen. Die haben mich jahrelang getriezt. Wenn ich einen von denen sehe, dann sag' ich ihnen die Meinung.","Ahora que estás conmigo, podríamos darles lecciones a algunos. Estos bastardos llevan años abusando de mí. Cuando vea a uno de ellos, le voy a decir una cosa o dos.","","","DIA_Mud_Nerve_18_07_00","",""
"Scripts/content/Story/MISSIONS/DIA_Vlk_574_Mud.d:678","Zusammen sind wir echt unschlagbar. Wir könnten das Alte Lager übernehmen. Mit den Erzbaronen werden wir schon fertig, wir sind ja zu zweit. Ich werde mir etwas ausdenken.","Formamos un equipo ideal. Podríamos tomar el control del Campamento Viejo. Como somos un equipo, los Magnates del Mineral no supondrían ningún problema para mí. Discurriré un plan.","","","DIA_Mud_Nerve_19_07_00","",""
"Scripts/content/Story/MISSIONS/DIA_Vlk_580_Grim.d:47","Hey, du! Du bist doch der Typ, der hier im Lager aufgenommen werden will?","¡Eh, tú! ¿No eres tú el que quiere unirse al Campamento?","","","DIA_Grim_Falle_06_00","",""
"Scripts/content/Story/MISSIONS/DIA_Vlk_580_Grim.d:48","Und wenn es so wäre?","¿Y si así fuera?","","","DIA_Grim_Falle_15_01","",""
"Scripts/content/Story/MISSIONS/DIA_Vlk_580_Grim.d:49","Ich könnte dir dabei helfen ...","Podría ayudarte.","","","DIA_Grim_Falle_06_02","",""
"Scripts/content/Story/MISSIONS/DIA_Vlk_580_Grim.d:50","Und wie?","¿Cómo?","","","DIA_Grim_Falle_15_03","",""
"Scripts/content/Story/MISSIONS/DIA_Vlk_580_Grim.d:51","Draußen vorm Lager sitzen zwei Typen rum, von denen einer die Erzbarone bestohlen hat. Es ist ein wertvolles Amulett, das mit dem letzten Konvoi gekommen sein sollte.","Hay dos tipos sentados fuera del Campamento y uno de ellos ha robado una cosa a los Magnates del Mineral. Es un amuleto de gran valor, que debería haber llegado en la última caravana.","","","DIA_Grim_Falle_06_04","",""
"Scripts/content/Story/MISSIONS/DIA_Vlk_580_Grim.d:52","Einer von ihnen müsste das Amulett noch haben. Wenn wir beide auf sie draufgehen, schaffen wir sie - alleine kann ich's nicht machen. Was sagst du?","Uno de ellos debería tener todavía el amuleto. Si les atacamos juntos podríamos derrotarles. Yo solo no podría hacerlo. ¿Qué me dices?","","","DIA_Grim_Falle_06_05","",""
"Scripts/content/Story/MISSIONS/DIA_Vlk_580_Grim.d:55","Kein Interesse - such dir einen anderen.","No me interesa. Tendrás que buscar a otra persona.","","","DIA_Grim_Falle.DIA_Grim_Falle_Deny","Info_AddChoice",""
"Scripts/content/Story/MISSIONS/DIA_Vlk_580_Grim.d:56","Was passiert, wenn wir das Amulett haben?","¿Qué pasará cuando tengamos el amuleto?","","","DIA_Grim_Falle.DIA_Grim_Falle_HowShare","Info_AddChoice",""
"Scripts/content/Story/MISSIONS/DIA_Vlk_580_Grim.d:57","Ich bin dabei!","¡Cuenta conmigo!","","","DIA_Grim_Falle.DIA_Grim_Falle_Accepr","Info_AddChoice",""
"Scripts/content/Story/MISSIONS/DIA_Vlk_580_Grim.d:62","Kein Interesse - such dir einen anderen.","No me interesa; tendrás que buscar a otro.","","","DIA_Grim_Falle_Deny_15_00","",""
"Scripts/content/Story/MISSIONS/DIA_Vlk_580_Grim.d:63","Mit der Einstellung kommst du hier nicht weit - sag mir Bescheid, falls du's dir doch noch überlegen solltest!","Con esta actitud no vas a durar mucho aquí. ¡Avísame si cambias de opinión!","","","DIA_Grim_Falle_Deny_06_01","",""
"Scripts/content/Story/MISSIONS/DIA_Vlk_580_Grim.d:69","Was passiert, wenn wir das Amulett haben?","¿Qué ocurrirá una vez tengamos el amuleto?","","","DIA_Grim_Falle_HowShare_15_00","",""
"Scripts/content/Story/MISSIONS/DIA_Vlk_580_Grim.d:70","Ganz einfach! Ich geb's zurück und kassier die Belohnung - dabei sag' ich, dass du mir geholfen hast. Damit hast du bei Gomez 'nen Stein in Brett.","¡Ésa es fácil! Lo devolveré y conseguiré la recompensa. Les diré que me ayudaste. Entonces te habrás ganado el favor de Gómez. ","","","DIA_Grim_Falle_HowShare_06_01","",""
"Scripts/content/Story/MISSIONS/DIA_Vlk_580_Grim.d:74","Wir machen Halbe-Halbe! Oder du kannst dich alleine mit den Typen anlegen!","¡No! ¡O vamos a medias o lo haces solo!","","","DIA_Grim_Falle.DIA_Grim_Falle_HalfHalf","Info_AddChoice",""
"Scripts/content/Story/MISSIONS/DIA_Vlk_580_Grim.d:80","Nein! Wir machen halbe-halbe! Oder du kannst dich alleine mit den Typen anlegen!","¡No! ¡O vamos a partes iguales o lo haces solo!","","","DIA_Grim_Falle_HalfHalf_15_00","",""
"Scripts/content/Story/MISSIONS/DIA_Vlk_580_Grim.d:81","Okay, okay, halbe-halbe. Wird schon genug dabei rausspringen. Also - bist du dabei?","Vale, vale. A partes iguales. Supongo que de todas maneras habrá suficiente para los dos. Bueno, ¿puedo contar contigo entonces?","","","DIA_Grim_Falle_HalfHalf_06_01","",""
"Scripts/content/Story/MISSIONS/DIA_Vlk_580_Grim.d:86","Ich bin dabei!","¡Cuenta conmigo!","","","DIA_Grim_Falle_Accepr_15_00","",""
"Scripts/content/Story/MISSIONS/DIA_Vlk_580_Grim.d:87","Gut, sag Bescheid, sobald wir losgehen können!","¡Vale, dime cuándo empezamos!","","","DIA_Grim_Falle_Accepr_06_01","",""
"Scripts/content/Story/MISSIONS/DIA_Vlk_580_Grim.d:100","Ich bin bereit, mit dir zu gehen - lass uns das Amulett holen!","Estoy listo para ir contigo. ¡A por el amuleto!","","","DIA_Grim_ReadyToGo.description","",""
"Scripts/content/Story/MISSIONS/DIA_Vlk_580_Grim.d:113","Ich bin bereit, mit dir zu gehen - lass uns das Amulett holen!","¡Yo ya estoy listo; vamos a por el amuleto!","","","DIA_Grim_ReadyToGo_15_00","",""
"Scripts/content/Story/MISSIONS/DIA_Vlk_580_Grim.d:114","Gut! Dann wollen wir mal ...","Vale, vamos a ello.","","","DIA_Grim_ReadyToGo_06_01","",""
"Scripts/content/Story/MISSIONS/DIA_Vlk_580_Grim.d:143","So, hier sind wir. Schön weit weg von deinem Freund Diego.","Bueno, pues aquí estamos, lejos de tu amigo Diego.","","","DIA_Grim_AtOCdraussen_06_00","",""
"Scripts/content/Story/MISSIONS/DIA_Vlk_580_Grim.d:146","Wir sollen dir schöne Grüße von Bloodwyn bestellen!","¡Nos han dicho que te demos recuerdos de parte de Bloodwyn!","","","DIA_Grim_AtOCdraussen_06_01","",""
"Scripts/content/Story/MISSIONS/DIA_Vlk_580_Grim.d:150","Ich soll dir schöne Grüße von Bloodwyn bestellen ...","¡Me han dicho que té de recuerdos de parte de Bloodwyn!","","","DIA_Grim_AtOCdraussen_06_02","",""
"Scripts/content/Story/MISSIONS/DIA_Vlk_580_Grim.d:197","Du Penner wolltest mir also nur 'ne Falle stellen ...","Así que lo único que querías era tenderme una trampa, ¿eh, idiota?","","","DIA_Grim_NACHFalle_15_01","",""
"Scripts/content/Story/MISSIONS/DIA_Vlk_580_Grim.d:198","Hey, Mann! Wir spielen beide dasselbe Spiel! Ich hab' auch keine Lust, in den Minen buddeln zu gehen.","¡Oye, tío! ¡Estamos montados en el mismo barco! A mí tampoco me gusta cavar en las minas.","","","DIA_Grim_NACHFalle_06_02","",""
"Scripts/content/Story/MISSIONS/DIA_Vlk_580_Grim.d:199","Also werd' ich tun, was mir die Gardisten sagen, dann werde ich hier bald aufgenommen.","Así que hago lo que me dicen los guardias y pronto seré aceptado.","","","DIA_Grim_NACHFalle_06_03","",""
"Scripts/content/Story/MISSIONS/DIA_Vlk_580_Grim.d:200","Dass ich ausgerechnet DIR aufs Maul hauen sollte, hast du dir im Grunde selber zuzuschreiben. Warum legst du dich auch mit den Gardisten an.","Que tenga que encargarme de ti precisamente es culpa tuya. ¿Por qué tuviste que empezar una pelea con los guardias?","","","DIA_Grim_NACHFalle_06_04","",""
"Scripts/content/Story/MISSIONS/DIA_Vlk_580_Grim.d:201","Persönlich hab' ich nichts gegen dich. Also was ist - Frieden oder weiterprügeln?","Personalmente no me caes mal. ¿Qué opinas; paz o seguimos luchando?","","","DIA_Grim_NACHFalle_06_05","",""
"Scripts/content/Story/MISSIONS/DIA_Vlk_580_Grim.d:204","Weiterprügeln.","Pelea.","","","DIA_Grim_NACHFalle.DIA_Grim_NACHFalle_Weiterpruegeln","Info_AddChoice",""
"Scripts/content/Story/MISSIONS/DIA_Vlk_580_Grim.d:205","Frieden.","Paz.","","","DIA_Grim_NACHFalle.DIA_Grim_NACHFalle_Frieden","Info_AddChoice",""
"Scripts/content/Story/MISSIONS/DIA_Vlk_580_Grim.d:210","Mir ist eher nach Weiterprügeln!","¡Tengo ganas de luchar!","","","DIA_Grim_NACHFalle_Weiterpruegeln_15_00","",""
"Scripts/content/Story/MISSIONS/DIA_Vlk_580_Grim.d:211","Oh Mann, du schaffst mich ...","Oh, tío, me deprimes.","","","DIA_Grim_NACHFalle_Weiterpruegeln_06_01","",""
"Scripts/content/Story/MISSIONS/DIA_Vlk_580_Grim.d:221","Frieden klingt gut.","La paz me parece bien.","","","DIA_Grim_NACHFalle_Frieden_15_00","",""
"Scripts/content/Story/MISSIONS/DIA_Vlk_580_Grim.d:222","Freut mich, dass du das Ganze durch meine Augen sehen kannst. Die Sache ist vergessen. Ab jetzt bin ich auf deiner Seite.","Me alegro de que estemos de acuerdo en esto. Olvidémoslo todo. De ahora en adelante, estoy de tu lado.","","","DIA_Grim_NACHFalle_Frieden_06_01","",""
"Scripts/content/Story/MISSIONS/DIA_Vlk_580_Grim.d:223","Wenn du noch mal Ärger haben solltest - kannst du auf mich zählen - schließlich schulde ich dir was.","Si vuelves a verte en problemas, puedes contar conmigo. Después de todo, estoy en deuda contigo.","","","DIA_Grim_NACHFalle_Frieden_06_02","",""
"Scripts/content/Story/MISSIONS/DIA_Vlk_580_Grim.d:240","Ich bin neu hier!","Soy nuevo aquí.","","","DIA_Grim_Hallo.description","",""
"Scripts/content/Story/MISSIONS/DIA_Vlk_580_Grim.d:258","Ich bin neu hier!","Soy nuevo aquí.","","","DIA_Grim_Hallo_15_00","",""
"Scripts/content/Story/MISSIONS/DIA_Vlk_580_Grim.d:259","Gerade angekommen, was? Ich bin Grim - bin auch noch nicht so lange da. Bin eine Fuhre vor dir mit reingeworfen worden.","Acabas de llegar, ¿verdad? Yo soy Grim; tampoco llevo mucho aquí. Me arrojaron junto con el cargamento anterior al tuyo.","","","DIA_Grim_Hallo_06_01","",""
"Scripts/content/Story/MISSIONS/DIA_Vlk_580_Grim.d:271","Wie ist das Leben hier so?","¿Cómo es la vida aquí?","","","DIA_Grim_Leben.description","",""
"Scripts/content/Story/MISSIONS/DIA_Vlk_580_Grim.d:281","Wie ist das Leben hier so?","¿Cómo es la vida aquí?","","","DIA_Grim_Leben_15_00","",""
"Scripts/content/Story/MISSIONS/DIA_Vlk_580_Grim.d:282","Ganz ruhig, so lange du dein Schutzgeld an die Gardisten bezahlst.","Fácil, siempre que pagues el dinero de la protección a los guardias.","","","DIA_Grim_Leben_06_01","",""
"Scripts/content/Story/MISSIONS/DIA_Vlk_580_Grim.d:294","Was muss ich machen, wenn ich in dieses Lager aufgenommen werden will?","¿Qué tengo que hacer si quiero que me admitan en este campamento?","","","DIA_Grim_Aufnahme.description","",""
"Scripts/content/Story/MISSIONS/DIA_Vlk_580_Grim.d:304","Was muss ich machen, wenn ich in diesem Lager aufgenommen werden will?","¿Qué tengo que hacer para que me admitan en este campamento?","","","DIA_Grim_Aufnahme_15_00","",""
"Scripts/content/Story/MISSIONS/DIA_Vlk_580_Grim.d:305","Also zuerst mal wirst du Schatten. Dazu musst du einen Fürsprecher finden. Jemand, der dir alles erklärt und für dich einsteht.","Bueno, primero tienes que convertirte en miembro de las Sombras. Por tanto, tienes que encontrar a alguien que te apoye. Alguien que te lo explique todo y se responsabilice de ti.","","","DIA_Grim_Aufnahme_06_01","",""
"Scripts/content/Story/MISSIONS/DIA_Vlk_580_Grim.d:306","Ich an deiner Stelle würd' mich direkt an Diego halten - hab' ich auch gemacht - der ist ganz in Ordnung.","Yo en tu lugar me mantendría cerca de Diego; es lo que hice yo. Buena gente.","","","DIA_Grim_Aufnahme_06_02","",""
"Scripts/content/Story/MISSIONS/DIA_Vlk_580_Grim.d:307","Er stellt dir die Prüfung des Vertrauens - die sieht bei jedem anders aus. Dann gibt's noch einige kleinere Aufgaben von anderen Schatten.","Te hará pasar la prueba de fe; cada caso es diferente. Luego habrá otras tareas menores de las otras Sombras.","","","DIA_Grim_Aufnahme_06_03","",""
"Scripts/content/Story/MISSIONS/DIA_Vlk_580_Grim.d:308","Wenn du die gelöst hast, bist du dabei.","Si consigues superar eso, serás uno de nosotros.","","","DIA_Grim_Aufnahme_06_04","",""
"Scripts/content/Story/MISSIONS/DIA_Vlk_580_Grim.d:323","Und - wie weit bist du mit deinen Prüfungen?","Y... ¿cuánto has avanzado con tus pruebas?","","","DIA_Grim_HowFarAreYou.description","",""
"Scripts/content/Story/MISSIONS/DIA_Vlk_580_Grim.d:336","Und - wie weit bist du mit deinen Prüfungen?","¿Y bien? ¿Cómo te va con tus pruebas?","","","DIA_Grim_HowFarAreYou_15_00","",""
"Scripts/content/Story/MISSIONS/DIA_Vlk_580_Grim.d:337","Ich hab' schon mit Dexter, Sly und Fingers geredet. Das sind einige der einflussreichsten Schatten hier im Lager.","Ya he hablado con Dexter, Sly y Fingers. Ellos figuran entre los miembros más influyentes de las Sombras aquí, en el Campamento.","","","DIA_Grim_HowFarAreYou_06_01","",""
"Scripts/content/Story/MISSIONS/DIA_Vlk_580_Grim.d:355","Was ist DEINE Prüfung des Vertrauens?","¿Cuál fue TU prueba de fe?","","","DIA_Grim_YourPDV.description","",""
"Scripts/content/Story/MISSIONS/DIA_Vlk_580_Grim.d:368","Was ist DEINE Prüfung des Vertrauens?","¿Cuál fue tu prueba de fe?","","","DIA_Grim_YourPDV_15_00","",""
"Scripts/content/Story/MISSIONS/DIA_Vlk_580_Grim.d:369","Das kann ich dir nicht sagen, Mann. Über solche Dinge musst du hier schweigen!","No puedo decírtelo, tío. ¡Aquí tienes que mantener el pico cerrado sobre esas cosas!","","","DIA_Grim_YourPDV_06_01","",""
"Scripts/content/Story/MISSIONS/DIA_Vlk_580_Grim.d:402","Hey, hast du schon gehört?","Eh, ¿te has enterado de las noticias?","","","DIA_Grim_INEXTREMO_06_01","",""
"Scripts/content/Story/MISSIONS/DIA_Vlk_580_Grim.d:403","In Extremo ist hier. Sie sind drüben auf der Bühne.","Han venido los In Extremo. Están allí, en el escenario.","","","DIA_Grim_INEXTREMO_06_02","",""
"Scripts/content/Story/MISSIONS/DIA_Vlk_580_Grim.d:404","Schnell, sonst versäumst du noch den Auftritt!","¡Date prisa o te perderás el espectáculo!","","","DIA_Grim_INEXTREMO_06_03","",""
"Scripts/content/Story/MISSIONS/DIA_Vlk_580_Grim.d:428","Wo sind InExtremo?","¿Dónde están los In Extremo?","","","DIA_Grim_INEXTREMOAWAY.description","",""
"Scripts/content/Story/MISSIONS/DIA_Vlk_580_Grim.d:442","Wo sind InExtremo?","¿Dónde están los In Extremo?","","","DIA_Grim_INEXTREMOAWAY_15_01","",""
"Scripts/content/Story/MISSIONS/DIA_Vlk_580_Grim.d:443","Sie sind weitergezogen. Schade, ich hatte mich an die Abende vor der Bühne gewöhnt.","Han seguido su camino. Es una pena; me había acostumbrado a pasar las tardes frente al escenario.","","","DIA_Grim_INEXTREMOAWAY_06_02","",""
