"location","source","target","id","fuzzy","context","translator_comments","developer_comments"
"Scripts/content/Story/MISSIONS/DIA_ORG_833_Buster.d:19","Du siehst ganz schön ungelenkig aus, ich könnte dir helfen.","Pek de çevik biri gibi durmuyorsun. Sana yardımcı olabilirim.","","","DIA_ORG_833_Buster_02_01","",""
"Scripts/content/Story/MISSIONS/DIA_ORG_833_Buster.d:51","Wie kannst du mir helfen?","Nasıl yardım edebilirsin?","","","DIA_ORG_833_Buster3.description","",""
"Scripts/content/Story/MISSIONS/DIA_ORG_833_Buster.d:61","Ich kann dir die hohe Kunst der Körperbeherrschung zeigen. AKROBATIK.","Vücudunu nasıl kontrol edeceğini gösterebilirim. Akrobasi sanatını öğrenebilirsin.","","","DIA_ORG_833_Buster3_02_01","",""
"Scripts/content/Story/MISSIONS/DIA_ORG_833_Buster.d:78","Wenn du deinen Körper beherrscht, bist du in der Lage viel weiter zu springen.","Vücudunun kontrolünü ele geçirdin anda, çok daha uzak mesafeye zıplayabilirsin.","","","DIA_ORG_833_Buster3_02_02","",""
"Scripts/content/Story/MISSIONS/DIA_ORG_833_Buster.d:79","Du lernst dich richtig abzurollen und aus dem Fall heraus richtig zu landen. Aber denk daran, du bist nicht unsterblich!","Takla atmayı da öğrenirsin, bu da yüksek bir yerden düşerken hasar almamanın en iyi yoludur. Tabii unutma, ölümsüz de değilsin!","","","DIA_ORG_833_Buster3_02_03","",""
"Scripts/content/Story/MISSIONS/DIA_ORG_833_Buster.d:80","Auch im Kampf ist Akrobatik sehr hilfreich. Du kannst deinen Abstand zum Gegner sehr schnell verändern. Viel Glück!","Akrobasi dövüş esnasında da çok işine yarayabilir. Rakibin ile aranı kısa sürede açmana olanak sağlar. Bol şans!","","","DIA_ORG_833_Buster3_02_04","",""
"Scripts/content/Story/MISSIONS/DIA_ORG_840_Roscoe.d:33","Ich habe die Bedarfsliste der alten Mine.","Yanımda Eski Maden'in ihtiyaç listesi var.","","","DIA_Roscoe_BringList.description","",""
"Scripts/content/Story/MISSIONS/DIA_ORG_840_Roscoe.d:46","Ich habe die Bedarfsliste der alten Mine.","Yanımda Eski Maden'in ihtiyaç listesi var.","","","DIA_Roscoe_BringList_15_00","",""
"Scripts/content/Story/MISSIONS/DIA_ORG_840_Roscoe.d:47","Nicht schlecht. Wie bist du daran gekommen?","Fena değil. Nasıl aldın bunu?","","","DIA_Roscoe_BringList_10_01","",""
"Scripts/content/Story/MISSIONS/DIA_ORG_840_Roscoe.d:48","Ian hat sie mir gegeben.","Ian verdi.","","","DIA_Roscoe_BringList_15_02","",""
"Scripts/content/Story/MISSIONS/DIA_ORG_840_Roscoe.d:49","Du hast Nerven. Sie haben dich geschickt, um dich zu prüfen, was? Thorus geht bestimmt schon die Wände hoch.","Sağlam adammışsın! Test için göndermişlerdi, değil mi? Eminim Throus şimdiden küplere binmiştir.","","","DIA_Roscoe_BringList_10_03","",""
"Scripts/content/Story/MISSIONS/DIA_ORG_840_Roscoe.d:50","Diego hat mir den Auftrag gegeben.","Emri Diego verdi.","","","DIA_Roscoe_BringList_15_04","",""
"Scripts/content/Story/MISSIONS/DIA_ORG_840_Roscoe.d:51","Diego macht, was Thorus ihm sagt. So wie ich ihn kenne, würde er sich totlachen, wenn er wüsste, dass du hier bist.","Diego Thorus ne derse onu yapar. Eğer onu biraz tanıyorsam, burada olduğunu bilseydi gülmekten ölürdü.","","","DIA_Roscoe_BringList_10_05","",""
"Scripts/content/Story/MISSIONS/DIA_ORG_840_Roscoe.d:52","Kann ich jetzt rein oder was?","Şimdi içeri girebilir miyim yoksa giremez miyim?","","","DIA_Roscoe_BringList_15_06","",""
"Scripts/content/Story/MISSIONS/DIA_ORG_840_Roscoe.d:53","Geh nur. Lares werden die Augen aus dem Kopf fallen.","Gir. Lares gözlerine inanamayacak.","","","DIA_Roscoe_BringList_10_07","",""
"Scripts/content/Story/MISSIONS/DIA_ORG_840_Roscoe.d:66","Mordrag schickt mich.","Beni Mordrag gönderdi.","","","DIA_Roscoe_Mordrag.description","",""
"Scripts/content/Story/MISSIONS/DIA_ORG_840_Roscoe.d:80","Mordrag schickt mich.","Beni Mordrag gönderdi.","","","DIA_Roscoe_Mordrag_15_00","",""
"Scripts/content/Story/MISSIONS/DIA_ORG_840_Roscoe.d:81","Mordrag ist schon lange nicht mehr hier. Er ist vielleicht schon längst zum Alten Lager übergelaufen.","Mordrag bir süredir buralarda gözükmüyor. Muhtemelen Eski Kamp'ın tarafına geçti.","","","DIA_Roscoe_Mordrag_10_01","",""
"Scripts/content/Story/MISSIONS/DIA_ORG_840_Roscoe.d:82","Ich bin mit ihm hierhin gekommen.","Buraya onunla geldim.","","","DIA_Roscoe_Mordrag_15_02","",""
"Scripts/content/Story/MISSIONS/DIA_ORG_840_Roscoe.d:83","Mordrag ist wieder hier? Wenn du ihn siehst, sag ihm, Lares will ihn sehen.","Mordrag döndü mü? Tekrar görecek olursan, Lares'in görüşmek istediğini söyle.","","","DIA_Roscoe_Mordrag_10_03","",""
"Scripts/content/Story/MISSIONS/DIA_ORG_840_Roscoe.d:84","Mordrag hat mir etwas für Lares gegeben.","Mordrag, Lares'e vermem için bana bir şey verdi.","","","DIA_Roscoe_Mordrag_15_04","",""
"Scripts/content/Story/MISSIONS/DIA_ORG_840_Roscoe.d:85","Was?","Neymiş o?","","","DIA_Roscoe_Mordrag_10_05","",""
"Scripts/content/Story/MISSIONS/DIA_ORG_840_Roscoe.d:86","Einen Ring.","Yüzük.","","","DIA_Roscoe_Mordrag_15_06","",""
"Scripts/content/Story/MISSIONS/DIA_ORG_840_Roscoe.d:87","Bestimmt ein kostbares Stück ... Gut, du kannst zu ihm.","Değerli bir parça olduğu kesin... Tamam, girip görüşebilirsin.","","","DIA_Roscoe_Mordrag_10_07","",""
"Scripts/content/Story/MISSIONS/DIA_ORG_840_Roscoe.d:100","Ich will mich eurer Bande anschließen.","Çetenize katılmak istiyorum.","","","DIA_Roscoe_WannaJoin.description","",""
"Scripts/content/Story/MISSIONS/DIA_ORG_840_Roscoe.d:116","Ich will mich eurer Bande anschließen.","Çetenize katılmak istiyorum.","","","DIA_Roscoe_WannaJoin_15_00","",""
"Scripts/content/Story/MISSIONS/DIA_ORG_840_Roscoe.d:117","Das wollen viele. Du musst schon mit mehr kommen, wenn du durch diese Tür gehen willst.","Bize pek çok kişi katılmak istiyor. Bu kapıdan içeri girebilmek için bundan fazlasıyla gelmen gerek.","","","DIA_Roscoe_WannaJoin_10_01","",""
"Scripts/content/Story/MISSIONS/DIA_ORG_840_Roscoe.d:145","Du schon wieder.","Yine sen.","","","DIA_Roscoe_ComeAgain_10_00","",""
"Scripts/content/Story/MISSIONS/DIA_ORG_840_Roscoe.d:182","Wo soll's denn hingehen?","Nereye gidiyorsun?","","","Info_Roscoe_FirstWarn_Info_10_00","",""
"Scripts/content/Story/MISSIONS/DIA_ORG_840_Roscoe.d:183","Ich will zu Lares.","Lares ile tanışmak istiyorum.","","","Info_Roscoe_FirstWarn_Info_15_01","",""
"Scripts/content/Story/MISSIONS/DIA_ORG_840_Roscoe.d:184","Lares ist hier - aber ohne guten Grund wirst du ihn nicht stören.","Lares burada - ama onu rahatsız edebilmek için iyi bir sebebin olmalı.","","","Info_Roscoe_FirstWarn_Info_10_02","",""
"Scripts/content/Story/MISSIONS/DIA_ORG_840_Roscoe.d:217","Du hörst wohl schlecht.","Sağır mısın?","","","Info_Roscoe_LastWarn_10_00","",""
"Scripts/content/Story/MISSIONS/DIA_ORG_855_Wolf.d:33","Wer bist du?","Sen kimsin?","","","DIA_Wolf_Hello.description","",""
"Scripts/content/Story/MISSIONS/DIA_ORG_855_Wolf.d:43","Wer bist du?","Sen kimsin?","","","DIA_Wolf_Hello_15_00","",""
"Scripts/content/Story/MISSIONS/DIA_ORG_855_Wolf.d:44","Ich bin Wolf, der Rüstungsbauer.","Ben Wolf. Zırh yaparım.","","","DIA_Wolf_Hello_09_01","",""
"Scripts/content/Story/MISSIONS/DIA_ORG_855_Wolf.d:71","Hey! Du bist jetzt einer von uns, Kleiner.","Hey! Artık bizden birisin, evlat!","","","DIA_Wolf_GreetORG_09_00","",""
"Scripts/content/Story/MISSIONS/DIA_ORG_855_Wolf.d:95","Handelst du noch mit was anderem?","Başka bir ürünle ticaret yapıyor musun?","","","Org_855_Wolf_TRADE_15_00","",""
"Scripts/content/Story/MISSIONS/DIA_ORG_855_Wolf.d:96","Ich kaufe Felle und Häute von den Jägern. Wenn du an so was rankommst, kauf' ich dir die Sachen ab.","Avcılardan post ve deri alıyorum. Sende de benzer bir şey varsa, alırım.","","","Org_855_Wolf_TRADE_09_01","",""
"Scripts/content/Story/MISSIONS/DIA_ORG_855_Wolf.d:109","Wie komme ich an Felle und Häute?","Nasıl post ve deri elde edebilirim?","","","Org_855_Wolf_WhereHunter.description","",""
"Scripts/content/Story/MISSIONS/DIA_ORG_855_Wolf.d:119","Wie komme ich an Felle und Häute?","Nasıl post ve deri elde edebilirim?","","","Org_855_Wolf_WhereHunter_15_00","",""
"Scripts/content/Story/MISSIONS/DIA_ORG_855_Wolf.d:120","Auf dem Weg zum Neuen Lager findest du Aidan. Er kann dir beibringen, wie du Tieren das Fell abziehst.","Yeni Kamp yolunda Aidan'a denk geleceksin. Hayvanların derisini nasıl yüzeceğini öğretebilir.","","","Org_855_Wolf_WhereHunter_09_01","",""
"Scripts/content/Story/MISSIONS/DIA_ORG_855_Wolf.d:121","Ratford und Drax treiben sich nördlich vom Alten Lager rum, auf dem Weg zum Austauschplatz.","Ratford ve Drax de Eski Kamp'ın kuzeyinde takılıyor. Ticaret bölgesine giden yolda.","","","Org_855_Wolf_WhereHunter_09_02","",""
"Scripts/content/Story/MISSIONS/DIA_ORG_855_Wolf.d:134","Ich suche eine bessere Rüstung.","Daha iyi bir zırh arıyorum.","","","DIA_Wolf_SellArmor.description","",""
"Scripts/content/Story/MISSIONS/DIA_ORG_855_Wolf.d:148","Ich suche eine bessere Rüstung.","Daha iyi bir zırh arıyorum.","","","DIA_Wolf_SellArmor_15_00","",""
"Scripts/content/Story/MISSIONS/DIA_ORG_855_Wolf.d:152","Jetzt, wo du einer von uns bist, kann ich dir eine verkaufen.","Artık bizden biri olduğuna göre, sana satış yapabilirim.","","","DIA_Wolf_SellArmor_09_01","",""
"Scripts/content/Story/MISSIONS/DIA_ORG_855_Wolf.d:161","Ich kann dir keine verkaufen. Lares reißt mir den Kopf ab, wenn ich unsere Rüstungen an Fremde verkaufe.","Sana bir şey satamam. Yabancılara zırh satacak olursam, Lares beni öldürür.","","","DIA_Wolf_SellArmor_WRONGGUILD_09_00","",""
"Scripts/content/Story/MISSIONS/DIA_ORG_855_Wolf.d:172","Ich möchte die mittlere Rüstung haben.","Orta sağlamlıkta bir zırh istiyorum.","","","DIA_Wolf_SellArmor_M_15_01","",""
"Scripts/content/Story/MISSIONS/DIA_ORG_855_Wolf.d:176","Ohne Erz gibt es auch keine Rüstung.","Cevher yoksa, zırh da yok.","","","DIA_Wolf_SellArmor_M_09_02","",""
"Scripts/content/Story/MISSIONS/DIA_ORG_855_Wolf.d:180","Eine gute Rüstung.Noch nicht so gut, wie das, was ich trage, aber sie bietet ausreichend Schutz.","Bu iyi bir zırh. Benim üzerimdeki kadar iyi değil ama yine de yeterince koruma sağlar.","","","DIA_Wolf_SellArmor_M_09_03","",""
"Scripts/content/Story/MISSIONS/DIA_ORG_855_Wolf.d:194","Kannst du mir eine schwere Rüstung verkaufen?","Bana ağır zırh satabilir misin?","","","DIA_Wolf_SellArmor_H_15_01","",""
"Scripts/content/Story/MISSIONS/DIA_ORG_855_Wolf.d:198","Ohne Erz gibt es auch keine Rüstung.","Cevher yoksa, zırh ta yok.","","","DIA_Wolf_SellArmor_H_09_02","",""
"Scripts/content/Story/MISSIONS/DIA_ORG_855_Wolf.d:202","Diese Rüstung wird dich vor allen Gefahren schützen! Ich trage sie auch und habe bisher überlebt. Nicht zuletzt dank der Rüstung.","Bu zırh seni her türlü tehlikeden koruyacak! Bende bundan giyiyorum ve şimdiye kadar hayatta kalmayı başardım. Zırhın payı hiç de az değil.","","","DIA_Wolf_SellArmor_H_09_03","",""
"Scripts/content/Story/MISSIONS/DIA_ORG_855_Wolf.d:223","Ich möchte den richtigen Umgang mit dem Bogen lernen","Yay tutmayı öğrenmek istiyorum.","","","ORG_855_Wolf_TRAINOFFER.description","",""
"Scripts/content/Story/MISSIONS/DIA_ORG_855_Wolf.d:236","Ich möchte den richtigen Umgang mit dem Bogen lernen.","Yay tutmayı öğrenmek istiyorum.","","","ORG_855_Wolf_TRAINOFFER_Info_15_01","",""
"Scripts/content/Story/MISSIONS/DIA_ORG_855_Wolf.d:237","Kann ich dir beibringen. Das ist aber keine Gefälligkeit, denn auch ich muss essen.","Öğretebilirim. Fakat hayır için yapmam. Ne de olsa, benim de karnım doymalı.","","","ORG_855_Wolf_TRAINOFFER_Info_09_02","",""
"Scripts/content/Story/MISSIONS/DIA_ORG_855_Wolf.d:238","Wie viel?","Ne kadar?","","","ORG_855_Wolf_TRAINOFFER_Info_15_03","",""
"Scripts/content/Story/MISSIONS/DIA_ORG_855_Wolf.d:239","Alles, was ich dir beibringe, kostet dich 50 Erz. Ich feilsche nicht.","Öğreteceğim her şey sana 50 cevhere patlar. Pazarlık yok.","","","ORG_855_Wolf_TRAINOFFER_Info_09_04","",""
"Scripts/content/Story/MISSIONS/DIA_ORG_855_Wolf.d:268","Bring mir den Umgang mit dem Bogen bei.","Bana yay kullanmayı öğret.","","","ORG_855_Wolf_TRAIN_Info_15_01","",""
"Scripts/content/Story/MISSIONS/DIA_ORG_855_Wolf.d:273","Deine Geschicklichkeit ist das Maß für einen Treffer. Je geschickter du wirst, umso genauer werden deine Pfeile ihr Ziel treffen.","Vuruşların becerine bağlıdır. Ne kadar beceri sahibiysen, oklarının hedefi vurma olasılığı da o kadar yüksek demektir.","","","ORG_855_Wolf_TRAIN_Info_09_02","",""
"Scripts/content/Story/MISSIONS/DIA_ORG_855_Wolf.d:274","Dein Talent bestimmt, auf welche Reichweite du dein Ziel noch triffst. Um ein guter Schütze zu werden, solltest du beides zu gleichen Teilen steigern.","Yeteneğin ise rakibini vurabileceğin maksimum mesafeyi belirler. İyi bir okçu olabilmek için, ikisini de geliştirmelisin.","","","ORG_855_Wolf_TRAIN_Info_09_03","",""
"Scripts/content/Story/MISSIONS/DIA_ORG_855_Wolf.d:303","Ich will mein Talent mit dem Bogen verbessern.","Yay kullanma becerimi geliştirmek istiyorum.","","","ORG_855_Wolf_TRAINAGAIN_Info_15_01","",""
"Scripts/content/Story/MISSIONS/DIA_ORG_855_Wolf.d:308","Du bist jetzt schon ein guter Jäger. Erfahre nun das letzte Wissen.","Zaten iyi bir avcısın. Şimdi işin geri kalan kısmını öğreneceksin.","","","ORG_855_Wolf_TRAINAGAIN_Info_09_02","",""
"Scripts/content/Story/MISSIONS/DIA_ORG_855_Wolf.d:309","Um ein Meisterschütze zu werden, musst du aufhören, einer sein zu wollen.","İyi bir okçu olmak için, iyi bir okçu olmayı hedeflemeyi bırak.","","","ORG_855_Wolf_TRAINAGAIN_Info_09_03","",""
"Scripts/content/Story/MISSIONS/DIA_ORG_855_Wolf.d:310","Erkenne das Gesetz von Auge, Spannkraft, Flugbahn und Ziel. Sei immer auf der Hut, sei immer bereit.","Göz, gerilim, yörünge ve hedef arasındaki doğal kanunu keşfet. Her zaman dikkatli ve hazırlıklı ol.","","","ORG_855_Wolf_TRAINAGAIN_Info_09_04","",""
"Scripts/content/Story/MISSIONS/DIA_ORG_855_Wolf.d:311","Die Technik beherrschst du schon lange zur Genüge. Geh einfach hin und wende dein Wissen und Können an.","İşte şimdi teknikte pekala ustalaştın. Gidip bilgi ve yeteneğini uygulamaya koyul.","","","ORG_855_Wolf_TRAINAGAIN_Info_09_05","",""
"Scripts/content/Story/MISSIONS/DIA_ORG_855_Wolf.d:328","Kannst du mir was beibringen?","Bana bir şey öğretebilir misin?","","","ORG_855_Wolf_Teach.description","",""
"Scripts/content/Story/MISSIONS/DIA_ORG_855_Wolf.d:341","Kannst du mir was beibringen?","Bana bir şey öğretebilir misin?","","","ORG_855_Wolf_Teach_15_00","",""
"Scripts/content/Story/MISSIONS/DIA_ORG_855_Wolf.d:342","Deine Geschicklichkeit bestimmt den Jagderfolg.","Becerin, avın ne kadar başarılı olacağını belirler.","","","ORG_855_Wolf_Teach_09_01","",""
"Scripts/content/Story/MISSIONS/DIA_ORG_855_Wolf.d:397","Gorn sagt, du wolltest dringend mit mir sprechen?","Gorn acilen benimle konuşmak istediğini söyledi.","","","Info_Wolf_GOOD.description","",""
"Scripts/content/Story/MISSIONS/DIA_ORG_855_Wolf.d:410","Gorn sagt, du wolltest dringend mit mir sprechen?","Gorn acilen benimle konuşmak istediğini söyledi.","","","Info_Wolf_GOOD_15_01","",""
"Scripts/content/Story/MISSIONS/DIA_ORG_855_Wolf.d:411","Gut, dass du vorher noch vorbeikommst!","İyi ki gitmeden önce uğradın!","","","Info_Wolf_GOOD_09_02","",""
"Scripts/content/Story/MISSIONS/DIA_ORG_855_Wolf.d:414","Vor was?","Nereye gitmeden önce?","","","Info_Wolf_GOOD_15_03","",""
"Scripts/content/Story/MISSIONS/DIA_ORG_855_Wolf.d:415","Vor eurem Besuch in der nicht mehr ganz so Freien Mine.","Pek-Özgür-Olmayan-Maden'e gitmeden önce.","","","Info_Wolf_GOOD_09_04","",""
"Scripts/content/Story/MISSIONS/DIA_ORG_855_Wolf.d:428","Worum geht es?","Ne oldu?","","","Info_Wolf_SPEAK.description","",""
"Scripts/content/Story/MISSIONS/DIA_ORG_855_Wolf.d:441","Worum geht es?","Ne oldu?","","","Info_Wolf_SPEAK_15_01","",""
"Scripts/content/Story/MISSIONS/DIA_ORG_855_Wolf.d:442","Ich hatte neulich eine Idee, wie wir völlig neue Rüstungen herstellen können.","Tamamen yeni tip bir zırh üretebilmek için bir fikrim var.","","","Info_Wolf_SPEAK_09_02","",""
"Scripts/content/Story/MISSIONS/DIA_ORG_855_Wolf.d:443","Aha, und wie?","Oh, nasıl peki?","","","Info_Wolf_SPEAK_15_03","",""
"Scripts/content/Story/MISSIONS/DIA_ORG_855_Wolf.d:444","Das härteste Material, dass ich kenne, sind die Panzerplatten der Minecrawler.","Maden deşenlerin zırhlı plakaları bildiğim en sert materyal.","","","Info_Wolf_SPEAK_09_04","",""
"Scripts/content/Story/MISSIONS/DIA_ORG_855_Wolf.d:445","Nicht etwa die der kleinen, harmlosen Exemplare aus der jetzt verschütteten Mine von Gomez ...","Gomez'in çökmüş madenindeki ufak, zararsız türlerini demiyorum tabii ki...","","","Info_Wolf_SPEAK_09_05","",""
"Scripts/content/Story/MISSIONS/DIA_ORG_855_Wolf.d:446","...NEEEEIN. Die nicht. In unserer Mine lebt eine wesentlich gefährlichere Unterart.","... HAYIIIIR. Onlar değil. Bizim madenimizde çok daha tehlikeli bir türü var.","","","Info_Wolf_SPEAK_09_06","",""
"Scripts/content/Story/MISSIONS/DIA_ORG_855_Wolf.d:447","Der Panzer dieser Biester ist fast nicht zu durchdringen!","O canavarların zırhını delmek neredeyse imkansız!","","","Info_Wolf_SPEAK_09_07","",""
"Scripts/content/Story/MISSIONS/DIA_ORG_855_Wolf.d:448","Wenn du mir einige dieser Panzerplatten bringen könntest, würde ich versuchen, daraus eine Rüstung herzustellen.","Bana o zırh plakalarından birkaç tane getirecek olursan, onları kullanarak bir zırh yapayı deneyebilirim.","","","Info_Wolf_SPEAK_09_08","",""
"Scripts/content/Story/MISSIONS/DIA_ORG_855_Wolf.d:460","Wie bekomme ich diese Platten von den Biestern ab?","Plakaları etlerinden nasıl ayırabilirim?","","","Info_Wolf_SKIN.description","",""
"Scripts/content/Story/MISSIONS/DIA_ORG_855_Wolf.d:473","Wie bekomme ich diese Platten von den Biestern ab?","Plakaları etlerinden nasıl ayırabilirim?","","","Info_Wolf_SKIN_15_01","",""
"Scripts/content/Story/MISSIONS/DIA_ORG_855_Wolf.d:474","Das ist relativ einfach. Die Rückenplatten sind nur an deren Rändern mit dem Körper verwachsen.","Çok basit. Arka plakaları bedenlerine yalnızca köşelerinden bağlı.","","","Info_Wolf_SKIN_09_02","",""
"Scripts/content/Story/MISSIONS/DIA_ORG_855_Wolf.d:475","Nimm einfach ein Rasiermesser und schneide halbschräg an den Rändern entlang.","Eline ustura alıp plakayı ayıracaksın. İşaretli yeri kesmekten farkı yok.","","","Info_Wolf_SKIN_09_03","",""
"Scripts/content/Story/MISSIONS/DIA_ORG_855_Wolf.d:476","Okay, kapiert! Mal sehen, ob ich solche Panzerplatten finden kann.","Tamam, anladım! İstediğin zırh plakalarını bulmaya çalışacağım.","","","Info_Wolf_SKIN_15_04","",""
"Scripts/content/Story/MISSIONS/DIA_ORG_855_Wolf.d:500","Und diese Information gibst du mir völlig uneigennützig?","Bunun karşılığında kendin için de bir şey istemeyecek misin?","","","Info_Wolf_PROFIT.description","",""
"Scripts/content/Story/MISSIONS/DIA_ORG_855_Wolf.d:513","Und diese Information gibst du mir völlig uneigennützig?","Bunun karşılığında kendin için de bir şey istemeyecek misin?","","","Info_Wolf_PROFIT_15_01","",""
"Scripts/content/Story/MISSIONS/DIA_ORG_855_Wolf.d:514","Nicht ganz ... Wenn es mir gelingt, aus solchen Platten eine gute Rüstung zu zimmern, werde ich sehr schnell ... sehr viel ... Ach, lassen wird das!","Aslında hayır... Bu plakalardan iyi bir zırh yapmayı becerebilirsem, ben... çok çabuk... çok... ah, boş ver!","","","Info_Wolf_PROFIT_09_02","",""
"Scripts/content/Story/MISSIONS/DIA_ORG_855_Wolf.d:526","Ich habe einige der Minecrawler-Panzerplatten eingesammelt!","Bahsettiğin maden deşen plakalarından topladım!","","","Info_Wolf_MCPLATESFEW.description","",""
"Scripts/content/Story/MISSIONS/DIA_ORG_855_Wolf.d:541","Ich habe einige der Minecrawler-Panzerplatten eingesammelt!","Bahsettiğin maden deşen plakalarından topladım!","","","Info_Wolf_MCPLATESFEW_15_01","",""
"Scripts/content/Story/MISSIONS/DIA_ORG_855_Wolf.d:542","Zu wenig! Das reicht nicht für eine ganze Rüstung!","Bu yetmez! Zırh yapabilmek için daha fazla lazım!","","","Info_Wolf_MCPLATESFEW_09_02","",""
"Scripts/content/Story/MISSIONS/DIA_ORG_855_Wolf.d:543","Bring mir mehr von diesen Platten!","Bu plakalardan biraz daha getir!","","","Info_Wolf_MCPLATESFEW_09_03","",""
"Scripts/content/Story/MISSIONS/DIA_ORG_855_Wolf.d:555","Ich habe jede Menge dieser Minecrawler-Panzerplatten eingesammelt!","Bahsettiğin plakalardan bir sürü topladım!","","","Info_Wolf_MCPLATESENOUGH.description","",""
"Scripts/content/Story/MISSIONS/DIA_ORG_855_Wolf.d:569","Ich habe jede Menge dieser Minecrawler-Panzerplatten eingesammelt!","Bahsettiğin plakalardan bir sürü topladım!","","","Info_Wolf_MCPLATESENOUGH_15_01","",""
"Scripts/content/Story/MISSIONS/DIA_ORG_855_Wolf.d:570","Fantastisch!!! Ich werde mich gleich an die Arbeit machen!","Harika!!! Hemen işe koyuluyorum!","","","Info_Wolf_MCPLATESENOUGH_09_02","",""
"Scripts/content/Story/MISSIONS/DIA_ORG_855_Wolf.d:571","Wie lange wirst du dafür brauchen?","Zırhı yapman ne kadar sürecek?","","","Info_Wolf_MCPLATESENOUGH_15_03","",""
"Scripts/content/Story/MISSIONS/DIA_ORG_855_Wolf.d:572","Ich habe nicht die geringste Ahnung. Das ist eine komplette Neuentwicklung, Mann!","En ufak bir fikrim bile yok. Tamamen yeni bir üretim bu, dostum!","","","Info_Wolf_MCPLATESENOUGH_09_04","",""
"Scripts/content/Story/MISSIONS/DIA_ORG_855_Wolf.d:573","Schau einfach ab und zu bei mir rein, wenn du in der Nähe bist!","Buraya tekrar geldiğin zaman yanıma uğrarsın!","","","Info_Wolf_MCPLATESENOUGH_09_05","",""
"Scripts/content/Story/MISSIONS/DIA_ORG_855_Wolf.d:594","Wie weit bist du mit der Rüstung?","Zırh ne durumda?","","","Info_Wolf_ARMORINWORK.description","",""
"Scripts/content/Story/MISSIONS/DIA_ORG_855_Wolf.d:608","Wie weit bist du mit der Rüstung?","Zırh ne durumda?","","","Info_Wolf_ARMORINWORK_15_01","",""
"Scripts/content/Story/MISSIONS/DIA_ORG_855_Wolf.d:609","Dauert noch, Mann! Diese Platten sind verdammt harter Tobak. Ich habe noch keinen Weg gefunden, sie aneinander zu befestigen!","Biraz zaman alacak dostum! Bu plakalar gerçekten ağır materyaller. Birbirlerine nasıl tutturabileceğimi hala bulamadım!","","","Info_Wolf_ARMORINWORK_09_02","",""
"Scripts/content/Story/MISSIONS/DIA_ORG_855_Wolf.d:610","Gib mir noch etwas Zeit, ich bekomme das schon hin!","Bana biraz daha zaman ver, halledeceğim!","","","Info_Wolf_ARMORINWORK_09_03","",""
"Scripts/content/Story/MISSIONS/DIA_ORG_855_Wolf.d:623","Wie weit bist du mit der Rüstung? ","Zırh konusunda ilerleme var mı? ","","","Info_Wolf_ARMORFINISHED.description","",""
"Scripts/content/Story/MISSIONS/DIA_ORG_855_Wolf.d:637","Wie weit bist du mit der Rüstung?","Zırh konusunda ilerleme var mı?","","","Info_Wolf_ARMORFINISHED_15_01","",""
"Scripts/content/Story/MISSIONS/DIA_ORG_855_Wolf.d:638","Ich habe endlich einen Weg gefunden, diese üblen Panzerplatten aneinander zu befestigen!","Zırh plakalarını birbirine bağlamanın yolunu nihayet bulabildim!","","","Info_Wolf_ARMORFINISHED_09_02","",""
"Scripts/content/Story/MISSIONS/DIA_ORG_855_Wolf.d:639","Das heißt, die Rüstung ist fertig?","Yani zırh tamamlandı mı?","","","Info_Wolf_ARMORFINISHED_15_03","",""
"Scripts/content/Story/MISSIONS/DIA_ORG_855_Wolf.d:640","Ja, Mann. Hier ist sie. Scheint tatsächlich noch härter zu sein als alles, was in unserem Lager so getragen wird.","Evet dostum. İşte burada. Kamptaki diğer zırhların tamamından daha sağlam gözüküyor.","","","Info_Wolf_ARMORFINISHED_09_04","",""
"Scripts/content/Story/MISSIONS/DIA_ORG_855_Wolf.d:641","Danke, du hast was gut bei mir!","Teşekkürler, sana borçlandım!","","","Info_Wolf_ARMORFINISHED_15_05","",""
"Scripts/content/Story/MISSIONS/DIA_ORG_855_Wolf.d:642","Ach, ist schon in Ordnung! Ich komme schon auf meine Kosten!","Sorun değil! Her zaman masraflarımı karşılamanın bir yolunu bulurum!","","","Info_Wolf_ARMORFINISHED_09_06","",""
"Scripts/content/Story/MISSIONS/DIA_ORG_855_Wolf.d:662","Wo kann ich denn hier einen Bogen bekommen?","Burada yay alabileceğim bir yer var mı?","","","Org_855_Wolf_SELLBOW.description","",""
"Scripts/content/Story/MISSIONS/DIA_ORG_855_Wolf.d:672","Wo kann ich denn hier einen Bogen bekommen?","Burada yay alabileceğim bir yer var mı?","","","Org_855_Wolf_SELLBOW_Info_15_01","",""
"Scripts/content/Story/MISSIONS/DIA_ORG_855_Wolf.d:673","Da bist du bei mir genau richtig. Für gutes Erz bekommst du gute Ware.","Doğru yere geldin. İyi cevher karşılığında iyi mallarım var.","","","Org_855_Wolf_SELLBOW_Info_09_02","",""
"Scripts/content/Story/MISSIONS/DIA_ORG_860_Renyu.d:47","Verpiß dich!","Kaybol!","","","Org_860_Renyu_GetLost_Info_06_00","",""
"Scripts/content/Story/MISSIONS/DIA_ORG_861_Killian.d:8","ENDE","SON","","","ORG_861_Killian_Exit.description","",""
"Scripts/content/Story/MISSIONS/DIA_ORG_861_Killian.d:44","Verpiß dich!","Kaybol!","","","Org_861_Killian_GetLost_Info_13_00","",""
"Scripts/content/Story/MISSIONS/DIA_ORG_862_Jacko.d:49","Was zum Teufel machst du hier?","Ne işin var burada?","","","ORG_862_Jacko_GoAway_Info_06_00","",""
"Scripts/content/Story/MISSIONS/DIA_ORG_862_Jacko.d:77","Na, haben wir uns verlaufen?","Yolumuzu kaybettik galiba?","","","ORG_862_Jacko_GUARD_Info_06_00","",""
"Scripts/content/Story/MISSIONS/DIA_ORG_862_Jacko.d:78","Cor Kalom weiß von eurem kleinen Unternehmen.","Cor Kalom küçük işletmenizden haberdar.","","","ORG_862_Jacko_GUARD_Info_15_01","",""
"Scripts/content/Story/MISSIONS/DIA_ORG_862_Jacko.d:79","Was? Warum bist du hier?","Ne? Ne için geldin?","","","ORG_862_Jacko_GUARD_Info_06_02","",""
