"location","source","target","id","fuzzy","context","translator_comments","developer_comments"
"Scripts/content/Story/MISSIONS/DIA_XardasDemon.d:20","... Sterblicher? ... Wer, ich? ... Ich geh ja schon!","... Ölümlü mü?... Kim, ben mi?... Tamamdır, yola koyuluyorum!","","","Info_Saturas_EXIT_15_01","",""
"Scripts/content/Story/MISSIONS/DIA_XardasDemon.d:55","Moment... Wer... Wer spricht hier.","Dur bir dakika... Kim... Benimle konuşan kim?","","","Info_XardasDemon_INTRO_15_01","",""
"Scripts/content/Story/MISSIONS/DIA_XardasDemon.d:57","DUUUU sprichst zu mir ??? Wie ... wie kommst du in meinen Kopf?","SEN mi konuşuyorsun??? Kafamın içine nasıl girdin?","","","Info_XardasDemon_INTRO_15_02","",""
"Scripts/content/Story/MISSIONS/DIA_XardasDemon.d:59","Du bist was? ... der Diener deines Herren?","Nesin?... Efendinin hizmetkarı mısın?","","","Info_XardasDemon_INTRO_15_03","",""
"Scripts/content/Story/MISSIONS/DIA_XardasDemon.d:60","Du erscheinst mir eher wie eine Kreatur der Hölle!","Cehennemden çıkmış bir yaratığa benziyorsun!","","","Info_XardasDemon_INTRO_15_04","",""
"Scripts/content/Story/MISSIONS/DIA_XardasDemon.d:62","Ich soll schweigen?","Sessiz mi olayım?","","","Info_XardasDemon_INTRO_15_05","",""
"Scripts/content/Story/MISSIONS/DIA_XardasDemon.d:74","Heißt Dein Herr und Meister zufällig Xardas?","Efendinin ismi Xardas olabilir mi?","","","Info_XardasDemon_MASTERWHO.description","",""
"Scripts/content/Story/MISSIONS/DIA_XardasDemon.d:87","Heißt dein Herr und Meister zufällig Xardas?","Efendinin ismi Xardas olabilir mi?","","","Info_XardasDemon_MASTERWHO_15_01","",""
"Scripts/content/Story/MISSIONS/DIA_XardasDemon.d:89","Aha ... Namen sind also unwichtig ... Okay.","Ah, tamam... İsimlerin önemi yok... Anladım.","","","Info_XardasDemon_MASTERWHO_15_02","",""
"Scripts/content/Story/MISSIONS/DIA_XardasDemon.d:90","Ich gehe einfach mal davon aus, dass das hier der Turm von Xardas ist.","Bu kulenin Xardas'a ait olduğunu varsayıyorum o zaman.","","","Info_XardasDemon_MASTERWHO_15_03","",""
"Scripts/content/Story/MISSIONS/DIA_XardasDemon.d:102","Ich muss mit deinem Meister sprechen!","Efendin ile konuşmam gerekiyor!","","","Info_XardasDemon_MASTERHOW.description","",""
"Scripts/content/Story/MISSIONS/DIA_XardasDemon.d:115","Ich muss mit deinem Meister sprechen!","Efendin ile konuşmam gerekiyor!","","","Info_XardasDemon_MASTERHOW_15_01","",""
"Scripts/content/Story/MISSIONS/DIA_XardasDemon.d:117","... Ich? ... unwürdig?? ... Was für ein Test???","... Ben?... Layık değil miyim??.. Nasıl bir test???","","","Info_XardasDemon_MASTERHOW_15_02","",""
"Scripts/content/Story/MISSIONS/DIA_XardasDemon.d:119","... Aaahhhh ... Ich verstehe ... wer deinen Meister sprechen will, muss sich würdig erweisen!","... Aaaah... Anladım... Efendinle konuşmak isteyen her kimse önce buna layık olduğunu göstermeli!","","","Info_XardasDemon_MASTERHOW_15_03","",""
"Scripts/content/Story/MISSIONS/DIA_XardasDemon.d:120","... Moment, wie war das? ... Der Beweis? ... Sieg über was? ... Sieg über die Elemente?","... Dur biraz, ne dedin?... Kanıt mı?... Neye karşı zafer?... Elementlere karşı zafer mi?","","","Info_XardasDemon_MASTERHOW_15_04","",""
"Scripts/content/Story/MISSIONS/DIA_XardasDemon.d:121","... Stein? ... Eis? ... Feuer?","... Taş?... Buz?... Ateş?","","","Info_XardasDemon_MASTERHOW_15_05","",""
"Scripts/content/Story/MISSIONS/DIA_XardasDemon.d:138","Du sprichst in Rätseln!","Bulmaca gibi konuşuyorsun!","","","Info_XardasDemon_NOHEART.description","",""
"Scripts/content/Story/MISSIONS/DIA_XardasDemon.d:155","Du sprichst in Rätseln!","Bulmaca gibi konuşuyorsun!","","","Info_XardasDemon_NOHEART_15_01","",""
"Scripts/content/Story/MISSIONS/DIA_XardasDemon.d:157","... Das hast du schon mal gesagt, du wiederholst dich!","... Bunu zaten söyledin, kendini tekrar ediyorsun!","","","Info_XardasDemon_NOHEART_15_02","",""
"Scripts/content/Story/MISSIONS/DIA_XardasDemon.d:158","... Du willst Beweise für den Sieg über die Elemente Feuer, Eis und Stein!","... Yani ateş, buz ve taş elementlerine karşı zafer kazandığımı mı kanıtlamam gerekiyor?","","","Info_XardasDemon_NOHEART_15_03","",""
"Scripts/content/Story/MISSIONS/DIA_XardasDemon.d:169","... Was? ... Aha! ... Ein würdiger Beweis!","... Ne?... Doğru mu?... O kanıtları getirmem yeterli!","","","Info_XardasDemon_GIVEHEART_15_01","",""
"Scripts/content/Story/MISSIONS/DIA_XardasDemon.d:170","... Fehlen? ... Zwei fehlen noch?","... Kayıp? İkisi hala kayıp mı?","","","Info_XardasDemon_GIVEHEART_15_02","",""
"Scripts/content/Story/MISSIONS/DIA_XardasDemon.d:176","... Die Dualität? ... Der zweite Beweis?","... İkilem?... İkinci kanıt?","","","Info_XardasDemon_GIVEHEART_15_03","",""
"Scripts/content/Story/MISSIONS/DIA_XardasDemon.d:177","... Einer bleibt noch?","... Hala bir tanesi eksik mi?","","","Info_XardasDemon_GIVEHEART_15_04","",""
"Scripts/content/Story/MISSIONS/DIA_XardasDemon.d:183","... Vollkommenheit? ... Ich bin würdig?","... Mükemmel?... Layık mıyım?","","","Info_XardasDemon_GIVEHEART_15_05","",""
"Scripts/content/Story/MISSIONS/DIA_XardasDemon.d:184","Wenn das so ist, dann wünsche ich jetzt, deinen Meister zu sprechen!","Madem öyle, şimdi efendin ile konuşmak istiyorum!","","","Info_XardasDemon_GIVEHEART_15_06","",""
"Scripts/content/Story/MISSIONS/DIA_XardasDemon.d:185","... Gegenbeweis? ... Was für einen Gegenbeweis? ... Eine Rune? ... Eine Rune für mich?","... Karşıt kanıt?... Nasıl bir karşıt kanıt?... Bir rün mü?... Benim için?","","","Info_XardasDemon_GIVEHEART_15_07","",""
"Scripts/content/Story/MISSIONS/DIA_XardasDemon.d:186","Nun, dann nehme ich die Rune der Teleportation als Zeichen der Würde an mich!","Tamam, bu teleport rününü liyakatimin bir kanıtı olarak alıyorum!","","","Info_XardasDemon_GIVEHEART_15_08","",""
"Scripts/content/Story/MISSIONS/DIA_XardasDemon.d:201","Ich habe hier das Herz eines Steingolems!","İşte, taş golemin kalbi!","","","Info_XardasDemon_STONEHEART.description","",""
"Scripts/content/Story/MISSIONS/DIA_XardasDemon.d:215","Ich habe hier das Herz eines Steingolems!","İşte, taş golemin kalbi!","","","Info_XardasDemon_STONEHEART_15_01","",""
"Scripts/content/Story/MISSIONS/DIA_XardasDemon.d:232","Ist dieses Herz eines Eisgolems ein Beweis?","Buz golemin kalbini kanıt olarak kabul edebilir misin?","","","Info_XardasDemon_ICEHEART.description","",""
"Scripts/content/Story/MISSIONS/DIA_XardasDemon.d:246","Ist dieses Herz eines Eisgolems ein Beweis?","Buz goleminin kalbini kanıt olarak kabul edebilir misin?","","","Info_XardasDemon_ICEHEART_15_01","",""
"Scripts/content/Story/MISSIONS/DIA_XardasDemon.d:262","Was ist mit diesem Herz des Feuergolems?","Ateş goleminin kalbi olur mu?","","","Info_XardasDemon_FIREHEART.description","",""
"Scripts/content/Story/MISSIONS/DIA_XardasDemon.d:276","Was ist mit diesem Herz des Feuergolems?","Ateş goleminin kalbi olur mu?","","","Info_XardasDemon_FIREHEART_15_01","",""
