"location","source","target","id","fuzzy","context","translator_comments","developer_comments"
"Scripts/content/Story/MISSIONS/DIA_EBR_100_Gomez.d:33","Ich bin gekommen, um dir meine Dienste anzubieten.","Hizmetlerimi sunmak için geldim.","","False","DIA_Gomez_Fault.description","",""
"Scripts/content/Story/MISSIONS/DIA_EBR_100_Gomez.d:46","Ich bin gekommen, um dir meine Dienste anzubieten.","Hizmetlerimi sunmak için geldim.","","False","DIA_Gomez_Fault_15_00","",""
"Scripts/content/Story/MISSIONS/DIA_EBR_100_Gomez.d:47","Du platzt hier einfach rein und erwartest, dass ich mich mit dir befasse, du Wurm? WACHE!","Karşıma elini kolunu sallayarak geliyorsun ve seninle ilgilenmemi mi bekliyorsun, seni sefil piç? MUHAFIZLAR!","","False","DIA_Gomez_Fault_11_01","",""
"Scripts/content/Story/MISSIONS/DIA_EBR_100_Gomez.d:67","Ich bin gekommen, um dir meine Dienste anzubieten.","Hizmetlerimi sunmak için geldim.","","False","DIA_Gomez_Hello.description","",""
"Scripts/content/Story/MISSIONS/DIA_EBR_100_Gomez.d:80","Ich bin gekommen, um dir meine Dienste anzubieten.","Hizmetlerimi sunmak için geldim.","","False","DIA_Gomez_Hello_15_00","",""
"Scripts/content/Story/MISSIONS/DIA_EBR_100_Gomez.d:81","Warum denkst du, dass wir an deinen Diensten interessiert sind?","Senin hizmetine ihtiyacımız olduğu sonucuna nasıl ulaştın?","","False","DIA_Gomez_Hello_11_01","",""
"Scripts/content/Story/MISSIONS/DIA_EBR_100_Gomez.d:84","Ich hoffe ich muss dir nicht erst den Kopf abhacken, um mich zu beweisen.","Umarım kendimi kanıtlamak için kafanı uçurmam gerekmiyordur.","","False","DIA_Gomez_Hello.DIA_Gomez_Hello_KopfAb","Info_AddChoice",""
"Scripts/content/Story/MISSIONS/DIA_EBR_100_Gomez.d:85","Weil hier nur Schwachköpfe rumrennen.","Burası taş kafalılarla dolu.","","False","DIA_Gomez_Hello.DIA_Gomez_Hello_Spinner","Info_AddChoice",""
"Scripts/content/Story/MISSIONS/DIA_EBR_100_Gomez.d:86","Ich bin viel rumgekommen und habe gute Kontakte in allen Lagern.","Buralarda epey gezip dolaştım ve her kampta bağlantılarım var.","","False","DIA_Gomez_Hello.DIA_Gomez_Hello_Kontakte","Info_AddChoice",""
"Scripts/content/Story/MISSIONS/DIA_EBR_100_Gomez.d:87","Ich habe die Prüfung des Vertrauens bestanden.","Güven testini geçtim.","","False","DIA_Gomez_Hello.DIA_Gomez_Hello_ThorusSays","Info_AddChoice",""
"Scripts/content/Story/MISSIONS/DIA_EBR_100_Gomez.d:92","Ich habe die Prüfung des Vertrauens bestanden und Thorus sagt, ich bin ein guter Mann.","Güven testini geçtim ve Thorus işe yarayacak biri olduğumu düşünüyor.","","False","DIA_Gomez_Hello_ThorusSays_15_00","",""
"Scripts/content/Story/MISSIONS/DIA_EBR_100_Gomez.d:93","Du wärst hier nicht lebend reingekommen, wenn das nicht so wäre. Ich hoffe, das war nicht schon alles.","Eğer öyle olmasaydı karşıma canlı halde gelemezdin. Umarım tüm maharetin bu kadar değildir.","","False","DIA_Gomez_Hello_ThorusSays_11_01","",""
"Scripts/content/Story/MISSIONS/DIA_EBR_100_Gomez.d:99","Ich bin viel in der Kolonie rumgekommen und habe gute Kontakte in allen Lagern.","Kolonide epey gezip dolaştım ve tüm kamplarda bağlantılarım var.","","False","DIA_Gomez_Hello_Kontakte_15_00","",""
"Scripts/content/Story/MISSIONS/DIA_EBR_100_Gomez.d:100","Das ist tatsächlich ein guter Grund. Zu wem hast du Kontakte?","Bak bu işimize yarayabilir. Kimlerle bağlantı kurdun?","","False","DIA_Gomez_Hello_Kontakte_11_01","",""
"Scripts/content/Story/MISSIONS/DIA_EBR_100_Gomez.d:102","Das waren alle wichtigen.","Önemli olanlar bunlardı.","","False","DIA_Gomez_Hello.DIA_Gomez_Hello_Kontakte_ThatsAll","Info_AddChoice",""
"Scripts/content/Story/MISSIONS/DIA_EBR_100_Gomez.d:103","Zu einigen Hehlern im Neuen Lager.","Yeni Kamp'taki bazı kaçakçılar.","","False","DIA_Gomez_Hello.DIA_Gomez_Hello_Kontakte_NLHehler","Info_AddChoice",""
"Scripts/content/Story/MISSIONS/DIA_EBR_100_Gomez.d:104","Zu Lares.","Lares.","","False","DIA_Gomez_Hello.DIA_Gomez_Hello_Kontakte_Lares","Info_AddChoice",""
"Scripts/content/Story/MISSIONS/DIA_EBR_100_Gomez.d:106","Zu einigen Baals aus dem Lager der Bruderschaft.","Kardeşliğin kampındaki birkaç Baal.","","False","DIA_Gomez_Hello.DIA_Gomez_Hello_Kontakte_Baals","Info_AddChoice",""
"Scripts/content/Story/MISSIONS/DIA_EBR_100_Gomez.d:107","Zu Cor Kalom.","Cor Kalom.","","False","DIA_Gomez_Hello.DIA_Gomez_Hello_Kontakte_Kalom","Info_AddChoice",""
"Scripts/content/Story/MISSIONS/DIA_EBR_100_Gomez.d:111","Zu Y'Berion.","Y'Berion.","","False","DIA_Gomez_Hello.DIA_Gomez_Hello_Kontakte_YBerion","Info_AddChoice",""
"Scripts/content/Story/MISSIONS/DIA_EBR_100_Gomez.d:117","Weil hier nur Schwachköpfe rumrennen, die ihre Aufgaben lieber an Neulinge weitergeben, statt sie selber zu erledigen.","Burası taş kafalılarla dolu, hepsi kendi işini yeni gelenlere yıkma peşinde.","","False","DIA_Gomez_Hello_Spinner_15_00","",""
"Scripts/content/Story/MISSIONS/DIA_EBR_100_Gomez.d:118","Das ist zwar bis auf wenige Ausnahmen richtig, aber kein Grund einen weiteren Schwachkopf anzuheuern.","Birkaç istisnayı saymazsak, haklı olabilirsin. Yine de bu yeni bir taş kafayı işe almam için geçerli bir sebep değil.","","False","DIA_Gomez_Hello_Spinner_11_01","",""
"Scripts/content/Story/MISSIONS/DIA_EBR_100_Gomez.d:123","Ich hoffe ich muss dir nicht erst den Kopf abhacken, um dir zu beweisen, dass ich mit einer Waffe umgehen kann","Umarım silah kullanabildiğimi kanıtlamak için kafanı uçurmam gerekmez.","","False","DIA_Gomez_Hello_KopfAb_15_00","",""
"Scripts/content/Story/MISSIONS/DIA_EBR_100_Gomez.d:124","Mut und Dummheit liegen dicht beieinander ...","Cesaret ve aptallık arasında ince bir çizgi vardır...","","False","DIA_Gomez_Hello_KopfAb_11_01","",""
"Scripts/content/Story/MISSIONS/DIA_EBR_100_Gomez.d:136","Zu Y'Berion.","Y'Berion.","","False","DIA_Gomez_Hello_Kontakte_YBerion_15_00","",""
"Scripts/content/Story/MISSIONS/DIA_EBR_100_Gomez.d:137","Y'Berion gibt sich nicht mit Burschen wie dir ab.","Y'Berion senin gibi adamlarla vakit harcamaz.","","False","DIA_Gomez_Hello_Kontakte_YBerion_11_01","",""
"Scripts/content/Story/MISSIONS/DIA_EBR_100_Gomez.d:138","Dass du lügst, zeigt mir, dass du mich für dumm hältst.","Alenen yalan söylemen beni aptal yerine koyduğunu gösteriyor.","","False","DIA_Gomez_Hello_Kontakte_YBerion_11_02","",""
"Scripts/content/Story/MISSIONS/DIA_EBR_100_Gomez.d:139","Dass du mich für DUMM hältst, enttäuscht mich.","APTAL olduğumu düşünmen beni hayal kırıklığına uğrattı.","","False","DIA_Gomez_Hello_Kontakte_YBerion_11_03","",""
"Scripts/content/Story/MISSIONS/DIA_EBR_100_Gomez.d:140","Ich hasse es, enttäuscht zu werden.","Hayal kırıklığına uğramaktan nefret ederim.","","False","DIA_Gomez_Hello_Kontakte_YBerion_11_04","",""
"Scripts/content/Story/MISSIONS/DIA_EBR_100_Gomez.d:149","Zu Cor Kalom.","Cor Kalom.","","False","DIA_Gomez_Hello_Kontakte_Kalom_15_00","",""
"Scripts/content/Story/MISSIONS/DIA_EBR_100_Gomez.d:150","Und?","Başka?","","False","DIA_Gomez_Hello_Kontakte_Kalom_11_01","",""
"Scripts/content/Story/MISSIONS/DIA_EBR_100_Gomez.d:156","Zu einigen Baals aus dem Lager der Bruderschaft.","Kardeşliğin kampındaki birkaç Baal.","","False","DIA_Gomez_Hello_Kontakte_Baals_15_00","",""
"Scripts/content/Story/MISSIONS/DIA_EBR_100_Gomez.d:157","Und?","Başka?","","False","DIA_Gomez_Hello_Kontakte_Baals_11_01","",""
"Scripts/content/Story/MISSIONS/DIA_EBR_100_Gomez.d:177","Zu Lares.","Lares.","","False","DIA_Gomez_Hello_Kontakte_Lares_15_00","",""
"Scripts/content/Story/MISSIONS/DIA_EBR_100_Gomez.d:178","Und?","Başka?","","False","DIA_Gomez_Hello_Kontakte_Lares_11_01","",""
"Scripts/content/Story/MISSIONS/DIA_EBR_100_Gomez.d:184","Zu einigen Hehlern im Neuen Lager.","Yeni Kamp'taki bazı kaçakçılar.","","False","DIA_Gomez_Hello_Kontakte_NLHehler_15_00","",""
"Scripts/content/Story/MISSIONS/DIA_EBR_100_Gomez.d:185","Und?","Başka?","","False","DIA_Gomez_Hello_Kontakte_NLHehler_11_01","",""
"Scripts/content/Story/MISSIONS/DIA_EBR_100_Gomez.d:191","Das waren alle wichtigen.","Önemli olanlar bunlardı.","","False","DIA_Gomez_Hello_Kontakte_ThatsAll_15_00","",""
"Scripts/content/Story/MISSIONS/DIA_EBR_100_Gomez.d:194","Beachtlich - für einen Neuling wie dich ...","Acemi biri için - fena değil...","","False","DIA_Gomez_Hello_Kontakte_ThatsAll_11_01","",""
"Scripts/content/Story/MISSIONS/DIA_EBR_100_Gomez.d:195","Du sollst deine Chance kriegen.","Sana bir şans vereceğim.","","False","DIA_Gomez_Hello_Kontakte_ThatsAll_11_02","",""
"Scripts/content/Story/MISSIONS/DIA_EBR_100_Gomez.d:200","DAMIT willst du mich beeindrucken? Im Lager gibt es BUDDLER, die bessere Beziehungen haben!","Bana BUNLARLA mı geldin? Daha iyi bağlantıları olan madencilerimiz var!","","False","DIA_Gomez_Hello_Kontakte_ThatsAll_INSUFF_11_00","",""
"Scripts/content/Story/MISSIONS/DIA_EBR_100_Gomez.d:214","Heißt das, ich bin dabei?","Bu işe alındım mı demek?","","False","DIA_Gomez_Dabei.description","",""
"Scripts/content/Story/MISSIONS/DIA_EBR_100_Gomez.d:228","Heißt das, ich bin dabei?","Bu işe alındım mı demek?","","False","DIA_Gomez_Dabei_15_00","",""
"Scripts/content/Story/MISSIONS/DIA_EBR_100_Gomez.d:229","Genau das heißt es. Du bist jetzt einer von uns, Kleiner.","Aynen öyle. Artık bizden birisin, evlat.","","False","DIA_Gomez_Dabei_11_01","",""
"Scripts/content/Story/MISSIONS/DIA_EBR_100_Gomez.d:230","Alles Weitere wird dir Raven erzählen.","Raven gerekli her şeyi anlatacak.","","False","DIA_Gomez_Dabei_11_02","",""
"Scripts/content/Story/MISSIONS/DIA_EBR_100_Gomez.d:260","Ich wollte mal einen Zwischenbericht abgeben.","Rapor vermek için geldim.","","False","DIA_Gomez_NurSo.description","",""
"Scripts/content/Story/MISSIONS/DIA_EBR_100_Gomez.d:273","Ich wollte mal einen Zwischenbericht abgeben.","Rapor vermek için geldim.","","False","DIA_Gomez_NurSo_15_00","",""
"Scripts/content/Story/MISSIONS/DIA_EBR_100_Gomez.d:274","Dann geh zu Raven. Und sprich mich nie wieder an, ohne dass du dazu aufgefordert worden bist!","Öyleyse gidip Raven'ı gör. Ve de sana söylenmediği sürece bir daha benimle muhatap olma!","","False","DIA_Gomez_NurSo_11_00","",""
"Scripts/content/Story/MISSIONS/DIA_EBR_100_Gomez.d:304","Wie bist du denn hier rein gekommen?","Buraya nasıl girdin?","","False","DIA_EBR_100_Gomez_Wait4SC_11_01","",""
"Scripts/content/Story/MISSIONS/DIA_EBR_100_Gomez.d:305","Moment! Bist du nicht diese Pestzecke gewesen, die unsere Leute in der Freien Mine kalt gemacht hat?","Bekle! Sen Özgür Maden'de adamlarımızla kapışan kişi değil misin?","","False","DIA_EBR_100_Gomez_Wait4SC_11_02","",""
"Scripts/content/Story/MISSIONS/DIA_EBR_100_Gomez.d:306","Deine Leute hatten kein Recht, dort einzufallen. Ich habe diesen Anflug von Größenwahnsinn nur wieder korrigiert!","Adamlarının orayı işgal etmeye hakkı yoktu. Megalomanca hamlenize müdahale ettim!","","False","DIA_EBR_100_Gomez_Wait4SC_15_03","",""
"Scripts/content/Story/MISSIONS/DIA_EBR_100_Gomez.d:307","Du hast Mut, so mit mir - GOMEZ - zu sprechen, aber es war ziemlich dumm von dir, hier einfach aufzutauchen.","Benimle, GOMEZ ile bu şekilde konuşman cesur olduğunu gösteriyor. Ancak buraya kendi ayağınla gelerek ahmaklık ettin.","","False","DIA_EBR_100_Gomez_Wait4SC_11_04","",""
"Scripts/content/Story/MISSIONS/DIA_EBR_100_Gomez.d:308","Ich werde persönlich sicherstellen, dass du mir nie wieder in die Suppe spucken wirst.","Bir daha yoluma çıkmaman için seninle şahsen ilgileneceğim.","","False","DIA_EBR_100_Gomez_Wait4SC_11_05","",""
"Scripts/content/Story/MISSIONS/DIA_EBR_101_Scar.d:33","Wer bist du?","Sen kimsin?","","False","DIA_SCAR_Hello.description","",""
"Scripts/content/Story/MISSIONS/DIA_EBR_101_Scar.d:43","Wer bist du?","Sen kimsin?","","False","DIA_SCAR_Hello_15_00","",""
"Scripts/content/Story/MISSIONS/DIA_EBR_101_Scar.d:44","Sie nennen mich Scar.","Bana Scar diyorlar.","","False","DIA_SCAR_Hello_08_01","",""
"Scripts/content/Story/MISSIONS/DIA_EBR_101_Scar.d:56","Was ist deine Aufgabe hier?","İşin nedir?","","False","DIA_SCAR_What.description","",""
"Scripts/content/Story/MISSIONS/DIA_EBR_101_Scar.d:69","Was ist deine Aufgabe hier?","İşin nedir?","","False","DIA_SCAR_What_15_00","",""
"Scripts/content/Story/MISSIONS/DIA_EBR_101_Scar.d:70","Ich und Arto passen auf, dass Gomez niemand zu nahe kommt, der hier nicht eingeladen wurde,","Arto ile birlikte davetsiz misafirlerin Gomez'in yanına gelmediğinden emin oluyoruz.","","False","DIA_SCAR_What_08_01","",""
"Scripts/content/Story/MISSIONS/DIA_EBR_101_Scar.d:71","Außerdem kümmere ich mich darum, dass die Frauen hier nicht zu kurz kommen .","Ayrıca kadınların boş durmadığından da emin oluyorum.","","False","DIA_SCAR_What_08_02","",""
"Scripts/content/Story/MISSIONS/DIA_EBR_101_Scar.d:83","Als sie mich reingeworfen haben, habe ich eine Frau gesehen.","Buraya atılırken benimle birlikte bir kadın da içeri girdi...","","False","DIA_SCAR_Frau.description","",""
"Scripts/content/Story/MISSIONS/DIA_EBR_101_Scar.d:96","Als sie mich reingeworfen haben, habe ich gesehen, wie eine Frau zusammen mit den Waren heruntergefahren wurde.","Buraya atılırken bir kadının mallar ile birlikte içeri girdiğini gördüm.","","False","DIA_SCAR_Frau_15_00","",""
"Scripts/content/Story/MISSIONS/DIA_EBR_101_Scar.d:97","Und?","Ne olmuş?","","False","DIA_SCAR_Frau_08_01","",""
"Scripts/content/Story/MISSIONS/DIA_EBR_101_Scar.d:98","Ist sie hier?","Burada mı?","","False","DIA_SCAR_Frau_15_02","",""
"Scripts/content/Story/MISSIONS/DIA_EBR_101_Scar.d:99","Wenn du dich für sie interessierst, geb' ich dir einen guten Rat: Vergiss sie.","Bak, eğer kadını beğendiysen bir tavsiye vereyim: Unut o kadını.","","False","DIA_SCAR_Frau_08_03","",""
"Scripts/content/Story/MISSIONS/DIA_EBR_101_Scar.d:100","Sie ist gerade angekommen und Gomez hat sie bei sich auf dem Zimmer eingesperrt.","Buraya yeni geldi ve Gomez onu kendi odasına kilitledi.","","False","DIA_SCAR_Frau_08_04","",""
"Scripts/content/Story/MISSIONS/DIA_EBR_101_Scar.d:101","Wenn er sie 'ne Zeit lang gehabt hat, schickt er sie vielleicht runter. Aber jetzt gehört sie IHM - also verschwende besser keinen Gedanken an sie.","İşi bittiğinde aşağı gönderebilir. Şimdilik kadın ONUN - o yüzden aklından çıkar o kadını.","","False","DIA_SCAR_Frau_08_05","",""
"Scripts/content/Story/MISSIONS/DIA_EBR_101_Scar.d:114","Kannst du mir etwas über Gomez erzählen?","Bana Gomez hakkında söyleyebileceğin bir şeyler var mı?","","False","DIA_SCAR_PERM.description","",""
"Scripts/content/Story/MISSIONS/DIA_EBR_101_Scar.d:127","Kannst du mir etwas über Gomez erzählen?","Bana Gomez hakkında söyleyebileceğin bir şeyler var mı?","","False","DIA_SCAR_PERM_15_00","",""
"Scripts/content/Story/MISSIONS/DIA_EBR_101_Scar.d:128","Über ihn musst du nur wissen, dass er der mächtigste Mann der Kolonie ist.","Kolonideki en güçlü adam olduğunu bilmen yeterli.","","False","DIA_SCAR_PERM_08_01","",""
"Scripts/content/Story/MISSIONS/DIA_EBR_101_Scar.d:129","Er kann alles haben, was er will, aber das einzige, was ihn WIRKLICH interessiert, ist Einfluss.","Neyi istiyorsa onu sahip olur, istediği te şey de güç.","","False","DIA_SCAR_PERM_08_02","",""
"Scripts/content/Story/MISSIONS/DIA_EBR_102_Arto.d:33","Wer bist du?","Sen kimsin?","","False","DIA_ARTO_Hello.description","",""
"Scripts/content/Story/MISSIONS/DIA_EBR_102_Arto.d:43","Wer bist du?","Sen kimsin?","","False","DIA_ARTO_Hello_15_00","",""
"Scripts/content/Story/MISSIONS/DIA_EBR_102_Arto.d:44","Ich bin Arto.","Ben Arto.","","False","DIA_ARTO_Hello_13_01","",""
"Scripts/content/Story/MISSIONS/DIA_EBR_102_Arto.d:56","Was machst du so?","Burada ne yapıyorsun?","","False","DIA_ARTO_What.description","",""
"Scripts/content/Story/MISSIONS/DIA_EBR_102_Arto.d:69","Was machst du so?","Burada ne yapıyorsun?","","False","DIA_ARTO_What_15_00","",""
"Scripts/content/Story/MISSIONS/DIA_EBR_102_Arto.d:70","Ich bin Gomez' Leibwächter.","Gomez'in korumasıyım.","","False","DIA_ARTO_What_13_01","",""
"Scripts/content/Story/MISSIONS/DIA_EBR_102_Arto.d:83","Du redest nicht viel, was?","Pek konuşkan biri değilsin sanırım?","","False","DIA_ARTO_PERM.description","",""
"Scripts/content/Story/MISSIONS/DIA_EBR_102_Arto.d:96","Du redest nicht viel, was?","Pek konuşkan biri değilsin sanırım?","","False","DIA_ARTO_PERM_15_00","",""
"Scripts/content/Story/MISSIONS/DIA_EBR_102_Arto.d:97","Nein.","Hayır.","","False","DIA_ARTO_PERM_13_01","",""
"Scripts/content/Story/MISSIONS/DIA_EBR_105_Raven.d:47","Was kann ich für dich tun?","Sana nasıl yardımcı olabilirim?","","False","DIA_Raven_FirstIn_10_00","",""
"Scripts/content/Story/MISSIONS/DIA_EBR_105_Raven.d:59","Wer bist du?","Sen kimsin?","","False","DIA_Raven_Who.description","",""
"Scripts/content/Story/MISSIONS/DIA_EBR_105_Raven.d:69","Wer bist du?","Sen kimsin?","","False","DIA_Raven_Who_15_00","",""
"Scripts/content/Story/MISSIONS/DIA_EBR_105_Raven.d:70","Ich bin Raven. Gomez' rechte Hand. Jeder, der hier ist, um mit Gomez zu reden, redet vorher mit MIR.","Ben Raven. Gomez'in sağ koluyum. Gomez'i görmek isteyen herkes önce BENİMLE görüşür.","","False","DIA_Raven_Who_10_01","",""
"Scripts/content/Story/MISSIONS/DIA_EBR_105_Raven.d:82","Ich habe eine Ladung Kraut für Gomez von Cor Kalom.","Beni Cor Calom gönderdi. Gomez için biraz ot getirdim.","","False","DIA_Raven_Krautbote.description","",""
"Scripts/content/Story/MISSIONS/DIA_EBR_105_Raven.d:95","Ich habe eine Ladung Kraut für Gomez von Cor Kalom.","Beni Cor Calom gönderdi. Gomez için biraz ot getirdim.","","False","DIA_Raven_Krautbote_15_00","",""
"Scripts/content/Story/MISSIONS/DIA_EBR_105_Raven.d:96","Bartholo kümmert sich um diese Sachen, Gomez selbst gibt sich nicht mit Boten ab.","O işlere Bartholo bakıyor. Gomez boş işlerle uğraşmaz.","","False","DIA_Raven_Krautbote_10_01","",""
"Scripts/content/Story/MISSIONS/DIA_EBR_105_Raven.d:97","Du findest ihn in der Kammer hier rechts hinter dem Eingang oder in der Küche im großen Turm.","Onu içeri girdikten sonra sağdaki odada bulabilirsin, orada değilse büyük kuledeki mutfaktadır.","","False","DIA_Raven_Krautbote_10_02","",""
"Scripts/content/Story/MISSIONS/DIA_EBR_105_Raven.d:98","Nachts schläft er natürlich. Da würd' ich es nicht wagen, ihn zu stören.","Tabii geceleri uyuyor. Yerinde olsam rahatsız etmezdim.","","False","DIA_Raven_Krautbote_10_03","",""
"Scripts/content/Story/MISSIONS/DIA_EBR_105_Raven.d:112","Ich will zu Gomez. Thorus sagt, ich soll als Schatten aufgenommen werden.","Gomez ile görüşmek istiyorum. Thorus Gölgelere katılabileceğimi söyledi.","","False","DIA_Raven_Aufnahme.description","",""
"Scripts/content/Story/MISSIONS/DIA_EBR_105_Raven.d:126","Ich will zu Gomez. Thorus sagt, ich soll als Schatten aufgenommen werden.","Gomez ile görüşmek istiyorum. Thorus Gölgelere katılabileceğimi söyledi.","","False","DIA_Raven_Aufnahme_15_00","",""
"Scripts/content/Story/MISSIONS/DIA_EBR_105_Raven.d:127","Wir sind immer auf der Suche nach guten Leuten. Du scheinst mir nicht auf den Kopf gefallen zu sein. Du könntest es hier zu was bringen.","İyi adamlara her zaman kapımız açık. Kafası çalışan birine benziyorsun. Buraya uyum sağlayabilir gibisin.","","False","DIA_Raven_Aufnahme_10_01","",""
"Scripts/content/Story/MISSIONS/DIA_EBR_105_Raven.d:128","Ich werde dich zu Gomez führen. Folge mir. Und fass nichts an!","Seni Gomez'e götüreceğim. Hiçbir şeye dokunma!","","False","DIA_Raven_Aufnahme_10_02","",""
"Scripts/content/Story/MISSIONS/DIA_EBR_105_Raven.d:156","Dort hinten ist Gomez. Wenn du ihm keinen Respekt zeigst, werde ich dir persönlich welchen beibringen, ist das klar?","Gomez orada. Eğer saygılı olmazsan, sana saygının olduğunu öğretmekten büyük keyif alırım, anladın mı?","","False","DIA_Raven_There_10_01","",""
"Scripts/content/Story/MISSIONS/DIA_EBR_105_Raven.d:172","Wie steht der Erzhandel?","Cevher ticareti nasıl gidiyor?","","False","DIA_Raven_PERM.description","",""
"Scripts/content/Story/MISSIONS/DIA_EBR_105_Raven.d:185","Wie steht der Erzhandel?","Cevher ticareti nasıl gidiyor?","","False","DIA_Raven_PERM_15_00","",""
"Scripts/content/Story/MISSIONS/DIA_EBR_105_Raven.d:186","Die Alte Mine spuckt genug aus. Die letzte Lieferung aus der Außenwelt war ziemlich fett.","Eski Maden'de işler iyi. Dışarıdan son aldığımız mal oldukça yüklüydü.","","False","DIA_Raven_PERM_10_01","",""
"Scripts/content/Story/MISSIONS/DIA_EBR_105_Raven.d:198","Gomez sagt, ich bin dabei.","Gomez işe alındığımı söyledi.","","False","DIA_Raven_BinDabei.description","",""
"Scripts/content/Story/MISSIONS/DIA_EBR_105_Raven.d:217","Gomez sagt, ich bin dabei.","Gomez işe alındığımı söyledi.","","False","DIA_Raven_BinDabei_15_00","",""
"Scripts/content/Story/MISSIONS/DIA_EBR_105_Raven.d:218","Gut! Du kannst dich gleich bei deinem ersten Auftrag bewähren.","Harika! Madem öyle, ilk görevin ile değerini gösterebilirsin.","","False","DIA_Raven_BinDabei_10_01","",""
"Scripts/content/Story/MISSIONS/DIA_EBR_105_Raven.d:219","Wenn deine Verbindungen wirklich so gut sind, wie du sagst, solltest du keine Probleme damit haben.","Eğer bağlantıların dediğin kadar güçlüyse, senin için zor bir görev olmayacak.","","False","DIA_Raven_BinDabei_10_02","",""
"Scripts/content/Story/MISSIONS/DIA_EBR_105_Raven.d:235","Was soll ich für dich erledigen?","Ne yapmamı istiyorsun?","","False","DIA_Raven_SpySect.description","",""
"Scripts/content/Story/MISSIONS/DIA_EBR_105_Raven.d:248","Was soll ich für dich erledigen?","Ne yapmamı istiyorsun?","","False","DIA_Raven_SpySect_15_00","",""
"Scripts/content/Story/MISSIONS/DIA_EBR_105_Raven.d:249","Wir stehen mit der Bruderschaft in Handelskontakt. Das bedeutet nicht, das wir ihnen unbedingt vertrauen.","Kardeşlik ile geniş bir ticaret ağına sahibiz. Lakin bu onlara güvendiğimiz anlamına gelmiyor.","","False","DIA_Raven_SpySect_10_01","",""
"Scripts/content/Story/MISSIONS/DIA_EBR_105_Raven.d:250","Mach dich auf den Weg in den Sumpf.","Bataklığa git.","","False","DIA_Raven_SpySect_10_02","",""
"Scripts/content/Story/MISSIONS/DIA_EBR_105_Raven.d:251","Wenn du dort im Lager bist, halte die Ohren auf. Alles was du erfährst, kann für uns nützlich sein.","Kampa vardığında, kulaklarını iyice aç. Edineceğin her bilgi işimize yarayabilir.","","False","DIA_Raven_SpySect_10_03","",""
"Scripts/content/Story/MISSIONS/DIA_EBR_105_Raven.d:252","Und je mehr du erfährst, desto besser. Das Ganze erfordert ein gewisses Feingefühl. Du weißt, was ich meine?","Ne kadar çok bilgi edinirsen, o kadar iyi. Ancak bu ince bir iş, ne demek istediğimi anlamışsındır.","","False","DIA_Raven_SpySect_10_04","",""
"Scripts/content/Story/MISSIONS/DIA_EBR_105_Raven.d:253","Bleib ruhig, ich werde ihren Zorn nicht heraufbeschwören.","Rahat ol, onları kızdıracak değilim.","","False","DIA_Raven_SpySect_15_05","",""
"Scripts/content/Story/MISSIONS/DIA_EBR_105_Raven.d:254","Ich wusste, dass du mich verstehen würdest.","Anladığını biliyordum.","","False","DIA_Raven_SpySect_10_06","",""
"Scripts/content/Story/MISSIONS/DIA_EBR_105_Raven.d:272","Wo bekomme ich bessere Ausrüstung her?","Nereden daha iyi ekipman alabilirim?","","False","DIA_Raven_Equipment.description","",""
"Scripts/content/Story/MISSIONS/DIA_EBR_105_Raven.d:285","Wo bekomme ich bessere Ausrüstung her?","Nereden daha iyi ekipman alabilirim?","","False","DIA_Raven_Equipment_15_00","",""
"Scripts/content/Story/MISSIONS/DIA_EBR_105_Raven.d:286","Geh zu Diego, er wird dir 'ne Rüstung geben. Damit wirst du nicht so schnell umgebracht und sie dient auch gleichzeitig als Ausweis.","Diego ile konuş, sana daha iyi bir zırh verir. Yeni zırhın hem seni ölmekten korur hem de bir kimlik görevi görür.","","False","DIA_Raven_Equipment_10_01","",""
"Scripts/content/Story/MISSIONS/DIA_EBR_105_Raven.d:287","Mit deiner neuen Rüstung solltest du hier überall hinkommen, wo du hin musst.","Giydiğin sürece girmen gereken her yere giriş sağlayabilirsin.","","False","DIA_Raven_Equipment_10_02","",""
"Scripts/content/Story/MISSIONS/DIA_EBR_105_Raven.d:288","Und wenn du Waffen brauchst, geh zu Skip, er ist in der großen Scheune hinten links auf den Burgplatz.","Silaha ihtiyacın varsa Skip ile konuş. Onu da hemen arkada, avlunun sol tarafındaki büyük barakada bulabilirsin.","","False","DIA_Raven_Equipment_10_03","",""
"Scripts/content/Story/MISSIONS/DIA_EBR_105_Raven.d:314","Ich will einen Zwischenbericht abgeben.","Rapor vermem gerekiyor.","","False","DIA_Raven_SpyBericht.description","",""
"Scripts/content/Story/MISSIONS/DIA_EBR_105_Raven.d:327","Ich will einen Zwischenbericht abgeben.","Rapor vermem gerekiyor.","","False","DIA_Raven_SpyBericht_15_00","",""
"Scripts/content/Story/MISSIONS/DIA_EBR_105_Raven.d:328","Gut. Ich bin gerne gut informiert.","Güzel. Güncel bilgiyi severim.","","False","DIA_Raven_SpyBericht_10_01","",""
"Scripts/content/Story/MISSIONS/DIA_EBR_105_Raven.d:334","Die große Beschwörung hat stattgefunden.","Büyük uyanış gerçekleştirildi.","","False","Org_826_Mordrag_RUNNING_15_04","",""
"Scripts/content/Story/MISSIONS/DIA_EBR_105_Raven.d:335","Du hast deine Sache gut gemacht.","","","False","DIA_Raven_SpyBericht_10_04","",""
"Scripts/content/Story/MISSIONS/DIA_EBR_105_Raven.d:343","Sie wollen die Eier einer Minecrawler-Königin, um daraus ein Elixier herzustellen, durch das sie Kontakt zum Schläfer aufnehmen können. Ich habe die Eier bei mir.","Şimdi de Uyuyan ile bağlantı kurmalarını sağlayacak bir iksir hazırlayacaklar, bunun için de kraliçe madendeşenin yumurtalarını istediler. Yumurtalar yanımda.","","False","DIA_Raven_SpyBericht_15_02","",""
