"location","source","target","id","fuzzy","context","translator_comments","developer_comments"
"Scripts/content/Story/MISSIONS/DIA_ORG_862_Jacko.d:84","Ich will euch warnen. Cor Kalom hat fünf Templer geschickt.","Sizi uyarmaya geldim. Cor Kalom işinizi bitirmesi için beş Tapınakçı gönderdi.","","","ORG_862_Jacko_GUARD.ORG_862_Jacko_GUARD_Templer","Info_AddChoice",""
"Scripts/content/Story/MISSIONS/DIA_ORG_862_Jacko.d:85","Ich will wissen, was dir diese Information wert ist.","Bu bilginin sizin için ne kadar değerli olduğunu bilmek istiyorum.","","","ORG_862_Jacko_GUARD.ORG_862_Jacko_GUARD_InfoWert","Info_AddChoice",""
"Scripts/content/Story/MISSIONS/DIA_ORG_862_Jacko.d:86","Um der Sache hier ein Ende zu bereiten!","Tüm işletmeye bir son vermeye geldim!","","","ORG_862_Jacko_GUARD.ORG_862_Jacko_GUARD_Angriff","Info_AddChoice",""
"Scripts/content/Story/MISSIONS/DIA_ORG_862_Jacko.d:91","Ich will euch warnen. Cor Kalom hat fünf Templer geschickt, die euch den Garaus machen sollen.","Sizi uyarmaya geldim. Cor Kalom işinizi bitirmesi için beş Tapınakçı gönderdi.","","","ORG_862_Jacko_GUARD_Templer_Info_15_00","",""
"Scripts/content/Story/MISSIONS/DIA_ORG_862_Jacko.d:92","Ach? Das glaubst du doch selbst nicht!","Ne? Ciddi olamazsın!","","","ORG_862_Jacko_GUARD_Templer_Info_06_01","",""
"Scripts/content/Story/MISSIONS/DIA_ORG_862_Jacko.d:93","Sie müßten jeden Moment hier sein.","Her an burada olabilirler.","","","ORG_862_Jacko_GUARD_Templer_Info_15_02","",""
"Scripts/content/Story/MISSIONS/DIA_ORG_862_Jacko.d:94","Verdammt! Wir müssen weg!","Kahretsin! Gitmemiz lazım!","","","ORG_862_Jacko_GUARD_Templer_Info_06_03","",""
"Scripts/content/Story/MISSIONS/DIA_ORG_862_Jacko.d:112","Ich will wissen, was dir diese Information wert ist.","Bu bilginin sizin için ne kadar değerli olduğunu bilmek istiyorum.","","","ORG_862_Jacko_GUARD_InfoWert_Info_15_00","",""
"Scripts/content/Story/MISSIONS/DIA_ORG_862_Jacko.d:113","Ach so ist das... Gut. Eine Hand wäscht die andere. Hier, das ist alles Erz, was ich bei mir habe.","Ah, derdin buydu demek... Tamam. Sen benim sırtımı kaşı, ben de senin sırtını. Al, üzerimde bu kadar cevher var.","","","ORG_862_Jacko_GUARD_InfoWert_Info_06_01","",""
"Scripts/content/Story/MISSIONS/DIA_ORG_862_Jacko.d:114","Wir müssen weg! Und du verschwindest hier auch besser.","Gitmemiz lazım! Sen de ortadan kaybolursan iyi edersin.","","","ORG_862_Jacko_GUARD_InfoWert_Info_06_02","",""
"Scripts/content/Story/MISSIONS/DIA_ORG_862_Jacko.d:132","Um der Sache hier ein Ende zu bereiten!","Tüm işletmeye bir son vermeye geldim!","","","ORG_862_Jacko_GUARD_Angriff_Info_15_00","",""
"Scripts/content/Story/MISSIONS/DIA_ORG_862_Jacko.d:133","Jungs! Kommt doch mal kurz her!","Çocuklar! Bir dakika buraya gelin!","","","ORG_862_Jacko_GUARD_Angriff_Info_06_01","",""
"Scripts/content/Story/MISSIONS/DIA_ORG_862_Jacko.d:166","Hierher habt ihr euch also verkrümelt.","Demek buraya kaçtın.","","","ORG_862_Jacko_Banditencamp.description","",""
"Scripts/content/Story/MISSIONS/DIA_ORG_862_Jacko.d:179","Hierher habt ihr euch also verkrümelt.","Demek buraya kaçtın.","","","ORG_862_Jacko_Banditencamp_15_00","",""
"Scripts/content/Story/MISSIONS/DIA_ORG_862_Jacko.d:180","Es war knapp. Die Templer der Sekte hätten uns bestimmt kaltgemacht.","Ucuz yırttık. Tarikatın tapınakçıları bizi öldürebilirdi.","","","ORG_862_Jacko_Banditencamp_06_01","",""
"Scripts/content/Story/MISSIONS/DIA_Org_801_Lares.d:53","Wie kommst du hier rein? Was ist mit Roscoe?","İçeri nasıl girdin? Roscoe'ya bir şey mi oldu?","","","ORG_801_Lares_YouHere_11_00","",""
"Scripts/content/Story/MISSIONS/DIA_Org_801_Lares.d:54","Er hatte keine Lust, mich aufzuhalten.","Beni durdurmak istemedi.","","","ORG_801_Lares_YouHere_15_01","",""
"Scripts/content/Story/MISSIONS/DIA_Org_801_Lares.d:55","Was willst du?","Ne istiyorsun?","","","ORG_801_Lares_YouHere_11_02","",""
"Scripts/content/Story/MISSIONS/DIA_Org_801_Lares.d:78","Ich will mich eurer Bande anschließen.","Çetenize katılmak istiyorum.","","","ORG_801_Lares_WannaJoin.description","",""
"Scripts/content/Story/MISSIONS/DIA_Org_801_Lares.d:92","Ich will mich eurer Bande anschließen.","Çetenize katılmak istiyorum.","","","ORG_801_Lares_WannaJoin_15_00","",""
"Scripts/content/Story/MISSIONS/DIA_Org_801_Lares.d:93","So? Was hast du denn vorzuweisen?","Yapma ya? Kendini kanıtlamak için bir şey getirdin mi peki?","","","ORG_801_Lares_WannaJoin_11_01","",""
"Scripts/content/Story/MISSIONS/DIA_Org_801_Lares.d:107","Ich habe die Bedarfsliste der Alten Mine bei mir.","Yanımda Eski Maden'in ihtiyaçlar listesi var.","","","ORG_801_Lares_BringList.description","",""
"Scripts/content/Story/MISSIONS/DIA_Org_801_Lares.d:120","Ich habe die Bedarfsliste der Alten Mine bei mir.","Yanımda Eski Maden'in ihtiyaç listesi var.","","","ORG_801_Lares_BringList_15_00","",""
"Scripts/content/Story/MISSIONS/DIA_Org_801_Lares.d:121","Nein! Das glaub' ich nicht! Du bist mir schon einer, das muss ich ja sagen.","Olamaz! İnanmıyorum! Gözü pek biri gibisin, itiraf etmem gerek.","","","ORG_801_Lares_BringList_11_01","",""
"Scripts/content/Story/MISSIONS/DIA_Org_801_Lares.d:122","Zeig her!","Göster!","","","ORG_801_Lares_BringList_11_02","",""
"Scripts/content/Story/MISSIONS/DIA_Org_801_Lares.d:123","Hier ist sie ...","İşte burada...","","","ORG_801_Lares_BringList_15_03","",""
"Scripts/content/Story/MISSIONS/DIA_Org_801_Lares.d:125","Tatsächlich! Weißt du, was wir jetzt damit machen? Wir schreiben noch ein bisschen was drauf und du bringst die Liste zurück ins Alte Lager!","Haklıymışsın! Bununla ne yapacağız biliyor musun? Ekleme yapacağız, sen de listeyi Eski Kamp'a geri götüreceksin!","","","ORG_801_Lares_BringList_11_04","",""
"Scripts/content/Story/MISSIONS/DIA_Org_801_Lares.d:126","Wenn sie den Krempel dann an die Mine liefern, überfallen wir sie und sacken uns alles ein! Das haben wir gleich ... So! Hier ist die Liste. Du weißt, was du zu tun hast.","Sonra da, listedekileri madene sevk ettikleri zaman, yolda pusuya düşürüp tüm malı yağmalayacağız! Bir dakika bile sürmeyecek... Hah! İşte liste. Ne yapacağını biliyorsun.","","","ORG_801_Lares_BringList_11_05","",""
"Scripts/content/Story/MISSIONS/DIA_Org_801_Lares.d:154","Ich habe Diego die Liste übergeben.","Listeyi Diego'ya verdim.","","","ORG_801_Lares_BringListBack.description","",""
"Scripts/content/Story/MISSIONS/DIA_Org_801_Lares.d:167","Ich habe Diego die Liste übergeben.","Listeyi Diego'ya verdim.","","","ORG_801_Lares_BringListBack_15_00","",""
"Scripts/content/Story/MISSIONS/DIA_Org_801_Lares.d:168","Gut! Ich habe bereits Leute auf dem Weg zur Alten Mine postiert. In diesem Moment liegen Thorus' Gardisten schon tot im Wald.","Güzel! Eski Maden yoluna birkaç adam dizmiştim bile. Şu an biz konuşurken, Thorus'un muhafızları ormanda ölü bir şekilde yatmakla meşgul.","","","ORG_801_Lares_BringListBack_11_01","",""
"Scripts/content/Story/MISSIONS/DIA_Org_801_Lares.d:187","Sie haben den Konvoi schon überfallen? Was ist mein Anteil bei der Sache?","Konvoyu soydular mı? Benim payım nerede?","","","ORG_801_Lares_BringListAnteil.description","",""
"Scripts/content/Story/MISSIONS/DIA_Org_801_Lares.d:200","Sie haben den Konvoi schon überfallen? Was ist mein Anteil bei der Sache?","Konvoyu soydular mı? Benim payım nerede?","","","ORG_801_Lares_BringListAnteil_15_00","",""
"Scripts/content/Story/MISSIONS/DIA_Org_801_Lares.d:201","Geh zu Gorn. Er wird dir etwas geben.","Gidip Gorn ile görüş. Sana bir şeyler verecek.","","","ORG_801_Lares_BringListAnteil_11_01","",""
"Scripts/content/Story/MISSIONS/DIA_Org_801_Lares.d:205","Ich kenne Gorn. Er ist kein Mitglied der Bande. Er ist ein Söldner der Magier.","Gorn'u tanıyorum. Çetenin üyesi değil. Büyücüler için çalışan bir paralı asker.","","","ORG_801_Lares_BringListAnteil_15_02","",""
"Scripts/content/Story/MISSIONS/DIA_Org_801_Lares.d:206","Ja, das ist richtig.","Evet, doğru.","","","ORG_801_Lares_BringListAnteil_11_03","",""
"Scripts/content/Story/MISSIONS/DIA_Org_801_Lares.d:207","War er an der Sache beteiligt?","Soygunda yer aldı mı?","","","ORG_801_Lares_BringListAnteil_15_04","",""
"Scripts/content/Story/MISSIONS/DIA_Org_801_Lares.d:208","Es ist nicht gut für dich, wenn du zu viel weißt. Geh einfach zu ihm und hol dir deinen Anteil ab.","Her şeyi bilmek yararına olmaz. Gidip onunla görüş ve payını al.","","","ORG_801_Lares_BringListAnteil_11_05","",""
"Scripts/content/Story/MISSIONS/DIA_Org_801_Lares.d:224","Mordrag schickt mich. Er hat mir einen Ring für dich gegeben.","Beni Mordrag gönderdi. Sana bu yüzüğü vermemi söyledi.","","","ORG_801_Lares_MordragSentMe.description","",""
"Scripts/content/Story/MISSIONS/DIA_Org_801_Lares.d:241","Mordrag schickt mich. Er hat mir einen Ring für dich gegeben.","Beni Mordrag gönderdi. Sana bu yüzüğü vermemi söyledi.","","","ORG_801_Lares_MordragSentMe_15_00","",""
"Scripts/content/Story/MISSIONS/DIA_Org_801_Lares.d:242","Ein wertvolles Stück! Es ist bei uns üblich, einen Teil der Beute mit dem Anführer zu teilen.","Kıymetli bir parça! Ganimeti çete lideri ile paylaşmak burada normal bir prosedürdür.","","","ORG_801_Lares_MordragSentMe_11_01","",""
"Scripts/content/Story/MISSIONS/DIA_Org_801_Lares.d:243","Aber dass er DIR den Ring gegeben hat, zeigt, dass er einiges von dir hält.","Ayrıca bu yüzüğü SANA emanet etmiş olması senin hakkında iyi şeyler düşündüğünün gösteriyor.","","","ORG_801_Lares_MordragSentMe_11_02","",""
"Scripts/content/Story/MISSIONS/DIA_Org_801_Lares.d:244","Ich will, dass du zu ihm gehst und ihm etwas ausrichtest.","Gidip ona bir şey söylemeni istiyorum.","","","ORG_801_Lares_MordragSentMe_11_03","",""
"Scripts/content/Story/MISSIONS/DIA_Org_801_Lares.d:245","Sag ihm, ich will jemanden im Sektenlager haben. Die Bruderschaft plant irgendwas Großes - ich will genau wissen, was da abläuft.","De ki Bataklık Kampı'nda birinin olmasını istiyorum. Kardeşlik büyük bir şeyin peşinde - orada neler olduğunu adım adım bilmek istiyorum.","","","ORG_801_Lares_MordragSentMe_11_04","",""
"Scripts/content/Story/MISSIONS/DIA_Org_801_Lares.d:270","Ich bin immerhin an deinen Wachen vorbeigekommen.","Muhafızlarını geçmeyi başardım.","","","ORG_801_Lares_Vorbeigemogelt.description","",""
"Scripts/content/Story/MISSIONS/DIA_Org_801_Lares.d:283","Ich bin immerhin an deinen Wachen vorbeigekommen.","Muhafızlarını geçmeyi başardım.","","","ORG_801_Lares_Vorbeigemogelt_15_00","",""
"Scripts/content/Story/MISSIONS/DIA_Org_801_Lares.d:284","Das ist richtig. Aber das alleine wird noch nicht reichen.","Doğru. Fakat sadece bu yeterli değil.","","","ORG_801_Lares_Vorbeigemogelt_11_01","",""
"Scripts/content/Story/MISSIONS/DIA_Org_801_Lares.d:300","Was kann ich noch machen?","Başka ne yapabilirim?","","","ORG_801_Lares_GetKraut.description","",""
"Scripts/content/Story/MISSIONS/DIA_Org_801_Lares.d:313","Was kann ich noch machen?","Başka ne yapabilirim?","","","ORG_801_Lares_GetKraut_15_00","",""
"Scripts/content/Story/MISSIONS/DIA_Org_801_Lares.d:314","Baal Isidro aus dem Sektenlager hat Kraut im Wert von mindestens 400 Erz bei sich. Ich will, dass du es ihm abnimmst. Egal, wie.","Tarikat Kampı'ndan Baal Isidro'nun üzerinde en az 400 cevher değerinde ot var. O malı almanı istiyorum. Nasıl yaptığın umurumda değil.","","","ORG_801_Lares_GetKraut_11_01","",""
"Scripts/content/Story/MISSIONS/DIA_Org_801_Lares.d:318","Wenn du den Riesenhaufen Kraut meinst, den hab' ich mir schon unter den Nagel gerissen","Bu dev ot yığınını diyorsan, onu zaten almıştım.","","","ORG_801_Lares_GetKraut_15_02","",""
"Scripts/content/Story/MISSIONS/DIA_Org_801_Lares.d:319","Du scheinst mir einer von der schnellen Sorte zu sein!","Görünüşe göre cidden akıllı birisin!","","","ORG_801_Lares_GetKraut_11_03","",""
"Scripts/content/Story/MISSIONS/DIA_Org_801_Lares.d:322","Wenn du das Kraut hast, verkauf es. Die 400 Erz bringst du zu mir.","Otu aldıktan sonra, sat. 400 cevheri de bana getir.","","","ORG_801_Lares_GetKraut_11_04","",""
"Scripts/content/Story/MISSIONS/DIA_Org_801_Lares.d:323","Dann unterhalten wir uns noch mal darüber, ob du in die Bande aufgenommen wirst.","Çeteye katılıp katılamayacağını ondan sonra konuşuruz.","","","ORG_801_Lares_GetKraut_11_05","",""
"Scripts/content/Story/MISSIONS/DIA_Org_801_Lares.d:345","Ich hab' die 400 Erz.","400 cevheri getirdim.","","","ORG_801_Lares_400Ore.description","",""
"Scripts/content/Story/MISSIONS/DIA_Org_801_Lares.d:358","Ich hab' die 400 Erz.","400 cevheri getirdim.","","","ORG_801_Lares_400Ore_15_00","",""
"Scripts/content/Story/MISSIONS/DIA_Org_801_Lares.d:361","Gut! Sehr gut. Ich denke, das reicht jetzt.","Güzel! Çok güzel. Bence şimdilik bu kadarı yeterli.","","","ORG_801_Lares_400Ore_11_01","",""
"Scripts/content/Story/MISSIONS/DIA_Org_801_Lares.d:371","Zähl noch mal nach. Ich hoffe, du hast nicht schon die Hälfte versoffen.","Tekrar say. Umarım yarısını içkiye harcamamışsındır.","","","ORG_801_Lares_400Ore_NOORE_11_00","",""
"Scripts/content/Story/MISSIONS/DIA_Org_801_Lares.d:385","Reicht das, um bei euch aufgenommen zu werden?","Size katılmak için yaptıklarım yeterli mi?","","","ORG_801_Lares_Reicht.description","",""
"Scripts/content/Story/MISSIONS/DIA_Org_801_Lares.d:400","Reicht das, um bei euch aufgenommen zu werden?","Size katılmak için yaptıklarım yeterli mi?","","","ORG_801_Lares_Reicht_15_00","",""
"Scripts/content/Story/MISSIONS/DIA_Org_801_Lares.d:404","Das will ich meinen!","Bence yeterli!","","","ORG_801_Lares_Reicht_AUFNAHME_11_00","",""
"Scripts/content/Story/MISSIONS/DIA_Org_801_Lares.d:405","Und ich habe sogar ein Geschenk für dich. Eine bessere Rüstung. Nicht viel, aber du hast sie dir verdient.","Senin için bir hediyem de var. Daha iyi bir zırh. Fazla bir şey değil ama, hak ettin.","","","ORG_801_Lares_Reicht_AUFNAHME_11_01","",""
"Scripts/content/Story/MISSIONS/DIA_Org_801_Lares.d:440","Mordrag hat sich für dich eingesetzt.","Mordrag senden bahsetti.","","","ORG_801_Lares_Reicht_11_02","",""
"Scripts/content/Story/MISSIONS/DIA_Org_801_Lares.d:445","Die Liste hier hinzubringen, hat dir einiges Ansehen gebracht.","O listeyi getirdiğin günden beri epey popülersin.","","","ORG_801_Lares_Reicht_11_03","",""
"Scripts/content/Story/MISSIONS/DIA_Org_801_Lares.d:448","Aber du bist noch nicht bereit. Erledige deine Aufgaben.","Ama daha hazır değilsin. Görevlerini yerine getir.","","","ORG_801_Lares_Reicht_11_04","",""
"Scripts/content/Story/MISSIONS/DIA_Org_801_Lares.d:463","Und was soll ich jetzt machen?","Peki şimdi ne yapmam gerekiyor?","","","ORG_801_Lares_GotoKalom.description","",""
"Scripts/content/Story/MISSIONS/DIA_Org_801_Lares.d:476","Und was soll ich jetzt machen?","Peki şimdi ne yapmam gerekiyor?","","","ORG_801_Lares_GotoKalom_15_00","",""
"Scripts/content/Story/MISSIONS/DIA_Org_801_Lares.d:477","Du bist jetzt ein Mitglied unserer Bande. Es steht dir frei zu tun, was du willst.","Artık çetemizin bir üyesisin. Ne istersen yapmakta özgürsün.","","","ORG_801_Lares_GotoKalom_11_01","",""
"Scripts/content/Story/MISSIONS/DIA_Org_801_Lares.d:485","Wenn du dich nützlich machen willst, geh zu Mordrag und unterstütz ihn bei der Sektensache.","Eğer işe yaramak istiyorsan, gidip Mordrag'a tarikat işinde yardımcı ol.","","","ORG_801_Lares_GotoKalom_11_02","",""
"Scripts/content/Story/MISSIONS/DIA_Org_801_Lares.d:493","Mordrag, einer unserer Leute vom Alten Lager, wurde umgebracht. Bevor er starb, hat er uns die Nachricht übermittelt, dass im Lager der Sekte eine große Sache läuft.","Eski Kamp'taki arkadaşlarımızdan biri, Mordrag, orada öldürüldü. Ölmeden önce de bize bir mesaj iletti. Dediğine göre Tarikat Kampı büyük bir şeyin peşinde.","","","ORG_801_Lares_GotoKalom_11_03","",""
"Scripts/content/Story/MISSIONS/DIA_Org_801_Lares.d:494","Geh zum Lager der Bruderschaft und finde heraus, was los ist.","Kardeşliğin kampına gidip orada neler döndüğünü öğren.","","","ORG_801_Lares_GotoKalom_11_04","",""
"Scripts/content/Story/MISSIONS/DIA_Org_801_Lares.d:499","Mordrag, einer unserer Leute aus dem Alten Lager, ist zurückgekehrt.","Eski Kamp'taki adamlarımızdan biri, Mordrag, geri döndü.","","","ORG_801_Lares_GotoKalom_11_05","",""
"Scripts/content/Story/MISSIONS/DIA_Org_801_Lares.d:500","Geh zu ihm. Sag ihm, ich will jemanden im Sektenlager haben. Die Bruderschaft plant irgendwas Großes - ich will genau wissen, was da abläuft.","Gidip onunla görüş. Tarikat Kampı'nda bir adamın olmasını istediğimi söyle. Kardeşlik büyük bir şey planlıyor - her adımlarından haberdar olmak istiyorum.","","","ORG_801_Lares_GotoKalom_11_06","",""
"Scripts/content/Story/MISSIONS/DIA_Org_801_Lares.d:501","Hilf ihm bei der Sache.","Ona yardımcı ol.","","","ORG_801_Lares_GotoKalom_11_07","",""
"Scripts/content/Story/MISSIONS/DIA_Org_801_Lares.d:519","Wo kann ich hier was lernen?","Nerede bir şeyler öğrenebilirim?","","","ORG_801_Lares_WhereLearn.description","",""
"Scripts/content/Story/MISSIONS/DIA_Org_801_Lares.d:529","Wo kann ich hier was lernen?","Nerede bir şeyler öğrenebilirim?","","","ORG_801_Lares_WhereLearn_Info_15_01","",""
"Scripts/content/Story/MISSIONS/DIA_Org_801_Lares.d:530","Bei mir. Ich kann dir beibringen, deine Geschicklichkeit und Stärke zu verbessern.","Ben öğretirim. Beceri ve kuvvet kazanman için yardımcı olabilirim.","","","ORG_801_Lares_WhereLearn_Info_11_02","",""
"Scripts/content/Story/MISSIONS/DIA_Org_801_Lares.d:545","Ich will mich verbessern","Kendimi geliştirmek istiyorum.","","","ORG_801_Lares_Teach.description","",""
"Scripts/content/Story/MISSIONS/DIA_Org_801_Lares.d:558","Ich will mich verbessern.","Kendimi geliştirmek istiyorum.","","","ORG_801_Lares_Teach_15_00","",""
"Scripts/content/Story/MISSIONS/DIA_Org_804_Organisator.d:49","Wo willst du denn hin?","NEREYE gidiyorsun bakalım?","","","Org_804_Organisator_Greet_06_00","",""
"Scripts/content/Story/MISSIONS/DIA_Org_804_Organisator.d:61","Wo geht's hier denn hin?","Nereye gidebilirim?","","","Org_804_Organisator_WayTo.description","",""
"Scripts/content/Story/MISSIONS/DIA_Org_804_Organisator.d:71","Wo GEHT's hier denn hin?","NEREYE gidebilirim?","","","Org_804_Organisator_WayTo_15_00","",""
"Scripts/content/Story/MISSIONS/DIA_Org_804_Organisator.d:72","Zu Lares.","Lares'e.","","","Org_804_Organisator_WayTo_06_01","",""
"Scripts/content/Story/MISSIONS/DIA_Org_804_Organisator.d:86","Ich will zu Lares.","Lares ile görüşmek istiyorum.","","","Org_804_Organisator_ToLares.description","",""
"Scripts/content/Story/MISSIONS/DIA_Org_804_Organisator.d:99","Ich will zu Lares.","Lares ile görüşmek istiyorum.","","","Org_804_Organisator_ToLares_15_00","",""
"Scripts/content/Story/MISSIONS/DIA_Org_804_Organisator.d:100","Kann mir kaum vorstell'n, dass er mit dir redet.","Seninle konuşacağını sanmam.","","","Org_804_Organisator_ToLares_06_01","",""
"Scripts/content/Story/MISSIONS/DIA_Org_804_Organisator.d:101","Das kannst du getrost mir überlassen.","O kısmını bana bırak.","","","Org_804_Organisator_ToLares_15_02","",""
"Scripts/content/Story/MISSIONS/DIA_Org_804_Organisator.d:102","Ich werde dich nicht aufhalten.","Seni durdurmam.","","","Org_804_Organisator_ToLares_06_03","",""
"Scripts/content/Story/MISSIONS/DIA_Org_804_Organisator.d:116","Kann ich zu Lares?","Lares'i görebilir miyim?","","","Org_804_Organisator_PERM.description","",""
"Scripts/content/Story/MISSIONS/DIA_Org_804_Organisator.d:129","Kann ich zu Lares?","Lares'i görebilir miyim?","","","Org_804_Organisator_PERM_15_00","",""
"Scripts/content/Story/MISSIONS/DIA_Org_804_Organisator.d:130","Klär das mit Roscoe.","O konuyu Roscoe ile görüş.","","","Org_804_Organisator_PERM_06_01","",""
"Scripts/content/Story/MISSIONS/DIA_Org_804_Organisator.d:169","Gomez' Schergen kommen hier nicht rein! Geh!","Gomez'in uşakları içeri giremez! Defol!","","","Info_Org_804_FirstWarn_Info_06_00","",""
"Scripts/content/Story/MISSIONS/DIA_Org_804_Organisator.d:204","Geh, solange du noch gehen KANNST!","Hala yürüyebiliyorken çekil git!","","","Info_Org_804_LastWarn_06_00","",""
"Scripts/content/Story/MISSIONS/DIA_Org_818_Ratford.d:43","Hey, du!","Hey, sen!","","","Org_818_Ratford_WrongWay_07_00","",""
"Scripts/content/Story/MISSIONS/DIA_Org_818_Ratford.d:44","Was willst du?","Ne istiyorsun?","","","Org_818_Ratford_WrongWay_15_01","",""
"Scripts/content/Story/MISSIONS/DIA_Org_818_Ratford.d:45","Dich warnen. Wenn du hier weiter gehst, kommst du in unser Jagdgebiet.","Seni uyarmak istiyorum. Bu yoldan devam edecek olursan, avlanma bölgemize girmiş olacaksın.","","","Org_818_Ratford_WrongWay_07_02","",""
"Scripts/content/Story/MISSIONS/DIA_Org_818_Ratford.d:57","Was jagt ihr denn so?","Ne avlıyorsunuz?","","","Org_818_Ratford_WhatGame.description","",""
"Scripts/content/Story/MISSIONS/DIA_Org_818_Ratford.d:67","Was jagt ihr denn so?","Ne avlıyorsunuz?","","","Org_818_Ratford_WhatGame_15_00","",""
"Scripts/content/Story/MISSIONS/DIA_Org_818_Ratford.d:68","Meistens Scavenger. Sie geben 'ne Menge Fleisch ab. Außerdem sind sie nicht so schwer zur Strecke zu bringen - wenn man weiß, wie.","Genellikle leşçileri. Çok etli oluyorlar. Hem, avlaması da pek zor değil... İşi biliyorsan tabii.","","","Org_818_Ratford_WhatGame_07_01","",""
"Scripts/content/Story/MISSIONS/DIA_Org_818_Ratford.d:69","So? Und wie?","Gerçekten mi? Nasıl?","","","Org_818_Ratford_WhatGame_15_02","",""
"Scripts/content/Story/MISSIONS/DIA_Org_818_Ratford.d:70","Frag meinen Freund Drax hier - der weiß über solche Sachen besser Bescheid als ich.","Dostum Drax'e sor - av konusunda herkesten daha bilgilidir.","","","Org_818_Ratford_WhatGame_07_03","",""
"Scripts/content/Story/MISSIONS/DIA_Org_818_Ratford.d:82","Was ist an diesem Gebiet so gefährlich?","Bu bölgeyi tehlikeli yapan nedir?","","","Org_818_Ratford_WhyDangerous.description","",""
"Scripts/content/Story/MISSIONS/DIA_Org_818_Ratford.d:92","Was ist an diesem Gebiet so gefährlich?","Bu bölgeyi tehlikeli yapan nedir?","","","Org_818_Ratford_WhyDangerous_15_00","",""
"Scripts/content/Story/MISSIONS/DIA_Org_818_Ratford.d:93","Du bist gerade angekommen, was? In der Kolonie gibt es unterschiedlich gefährliche Gebiete.","Buraya yeni geldin, değil mi? Koloni'de çok ya da az tehlikeli olan pek çok farklı bölge var.","","","Org_818_Ratford_WhyDangerous_07_01","",""
"Scripts/content/Story/MISSIONS/DIA_Org_818_Ratford.d:94","Auf den Wegen zwischen den Lagern ist es einigermaßen sicher. Aber auch dort kannst du ein paar Wölfen begegnen, die dich als leichte Beute sehen werden.","Kamplar arasındaki patikalar oldukça güvenlidir. Fakat o patikalarda bile seni kolay av olarak gören birkaç kurt ile karşılaşma ihtimalin var.","","","Org_818_Ratford_WhyDangerous_07_02","",""
"Scripts/content/Story/MISSIONS/DIA_Org_818_Ratford.d:95","Und genau das bist du auch, bis du geeignete Waffen und Rüstung hast.","Düzgün bir silah ve zırh bulana kadar da tam olarak av sayılırsın.","","","Org_818_Ratford_WhyDangerous_07_03","",""
"Scripts/content/Story/MISSIONS/DIA_Org_818_Ratford.d:107","Wo kriege ich bessere Ausrüstung her?","Nereden daha iyi teçhizat bulabilirim?","","","Org_818_Ratford_WoEquipment.description","",""
"Scripts/content/Story/MISSIONS/DIA_Org_818_Ratford.d:120","Wo kriege ich bessere Ausrüstung her?","Nereden daha iyi teçhizat bulabilirim?","","","Org_818_Ratford_WoEquipment_15_00","",""
"Scripts/content/Story/MISSIONS/DIA_Org_818_Ratford.d:121","Der nächste Ort ist das Alte Lager. Du musst nur dem Weg folgen, den du gekommen bist.","En yakın yer Eski Kamp. Önümüzdeki patikayı izlersen oraya ulaşırsın.","","","Org_818_Ratford_WoEquipment_07_01","",""
"Scripts/content/Story/MISSIONS/DIA_Org_818_Ratford.d:122","Aber bei uns im Neuen Lager bekommst du die Sachen billiger - wenn du die richtigen Leute kennst.","Ama Yeni Kamp'ımızda her şeyi daha ucuza alabilirsin - doğru insanları tanıyorsan elbette.","","","Org_818_Ratford_WoEquipment_07_02","",""
"Scripts/content/Story/MISSIONS/DIA_Org_818_Ratford.d:123","Wenn du ins alte Lager gehst, frag nach Mordrag. Er ist einer von uns. Er verkauft gute Ware für wenig Erz.","Eski Kamp'a gidecek olursan, Mordrag'ı sor. Bizden biridir. Sana düşük fiyata iyi mal satar.","","","Org_818_Ratford_WoEquipment_07_03","",""
"Scripts/content/Story/MISSIONS/DIA_Org_818_Ratford.d:138","Erzähl mir mehr über die Gebiete der Kolonie.","Bana Koloni'nin bölgelerinden bahset.","","","Org_818_Ratford_MoreLocations.description","",""
"Scripts/content/Story/MISSIONS/DIA_Org_818_Ratford.d:151","Erzähl mir mehr über die Gebiete der Kolonie.","Bana Koloni'nin bölgelerinden bahset.","","","Org_818_Ratford_MoreLocations_15_00","",""
"Scripts/content/Story/MISSIONS/DIA_Org_818_Ratford.d:152","Wenn du zwischen den Lagern reist, solltest du eine Karte haben. So kannst du die Verbindungswege von den Sackgassen unterscheiden.","Kamplar arasında yolculuk edeceksen, çıkmaz yolları ve patikaları iyi ayırabilmek için bir haritaya ihtiyacın olacak.","","","Org_818_Ratford_MoreLocations_07_01","",""
"Scripts/content/Story/MISSIONS/DIA_Org_818_Ratford.d:153","Die Sackgassen führen dich oft in gefährliche Schluchten, in denen du Kreaturen begegnen wirst, denen du am Anfang besser aus dem Weg gehst.","Çıkmaz yollar genellikle seni tehlikeli yaratıkların bulunduğu kanyonlara çıkartır. Buralardan uzak durursan iyi edersin.","","","Org_818_Ratford_MoreLocations_07_02","",""
