"location","source","target","id","fuzzy","context","translator_comments","developer_comments"
"Scripts/content/Story/MISSIONS/DIA_PC_Fighter.d:966","Das Überraschungsmoment kann die Stärke einer Truppe vervielfachen.","Prvek překvapení může mnohonásobně zvýšit sílu bojovníka.","","","Info_Gorn_FREEMINE_09_07","",""
"Scripts/content/Story/MISSIONS/DIA_PC_Fighter.d:978","Was hast du jetzt vor?","Co máš teď v plánu?","","","Info_Gorn_GUARDNC.description","",""
"Scripts/content/Story/MISSIONS/DIA_PC_Fighter.d:991","Was hast du jetzt vor?","Co máš teď v plánu?","","","Info_Gorn_GUARDNC_15_01","",""
"Scripts/content/Story/MISSIONS/DIA_PC_Fighter.d:992","Die gesamte Verteidigung unseres Lagers muss nun umgestellt werden. Das braucht Zeit.","Celá naše obranná strategie se musí změnit. To zabere nějaký čas.","","","Info_Gorn_GUARDNC_09_02","",""
"Scripts/content/Story/MISSIONS/DIA_PC_Fighter.d:993","Bis Lee und seine Leute so weit sind, werde ich mich erst mal Cords provisorischen Wachposten anschließen.","Dokud Lee a jeho lidé nebudou připraveni, přidám se ke Cordově provizorní stráži.","","","Info_Gorn_GUARDNC_09_03","",""
"Scripts/content/Story/MISSIONS/DIA_PC_Fighter.d:994","Plant ihr einen Gegenschlag?","Chystáš protiútok?","","","Info_Gorn_GUARDNC_15_04","",""
"Scripts/content/Story/MISSIONS/DIA_PC_Fighter.d:995","Noch nicht, aber der Tag wird kommen!","Zatím ne, ale ten den přijde!","","","Info_Gorn_GUARDNC_09_05","",""
"Scripts/content/Story/MISSIONS/DIA_PC_Fighter.d:996","Wenn du mich suchst, gehe von hier in Richtung Mine. Dort werde ich meinen Posten beziehen.","Jestli mě někdy budeš hledat, jdi odtud směrem k dolu. Budu tam na stráži.","","","Info_Gorn_GUARDNC_09_06","",""
"Scripts/content/Story/MISSIONS/DIA_PC_Fighter.d:1013","Wie ist die Lage?","Jak to jde?","","","Info_Gorn_GUARDNCRUNNING.description","",""
"Scripts/content/Story/MISSIONS/DIA_PC_Fighter.d:1027","Wie ist die Lage?","Jak to jde?","","","Info_Gorn_GUARDNCRUNNING_15_01","",""
"Scripts/content/Story/MISSIONS/DIA_PC_Fighter.d:1028","Alles ruhig. In der Freien Mine rührt sich nichts.","Všude klid. Ve Svobodném dole se nic neděje.","","","Info_Gorn_GUARDNCRUNNING_09_02","",""
"Scripts/content/Story/MISSIONS/DIA_PC_Fighter.d:1029","Lee ist noch damit beschäftigt, unsere Verteidigung zu organisieren!","Lee je pořád zaneprázdněný organizací naší obrany!","","","Info_Gorn_GUARDNCRUNNING_09_03","",""
"Scripts/content/Story/MISSIONS/DIA_PC_Fighter.d:1055","Du kommst gerade richtig! Wir bereiten uns auf den Gegenschlag vor.","Jdeš právě včas. Připravujeme protiútok.","","","Info_Gorn_POST_09_01","",""
"Scripts/content/Story/MISSIONS/DIA_PC_Fighter.d:1056","Die Rückeroberung der Freien Mine ist der erste Schritt!","V první fázi převezmeme zpět Svobodný důl!","","","Info_Gorn_POST_09_02","",""
"Scripts/content/Story/MISSIONS/DIA_PC_Fighter.d:1068","Eine Rückeroberung mit vier Mann? Wo sind all die anderen Söldner?","Plánuješ jeho převzetí jenom se čtyřmi muži? Kde jsou všichni žoldáci?","","","Info_Gorn_TAKEBACK.description","",""
"Scripts/content/Story/MISSIONS/DIA_PC_Fighter.d:1081","Eine Rückeroberung mit vier Mann? Wo sind all die anderen Söldner?","Plánuješ jeho převzetí jenom se čtyřmi muži? Kde jsou všichni žoldáci?","","","Info_Gorn_TAKEBACK_15_01","",""
"Scripts/content/Story/MISSIONS/DIA_PC_Fighter.d:1082","Ein frontaler Angriff bringt nichts! Dafür sind Gomez' Leute zu gut verschanzt!","Čelní útok není dobrý! Gomezovi lidé jsou na to příliš dobře opevnění!","","","Info_Gorn_TAKEBACK_09_02","",""
"Scripts/content/Story/MISSIONS/DIA_PC_Fighter.d:1083","Aber eine verdeckte Operation, bei der wir Mann für Mann ausschalten, könnte gelingen!","Ale tajná mise, při které bychom likvidovali jednoho muže po druhém - to by fungovalo!","","","Info_Gorn_TAKEBACK_09_03","",""
"Scripts/content/Story/MISSIONS/DIA_PC_Fighter.d:1084","Lee bat mich, dir etwas auszurichten.","Lee mě požádal, abych ti předal zprávu.","","","Info_Gorn_TAKEBACK_09_04","",""
"Scripts/content/Story/MISSIONS/DIA_PC_Fighter.d:1090","Als einer unserer besten Söldner wurdest du bestimmt, die Operation durchzuführen!","Jako jeden z našich nejlepších žoldáků jsi byl pověřen, vykonáním této mise!","","","Info_Gorn_TAKEBACK_09_05","",""
"Scripts/content/Story/MISSIONS/DIA_PC_Fighter.d:1094","Als Wassermagier mit sehr viel Kampferfahrung wurdest du bestimmt, die Operation durchzuführen!","Jako mág Kruhu vody a zkušený bojovník jsi byl pověřen, vykonáním této mise!","","","Info_Gorn_TAKEBACK_09_06","",""
"Scripts/content/Story/MISSIONS/DIA_PC_Fighter.d:1098","Als einer unserer besten Banditen wurdest du bestimmt, die Operation durchzuführen!","Jako jeden z nejlepších banditů jsi byl pověřen, vykonáním této mise!","","","Info_Gorn_TAKEBACK_09_07","",""
"Scripts/content/Story/MISSIONS/DIA_PC_Fighter.d:1102","Obwohl du nicht zu uns gehörst, hast du unserem Lager schon große Dienste erwiesen und dich mehr als bewährt.","I když nejsi jedním z nás, vykonal jsi pro náš tábor velikou službu a vícekrát jsi dokázal svou kvalitu.","","","Info_Gorn_TAKEBACK_09_08","",""
"Scripts/content/Story/MISSIONS/DIA_PC_Fighter.d:1103","Wir bieten dir die Durchführung der Operation an!","Nabízíme ti příležitost, vykonal tuhle misi!","","","Info_Gorn_TAKEBACK_09_09","",""
"Scripts/content/Story/MISSIONS/DIA_PC_Fighter.d:1106","Ich werde mit dir gehen. Gemeinsam können wir es schaffen!","Půjdu s tebou. Dohromady se nám to podaří!","","","Info_Gorn_TAKEBACK_09_10","",""
"Scripts/content/Story/MISSIONS/DIA_PC_Fighter.d:1118","Der erste Schritt? Was wird denn der zweite sein?","První fáze? Co bude druhá?","","","Info_Gorn_SECOND.description","",""
"Scripts/content/Story/MISSIONS/DIA_PC_Fighter.d:1131","Der erste Schritt? Was wird denn der Zweite sein?","První fáze? Co bude druhá?","","","Info_Gorn_SECOND_15_01","",""
"Scripts/content/Story/MISSIONS/DIA_PC_Fighter.d:1132","Sobald die Mine wieder in unserem Besitz ist, werden wir den Pass über die Berge suchen, den Gomez' Leute für den Überfall benutzt haben!","Jakmile bude důl zase náš, začneme hledat horský průsmyk, přes který přešli Gomezovi lidé, aby nás napadli!","","","Info_Gorn_SECOND_09_02","",""
"Scripts/content/Story/MISSIONS/DIA_PC_Fighter.d:1133","Wenn der Pass dicht gemacht wurde, haben wir die Situation wieder im Griff.","Když bude ten průsmyk uzavřený, situace bude zase pod naší kontrolou.","","","Info_Gorn_SECOND_09_03","",""
"Scripts/content/Story/MISSIONS/DIA_PC_Fighter.d:1134","Verstehe.","Aha.","","","Info_Gorn_SECOND_15_04","",""
"Scripts/content/Story/MISSIONS/DIA_PC_Fighter.d:1146","Warum gerade ich?","Proč právě já?","","","Info_Gorn_WHYME.description","",""
"Scripts/content/Story/MISSIONS/DIA_PC_Fighter.d:1159","Warum gerade ich?","Proč právě já?","","","Info_Gorn_WHYME_15_01","",""
"Scripts/content/Story/MISSIONS/DIA_PC_Fighter.d:1160","Du hast schon mehrmals bewiesen, dass du Mut hast und gleichzeitig denken kannst!","Už jsi vícekrát dokázal, že jsi současně odvážný i chytrý!","","","Info_Gorn_WHYME_09_02","",""
"Scripts/content/Story/MISSIONS/DIA_PC_Fighter.d:1161","Außerdem kennst du das Alte Lager und die Gardisten besser als die meisten von uns.","A kromě toho znáš Starý tábor a jeho stráže líp než kdokoliv z nás.","","","Info_Gorn_WHYME_09_03","",""
"Scripts/content/Story/MISSIONS/DIA_PC_Fighter.d:1162","Du bist der beste Mann für diesen schwierigen Job!","Pro tenhle úkol jsi nejlepší muž!","","","Info_Gorn_WHYME_09_04","",""
"Scripts/content/Story/MISSIONS/DIA_PC_Fighter.d:1174","Lass uns den ungebetenen Gästen in der Mine kräftig in den Hintern treten!","Dobrá, tak pojďme dát našim nevítaným hostům do dolu pořádnou lekci!","","","Info_Gorn_KICKBUTT.description","",""
"Scripts/content/Story/MISSIONS/DIA_PC_Fighter.d:1188","Okay, lass uns den ungebetenen Gästen in der Mine kräftig in den Hintern treten!","Dobrá, tak pojďme dát našim nevítaným hostům do dolu pořádnou lekci!","","","Info_Gorn_KICKBUTT_15_01","",""
"Scripts/content/Story/MISSIONS/DIA_PC_Fighter.d:1189","Nichts anderes habe ich von dir erwartet!","Nečekal jsem, že řekneš něco jiného!","","","Info_Gorn_KICKBUTT_09_02","",""
"Scripts/content/Story/MISSIONS/DIA_PC_Fighter.d:1190","Hier, nimm diesen Schlüssel. Er öffnet das Torhaus vor dem Eingang der Mine.","Tady je klíč. Je od vrátnice před vstupem do dolu.","","","Info_Gorn_KICKBUTT_09_03","",""
"Scripts/content/Story/MISSIONS/DIA_PC_Fighter.d:1204","Warum nicht. Ich muss ohnehin in die Mine!","Proč ne. Potřebuju se stejně dostat do dolu!","","","Info_Gorn_MYWAY.description","",""
"Scripts/content/Story/MISSIONS/DIA_PC_Fighter.d:1218","Warum nicht. Ich muss ohnehin in die Mine!","Proč ne. Potřebuju se stejně dostat do dolu!","","","Info_Gorn_MYWAY_15_01","",""
"Scripts/content/Story/MISSIONS/DIA_PC_Fighter.d:1219","Was immer auch DEINE Gründe sein mögen, ich bin froh, dass wir diese Sache gemeinsam erledigen!","Ať už máš k tomu jakýkoliv důvod, jsem rád, že jsme se v téhle věci spolu dohodli!","","","Info_Gorn_MYWAY_09_02","",""
"Scripts/content/Story/MISSIONS/DIA_PC_Fighter.d:1220","Hier, nimm diesen Schlüssel. Er öffnet das Torhaus vor dem Eingang der Mine.","Tady je klíč. Je od vrátnice před vstupem do dolu.","","","Info_Gorn_MYWAY_09_03","",""
"Scripts/content/Story/MISSIONS/DIA_PC_Fighter.d:1249","Fast hätte ich es vergessen!","Och, málem jsem zapomněl!","","","Info_Gorn_WOLF_09_01","",""
"Scripts/content/Story/MISSIONS/DIA_PC_Fighter.d:1250","Der Bandit Wolf will dich unbedingt sprechen, bevor wir zur Mine aufbrechen!","Bandita Wolf s tebou chce nutně mluvit, ještě než odejdeš do dolu!","","","Info_Gorn_WOLF_09_02","",""
"Scripts/content/Story/MISSIONS/DIA_PC_Fighter.d:1253","Er kann warten, wir haben jetzt wichtigeres zu tun!","Může počkat, máme na práci důležitější věci!","","","Info_Gorn_WOLF.Info_Gorn_WOLF_FM","Info_AddChoice",""
"Scripts/content/Story/MISSIONS/DIA_PC_Fighter.d:1254","Dann werde ihn besser noch vorher aufsuchen!","Pak tam raději půjdu hned!","","","Info_Gorn_WOLF.Info_Gorn_WOLF_WOLF","Info_AddChoice",""
"Scripts/content/Story/MISSIONS/DIA_PC_Fighter.d:1262","Er kann warten, wir haben jetzt Wichtigeres zu tun!","Může počkat, máme na práci důležitější věci!","","","Info_Gorn_WOLF_15_04","",""
"Scripts/content/Story/MISSIONS/DIA_PC_Fighter.d:1263","Wie du meinst!","Jak říkáš!","","","Info_Gorn_WOLF_09_05","",""
"Scripts/content/Story/MISSIONS/DIA_PC_Fighter.d:1269","Dann werde ich ihn besser noch vorher aufsuchen!","Tak to bych za ním měl jít hned!","","","Info_Gorn_WOLF_15_06","",""
"Scripts/content/Story/MISSIONS/DIA_PC_Fighter.d:1270","Tu das. Ich warte hier am Wachposten auf dich!","To udělej. Počkám tady na tebe!","","","Info_Gorn_WOLF_09_07","",""
"Scripts/content/Story/MISSIONS/DIA_PC_Fighter.d:1306","Du scheinst doch noch mit Wolf sprechen zu wollen!","Vypadá to, že chceš mluvit s Wolfem!","","","Info_Gorn_LEAVEFORPOST_09_01","",""
"Scripts/content/Story/MISSIONS/DIA_PC_Fighter.d:1310","Du läufst in die falsche Richtung! Wir müssen zur Mine!","To je špatný směr! Musíme jít k dolu!","","","Info_Gorn_LEAVEFORPOST_09_02","",""
"Scripts/content/Story/MISSIONS/DIA_PC_Fighter.d:1313","Ich warte am provisorischen Wachposten auf dich!","Počkám na tebe u provizorní strážnice!","","","Info_Gorn_LEAVEFORPOST_09_03","",""
"Scripts/content/Story/MISSIONS/DIA_PC_Fighter.d:1331","Es kann losgehen! Auf zur Mine!","Pojďme k dolu!","","","Info_Gorn_REJOINFORFM.description","",""
"Scripts/content/Story/MISSIONS/DIA_PC_Fighter.d:1346","Es kann losgehen! Auf zur Mine!","Pojďme k dolu!","","","Info_Gorn_REJOINFORFM_15_01","",""
"Scripts/content/Story/MISSIONS/DIA_PC_Fighter.d:1347","Höchste Zeit, dass wir die Gardisten von dort vertreiben!","Nejvyšší čas vyhnat odtud stráže!","","","Info_Gorn_REJOINFORFM_09_02","",""
"Scripts/content/Story/MISSIONS/DIA_PC_Fighter.d:1348","Geh du vor, ich folge dir!","Jdi napřed, půjdu za tebou!","","","Info_Gorn_REJOINFORFM_09_03","",""
"Scripts/content/Story/MISSIONS/DIA_PC_Fighter.d:1380","VORSICHT, RAZORS!!!","POZOR, NEBEZPEČÍ!!!","","","Info_Gorn_RAZOR_09_01","",""
"Scripts/content/Story/MISSIONS/DIA_PC_Fighter.d:1381","Die arbeiten genauso in Rudeln wie die Snapper, nur dass sie viel heftiger zubeißen!","Loví ve smečkách jako kousavci, ale koušou daleko hůř!","","","Info_Gorn_RAZOR_09_02","",""
"Scripts/content/Story/MISSIONS/DIA_PC_Fighter.d:1382","Wir sollten sie aus dem Weg räumen! Du weißt ja, ich habe gerne einen freien Rücken!","Měli bychom je odstranit z cesty. Znáš mě, mám rád, když vím, co mám za zády!","","","Info_Gorn_RAZOR_09_03","",""
"Scripts/content/Story/MISSIONS/DIA_PC_Fighter.d:1411","Warte mal, siehst du all die Leichen hier?","Zadrž, vidíš všechny ty mrtvoly?","","","Info_Gorn_FMCENTRANCE_09_01","",""
"Scripts/content/Story/MISSIONS/DIA_PC_Fighter.d:1412","Geh du runter zum Mineneingang, ich bleib' erst mal hier oben und stelle sicher, dass es keine Überraschung von hinten gibt.","Jdi ke vchodu do dolu, já zůstanu tady a ohlídám, abysme nebyli zezadu nemile zaskočeni.","","","Info_Gorn_FMCENTRANCE_09_02","",""
"Scripts/content/Story/MISSIONS/DIA_PC_Fighter.d:1413","Wenn du unten bist, komme ich nach.","Až budeš dole, půjdu za tebou.","","","Info_Gorn_FMCENTRANCE_09_03","",""
"Scripts/content/Story/MISSIONS/DIA_PC_Fighter.d:1444","Ich hörte dich kämpfen, da bin ich sofort hinterher.","Slyšel jsem, jak bojuješ, a tak jsem za tebou ihned vyrazil.","","","Info_Gorn_FMGATE_09_01","",""
"Scripts/content/Story/MISSIONS/DIA_PC_Fighter.d:1445","Ein alter Bekannter ... aber die Rechnung ist beglichen.","Starý známý... Ale účet je srovnaný.","","","Info_Gorn_FMGATE_15_02","",""
"Scripts/content/Story/MISSIONS/DIA_PC_Fighter.d:1446","Gut, öffne du das Tor, ich pass' hier auf!","Dobrá, otevři tu bránu a já budu hlídat!","","","Info_Gorn_FMGATE_09_03","",""
"Scripts/content/Story/MISSIONS/DIA_PC_Fighter.d:1475","Oh, Mann. Das war ein wirklich beinharter Kampf.","Ach, člověče. To byl opravdu tvrdý boj.","","","Info_Gorn_AFTERFM_09_01","",""
"Scripts/content/Story/MISSIONS/DIA_PC_Fighter.d:1476","Hätte nicht gedacht, dass Gomez' Gardisten so viel Widerstand leisten.","Nikdy bych si nebyl pomyslel, že by Gomezovy stráže dokázaly klást takový odpor.","","","Info_Gorn_AFTERFM_09_02","",""
"Scripts/content/Story/MISSIONS/DIA_PC_Fighter.d:1477","Die Hauptsache ist, dass wir sie wieder aus unserer Mine vertrieben haben!","Hlavní je, že jsme je vyhnali z našeho dolu!","","","Info_Gorn_AFTERFM_15_03","",""
"Scripts/content/Story/MISSIONS/DIA_PC_Fighter.d:1478","Ich werde hier bleiben und dafür sorgen, dass das auch so bleibt!","Jsem pořád tady a hlídám situaci!","","","Info_Gorn_AFTERFM_09_04","",""
"Scripts/content/Story/MISSIONS/DIA_PC_Fighter.d:1497","Wie ist die Lage?","Jaká je situace?","","","Info_Gorn_FMWATCH.description","",""
"Scripts/content/Story/MISSIONS/DIA_PC_Fighter.d:1510","Wie ist die Lage?","Jaká je situace?","","","Info_Gorn_FMWATCH_15_01","",""
"Scripts/content/Story/MISSIONS/DIA_PC_Fighter.d:1511","Alles ruhig. In der Freien Mine rührt sich nichts.","Všude klid. Ve Svobodném dole se nic neděje.","","","Info_Gorn_FMWATCH_09_02","",""
"Scripts/content/Story/MISSIONS/DIA_PC_Fighter.d:1512","Es kann nicht mehr lange dauern, bis Lee die Verstärkung hier hoch schickt.","Už to nebude dlouho trvat, než sem dorazí posily, které vyslal Lee.","","","Info_Gorn_FMWATCH_09_03","",""
"Scripts/content/Story/MISSIONS/DIA_PC_Fighter.d:1513","So lange werde ich es mir hier gemütlich machen.","Do té doby bych už byl dávno doma.","","","Info_Gorn_FMWATCH_09_04","",""
"Scripts/content/Story/MISSIONS/DIA_PC_Fighter.d:1539","Eine interessante Ork-Standarte, die du da hast.","To je zajímavá skřetí standarta, co tady máš.","","","Info_Gorn_FOUNDULUMULU_09_01","",""
"Scripts/content/Story/MISSIONS/DIA_PC_Fighter.d:1540","Stammt sie von dem befreiten Ork-Sklaven in der Mine?","Patřila tomu skřetímu otrokovi z dolu?","","","Info_Gorn_FOUNDULUMULU_09_02","",""
"Scripts/content/Story/MISSIONS/DIA_PC_Fighter.d:1541","Es ist ein orkisches Symbol für Freundschaft. Ich will damit die Stadt der Orks betreten.","Je to skřetí symbol přátelství. Chci s ním jít do skřetího města.","","","Info_Gorn_FOUNDULUMULU_15_03","",""
"Scripts/content/Story/MISSIONS/DIA_PC_Fighter.d:1542","Ich hoffe für dich, die Orks respektieren dieses ... ETWAS!","Doufám, že budeš mít štěstí a že budou skřeti respektovat tuhle... VĚC!","","","Info_Gorn_FOUNDULUMULU_09_04","",""
"Scripts/content/Story/MISSIONS/DIA_PC_FighterFM.d:23","Auf in den Kampf!","Do boje!","","","Info_GornFM_EXIT_09_01","",""
"Scripts/content/Story/MISSIONS/DIA_PC_FighterFM.d:27","Bis später.","Ještě se uvidíme.","","","Info_GornFM_EXIT_09_02","",""
"Scripts/content/Story/MISSIONS/DIA_PC_FighterFM.d:51","Halt die Stellung, ich werde erst mal die Lage prüfen!","Hlídej tuhle pozici, já obhlédnu situaci!","","","Info_GornFM_WAIT.description","",""
"Scripts/content/Story/MISSIONS/DIA_PC_FighterFM.d:64","Halt die Stellung, ich werde erst mal die Lage prüfen!","Hlídej tuhle pozici, já obhlédnu situaci!","","","Info_GornFM_WAIT_15_01","",""
"Scripts/content/Story/MISSIONS/DIA_PC_FighterFM.d:65","Ist gut. Ich warte am Mineneingang und sorge dafür, dass dir niemand in den Rücken fällt!","Dobře. Počkám u vchodu do dolu a dohlédnu na to, aby ti nikdo nevpadlo do zad!","","","Info_GornFM_WAIT_09_02","",""
"Scripts/content/Story/MISSIONS/DIA_PC_FighterFM.d:81","Komm mit, ich brauche deine Unterstützung!","Pojď se mnou, potřebuji tvou pomoc!","","","Info_GornFM_FOLLOW.description","",""
"Scripts/content/Story/MISSIONS/DIA_PC_FighterFM.d:94","Komm mit, ich brauche deine Unterstützung!","Pojď, potřebuji tvou pomoc!","","","Info_GornFM_FOLLOW_15_01","",""
"Scripts/content/Story/MISSIONS/DIA_PC_FighterFM.d:95","Endlich geht es weiter! Geh voraus, ich folge dir!","Konečně se pohneme! Jdi první, já půjdu za tebou!","","","Info_GornFM_FOLLOW_09_02","",""
