"location","source","target","id","fuzzy","context","translator_comments","developer_comments"
"Scripts/content/Story/MISSIONS/DIA_Pc_Thief.d:1609","Was wollen Milten und du nun machen?","Ce veti face tu si Milten de acum?","","","Info_Diego_OCRETREAT_15_01","",""
"Scripts/content/Story/MISSIONS/DIA_Pc_Thief.d:1610","Wir werden hier noch eine Weile ausharren und andere Freunde warnen, bevor sie den fanatischen Gardisten in die Hände laufen.","Vom sta aici si vom mai avertiza mai multi prieteni, pentru a nu cadea direct in mainile garzilor.","","","Info_Diego_OCRETREAT_11_02","",""
"Scripts/content/Story/MISSIONS/DIA_Pc_Thief.d:1611","Aber du könntest uns noch einen Gefallen tun.","Dar ai putea sa ne faci o favoare.","","","Info_Diego_OCRETREAT_11_03","",""
"Scripts/content/Story/MISSIONS/DIA_Pc_Thief.d:1623","Ist schon so gut wie erledigt. Sprich!","Ca si facut. Zi-mi ce pot face!","","","Info_Diego_OCFAVOR.description","",""
"Scripts/content/Story/MISSIONS/DIA_Pc_Thief.d:1636","Ist schon so gut wie erledigt. Sprich!","Ca si facut. Zi-mi ce pot face!","","","Info_Diego_OCFAVOR_15_01","",""
"Scripts/content/Story/MISSIONS/DIA_Pc_Thief.d:1637","Suche Lester und Gorn. Sie müssen wissen, was hier passiert ist.","Cauta-i pe Lester si Gorn. trebuie sa afel ce s-a intamplat aici.","","","Info_Diego_OCFAVOR_11_02","",""
"Scripts/content/Story/MISSIONS/DIA_Pc_Thief.d:1638","Richte ihnen aus, dass wir vier uns wie immer am verabredeten Platz treffen.","Spune-le ca noi patru ne vom întâlni in acelasi loc, ca întotdeauna.","","","Info_Diego_OCFAVOR_11_03","",""
"Scripts/content/Story/MISSIONS/DIA_Pc_Thief.d:1639","Wenn ich sie vor euch treffe, werde ich sie warnen und zu eurem Treffpunkt schicken.","Daca îi vad înaintea ta, ii voi anunta si îi voi trimite la locul de intalnire.","","","Info_Diego_OCFAVOR_15_04","",""
"Scripts/content/Story/MISSIONS/DIA_Pc_Thief.d:1640","Danke, mein Freund. Du scheinst wirklich in Ordnung zu sein. Geh nun, wir sehen uns später.","Multumesc, prietene. Chiar pari sa fi un om de treaba. ne vom mai întalni.","","","Info_Diego_OCFAVOR_11_05","",""
