"location","source","target","id","fuzzy","context","translator_comments","developer_comments"
"Scripts/content/Story/MISSIONS/DIA_Pc_Thief.d:26","Ich bin Diego.","Eu sunt Diego.","","","Info_Diego_Gamestart_11_00","",""
"Scripts/content/Story/MISSIONS/DIA_Pc_Thief.d:27","Ich bin...","Eu...","","","Info_Diego_Gamestart_15_01","",""
"Scripts/content/Story/MISSIONS/DIA_Pc_Thief.d:28","Mich interessiert nicht, wer du bist. Du bist neu hier. Ich kümmere mich um die Neuen. Belassen wir es vorerst dabei.","Nu ma intereseaza cine esti. Abia ai sosit. Eu am grija de noii veniti. Atat deocamdata.","","","Info_Diego_Gamestart_11_02","",""
"Scripts/content/Story/MISSIONS/DIA_Pc_Thief.d:29","Wenn du vorhast, länger zu leben, solltest du dich ein bißchen mit mir unterhalten. Ich werde dich allerdings nicht daran hindern, in dein Verderben zu rennen. Also, wie sieht's aus?","Daca vrei sa stai in viata pentru o vreme ar trebui sa vorbesti cu mine. Dar desigur nu te oblig sa nu-ti alegi propria distrugere. Deci, ce zici?","","","Info_Diego_Gamestart_11_03","",""
"Scripts/content/Story/MISSIONS/DIA_Pc_Thief.d:53","Danke für die Hilfe.","Multumesc pentru ajutor.","","","Info_Diego_EXIT_Gamestart_15_00","",""
"Scripts/content/Story/MISSIONS/DIA_Pc_Thief.d:57","Wie du willst. War nett, dich gekannt zu haben.","E decizia ta. Mi-a facut placere sa te cunosc.","","","Info_Diego_EXIT_Gamestart_11_01","",""
"Scripts/content/Story/MISSIONS/DIA_Pc_Thief.d:61","Wir sehen uns im Alten Lager.","Ne vedem in Tabara Veche.","","","Info_Diego_EXIT_Gamestart_11_02","",""
"Scripts/content/Story/MISSIONS/DIA_Pc_Thief.d:96","Weiter geht's.","Hai sa continuam.","","","Info_Diego_EXIT_11_01","",""
"Scripts/content/Story/MISSIONS/DIA_Pc_Thief.d:100","Mach's gut.","Ai grija.","","","Info_Diego_EXIT_15_00","",""
"Scripts/content/Story/MISSIONS/DIA_Pc_Thief.d:115","Ich habe einen Brief für den obersten Feuermagier.","Am o scrisoare pentru Marele Magician al Cercului de Foc.","","","Info_Diego_Brief.description","",""
"Scripts/content/Story/MISSIONS/DIA_Pc_Thief.d:128","Ich habe einen Brief für den obersten Feuermagier.","Am o scrisoare pentru Marele Magician al Cercului de Foc.","","","Info_Diego_Brief_15_00","",""
"Scripts/content/Story/MISSIONS/DIA_Pc_Thief.d:129","So...?","Serios...?","","","Info_Diego_Brief_11_01","",""
"Scripts/content/Story/MISSIONS/DIA_Pc_Thief.d:130","Ein Magier hat ihn mir gegeben, kurz bevor sie mich reingeworfen haben.","Mi-a fost data de un mag chiar inainte de a ma arunca aici.","","","Info_Diego_Brief_15_02","",""
"Scripts/content/Story/MISSIONS/DIA_Pc_Thief.d:131","Du kannst von Glück sagen, dass ich mich bei den Magiern nicht mehr blicken lassen kann. Jeder andere wird dir mit Freude für diesen Brief die Kehle durchschneiden.","Ai noroc ca nu mai pot sta aproape de magicieni. Altii ti-ar taia gatul pentru scrisoarea aia.","","","Info_Diego_Brief_11_03","",""
"Scripts/content/Story/MISSIONS/DIA_Pc_Thief.d:132","Die Magier belohnen ihre Boten immer sehr gut, und die meisten hier haben gar nichts, verstehst du?","Asta pentru ca magii platesc pe courierii lor foarte bine iar pe aici multa lume nu are nimic.","","","Info_Diego_Brief_11_04","",""
"Scripts/content/Story/MISSIONS/DIA_Pc_Thief.d:133","Wenn ich du wäre, würde ich die Schnauze halten, bis ich einen der Magier treffe. Obwohl das in deiner Lage nicht allzu wahrscheinlich ist.","Daca as fi in locul tau as tace din gura pana m-as intalni cu unul dintre magi. Dar in situatia ta asta nu se va intampla.","","","Info_Diego_Brief_11_05","",""
"Scripts/content/Story/MISSIONS/DIA_Pc_Thief.d:134","Wieso nicht?","De ce nu?","","","Info_Diego_Brief_15_06","",""
"Scripts/content/Story/MISSIONS/DIA_Pc_Thief.d:135","Die Magier sind in der Burg im Alten Lager. Nur Gomez' Leuten ist es erlaubt, die Burg zu betreten.","Magicienii locuiesc in Castelul din Tabara Veche. Doar oamenii lui Gomez au voie in castel.","","","Info_Diego_Brief_11_07","",""
"Scripts/content/Story/MISSIONS/DIA_Pc_Thief.d:147","Warum hast du mir geholfen?","De ce m-ai ajutat?","","","Info_Diego_WarumGeholfen.description","",""
"Scripts/content/Story/MISSIONS/DIA_Pc_Thief.d:161","Warum hast du mir geholfen?","De ce m-ai ajutat?","","","Info_Diego_WarumGeholfen_15_00","",""
"Scripts/content/Story/MISSIONS/DIA_Pc_Thief.d:162","Weil du Hilfe gebraucht hast. Bullit und seine Jungs hätten dich vielleicht kaltgemacht.","Pentru ca aveai nevoie, altfel Bullit si baietii lui te-ar fi omorat.","","","Info_Diego_WarumGeholfen_11_01","",""
"Scripts/content/Story/MISSIONS/DIA_Pc_Thief.d:163","Und das konnte ich nicht mit ansehen. Schließlich bin ich den ganzen weiten Weg gekommen um dir einen Vorschlag zu machen.","Si nu puteam sa stau si sa ma uit. Pentru ca am venit pana aici sa iti fac o sugestie.","","","Info_Diego_WarumGeholfen_11_02","",""
"Scripts/content/Story/MISSIONS/DIA_Pc_Thief.d:164","Einen Vorschlag...","O sugestie...","","","Info_Diego_WarumGeholfen_15_03","",""
"Scripts/content/Story/MISSIONS/DIA_Pc_Thief.d:165","Ja. Deine Begegnung mit Bullit und seinen Jungs hat dir hoffentlich gezeigt, dass du Schutz brauchst.","Da. Dupa incidentul cu Bullit, trebuie sa iti dai seama ca ai nevoie de protectie..","","","Info_Diego_WarumGeholfen_11_04","",""
"Scripts/content/Story/MISSIONS/DIA_Pc_Thief.d:166","Jeder, der hier ankommt, wird vor eine Wahl gestellt. Es gibt drei Lager in der Kolonie, und einem davon wirst du dich anschließen müssen.","Oricine vine aici are dreptul de a alege. Sunt trei tabere in colonie, si tu va trebui sa te alaturi uneia din ele.","","","Info_Diego_WarumGeholfen_11_05","",""
"Scripts/content/Story/MISSIONS/DIA_Pc_Thief.d:167","Ich bin hier, um Neuen wie dir klarzumachen, dass sie bei uns im alten Lager am besten aufgehoben sind.","Eu sunt aici ca sa arat celor noi ca Tabara Veche este cea mai buna.","","","Info_Diego_WarumGeholfen_11_06","",""
"Scripts/content/Story/MISSIONS/DIA_Pc_Thief.d:177","Wo ist dieser Bullit jetzt?","Unde este Bullit acum?","","","Info_Diego_Bullit.description","",""
"Scripts/content/Story/MISSIONS/DIA_Pc_Thief.d:190","Wo ist dieser Bullit jetzt?","Unde e Bullit acum?","","","Info_Diego_Bullit_15_02","",""
"Scripts/content/Story/MISSIONS/DIA_Pc_Thief.d:191","Er und die anderen bringen die Waren aus der Außenwelt ins alte Lager. Dort kannst du ihn finden.","El si ceilalti duc marfurile din afara in Tabara. O sa-l gasesti acolo.","","","Info_Diego_Bullit_11_03","",""
"Scripts/content/Story/MISSIONS/DIA_Pc_Thief.d:192","Aber wenn du vorhast, dich mit ihm anzulegen, sei vorsichtig. Er ist ein erfahrener Kämpfer.","Dar ai grija daca vrei sa te lupti cu el. E un razboinic puternic.","","","Info_Diego_Bullit_11_04","",""
"Scripts/content/Story/MISSIONS/DIA_Pc_Thief.d:204","Okay, was muss ich über diesen Ort wissen?","Deci,ce trebuie sa stiu despre locul asta?","","","Info_Diego_Kolonie.description","",""
"Scripts/content/Story/MISSIONS/DIA_Pc_Thief.d:217","Okay, was muss ich über diesen Ort wissen?","Deci, ce trebuie sa stiu despre locul asta?","","","Info_Diego_Kolonie_15_00","",""
"Scripts/content/Story/MISSIONS/DIA_Pc_Thief.d:218","Wir nennen es die Kolonie. Du wirst sicher schon gehört haben, dass wir hier Erz für den König fördern.","Noi am denumit-o 'colonia'. Stii deja ca noi producem cristale pentru rege.","","","Info_Diego_Kolonie_11_01","",""
"Scripts/content/Story/MISSIONS/DIA_Pc_Thief.d:219","Nun - zumindest wir vom alten Lager.","Cel putin noi, cei din Tabara Veche.","","","Info_Diego_Kolonie_11_02","",""
"Scripts/content/Story/MISSIONS/DIA_Pc_Thief.d:220","Es gibt drei Lager innerhalb der Barriere. Das alte Lager ist das größte von ihnen. Es war auch das erste.","Sunt trei Tabere in Bariera. Tabara Veche este cea mai mare, si a si fost prima.","","","Info_Diego_Kolonie_11_03","",""
"Scripts/content/Story/MISSIONS/DIA_Pc_Thief.d:230","Erzähl mir was über die Barriere.","Mai zi-im despre Bariera.","","","Info_Diego_Barriere.description","",""
"Scripts/content/Story/MISSIONS/DIA_Pc_Thief.d:243","Erzähl mir was über die Barriere.","Zi-mi mai multe despre Bariera.","","","Info_Diego_Barriere_15_00","",""
"Scripts/content/Story/MISSIONS/DIA_Pc_Thief.d:244","Da gibt es nicht viel zu erzählen. Sie ist undurchdringlich.","Nu prea am ce sa zic. Este impenetrabila.","","","Info_Diego_Barriere_11_01","",""
"Scripts/content/Story/MISSIONS/DIA_Pc_Thief.d:245","Was passiert, wenn ich hier einfach wieder rausspaziere?","Ce se intampla daca pur si simplu ies de aici?","","","Info_Diego_Barriere_15_02","",""
"Scripts/content/Story/MISSIONS/DIA_Pc_Thief.d:246","Der Letzte, der das versucht hat, ist tot auf der anderen Seite angekommen. Diese verdammte Barriere lässt dich zwar rein, aber raus kommst du hier nicht mehr.","Ultimul care a incercat asta a iesit pe cealalta parte mort. Aceasta Bariera te lasa inauntru, dar nu vei iesi niciodata de aici.","","","Info_Diego_Barriere_11_03","",""
"Scripts/content/Story/MISSIONS/DIA_Pc_Thief.d:247","Wenn es einen Weg hier raus gibt, werde ich ihn finden.","Daca exista vreo cale de scapare, eu o s-o gasesc.","","","Info_Diego_Barriere_15_04","",""
"Scripts/content/Story/MISSIONS/DIA_Pc_Thief.d:248","Hast du's SO eilig, hier wieder rauszukommen? Du bist ja gerade mal da!","Deja te grabesti sa iesi de aici? Dar abia ai ajuns!","","","Info_Diego_Barriere_11_05","",""
"Scripts/content/Story/MISSIONS/DIA_Pc_Thief.d:258","Was ist mit den beiden anderen Lagern?","Ce e cu celelalte doua Taberi?","","","Info_Diego_OtherCamps.description","",""
"Scripts/content/Story/MISSIONS/DIA_Pc_Thief.d:272","Was ist mit den beiden anderen Lagern?","Ce e cu celelalte doua Tabere?","","","Info_Diego_OtherCamps_15_00","",""
"Scripts/content/Story/MISSIONS/DIA_Pc_Thief.d:273","Die beiden anderen Lager haben sich abgespalten, um ihren schwachsinnigen Ausbruchsplänen nachzugehen.","Cele doua Tabere s-au despartit de Tabara Veche pentru a-si indeplini planuriile lor nebune de evadare.","","","Info_Diego_OtherCamps_11_01","",""
"Scripts/content/Story/MISSIONS/DIA_Pc_Thief.d:274","Es gibt das neue Lager im Westen der Kolonie. Die Magier dort meinen, wenn sie genug Erz zusammengekratzt haben, können sie die Barriere einfach sprengen.","Este Tabara Noua in vestul Coloniei, unde magii cred ca pot doar sa detoneze Bariera odata ce vor avea destule cristale.","","","Info_Diego_OtherCamps_11_02","",""
"Scripts/content/Story/MISSIONS/DIA_Pc_Thief.d:275","Dann gibt's im Osten die Sektenspinner. Sie haben ihr Lager im Sumpf und beten zu ihrem Götzen, er möge ihnen die Freiheit schenken.","Si mai este secta din est. Tabara lor este in mijlocul mlastinii, si se roaga la idolul lor sa-i elibereze.","","","Info_Diego_OtherCamps_11_03","",""
"Scripts/content/Story/MISSIONS/DIA_Pc_Thief.d:276","Bis jetzt hat er sich noch nicht gemeldet.","Inca nu le-a raspuns.","","","Info_Diego_OtherCamps_11_04","",""
"Scripts/content/Story/MISSIONS/DIA_Pc_Thief.d:277","Wenn ich du wäre, würde ich meine Zeit nicht mit den Spinnern verschwenden.","Daca as fi in locul tau, nu mi-as pierde timpul cu nebunii astia.","","","Info_Diego_OtherCamps_11_05","",""
"Scripts/content/Story/MISSIONS/DIA_Pc_Thief.d:287","Erzähl mir was über das alte Lager.","Spune-mi ceva despre Tabara Veche.","","","Info_Diego_OldCamp.description","",""
"Scripts/content/Story/MISSIONS/DIA_Pc_Thief.d:300","Erzähl mir was über das alte Lager.","Spune-mi ceva despre Tabara Veche.","","","Info_Diego_OldCamp_15_00","",""
"Scripts/content/Story/MISSIONS/DIA_Pc_Thief.d:301","Es ist das größte und mächtigste der drei Lager. Gomez und seine Jungs kontrollieren das Lager und damit den ganzen Erzaustausch.","Este cea mai mare si puternica dintre cele trei tabere. Gomez si baietii lui controleaza Tabara deci si intregul comert de cristale.","","","Info_Diego_OldCamp_11_01","",""
"Scripts/content/Story/MISSIONS/DIA_Pc_Thief.d:302","Einmal im Monat schickt der König uns alles, was wir fordern. Wir haben den alten Sack in der Hand, verstehst du? Er ist auf das Erz angewiesen.","Odata pe luna, Regele ne trimite tot ce ne trebuie. Il avem pe mos la mana noastra, intelegi?","","","Info_Diego_OldCamp_11_02","",""
"Scripts/content/Story/MISSIONS/DIA_Pc_Thief.d:303","Er schickt uns Wein, Brot, Fleisch, Waffen, einfach alles.","Ne trimite vin, paine, carne, arme...totul.","","","Info_Diego_OldCamp_11_03","",""
"Scripts/content/Story/MISSIONS/DIA_Pc_Thief.d:307","Du kannst auch deinen Teil davon bekommen. Alles, was du tun mußt, ist dich Gomez' Leuten anzuschließen.","Poti sa iei si tu cate ceva din astea. Tot ce trebuie sa faci este sa te alaturi oamenilor lui Gomez.","","","Info_Diego_OldCamp_11_04","",""
"Scripts/content/Story/MISSIONS/DIA_Pc_Thief.d:320","Wer ist Gomez?","Cine e Gomez?","","","Info_Diego_WhosGomez.description","",""
"Scripts/content/Story/MISSIONS/DIA_Pc_Thief.d:333","Wer ist Gomez?","Cine e Gomez?","","","Info_Diego_WhosGomez_15_00","",""
"Scripts/content/Story/MISSIONS/DIA_Pc_Thief.d:334","Gomez ist der oberste Erzbaron. Der Boss des Alten Lagers. Der mächtigste Mann in der Kolonie.","Gomez este cel mai puternic Baron al Cristalelor. El este seful Taberei Vechi - cel mai puternic om din colonie.","","","Info_Diego_WhosGomez_11_01","",""
"Scripts/content/Story/MISSIONS/DIA_Pc_Thief.d:346","Wie kann ich mich Gomez' Leuten anschliessen?","Sa zicem ca vreau sa ma alatur oameniilor lui, ce trebuie sa fac?","","","Info_Diego_JoinOldcamp.description","",""
"Scripts/content/Story/MISSIONS/DIA_Pc_Thief.d:361","Mal angenommen, ich wollte mich seinen Leuten anschließen, was müßte ich tun.","Sa zicem ca vreau sa ma alatur oameniilor lui, ce trebuie sa fac?","","","Info_Diego_JoinOldcamp_15_00","",""
"Scripts/content/Story/MISSIONS/DIA_Pc_Thief.d:362","Am Eingang zur Burg findest du einen Mann, der Thorus heißt. Sag ihm Diego schickt dich.","La poarta cetatii o sa gasesti un om pe nume Thorus. Spune-i ca te-a trimis Diego.","","","Info_Diego_JoinOldcamp_11_01","",""
"Scripts/content/Story/MISSIONS/DIA_Pc_Thief.d:380","Wie komme ich zum alten Lager?","Cum ajung in Tabara Veche?","","","Info_Diego_WayToOldcamp.description","",""
"Scripts/content/Story/MISSIONS/DIA_Pc_Thief.d:393","Wie komme ich zum alten Lager?","Cum ajung in Tabara Veche?","","","Info_Diego_WayToOldcamp_15_00","",""
"Scripts/content/Story/MISSIONS/DIA_Pc_Thief.d:394","Du mußt nur dem Weg hier folgen. Das Alte Lager ist der nächste halbwegs sichere Ort von hier aus gesehen.","Urmeaza drumul asta. Tabara Veche este urmatorul loc sigur care il vei intalni.","","","Info_Diego_WayToOldcamp_11_01","",""
"Scripts/content/Story/MISSIONS/DIA_Pc_Thief.d:395","Es treiben sich jede Menge wilder Bestien zwischen den Lagern herum. Ohne Waffe zu gehen ist Wahnsinn.","Sunt multe bestii intre tabere. Ai fi nebun sa te plimbi pe-aici fara o arma.","","","Info_Diego_WayToOldcamp_11_02","",""
"Scripts/content/Story/MISSIONS/DIA_Pc_Thief.d:407","Wo kriege ich eine Waffe her?","De unde pot sa iau o arma?","","","Info_Diego_WoWaffe.description","",""
"Scripts/content/Story/MISSIONS/DIA_Pc_Thief.d:420","Wo kriege ich eine Waffe her?","De unde pot sa iau o arma?","","","Info_Diego_WoWaffe_15_00","",""
"Scripts/content/Story/MISSIONS/DIA_Pc_Thief.d:421","Wenn du an der verlassenen Mine vorbeikommst, sieh dich mal ein bißchen um. Du findest bestimmt was Brauchbares.","Cand o sa ajungi la Mina Abandonata, uita-te in jur. Sunt sigur ca vei gasi ceva folositor.","","","Info_Diego_WoWaffe_11_01","",""
"Scripts/content/Story/MISSIONS/DIA_Pc_Thief.d:422","Die Mine ist leicht zu finden, nur ein paar Meter die Schlucht entlang.","Mina este usor de gasit, este doar la cativa metri, de-a lungul canionului.","","","Info_Diego_WoWaffe_11_02","",""
"Scripts/content/Story/MISSIONS/DIA_Pc_Thief.d:434","Ich habe mit Thorus geredet.","Am vorbit cu Thorus.","","","Info_Diego_ThorusSays.description","",""
"Scripts/content/Story/MISSIONS/DIA_Pc_Thief.d:447","Ich habe mit Thorus geredet.","Am vorbit cu Thorus.","","","Info_Diego_ThorusSays_15_00","",""
"Scripts/content/Story/MISSIONS/DIA_Pc_Thief.d:448","Und was sagt er?","Si ce a zis?","","","Info_Diego_ThorusSays_11_01","",""
"Scripts/content/Story/MISSIONS/DIA_Pc_Thief.d:449","Er will mich im Lager aufnehmen, wenn DU denkst, dass ich gut genug bin.","A zis ca ma pot alatura Taberei Vechi daca TU crezi ca-s destul de bun.","","","Info_Diego_ThorusSays_15_02","",""
"Scripts/content/Story/MISSIONS/DIA_Pc_Thief.d:450","Sieht so aus, als hätte ich einen neuen Job.","Se pare ca am o noua treaba de facut.","","","Info_Diego_ThorusSays_11_03","",""
"Scripts/content/Story/MISSIONS/DIA_Pc_Thief.d:451","Fangen wir direkt an?","Incepem acum?","","","Info_Diego_ThorusSays_15_04","",""
"Scripts/content/Story/MISSIONS/DIA_Pc_Thief.d:452","Vorher solltest du ein paar Sachen wissen.","In primul rand sunt cateva lucruri ce trebuie sa le stii.","","","Info_Diego_ThorusSays_11_05","",""
"Scripts/content/Story/MISSIONS/DIA_Pc_Thief.d:464","Was muss ich wissen, um im Alten Lager aufgenommen zu werden?","Ce trebuie sa fac ca sa fiu acceptat in Tabara Veche?","","","Info_Diego_Rules.description","",""
"Scripts/content/Story/MISSIONS/DIA_Pc_Thief.d:477","Was muss ich wissen, um im Alten Lager aufgenommen zu werden?","Ce trebuie sa fac ca sa fiu acceptat in Tabara Veche?","","","Info_Diego_Rules_15_00","",""
"Scripts/content/Story/MISSIONS/DIA_Pc_Thief.d:478","Wenn du aufgenommen werden willst, mußt du Pluspunkte sammeln.","Daca vrei sa te alaturi Taberei, trebuie sa castigi respect.","","","Info_Diego_Rules_11_01","",""
"Scripts/content/Story/MISSIONS/DIA_Pc_Thief.d:479","Es gibt einige einflussreiche Leute hier im Außenring. Die meisten davon sind Schatten. Wenn du es schaffst, sie zu beeindrucken, bringt dir das Pluspunkte ein.","Sunt ceva oameni importanti in Cercul Exterior al Taberei. Multi sunt din Ghilda Umbrelor. Daca reusesti sa-i impresionez,vei castiga ceva respect.","","","Info_Diego_Rules_11_02","",""
"Scripts/content/Story/MISSIONS/DIA_Pc_Thief.d:480","Dann mußt du eine Prüfung des Vertrauens ablegen.","Apoi trebuie sa dai Testul Curajului.","","","Info_Diego_Rules_11_03","",""
"Scripts/content/Story/MISSIONS/DIA_Pc_Thief.d:481","Außerdem gibt es für einen Neuen wie dich jede Menge neuer Talente zu lernen. Je mehr du lernst, desto wertvoller bist du für uns.","Deasemenea sunt multe lucruri care un incepator trebuie sa le stie. Cu cat vei stii mai mult, cu atat vei fi mai folositor noua.","","","Info_Diego_Rules_11_04","",""
"Scripts/content/Story/MISSIONS/DIA_Pc_Thief.d:495","Wo finde ich die wichtigen Leute?","Unde gasesc oamenii importanti?","","","Info_Diego_Celebs.description","",""
"Scripts/content/Story/MISSIONS/DIA_Pc_Thief.d:508","Wo finde ich die wichtigen Leute?","Unde gasesc oamenii importanti?","","","Info_Diego_Celebs_15_00","",""
"Scripts/content/Story/MISSIONS/DIA_Pc_Thief.d:509","Nun, einer steht hier direkt vor dir, dann wäre da noch Thorus, den kennst du ja schon.","Pai, te uiti la unul din ei. Apoi mai este Thorus... deja il stii.","","","Info_Diego_Celebs_11_01","",""
"Scripts/content/Story/MISSIONS/DIA_Pc_Thief.d:510","Was die anderen betrifft, das wirst du selbst rausfinden müssen. Wenn du dazu nicht in der Lage bist, hast du hier im Lager sowieso nichts verloren.","Cat despre ceilalti... trebuie sa-i gasesti singur. Daca nu poti sa faci asta, nu apartii acestei tabere, oricum.","","","Info_Diego_Celebs_11_02","",""
"Scripts/content/Story/MISSIONS/DIA_Pc_Thief.d:511","Geh einfach durch den Außenring und rede mit den Leuten. Du findest dann schon raus, an wen du dich halten mußt.","Doar plimba-te prin Cercul Exterior si vorbeste cu lumea, atunci vei gasi pe cine este mai important.","","","Info_Diego_Celebs_11_03","",""
"Scripts/content/Story/MISSIONS/DIA_Pc_Thief.d:523","Bei wem kann ich was lernen?","Cine ma poate invata?","","","Info_Diego_Teachers.description","",""
"Scripts/content/Story/MISSIONS/DIA_Pc_Thief.d:536","Bei wem kann ich was lernen?","Cine ma poate invata?","","","Info_Diego_Teachers_15_00","",""
"Scripts/content/Story/MISSIONS/DIA_Pc_Thief.d:537","Für den Anfang solltest du dich an Fingers halten. Er ist der Geschickteste von uns.","Incepe cu Fingers. El este cel mai priceput dintre noi.","","","Info_Diego_Teachers_11_01","",""
"Scripts/content/Story/MISSIONS/DIA_Pc_Thief.d:538","Wenn du die Augen aufhältst, wirst du noch andere Leute finden, die dir etwas beibringen können.","Daca iti tii ochi deschisi, vei gasi alte persoane care te vor invata.","","","Info_Diego_Teachers_11_02","",""
"Scripts/content/Story/MISSIONS/DIA_Pc_Thief.d:539","Wo finde ich diesen Fingers?","Unde il gasesc pe Fingers?","","","Info_Diego_Teachers_15_03","",""
"Scripts/content/Story/MISSIONS/DIA_Pc_Thief.d:540","Seine Hütte liegt etwas zurück, direkt an der Burgmauer, wenn du von hier zur Arena gehst.","Coliba lui este cam ascunsa. Este langa zidul castelului. Porneste de aici si du-te spre arena.","","","Info_Diego_Teachers_11_04","",""
"Scripts/content/Story/MISSIONS/DIA_Pc_Thief.d:541","Wenn du vorm Burgtor stehst, geh links runter, da geht's Richtung Arena.","Cand esti la poarta castelului, du-te la stanga si te vei indrepta spre arena.","","","Info_Diego_Teachers_11_05","",""
"Scripts/content/Story/MISSIONS/DIA_Pc_Thief.d:563","Kannst du mir was beibringen?","Ma poti invata ceva?","","","Info_Diego_Teach.description","",""
"Scripts/content/Story/MISSIONS/DIA_Pc_Thief.d:583","Kannst du mir was beibringen?","Ma poti invata ceva?","","","Info_Diego_Teach_15_00","",""
"Scripts/content/Story/MISSIONS/DIA_Pc_Thief.d:584","Ja. Bei mir kannst du lernen, deine Geschicklichkeit zu verbessern oder deine Kampfkraft zu steigern.","Da. Te pot invata cum sa iti cresti puterea si dexteritatea.","","","Info_Diego_Teach_11_01","",""
"Scripts/content/Story/MISSIONS/DIA_Pc_Thief.d:601","Deine Kampfkraft ist um einiges gestiegen.","Puterea ta a crescut mult.","","","Info_Diego_Teach_BACK_11_00","",""
"Scripts/content/Story/MISSIONS/DIA_Pc_Thief.d:606","Dein Geschick im Umgang mit Bögen und Armbrüsten ist schon besser geworden.","Priceperea ta cu arcul si arbaleta au devenit mai bune.","","","Info_Diego_Teach_BACK_11_01","",""
"Scripts/content/Story/MISSIONS/DIA_Pc_Thief.d:609","Komm bald wieder - es gibt viel zu lernen!","Sa te intorci - Sunt multe lucruri care trebuie sa le inveti!","","","Info_Diego_Teach_BACK_11_02","",""
"Scripts/content/Story/MISSIONS/DIA_Pc_Thief.d:670","Was ist die Prüfung des Vertrauens?","Care este Testul Curajului?","","","Info_Diego_BringList_Offer.description","",""
"Scripts/content/Story/MISSIONS/DIA_Pc_Thief.d:683","Was ist die Prüfung des Vertrauens?","Care este Testul Curajului?","","","Info_Diego_BringList_Offer_15_00","",""
"Scripts/content/Story/MISSIONS/DIA_Pc_Thief.d:684","Du sollst für mich zur alten Mine gehen. Dort triffst du einen Kerl namens Ian. Er wird dir eine Liste geben.","Trebuie sa te duci in Mina Veche. Acolo e un tip pe nume Ian. Iti va da o lista.","","","Info_Diego_BringList_Offer_11_01","",""
"Scripts/content/Story/MISSIONS/DIA_Pc_Thief.d:685","Diese Liste ist wichtig. Da steht drauf, was die Jungs in der Mine von uns brauchen.","Lista e importanta. Contine toate obiectele necesare celor din mina care trebuie sa le trimitem.","","","Info_Diego_BringList_Offer_11_02","",""
"Scripts/content/Story/MISSIONS/DIA_Pc_Thief.d:686","Das schicken wir ihnen dann mit dem nächsten Convoy!","Vor lua marfa cu urmatorul transport!","","","Info_Diego_BringList_Offer_11_03","",""
"Scripts/content/Story/MISSIONS/DIA_Pc_Thief.d:687","Kein Problem!","Nici o problema!","","","Info_Diego_BringList_Offer_15_04","",""
"Scripts/content/Story/MISSIONS/DIA_Pc_Thief.d:688","Oh, doch! Das ist ein Problem. Das Neue Lager darf auf keinen Fall die Liste in die Finger bekommen!","De fapt, e o problema! Tabara Noua nu trebuie sa ia lista!","","","Info_Diego_BringList_Offer_11_05","",""
"Scripts/content/Story/MISSIONS/DIA_Pc_Thief.d:689","Wie ich schon sagte, die Liste ist wichtig. Wenn du die Sache gut machst, bringt dich das einen großen Schritt weiter.","Cum am spus: lista este importanta. Daca faci treaba cum trebuie, vei ajunge sa faci lucruri mai importante.","","","Info_Diego_BringList_Offer_11_06","",""
"Scripts/content/Story/MISSIONS/DIA_Pc_Thief.d:708","Wenn die Liste so vichtig ist, wieso sollte Ian sie mir geben?","Daca lista este asa de importanta, de ce mi-ar da-o Ian MIE?","","","Info_Diego_IanPassword.description","",""
"Scripts/content/Story/MISSIONS/DIA_Pc_Thief.d:721","Wenn die Liste so wichtig ist, wieso sollte Ian sie dann ausgerechnet MIR geben?","Daca lista este asa de importanta, de ce mi-ar da-o Ian MIE?","","","Info_Diego_IanPassword_Info_15_01","",""
"Scripts/content/Story/MISSIONS/DIA_Pc_Thief.d:722","Weil du ihm sagst, Diego schickt dich.","Pentru ca o sa-i spui ca Diego te-a trimis.","","","Info_Diego_IanPassword_Info_11_02","",""
"Scripts/content/Story/MISSIONS/DIA_Pc_Thief.d:723","Werd's ihm ausrichten.","O sa-i spun.","","","Info_Diego_IanPassword_Info_15_03","",""
"Scripts/content/Story/MISSIONS/DIA_Pc_Thief.d:735","Wo finde ich die Alte Mine?","Unde gasesc Mina Veche?","","","Info_Diego_MapToOldMine.description","",""
"Scripts/content/Story/MISSIONS/DIA_Pc_Thief.d:748","Wo finde ich die Alte Mine?","Unde gasesc Mina Veche","","","Info_Diego_MapToOldMine_Info_15_00","",""
"Scripts/content/Story/MISSIONS/DIA_Pc_Thief.d:749","Geh zu Graham. Er zeichnet Karten. Sag ihm, du kommst von mir. Er soll dir 'ne Karte geben. Auf der wirst du die Mine finden.","Du-te la Graham. Este un cartograf. Spune-i ca te-am trimis eu si ca ai nevoie de o harta. Iti va arata drumul spre mina.","","","Info_Diego_MapToOldMine_Info_11_01","",""
"Scripts/content/Story/MISSIONS/DIA_Pc_Thief.d:750","Er wohnt drüben links neben dem Nordtor.","Locuieste in stanga Portii de Nord.","","","Info_Diego_MapToOldMine_Info_11_02","",""
