"location","source","target","id","fuzzy","context","translator_comments","developer_comments"
"Scripts/content/Story/MISSIONS/DIA_EBR_100_Gomez.d:33","Ich bin gekommen, um dir meine Dienste anzubieten.","","","False","DIA_Gomez_Fault.description","",""
"Scripts/content/Story/MISSIONS/DIA_EBR_100_Gomez.d:46","Ich bin gekommen, um dir meine Dienste anzubieten.","","","False","DIA_Gomez_Fault_15_00","",""
"Scripts/content/Story/MISSIONS/DIA_EBR_100_Gomez.d:47","Du platzt hier einfach rein und erwartest, dass ich mich mit dir befasse, du Wurm? WACHE!","","","False","DIA_Gomez_Fault_11_01","",""
"Scripts/content/Story/MISSIONS/DIA_EBR_100_Gomez.d:67","Ich bin gekommen, um dir meine Dienste anzubieten.","","","False","DIA_Gomez_Hello.description","",""
"Scripts/content/Story/MISSIONS/DIA_EBR_100_Gomez.d:80","Ich bin gekommen, um dir meine Dienste anzubieten.","","","False","DIA_Gomez_Hello_15_00","",""
"Scripts/content/Story/MISSIONS/DIA_EBR_100_Gomez.d:81","Warum denkst du, dass wir an deinen Diensten interessiert sind?","","","False","DIA_Gomez_Hello_11_01","",""
"Scripts/content/Story/MISSIONS/DIA_EBR_100_Gomez.d:84","Ich hoffe ich muss dir nicht erst den Kopf abhacken, um mich zu beweisen.","","","False","DIA_Gomez_Hello.DIA_Gomez_Hello_KopfAb","Info_AddChoice",""
"Scripts/content/Story/MISSIONS/DIA_EBR_100_Gomez.d:85","Weil hier nur Schwachköpfe rumrennen.","","","False","DIA_Gomez_Hello.DIA_Gomez_Hello_Spinner","Info_AddChoice",""
"Scripts/content/Story/MISSIONS/DIA_EBR_100_Gomez.d:86","Ich bin viel rumgekommen und habe gute Kontakte in allen Lagern.","","","False","DIA_Gomez_Hello.DIA_Gomez_Hello_Kontakte","Info_AddChoice",""
"Scripts/content/Story/MISSIONS/DIA_EBR_100_Gomez.d:87","Ich habe die Prüfung des Vertrauens bestanden.","","","False","DIA_Gomez_Hello.DIA_Gomez_Hello_ThorusSays","Info_AddChoice",""
"Scripts/content/Story/MISSIONS/DIA_EBR_100_Gomez.d:92","Ich habe die Prüfung des Vertrauens bestanden und Thorus sagt, ich bin ein guter Mann.","","","False","DIA_Gomez_Hello_ThorusSays_15_00","",""
"Scripts/content/Story/MISSIONS/DIA_EBR_100_Gomez.d:93","Du wärst hier nicht lebend reingekommen, wenn das nicht so wäre. Ich hoffe, das war nicht schon alles.","","","False","DIA_Gomez_Hello_ThorusSays_11_01","",""
"Scripts/content/Story/MISSIONS/DIA_EBR_100_Gomez.d:99","Ich bin viel in der Kolonie rumgekommen und habe gute Kontakte in allen Lagern.","","","False","DIA_Gomez_Hello_Kontakte_15_00","",""
"Scripts/content/Story/MISSIONS/DIA_EBR_100_Gomez.d:100","Das ist tatsächlich ein guter Grund. Zu wem hast du Kontakte?","","","False","DIA_Gomez_Hello_Kontakte_11_01","",""
"Scripts/content/Story/MISSIONS/DIA_EBR_100_Gomez.d:102","Das waren alle wichtigen.","","","False","DIA_Gomez_Hello.DIA_Gomez_Hello_Kontakte_ThatsAll","Info_AddChoice",""
"Scripts/content/Story/MISSIONS/DIA_EBR_100_Gomez.d:103","Zu einigen Hehlern im Neuen Lager.","","","False","DIA_Gomez_Hello.DIA_Gomez_Hello_Kontakte_NLHehler","Info_AddChoice",""
"Scripts/content/Story/MISSIONS/DIA_EBR_100_Gomez.d:104","Zu Lares.","","","False","DIA_Gomez_Hello.DIA_Gomez_Hello_Kontakte_Lares","Info_AddChoice",""
"Scripts/content/Story/MISSIONS/DIA_EBR_100_Gomez.d:106","Zu einigen Baals aus dem Lager der Bruderschaft.","","","False","DIA_Gomez_Hello.DIA_Gomez_Hello_Kontakte_Baals","Info_AddChoice",""
"Scripts/content/Story/MISSIONS/DIA_EBR_100_Gomez.d:107","Zu Cor Kalom.","","","False","DIA_Gomez_Hello.DIA_Gomez_Hello_Kontakte_Kalom","Info_AddChoice",""
"Scripts/content/Story/MISSIONS/DIA_EBR_100_Gomez.d:111","Zu Y'Berion.","","","False","DIA_Gomez_Hello.DIA_Gomez_Hello_Kontakte_YBerion","Info_AddChoice",""
"Scripts/content/Story/MISSIONS/DIA_EBR_100_Gomez.d:117","Weil hier nur Schwachköpfe rumrennen, die ihre Aufgaben lieber an Neulinge weitergeben, statt sie selber zu erledigen.","","","False","DIA_Gomez_Hello_Spinner_15_00","",""
"Scripts/content/Story/MISSIONS/DIA_EBR_100_Gomez.d:118","Das ist zwar bis auf wenige Ausnahmen richtig, aber kein Grund einen weiteren Schwachkopf anzuheuern.","","","False","DIA_Gomez_Hello_Spinner_11_01","",""
"Scripts/content/Story/MISSIONS/DIA_EBR_100_Gomez.d:123","Ich hoffe ich muss dir nicht erst den Kopf abhacken, um dir zu beweisen, dass ich mit einer Waffe umgehen kann","","","False","DIA_Gomez_Hello_KopfAb_15_00","",""
"Scripts/content/Story/MISSIONS/DIA_EBR_100_Gomez.d:124","Mut und Dummheit liegen dicht beieinander ...","","","False","DIA_Gomez_Hello_KopfAb_11_01","",""
"Scripts/content/Story/MISSIONS/DIA_EBR_100_Gomez.d:136","Zu Y'Berion.","","","False","DIA_Gomez_Hello_Kontakte_YBerion_15_00","",""
"Scripts/content/Story/MISSIONS/DIA_EBR_100_Gomez.d:137","Y'Berion gibt sich nicht mit Burschen wie dir ab.","","","False","DIA_Gomez_Hello_Kontakte_YBerion_11_01","",""
"Scripts/content/Story/MISSIONS/DIA_EBR_100_Gomez.d:138","Dass du lügst, zeigt mir, dass du mich für dumm hältst.","","","False","DIA_Gomez_Hello_Kontakte_YBerion_11_02","",""
"Scripts/content/Story/MISSIONS/DIA_EBR_100_Gomez.d:139","Dass du mich für DUMM hältst, enttäuscht mich.","","","False","DIA_Gomez_Hello_Kontakte_YBerion_11_03","",""
"Scripts/content/Story/MISSIONS/DIA_EBR_100_Gomez.d:140","Ich hasse es, enttäuscht zu werden.","","","False","DIA_Gomez_Hello_Kontakte_YBerion_11_04","",""
"Scripts/content/Story/MISSIONS/DIA_EBR_100_Gomez.d:149","Zu Cor Kalom.","","","False","DIA_Gomez_Hello_Kontakte_Kalom_15_00","",""
"Scripts/content/Story/MISSIONS/DIA_EBR_100_Gomez.d:150","Und?","","","False","DIA_Gomez_Hello_Kontakte_Kalom_11_01","",""
"Scripts/content/Story/MISSIONS/DIA_EBR_100_Gomez.d:156","Zu einigen Baals aus dem Lager der Bruderschaft.","","","False","DIA_Gomez_Hello_Kontakte_Baals_15_00","",""
"Scripts/content/Story/MISSIONS/DIA_EBR_100_Gomez.d:157","Und?","","","False","DIA_Gomez_Hello_Kontakte_Baals_11_01","",""
"Scripts/content/Story/MISSIONS/DIA_EBR_100_Gomez.d:177","Zu Lares.","","","False","DIA_Gomez_Hello_Kontakte_Lares_15_00","",""
"Scripts/content/Story/MISSIONS/DIA_EBR_100_Gomez.d:178","Und?","","","False","DIA_Gomez_Hello_Kontakte_Lares_11_01","",""
"Scripts/content/Story/MISSIONS/DIA_EBR_100_Gomez.d:184","Zu einigen Hehlern im Neuen Lager.","","","False","DIA_Gomez_Hello_Kontakte_NLHehler_15_00","",""
"Scripts/content/Story/MISSIONS/DIA_EBR_100_Gomez.d:185","Und?","","","False","DIA_Gomez_Hello_Kontakte_NLHehler_11_01","",""
"Scripts/content/Story/MISSIONS/DIA_EBR_100_Gomez.d:191","Das waren alle wichtigen.","","","False","DIA_Gomez_Hello_Kontakte_ThatsAll_15_00","",""
"Scripts/content/Story/MISSIONS/DIA_EBR_100_Gomez.d:194","Beachtlich - für einen Neuling wie dich ...","","","False","DIA_Gomez_Hello_Kontakte_ThatsAll_11_01","",""
"Scripts/content/Story/MISSIONS/DIA_EBR_100_Gomez.d:195","Du sollst deine Chance kriegen.","","","False","DIA_Gomez_Hello_Kontakte_ThatsAll_11_02","",""
"Scripts/content/Story/MISSIONS/DIA_EBR_100_Gomez.d:200","DAMIT willst du mich beeindrucken? Im Lager gibt es BUDDLER, die bessere Beziehungen haben!","","","False","DIA_Gomez_Hello_Kontakte_ThatsAll_INSUFF_11_00","",""
"Scripts/content/Story/MISSIONS/DIA_EBR_100_Gomez.d:214","Heißt das, ich bin dabei?","","","False","DIA_Gomez_Dabei.description","",""
"Scripts/content/Story/MISSIONS/DIA_EBR_100_Gomez.d:228","Heißt das, ich bin dabei?","","","False","DIA_Gomez_Dabei_15_00","",""
"Scripts/content/Story/MISSIONS/DIA_EBR_100_Gomez.d:229","Genau das heißt es. Du bist jetzt einer von uns, Kleiner.","","","False","DIA_Gomez_Dabei_11_01","",""
"Scripts/content/Story/MISSIONS/DIA_EBR_100_Gomez.d:230","Alles Weitere wird dir Raven erzählen.","","","False","DIA_Gomez_Dabei_11_02","",""
"Scripts/content/Story/MISSIONS/DIA_EBR_100_Gomez.d:260","Ich wollte mal einen Zwischenbericht abgeben.","","","False","DIA_Gomez_NurSo.description","",""
"Scripts/content/Story/MISSIONS/DIA_EBR_100_Gomez.d:273","Ich wollte mal einen Zwischenbericht abgeben.","","","False","DIA_Gomez_NurSo_15_00","",""
"Scripts/content/Story/MISSIONS/DIA_EBR_100_Gomez.d:274","Dann geh zu Raven. Und sprich mich nie wieder an, ohne dass du dazu aufgefordert worden bist!","","","False","DIA_Gomez_NurSo_11_00","",""
"Scripts/content/Story/MISSIONS/DIA_EBR_100_Gomez.d:304","Wie bist du denn hier rein gekommen?","","","False","DIA_EBR_100_Gomez_Wait4SC_11_01","",""
"Scripts/content/Story/MISSIONS/DIA_EBR_100_Gomez.d:305","Moment! Bist du nicht diese Pestzecke gewesen, die unsere Leute in der Freien Mine kalt gemacht hat?","","","False","DIA_EBR_100_Gomez_Wait4SC_11_02","",""
"Scripts/content/Story/MISSIONS/DIA_EBR_100_Gomez.d:306","Deine Leute hatten kein Recht, dort einzufallen. Ich habe diesen Anflug von Größenwahnsinn nur wieder korrigiert!","","","False","DIA_EBR_100_Gomez_Wait4SC_15_03","",""
"Scripts/content/Story/MISSIONS/DIA_EBR_100_Gomez.d:307","Du hast Mut, so mit mir - GOMEZ - zu sprechen, aber es war ziemlich dumm von dir, hier einfach aufzutauchen.","","","False","DIA_EBR_100_Gomez_Wait4SC_11_04","",""
"Scripts/content/Story/MISSIONS/DIA_EBR_100_Gomez.d:308","Ich werde persönlich sicherstellen, dass du mir nie wieder in die Suppe spucken wirst.","","","False","DIA_EBR_100_Gomez_Wait4SC_11_05","",""
"Scripts/content/Story/MISSIONS/DIA_EBR_101_Scar.d:33","Wer bist du?","","","False","DIA_SCAR_Hello.description","",""
"Scripts/content/Story/MISSIONS/DIA_EBR_101_Scar.d:43","Wer bist du?","","","False","DIA_SCAR_Hello_15_00","",""
"Scripts/content/Story/MISSIONS/DIA_EBR_101_Scar.d:44","Sie nennen mich Scar.","","","False","DIA_SCAR_Hello_08_01","",""
"Scripts/content/Story/MISSIONS/DIA_EBR_101_Scar.d:56","Was ist deine Aufgabe hier?","","","False","DIA_SCAR_What.description","",""
"Scripts/content/Story/MISSIONS/DIA_EBR_101_Scar.d:69","Was ist deine Aufgabe hier?","","","False","DIA_SCAR_What_15_00","",""
"Scripts/content/Story/MISSIONS/DIA_EBR_101_Scar.d:70","Ich und Arto passen auf, dass Gomez niemand zu nahe kommt, der hier nicht eingeladen wurde,","","","False","DIA_SCAR_What_08_01","",""
"Scripts/content/Story/MISSIONS/DIA_EBR_101_Scar.d:71","Außerdem kümmere ich mich darum, dass die Frauen hier nicht zu kurz kommen .","","","False","DIA_SCAR_What_08_02","",""
"Scripts/content/Story/MISSIONS/DIA_EBR_101_Scar.d:83","Als sie mich reingeworfen haben, habe ich eine Frau gesehen.","","","False","DIA_SCAR_Frau.description","",""
"Scripts/content/Story/MISSIONS/DIA_EBR_101_Scar.d:96","Als sie mich reingeworfen haben, habe ich gesehen, wie eine Frau zusammen mit den Waren heruntergefahren wurde.","","","False","DIA_SCAR_Frau_15_00","",""
"Scripts/content/Story/MISSIONS/DIA_EBR_101_Scar.d:97","Und?","","","False","DIA_SCAR_Frau_08_01","",""
"Scripts/content/Story/MISSIONS/DIA_EBR_101_Scar.d:98","Ist sie hier?","","","False","DIA_SCAR_Frau_15_02","",""
"Scripts/content/Story/MISSIONS/DIA_EBR_101_Scar.d:99","Wenn du dich für sie interessierst, geb' ich dir einen guten Rat: Vergiss sie.","","","False","DIA_SCAR_Frau_08_03","",""
"Scripts/content/Story/MISSIONS/DIA_EBR_101_Scar.d:100","Sie ist gerade angekommen und Gomez hat sie bei sich auf dem Zimmer eingesperrt.","","","False","DIA_SCAR_Frau_08_04","",""
"Scripts/content/Story/MISSIONS/DIA_EBR_101_Scar.d:101","Wenn er sie 'ne Zeit lang gehabt hat, schickt er sie vielleicht runter. Aber jetzt gehört sie IHM - also verschwende besser keinen Gedanken an sie.","","","False","DIA_SCAR_Frau_08_05","",""
"Scripts/content/Story/MISSIONS/DIA_EBR_101_Scar.d:114","Kannst du mir etwas über Gomez erzählen?","","","False","DIA_SCAR_PERM.description","",""
"Scripts/content/Story/MISSIONS/DIA_EBR_101_Scar.d:127","Kannst du mir etwas über Gomez erzählen?","","","False","DIA_SCAR_PERM_15_00","",""
"Scripts/content/Story/MISSIONS/DIA_EBR_101_Scar.d:128","Über ihn musst du nur wissen, dass er der mächtigste Mann der Kolonie ist.","","","False","DIA_SCAR_PERM_08_01","",""
"Scripts/content/Story/MISSIONS/DIA_EBR_101_Scar.d:129","Er kann alles haben, was er will, aber das einzige, was ihn WIRKLICH interessiert, ist Einfluss.","","","False","DIA_SCAR_PERM_08_02","",""
"Scripts/content/Story/MISSIONS/DIA_EBR_102_Arto.d:33","Wer bist du?","","","False","DIA_ARTO_Hello.description","",""
"Scripts/content/Story/MISSIONS/DIA_EBR_102_Arto.d:43","Wer bist du?","","","False","DIA_ARTO_Hello_15_00","",""
"Scripts/content/Story/MISSIONS/DIA_EBR_102_Arto.d:44","Ich bin Arto.","","","False","DIA_ARTO_Hello_13_01","",""
"Scripts/content/Story/MISSIONS/DIA_EBR_102_Arto.d:56","Was machst du so?","","","False","DIA_ARTO_What.description","",""
"Scripts/content/Story/MISSIONS/DIA_EBR_102_Arto.d:69","Was machst du so?","","","False","DIA_ARTO_What_15_00","",""
"Scripts/content/Story/MISSIONS/DIA_EBR_102_Arto.d:70","Ich bin Gomez' Leibwächter.","","","False","DIA_ARTO_What_13_01","",""
"Scripts/content/Story/MISSIONS/DIA_EBR_102_Arto.d:83","Du redest nicht viel, was?","","","False","DIA_ARTO_PERM.description","",""
"Scripts/content/Story/MISSIONS/DIA_EBR_102_Arto.d:96","Du redest nicht viel, was?","","","False","DIA_ARTO_PERM_15_00","",""
"Scripts/content/Story/MISSIONS/DIA_EBR_102_Arto.d:97","Nein.","","","False","DIA_ARTO_PERM_13_01","",""
"Scripts/content/Story/MISSIONS/DIA_EBR_105_Raven.d:47","Was kann ich für dich tun?","","","False","DIA_Raven_FirstIn_10_00","",""
"Scripts/content/Story/MISSIONS/DIA_EBR_105_Raven.d:59","Wer bist du?","","","False","DIA_Raven_Who.description","",""
"Scripts/content/Story/MISSIONS/DIA_EBR_105_Raven.d:69","Wer bist du?","","","False","DIA_Raven_Who_15_00","",""
"Scripts/content/Story/MISSIONS/DIA_EBR_105_Raven.d:70","Ich bin Raven. Gomez' rechte Hand. Jeder, der hier ist, um mit Gomez zu reden, redet vorher mit MIR.","","","False","DIA_Raven_Who_10_01","",""
"Scripts/content/Story/MISSIONS/DIA_EBR_105_Raven.d:82","Ich habe eine Ladung Kraut für Gomez von Cor Kalom.","","","False","DIA_Raven_Krautbote.description","",""
"Scripts/content/Story/MISSIONS/DIA_EBR_105_Raven.d:95","Ich habe eine Ladung Kraut für Gomez von Cor Kalom.","","","False","DIA_Raven_Krautbote_15_00","",""
"Scripts/content/Story/MISSIONS/DIA_EBR_105_Raven.d:96","Bartholo kümmert sich um diese Sachen, Gomez selbst gibt sich nicht mit Boten ab.","","","False","DIA_Raven_Krautbote_10_01","",""
"Scripts/content/Story/MISSIONS/DIA_EBR_105_Raven.d:97","Du findest ihn in der Kammer hier rechts hinter dem Eingang oder in der Küche im großen Turm.","","","False","DIA_Raven_Krautbote_10_02","",""
"Scripts/content/Story/MISSIONS/DIA_EBR_105_Raven.d:98","Nachts schläft er natürlich. Da würd' ich es nicht wagen, ihn zu stören.","","","False","DIA_Raven_Krautbote_10_03","",""
"Scripts/content/Story/MISSIONS/DIA_EBR_105_Raven.d:112","Ich will zu Gomez. Thorus sagt, ich soll als Schatten aufgenommen werden.","","","False","DIA_Raven_Aufnahme.description","",""
"Scripts/content/Story/MISSIONS/DIA_EBR_105_Raven.d:126","Ich will zu Gomez. Thorus sagt, ich soll als Schatten aufgenommen werden.","","","False","DIA_Raven_Aufnahme_15_00","",""
"Scripts/content/Story/MISSIONS/DIA_EBR_105_Raven.d:127","Wir sind immer auf der Suche nach guten Leuten. Du scheinst mir nicht auf den Kopf gefallen zu sein. Du könntest es hier zu was bringen.","","","False","DIA_Raven_Aufnahme_10_01","",""
"Scripts/content/Story/MISSIONS/DIA_EBR_105_Raven.d:128","Ich werde dich zu Gomez führen. Folge mir. Und fass nichts an!","","","False","DIA_Raven_Aufnahme_10_02","",""
"Scripts/content/Story/MISSIONS/DIA_EBR_105_Raven.d:156","Dort hinten ist Gomez. Wenn du ihm keinen Respekt zeigst, werde ich dir persönlich welchen beibringen, ist das klar?","","","False","DIA_Raven_There_10_01","",""
"Scripts/content/Story/MISSIONS/DIA_EBR_105_Raven.d:172","Wie steht der Erzhandel?","","","False","DIA_Raven_PERM.description","",""
"Scripts/content/Story/MISSIONS/DIA_EBR_105_Raven.d:185","Wie steht der Erzhandel?","","","False","DIA_Raven_PERM_15_00","",""
"Scripts/content/Story/MISSIONS/DIA_EBR_105_Raven.d:186","Die Alte Mine spuckt genug aus. Die letzte Lieferung aus der Außenwelt war ziemlich fett.","","","False","DIA_Raven_PERM_10_01","",""
"Scripts/content/Story/MISSIONS/DIA_EBR_105_Raven.d:198","Gomez sagt, ich bin dabei.","","","False","DIA_Raven_BinDabei.description","",""
"Scripts/content/Story/MISSIONS/DIA_EBR_105_Raven.d:217","Gomez sagt, ich bin dabei.","","","False","DIA_Raven_BinDabei_15_00","",""
"Scripts/content/Story/MISSIONS/DIA_EBR_105_Raven.d:218","Gut! Du kannst dich gleich bei deinem ersten Auftrag bewähren.","","","False","DIA_Raven_BinDabei_10_01","",""
"Scripts/content/Story/MISSIONS/DIA_EBR_105_Raven.d:219","Wenn deine Verbindungen wirklich so gut sind, wie du sagst, solltest du keine Probleme damit haben.","","","False","DIA_Raven_BinDabei_10_02","",""
"Scripts/content/Story/MISSIONS/DIA_EBR_105_Raven.d:235","Was soll ich für dich erledigen?","","","False","DIA_Raven_SpySect.description","",""
"Scripts/content/Story/MISSIONS/DIA_EBR_105_Raven.d:248","Was soll ich für dich erledigen?","","","False","DIA_Raven_SpySect_15_00","",""
"Scripts/content/Story/MISSIONS/DIA_EBR_105_Raven.d:249","Wir stehen mit der Bruderschaft in Handelskontakt. Das bedeutet nicht, das wir ihnen unbedingt vertrauen.","","","False","DIA_Raven_SpySect_10_01","",""
"Scripts/content/Story/MISSIONS/DIA_EBR_105_Raven.d:250","Mach dich auf den Weg in den Sumpf.","","","False","DIA_Raven_SpySect_10_02","",""
"Scripts/content/Story/MISSIONS/DIA_EBR_105_Raven.d:251","Wenn du dort im Lager bist, halte die Ohren auf. Alles was du erfährst, kann für uns nützlich sein.","","","False","DIA_Raven_SpySect_10_03","",""
"Scripts/content/Story/MISSIONS/DIA_EBR_105_Raven.d:252","Und je mehr du erfährst, desto besser. Das Ganze erfordert ein gewisses Feingefühl. Du weißt, was ich meine?","","","False","DIA_Raven_SpySect_10_04","",""
"Scripts/content/Story/MISSIONS/DIA_EBR_105_Raven.d:253","Bleib ruhig, ich werde ihren Zorn nicht heraufbeschwören.","","","False","DIA_Raven_SpySect_15_05","",""
"Scripts/content/Story/MISSIONS/DIA_EBR_105_Raven.d:254","Ich wusste, dass du mich verstehen würdest.","","","False","DIA_Raven_SpySect_10_06","",""
"Scripts/content/Story/MISSIONS/DIA_EBR_105_Raven.d:272","Wo bekomme ich bessere Ausrüstung her?","","","False","DIA_Raven_Equipment.description","",""
"Scripts/content/Story/MISSIONS/DIA_EBR_105_Raven.d:285","Wo bekomme ich bessere Ausrüstung her?","","","False","DIA_Raven_Equipment_15_00","",""
"Scripts/content/Story/MISSIONS/DIA_EBR_105_Raven.d:286","Geh zu Diego, er wird dir 'ne Rüstung geben. Damit wirst du nicht so schnell umgebracht und sie dient auch gleichzeitig als Ausweis.","","","False","DIA_Raven_Equipment_10_01","",""
"Scripts/content/Story/MISSIONS/DIA_EBR_105_Raven.d:287","Mit deiner neuen Rüstung solltest du hier überall hinkommen, wo du hin musst.","","","False","DIA_Raven_Equipment_10_02","",""
"Scripts/content/Story/MISSIONS/DIA_EBR_105_Raven.d:288","Und wenn du Waffen brauchst, geh zu Skip, er ist in der großen Scheune hinten links auf den Burgplatz.","","","False","DIA_Raven_Equipment_10_03","",""
"Scripts/content/Story/MISSIONS/DIA_EBR_105_Raven.d:314","Ich will einen Zwischenbericht abgeben.","","","False","DIA_Raven_SpyBericht.description","",""
"Scripts/content/Story/MISSIONS/DIA_EBR_105_Raven.d:327","Ich will einen Zwischenbericht abgeben.","","","False","DIA_Raven_SpyBericht_15_00","",""
"Scripts/content/Story/MISSIONS/DIA_EBR_105_Raven.d:328","Gut. Ich bin gerne gut informiert.","","","False","DIA_Raven_SpyBericht_10_01","",""
"Scripts/content/Story/MISSIONS/DIA_EBR_105_Raven.d:335","Du hast deine Sache gut gemacht.","","","False","DIA_Raven_SpyBericht_10_04","",""
"Scripts/content/Story/MISSIONS/DIA_EBR_105_Raven.d:343","Sie wollen die Eier einer Minecrawler-Königin, um daraus ein Elixier herzustellen, durch das sie Kontakt zum Schläfer aufnehmen können. Ich habe die Eier bei mir.","","","False","DIA_Raven_SpyBericht_15_02","",""
"Scripts/content/Story/MISSIONS/DIA_EBR_105_Raven.d:346","Interessant. Bin gespannt, ob die Sache funktioniert. Bring die Eier in den Tempel.","","","False","DIA_Raven_SpyBericht_10_03","",""
"Scripts/content/Story/MISSIONS/DIA_EBR_105_Raven.d:360","Ich weiß noch nicht GENAU was sie vorhaben.","","","False","DIA_Raven_SpyBericht_15_05","",""
"Scripts/content/Story/MISSIONS/DIA_EBR_105_Raven.d:361","Was belästigst du mich dann?","","","False","DIA_Raven_SpyBericht_10_06","",""
"Scripts/content/Story/MISSIONS/DIA_EBR_106_Bartholo.d:33","Wer bist du?","","","False","Info_Bartholo_HAllo.description","",""
"Scripts/content/Story/MISSIONS/DIA_EBR_106_Bartholo.d:43","Wer bist du?","","","False","Info_Bartholo_HAllo_15_00","",""
"Scripts/content/Story/MISSIONS/DIA_EBR_106_Bartholo.d:44","Ich bin Bartholo. Ich kümmere mich um die Versorgung der Erzbarone.","","","False","Info_Bartholo_HAllo_12_01","",""
"Scripts/content/Story/MISSIONS/DIA_EBR_106_Bartholo.d:45","Ich regele alles - von Krautlieferungen, über Essen bis hin zur Versorgung der Frauen.","","","False","Info_Bartholo_HAllo_12_02","",""
"Scripts/content/Story/MISSIONS/DIA_EBR_106_Bartholo.d:46","Außerdem sorge ich dafür, dass die beiden idiotischen Köche ihre Arbeit gut machen.","","","False","Info_Bartholo_HAllo_12_03","",""
"Scripts/content/Story/MISSIONS/DIA_EBR_106_Bartholo.d:47","Sie sollten mir dafür dankbar sein. Gomez lässt sich nicht jeden Fraß gefallen. Die letzten beiden hat er an die Snapper im Fluss verfüttert.","","","False","Info_Bartholo_HAllo_12_04","",""
"Scripts/content/Story/MISSIONS/DIA_EBR_106_Bartholo.d:60","Ich will mit dir handeln.","","","False","Info_Bartholo_PERM.description","",""
"Scripts/content/Story/MISSIONS/DIA_EBR_106_Bartholo.d:74","Ich will mit dir handeln.","","","False","Info_Bartholo_PERM_15_00","",""
"Scripts/content/Story/MISSIONS/DIA_EBR_106_Bartholo.d:75","Ich habe einiges da - wenn du genug Erz hast.","","","False","Info_Bartholo_PERM_12_01","",""
"Scripts/content/Story/MISSIONS/DIA_EBR_106_Bartholo.d:88","Ich habe ne Ladung Kraut von Cor Kalom für Gomez.","","","False","Info_Bartholo_Krautbote.description","",""
"Scripts/content/Story/MISSIONS/DIA_EBR_106_Bartholo.d:101","Ich habe 'ne Ladung Kraut von Cor Kalom für Gomez.","","","False","Info_Bartholo_Krautbote_15_00","",""
"Scripts/content/Story/MISSIONS/DIA_EBR_106_Bartholo.d:102","Zeig her!","","","False","Info_Bartholo_Krautbote_12_01","",""
"Scripts/content/Story/MISSIONS/DIA_EBR_106_Bartholo.d:106","Hmmmmmmm ...","","","False","Info_Bartholo_Krautbote_12_02","",""
"Scripts/content/Story/MISSIONS/DIA_EBR_106_Bartholo.d:107","Gut! Gomez ist beinahe ungeduldig geworden. Sei froh, dass du es heute noch abgeliefert hast!","","","False","Info_Bartholo_Krautbote_12_03","",""
"Scripts/content/Story/MISSIONS/DIA_EBR_106_Bartholo.d:108","Was ist mit der Bezahlung?","","","False","Info_Bartholo_Krautbote_15_04","",""
"Scripts/content/Story/MISSIONS/DIA_EBR_106_Bartholo.d:109","Nicht so eilig ... Hier, nimm. 500 Erz waren abgemacht.","","","False","Info_Bartholo_Krautbote_12_05","",""
"Scripts/content/Story/MISSIONS/DIA_EBR_106_Bartholo.d:123","Du hast zu wenig Kraut für einen Boten! Ich will für dich nicht hoffen, dass du das Zeug verscherbelt hast! Komm wieder, wenn du die richtige Menge dabei hast!","","","False","Info_Bartholo_Krautbote_NoKraut_12_00","",""
"Scripts/content/Story/MISSIONS/DIA_EBR_106_Bartholo.d:150","Ich hatte mir fast gedacht, dass es jemand durch das Pentagramm versuchen würde!","","","False","Info_Bartholo_12_01","",""
"Scripts/content/Story/MISSIONS/DIA_EBR_106_Bartholo.d:151","Aber im Gegensatz zu diesem verräterischen Schmied Stone brauchen wir dich nicht mehr!","","","False","Info_Bartholo_12_02","",""
"Scripts/content/Story/MISSIONS/DIA_EBR_106_Bartholo.d:152","Wo ist Stone?","","","False","Info_Bartholo_15_03","",""
"Scripts/content/Story/MISSIONS/DIA_EBR_106_Bartholo.d:153","Hinter Gittern! Aber dafür wirst du gleich unter der Erde liegen!","","","False","Info_Bartholo_12_04","",""
"Scripts/content/Story/MISSIONS/DIA_EBR_106_Bartholo.d:154","Schnappt ihn euch, Jungs, und macht ihn kalt!","","","False","Info_Bartholo_12_05","",""
