"location","source","target","id","fuzzy","context","translator_comments","developer_comments"
"Scripts/content/Story/MISSIONS/DIA_Vlk_580_Grim.d:368","Was ist DEINE Prüfung des Vertrauens?","Mi a TE bizalom próbád?","","False","DIA_Grim_YourPDV_15_00","",""
"Scripts/content/Story/MISSIONS/DIA_Vlk_580_Grim.d:369","Das kann ich dir nicht sagen, Mann. Über solche Dinge musst du hier schweigen!","Azt nem mondhatom el, ember. Az efféle dolgokat jobb titokban tartani itt!","","False","DIA_Grim_YourPDV_06_01","",""
"Scripts/content/Story/MISSIONS/DIA_Vlk_580_Grim.d:402","Hey, hast du schon gehört?","Hé, hallottad a híreket?","","False","DIA_Grim_INEXTREMO_06_01","",""
"Scripts/content/Story/MISSIONS/DIA_Vlk_580_Grim.d:403","In Extremo ist hier. Sie sind drüben auf der Bühne.","Az In Extremo megérkezett. Fellépnek a színpadon.","","False","DIA_Grim_INEXTREMO_06_02","",""
"Scripts/content/Story/MISSIONS/DIA_Vlk_580_Grim.d:404","Schnell, sonst versäumst du noch den Auftritt!","Siess, különben lekésed a koncertet!","","False","DIA_Grim_INEXTREMO_06_03","",""
"Scripts/content/Story/MISSIONS/DIA_Vlk_580_Grim.d:428","Wo sind InExtremo?","Hol lép fel az In Extremo?","","False","DIA_Grim_INEXTREMOAWAY.description","",""
"Scripts/content/Story/MISSIONS/DIA_Vlk_580_Grim.d:442","Wo sind InExtremo?","Hol lép fel az In Extremo?","","False","DIA_Grim_INEXTREMOAWAY_15_01","",""
"Scripts/content/Story/MISSIONS/DIA_Vlk_580_Grim.d:443","Sie sind weitergezogen. Schade, ich hatte mich an die Abende vor der Bühne gewöhnt.","Tovább álltak. Milyen kár, kezdtem hozzászokni, hogy estéimet a színpad előtt töltöttem.","","False","DIA_Grim_INEXTREMOAWAY_06_02","",""
"Scripts/content/Story/MISSIONS/DIA_Vlk_581_Snaf.d:33","Wie steht's?","Mi a helyzet?","","False","DIA_Snaf_Hello.description","",""
"Scripts/content/Story/MISSIONS/DIA_Vlk_581_Snaf.d:43","Wie steht's?","Mi a helyzet?","","False","DIA_Snaf_Hello_15_00","",""
"Scripts/content/Story/MISSIONS/DIA_Vlk_581_Snaf.d:44","Nicht schlecht. Wenn man gut kochen kann, hat man viele Freunde hier.","Nem rossz. Ha jól tudsz főzni, nagyon sok barátot találsz itt.","","False","DIA_Snaf_Hello_01_01","",""
"Scripts/content/Story/MISSIONS/DIA_Vlk_581_Snaf.d:45","Willst du etwas von meinem Reiseintopf? Hier, nimm und lass es dir schmecken.","Szeretnéd megkóstolni a rizses ragumat?","","False","DIA_Snaf_Hello_01_02","",""
"Scripts/content/Story/MISSIONS/DIA_Vlk_581_Snaf.d:46","Danke.","Köszi.","","False","DIA_Snaf_Hello_15_03","",""
"Scripts/content/Story/MISSIONS/DIA_Vlk_581_Snaf.d:47","Du könntest mir einen Gefallen tun.","Megkérnélek egy szívességre.","","False","DIA_Snaf_Hello_01_04","",""
"Scripts/content/Story/MISSIONS/DIA_Vlk_581_Snaf.d:65","Was kann ich für dich tun?","Mit tehetek érted?","","False","DIA_Snaf_Zutaten.description","",""
"Scripts/content/Story/MISSIONS/DIA_Vlk_581_Snaf.d:78","Was kann ich für dich tun?","Mit tehetek érted?","","False","DIA_Snaf_Zutaten_15_00","",""
"Scripts/content/Story/MISSIONS/DIA_Vlk_581_Snaf.d:79","Du bist sicher gutes Essen gewöhnt. Ich hab' da ein neues Rezept: Fleischwanzen-Ragout ŕ la Snaf, mit Reis und Pilzen.","Biztos jó ételekhez vagy szokva. Van egy új receptem: húsbogár ragu Snaf módra, rizzsel és gombával.","","False","DIA_Snaf_Zutaten_01_01","",""
"Scripts/content/Story/MISSIONS/DIA_Vlk_581_Snaf.d:80","Du kannst haben, so viel du willst, aber ich brauche aber noch 3 Fleischwanzen und einige Höllenpilze - 5 müssten reichen.","Ehetsz belőle amennyit csak akarsz, de szükségem van 3 Húsbogárra és néhány pokolgombára - 5 biztosan elég lesz.","","False","DIA_Snaf_Zutaten_01_02","",""
"Scripts/content/Story/MISSIONS/DIA_Vlk_581_Snaf.d:83","Willst du, dass ich kotze?","Azt akarod hogy hányjak?","","False","DIA_Snaf_Zutaten.DIA_Snaf_Zutaten_KOTZ","Info_AddChoice",""
"Scripts/content/Story/MISSIONS/DIA_Vlk_581_Snaf.d:84","Hört sich gut an.","Jól hangzik.","","False","DIA_Snaf_Zutaten.DIA_Snaf_Zutaten_DoIt","Info_AddChoice",""
"Scripts/content/Story/MISSIONS/DIA_Vlk_581_Snaf.d:89","Willst du, dass ich kotze?","Azt akarod hogy hányjak?","","False","DIA_Snaf_Zutaten_KOTZ_15_00","",""
"Scripts/content/Story/MISSIONS/DIA_Vlk_581_Snaf.d:90","Du musst es ja nicht essen, aber zumindest probieren solltest du es! Falls du an die Sachen rankommst, denk an mich.","Nem muszáj megenned, de szerintem egy próbát azért megér! Ha úgy adódik, hogy megvan a hozzávaló, majd gondolj rám.","","False","DIA_Snaf_Zutaten_KOTZ_01_01","",""
"Scripts/content/Story/MISSIONS/DIA_Vlk_581_Snaf.d:91","Ich hab' schon jemanden geschickt, aber der kommt einfach nicht wieder - ist bestimmt zum Neuen Lager übergelaufen.","Már elküldtem valakit, de még mindig nem tért vissza - biztosan átpártolt az Új Táborhoz.","","False","DIA_Snaf_Zutaten_KOTZ_01_02","",""
"Scripts/content/Story/MISSIONS/DIA_Vlk_581_Snaf.d:103","Hört sich gut an.","Jól hangzik.","","False","DIA_Snaf_Zutaten_DoIt_15_00","",""
"Scripts/content/Story/MISSIONS/DIA_Vlk_581_Snaf.d:104","Dann sieh mal zu, dass du die Sachen besorgst.","Akkor indulj és majd meglátjuk sikerül-e összeszedni az alapanyagokat.","","False","DIA_Snaf_Zutaten_DoIt_01_01","",""
"Scripts/content/Story/MISSIONS/DIA_Vlk_581_Snaf.d:105","Der Letzte, den ich losgeschickt hab, kommt einfach nicht wieder - ist bestimmt zum Neuen Lager übergelaufen.","Az utolsó, akit elküldtem még mindig nem tért vissza - biztosan átpártolt az Új Táborhoz.","","False","DIA_Snaf_Zutaten_DoIt_01_02","",""
"Scripts/content/Story/MISSIONS/DIA_Vlk_581_Snaf.d:125","Ich hab' die Sachen, die du von mir wolltest!","Megvan minden amit kértél!","","False","DIA_Snaf_ZutatenSuccess.description","",""
"Scripts/content/Story/MISSIONS/DIA_Vlk_581_Snaf.d:138","Ich hab' die Sachen, die du von mir wolltest!","Megvan minden amit kértél!","","False","DIA_Snaf_ZutatenSuccess_15_00","",""
"Scripts/content/Story/MISSIONS/DIA_Vlk_581_Snaf.d:139","Gut, ich brauch sie nur noch dazuzugeben, dann ist der Eintopf fertig ... warte ...","Jó, csak hozzá kell adnom őket és a ragu máris kész... Egy pillanat ...","","False","DIA_Snaf_ZutatenSuccess_01_01","",""
"Scripts/content/Story/MISSIONS/DIA_Vlk_581_Snaf.d:177","Du hast gesagt, ich kann soviel von dem Eintopf haben, wie ich will...","Azt mondtad annyit ehetek amennyit akarok...","","False","DIA_Snaf_AfterSuccess.description","",""
"Scripts/content/Story/MISSIONS/DIA_Vlk_581_Snaf.d:190","Du hast gesagt, ich kann so viel von den Eintopf haben, wie ich will ...","Azt mondtad annyit ehetek amennyit akarok...","","False","DIA_Snaf_AfterSuccess_15_00","",""
"Scripts/content/Story/MISSIONS/DIA_Vlk_581_Snaf.d:194","Und das stimmt auch. Hier, nimm 3 Portionen!","És meg is volnánk. Tessék, itt van 3 porció.","","False","DIA_Snaf_AfterSuccess_01_01","",""
"Scripts/content/Story/MISSIONS/DIA_Vlk_581_Snaf.d:201","Klar! Heute ist aber alles schon auf. Komm morgen wieder!","Így van! De a mai adag elfogyott. Gyere vissza holnap!","","False","DIA_Snaf_AfterSuccess_01_02","",""
"Scripts/content/Story/MISSIONS/DIA_Vlk_581_Snaf.d:214","Wo finde ich Fleischwanzen?","Merre találok Húsbogarakat?","","False","DIA_Snaf_WhereMeatbugs.description","",""
"Scripts/content/Story/MISSIONS/DIA_Vlk_581_Snaf.d:227","Wo finde ich Fleischwanzen?","Merre találom a Húsbogarakat?","","False","DIA_Snaf_WhereMeatbugs_15_00","",""
"Scripts/content/Story/MISSIONS/DIA_Vlk_581_Snaf.d:228","Überall da, wo Müll rumliegt. An der Burgmauer gibt es einige verlassene Hütten, da solltest du welche finden.","Mindenhol ahol szemét fekszik a földön. Biztosan találsz egy párat a lakatlan viskók körül a vár fal tövében.","","False","DIA_Snaf_WhereMeatbugs_01_01","",""
"Scripts/content/Story/MISSIONS/DIA_Vlk_581_Snaf.d:229","Lass dich von ihrem fiesen Aussehen nicht täuschen. Gekocht sind sie lecker.","Ne zavarjon meg a ronda külsejük. Megfőzve nagyon ízletesek.","","False","DIA_Snaf_WhereMeatbugs_01_02","",""
"Scripts/content/Story/MISSIONS/DIA_Vlk_581_Snaf.d:243","Wo finde ich Höllenpilze?","Merre találok Pokolgombát?","","False","DIA_Snaf_WhereMushrooms.description","",""
"Scripts/content/Story/MISSIONS/DIA_Vlk_581_Snaf.d:256","Wo finde ich Höllenpilze?","Merre találok Pokolgombát?","","False","DIA_Snaf_WhereMushrooms_15_00","",""
"Scripts/content/Story/MISSIONS/DIA_Vlk_581_Snaf.d:257","Wenn du aus dem Südtor rausgehst - das ist der umgestürzte Turm - findest du direkt vor dir eine Ebene, auf der Pilze wachsen.","Ha kimész a déli kapun - a leomlott torony mellet - egy tisztásra érsz pontosan veled szemben. Sok gomba nő arrafelé.","","False","DIA_Snaf_WhereMushrooms_01_01","",""
"Scripts/content/Story/MISSIONS/DIA_Vlk_581_Snaf.d:271","Wer war der Typ, den du vor mir losgeschickt hast?","Ki volt az a srác akit előttem küldtél?","","False","DIA_Snaf_WhereNek.description","",""
"Scripts/content/Story/MISSIONS/DIA_Vlk_581_Snaf.d:284","Wer war der Typ, den du vor mir losgeschickt hast?","Ki volt az a srác akit előttem küldtél?","","False","DIA_Snaf_WhereNek_15_00","",""
"Scripts/content/Story/MISSIONS/DIA_Vlk_581_Snaf.d:285","Sein Name war Nek. Er war ziemlich unzufrieden hier - ich denke, er ist jetzt im Neuen Lager.","Nek-nek hívták. Elégedetlen volt az itteni viszonyokkal - úgy gondolom most már az Új Táborban van.","","False","DIA_Snaf_WhereNek_01_01","",""
"Scripts/content/Story/MISSIONS/DIA_Vlk_581_Snaf.d:286","Hab ihn Pilze suchen geschickt - aber er kam nicht wieder ...","Elküldtem gombát gyűjteni - de még nem jött vissza...","","False","DIA_Snaf_WhereNek_01_02","",""
"Scripts/content/Story/MISSIONS/DIA_Vlk_582_Melvin.d:33","Hi! Du bist nicht aus diesem Lager, oder?","Üdv! Nem Táborbeli vagy, igaz?","","False","DIA_Melvin_Hello.description","",""
"Scripts/content/Story/MISSIONS/DIA_Vlk_582_Melvin.d:43","Hi! Du bist nicht aus diesem Lager, oder?","Üdv! Nem Táborbeli vagy, igaz?","","False","DIA_Melvin_Hello_15_00","",""
"Scripts/content/Story/MISSIONS/DIA_Vlk_582_Melvin.d:44","Jetzt schon! Ich bin vor 'ner Woche aus dem Alten Lager abgehauen. Hab' meinem Kumpel Dusty gesagt, er soll mitkommen, aber er wollte lieber noch warten.","Nos, most már az vagyok! Otthagytam a Régi Tábort hetekkel ezelőtt. Mondtam Dusty barátomnak, hogy tartson velem, de ő még várni akart.","","False","DIA_Melvin_Hello_03_01","",""
"Scripts/content/Story/MISSIONS/DIA_Vlk_582_Melvin.d:60","Ich kenne Dusty - hab' mich kurz mit ihm unterhalten.","Ismerem Dusty-t - Beszélgettem vele egy kicsit.","","False","DIA_Melvin_MetDusty.description","",""
"Scripts/content/Story/MISSIONS/DIA_Vlk_582_Melvin.d:73","Ich kenne Dusty - hab' mich kurz mit ihm unterhalten.","Ismerem Dusty-t - Beszélgettem vele egy kicsit.","","False","DIA_Melvin_MetDusty_15_00","",""
"Scripts/content/Story/MISSIONS/DIA_Vlk_582_Melvin.d:74","Wenn du ihn noch mal triffst, sag ihm, er ist schön blöd, dass er dageblieben ist. Wenn das hier nicht zehnmal besser ist, als sich im Alten Lager von den Gardisten schikanieren zu lassen, dann weiß ich's auch nicht mehr.","Ha újra találkoznál vele, mondd meg neki, hogy hülyeség volt ott maradnia. Itt tízszer jobb lenni, mint a Régi Tárborban hagyni, hogy az őrök zaklassanak.","","False","DIA_Melvin_MetDusty_03_01","",""
"Scripts/content/Story/MISSIONS/DIA_Vlk_582_Melvin.d:75","Werd's ihm ausrichten, wenn ich ihn noch mal sehe.","Átadom neki, ha újra látom.","","False","DIA_Melvin_MetDusty_15_02","",""
"Scripts/content/Story/MISSIONS/DIA_Vlk_583_Glen.d:30","Worauf sollte ich in der Mine achten?","Mit kell észben tartanom ha a bányában vagyok?","","False","VLK_583_Glen_INFO.description","",""
"Scripts/content/Story/MISSIONS/DIA_Vlk_583_Glen.d:40","Worauf sollte ich in der Mine achten?","Mit kell észben tartanom ha a bányában vagyok?","","False","VLK_583_Glen_INFO_Info_15_01","",""
"Scripts/content/Story/MISSIONS/DIA_Vlk_583_Glen.d:41","Auf die Minecrawler.","Óvakodj a Tárnarákoktól.","","False","VLK_583_Glen_INFO_Info_02_02","",""
"Scripts/content/Story/MISSIONS/DIA_Vlk_583_Glen.d:42","Je weiter du nach unten kommst, desto näher bist den Viechern. Die Mistdinger kommen direkt aus Beliars Reich!","Minél lejjebb mész, annál közelebb kerülsz ezekhez a fenevadakhoz. Azok az átkozott teremtmények egyenesen Beliar birodalmából szabadultak!","","False","VLK_583_Glen_INFO_Info_02_03","",""
"Scripts/content/Story/MISSIONS/DIA_Vlk_583_Glen.d:43","Man kann sie schaben und kratzen hören. Sie lauern in der Dunkelheit und warten nur auf dich. Ich habe gesehen, wie sie getötet haben.","Hallhatod, ahogy mocorognak és kaparásznak. A sötétségben lapulnak és csak rád várnak. Láttam ölni őket...","","False","VLK_583_Glen_INFO_Info_02_04","",""
"Scripts/content/Story/MISSIONS/DIA_Vlk_583_Glen.d:44","Gnadenlos und schnell. Wenn du am Leben hängst, solltest du dich nicht hier unten aufhalten. Geh lieber, bevor dir noch was passiert.","Könyörtelenek és gyorsak. Ha szereted az életed, jobban teszed, ha nem mész le oda. Jobb ha elmész innen, még mielőtt valami baj történik veled.","","False","VLK_583_Glen_INFO_Info_02_05","",""
"Scripts/content/Story/MISSIONS/DIA_Vlk_583_Glen.d:54","Bei dir gibts Dietriche?","Jól hallottam, hogy itt tudok tolvajkulcsot venni?","","False","VLK_583_Glen_LOCKPICK.description","",""
"Scripts/content/Story/MISSIONS/DIA_Vlk_583_Glen.d:67","Ich hab' gehört, bei dir kann ich Dietriche kaufen.","Azt hallottam, hogy vásárolhatok tőled tolvajkulcsot.","","False","VLK_583_Glen_LOCKPICK_15_01","",""
"Scripts/content/Story/MISSIONS/DIA_Vlk_583_Glen.d:68","Nun, wenn du schlau genug warst, das herauszufinden, dann kannst du welche haben. 10 Erz das Stück.","Nos, velősen rájöttél magadtól is, szóval vehetsz párat. 10 ércért darabját.","","False","VLK_583_Glen_LOCKPICK_02_02","",""
"Scripts/content/Story/MISSIONS/DIA_Vlk_583_Glen.d:80","(Dietriche kaufen)","(Tolvajkulcsot vesz)","","False","VLK_583_Glen_BUY.description","",""
"Scripts/content/Story/MISSIONS/DIA_Vlk_583_Glen.d:93","Ich will Dietriche kaufen.","Tolvajkulcsot akarok venni.","","False","VLK_583_Glen_BUY_Info_15_01","",""
"Scripts/content/Story/MISSIONS/DIA_Vlk_584_Snipes.d:19","Wir sehen uns.","Még találkozunk.","","False","Info_Exit_Info_15_001","",""
"Scripts/content/Story/MISSIONS/DIA_Vlk_584_Snipes.d:20","Na, aber sicher doch!","Igen, biztosan!","","False","Info_Exit_Info_07_02","",""
"Scripts/content/Story/MISSIONS/DIA_Vlk_584_Snipes.d:32","Wie siehts aus?","Mi a helyzet?","","False","VLK_584_Snipes_DEAL.description","",""
"Scripts/content/Story/MISSIONS/DIA_Vlk_584_Snipes.d:42","Wie sieht's aus?","Mi a helyzet?","","False","VLK_584_Snipes_DEAL_Info_15_01","",""
"Scripts/content/Story/MISSIONS/DIA_Vlk_584_Snipes.d:43","Ich schlage dir ein Geschäft vor.","Van egy üzleti ajánlatom.","","False","VLK_584_Snipes_DEAL_Info_07_02","",""
"Scripts/content/Story/MISSIONS/DIA_Vlk_584_Snipes.d:44","Wenn du Aaron dazu kriegst, dass er von der Truhe abhaut, dann gebe ich dir 10 Erz!","Ha ráveszed Aaron-t hogy, hagyja a ládát magára, adok 10 ércet!","","False","VLK_584_Snipes_DEAL_Info_07_03","",""
"Scripts/content/Story/MISSIONS/DIA_Vlk_584_Snipes.d:59","Du schuldest mir 10 Erz","Tartozol 10 érccel!","","False","VLK_584_Snipes_DEAL_RUN.description","",""
"Scripts/content/Story/MISSIONS/DIA_Vlk_584_Snipes.d:72","Du schuldest mir 10 Erz","Tartozol 10 érccel!","","False","VLK_584_Snipes_DEAL_RUN_Info_15_01","",""
"Scripts/content/Story/MISSIONS/DIA_Vlk_584_Snipes.d:73","Hier, die 10 Erz hast du dir verdient.","Tessék, tényleg kiérdemelted a 10 ércet.","","False","VLK_584_Snipes_DEAL_RUN_Info_07_02","",""
"Scripts/content/Story/MISSIONS/DIA_Vlk_584_Snipes.d:74","Ach noch was, den Schlüssel für seine Truhe hab' ich auch. Für dich nur 30 Erz!","Ó, még egy dolog: a kulcs is megvan a ládájához. Csak neked... 30 ércbe kerül!","","False","VLK_584_Snipes_DEAL_RUN_Info_07_03","",""
"Scripts/content/Story/MISSIONS/DIA_Vlk_584_Snipes.d:92","(Schlüssel kaufen)","(megveszem a kulcsot)","","False","VLK_584_Snipes_DEAL_2.description","",""
"Scripts/content/Story/MISSIONS/DIA_Vlk_584_Snipes.d:108","Gib mir den Schlüssel.","Add ide a kulcsot.","","False","VLK_584_Snipes_DEAL_2_Info_15_01","",""
"Scripts/content/Story/MISSIONS/DIA_Vlk_584_Snipes.d:109","Du hast ein gutes Geschäft gemacht!","Jó üzletet kötöttél.","","False","VLK_584_Snipes_DEAL_2_Info_07_02","",""
"Scripts/content/Story/MISSIONS/DIA_Vlk_584_Snipes.d:110","Ich frage mich, was dein Gewinn an der Sache ist.","Kíváncsi vagyok, mit fogsz benne találni.","","False","VLK_584_Snipes_DEAL_2_Info_15_03","",""
"Scripts/content/Story/MISSIONS/DIA_Vlk_584_Snipes.d:111","Ich freue mich immer, wenn ich den Gardisten eins auswischen kann. Und wenn die den Inhalt der Truhe bei mir finden, bin ich dran!","Mindig jó kedvre derít, ha keresztbe tehetek az őröknek. Viszont ha megtalálnák nálam a láda tartalmát, halott lennék.","","False","VLK_584_Snipes_DEAL_2_Info_07_04","",""
"Scripts/content/Story/MISSIONS/DIA_Vlk_584_Snipes.d:121","Ich sagte 30 Erz! Gib mir das Erz und ich gebe dir den Schlüssel!","Azt mondtam 30 érc! Fizesd ki és megkapod a kulcsot!","","False","VLK_584_Snipes_DEAL_2_Info_07_05","",""
"Scripts/content/Story/MISSIONS/DIA_Vlk_585_Aleph.d:21","Viel Glück noch.","Sok szerencsét!","","False","VLK_585_Aleph_Exit_Info_15_01","",""
"Scripts/content/Story/MISSIONS/DIA_Vlk_585_Aleph.d:22","Du weißt ja, wo du mich findest.","Nos, tudod hol találsz meg.","","False","VLK_585_Aleph_Exit_Info_05_02","",""
"Scripts/content/Story/MISSIONS/DIA_Vlk_585_Aleph.d:44","Hehehe, die Wachen erwischen mich nie!","Hehehe, az őrök sohasem fognak elkapni!","","False","VLK_585_Aleph_CLEVER_Info_05_01","",""
"Scripts/content/Story/MISSIONS/DIA_Vlk_585_Aleph.d:54","Wie meinst du das?","Mit értesz ezalatt?","","False","VLK_585_Aleph_GUARDS.description","",""
"Scripts/content/Story/MISSIONS/DIA_Vlk_585_Aleph.d:67","Wie meinst du das?","Mit értesz ezalatt?","","False","VLK_585_Aleph_GUARDS_Info_15_01","",""
"Scripts/content/Story/MISSIONS/DIA_Vlk_585_Aleph.d:68","Ich arbeite nur, wenn Wachen in der Nähe sind oder mich sehen können. Ansonsten häng' ich hier meine Zeit ab.","Csak akkor dolgozom, ha az őrök a közelben vannak, vagy ha rám látnak. Egyébként csak lopom a napot.","","False","VLK_585_Aleph_GUARDS_Info_05_02","",""
"Scripts/content/Story/MISSIONS/DIA_Vlk_585_Aleph.d:69","Werden sie nicht misstrauisch?","Nem fognak gyanút?","","False","VLK_585_Aleph_GUARDS_Info_15_03","",""
"Scripts/content/Story/MISSIONS/DIA_Vlk_585_Aleph.d:70","Nun ja, ich schürfe natürlich weniger Erz als alle anderen. Es reicht natürlich nicht immer, da muss ich halt mal ein bisschen geschickt tauschen.","Hát, így én kevesebb ércet bányászok mint a többiek. Ez nem mindig elég, tehát muszáj egy kicsit seftelnem.","","False","VLK_585_Aleph_GUARDS_Info_05_04","",""
"Scripts/content/Story/MISSIONS/DIA_Vlk_585_Aleph.d:71","Ich halt immer meine Ohren offen und bekomme viele nützliche Dinge mit. Du hast nicht zufällig etwas Erz bei dir? So ungefähr 10 Erz?","Nyitva tartom a fülem, így sok hasznos információval szolgálhatok. Nincs esetleg nálad néhány érc? Mondjuk 10 darab?","","False","VLK_585_Aleph_GUARDS_Info_05_05","",""
"Scripts/content/Story/MISSIONS/DIA_Vlk_585_Aleph.d:88","(10 Erz geben)","(adok 10 ércet)","","False","VLK_585_Aleph_INFO.description","",""
"Scripts/content/Story/MISSIONS/DIA_Vlk_585_Aleph.d:101","In Ordnung, hier sind 10 Erz für dich.","Rendben, itt van a 10 érced.","","False","VLK_585_Aleph_INFO_Info_15_01","",""
"Scripts/content/Story/MISSIONS/DIA_Vlk_585_Aleph.d:102","Danke. Wenn du zurück zum Hauptschacht gehst und den Stegen weiter nach unten folgst, kommst du bald an zwei Nebenhöhlen.","Köszönöm. Ha végigmész a fő járaton és követed az állványzatot egészen lefelé, akkor eljutsz két oldalsó barlangig.","","False","VLK_585_Aleph_INFO_Info_05_02","",""
"Scripts/content/Story/MISSIONS/DIA_Vlk_585_Aleph.d:103","In der zweiten Höhle steht eine Wache. Da steht auch ein alter Stampfer.","Van egy őr a másodiknál és lesz ott egy régi öreg érczúzó.","","False","VLK_585_Aleph_INFO_Info_05_03","",""
"Scripts/content/Story/MISSIONS/DIA_Vlk_585_Aleph.d:104","Dort liegt noch irgendwo ein Heiltrank, aber sei vorsichtig und nimm dich vor den Crawlern in Acht!","Valahol van ott egy gyógyító ital a földön, de légy óvatos és vigyázz a Tárnarákokkal!","","False","VLK_585_Aleph_INFO_Info_05_04","",""
"Scripts/content/Story/MISSIONS/DIA_Vlk_585_Aleph.d:105","Und wenn du mal wieder was brauchst oder hörst, dann komm ruhig zu mir, ich kann dir bestimmt weiterhelfen ...","És ha szükséged van valamire, vagy hallasz valamit, gyere hozzám, biztosan tudok majd segíteni ...","","False","VLK_585_Aleph_INFO_Info_05_05","",""
"Scripts/content/Story/MISSIONS/DIA_Vlk_585_Aleph.d:129","Du hast mich bei Brandick angeschwärzt? Mach, dass du wegkommst!","Kibeszéltetek a hátam mögött Brandick-kel? Kotródj innét!","","False","VLK_585_Aleph_ANGRY_Info_05_01","",""
"Scripts/content/Story/MISSIONS/DIA_Vlk_585_Aleph.d:142","Hast du noch ein paar nützliche Informationen?","Van még valami használható információd?","","False","VLK_585_Aleph_KEY.description","",""
"Scripts/content/Story/MISSIONS/DIA_Vlk_585_Aleph.d:155","Hast du noch ein paar nützliche Informationen?","Van még valami használható információd?","","False","VLK_585_Aleph_KEY_Info_15_01","",""
"Scripts/content/Story/MISSIONS/DIA_Vlk_585_Aleph.d:156","Na klar, hast du noch 10 Erz?","Persze, van nálad 10 érc?","","False","VLK_585_Aleph_KEY_Info_05_02","",""
"Scripts/content/Story/MISSIONS/DIA_Vlk_585_Aleph.d:166","(10 Erz geben)","(adok 10 ércet)","","False","VLK_585_Aleph_GLEN.description","",""
"Scripts/content/Story/MISSIONS/DIA_Vlk_585_Aleph.d:179","Für mein Erz erwarte ich auch eine gute Information!","Hasznos információt várok az ércemért!","","False","VLK_585_Aleph_GLEN_Info_15_01","",""
"Scripts/content/Story/MISSIONS/DIA_Vlk_585_Aleph.d:180","Hier gibt's eine Menge verschlossener Truhen. Glen, der Buddler, der ganz oben steht, kann dir ein paar Dietriche besorgen.","Rengeteg lezárt láda van itt. Glen, a bányász a felső szintről, szerezhet neked egy pár tolvajkulcsot.","","False","VLK_585_Aleph_GLEN_Info_05_02","",""
"Scripts/content/Story/MISSIONS/DIA_Vlk_585_Aleph.d:196","Weißt du was über den Schlüssel für die Truhen im Lagerschuppen?","Tudsz valamit a raktárhelyiség ládáinak kulcsairól?","","False","VLK_585_Aleph_SCHUPPEN.description","",""
"Scripts/content/Story/MISSIONS/DIA_Vlk_585_Aleph.d:209","Weißt du was über den Schlüssel für die Truhen im Lagerschuppen?","Tudsz valamit a raktárhelyiség ládáinak kulcsairól?","","False","VLK_585_Aleph_SCHUPPEN_Info_15_01","",""
"Scripts/content/Story/MISSIONS/DIA_Vlk_585_Aleph.d:210","Nun, das kommt ganz darauf an ...","Nos, attól függ...","","False","VLK_585_Aleph_SCHUPPEN_Info_05_02","",""
"Scripts/content/Story/MISSIONS/DIA_Vlk_585_Aleph.d:211","Darauf, wieviel Erz ich dir gebe?","Hogy, mennyi ércet adok neked?","","False","VLK_585_Aleph_SCHUPPEN_Info_15_03","",""
"Scripts/content/Story/MISSIONS/DIA_Vlk_585_Aleph.d:212","Du lernst schnell.","Gyorsan tanulsz.","","False","VLK_585_Aleph_SCHUPPEN_Info_05_04","",""
"Scripts/content/Story/MISSIONS/DIA_Vlk_585_Aleph.d:217","50 Erz zahlen","Fizetsz 50 ércet.","","False","VLK_585_Aleph_SCHUPPEN.VLK_585_Aleph_SCHUPPEN_50","Info_AddChoice",""
"Scripts/content/Story/MISSIONS/DIA_Vlk_585_Aleph.d:218","30 Erz zahlen","Fizetsz 30 ércet.","","False","VLK_585_Aleph_SCHUPPEN.VLK_585_Aleph_SCHUPPEN_30","Info_AddChoice",""
"Scripts/content/Story/MISSIONS/DIA_Vlk_585_Aleph.d:219","15 Erz zahlen","Fizetsz 15 ércet.","","False","VLK_585_Aleph_SCHUPPEN.VLK_585_Aleph_SCHUPPEN_15","Info_AddChoice",""
"Scripts/content/Story/MISSIONS/DIA_Vlk_585_Aleph.d:226","50 Erz sind mehr als genug für dich!","50 ércnek elégnek kell lennie!","","False","VLK_585_Aleph_SCHUPPEN_50_15_01","",""
"Scripts/content/Story/MISSIONS/DIA_Vlk_585_Aleph.d:227","Überaus großzügig. Hier ist der Schlüssel. Und nimm auch diesen Ring. Mir hat er immer Glück gebracht.","Nagyon bőkezű vagy! Itt a kulcs. És vidd ezt a gyűrűt is. Nekem mindig szerencsét hozott.","","False","VLK_585_Aleph_SCHUPPEN_50_05_02","",""
"Scripts/content/Story/MISSIONS/DIA_Vlk_585_Aleph.d:245","So viel Erz hast du nicht!","Nincs nálad annyi érc!","","False","VLK_585_Aleph_SCHUPPEN_50_05_03","",""
"Scripts/content/Story/MISSIONS/DIA_Vlk_585_Aleph.d:258","30 Erz sollten reichen.","30 érc megteszi.","","False","VLK_585_Aleph_SCHUPPEN_30_15_01","",""
"Scripts/content/Story/MISSIONS/DIA_Vlk_585_Aleph.d:259","Nun gut, zufällig habe ich hier einen Schlüssel.","Rendben, pont itt van nálam a kulcs.","","False","VLK_585_Aleph_SCHUPPEN_30_05_02","",""
"Scripts/content/Story/MISSIONS/DIA_Vlk_585_Aleph.d:265","So viel Erz hast du nicht!","Nincs elegendő érced!","","False","VLK_585_Aleph_SCHUPPEN_30_05_03","",""
"Scripts/content/Story/MISSIONS/DIA_Vlk_585_Aleph.d:272","Bist du mit 15 Erz einverstanden?","15 érc elég lesz?","","False","VLK_585_Aleph_SCHUPPEN_15_15_01","",""
"Scripts/content/Story/MISSIONS/DIA_Vlk_585_Aleph.d:273","15 Erz? Ich weiß nichts von einem Schlüssel!","15 érc? Nem tudok semmit sem arról a kulcsról!","","False","VLK_585_Aleph_SCHUPPEN_15_05_02","",""
"Scripts/content/Story/MISSIONS/DIA_Vlk_585_Aleph.d:290","Weißt du was über den Schlüssel für die Truhen im Lagerschuppen?","Tudsz valamit a raktárhelyiség ládáinak kulcsairól?","","False","VLK_585_Aleph_DIRTY.description","",""
