"location","source","target","id","fuzzy","context","translator_comments","developer_comments"
"Scripts/content/Story/MISSIONS/DIA_Vlk_538_Huno.d:74","Wieso? Bezahlt er nicht gut?","Miért? Nem fizet eleget?","","False","DIA_Huno_HowLong_15_04","",""
"Scripts/content/Story/MISSIONS/DIA_Vlk_538_Huno.d:75","Doch, ganz im Gegenteil. Für sein letztes Schwert hat er 150 Erz locker gemacht.","Nem, éppen ellenkezőleg. 150 ércet adott az utolsó kardjáért.","","False","DIA_Huno_HowLong_09_05","",""
"Scripts/content/Story/MISSIONS/DIA_Vlk_538_Huno.d:76","Irgendwie hat der Typ ein Faible für Ornamente und so 'nen Weiberkram, und das hat natürlich seinen Preis.","Az a fickó bele van bolondulva a giccses és lányos dolgokba, ez persze nem olcsó mulatság.","","False","DIA_Huno_HowLong_09_06","",""
"Scripts/content/Story/MISSIONS/DIA_Vlk_538_Huno.d:77","Hey, du bist ganz schön neugierig, Freundchen.","Hé haver, nem vagy te túl kíváncsi?","","False","DIA_Huno_HowLong_09_07","",""
"Scripts/content/Story/MISSIONS/DIA_Vlk_538_Huno.d:90","Na, Schmied, wie läuft das Geschäft?","Nos, kovács, hogy megy az üzlet?","","False","DIA_Huno_HowsYourBusiness.description","",""
"Scripts/content/Story/MISSIONS/DIA_Vlk_538_Huno.d:103","Na, Schmied, wie läuft das Geschäft?","Nos, kovács, hogy megy az üzlet?","","False","DIA_Huno_HowsYourBusiness_15_00","",""
"Scripts/content/Story/MISSIONS/DIA_Vlk_538_Huno.d:104","Was geht dich das an?","Minek akarod tudni?","","False","DIA_Huno_HowsYourBusiness_09_01","",""
"Scripts/content/Story/MISSIONS/DIA_Vlk_538_Huno.d:105","Vielleicht habe ich einen Auftrag für dich.","Volna egy megrendelésem a számodra.","","False","DIA_Huno_HowsYourBusiness_15_02","",""
"Scripts/content/Story/MISSIONS/DIA_Vlk_538_Huno.d:106","Ach ja? Was denn?","Ó igazán? És mi?","","False","DIA_Huno_HowsYourBusiness_09_03","",""
"Scripts/content/Story/MISSIONS/DIA_Vlk_538_Huno.d:107","Ich überleg's mir.","Még gondolkodom rajta.","","False","DIA_Huno_HowsYourBusiness_15_04","",""
"Scripts/content/Story/MISSIONS/DIA_Vlk_538_Huno.d:108","Komm wieder, wenn du was brauchst, und geh mir nicht auf die Nerven.","Akkor gyere vissza ha tudod mit akarsz, ahelyett hogy itt bosszantasz.","","False","DIA_Huno_HowsYourBusiness_09_05","",""
"Scripts/content/Story/MISSIONS/DIA_Vlk_538_Huno.d:123","Ich würde mich selbst gern mal an deiner Schmiede versuchen.","Szeretném magam is kipróbálni a munkád.","","False","DIA_Huno_LEARNSMITH.description","",""
"Scripts/content/Story/MISSIONS/DIA_Vlk_538_Huno.d:136","Ich würde mich selbst gern mal an deiner Schmiede versuchen.","Szeretném magam is kipróbálni a munkád.","","False","DIA_Huno_LEARNSMITH_15_00","",""
"Scripts/content/Story/MISSIONS/DIA_Vlk_538_Huno.d:137","So so, aber glaub nur nicht, dass du tolle Klingen herstellen kannst!","Ó, de ne gondold, hogy fantasztikus pengéket fogsz készíteni!","","False","DIA_Huno_LEARNSMITH_09_01","",""
"Scripts/content/Story/MISSIONS/DIA_Vlk_538_Huno.d:138","Was muss ich tun?","Mit kell tennem?","","False","DIA_Huno_LEARNSMITH_15_02","",""
"Scripts/content/Story/MISSIONS/DIA_Vlk_538_Huno.d:139","Okay, nimm den Rohstahl und halte ihn ins Schmiedefeuer.","Rendben, fogd az acélt és tartsd a tűzbe.","","False","DIA_Huno_LEARNSMITH_09_03","",""
"Scripts/content/Story/MISSIONS/DIA_Vlk_538_Huno.d:140","Dann musst du den glühenden Stahl am Amboss schmieden.","Ezután fektesd rá az üllőre a vörösen izzó acélt.","","False","DIA_Huno_LEARNSMITH_09_04","",""
"Scripts/content/Story/MISSIONS/DIA_Vlk_538_Huno.d:141","Stecke dann die glühende Klinge dort drüben in den Wassereimer, um sie zu härten.","Amikor befejezted, tedd a forró pengét a vizes vödörbe, hogy megedződjön.","","False","DIA_Huno_LEARNSMITH_09_05","",""
"Scripts/content/Story/MISSIONS/DIA_Vlk_538_Huno.d:142","Am Ende muss die abgekühlte Klinge noch am Schleifstein geschärft werden.","A lehűtött pengét végül a köszörűkövön kell megélezni.","","False","DIA_Huno_LEARNSMITH_09_06","",""
"Scripts/content/Story/MISSIONS/DIA_Vlk_538_Huno.d:143","Verstehe.","Értem.","","False","DIA_Huno_LEARNSMITH_15_07","",""
"Scripts/content/Story/MISSIONS/DIA_Vlk_538_Huno.d:144","Allerdings brauchst du dafür ein paar Sachen. Ich kann sie dir verkaufen.","De ehhez szükséged lesz pár dologra. Tudsz venni tőlem is.","","False","DIA_Huno_LEARNSMITH_09_08","",""
"Scripts/content/Story/MISSIONS/DIA_Vlk_538_Huno.d:160","Ich möchte Dinge fürs Schmieden kaufen!","Szeretnék kovács felszerelést venni!","","False","DIA_Huno_BUYSMITH.description","",""
"Scripts/content/Story/MISSIONS/DIA_Vlk_538_Huno.d:173","Ich möchte Dinge fürs Schmieden kaufen!","Szeretnék kovács felszerelést venni!","","False","DIA_Huno_BUYSMITH_15_00","",""
"Scripts/content/Story/MISSIONS/DIA_Vlk_564_Jesse.d:33","Wie sieht's aus?","Mi a helyzet?","","False","DIA_Jesse_Hallo.description","",""
"Scripts/content/Story/MISSIONS/DIA_Vlk_564_Jesse.d:46","Wie sieht's aus?","Mi a helyzet?","","False","DIA_Jesse_Hallo_15_00","",""
"Scripts/content/Story/MISSIONS/DIA_Vlk_564_Jesse.d:47","Neu hier, was? Du solltest wissen, dass man sich hier besser nicht mit den Gardisten anlegt.","Ugye új vagy itt? Jobb ha tudod, hogy nem ajánlatos össze akasztani a bajszod az őrökkel.","","False","DIA_Jesse_Hallo_03_01","",""
"Scripts/content/Story/MISSIONS/DIA_Vlk_564_Jesse.d:48","Wenn sie Schutzgeld wollen, zahlst du besser, sonst hast du bald das halbe Lager gegen dich.","Amikor védelmi pénzt akarnak tőled, jobb ha fizetsz, különben a tábor fele ellened lesz.","","False","DIA_Jesse_Hallo_03_02","",""
"Scripts/content/Story/MISSIONS/DIA_Vlk_564_Jesse.d:73","Hey, du! Ich hab' gehört, du wolltest Bloodwyn kein Schutzgeld zahlen?","Hét te! Jól hallottam hogy nem akarsz védelmi sarcot fizetni Bloodwyn-nak?","","False","DIA_Jesse_Warn_03_00","",""
"Scripts/content/Story/MISSIONS/DIA_Vlk_564_Jesse.d:74","Was willst du?","Mit akarsz?","","False","DIA_Jesse_Warn_15_01","",""
"Scripts/content/Story/MISSIONS/DIA_Vlk_564_Jesse.d:75","Dich warnen! Bloodwyn hat einige Leute bezahlt, damit sie dir Ärger machen.","Figyelmeztetni! Bloodwyn lefizetett néhány embert, elfogják látni a bajod.","","False","DIA_Jesse_Warn_03_02","",""
"Scripts/content/Story/MISSIONS/DIA_Vlk_564_Jesse.d:76","Ich hab' zum Beispiel gesehen, wie er mit Herek da drüben geredet hat. Und nur die Götter wissen, mit wem noch!","Láttam, hogy beszélt néhány emberrel, például Herek-kel amott, és isten tudja kit bérelt még fel!","","False","DIA_Jesse_Warn_03_03","",""
"Scripts/content/Story/MISSIONS/DIA_Vlk_564_Jesse.d:77","Was Herek betrifft, kommt deine Warnung etwas spät.","Ami Herek-et illeti elkéstél.","","False","DIA_Jesse_Warn_15_04","",""
"Scripts/content/Story/MISSIONS/DIA_Vlk_564_Jesse.d:78","Er muss noch mit jemand anderem geredet haben - so viel hab' ich mitgekriegt. Also pass auf dich auf.","Minden bizonnyal beszélt másokkal is, ebben biztos vagyok. Szóval légy óvatos.","","False","DIA_Jesse_Warn_03_05","",""
"Scripts/content/Story/MISSIONS/DIA_Vlk_564_Jesse.d:92","Warum hast du mir die Sache mit Bloodwyn erzählt?","Miért mondtad el a Bloodwyn történteket?","","False","DIA_Jesse_Mission.description","",""
"Scripts/content/Story/MISSIONS/DIA_Vlk_564_Jesse.d:105","Warum hast du mir die Sache mit Bloodwyn erzählt?","Miért mondtad el a Bloodwyn történeteket?","","False","DIA_Jesse_Mission_15_00","",""
"Scripts/content/Story/MISSIONS/DIA_Vlk_564_Jesse.d:106","Weil hier eine Hand die andere wäscht. Du siehst nicht so aus wie einer, der das nicht begreifen würde.","Mivel a szívességet viszonozni szokás. És te nem úgy nézel ki, mint aki nem értené volna ezt meg.","","False","DIA_Jesse_Mission_03_01","",""
"Scripts/content/Story/MISSIONS/DIA_Vlk_564_Jesse.d:107","Und weil ich DIR jetzt einen Gefallen getan habe, möchte ich dir Gelegenheit geben, dich zu revanchieren.","És mivel ÉN tettem neked egy szívességet, szeretném megadni a lehetőséget, hogy viszonozd.","","False","DIA_Jesse_Mission_03_02","",""
"Scripts/content/Story/MISSIONS/DIA_Vlk_564_Jesse.d:110","Vergiß es! Ich schulde dir gar nichts!","Felejtsd el! Nem tartozok neked semmivel!","","False","DIA_Jesse_Mission.DIA_Jesse_Mission_ForgetIt","Info_AddChoice",""
"Scripts/content/Story/MISSIONS/DIA_Vlk_564_Jesse.d:111","An was hattest du denn da gedacht?","Pontosan mire gondolsz?","","False","DIA_Jesse_Mission.DIA_Jesse_Mission_What","Info_AddChoice",""
"Scripts/content/Story/MISSIONS/DIA_Vlk_564_Jesse.d:116","Ich schulde dir GAR nichts!","Nem tartozok neked semmivel!","","False","DIA_Jesse_Mission_ForgetIt_15_00","",""
"Scripts/content/Story/MISSIONS/DIA_Vlk_564_Jesse.d:117","(sauer) Dann vergiss es doch einfach!","Ó! Akkor tűnj innen!","","False","DIA_Jesse_Mission_ForgetIt_03_01","",""
"Scripts/content/Story/MISSIONS/DIA_Vlk_564_Jesse.d:125","An was hattest du denn da gedacht?","Pontosan mire gondolsz?","","False","DIA_Jesse_Mission_What_15_00","",""
"Scripts/content/Story/MISSIONS/DIA_Vlk_564_Jesse.d:126","Ich hab' kein Erz mehr, und Bloodwyn hat schon versucht, das letzte Bröckchen aus mir rauszupressen.","Nem maradt semmi ércem és Bloodwyn is éppen most kopasztott meg.","","False","DIA_Jesse_Mission_What_03_01","",""
"Scripts/content/Story/MISSIONS/DIA_Vlk_564_Jesse.d:127","Jetzt, wo ich dir geholfen habe, könntest du ihm doch meine 10 Erz geben, oder? Sag ihm, sie kommen von mir.","Most hogy segítettem neked. Odaadhatnád neki a 10 ércet amivel tartozom. Mond azt, hogy tőlem van.","","False","DIA_Jesse_Mission_What_03_02","",""
"Scripts/content/Story/MISSIONS/DIA_Vlk_564_Jesse.d:130","Ich für dich zahlen? Vergiß es!","Én fizessek helyetted? Felejtsd el!","","False","DIA_Jesse_Mission.DIA_Jesse_Mission_NO","Info_AddChoice",""
"Scripts/content/Story/MISSIONS/DIA_Vlk_564_Jesse.d:131","Ich werd sehen, was ich machen kann...","Meglátom mit tehetek.","","False","DIA_Jesse_Mission.DIA_Jesse_Mission_YES","Info_AddChoice",""
"Scripts/content/Story/MISSIONS/DIA_Vlk_564_Jesse.d:137","Ich werd sehen, was ich machen kann ...","Meglátom mit tehetek.","","False","DIA_Jesse_Mission_YES_15_00","",""
"Scripts/content/Story/MISSIONS/DIA_Vlk_564_Jesse.d:138","Danke, Mann! Du bist meine Rettung! Sag mir Bescheid, wenn die Sache gelaufen ist, ja?","Kösz haver! Te vagy a megmentőm! Szólnál, ha mindent elintéztél?","","False","DIA_Jesse_Mission_YES_03_01","",""
"Scripts/content/Story/MISSIONS/DIA_Vlk_564_Jesse.d:146","Ich für dich zahlen? Vergiss es!","Én fizessek helyetted? Felejtsd el!","","False","DIA_Jesse_Mission_NO_15_00","",""
"Scripts/content/Story/MISSIONS/DIA_Vlk_564_Jesse.d:147","So kann man sich in jemandem irren. Mit meiner Hilfe rechnest du am besten nicht mehr.","Úgy látom rosszul ítéltelek meg. Ne számíts rám a jövőben.","","False","DIA_Jesse_Mission_NO_03_01","",""
"Scripts/content/Story/MISSIONS/DIA_Vlk_564_Jesse.d:162","Ich habe Bloodwyn bezahlt!","Fizettem Bloodwyn-nek!","","False","DIA_Jesse_MisSuccess.description","",""
"Scripts/content/Story/MISSIONS/DIA_Vlk_564_Jesse.d:175","Ich habe Bloodwyn bezahlt!","Fizettem Bloodwyn-nek!","","False","DIA_Jesse_MisSuccess_15_00","",""
"Scripts/content/Story/MISSIONS/DIA_Vlk_564_Jesse.d:176","Ja? Gut! Dann sind wir ja jetzt quitt.","Igen? Nagyszerű! Akkor kvittek vagyunk.","","False","DIA_Jesse_MisSuccess_03_01","",""
"Scripts/content/Story/MISSIONS/DIA_Vlk_564_Jesse.d:180","WAAAS?! Ich hab' 10 Erz ausgegeben für einen Tip, den ich sowieso schon kannte!?","HOGY MI? Kiadtam 10 ércet azért amit eddig is tudtam?","","False","DIA_Jesse_MisSuccess.DIA_Jesse_MisSuccess_Waaas","Info_AddChoice",""
"Scripts/content/Story/MISSIONS/DIA_Vlk_564_Jesse.d:181","Genau. Eine Hand wäscht die andere...","Így van. Kéz kezet mos.","","False","DIA_Jesse_MisSuccess.DIA_Jesse_MisSuccess_Ok","Info_AddChoice",""
"Scripts/content/Story/MISSIONS/DIA_Vlk_564_Jesse.d:186","WAAAS?! Ich hab' 10 Erz ausgegeben für einen Tipp, den ich sowieso schon kannte!?","HOGY MI? Kiadtam 10 ércet azért amit eddig is tudtam?","","False","DIA_Jesse_MisSuccess_Waaas_15_00","",""
"Scripts/content/Story/MISSIONS/DIA_Vlk_564_Jesse.d:187","Sieht so aus.","Olybá' tűnik.","","False","DIA_Jesse_MisSuccess_Waaas_03_01","",""
"Scripts/content/Story/MISSIONS/DIA_Vlk_564_Jesse.d:192","Genau. Eine Hand wäscht die andere ...","Így van. Kéz kezet mos.","","False","DIA_Jesse_MisSuccess_Ok_15_00","",""
"Scripts/content/Story/MISSIONS/DIA_Vlk_572_Gravo.d:33","Wie steht's denn so?","Hogy vagy?","","False","DIA_Gravo_Hallo.description","",""
"Scripts/content/Story/MISSIONS/DIA_Vlk_572_Gravo.d:43","Wie steht's denn so?","Hogy vagy?","","False","DIA_Gravo_Hallo_15_00","",""
"Scripts/content/Story/MISSIONS/DIA_Vlk_572_Gravo.d:44","Seit ich aufgehört habe, in der Mine zu arbeiten, lässt sich's hier richtig gut leben.","Hát, mióta már nem dolgozom a bányában, nincs miért panaszkodnom.","","False","DIA_Gravo_Hallo_04_01","",""
"Scripts/content/Story/MISSIONS/DIA_Vlk_572_Gravo.d:45","Und woher kriegst du dein Erz?","És honnan szerezel így ércet?","","False","DIA_Gravo_Hallo_15_02","",""
"Scripts/content/Story/MISSIONS/DIA_Vlk_572_Gravo.d:46","Ich helfe Leuten, die Probleme haben.","Olyan embereknek segítek, akiknek gondjuk akad.","","False","DIA_Gravo_Hallo_04_03","",""
"Scripts/content/Story/MISSIONS/DIA_Vlk_572_Gravo.d:47","Wenn du hier Ärger mit einflussreichen Leuten hast, kann ich dafür sorgen, dass die Sache wieder ins Lot kommt.","Ha bajba kerülsz valamelyik befolyásos emberrel, segíthetek elsimítani a dolgokat.","","False","DIA_Gravo_Hallo_04_04","",""
"Scripts/content/Story/MISSIONS/DIA_Vlk_572_Gravo.d:59","Wenn ich hier Ärger habe, kannst DU mir also helfen? Wie?","Hogyha bajba kerülök, TE tudsz nekem segíteni? Hogyan?","","False","DIA_Gravo_HelpHow.description","",""
"Scripts/content/Story/MISSIONS/DIA_Vlk_572_Gravo.d:72","Wenn ich hier Ärger habe, kannst DU mir also helfen? Wie?","Hogyha bajba kerülök, TE tudsz nekem segíteni? Hogyan?","","False","DIA_Gravo_HelpHow_15_00","",""
"Scripts/content/Story/MISSIONS/DIA_Vlk_572_Gravo.d:73","Nun - sagen wir mal, du hast Ärger mit Thorus. Du solltest es besser nie dazu kommen lassen, aber man weiß ja nie, was passiert.","Nos tegyük fel, hogy Thorus begyébe vagy. Mondjuk jobb ha nem keveredsz vele összetűzésbe, de sohasem lehet tudni.","","False","DIA_Gravo_HelpHow_04_01","",""
"Scripts/content/Story/MISSIONS/DIA_Vlk_572_Gravo.d:74","Thorus kann ziemlich stur sein - wenn du's dir einmal mit ihm verscherzt hast, redet er nicht mehr mit dir. Das ist schlecht.","Thorus nagyon makacs tud lenni - ha csak egyszer is felhúzod, többet nem áll szóba veled. És ez rossz dolog.","","False","DIA_Gravo_HelpHow_04_02","",""
"Scripts/content/Story/MISSIONS/DIA_Vlk_572_Gravo.d:75","Denn als Neuer bist du auf ihn angewiesen. Also kommst du zu mir. Ich kenne 'ne Menge Leute hier, die Einfluss auf Thorus haben.","Mivel zöldfülű vagy, tőle függ a sorsod. Látogass majd meg. Sok embert ismerek itt, akikre hallgat Thorus.","","False","DIA_Gravo_HelpHow_04_03","",""
"Scripts/content/Story/MISSIONS/DIA_Vlk_572_Gravo.d:76","Die legen ein gutes Wort für dich ein und Thorus ist wieder auf deiner Seite. Natürlich wollen die Jungs dafür Erz sehen. Dein Erz.","Szólnak egy pár jó szót az érdekedben és Thorus megnyugszik. Persze a fiúk cserébe szeretnének néhány ércet látni. A tiedből persze.","","False","DIA_Gravo_HelpHow_04_04","",""
"Scripts/content/Story/MISSIONS/DIA_Vlk_572_Gravo.d:77","Und ICH kümmere mich darum, dass dein Erz die richtigen Leute erreicht ...","Én pedig figyelek rá, hogy az érced a megfelelő emberek kezébe kerüljön...","","False","DIA_Gravo_HelpHow_04_05","",""
"Scripts/content/Story/MISSIONS/DIA_Vlk_572_Gravo.d:91","Stimmt, er ist nicht besonders gut auf dich zu sprechen.","Való igaz, nem szeret téged különösebben.","","False","B_Gravo_HelpAttitude_ANGRY_04_00","",""
"Scripts/content/Story/MISSIONS/DIA_Vlk_572_Gravo.d:92","Ich werd' zusehen, dass sich ein paar Leute mal mit ihm unterhalten. 100 Erz und ich erledige die Sache.","Meggyőzök pár fickót hogy beszéljenek vele. 100 érc és megoldom a problémád.","","False","B_Gravo_HelpAttitude_ANGRY_04_01","",""
"Scripts/content/Story/MISSIONS/DIA_Vlk_572_Gravo.d:95","Lass sehen, wie viel du hast ... Ah! Das sollte reichen. Betrachte die Sache als erledigt.","Nézzük mennyi van nálad... Áh! Ez elég lesz. Vedd elsimítottnak a nézeteltéréseteket.","","False","B_Gravo_HelpAttitude_ANGRY_04_02","",""
"Scripts/content/Story/MISSIONS/DIA_Vlk_572_Gravo.d:96","Und sprich mit keinem darüber. Tu einfach so, als wär' nichts passiert.","De erről nem beszélhetsz senkinek. Csak egyszerűen tégy úgy, mintha semmi sem történt volna.","","False","B_Gravo_HelpAttitude_ANGRY_04_03","",""
"Scripts/content/Story/MISSIONS/DIA_Vlk_572_Gravo.d:102","So viel hab' ich nicht.","Nincs annyim.","","False","B_Gravo_HelpAttitude_NoOre_15_01","",""
"Scripts/content/Story/MISSIONS/DIA_Vlk_572_Gravo.d:103","Dann kann ich nichts für dich tun - tut mir Leid, Junge.","Akkor nem tehetek érted semmi - bocs kölyök.","","False","B_Gravo_HelpAttitude_NoOre_04_02","",""
"Scripts/content/Story/MISSIONS/DIA_Vlk_572_Gravo.d:108","Ärger ist gar kein Ausdruck, Junge. Er würde dir am liebsten den Kopf abreißen.","Ezt te problémának hívod? Egy kicsit alábecsülöd a helyzeted. Szerintem inkább apró cafatokra tépne szét, kölyök.","","False","B_Gravo_HelpAttitude_HOSTILE_04_00","",""
"Scripts/content/Story/MISSIONS/DIA_Vlk_572_Gravo.d:109","Wenn ich ein paar Jungs davon überzeugen soll, ihn wieder gut zu stimmen, wird das nicht billig. 500 Erz musst du schon hinlegen.","Nem lesz olcsó meggyőzni ennyi embert, hogy megint lenyugtassák . Ez legalább 500 ércedbe fog kerülni.","","False","B_Gravo_HelpAttitude_HOSTILE_04_01","",""
"Scripts/content/Story/MISSIONS/DIA_Vlk_572_Gravo.d:112","Lass sehen, wie viel du hast ... Du scheinst ein reicher Bursche zu sein. Ich nehme die 500 und kümmere mich drum.","Nézzük csak mennyi is van nálad... Gazdag fickónak tűnsz. Viszem ezt az 500 ércet és elsimítom a nézeteltérésetek.","","False","B_Gravo_HelpAttitude_HOSTILE_04_02","",""
"Scripts/content/Story/MISSIONS/DIA_Vlk_572_Gravo.d:113","Und noch was: Er darf nie erfahren, dass ICH die Sache für dich geregelt habe - also rede mit KEINEM darüber!","És ne feledd: Sohasem tudhatja meg, hogy én oldottam meg a problémát - tehát SENKINEK sem beszélhetsz erről, megértetted?","","False","B_Gravo_HelpAttitude_HOSTILE_04_03","",""
"Scripts/content/Story/MISSIONS/DIA_Vlk_572_Gravo.d:125","Soweit ich weiß, hat er kein Problem mit dir - mach dir keine Sorgen.","Amennyire én tudom, nincs semmi baja veled - ne aggódj.","","False","B_Gravo_HelpAttitude_NoProb_04_00","",""
"Scripts/content/Story/MISSIONS/DIA_Vlk_572_Gravo.d:137","Kannst du mir helfen - ich glaub, ich hab' Ärger.","Tudnál segíteni - Azt hiszem bajban vagyok.","","False","DIA_Gravo_HelpAngryNow.description","",""
"Scripts/content/Story/MISSIONS/DIA_Vlk_572_Gravo.d:150","Kannst du mir helfen - ich glaub, ich hab' Ärger.","Tudnál segíteni - Azt hiszem bajban vagyok.","","False","DIA_Gravo_HelpAngryNow_15_00","",""
"Scripts/content/Story/MISSIONS/DIA_Vlk_572_Gravo.d:151","Ich denke schon, aber ich warne dich, die Sache kann dich zwischen 100 und 500 Erz kosten.","Szerintem igen, de figyelmeztetlek, a segítségem 100 és 500 közötti ércedbe is fájhat.","","False","DIA_Gravo_HelpAngryNow_04_01","",""
"Scripts/content/Story/MISSIONS/DIA_Vlk_572_Gravo.d:155","Mit Diego.","Segíts Diego-val kapcsolatban.","","False","DIA_Gravo_HelpAngryNow.DIA_Gravo_HelpAngryNow_Diego","Info_AddChoice",""
"Scripts/content/Story/MISSIONS/DIA_Vlk_572_Gravo.d:156","Mit Thorus","Segítség kéne Thorus-szal.","","False","DIA_Gravo_HelpAngryNow.DIA_Gravo_HelpAngryNow_Thorus","Info_AddChoice",""
"Scripts/content/Story/MISSIONS/DIA_Vlk_572_Gravo.d:157","Mit Gomez","Segítség kéne Gomez-zel.","","False","DIA_Gravo_HelpAngryNow.DIA_Gravo_HelpAngryNow_Gomez","Info_AddChoice",""
"Scripts/content/Story/MISSIONS/DIA_Vlk_572_Gravo.d:167","Mit Diego.","Segíts Diego-val kapcsolatban.","","False","DIA_Gravo_HelpAngryNow_Diego_15_00","",""
"Scripts/content/Story/MISSIONS/DIA_Vlk_572_Gravo.d:176","Mit Thorus.","Segíts Thorus-szal kapcsolatban.","","False","DIA_Gravo_HelpAngryNow_Thorus_15_00","",""
"Scripts/content/Story/MISSIONS/DIA_Vlk_572_Gravo.d:185","Mit Gomez.","Segíts Gomez-zel kapcsolatban.","","False","DIA_Gravo_HelpAngryNow_Gomez_15_00","",""
"Scripts/content/Story/MISSIONS/DIA_Vlk_572_Gravo.d:202","Kannst du mir sagen, wer hier zu den einflussreichen Leuten gehört?","Meg tudnád mondani ki tartozik a befolyásos emberek közé?","","False","DIA_Gravo_Influence.description","",""
"Scripts/content/Story/MISSIONS/DIA_Vlk_572_Gravo.d:215","Kannst du mir sagen, wer von den Schatten hier zu den einflussreichen Leuten gehört?","Meg tudnád mondani, hogy kik azok az Árnyak akik befolyással bírnak itt?","","False","DIA_Gravo_Influence_15_00","",""
"Scripts/content/Story/MISSIONS/DIA_Vlk_572_Gravo.d:216","Du willst die richtigen Leute beeindrucken, he?","A megfelelő embereknek akarsz a kedvében járni, ugye?","","False","DIA_Gravo_Influence_04_01","",""
"Scripts/content/Story/MISSIONS/DIA_Vlk_572_Gravo.d:217","Diego hat von allen Schatten am meisten zu melden. Zu seinen Vertrauten zählen Fingers, Whistler und Sly.","Diego-nak van a legnagyobb befolyása az Árnyak között. Fingers, Whistler és Sly a bizalmasai.","","False","DIA_Gravo_Influence_04_02","",""
"Scripts/content/Story/MISSIONS/DIA_Vlk_572_Gravo.d:218","Dexter und Fisk verscherbeln ihre Sachen auf dem Marktplatz. Sie haben viele Kunden, selbst unter den Gardisten und sind dementsprechend einflussreich.","Dexter és Fisk a piactéren kereskednek az áruikkal. Sok vásárlójuk van, még az őrök között is és ez elég befolyásossá teszi őket.","","False","DIA_Gravo_Influence_04_03","",""
"Scripts/content/Story/MISSIONS/DIA_Vlk_572_Gravo.d:219","Und dann wäre da noch Scatty, er leitet die Arena, bestimmt wer kämpft und so. Es gibt viele hier, die ihm noch Erz schulden - auch an ihn kannst du dich halten.","Aztán ott van Scatty. Ő felügyeli az arénát, és dönti el kik harcolhatnak ott és még miegymást. Nagyon sok ember tartozik neki érccel - ezért ő is elég befolyásos.","","False","DIA_Gravo_Influence_04_04","",""
"Scripts/content/Story/MISSIONS/DIA_Vlk_573_Graham.d:33","Hi! Ich bin neu hier.","Hali! Új vagyok itt.","","False","DIA_Graham_Hello.description","",""
"Scripts/content/Story/MISSIONS/DIA_Vlk_573_Graham.d:43","Hi! Ich bin neu hier.","Hali! Új vagyok itt.","","False","DIA_Graham_Hello_15_00","",""
"Scripts/content/Story/MISSIONS/DIA_Vlk_573_Graham.d:44","Ich bin Graham. Ich zeichne Karten. Dich hab' ich hier noch nie gesehen ... Was willst du?","Én Graham vagyok. Térképeket vázolok. Még nem láttalak errefelé... mit szeretnél?","","False","DIA_Graham_Hello_02_01","",""
"Scripts/content/Story/MISSIONS/DIA_Vlk_573_Graham.d:62","Diego schickt mich. Er sagt, du sollst mir ne Karte geben.","Diego küldött. Azt kéri, adj nekem egy térképet a Régi Bányáról.","","False","DIA_Graham_SellMap.description","",""
"Scripts/content/Story/MISSIONS/DIA_Vlk_573_Graham.d:75","Diego schickt mich. Er sagt, du sollst mir 'ne Karte geben, auf der der Weg zur Alten Mine verzeichnet ist.","Diego küldött. Azt kéri, adj nekem egy térképet amin rajta van az útvonal Régi Bányához.","","False","DIA_Graham_SellMap_15_00","",""
"Scripts/content/Story/MISSIONS/DIA_Vlk_573_Graham.d:76","Kein Problem. Für dich nur 20 Erz.","Nem gond. Neked csak 20 érc lesz.","","False","DIA_Graham_SellMap_02_01","",""
"Scripts/content/Story/MISSIONS/DIA_Vlk_573_Graham.d:78","Ich komme wieder.","Még visszatérek.","","False","DIA_Graham_SellMap.DIA_Graham_SellMap_BACK","Info_AddChoice",""
"Scripts/content/Story/MISSIONS/DIA_Vlk_573_Graham.d:79","Gut - ich werde die Karte bezahlen. Hier, nimm das Erz.","Kifizetem a térképet. Tessék itt az érc.","","False","DIA_Graham_SellMap.DIA_Graham_SellMap_Pay","Info_AddChoice",""
"Scripts/content/Story/MISSIONS/DIA_Vlk_573_Graham.d:80","Rück die Karte raus, oder ich polier dir die Fresse!","Add ide a térképet vagy én veszem el!","","False","DIA_Graham_SellMap.DIA_Graham_SellMap_AufsMaul","Info_AddChoice",""
"Scripts/content/Story/MISSIONS/DIA_Vlk_573_Graham.d:81","Moment, Diego sagte, du sollst mir die Karte GEBEN, nicht verkaufen.","Na várj, Diego azt mondta oda KELL adnod a térképet, NEM eladnod!","","False","DIA_Graham_SellMap.DIA_Graham_SellMap_GiveNotSell","Info_AddChoice",""
"Scripts/content/Story/MISSIONS/DIA_Vlk_573_Graham.d:86","Ich komme wieder.","Még visszatérek.","","False","DIA_Graham_SellMap_BACK_15_00","",""
"Scripts/content/Story/MISSIONS/DIA_Vlk_573_Graham.d:92","Ich werde die Karte bezahlen. Hier, nimm das Erz.","Kifizetem a térképet. Tessék itt az érc.","","False","DIA_Graham_SellMap_Pay_15_00","",""
"Scripts/content/Story/MISSIONS/DIA_Vlk_573_Graham.d:95","Gut. So billig kommst du nie wieder an so eine Karte - glaub mir.","Hát jó. Sehol sem kapsz térképet ilyen olcsón - nekem elhiheted.","","False","DIA_Graham_SellMap_Pay_02_01","",""
"Scripts/content/Story/MISSIONS/DIA_Vlk_573_Graham.d:103","Beschaff dir erst mal ein bisschen Erz. Geh Tiere jagen oder Pilze sammeln - du kannst den Krempel dann hier im Lager zu Erz machen.","Menj és szerezz egy kis ércet. Vadássz állatokra, vagy szedj pár gombát - ezeket eltudod adni itt a táborban.","","False","DIA_Graham_SellMap_Pay_NoOre_02_00","",""
