"location","source","target","id","fuzzy","context","translator_comments","developer_comments"
"Scripts/content/Story/MISSIONS/DIA_Pc_Thief.d:26","Ich bin Diego.","Diego vagyok.","","","Info_Diego_Gamestart_11_00","",""
"Scripts/content/Story/MISSIONS/DIA_Pc_Thief.d:27","Ich bin...","Én...","","","Info_Diego_Gamestart_15_01","",""
"Scripts/content/Story/MISSIONS/DIA_Pc_Thief.d:28","Mich interessiert nicht, wer du bist. Du bist neu hier. Ich kümmere mich um die Neuen. Belassen wir es vorerst dabei.","Nem érdekel ki vagy te valójában. Az előbb érkeztél. Én figyelek az újonnan érkezőkre. Ez minden jelenleg.","","","Info_Diego_Gamestart_11_02","",""
"Scripts/content/Story/MISSIONS/DIA_Pc_Thief.d:29","Wenn du vorhast, länger zu leben, solltest du dich ein bißchen mit mir unterhalten. Ich werde dich allerdings nicht daran hindern, in dein Verderben zu rennen. Also, wie sieht's aus?","Ha azt tervezed életben maradsz egy ideig, beszélned kell velem. De természetesen meg nem óvhatlak attól hogy megválaszd a saját halálod. Nos, mit gondolsz?","","","Info_Diego_Gamestart_11_03","",""
"Scripts/content/Story/MISSIONS/DIA_Pc_Thief.d:53","Danke für die Hilfe.","Köszönöm a segítséged.","","","Info_Diego_EXIT_Gamestart_15_00","",""
"Scripts/content/Story/MISSIONS/DIA_Pc_Thief.d:57","Wie du willst. War nett, dich gekannt zu haben.","Erről te döntesz. Örülök hogy megismertelek.","","","Info_Diego_EXIT_Gamestart_11_01","",""
"Scripts/content/Story/MISSIONS/DIA_Pc_Thief.d:61","Wir sehen uns im Alten Lager.","Találkozunk a Régi Táborban.","","","Info_Diego_EXIT_Gamestart_11_02","",""
"Scripts/content/Story/MISSIONS/DIA_Pc_Thief.d:96","Weiter geht's.","Menjünk.","","","Info_Diego_EXIT_11_01","",""
"Scripts/content/Story/MISSIONS/DIA_Pc_Thief.d:100","Mach's gut.","Légy óvatos.","","","Info_Diego_EXIT_15_00","",""
"Scripts/content/Story/MISSIONS/DIA_Pc_Thief.d:115","Ich habe einen Brief für den obersten Feuermagier.","Van egy levelem a Tűzmágusok Körének Főmágusához.","","","Info_Diego_Brief.description","",""
"Scripts/content/Story/MISSIONS/DIA_Pc_Thief.d:128","Ich habe einen Brief für den obersten Feuermagier.","Van egy levelem a Tűzmágusok Körének Főmágusához.","","","Info_Diego_Brief_15_00","",""
"Scripts/content/Story/MISSIONS/DIA_Pc_Thief.d:129","So...?","Igazán...?","","","Info_Diego_Brief_11_01","",""
"Scripts/content/Story/MISSIONS/DIA_Pc_Thief.d:130","Ein Magier hat ihn mir gegeben, kurz bevor sie mich reingeworfen haben.","Ezt egy mágus adta röviddel az előtt hogy ide dobtak volna.","","","Info_Diego_Brief_15_02","",""
"Scripts/content/Story/MISSIONS/DIA_Pc_Thief.d:131","Du kannst von Glück sagen, dass ich mich bei den Magiern nicht mehr blicken lassen kann. Jeder andere wird dir mit Freude für diesen Brief die Kehle durchschneiden.","Szerencsés vagy. Nekem nem áll módomban többé megjelenni a mágusok előtt. Bárki más örömmel átvágná a torkod ezért a levélért.","","","Info_Diego_Brief_11_03","",""
"Scripts/content/Story/MISSIONS/DIA_Pc_Thief.d:132","Die Magier belohnen ihre Boten immer sehr gut, und die meisten hier haben gar nichts, verstehst du?","Ez azért van, mert a mágusok sokat fizetnek a futárjaiknak, a sokunknak meg nincs semmilye.","","False","Info_Diego_Brief_11_04","",""
"Scripts/content/Story/MISSIONS/DIA_Pc_Thief.d:133","Wenn ich du wäre, würde ich die Schnauze halten, bis ich einen der Magier treffe. Obwohl das in deiner Lage nicht allzu wahrscheinlich ist.","A helyedben csendben maradnék míg nem találkozom egy mágussal. Habár, a te helyzetedben nem valószínű hogy ez megtörténjen.","","","Info_Diego_Brief_11_05","",""
"Scripts/content/Story/MISSIONS/DIA_Pc_Thief.d:134","Wieso nicht?","Miért nem?","","","Info_Diego_Brief_15_06","",""
"Scripts/content/Story/MISSIONS/DIA_Pc_Thief.d:135","Die Magier sind in der Burg im Alten Lager. Nur Gomez' Leuten ist es erlaubt, die Burg zu betreten.","A mágusok a régi tábor várában tartózkodnak. Oda viszont csak Gomez emberei léphetnek be.","","False","Info_Diego_Brief_11_07","",""
"Scripts/content/Story/MISSIONS/DIA_Pc_Thief.d:147","Warum hast du mir geholfen?","Miért segítesz nekem?","","","Info_Diego_WarumGeholfen.description","",""
"Scripts/content/Story/MISSIONS/DIA_Pc_Thief.d:161","Warum hast du mir geholfen?","Miért segítesz nekem?","","","Info_Diego_WarumGeholfen_15_00","",""
"Scripts/content/Story/MISSIONS/DIA_Pc_Thief.d:162","Weil du Hilfe gebraucht hast. Bullit und seine Jungs hätten dich vielleicht kaltgemacht.","Szükséged van segítségre, különben Bullit és az emberei megölhetnek téged.","","","Info_Diego_WarumGeholfen_11_01","",""
"Scripts/content/Story/MISSIONS/DIA_Pc_Thief.d:163","Und das konnte ich nicht mit ansehen. Schließlich bin ich den ganzen weiten Weg gekommen um dir einen Vorschlag zu machen.","Nem tudnék egy helyben állni és nézni. Azért jöttem idáig hogy egy javaslatot tegyek.","","","Info_Diego_WarumGeholfen_11_02","",""
"Scripts/content/Story/MISSIONS/DIA_Pc_Thief.d:164","Einen Vorschlag...","Egy javaslat...","","","Info_Diego_WarumGeholfen_15_03","",""
"Scripts/content/Story/MISSIONS/DIA_Pc_Thief.d:165","Ja. Deine Begegnung mit Bullit und seinen Jungs hat dir hoffentlich gezeigt, dass du Schutz brauchst.","Igen. Ezután a kis incidens után Bullittal és a fiúkkal, most már láthatod hogy szükséged van védelemre.","","","Info_Diego_WarumGeholfen_11_04","",""
"Scripts/content/Story/MISSIONS/DIA_Pc_Thief.d:166","Jeder, der hier ankommt, wird vor eine Wahl gestellt. Es gibt drei Lager in der Kolonie, und einem davon wirst du dich anschließen müssen.","Minden ideérkező választhat: Három tábor van a kolónián belül és az egyikhez csatlakozhatsz ezek közül.","","","Info_Diego_WarumGeholfen_11_05","",""
"Scripts/content/Story/MISSIONS/DIA_Pc_Thief.d:167","Ich bin hier, um Neuen wie dir klarzumachen, dass sie bei uns im alten Lager am besten aufgehoben sind.","Azért vagyok itt, hogy megmutassam az újaknak, a Régi Tábor a legjobb hely számukra.","","","Info_Diego_WarumGeholfen_11_06","",""
"Scripts/content/Story/MISSIONS/DIA_Pc_Thief.d:177","Wo ist dieser Bullit jetzt?","Hol van most Bullit?","","","Info_Diego_Bullit.description","",""
"Scripts/content/Story/MISSIONS/DIA_Pc_Thief.d:190","Wo ist dieser Bullit jetzt?","Hol van most Bullit?","","","Info_Diego_Bullit_15_02","",""
"Scripts/content/Story/MISSIONS/DIA_Pc_Thief.d:191","Er und die anderen bringen die Waren aus der Außenwelt ins alte Lager. Dort kannst du ihn finden.","Ő és a többiek hordják a javakat a külvilágból a Táborba. Itt meg fogod őt találni.","","","Info_Diego_Bullit_11_03","",""
"Scripts/content/Story/MISSIONS/DIA_Pc_Thief.d:192","Aber wenn du vorhast, dich mit ihm anzulegen, sei vorsichtig. Er ist ein erfahrener Kämpfer.","De ha az a terved hogy megküzdesz vele, légy óvatos. Ő egy tapasztalt harcos.","","","Info_Diego_Bullit_11_04","",""
"Scripts/content/Story/MISSIONS/DIA_Pc_Thief.d:204","Okay, was muss ich über diesen Ort wissen?","Oké, mit kell tudnom erről a helyről?","","","Info_Diego_Kolonie.description","",""
"Scripts/content/Story/MISSIONS/DIA_Pc_Thief.d:217","Okay, was muss ich über diesen Ort wissen?","Oké, mit kell tudnom erről a helyről?","","","Info_Diego_Kolonie_15_00","",""
"Scripts/content/Story/MISSIONS/DIA_Pc_Thief.d:218","Wir nennen es die Kolonie. Du wirst sicher schon gehört haben, dass wir hier Erz für den König fördern.","Mi kolóniának hívjuk a helyet. Úgyis látni fogod hogy ércet termelünk a Királynak.","","","Info_Diego_Kolonie_11_01","",""
"Scripts/content/Story/MISSIONS/DIA_Pc_Thief.d:219","Nun - zumindest wir vom alten Lager.","Nos, úgy értem mi - a Régi Tábor lakói.","","","Info_Diego_Kolonie_11_02","",""
"Scripts/content/Story/MISSIONS/DIA_Pc_Thief.d:220","Es gibt drei Lager innerhalb der Barriere. Das alte Lager ist das größte von ihnen. Es war auch das erste.","Három tábor van a Kupolán belül. A Régi Tábor a legnagyobb és ez volt az első is egyben.","","","Info_Diego_Kolonie_11_03","",""
"Scripts/content/Story/MISSIONS/DIA_Pc_Thief.d:230","Erzähl mir was über die Barriere.","Mesélj még a Kupoláról.","","","Info_Diego_Barriere.description","",""
"Scripts/content/Story/MISSIONS/DIA_Pc_Thief.d:243","Erzähl mir was über die Barriere.","Mesélj még a Kupoláról.","","","Info_Diego_Barriere_15_00","",""
"Scripts/content/Story/MISSIONS/DIA_Pc_Thief.d:244","Da gibt es nicht viel zu erzählen. Sie ist undurchdringlich.","Nincs más amit mondhatnék. Áthatolhatatlan.","","","Info_Diego_Barriere_11_01","",""
"Scripts/content/Story/MISSIONS/DIA_Pc_Thief.d:245","Was passiert, wenn ich hier einfach wieder rausspaziere?","Mi történik ha egyszerűen kisétálok innen?","","","Info_Diego_Barriere_15_02","",""
"Scripts/content/Story/MISSIONS/DIA_Pc_Thief.d:246","Der Letzte, der das versucht hat, ist tot auf der anderen Seite angekommen. Diese verdammte Barriere lässt dich zwar rein, aber raus kommst du hier nicht mehr.","Az utolsó aki megpróbálta elérni a túloldalt, halott. Ez az átkozott Kupola beenged, de soha nem fogsz kijutni innen.","","","Info_Diego_Barriere_11_03","",""
"Scripts/content/Story/MISSIONS/DIA_Pc_Thief.d:247","Wenn es einen Weg hier raus gibt, werde ich ihn finden.","Ha létezik kiút, meg fogom találni.","","","Info_Diego_Barriere_15_04","",""
"Scripts/content/Story/MISSIONS/DIA_Pc_Thief.d:248","Hast du's SO eilig, hier wieder rauszukommen? Du bist ja gerade mal da!","Még ily nagy benned a sietség hogy kijuss? De csak az imént érkeztél!","","","Info_Diego_Barriere_11_05","",""
"Scripts/content/Story/MISSIONS/DIA_Pc_Thief.d:258","Was ist mit den beiden anderen Lagern?","Mi a helyzet a másik két Táborral?","","","Info_Diego_OtherCamps.description","",""
"Scripts/content/Story/MISSIONS/DIA_Pc_Thief.d:272","Was ist mit den beiden anderen Lagern?","Mi a helyzet a másik két Táborral?","","","Info_Diego_OtherCamps_15_00","",""
"Scripts/content/Story/MISSIONS/DIA_Pc_Thief.d:273","Die beiden anderen Lager haben sich abgespalten, um ihren schwachsinnigen Ausbruchsplänen nachzugehen.","Két másik tábor vált külön hogy hajszolják őrült menekülési terveiket.","","","Info_Diego_OtherCamps_11_01","",""
"Scripts/content/Story/MISSIONS/DIA_Pc_Thief.d:274","Es gibt das neue Lager im Westen der Kolonie. Die Magier dort meinen, wenn sie genug Erz zusammengekratzt haben, können sie die Barriere einfach sprengen.","Az Új Tábor a kolónia nyugati részén helyezkedik el, ahol mágusaik úgy gondolják felrobbanthatják a Kupolát amint elég ércet gyűjtöttek össze.","","","Info_Diego_OtherCamps_11_02","",""
"Scripts/content/Story/MISSIONS/DIA_Pc_Thief.d:275","Dann gibt's im Osten die Sektenspinner. Sie haben ihr Lager im Sumpf und beten zu ihrem Götzen, er möge ihnen die Freiheit schenken.","Aztán ott vannak keleten a szekta-bolondok. A táboruk a mocsár közepén található és a bálványukhoz imádkoznak hogy szabadítsa ki őket.","","","Info_Diego_OtherCamps_11_03","",""
"Scripts/content/Story/MISSIONS/DIA_Pc_Thief.d:276","Bis jetzt hat er sich noch nicht gemeldet.","Eddig még nem válaszolt nekik.","","","Info_Diego_OtherCamps_11_04","",""
"Scripts/content/Story/MISSIONS/DIA_Pc_Thief.d:277","Wenn ich du wäre, würde ich meine Zeit nicht mit den Spinnern verschwenden.","A helyedben nem vesztegetném az időm azokra a vadakra.","","","Info_Diego_OtherCamps_11_05","",""
"Scripts/content/Story/MISSIONS/DIA_Pc_Thief.d:287","Erzähl mir was über das alte Lager.","Mondj valamit a Régi Táborról.","","","Info_Diego_OldCamp.description","",""
"Scripts/content/Story/MISSIONS/DIA_Pc_Thief.d:300","Erzähl mir was über das alte Lager.","Mondj valamit a Régi Táborról.","","","Info_Diego_OldCamp_15_00","",""
"Scripts/content/Story/MISSIONS/DIA_Pc_Thief.d:301","Es ist das größte und mächtigste der drei Lager. Gomez und seine Jungs kontrollieren das Lager und damit den ganzen Erzaustausch.","Ez a legnagyobb és legerősebb a három tábor közül. Gomez és emberei irányítják a Tábort, ezáltal az egész érc-kereskedelmet.","","","Info_Diego_OldCamp_11_01","",""
"Scripts/content/Story/MISSIONS/DIA_Pc_Thief.d:302","Einmal im Monat schickt der König uns alles, was wir fordern. Wir haben den alten Sack in der Hand, verstehst du? Er ist auf das Erz angewiesen.","Havonta egyszer a Király ellát minket mindennel amire szükségünk van. A markunkban van az öreg, érted? Minden az érc körül forog.","","False","Info_Diego_OldCamp_11_02","",""
"Scripts/content/Story/MISSIONS/DIA_Pc_Thief.d:303","Er schickt uns Wein, Brot, Fleisch, Waffen, einfach alles.","Küld nekünk bort, kenyeret, húst, fegyvert... mindent.","","","Info_Diego_OldCamp_11_03","",""
"Scripts/content/Story/MISSIONS/DIA_Pc_Thief.d:307","Du kannst auch deinen Teil davon bekommen. Alles, was du tun mußt, ist dich Gomez' Leuten anzuschließen.","Ezekből elvehetsz valamennyit. Csupán csatlakoznod kell Gomez embereihez.","","","Info_Diego_OldCamp_11_04","",""
"Scripts/content/Story/MISSIONS/DIA_Pc_Thief.d:320","Wer ist Gomez?","Ki az a Gomez?","","","Info_Diego_WhosGomez.description","",""
"Scripts/content/Story/MISSIONS/DIA_Pc_Thief.d:333","Wer ist Gomez?","Ki az a Gomez?","","","Info_Diego_WhosGomez_15_00","",""
"Scripts/content/Story/MISSIONS/DIA_Pc_Thief.d:334","Gomez ist der oberste Erzbaron. Der Boss des Alten Lagers. Der mächtigste Mann in der Kolonie.","Gomez a leghatalmasabb Ércbáró. Ő a Régi Tábor vezetője - a legbefolyásosabb ember a kolónián belül.","","","Info_Diego_WhosGomez_11_01","",""
"Scripts/content/Story/MISSIONS/DIA_Pc_Thief.d:346","Wie kann ich mich Gomez' Leuten anschliessen?","Tételezzük fel, hogy csatlakozom hozzá, mit kell tennem ehhez?","","","Info_Diego_JoinOldcamp.description","",""
"Scripts/content/Story/MISSIONS/DIA_Pc_Thief.d:361","Mal angenommen, ich wollte mich seinen Leuten anschließen, was müßte ich tun.","Tegyük fel, hogy csatlakozni akarok az embereihez, mit kellene tennem.","","False","Info_Diego_JoinOldcamp_15_00","",""
"Scripts/content/Story/MISSIONS/DIA_Pc_Thief.d:362","Am Eingang zur Burg findest du einen Mann, der Thorus heißt. Sag ihm Diego schickt dich.","A várkapunál találsz egy embert, akit Thorusnak hívnak. Mondd neki hogy Diego küldött.","","","Info_Diego_JoinOldcamp_11_01","",""
"Scripts/content/Story/MISSIONS/DIA_Pc_Thief.d:380","Wie komme ich zum alten Lager?","Hogy jutok el a Régi Táborba?","","","Info_Diego_WayToOldcamp.description","",""
"Scripts/content/Story/MISSIONS/DIA_Pc_Thief.d:393","Wie komme ich zum alten Lager?","Hogy jutok el a Régi Táborba?","","","Info_Diego_WayToOldcamp_15_00","",""
"Scripts/content/Story/MISSIONS/DIA_Pc_Thief.d:394","Du mußt nur dem Weg hier folgen. Das Alte Lager ist der nächste halbwegs sichere Ort von hier aus gesehen.","Csak kövesd az ösvényt. A Régi Tábor a következő biztonságosnak tűnő hely ami az utadba kerül.","","","Info_Diego_WayToOldcamp_11_01","",""
"Scripts/content/Story/MISSIONS/DIA_Pc_Thief.d:395","Es treiben sich jede Menge wilder Bestien zwischen den Lagern herum. Ohne Waffe zu gehen ist Wahnsinn.","Számos vad szörnyeteg rejtőzik a táborok között. Őrültség lenne fegyver nélkül sétálgatni.","","","Info_Diego_WayToOldcamp_11_02","",""
"Scripts/content/Story/MISSIONS/DIA_Pc_Thief.d:407","Wo kriege ich eine Waffe her?","Hol kapok fegyvert?","","","Info_Diego_WoWaffe.description","",""
"Scripts/content/Story/MISSIONS/DIA_Pc_Thief.d:420","Wo kriege ich eine Waffe her?","Hol kapok fegyvert?","","","Info_Diego_WoWaffe_15_00","",""
"Scripts/content/Story/MISSIONS/DIA_Pc_Thief.d:421","Wenn du an der verlassenen Mine vorbeikommst, sieh dich mal ein bißchen um. Du findest bestimmt was Brauchbares.","Amint a Régi Táborba érsz, nézz körül. Biztos vagyok benne hogy találsz valami használhatót.","","","Info_Diego_WoWaffe_11_01","",""
"Scripts/content/Story/MISSIONS/DIA_Pc_Thief.d:422","Die Mine ist leicht zu finden, nur ein paar Meter die Schlucht entlang.","A bányát könnyen megtalálod, csupán néhány méter a kanyon mentén.","","","Info_Diego_WoWaffe_11_02","",""
"Scripts/content/Story/MISSIONS/DIA_Pc_Thief.d:434","Ich habe mit Thorus geredet.","Beszéltem Thorus-szal.","","","Info_Diego_ThorusSays.description","",""
"Scripts/content/Story/MISSIONS/DIA_Pc_Thief.d:447","Ich habe mit Thorus geredet.","Beszéltem Thorus-szal.","","","Info_Diego_ThorusSays_15_00","",""
"Scripts/content/Story/MISSIONS/DIA_Pc_Thief.d:448","Und was sagt er?","És mit mondott?","","","Info_Diego_ThorusSays_11_01","",""
"Scripts/content/Story/MISSIONS/DIA_Pc_Thief.d:449","Er will mich im Lager aufnehmen, wenn DU denkst, dass ich gut genug bin.","Azt mondta, csatlakozhatok a Régi Táborhoz ha TE elég jónak tartasz.","","","Info_Diego_ThorusSays_15_02","",""
"Scripts/content/Story/MISSIONS/DIA_Pc_Thief.d:450","Sieht so aus, als hätte ich einen neuen Job.","Úgy tűnik új munkát találtam.","","","Info_Diego_ThorusSays_11_03","",""
"Scripts/content/Story/MISSIONS/DIA_Pc_Thief.d:451","Fangen wir direkt an?","Most kezdhetjük is?","","","Info_Diego_ThorusSays_15_04","",""
"Scripts/content/Story/MISSIONS/DIA_Pc_Thief.d:452","Vorher solltest du ein paar Sachen wissen.","Mindenekelőtt van pár dolog amit tudnod kell.","","","Info_Diego_ThorusSays_11_05","",""
"Scripts/content/Story/MISSIONS/DIA_Pc_Thief.d:464","Was muss ich wissen, um im Alten Lager aufgenommen zu werden?","Mit kell tudnom, mi az elfogadott a Régi Táborban?","","","Info_Diego_Rules.description","",""
"Scripts/content/Story/MISSIONS/DIA_Pc_Thief.d:477","Was muss ich wissen, um im Alten Lager aufgenommen zu werden?","Mit kell tudnom, mi az elfogadott a Régi Táborban?","","","Info_Diego_Rules_15_00","",""
"Scripts/content/Story/MISSIONS/DIA_Pc_Thief.d:478","Wenn du aufgenommen werden willst, mußt du Pluspunkte sammeln.","Ha csatlakozni akarsz a táborhoz, szerezned kell némi elismerést.","","","Info_Diego_Rules_11_01","",""
"Scripts/content/Story/MISSIONS/DIA_Pc_Thief.d:479","Es gibt einige einflussreiche Leute hier im Außenring. Die meisten davon sind Schatten. Wenn du es schaffst, sie zu beeindrucken, bringt dir das Pluspunkte ein.","Él egy kevés befolyásos ember a Külső Gyűrűn. A legtöbbjük Árny. Ha sikerül őket meggyőznöd, az jelenthet számodra valamennyi elismerést.","","","Info_Diego_Rules_11_02","",""
"Scripts/content/Story/MISSIONS/DIA_Pc_Thief.d:480","Dann mußt du eine Prüfung des Vertrauens ablegen.","Aztán ki kell állnod a hűségpróbát.","","","Info_Diego_Rules_11_03","",""
"Scripts/content/Story/MISSIONS/DIA_Pc_Thief.d:481","Außerdem gibt es für einen Neuen wie dich jede Menge neuer Talente zu lernen. Je mehr du lernst, desto wertvoller bist du für uns.","Emellett létezik rengeteg képzettség, amit az újak megtanulhatnak. Minél többet elsajátítasz, annál értékesebb leszel számunkra.","","","Info_Diego_Rules_11_04","",""
"Scripts/content/Story/MISSIONS/DIA_Pc_Thief.d:495","Wo finde ich die wichtigen Leute?","Hol találom ezeket a fontos embereket?","","","Info_Diego_Celebs.description","",""
"Scripts/content/Story/MISSIONS/DIA_Pc_Thief.d:508","Wo finde ich die wichtigen Leute?","Hol találom ezeket a fontos embereket?","","","Info_Diego_Celebs_15_00","",""
"Scripts/content/Story/MISSIONS/DIA_Pc_Thief.d:509","Nun, einer steht hier direkt vor dir, dann wäre da noch Thorus, den kennst du ja schon.","Nos, épp az egyiküket nézed. Aztán ott van Thorus... őt már szintén ismered.","","","Info_Diego_Celebs_11_01","",""
"Scripts/content/Story/MISSIONS/DIA_Pc_Thief.d:510","Was die anderen betrifft, das wirst du selbst rausfinden müssen. Wenn du dazu nicht in der Lage bist, hast du hier im Lager sowieso nichts verloren.","A többiek pedig... de ezt már magadnak kell kiderítened. Ha nem igyekszel így tenni, többé nem tartozol közénk.","","","Info_Diego_Celebs_11_02","",""
"Scripts/content/Story/MISSIONS/DIA_Pc_Thief.d:511","Geh einfach durch den Außenring und rede mit den Leuten. Du findest dann schon raus, an wen du dich halten mußt.","Csak mászkálj a Külső Gyűrűn és beszélj az emberekkel, így majd rájössz ki fontos.","","","Info_Diego_Celebs_11_03","",""
"Scripts/content/Story/MISSIONS/DIA_Pc_Thief.d:523","Bei wem kann ich was lernen?","Ki tud tanítani engem?","","","Info_Diego_Teachers.description","",""
"Scripts/content/Story/MISSIONS/DIA_Pc_Thief.d:536","Bei wem kann ich was lernen?","Ki tud tanítani engem?","","","Info_Diego_Teachers_15_00","",""
"Scripts/content/Story/MISSIONS/DIA_Pc_Thief.d:537","Für den Anfang solltest du dich an Fingers halten. Er ist der Geschickteste von uns.","Kezdd Fingers-szel. Ő a legképzettebb közülünk.","","","Info_Diego_Teachers_11_01","",""
"Scripts/content/Story/MISSIONS/DIA_Pc_Thief.d:538","Wenn du die Augen aufhältst, wirst du noch andere Leute finden, die dir etwas beibringen können.","Ha nyitva tartod a szemeidet, találsz másokat is akik taníthatnak téged.","","","Info_Diego_Teachers_11_02","",""
"Scripts/content/Story/MISSIONS/DIA_Pc_Thief.d:539","Wo finde ich diesen Fingers?","Hol találom Fingerst?","","","Info_Diego_Teachers_15_03","",""
"Scripts/content/Story/MISSIONS/DIA_Pc_Thief.d:540","Seine Hütte liegt etwas zurück, direkt an der Burgmauer, wenn du von hier zur Arena gehst.","A kunyhója rejtve van. Közvetlenül a várfalnál. Indulj erről a pontról az aréna felé.","","","Info_Diego_Teachers_11_04","",""
"Scripts/content/Story/MISSIONS/DIA_Pc_Thief.d:541","Wenn du vorm Burgtor stehst, geh links runter, da geht's Richtung Arena.","Amint a várkapuhoz érsz, menj le balra és vedd az irányt az aréna felé.","","","Info_Diego_Teachers_11_05","",""
"Scripts/content/Story/MISSIONS/DIA_Pc_Thief.d:563","Kannst du mir was beibringen?","Mit tudsz tanítani?","","","Info_Diego_Teach.description","",""
"Scripts/content/Story/MISSIONS/DIA_Pc_Thief.d:583","Kannst du mir was beibringen?","Mit tudsz tanítani?","","","Info_Diego_Teach_15_00","",""
"Scripts/content/Story/MISSIONS/DIA_Pc_Thief.d:584","Ja. Bei mir kannst du lernen, deine Geschicklichkeit zu verbessern oder deine Kampfkraft zu steigern.","Igen. Megtaníthatlak hogy fejleszd az ÜGYESSÉGED, valamint az ERŐD.","","","Info_Diego_Teach_11_01","",""
"Scripts/content/Story/MISSIONS/DIA_Pc_Thief.d:601","Deine Kampfkraft ist um einiges gestiegen.","A fizikai erőd megnövekedett.","","","Info_Diego_Teach_BACK_11_00","",""
"Scripts/content/Story/MISSIONS/DIA_Pc_Thief.d:606","Dein Geschick im Umgang mit Bögen und Armbrüsten ist schon besser geworden.","Az íj- és számszeríjhasználatod fejlődött.","","","Info_Diego_Teach_BACK_11_01","",""
"Scripts/content/Story/MISSIONS/DIA_Pc_Thief.d:609","Komm bald wieder - es gibt viel zu lernen!","Gyere vissza hamarosan - még sok dolgot kell tanulnod!","","","Info_Diego_Teach_BACK_11_02","",""
"Scripts/content/Story/MISSIONS/DIA_Pc_Thief.d:670","Was ist die Prüfung des Vertrauens?","Mi az a hűségpróba?","","","Info_Diego_BringList_Offer.description","",""
"Scripts/content/Story/MISSIONS/DIA_Pc_Thief.d:683","Was ist die Prüfung des Vertrauens?","Mi az a hűségpróba?","","","Info_Diego_BringList_Offer_15_00","",""
"Scripts/content/Story/MISSIONS/DIA_Pc_Thief.d:684","Du sollst für mich zur alten Mine gehen. Dort triffst du einen Kerl namens Ian. Er wird dir eine Liste geben.","El kell jutnod a Régi Bányához. Itt találkozhatsz egy alakkal, Iannal. Ő ad majd egy listát.","","","Info_Diego_BringList_Offer_11_01","",""
"Scripts/content/Story/MISSIONS/DIA_Pc_Thief.d:685","Diese Liste ist wichtig. Da steht drauf, was die Jungs in der Mine von uns brauchen.","Ez a lista fontos. Tartalmaz minden dolgot amire a srácoknak a bányában szükségük van.","","","Info_Diego_BringList_Offer_11_02","",""
"Scripts/content/Story/MISSIONS/DIA_Pc_Thief.d:686","Das schicken wir ihnen dann mit dem nächsten Convoy!","A következő karavánnal elviszik a cuccokat!","","","Info_Diego_BringList_Offer_11_03","",""
"Scripts/content/Story/MISSIONS/DIA_Pc_Thief.d:687","Kein Problem!","Nem probléma!","","","Info_Diego_BringList_Offer_15_04","",""
"Scripts/content/Story/MISSIONS/DIA_Pc_Thief.d:688","Oh, doch! Das ist ein Problem. Das Neue Lager darf auf keinen Fall die Liste in die Finger bekommen!","De igen, van probléma! Az Új Tábor nem szerezheti meg a listát!","","","Info_Diego_BringList_Offer_11_05","",""
"Scripts/content/Story/MISSIONS/DIA_Pc_Thief.d:689","Wie ich schon sagte, die Liste ist wichtig. Wenn du die Sache gut machst, bringt dich das einen großen Schritt weiter.","Amint mondtam: A lista fontos. Hogyha megteszed, sokkal előrébb juthatsz.","","","Info_Diego_BringList_Offer_11_06","",""
"Scripts/content/Story/MISSIONS/DIA_Pc_Thief.d:708","Wenn die Liste so vichtig ist, wieso sollte Ian sie mir geben?","Ha olyan fontos a lista, miért kellene Iannak odaadnia nekem?","","","Info_Diego_IanPassword.description","",""
"Scripts/content/Story/MISSIONS/DIA_Pc_Thief.d:721","Wenn die Liste so wichtig ist, wieso sollte Ian sie dann ausgerechnet MIR geben?","Ha az a lista ennyire fontos, Ian miért NEKEM fogja adni?","","","Info_Diego_IanPassword_Info_15_01","",""
"Scripts/content/Story/MISSIONS/DIA_Pc_Thief.d:722","Weil du ihm sagst, Diego schickt dich.","Mert elmondod majd neki hogy Diego küldött téged.","","","Info_Diego_IanPassword_Info_11_02","",""
"Scripts/content/Story/MISSIONS/DIA_Pc_Thief.d:723","Werd's ihm ausrichten.","El fogom mondani.","","","Info_Diego_IanPassword_Info_15_03","",""
"Scripts/content/Story/MISSIONS/DIA_Pc_Thief.d:735","Wo finde ich die Alte Mine?","Merre találom a Régi Bányát?","","","Info_Diego_MapToOldMine.description","",""
