"location","source","target","id","fuzzy","context","translator_comments","developer_comments"
"Scripts/content/Story/MISSIONS/DIA_Vlk_511_Herek.d:46","Warte doch mal! Ich hab' gehört, du hast dich mit Bloodwyn unterhalten?","Egy pillanat! Azt hallottam te beszéltél Bloodwyn-nel?","","False","DIA_Herek_Bully_01_00","",""
"Scripts/content/Story/MISSIONS/DIA_Vlk_511_Herek.d:47","Warum? Was willst du?","Miért? Mit akarsz?","","False","DIA_Herek_Bully_15_01","",""
"Scripts/content/Story/MISSIONS/DIA_Vlk_511_Herek.d:48","Fand ich echt gut von dir, dass du dich geweigert hast, ihm Schutzgeld zu zahlen!","Nagyon vagány volt, hogy nem fizettél neki védelmi pénzt!","","False","DIA_Herek_Bully_01_02","",""
"Scripts/content/Story/MISSIONS/DIA_Vlk_511_Herek.d:49","Das heißt, wir anderen müssen deinen Teil mitbezahlen!","Ez azt jelenti, hogy nekünk kell kifizetnünk a részedet!","","False","DIA_Herek_Bully_01_03","",""
"Scripts/content/Story/MISSIONS/DIA_Vlk_511_Herek.d:50","Ich werde dafür sorgen, dass du dich daran erinnerst, wenn er dich das nächste Mal fragt ...","Biztosra megyek, hogy emlékezz rá, amikor legközelebb megkérdezi...","","False","DIA_Herek_Bully_01_04","",""
"Scripts/content/Story/MISSIONS/DIA_Vlk_511_Herek.d:69","Na, wie sieht's aus?","És, hogy mennek a dolgok?","","False","DIA_Herek_Motz.description","",""
"Scripts/content/Story/MISSIONS/DIA_Vlk_511_Herek.d:82","Na, wie sieht's aus?","És, hogy mennek a dolgok?","","False","DIA_Herek_Motz_15_00","",""
"Scripts/content/Story/MISSIONS/DIA_Vlk_511_Herek.d:83","In diesem Lager ist nicht genug Platz für uns beide!","Nincs elég hely kettőnknek ebben a táborban!","","False","DIA_Herek_Motz_01_01","",""
"Scripts/content/Story/MISSIONS/DIA_Vlk_511_Herek.d:84","Bitte was?","Tessék?","","False","DIA_Herek_Motz_15_02","",""
"Scripts/content/Story/MISSIONS/DIA_Vlk_511_Herek.d:85","Wenn es nach mir ginge, würdest du hier nicht alt!","Ha rajtam állna, nem sokáig maradnál itt!","","False","DIA_Herek_Motz_01_03","",""
"Scripts/content/Story/MISSIONS/DIA_Vlk_511_Herek.d:86","Weißt du, warum ich hier bin? In einer Nacht habe ich ein Dutzend Leute umgebracht. Einfach nur so ... hä hä hä!","Tudod te miért vagyok itt? Tucatnyi embert öltem meg egy éjszaka alatt, olyanokat mint te... He he he!","","False","DIA_Herek_Motz_01_04","",""
"Scripts/content/Story/MISSIONS/DIA_Vlk_511_Herek.d:103","Du denkst, du bist einer von den Harten? Versuch's doch nochmal bei mir.","Szóval azt hiszed egyike vagy a kemény fiúknak, igaz? Próbálkozz velem...","","False","DIA_Herek_Anlegen.description","",""
"Scripts/content/Story/MISSIONS/DIA_Vlk_511_Herek.d:116","So, du denkst also, du bist einer von den Harten? Versuch's doch mal bei mir ...","Szóval azt hiszed egyike vagy a kemény fiúknak, igaz? Miért nem kezdesz ki inkább velem ...","","False","DIA_Herek_Anlegen_15_00","",""
"Scripts/content/Story/MISSIONS/DIA_Vlk_511_Herek.d:117","Du willst'n paar aufs Maul?! Kannst du haben!!","Szeretnéd ha jól elpáholnának? Hát jó, legyen hogyha ezt akarod!!","","False","DIA_Herek_Anlegen_01_01","",""
"Scripts/content/Story/MISSIONS/DIA_Vlk_520_Buddler.d:34","Was machst du hier draußen?","Mit csinálsz itt kint?","","False","DIA_Vlk_520_LeaveMe.description","",""
"Scripts/content/Story/MISSIONS/DIA_Vlk_520_Buddler.d:44","Was machst du hier draußen?","Mit csinálsz itt kint?","","False","DIA_Vlk_520_LeaveMe_15_00","",""
"Scripts/content/Story/MISSIONS/DIA_Vlk_520_Buddler.d:45","Ich will meine Ruhe haben - also zisch ab.","Csak nyugalmat akarok - szóval húzz innen!","","False","DIA_Vlk_520_LeaveMe_01_01","",""
"Scripts/content/Story/MISSIONS/DIA_Vlk_524_Dusty.d:33","Hi! Ich bin neu hier - wie sieht's aus?","Helló! Új vagyok itt - hogy mennek a dolgok?","","False","DIA_Dusty_Hello.description","",""
"Scripts/content/Story/MISSIONS/DIA_Vlk_524_Dusty.d:43","Hi! Ich bin neu hier - wie sieht's aus?","Helló! Új vagyok itt - hogy mennek a dolgok?","","False","DIA_Dusty_Hello_15_00","",""
"Scripts/content/Story/MISSIONS/DIA_Vlk_524_Dusty.d:44","Ach hör auf! Ich hab' die letzten zwei Wochen in den Minen geschuftet. Und wofür?","Menj már! Már két hete itt koptatom a seggem a bányában. De minek?","","False","DIA_Dusty_Hello_03_01","",""
"Scripts/content/Story/MISSIONS/DIA_Vlk_524_Dusty.d:45","Ein paar lausige Brocken Erz sind mir geblieben. Das meiste ging für Essen drauf.","Csak néhány nyomorult kis érc rögöt kaptam. Az egészet élelemre kellett költenem.","","False","DIA_Dusty_Hello_03_02","",""
"Scripts/content/Story/MISSIONS/DIA_Vlk_524_Dusty.d:46","Ich hab' mich mit Baal Parvez da unten unterhalten. Er hat mir ein paar interessante Sachen über das Lager der Sekte erzählt.","Beszéltem Baal Parvez-zel odalent. Mondott néhány érdekes dolgot a Szekta Táborról.","","False","DIA_Dusty_Hello_03_03","",""
"Scripts/content/Story/MISSIONS/DIA_Vlk_524_Dusty.d:47","Ich glaube, ich sollte besser zu denen gehen, als mir weiter für Gomez den Rücken krumm zu schuften.","Azt hiszem, hogy jobban teszem, ha elmegyek oda, ahelyett hogy itt robotolok Gomeznek.","","False","DIA_Dusty_Hello_03_04","",""
"Scripts/content/Story/MISSIONS/DIA_Vlk_524_Dusty.d:59","Dir gefällt's hier nicht? Wieso gehst du dann nicht einfach?","Nem szeretsz itt lenni? Miért nem mész el akkor?","","False","DIA_Dusty_WhyNotLeave.description","",""
"Scripts/content/Story/MISSIONS/DIA_Vlk_524_Dusty.d:73","Dir gefällt's hier nicht? Wieso gehst du dann nicht einfach?","Nem szeretsz itt lenni? Miért nem mész el akkor?","","False","DIA_Dusty_WhyNotLeave_15_00","",""
"Scripts/content/Story/MISSIONS/DIA_Vlk_524_Dusty.d:74","Weil ich nicht sicher bin, was mich da erwartet. Ich habe 'nen Kumpel hier gehabt - Melvin heißt er. Er ist vor einer Woche ins Sektenlager abgehauen.","Mivel nem vagyok elég biztos abban, hogy mi vár rám ott. Volt egy haverom itt, Melvin-nek hívják. Egy héttel ezelőtt a Szekta Táborba ment.","","False","DIA_Dusty_WhyNotLeave_03_01","",""
"Scripts/content/Story/MISSIONS/DIA_Vlk_524_Dusty.d:75","Aber ich habe seitdem nichts mehr von ihm gehört. Und so lange sich das nicht ändert, bleibe ich besser hier!","De azóta semmit se hallottam felőle. És ameddig nem kapok valami hírt, addig itt maradok!","","False","DIA_Dusty_WhyNotLeave_03_02","",""
"Scripts/content/Story/MISSIONS/DIA_Vlk_524_Dusty.d:91","Ich war im Lager der Sekte und hab' Melvin getroffen.","Voltam a Szekta Táborban és találkoztam Melvin-nel.","","False","DIA_Dusty_MetMelvin.description","",""
"Scripts/content/Story/MISSIONS/DIA_Vlk_524_Dusty.d:104","Ich war im Lager der Sekte und hab' Melvin getroffen.","Voltam a Szekta Táborban és találkoztam Melvin-nel.","","False","DIA_Dusty_MetMelvin_15_00","",""
"Scripts/content/Story/MISSIONS/DIA_Vlk_524_Dusty.d:105","Und? Was sagt er?","És? Mit mondott?","","False","DIA_Dusty_MetMelvin_03_01","",""
"Scripts/content/Story/MISSIONS/DIA_Vlk_524_Dusty.d:106","Es gefällt ihm anscheinend besser, als sich von den Gardisten schikanieren zu lassen.","Úgy tűnik sokkal jobban szereti annál, minthogy az Őrök zaklassák.","","False","DIA_Dusty_MetMelvin_15_02","",""
"Scripts/content/Story/MISSIONS/DIA_Vlk_524_Dusty.d:107","Hey, Mann! Er hat den ganzen Spaß ohne mich? Ich muss da hin. Aber ich komme nie aus dem Lager raus.","Komolyan haver! Ennyire jól szórakozik? El kell mennem oda. Viszont nincs esélyem kijutni a táborból!","","False","DIA_Dusty_MetMelvin_03_03","",""
"Scripts/content/Story/MISSIONS/DIA_Vlk_524_Dusty.d:108","So? Warum nicht?","Tényleg? Miért nincs?","","False","DIA_Dusty_MetMelvin_15_04","",""
"Scripts/content/Story/MISSIONS/DIA_Vlk_524_Dusty.d:109","Die Gardisten haben spitz gekriegt, dass ich mich verdrücken will - schätze, ich hab' zu viel geredet.","Az őrök rájöttek, hogy el akarok menni, azt hiszem túl sokat járatom a szám.","","False","DIA_Dusty_MetMelvin_03_05","",""
"Scripts/content/Story/MISSIONS/DIA_Vlk_524_Dusty.d:110","Ich bräuchte mindestens 100 Erz, um die Wachen zu bestechen.","Legalább 100 érc kéne az őrök lefizetésére.","","False","DIA_Dusty_MetMelvin_03_06","",""
"Scripts/content/Story/MISSIONS/DIA_Vlk_524_Dusty.d:122","Was wäre, wenn ich dir die 100 Erz für die Wachen geben würde?","Mi van akkor ha adok neked 100 ércet az őröknek?","","False","DIA_Dusty_Offer100Ore.description","",""
"Scripts/content/Story/MISSIONS/DIA_Vlk_524_Dusty.d:136","Was wäre, wenn ich dir die 100 Erz für die Wachen geben würde?","Mi van akkor ha adok neked 100 ércet az őröknek?","","False","DIA_Dusty_Offer100Ore_15_00","",""
"Scripts/content/Story/MISSIONS/DIA_Vlk_524_Dusty.d:137","Das würdest du tun? Warum?","Megtennéd? Mér'?","","False","DIA_Dusty_Offer100Ore_03_01","",""
"Scripts/content/Story/MISSIONS/DIA_Vlk_524_Dusty.d:138","Nun, sagen wir mal, du bist nicht der einzige, der dein dummes Grinsen gerne im Sektenlager sehen würde.","Nos, tegyük fel hogy nem te vagy az egyetlen, aki jobban szeretne a Szekta Táborban lógni.","","False","DIA_Dusty_Offer100Ore_15_02","",""
"Scripts/content/Story/MISSIONS/DIA_Vlk_524_Dusty.d:139","Soll das heißen, du willst mit mir dahin gehen?","Úgy érted velem jössz?","","False","DIA_Dusty_Offer100Ore_03_03","",""
"Scripts/content/Story/MISSIONS/DIA_Vlk_524_Dusty.d:151","Ich WERDE mit dir zum Sektenlager gehen.","EL fogok veled menni a Szekta Táborba.","","False","DIA_Dusty_IWouldGo.description","",""
"Scripts/content/Story/MISSIONS/DIA_Vlk_524_Dusty.d:164","Ich WERDE mit dir zum Sektenlager gehen.","EL fogok veled menni a Szekta Táborba.","","False","DIA_Dusty_IWouldGo_15_00","",""
"Scripts/content/Story/MISSIONS/DIA_Vlk_524_Dusty.d:165","Gut, Mann! Ich bin bereit. Wir können los, sobald du so weit bist.","Haver, ez nagyszerű! Készen állok! Mehetünk, mihelyst akarsz.","","False","DIA_Dusty_IWouldGo_03_01","",""
"Scripts/content/Story/MISSIONS/DIA_Vlk_524_Dusty.d:166","Aber vergiss nicht - wir brauchen 100 Erz für die Wachen.","De ne feledd - 100 érc kell az őröknek.","","False","DIA_Dusty_IWouldGo_03_02","",""
"Scripts/content/Story/MISSIONS/DIA_Vlk_524_Dusty.d:184","Ich bin bereit - lass uns gehen.","Kész vagyok - indulhatunk.","","False","DIA_Dusty_LetsGo.description","",""
"Scripts/content/Story/MISSIONS/DIA_Vlk_524_Dusty.d:200","Ich bin bereit - lass uns gehen.","Kész vagyok - indulhatunk.","","False","DIA_Dusty_LetsGo_15_00","",""
"Scripts/content/Story/MISSIONS/DIA_Vlk_524_Dusty.d:201","Okay - lass uns durchs Südtor gehen - auf keinen Fall durchs Nordtor - die Wachen dort lassen sich garantiert nicht bestechen.","Rendben - gyerünk a déli kapuhoz - az északin kizárt átjutni, mert az ottani őröket nem lehet lefizetni.","","False","DIA_Dusty_LetsGo_03_01","",""
"Scripts/content/Story/MISSIONS/DIA_Vlk_524_Dusty.d:202","Und die Sache mit dem Erz regelst du am besten - ich bin nicht sehr gut in so was.","És te talán törődhetnél az érccel - Én nem vagyok valami jó az efféle dolgokban.","","False","DIA_Dusty_LetsGo_03_02","",""
"Scripts/content/Story/MISSIONS/DIA_Vlk_524_Dusty.d:203","Gut - also los!","Oké - mozgás!","","False","DIA_Dusty_LetsGo_15_03","",""
"Scripts/content/Story/MISSIONS/DIA_Vlk_530_Guy.d:33","Hallo!","Helló!","","False","DIA_Guy_Hello.description","",""
"Scripts/content/Story/MISSIONS/DIA_Vlk_530_Guy.d:46","Hallo!","Helló!","","False","DIA_Guy_Hello_15_00","",""
"Scripts/content/Story/MISSIONS/DIA_Vlk_530_Guy.d:47","Hm? Dich hab' ich hier noch nie gesehen - du bist neu hier, oder?","Hm? Még nem láttalak erre felé - új vagy itt, nem igaz?","","False","DIA_Guy_Hello_03_01","",""
"Scripts/content/Story/MISSIONS/DIA_Vlk_530_Guy.d:48","Vor kurzem angekommen ...","Mostanában érkeztem...","","False","DIA_Guy_Hello_15_02","",""
"Scripts/content/Story/MISSIONS/DIA_Vlk_530_Guy.d:49","Hast du dir schon überlegt, welchem Lager du dich anschließen willst?","Eldöntötted már, hogy melyik táborhoz csatlakozol?","","False","DIA_Guy_Hello_03_03","",""
"Scripts/content/Story/MISSIONS/DIA_Vlk_530_Guy.d:50","Nein, was würdest du mir raten?","Nem, neked mi a véleményed?","","False","DIA_Guy_Hello_15_04","",""
"Scripts/content/Story/MISSIONS/DIA_Vlk_530_Guy.d:51","Kommt drauf an - jedes Lager hat seine Vorteile - denke ich.","Hát, attól függ - szerintem mindegyik tábornak megvannak az előnyei.","","False","DIA_Guy_Hello_03_05","",""
"Scripts/content/Story/MISSIONS/DIA_Vlk_530_Guy.d:52","Bist du dir's überlegt hast, kannst du hier wohnen - ist gerade 'ne Hütte freigeworden.","Amíg nem döntesz, maradhatsz - egy kunyhó épp most lett szabad.","","False","DIA_Guy_Hello_03_06","",""
"Scripts/content/Story/MISSIONS/DIA_Vlk_530_Guy.d:65","Was sind die Vorteile des Alten Lagers?","Mik a Régi Tábor előnyei?","","False","DIA_Guy_AdOC.description","",""
"Scripts/content/Story/MISSIONS/DIA_Vlk_530_Guy.d:78","Was sind die Vorteile des Alten Lagers?","Mik a Régi Tábor előnyei?","","False","DIA_Guy_AdOC_15_00","",""
"Scripts/content/Story/MISSIONS/DIA_Vlk_530_Guy.d:79","Wenn du den Gardisten dein Schutzgeld zahlst, hast du ein ruhiges Leben. Sie mischen sich in alle Kämpfe ein, in denen jemand angegriffen wird, den sie beschützen.","Ha fizetsz védelmi pénzt az őröknek, nyugis életed lehet itt. Mindig közbelépnek ha egy fizető bányászukat megtámadják.","","False","DIA_Guy_AdOC_03_01","",""
"Scripts/content/Story/MISSIONS/DIA_Vlk_530_Guy.d:80","Außerdem kommt man nur hier günstig an Außenwelt-Waren. In den anderen Lagern sind diese Sachen unbezahlbar.","Mindezek mellett, csak itt juthatsz olcsón a kinti világból származó árukhoz. Ezek a dolgok hozzáférhetetlenek a többi táborban.","","False","DIA_Guy_AdOC_03_02","",""
"Scripts/content/Story/MISSIONS/DIA_Vlk_530_Guy.d:83","Ich denke, ich hab' genug über's alte Lager gehört...","Azt hiszem eleget hallottam a Régi Táborról.","","False","DIA_Guy_AdOC.DIA_Guy_AdOC_BACK","Info_AddChoice",""
"Scripts/content/Story/MISSIONS/DIA_Vlk_530_Guy.d:84","Was sind hier wertvolle Waren?","Mi számít értékes árunak erre felé?","","False","DIA_Guy_AdOC.DIA_Guy_AdOC_Warez","Info_AddChoice",""
"Scripts/content/Story/MISSIONS/DIA_Vlk_530_Guy.d:85","Und was ist, wenn zwei Leute kämpfen, die beide Schutzgeld zahlen?","Mi van akkor ha két védelmi díjat fizető ember kerül összeszólalkozásba?","","False","DIA_Guy_AdOC.DIA_Guy_AdOC_Protection","Info_AddChoice",""
"Scripts/content/Story/MISSIONS/DIA_Vlk_530_Guy.d:90","Ich denke, ich hab' genug über's Alte Lager gehört...","Azt hiszem eleget hallottam a Régi Táborról.","","False","DIA_Guy_AdOC_BACK_15_00","",""
"Scripts/content/Story/MISSIONS/DIA_Vlk_530_Guy.d:91","Also, mir gefällt's hier.","Én szeretek itt lenni.","","False","DIA_Guy_AdOC_BACK_03_01","",""
"Scripts/content/Story/MISSIONS/DIA_Vlk_530_Guy.d:97","Was sind hier wertvolle Waren?","Mi számít értékes árunak erre felé?","","False","DIA_Guy_AdOC_Warez_15_00","",""
"Scripts/content/Story/MISSIONS/DIA_Vlk_530_Guy.d:98","Alles, was aus der Außenwelt kommt. Brot, Käse, Schinken und vor allem Bier und Wein - nicht der billige Reisschnaps aus dem Neuen Lager, sondern richtig guter Stoff.","Minden ami a kinti világból származik. Kenyér, sajt, szalonna de legfőképp a sör és bor - nem úgy mint az az olcsó szar Rizspálinka az Új Táborból, csak az igazán jó cuccok.","","False","DIA_Guy_AdOC_Warez_03_01","",""
"Scripts/content/Story/MISSIONS/DIA_Vlk_530_Guy.d:99","Für Waffen bekommt man fast immer was und Rüstungen sind RICHTIG teuer.","Mindig jó árat kapsz fegyverekre, de a páncél NAGYON drága.","","False","DIA_Guy_AdOC_Warez_03_02","",""
"Scripts/content/Story/MISSIONS/DIA_Vlk_530_Guy.d:100","Die Gardisten haben sich die alten Rüstungen der Aufseher unter den Nagel gerissen, nachdem sie sie alle umgebracht hatten.","Az őrök elkobozták a felvigyázók régi páncélját, miután mindannyiukat megölték.","","False","DIA_Guy_AdOC_Warez_03_03","",""
"Scripts/content/Story/MISSIONS/DIA_Vlk_530_Guy.d:101","Diese Rüstungen sind so was wie ihr Erkennungszeichen, die verkaufen sie nur an ihresgleichen, da kommst du als Fremder gar nicht ran.","Könnyen felismerheted őket a páncéljukról, csak őröknek adják el őket. Kívülállóként sose fogsz hozzá jutni .","","False","DIA_Guy_AdOC_Warez_03_04","",""
"Scripts/content/Story/MISSIONS/DIA_Vlk_530_Guy.d:106","Und was ist, wenn zwei Leute kämpfen, die beide Schutzgeld zahlen?","Mi van akkor ha két védelmi díjat fizető ember kerül összeszólalkozásba?","","False","DIA_Guy_AdOC_Protection_15_00","",""
"Scripts/content/Story/MISSIONS/DIA_Vlk_530_Guy.d:107","Dann sehen sich die Gardisten das in aller Seelenruhe an. Aber wehe, wenn der eine den anderen umbringt. Dann ist er selber dran!","Akkor az őrök csak néznek - amíg az egyik ki nem nyírja a másikat: Akkor aztán lesz nemulass.","","False","DIA_Guy_AdOC_Protection_03_01","",""
"Scripts/content/Story/MISSIONS/DIA_Vlk_530_Guy.d:119","Was spricht für das Neue Lager?","Mik az Új Tábor előnyei?","","False","DIA_Guy_AdNC.description","",""
"Scripts/content/Story/MISSIONS/DIA_Vlk_530_Guy.d:132","Was spricht für das Neue Lager?","Mik az Új Tábor előnyei?","","False","DIA_Guy_AdNC_15_00","",""
"Scripts/content/Story/MISSIONS/DIA_Vlk_530_Guy.d:133","Wenn du kein Problem damit hast, wegen einem Stück Brot die Kehle durchgeschnitten zu kriegen, bist du da richtig!","Ha nem érdekel, hogy egy darab kenyérért elvághatják a torkodat, menj csak oda.","","False","DIA_Guy_AdNC_03_01","",""
"Scripts/content/Story/MISSIONS/DIA_Vlk_530_Guy.d:134","Nein - ganz so schlimm ist es nicht. Aber es geht anders zu als hier.","Nem annyira rossz. De különbözik attól ami itt van.","","False","DIA_Guy_AdNC_03_02","",""
"Scripts/content/Story/MISSIONS/DIA_Vlk_530_Guy.d:135","Hier sorgt Gomez dafür, das alles halbwegs ruhig bleibt. Im Neuen Lager gibt es kein Gesetz.","Itt Gomez gondoskodik róla, hogy nagyjából nyugalom legyen. Az Új Táborban, na ott nincsenek törvények.","","False","DIA_Guy_AdNC_03_03","",""
"Scripts/content/Story/MISSIONS/DIA_Vlk_530_Guy.d:136","Die einzigen, die mächtig genug wären, den Laden zu schmeißen, sind die Wassermagier, und die forschen den ganzen Tag an der Barriere herum.","Csak a Vízmágusoknak van elég hatalmuk ott, hogy legyen bármi szavuk a dolgokban, de ők túlságosan elfoglaltak a Kupola tanulmányozásával egész nap.","","False","DIA_Guy_AdNC_03_04","",""
"Scripts/content/Story/MISSIONS/DIA_Vlk_530_Guy.d:148","Warum sollte ich mich der Sekte anschließen?","Miért kellene a szektához csatlakoznom?","","False","DIA_Guy_AdST.description","",""
"Scripts/content/Story/MISSIONS/DIA_Vlk_530_Guy.d:161","Warum sollte ich mich der Sekte anschließen?","Miért kellene a szektához csatlakoznom?","","False","DIA_Guy_AdST_15_00","",""
"Scripts/content/Story/MISSIONS/DIA_Vlk_530_Guy.d:162","Tja, das fragst du am besten einen, der von dort kommt.","Hát, erről jobb ha megkérdezel valakit a Szekta Táborból.","","False","DIA_Guy_AdST_03_01","",""
"Scripts/content/Story/MISSIONS/DIA_Vlk_530_Guy.d:163","Es sind immer einige Novizen im Lager, die können dir sicher 'ne Menge über die Sekte erzählen.","Mindig van egy-két tanonc a táborban, biztos vagyok benne hogy ők többet tudnak mesélni a szektáról.","","False","DIA_Guy_AdST_03_02","",""
"Scripts/content/Story/MISSIONS/DIA_Vlk_530_Guy.d:164","Ich war selbst nie da. Aber nach allem, was man hört, sollen sie sehr großzügig sein.","Jó magam sohase jártam arra. Viszont azok alapján amit mondanak, biztos hogy bőkezűek.","","False","DIA_Guy_AdST_03_03","",""
"Scripts/content/Story/MISSIONS/DIA_Vlk_530_Guy.d:165","Keines der drei Lager scheint so dringend neue Leute zu brauchen wie das der Sekte.","A három tábor közül egyiknek sincs akkora szüksége új emberekre, mint a Szekta Tábornak.","","False","DIA_Guy_AdST_03_04","",""
"Scripts/content/Story/MISSIONS/DIA_Vlk_530_Guy.d:178","Welche von den Hütten kann ich für mich nehmen?","Melyik kunyhó lehet az enyém?","","False","DIA_Guy_MyOwnHut.description","",""
"Scripts/content/Story/MISSIONS/DIA_Vlk_530_Guy.d:191","Welche von den Hütten kann ich für mich nehmen?","Melyik kunyhó lehet az enyém?","","False","DIA_Guy_MyOwnHut_15_00","",""
"Scripts/content/Story/MISSIONS/DIA_Vlk_530_Guy.d:193","Die Hütte da oben mit dem kleinen Vordach ist frei.","Az a kunyhó ott azzal a kis előtetővel üres.","","False","DIA_Guy_MyOwnHut_03_01","",""
"Scripts/content/Story/MISSIONS/DIA_Vlk_534_Buddler.d:34","Warum bist du hier und nicht im Lager?","Miért vagy itt és nem a Táborban?","","False","DIA_Vlk_534_LeaveMe.description","",""
"Scripts/content/Story/MISSIONS/DIA_Vlk_534_Buddler.d:44","Warum bist du hier und nicht im Lager?","Miért vagy itt és nem a Táborban?","","False","DIA_Vlk_534_LeaveMe_15_00","",""
"Scripts/content/Story/MISSIONS/DIA_Vlk_534_Buddler.d:45","Ich warte darauf, dass ein Kumpel von mir aus der Mine kommt. Er schuldet mit noch Erz.","Egy haveromra várok a bányából. Tartozik nekem egy pár érccel.","","False","DIA_Vlk_534_LeaveMe_02_01","",""
"Scripts/content/Story/MISSIONS/DIA_Vlk_534_Buddler.d:46","Ohne das Erz kann ich mich nicht im Lager sehen lassen - sonst kann ich den Gardisten kein Schutzgeld zahlen und dann kann die Sache für einen ziemlich unangenehm werden.","Nem állíthatok be a Táborba érc nélkül - Nem tudnék védelmi pénzt fizetni az őröknek és akkor igen csak nagy bajban lennék.","","False","DIA_Vlk_534_LeaveMe_02_02","",""
"Scripts/content/Story/MISSIONS/DIA_Vlk_536_Kyle.d:48","Wie oft hab' ich euch Pennern gesagt, rennt nicht durch meine Hütte.","Hányszor mondtam már ti anyaszomorítók, hogy ne rohangáljanak keresztül a házamon!","","False","DIA_Kyle_HutRage_10_00","",""
"Scripts/content/Story/MISSIONS/DIA_Vlk_536_Kyle.d:61","Was ist dein Problem?","Neked meg mi a gondod?","","False","DIA_Kyle_Problem.description","",""
"Scripts/content/Story/MISSIONS/DIA_Vlk_536_Kyle.d:71","Was ist dein Problem?","Neked meg mi a gondod?","","False","DIA_Kyle_Problem_15_00","",""
"Scripts/content/Story/MISSIONS/DIA_Vlk_536_Kyle.d:72","Mann, lass mich bloß in Ruhe! Jeder hier hat ein Problem mit mir!","Hagyj békén, ember! Mindenkinek VELEM van gondja!","","False","DIA_Kyle_Problem_10_01","",""
"Scripts/content/Story/MISSIONS/DIA_Vlk_536_Kyle.d:73","Es fing alles damit an, dass ich meine Hütte gebaut hab'.","Minden akkor kezdődött amikor a kunyhóm építettem!","","False","DIA_Kyle_Problem_10_02","",""
"Scripts/content/Story/MISSIONS/DIA_Vlk_536_Kyle.d:74","Bau deine Hütte nicht an den Graben, haben sie gesagt.","Azt mondták, ne építsem olyan közel az árokhoz a házam.","","False","DIA_Kyle_Problem_10_03","",""
"Scripts/content/Story/MISSIONS/DIA_Vlk_536_Kyle.d:75","Aber keiner von den Pennern hat mir gesagt, was passiert, wenn ich es doch tue.","De egyik barom se mondta, hogy mi fog történni, akkor ha mégis megteszem.","","False","DIA_Kyle_Problem_10_04","",""
"Scripts/content/Story/MISSIONS/DIA_Vlk_536_Kyle.d:76","Als ich vor ein paar Tagen aus der Mine wiederkam, hatte ich 'ne zweite Tür.","Aztán mikor pár napja visszatértem a bányából, lett egy másik ajtóm.","","False","DIA_Kyle_Problem_10_05","",""
"Scripts/content/Story/MISSIONS/DIA_Vlk_536_Kyle.d:77","Diese Schweine. Ich hasse sie. Ich kann dir gar nicht sagen, wie ich sie hasse!","Azok a disznók. Utálom őket. El se tudom mondani mennyire utálom őket.","","False","DIA_Kyle_Problem_10_06","",""
"Scripts/content/Story/MISSIONS/DIA_Vlk_536_Kyle.d:78","Jetzt rennt jeder durch meine Hütte. Jeder Arsch.","Most mindenki átjár a házamon. Minden idióta.","","False","DIA_Kyle_Problem_10_07","",""
"Scripts/content/Story/MISSIONS/DIA_Vlk_538_Huno.d:33","Wie's aussieht, beherrschst du dein Handwerk.","Úgy látom értesz a munkádhoz.","","False","DIA_Huno_YouKnowYourJob.description","",""
"Scripts/content/Story/MISSIONS/DIA_Vlk_538_Huno.d:43","Wie's aussieht, beherrschst du dein Handwerk.","Úgy látom értesz a munkádhoz.","","False","DIA_Huno_YouKnowYourJob_15_00","",""
"Scripts/content/Story/MISSIONS/DIA_Vlk_538_Huno.d:44","Bisher hat sich noch niemand beschwert.","Még senki se panaszkodott.","","False","DIA_Huno_YouKnowYourJob_09_01","",""
"Scripts/content/Story/MISSIONS/DIA_Vlk_538_Huno.d:45","Aber das will ich auch keinem raten. Jeder Pisser hier braucht ein Schwert, und das kriegen sie von mir.","De az amúgy is elég rossz ötlet lenne. Minden idiótának szüksége van egy kardra errefelé, és ezt csak tőlem szerezhetik be.","","False","DIA_Huno_YouKnowYourJob_09_02","",""
"Scripts/content/Story/MISSIONS/DIA_Vlk_538_Huno.d:57","Wie lange brauchst du für eine Klinge?","Mennyi ideig tart míg elkészítesz egy pengét?","","False","DIA_Huno_HowLong.description","",""
"Scripts/content/Story/MISSIONS/DIA_Vlk_538_Huno.d:70","Wie lange brauchst du für eine Klinge?","Mennyi ideig tart míg elkészítesz egy pengét?","","False","DIA_Huno_HowLong_15_00","",""
"Scripts/content/Story/MISSIONS/DIA_Vlk_538_Huno.d:71","Kommt drauf an. Ein einfaches Schwert mach' ich dir schneller, als deine müden Augen zuschauen können.","Attól függ. Sima karddal gyors vagyok akár egy hurrikán.","","False","DIA_Huno_HowLong_09_01","",""
"Scripts/content/Story/MISSIONS/DIA_Vlk_538_Huno.d:72","Vorausgesetzt, du motivierst mich mit einer entsprechenden Bezahlung.","Persze van egy feltétel, hogy az ár motiváljon.","","False","DIA_Huno_HowLong_09_02","",""
"Scripts/content/Story/MISSIONS/DIA_Vlk_538_Huno.d:73","So'n Spinner wie der Whistler muss aber meistens länger auf sein Schmuckstück warten.","Egy olyan korcsnak, mint Whistler, általában tovább kell várnia a játékszerére, mint másoknak.","","False","DIA_Huno_HowLong_09_03","",""
