"location","source","target","id","fuzzy","context","translator_comments","developer_comments"
"Scripts/content/Story/MISSIONS/DIA_Bau_903_Rufus.d:125","Ich hab' ihm erklärt, dass ich kaputt bin vom Tag vorher, dass ich mich ausruhen muss und so. Aber er hat mir nicht zugehört.","Mondtam neki, hogy teljesen kimerültem az előző napi munkában és csak egy kis pihenésre van szükségem és semmi több. De nem hallgatott rám.","","","DIA_Rufus_Why_02_05","",""
"Scripts/content/Story/MISSIONS/DIA_Bau_903_Rufus.d:126","Er hat mich am Kragen gepackt und auf die Felder geschleift.","Megragadott a nyakamnál és visszazavart a mezőre.","","","DIA_Rufus_Why_02_06","",""
"Scripts/content/Story/MISSIONS/DIA_Bau_903_Rufus.d:127","Seit dem Tag stand er jeden Morgen vor meiner Tür - irgendwann bin ich dann von alleine gekommen - ich wollte keinen Ärger mit den Typen.","Attól a naptól kezdve, egésznap a küszöböm előtt állt - egészen addig, amíg elkezdtem magam boldogulni. Nem akartam bajba keveredni azokkal a fickókkal.","","","DIA_Rufus_Why_02_07","",""
"Scripts/content/Story/MISSIONS/DIA_Bau_903_Rufus.d:128","Das sind richtige Halsabschneider, mit denen legst du dich besser nicht an.","Igazi seggfejek, jobb lesz, ha messzire elkerülöd őket.","","","DIA_Rufus_Why_02_08","",""
"Scripts/content/Story/MISSIONS/DIA_Bau_903_Rufus.d:143","Wer ist der Reislord?","Kicsoda az a Rizsbáró?","","","DIA_Rufus_Ricelord.description","",""
"Scripts/content/Story/MISSIONS/DIA_Bau_903_Rufus.d:156","Wer ist der Reislord?","Kicsoda az a Rizsbáró?","","","DIA_Rufus_Ricelord_15_00","",""
"Scripts/content/Story/MISSIONS/DIA_Bau_903_Rufus.d:157","Er war einer der Ersten hier. Hat das Lager mit gegründet und die Reisfelder angelegt.","Ő egy volt azok közül, akik elsőként érkeztek ide. Segített felállítani a Tábort és elkezdeni a rizstermesztést.","","","DIA_Rufus_Ricelord_02_01","",""
"Scripts/content/Story/MISSIONS/DIA_Bau_903_Rufus.d:158","Heute steht er nur noch vor seinem Lagerhaus und streckt seine Wampe raus, der alte Fettsack!","Mostanság azonban csak a raktár körül ólálkodik és tágítja a gyomrát, a kövér disznója!","","","DIA_Rufus_Ricelord_02_02","",""
"Scripts/content/Story/MISSIONS/DIA_Bau_912_Jeremiah.d:33","Was machst du hier?","Hogy vagy?","","","DIA_Jeremiah_Hallo.description","",""
"Scripts/content/Story/MISSIONS/DIA_Bau_912_Jeremiah.d:43","Was machst du hier?","Hogy vagy?","","","DIA_Jeremiah_Hallo_15_00","",""
"Scripts/content/Story/MISSIONS/DIA_Bau_912_Jeremiah.d:44","Ich brenne den Reisschnaps, Junge.","Rizspárlatot készítek, fiam.","","","DIA_Jeremiah_Hallo_04_01","",""
"Scripts/content/Story/MISSIONS/DIA_Bau_912_Jeremiah.d:45","Hier - nimm ne Flasche. Aber sag nichts Silas.","Tessék - Itt van egy üveggel. Csak ne áruld el Silasnak.","","","DIA_Jeremiah_Hallo_04_02","",""
"Scripts/content/Story/MISSIONS/DIA_Bau_912_Jeremiah.d:63","Wie läuft das Schnapsbrennergeschäft?","Hogy megy a lepárlás?","","","DIA_Jeremiah_PERM.description","",""
"Scripts/content/Story/MISSIONS/DIA_Bau_912_Jeremiah.d:73","Wie läuft das Schnapsbrennergeschäft?","Hogy megy a lepárlás?","","","DIA_Jeremiah_PERM_15_00","",""
"Scripts/content/Story/MISSIONS/DIA_Bau_912_Jeremiah.d:74","Ich kann kaum soviel nachlegen, wie die Kerle wegsaufen.","Alig tudok lépést tartani ezekkel a fickókkal. Hihetetlen hogy mennyit tudnak inni!","","False","DIA_Jeremiah_PERM_04_01","",""
"Scripts/content/Story/MISSIONS/DIA_Bau_912_Jeremiah.d:75","Ist auch ganz gut so - solange ich hier genug zu tun habe, lassen mich die Jungs vom Reislord in Ruhe.","Ez tényleg nagyon jó dolog. Amíg elfoglalom magam, a Rizsbáró ölebei is békén hagynak.","","","DIA_Jeremiah_PERM_04_02","",""
"Scripts/content/Story/MISSIONS/DIA_Bau_912_Jeremiah.d:89","Was kannst du mir über den Reislord sagen?","Mit tudsz mondani a Rizsbáróról?","","","DIA_Jeremiah_Horatio.description","",""
"Scripts/content/Story/MISSIONS/DIA_Bau_912_Jeremiah.d:102","Was kannst du mir über den Reislord sagen?","Mit tudsz mondani a Rizsbáróról?","","","DIA_Jeremiah_Horatio_15_00","",""
"Scripts/content/Story/MISSIONS/DIA_Bau_912_Jeremiah.d:103","Er ist ein verdammtes Schwein! Seine Schläger suchen sich die Schwachen aus, um sie zur Arbeit auf den Feldern zu zwingen.","Ő egy mocskos disznó! A banditái fogják a gyengéket és arra kényszerítik őket, hogy a földeken dolgozzanak.","","","DIA_Jeremiah_Horatio_04_01","",""
"Scripts/content/Story/MISSIONS/DIA_Bau_912_Jeremiah.d:104","Der einzige, der sich wehren könnte ist Horatio. Aber der hat mit Gewalt nichts am Hut.","Az egyetlen, aki szembe mer szállni vele Horatio. De ő nem egy erőszakos ember.","","","DIA_Jeremiah_Horatio_04_02","",""
"Scripts/content/Story/MISSIONS/DIA_Bau_912_Jeremiah.d:105","Ich hab' mal gehört, wie er gesagt hat, er würde dem Reislord gerne den Schädel einschlagen, aber das würde er nie tun.","Egyszer hallottam tőle, hogy szívesen fejét venné a Rizsbárónak, de valójában sohasem próbálta meg.","","","DIA_Jeremiah_Horatio_04_03","",""
"Scripts/content/Story/MISSIONS/DIA_Bau_912_Jeremiah.d:106","Seine Überzeugung hält ihn davon ab.","Szívesen ellenszegülnék az elveinek.","","","DIA_Jeremiah_Horatio_04_04","",""
"Scripts/content/Story/MISSIONS/DIA_Bau_935_Homer.d:33","Hältst du nach irgendwas Ausschau?","Keresel valamit?","","","DIA_Homer_Hello.description","",""
"Scripts/content/Story/MISSIONS/DIA_Bau_935_Homer.d:43","Hältst du nach irgendwas Ausschau?","Keresel valamit?","","","DIA_Homer_Hello_15_00","",""
"Scripts/content/Story/MISSIONS/DIA_Bau_935_Homer.d:44","Ich suche undichte Stellen im Damm. Ich habe den Verdacht, dass ein Lurker am Fundament des Damms nagt.","Repedéseket keresek a gáton. Észrevettem, hogy egy Lopakodó rágcsálja az alapzatot.","","","DIA_Homer_Hello_02_01","",""
"Scripts/content/Story/MISSIONS/DIA_Bau_935_Homer.d:45","Das Vieh wetzt seine Zähne und Krallen an den Steinen und Holzbalken unter Wasser.","Az a bestia a víz alatti köveken és tartó gerendákon élesíti a körmeit és a fogait.","","","DIA_Homer_Hello_02_02","",""
"Scripts/content/Story/MISSIONS/DIA_Bau_935_Homer.d:46","Auf diese Weise ist bald der gesamte Damm untergraben.","Ha ez így folytatódik, hamarosan az egész gátat aláássa.","","","DIA_Homer_Hello_02_03","",""
"Scripts/content/Story/MISSIONS/DIA_Bau_935_Homer.d:58","Hast DU den Damm gebaut?","TE építetted a gátat?","","","DIA_Homer_BuiltDam.description","",""
"Scripts/content/Story/MISSIONS/DIA_Bau_935_Homer.d:71","Hast DU den Damm gebaut?","TE építetted a gátat?","","","DIA_Homer_BuiltDam_15_00","",""
"Scripts/content/Story/MISSIONS/DIA_Bau_935_Homer.d:72","Ja. Als wir damals das neue Lager gegründet haben, habe ich den Damm errichtet.","Igen. Én építettem a gátat még akkor, amikor az Új Tábort megalapítottuk.","","","DIA_Homer_BuiltDam_02_01","",""
"Scripts/content/Story/MISSIONS/DIA_Bau_935_Homer.d:73","Natürlich haben alle mitgeholfen, aber ich war der Baumeister.","Persze mindenki segített, de én voltam a főépítész.","","","DIA_Homer_BuiltDam_02_02","",""
"Scripts/content/Story/MISSIONS/DIA_Bau_935_Homer.d:87","Kann ich dir helfen?","Van valami amiben segíteni tudnék?","","","DIA_Homer_WannaHelp.description","",""
"Scripts/content/Story/MISSIONS/DIA_Bau_935_Homer.d:100","Kann ich dir helfen?","Van valami amiben segíteni tudnék?","","","DIA_Homer_WannaHelp_15_00","",""
"Scripts/content/Story/MISSIONS/DIA_Bau_935_Homer.d:101","Klar, halt das Vieh davon ab, weiter an meinem Damm rumzunagen.","Persze, állítsd le azt a bestiát, hogy ne piszkálhassa a gátamat.","","","DIA_Homer_WannaHelp_02_01","",""
"Scripts/content/Story/MISSIONS/DIA_Bau_935_Homer.d:119","Wo finde ich das Biest?","Holt találom a vadat?","","","DIA_Homer_Running.description","",""
"Scripts/content/Story/MISSIONS/DIA_Bau_935_Homer.d:132","Wo finde ich das Biest?","Holt találom a vadat?","","","DIA_Homer_Running_15_00","",""
"Scripts/content/Story/MISSIONS/DIA_Bau_935_Homer.d:133","Ich würde auf der anderen Seite des Sees suchen. Keiner von den Leuten hier geht da hin. Wahrscheinlich hat es da seine Höhle.","Én a tó másik oldalán próbálnék rábukkanni. Senki sem jár arra. Valahol ott lehet a verme.","","","DIA_Homer_Running_02_01","",""
"Scripts/content/Story/MISSIONS/DIA_Bau_935_Homer.d:148","Ich hab' das Biest erledigt!","Megöltem a vadat!","","","DIA_Homer_Success.description","",""
"Scripts/content/Story/MISSIONS/DIA_Bau_935_Homer.d:166","Ich hab' das Biest erledigt!","Megöltem a vadat!","","","DIA_Homer_Success_15_00","",""
"Scripts/content/Story/MISSIONS/DIA_Bau_935_Homer.d:167","Gut! Ich habe schon zusammen mit einigen von Reislords Leuten die Schäden behoben, die es bisher angerichtet hat.","Nagyszerű! Szerzek pár embert a Rizsbárótól, hogy segítsenek helyrehozni a károkat, amit eddig okozott.","","","DIA_Homer_Success_02_01","",""
"Scripts/content/Story/MISSIONS/DIA_Bau_935_Homer.d:168","Jetzt kann ich mich endlich mal wieder in Ruhe schlafen legen.","Most már végre nyugodtan aludhatok.","","","DIA_Homer_Success_02_02","",""
"Scripts/content/Story/MISSIONS/DIA_Bau_935_Homer.d:189","Alles klar beim Damm?","Minden rendben a gáttal?","","","DIA_Homer_PERM.description","",""
"Scripts/content/Story/MISSIONS/DIA_Bau_935_Homer.d:202","Alles klar beim Damm?","Minden rendben a gáttal?","","","DIA_Homer_PERM_15_00","",""
"Scripts/content/Story/MISSIONS/DIA_Bau_935_Homer.d:203","Steht wie 'ne Festung, den kriegt so schnell nichts klein.","Olyan erős most már, mint egy erőd. Semmi nem árthat neki.","","","DIA_Homer_PERM_02_01","",""
