"location","source","target","id","fuzzy","context","translator_comments","developer_comments"
"Scripts/content/Story/MISSIONS/DIA_Bau_900_Ricelord.d:33","Du kümmerst dich um die Reisfelder, richtig?","Te gondoskodsz a rizsföldekről, nem igaz?","","False","DIA_Ricelord_Hello.description","",""
"Scripts/content/Story/MISSIONS/DIA_Bau_900_Ricelord.d:43","Du kümmerst dich um die Reisfelder, richtig?","Te gondoskodsz a rizsföldekről, nem igaz?","","False","DIA_Ricelord_Hello_15_00","",""
"Scripts/content/Story/MISSIONS/DIA_Bau_900_Ricelord.d:44","Warum? Suchst du Arbeit?","Miért? Munkát keresel?","","False","DIA_Ricelord_Hello_12_01","",""
"Scripts/content/Story/MISSIONS/DIA_Bau_900_Ricelord.d:56","Hast du Arbeit für mich?","Van számomra munkád?","","False","DIA_Ricelord_Arbeit.description","",""
"Scripts/content/Story/MISSIONS/DIA_Bau_900_Ricelord.d:71","Hast du Arbeit für mich?","Van számomra munkád?","","False","DIA_Ricelord_Arbeit_15_00","",""
"Scripts/content/Story/MISSIONS/DIA_Bau_900_Ricelord.d:72","Geh zu Lefty. Er ist meistens hier vorne rechts neben der Scheune.","Menj és beszélj Lefty-vel. Általában a fészer jobb oldalánál szokott tartózkodni.","","False","DIA_Ricelord_Arbeit_12_01","",""
"Scripts/content/Story/MISSIONS/DIA_Bau_900_Ricelord.d:86","Wir könnten handeln...","Üzletelhetünk...","","False","DIA_Ricelord_TRADE.description","",""
"Scripts/content/Story/MISSIONS/DIA_Bau_900_Ricelord.d:99","Wir könnten handeln ...","Üzletelhetünk...","","False","DIA_Ricelord_TRADE_15_00","",""
"Scripts/content/Story/MISSIONS/DIA_Bau_900_Ricelord.d:100","Was hast du denn zu bieten?","Mit kínálsz?","","False","DIA_Ricelord_TRADE_12_01","",""
"Scripts/content/Story/MISSIONS/DIA_Bau_900_Ricelord.d:113","Lefty schickt mich.","Lefty küldött.","","False","DIA_Ricelord_LeftySentMe.description","",""
"Scripts/content/Story/MISSIONS/DIA_Bau_900_Ricelord.d:129","Lefty schickt mich.","Lefty küldött.","","False","DIA_Ricelord_LeftySentMe_15_00","",""
"Scripts/content/Story/MISSIONS/DIA_Bau_900_Ricelord.d:130","Ach so. Was hat er gesagt?","Ó igazán. Mit mondott?","","False","DIA_Ricelord_LeftySentMe_12_01","",""
"Scripts/content/Story/MISSIONS/DIA_Bau_900_Ricelord.d:144","Ich soll den Bauern Wasser bringen.","A parasztoknak kell vizet vinnem.","","False","DIA_Ricelord_GetWater.description","",""
"Scripts/content/Story/MISSIONS/DIA_Bau_900_Ricelord.d:157","Ich soll den Bauern Wasser bringen.","A parasztoknak kell vizet vinnem.","","False","DIA_Ricelord_GetWater_15_00","",""
"Scripts/content/Story/MISSIONS/DIA_Bau_900_Ricelord.d:161","Gut. Hier sind ein Dutzend Flaschen Wasser.","Helyes. Itt van egy tucat vizes üveg.","","False","DIA_Ricelord_GetWater_12_01","",""
"Scripts/content/Story/MISSIONS/DIA_Bau_900_Ricelord.d:162","Es gibt etwa doppelt so viele Bauern, also verteil sie gleichmäßig.","Körülbelül kétszer ennyi paraszt van, szóval igazságosan oszd el közöttük.","","False","DIA_Ricelord_GetWater_12_02","",""
"Scripts/content/Story/MISSIONS/DIA_Bau_900_Ricelord.d:174","Das war gestern, Bursche! Geh besser zu ihm. Er hat dir was zu sagen.","Az tegnap volt, fiú! Jobb lenne, ha megkeresnéd. Mondani valója van neked.","","","DIA_Ricelord_GetWater_TooLate_12_00","",""
"Scripts/content/Story/MISSIONS/DIA_Bau_900_Ricelord.d:179","Das war vor einigen Tagen, Bursche! Geh besser zu ihm. Er hat dir was zu sagen.","Az jó pár napja volt, kölyök! Jobb lenne, ha megkeresnéd. Mondanivalója van neked..","","","DIA_Ricelord_GetWater_TooLate_12_01","",""
"Scripts/content/Story/MISSIONS/DIA_Bau_901_Horatio.d:34","Lefty schickt mich. Ich hab' Wasser für dich.","Lefty küldött. Hoztam egy kis vizet.","","","Info_Horatio_Wasser.description","",""
"Scripts/content/Story/MISSIONS/DIA_Bau_901_Horatio.d:48","Lefty schickt mich. Ich hab' Wasser für dich.","Lefty küldött. Hoztam egy kis vizet.","","","Info_Horatio_Wasser_15_00","",""
"Scripts/content/Story/MISSIONS/DIA_Bau_901_Horatio.d:51","Danke, Mann! Ich war schon kurz davor, den Schlamm zu saufen.","Köszönöm, ember! Már majdnem a sarat kezdtem el inni.","","","Info_Horatio_Wasser_09_01","",""
"Scripts/content/Story/MISSIONS/DIA_Bau_901_Horatio.d:70","Du hast nichts mehr. Ich hol mir von den anderen was.","Elkéstél. Majd kapok a többiektől.","","","Info_Horatio_Wasser_NOWATER_09_00","",""
"Scripts/content/Story/MISSIONS/DIA_Bau_901_Horatio.d:97","Was machst du hier? Willst du Ärger haben?","Mit keresel itt? Bajba akarsz kerülni?","","","DIA_Horatio_Hello_09_00","",""
"Scripts/content/Story/MISSIONS/DIA_Bau_901_Horatio.d:100","Ärger? Von wem? Von einem Bauern?","Baj? Kivel? Egy paraszt?","","","DIA_Horatio_Hello.DIA_Horatio_Hello_PissOff","Info_AddChoice",""
"Scripts/content/Story/MISSIONS/DIA_Bau_901_Horatio.d:101","Entspann dich! Ich bin neu hier.","Hé, nyugi! Én új vagyok itt.","","","DIA_Horatio_Hello.DIA_Horatio_Hello_BeCool","Info_AddChoice",""
"Scripts/content/Story/MISSIONS/DIA_Bau_901_Horatio.d:106","Entspann dich! Ich bin neu hier.","Hé, nyugi! Én új vagyok itt.","","","DIA_Horatio_Hello_BeCool_15_00","",""
"Scripts/content/Story/MISSIONS/DIA_Bau_901_Horatio.d:107","Hm ... siehst mir ganz in Ordnung aus - hier weiß man nie. Da kommt jeden Tag ein neuer Mistkerl, der's wissen will.","Hú... Megfelelő vagy. Sohasem lehet tudni. Minden nap új srácok jelennek meg, s azt gondolják Ők azok.","","","DIA_Horatio_Hello_BeCool_09_01","",""
"Scripts/content/Story/MISSIONS/DIA_Bau_901_Horatio.d:113","Ärger? Von wem? Von einem Bauern?","Baj? Kivel? Egy paraszt?","","","DIA_Horatio_Hello_PissOff_15_00","",""
"Scripts/content/Story/MISSIONS/DIA_Bau_901_Horatio.d:114","Nur weil ich auf den Feldern arbeite, heißt das nicht, dass ich mich nicht gegen Typen wie dich wehren kann.","Csak azért, mert a földön dolgozom, ne gondold azt hogy nem tudom megvédeni magam az olyanoktól mint te.","","","DIA_Horatio_Hello_PissOff_09_01","",""
"Scripts/content/Story/MISSIONS/DIA_Bau_901_Horatio.d:115","Also komm nur her, wenn du Ärger willst!","Csak gyere ide, ha valami gond van!","","","DIA_Horatio_Hello_PissOff_09_02","",""
"Scripts/content/Story/MISSIONS/DIA_Bau_901_Horatio.d:132","Tut mir leid, der Spruch mit dem Bauern.","Elnézést, én azt mondtam mit csináljak a parasztokkal.","","","DIA_Horatio_SORRY.description","",""
"Scripts/content/Story/MISSIONS/DIA_Bau_901_Horatio.d:145","Tut mir Leid, der Spruch mit dem Bauern.","Elnézést, én azt mondtam mit csináljak a parasztokkal.","","","DIA_Horatio_SORRY_15_00","",""
"Scripts/content/Story/MISSIONS/DIA_Bau_901_Horatio.d:146","Das hättest du dir eher überlegen sollen, Junge!","Előbb kellett volna ezen elgondolkoznod, fiú!","","","DIA_Horatio_SORRY_09_01","",""
"Scripts/content/Story/MISSIONS/DIA_Bau_901_Horatio.d:158","Was macht ein Kerl wie du bei den Bauern?","Az olyan ember mint te mit tudok csinálni a parasztokkal?","","","DIA_Horatio_Story.description","",""
"Scripts/content/Story/MISSIONS/DIA_Bau_901_Horatio.d:171","Was macht ein Kerl wie du bei den Bauern?","Az olyan ember mint te mit tudok csinálni a parasztokkal?","","","DIA_Horatio_Story_15_00","",""
"Scripts/content/Story/MISSIONS/DIA_Bau_901_Horatio.d:172","Das hat Lee mich auch gefragt, aber ich kämpfe nicht mehr - außer um mich zu verteidigen.","Lee kért meg rá. Nem harcolok többet - kivéve, ha meg kell védenem magam.","","","DIA_Horatio_Story_09_01","",""
"Scripts/content/Story/MISSIONS/DIA_Bau_901_Horatio.d:173","Ich habe einmal getötet, das war einmal zu viel. Deswegen haben sie mich in diese gottverdammte Kolonie geworfen - und das war nur gerecht.","Megöltem egy embert, és ez már sok volt. Ezért dobtak be ebbe az átkozott kolóniába - ez volt az ítélet.","","","DIA_Horatio_Story_09_02","",""
"Scripts/content/Story/MISSIONS/DIA_Bau_901_Horatio.d:174","Was ist passiert?","Hogyan történt?","","","DIA_Horatio_Story_15_03","",""
"Scripts/content/Story/MISSIONS/DIA_Bau_901_Horatio.d:175","Es war ein einfacher Streit in einer Kneipe. Ich wollte den Mann nicht töten, aber ich habe zu stark zugeschlagen.","Csak egy szokványos kocsmai verekedés volt. Nem akartam megölni a fickót, biztosan csak túl erősen ütöttem meg.","","","DIA_Horatio_Story_09_04","",""
"Scripts/content/Story/MISSIONS/DIA_Bau_901_Horatio.d:176","Ich habe damals als Schmied gearbeitet. Ich konnte meine Kraft nicht kontrollieren ...","Kovácsként dolgoztam akkoriban. Nem voltam tisztában az erőmmel...","","","DIA_Horatio_Story_09_05","",""
"Scripts/content/Story/MISSIONS/DIA_Bau_901_Horatio.d:188","Warum bist du ausgerechnet in DIESES Lager gegangen?","Miért csatlakoztál EHHEZ a Táborhoz?","","","DIA_Horatio_WhyHere.description","",""
"Scripts/content/Story/MISSIONS/DIA_Bau_901_Horatio.d:201","Warum bist du ausgerechnet in DIESES Lager gegangen?","Miért csatlakoztál EHHEZ a Táborhoz?","","","DIA_Horatio_WhyHere_15_00","",""
"Scripts/content/Story/MISSIONS/DIA_Bau_901_Horatio.d:202","Das will ich dir sagen: Die einzig andere Wahl wären die Sektenspinner gewesen, aber ich habe keine Lust, mir von den Gurus den Kopf waschen zu lassen.","Elmondom neked: az egyedüli lehetőségem az volt hogy csatlakozom a szektásokhoz, de nem akartam hogy azok a Guruk piszkálják az agyamat.","","","DIA_Horatio_WhyHere_09_01","",""
"Scripts/content/Story/MISSIONS/DIA_Bau_901_Horatio.d:203","Im Alten Lager hätte ich keine Ruhe vor den Gardisten gehabt, aber die Söldner und Banditen haben Respekt.","A Régi Táborban, az őröknek túl sok problémája volt velem, de a zsoldosok és a zsiványok tisztelnek.","","","DIA_Horatio_WhyHere_09_02","",""
"Scripts/content/Story/MISSIONS/DIA_Bau_901_Horatio.d:204","Sie fürchten dich ...","Félnek tőled...","","","DIA_Horatio_WhyHere_15_03","",""
"Scripts/content/Story/MISSIONS/DIA_Bau_901_Horatio.d:205","Kann schon sein. Immerhin habe ICH hier meinen Frieden gefunden. Und das solltest du auch versuchen.","Lehet. Mellesleg békét találtam itt, neked is meg kellene próbálnod.","","","DIA_Horatio_WhyHere_09_04","",""
"Scripts/content/Story/MISSIONS/DIA_Bau_901_Horatio.d:219","Kannst du mir beibringen, auch so stark zuzuschlagen?","Meg tudod tanítani, hogyan legyek olyan erős mint te?","","","DIA_Horatio_PleaseTeachSTR.description","",""
"Scripts/content/Story/MISSIONS/DIA_Bau_901_Horatio.d:232","Kannst du mir beibringen, auch so stark zuzuschlagen?","Meg tudod tanítani, hogyan legyek olyan erős mint te?","","","DIA_Horatio_PleaseTeachSTR_15_00","",""
"Scripts/content/Story/MISSIONS/DIA_Bau_901_Horatio.d:233","Selbst wenn - zu WAS würde jemand wie du seine Stärke einsetzen?","Ha tudnék is segíteni - MIRE akarnád használni az erődet?","","","DIA_Horatio_PleaseTeachSTR_09_01","",""
"Scripts/content/Story/MISSIONS/DIA_Bau_901_Horatio.d:238","Damit ich Reislord und seine Schläger fertigmachen kann!","Megfizetek a Rizsbárónak és a banditáinak!","","","DIA_Horatio_PleaseTeachSTR.DIA_Horatio_PleaseTeachSTR_Ricelord","Info_AddChoice",""
"Scripts/content/Story/MISSIONS/DIA_Bau_901_Horatio.d:242","Gute Frage. Ich werde darüber nachdenken...","Jó kérdés. Gondolkodni fogok rajta...","","","DIA_Horatio_PleaseTeachSTR.DIA_Horatio_PleaseTeachSTR_BACK","Info_AddChoice",""
"Scripts/content/Story/MISSIONS/DIA_Bau_901_Horatio.d:245","Zur Selbstverteidigung!","Önvédelem!","","","DIA_Horatio_PleaseTeachSTR.DIA_Horatio_PleaseTeachSTR_Defend","Info_AddChoice",""
"Scripts/content/Story/MISSIONS/DIA_Bau_901_Horatio.d:246","Um den Mistkerlen hier zu zeigen, wie man mit mir zu sprechen hat!","Tanítsd meg a fattyúkat, hogyan kell velem illően beszélni!","","","DIA_Horatio_PleaseTeachSTR.DIA_Horatio_PleaseTeachSTR_Attack","Info_AddChoice",""
"Scripts/content/Story/MISSIONS/DIA_Bau_901_Horatio.d:255","Um den Mistkerlen hier zu zeigen, wie man mit mir zu sprechen hat!","Tanítsd meg a fattyúkat, hogyan kell velem illően beszélni!","","","DIA_Horatio_PleaseTeachSTR_Attack_15_00","",""
"Scripts/content/Story/MISSIONS/DIA_Bau_901_Horatio.d:256","Und bevor du dich versiehst, bist du nur ein weiterer Mistkerl mehr ... Nein! Dafür werde ich dir nichts beibringen.","És mielőtt feleszmélsz, máris azok közé a szemetek közé tartozol te is... Nem, uram, nem foglak tanítani.","","","DIA_Horatio_PleaseTeachSTR_Attack_09_01","",""
"Scripts/content/Story/MISSIONS/DIA_Bau_901_Horatio.d:262","Zur Selbstverteidigung!","Önvédelem!","","","DIA_Horatio_PleaseTeachSTR_Defend_15_00","",""
"Scripts/content/Story/MISSIONS/DIA_Bau_901_Horatio.d:263","Dazu musst du nur schnell sein und nicht stark. Glaubst du, dass Schädel spalten besser ist als seinen Frieden zu finden?","Ahhoz gyorsan kell lenned, nem erősnek. Azt hiszed a harc jobb mint a béke megtalálása?","","","DIA_Horatio_PleaseTeachSTR_Defend_09_01","",""
"Scripts/content/Story/MISSIONS/DIA_Bau_901_Horatio.d:268","Gute Frage. Ich werde drüber nachdenken ...","Jó kérdés. Gondolkodni fogok rajta...","","","DIA_Horatio_PleaseTeachSTR_BACK_15_00","",""
"Scripts/content/Story/MISSIONS/DIA_Bau_901_Horatio.d:274","Damit ich den Reislord und seine Schläger fertig machen kann!","Megfizetek a Rizsbárónak és a banditáinak!","","","DIA_Horatio_PleaseTeachSTR_Ricelord_15_00","",""
"Scripts/content/Story/MISSIONS/DIA_Bau_901_Horatio.d:275","Hmm ... Du bist nicht der Erste, der das versucht.","Hmm... Nem te lennél az első, aki megpróbálja.","","","DIA_Horatio_PleaseTeachSTR_Ricelord_09_01","",""
"Scripts/content/Story/MISSIONS/DIA_Bau_901_Horatio.d:290","Ich hab' nochmal über die Sache nachgedacht...","Át fogom gondolni az egészet...","","","DIA_Horatio_ThoughtSTR.description","",""
"Scripts/content/Story/MISSIONS/DIA_Bau_901_Horatio.d:303","Ich hab' noch einmal über die Sache nachgedacht ...","Át fogom gondolni az egészet...","","","DIA_Horatio_ThoughtSTR_15_00","",""
"Scripts/content/Story/MISSIONS/DIA_Bau_901_Horatio.d:304","Und? Ist dir was Besseres eingefallen?","És? Tudsz valami jobbat?","","","DIA_Horatio_ThoughtSTR_09_01","",""
"Scripts/content/Story/MISSIONS/DIA_Bau_901_Horatio.d:307","Nein.","Nem.","","","DIA_Horatio_ThoughtSTR.DIA_Horatio_ThoughtSTR_NoIdea","Info_AddChoice",""
"Scripts/content/Story/MISSIONS/DIA_Bau_901_Horatio.d:312","Ja. Ich will es mit Ricelord und seinen Schlägern aufnehmen können!","Igen. Meg tudom tenni a Rizsbáróval és a banditáival!","","","DIA_Horatio_ThoughtSTR.DIA_Horatio_ThoughtSTR_Ricelord","Info_AddChoice",""
"Scripts/content/Story/MISSIONS/DIA_Bau_901_Horatio.d:318","Nein.","Nem.","","","DIA_Horatio_ThoughtSTR_NoIdea_15_00","",""
"Scripts/content/Story/MISSIONS/DIA_Bau_901_Horatio.d:319","Dachte ich mir.","Gondoltam.","","","DIA_Horatio_ThoughtSTR_NoIdea_09_01","",""
"Scripts/content/Story/MISSIONS/DIA_Bau_901_Horatio.d:325","Ja. Ich will es mit dem Reislord und seinen Schlägern aufnehmen können!","Igen. Meg tudom tenni a Rizsbáróval és a banditáival!","","","DIA_Horatio_ThoughtSTR_Ricelord_15_00","",""
"Scripts/content/Story/MISSIONS/DIA_Bau_901_Horatio.d:326","Hmm ... Du bist nicht der Erste, der das versucht.","Hmm... Nem te próbálkoznál először.","","","DIA_Horatio_ThoughtSTR_Ricelord_09_01","",""
"Scripts/content/Story/MISSIONS/DIA_Bau_901_Horatio.d:349","Wenn du stark zuschlagen willst, kommt es auf die richtige Technik an. Das ist das Erste, was du beim Schmieden lernst.","Ha erőteljes csapást akarsz bevinni, ismerned kell a megfelelő taktikát. Ez az első amit meg kell tanulnod kovácsként.","","","DIA_Horatio_HelpSTR_LEARN_NOW_09_00","",""
"Scripts/content/Story/MISSIONS/DIA_Bau_901_Horatio.d:350","Lerne jeden Teil deines Arms, von der Schulter bis zum Handgelenk, gleichzeitig nach vorne schnellen zu lassen.","Megtanulni a legnagyobb erő kifejtését, a válladon és a kezeden keresztül.","","","DIA_Horatio_HelpSTR_LEARN_NOW_09_01","",""
"Scripts/content/Story/MISSIONS/DIA_Bau_901_Horatio.d:351","Je besser die Technik, umso härter der Schlag. Du wirst es schnell raushaben.","Minél jobban megy ez, annál nagyobbat csapsz. Hamar ráérzel a lényegre.","","","DIA_Horatio_HelpSTR_LEARN_NOW_09_02","",""
"Scripts/content/Story/MISSIONS/DIA_Bau_901_Horatio.d:361","Ich WERDE den Reislord fertig machen - wenn du mir dabei hilfst!","Én LEGYŐZÖM a Rizsbárót és a banditáit - ha segítesz nekem!","","","DIA_Horatio_HelpSTR.description","",""
"Scripts/content/Story/MISSIONS/DIA_Bau_901_Horatio.d:374","Ich WERDE den Reislord und seine Schläger fertig machen - wenn du mir dabei hilfst!","Én LEGYŐZÖM a Rizsbárót és a banditáit - ha segítesz nekem!","","","DIA_Horatio_HelpSTR_15_00","",""
"Scripts/content/Story/MISSIONS/DIA_Bau_901_Horatio.d:375","Gut! Ich habe geschworen, nie wieder jemanden anzugreifen, aber NICHT, es niemandem beizubringen.","Remek! Megesküdtem, hogy nem harcolok soha többet, de azt sohasem mondtam hogy nem is tanítok rá másokat.","","","DIA_Horatio_HelpSTR_09_01","",""
"Scripts/content/Story/MISSIONS/DIA_Bau_901_Horatio.d:376","Ich bin ganz Ohr!","Csupa fül vagyok!","","","DIA_Horatio_HelpSTR_15_02","",""
"Scripts/content/Story/MISSIONS/DIA_Bau_901_Horatio.d:393","Danke für deine Hilfe!","Köszönöm a segítséged!","","","DIA_Horatio_Thanks.description","",""
"Scripts/content/Story/MISSIONS/DIA_Bau_901_Horatio.d:406","Danke für deine Hilfe!","Köszönöm a segítséged!","","","DIA_Horatio_Thanks_15_00","",""
"Scripts/content/Story/MISSIONS/DIA_Bau_901_Horatio.d:407","Nutze dein Wissen für die gerechte Sache! Und NUR DAFÜR.","Használd a tudásodat egy igaz ügyért és SEMMI MÁSÉRT.","","","DIA_Horatio_Thanks_09_01","",""
"Scripts/content/Story/MISSIONS/DIA_Bau_902_Pock.d:37","Lefty schickt mich. Ich hab' Wasser für dich.","Lefty küldött. Hoztam egy kis vizet.","","","Info_Pock_Wasser.description","",""
"Scripts/content/Story/MISSIONS/DIA_Bau_902_Pock.d:51","Lefty schickt mich. Ich hab' Wasser für dich.","Lefty küldött. Hoztam egy kis vizet.","","","Info_Pock_Wasser_15_00","",""
"Scripts/content/Story/MISSIONS/DIA_Bau_902_Pock.d:62","Danke, Junge! Das hab' ich gebraucht!","Köszönöm, fiú! Szükségem volt rá!","","","Info_Pock_Wasser_04_01","",""
"Scripts/content/Story/MISSIONS/DIA_Bau_902_Pock.d:73","Aber du hast nichts mehr. Ist schon gut, Junge. Ich werd mich an die andern halten.","De neked már nincs több. Nem baj, fiú. Megkérdezem a többieket.","","","Info_Pock_Wasser_NOWATER_04_00","",""
"Scripts/content/Story/MISSIONS/DIA_Bau_902_Pock.d:86","Hi! Ich bin neu hier.","Hi! Új vagyok itt.","","","DIA_Pock_Hello.description","",""
"Scripts/content/Story/MISSIONS/DIA_Bau_902_Pock.d:99","Hi! Ich bin neu hier.","Hi! Új vagyok itt.","","","DIA_Pock_Hello_15_00","",""
"Scripts/content/Story/MISSIONS/DIA_Bau_902_Pock.d:100","Schön mal wieder ein neues Gesicht zu sehen.","Jó új arcokat látni.","","","DIA_Pock_Hello_04_01","",""
"Scripts/content/Story/MISSIONS/DIA_Bau_902_Pock.d:101","Du bist schon lange in der Kolonie, hm?","Biztosan régóta vagy itt, hm?","","","DIA_Pock_Hello_15_02","",""
"Scripts/content/Story/MISSIONS/DIA_Bau_902_Pock.d:102","Stimmt genau, Junge. Ich war einer der Ersten.","Teljesen igaz, fiú. A legjobbak közt voltam.","","","DIA_Pock_Hello_04_03","",""
"Scripts/content/Story/MISSIONS/DIA_Bau_902_Pock.d:114","Dann weißt du bestimmt ne Menge über all das hier?","Ebben az ügyben muszáj többet tudnod erről a helyről?","","","DIA_Pock_KnowMuch.description","",""
"Scripts/content/Story/MISSIONS/DIA_Bau_902_Pock.d:127","Dann weißt du bestimmt ne Menge über all das hier?","Ebben az ügyben muszáj többet tudnod erről a helyről?","","","DIA_Pock_KnowMuch_15_00","",""
"Scripts/content/Story/MISSIONS/DIA_Bau_902_Pock.d:128","Tja wie man's nimmt, die meiste Zeit verbringe ich hier beim Reispflücken.","Az időm nagy részében kint vagyok és rizst szedek.","","","DIA_Pock_KnowMuch_04_01","",""
"Scripts/content/Story/MISSIONS/DIA_Bau_902_Pock.d:129","Nur dadurch bin ich so alt geworden. Wir bekommen etwas Reis ab und vielleicht mal Schnaps, nicht viel, aber es reicht.","Ez az, ami megöregített. Kapunk egy kis rizst és egy kis pálinkát. Nem sok, de elég.","","","DIA_Pock_KnowMuch_04_02","",""
"Scripts/content/Story/MISSIONS/DIA_Bau_902_Pock.d:141","Weshalb bist du hier?","Miért vagy itt?","","","DIA_Pock_WhyJail.description","",""
"Scripts/content/Story/MISSIONS/DIA_Bau_902_Pock.d:154","Weshalb bist du hier?","Miért vagy itt?","","","DIA_Pock_WhyJail_15_00","",""
"Scripts/content/Story/MISSIONS/DIA_Bau_902_Pock.d:155","Die Steuern, mein Junge, die Steuern. Meine Scheune war so leer wie mein Bauch, da konnte ich nicht mehr zahlen.","Adók, fiam, adók. Olyan üres volt a pajtám, mint a gyomrom és egyszerűen nem tudtam fizetni.","","","DIA_Pock_WhyJail_04_01","",""
"Scripts/content/Story/MISSIONS/DIA_Bau_902_Pock.d:156","Irgendwann kamen die Soldaten und brachten mich her. Aber hier ist es nicht schlechter als draußen. Ich werde wenigstens nicht vor Hunger sterben.","Aztán egy nap jöttek a katonák és ide hoztak. De itt nem olyan rossz mint odakint. Legalább itt nem éhezem.","","","DIA_Pock_WhyJail_04_02","",""
"Scripts/content/Story/MISSIONS/DIA_Bau_902_Pock.d:157","Hab immer meine Steuern gezahlt - jahrelang. Aber das hat dem Hurensohn mit der Krone nicht gereicht!","Mindig befizettem az adót - egész életemben. De ez nem volt elég annak a koronás fattyúnak!","","","DIA_Pock_WhyJail_04_03","",""
"Scripts/content/Story/MISSIONS/DIA_Bau_902_Pock.d:170","Alles klar bei dir?","Minden rendben van?","","","DIA_Pock_ForgotAll.description","",""
"Scripts/content/Story/MISSIONS/DIA_Bau_902_Pock.d:183","Alles klar bei dir?","Minden rendben van?","","","DIA_Pock_ForgotAll_15_00","",""
"Scripts/content/Story/MISSIONS/DIA_Bau_902_Pock.d:184","Schön mal wieder ein neues Gesicht zu sehen.","Jó új arcokat látni.","","","DIA_Pock_ForgotAll_04_01","",""
"Scripts/content/Story/MISSIONS/DIA_Bau_902_Pock.d:185","Moment mal! Wir hatten uns schon unterhalten.","Várj csak! Mi korábban beszélgettünk.","","","DIA_Pock_ForgotAll_15_02","",""
"Scripts/content/Story/MISSIONS/DIA_Bau_902_Pock.d:186","Nein! Nein, das ist ausgeschlossen. Dich hab' ich hier noch nie gesehen.","Nem! Nem, az lehetetlen. Soha életemben nem láttalak.","","","DIA_Pock_ForgotAll_04_03","",""
"Scripts/content/Story/MISSIONS/DIA_Bau_902_Pock.d:187","Natürlich ...","Biztos...","","","DIA_Pock_ForgotAll_15_04","",""
"Scripts/content/Story/MISSIONS/DIA_Bau_903_Rufus.d:34","Lefty schickt mich. Ich hab' Wasser für dich.","Lefty küldött. Hoztam egy kis vizet.","","","Info_Rufus_Wasser.description","",""
"Scripts/content/Story/MISSIONS/DIA_Bau_903_Rufus.d:48","Lefty schickt mich. Ich hab' Wasser für dich.","Lefty küldött. Hoztam egy kis vizet.","","","Info_Rufus_Wasser_15_00","",""
"Scripts/content/Story/MISSIONS/DIA_Bau_903_Rufus.d:51","Danke, Mann. Ich sterbe vor Durst.","Köszönöm. Olyan volt a szám mint a sivatag.","","False","Info_Rufus_Wasser_02_01","",""
"Scripts/content/Story/MISSIONS/DIA_Bau_903_Rufus.d:70","Wasser! Hey, Mann! Du hast nichts mehr! Haben wieder alle was gekriegt bis auf mich?","Víz! Hé, ember! Nem maradt! Ne mond, hogy mindenki kapott rajtam kívül, van még?","","","Info_Rufus_Wasser_NOWATER_02_00","",""
"Scripts/content/Story/MISSIONS/DIA_Bau_903_Rufus.d:83","Hi! Ich bin neu hier. Wollte mal fragen, was hier so läuft.","Hi! Új vagyok itt. Csak azt szeretném tudni, hogyan mennek errefelé a dolgok.","","","DIA_Rufus_Hello.description","",""
"Scripts/content/Story/MISSIONS/DIA_Bau_903_Rufus.d:93","Hi! Ich bin neu hier. Wollte mal fragen, was hier so läuft.","Hi! Új vagyok itt. Csak azt szeretném tudni, hogyan mennek errefelé a dolgok.","","","DIA_Rufus_Hello_15_00","",""
"Scripts/content/Story/MISSIONS/DIA_Bau_903_Rufus.d:94","Frag jemand anderen. Ich arbeite den ganzen Tag auf den Feldern und krieg nichts von dem mit, was hier läuft.","Kérdezz valaki mást. Én csak dolgozom itt kint a földön, nem tudok semmit.","","","DIA_Rufus_Hello_02_01","",""
"Scripts/content/Story/MISSIONS/DIA_Bau_903_Rufus.d:95","Mann, wie gerne würd' ich zum Reislord gehen und ihm sagen, er soll seinen Scheiß alleine machen!","Ember, Legszívesebben megmondanám a Rizsbárónak hogy végezze ő ezt a piszkos munkát!","","","DIA_Rufus_Hello_02_02","",""
"Scripts/content/Story/MISSIONS/DIA_Bau_903_Rufus.d:107","Wenn's dir nicht gefällt, warum arbeitest du dann hier? ","Hogyha nem szereted, miért dolgozol itt?","","False","DIA_Rufus_Why.description","",""
"Scripts/content/Story/MISSIONS/DIA_Bau_903_Rufus.d:120","Wenn's dir nicht gefällt, warum arbeitest du dann hier?","Hogyha nem szereted, miért dolgozol itt?","","","DIA_Rufus_Why_15_00","",""
"Scripts/content/Story/MISSIONS/DIA_Bau_903_Rufus.d:121","Es war am ersten Tag als ich hier war. Lefty, einer der Schläger, die für den Reislord arbeiten, kam zu mir und fragte mich, ob ich mal kurz auf den Reisfeldern helfen könnte.","Az első napon történt, amikor ide kerültem. Lefty, az egyik alak, aki a Rizsbárónak dolgozik, jött oda hozzám és kérdezte tudnék-e segíteni a munkában.","","","DIA_Rufus_Why_02_01","",""
"Scripts/content/Story/MISSIONS/DIA_Bau_903_Rufus.d:122","Klar, hab' ich gesagt. Ich war neu und wollte mich nützlich machen.","Persze, válaszoltam. Új voltam itt és hasznossá akartam tenni magamat.","","","DIA_Rufus_Why_02_02","",""
"Scripts/content/Story/MISSIONS/DIA_Bau_903_Rufus.d:123","Als ich mich am nächsten Tag von der Arbeit ausruhte, steht der Typ schon wieder vor mir.","A következő napon, amikor rövid pihenőt tartottam, a fickó újra felbukkant.","","","DIA_Rufus_Why_02_03","",""
"Scripts/content/Story/MISSIONS/DIA_Bau_903_Rufus.d:124","'Du willst doch nicht deine Kollegen ganz alleine schuften lassen?', hat er gesagt.","Ugye nem akarod, hogy a többiek végezzék el helyetted a munkát, vagy igen? kérdezte.","","","DIA_Rufus_Why_02_04","",""
