"location","source","target","id","fuzzy","context","translator_comments","developer_comments"
"Scripts/content/Story/MISSIONS/DIA_Sld_737_Torlof.d:77","Wenn du nen Tipp willst, Junge: Klau was wichtiges aus dem Alten Lager oder der Alten Mine.","Tu veux un conseil, gamin : vole quelque chose d'important du Vieux camp ou de la vieille mine.","","","DIA_Torlof_Mitmachen_04_03","",""
"Scripts/content/Story/MISSIONS/DIA_Sld_737_Torlof.d:78","Wenn die Jungs hier merken, dass du gegen Gomez bist, hast du hier keine Probleme mehr.","Dès que les gars verront que tu es contre Gomez, tu n'auras plus d'ennui.","","","DIA_Torlof_Mitmachen_04_04","",""
"Scripts/content/Story/MISSIONS/DIA_Sld_737_Torlof.d:79","Und wie stelle ich das an?","Et comment est-ce que je fais cela ?","","","DIA_Torlof_Mitmachen_15_05","",""
"Scripts/content/Story/MISSIONS/DIA_Sld_737_Torlof.d:80","Du mußt ihr VERTRAUEN gewinnen - und dann haust du sie über's Ohr!","Tu dois gagner leur CONFIANCE - et après tu peux les embrouiller !","","","DIA_Torlof_Mitmachen_04_06","",""
"Scripts/content/Story/MISSIONS/DIA_Sld_751_Soeldner.d:21","Ah, Besuch! Mach uns keinen Ärger, sonst bekommst du welchen!","Ah, un visiteur ! ne nous cause pas d'ennuis ici ou  bien tu le regretteras !","","","DIA_SLD_751_Soeldner_INTRO_INFO_01_01","",""
"Scripts/content/Story/MISSIONS/DIA_Sld_751_Soeldner.d:31","Ich geh dann mal.","J'irais mieux.","","","DIA_SLD_751_Soeldner_EXIT_1.description","",""
"Scripts/content/Story/MISSIONS/DIA_Sld_751_Soeldner.d:41","Ich geh' dann mal.","J'irais mieux.","","","DIA_SLD_751_Soeldner_EXIT_1_INFO_15_01","",""
"Scripts/content/Story/MISSIONS/DIA_Sld_751_Soeldner.d:42","Ich hoffe, wir verstehen uns.","J'espère que nous nous comprenons.","","","DIA_SLD_751_Soeldner_EXIT_1_INFO_01_02","",""
"Scripts/content/Story/MISSIONS/DIA_Sld_751_Soeldner.d:54","Ich muss weiter.","Je dois continuer.","","","DIA_SLD_751_Soeldner_EXIT_2.description","",""
"Scripts/content/Story/MISSIONS/DIA_Sld_751_Soeldner.d:67","Ich muss weiter.","Je dois continuer.","","","DIA_SLD_751_Soeldner_EXIT_2_INFO_15_01","",""
"Scripts/content/Story/MISSIONS/DIA_Sld_751_Soeldner.d:68","Dann geh mal.","Vas-y alors.","","","DIA_SLD_751_Soeldner_EXIT_2_INFO_01_02","",""
"Scripts/content/Story/MISSIONS/DIA_Sld_751_Soeldner.d:79","Ich will mich hier nur mal umsehen.","Je veux juste jeter un oeil par là.","","","DIA_SLD_751_Soeldner_UMSEHEN.description","",""
"Scripts/content/Story/MISSIONS/DIA_Sld_751_Soeldner.d:89","Ich will mich hier nur mal umsehen.","Je veux juste jeter un oeil par là.","","","DIA_SLD_751_Soeldner_UMSEHEN_INFO_15_01","",""
"Scripts/content/Story/MISSIONS/DIA_Sld_751_Soeldner.d:90","Dann pass auf, dass du niemanden auf die Füße trittst.","Et rappelles-toi de ne pas marcher sur les pied.","","","DIA_SLD_751_Soeldner_UMSEHEN_INFO_01_02","",""
"Scripts/content/Story/MISSIONS/DIA_Sld_751_Soeldner.d:100","Ich will in die Mine.","Je veux entrer dans la mine.","","","DIA_SLD_751_Soeldner_INMINE.description","",""
"Scripts/content/Story/MISSIONS/DIA_Sld_751_Soeldner.d:110","Ich will in die Mine.","Je veux entrer dans la mine.","","","DIA_SLD_751_Soeldner_INMINE_INFO_15_01","",""
"Scripts/content/Story/MISSIONS/DIA_Sld_751_Soeldner.d:111","Ich glaube kaum, dass dir dass gelingen wird. Aber sprich mal mit Okyl.","Je peux à peine croire que tu diriges ça. Mais parle à Okyl.","","","DIA_SLD_751_Soeldner_INMINE_INFO_01_02","",""
"Scripts/content/Story/MISSIONS/DIA_Sld_752_Okyl.d:20","Hey, du! Du gehörst nicht zu meinen Jungs. Was machst du hier?","Hé, toi ! tu n'es pas l'un de mes hommes. Que fais-tu ici ?","","","DIA_SLD_752_OKYL_INTRO_INFO_11_01","",""
"Scripts/content/Story/MISSIONS/DIA_Sld_752_Okyl.d:31","Ich muss weiter!","Je dois continuer !","","","DIA_SLD_752_OKYL_EXIT.description","",""
"Scripts/content/Story/MISSIONS/DIA_Sld_752_Okyl.d:41","Ich muss weiter!","Je dois continuer !","","","DIA_SLD_752_OKYL_EXIT_INFO_15_01","",""
"Scripts/content/Story/MISSIONS/DIA_Sld_752_Okyl.d:42","Dann lass mich in Ruhe.","Laisse-moi seul alors.","","","DIA_SLD_752_OKYL_EXIT_INFO_11_02","",""
"Scripts/content/Story/MISSIONS/DIA_Sld_752_Okyl.d:53","Ich seh mich hier nur mal um.","Je jetterai juste un oeil par là.","","","DIA_SLD_752_OKYL_UMSEHEN.description","",""
"Scripts/content/Story/MISSIONS/DIA_Sld_752_Okyl.d:63","Ich seh' mich hier nur mal um.","Je jetterai juste un oeil par là.","","","DIA_SLD_752_OKYL_UMSEHEN_INFO_15_01","",""
"Scripts/content/Story/MISSIONS/DIA_Sld_752_Okyl.d:64","Dann pass bloß auf, dass du hier im Kessel keinen Mist baust, sonst bist du schneller im Grab, als dir lieb ist.","Alors fais attention de ne pas mettre la pagaille dans l'Éboulis, autrement tu seras plus vite dans une tombe que tu ne le penses.","","","DIA_SLD_752_OKYL_UMSEHEN_INFO_11_02","",""
"Scripts/content/Story/MISSIONS/DIA_Sld_752_Okyl.d:74","Wer bist du?","Qui es-tu ?","","","DIA_SLD_752_OKYL_WERBISTDU.description","",""
"Scripts/content/Story/MISSIONS/DIA_Sld_752_Okyl.d:84","Wer bist du?","Qui es-tu ?","","","DIA_SLD_752_OKYL_WERBISTDU_INFO_15_01","",""
"Scripts/content/Story/MISSIONS/DIA_Sld_752_Okyl.d:85","Ich bin Okyl. Ich hab' das Kommando über den Kessel.","Je suis Okyl. Je suis le patron de Éboulis","","","DIA_SLD_752_OKYL_WERBISTDU_INFO_11_02","",""
"Scripts/content/Story/MISSIONS/DIA_Sld_752_Okyl.d:95","Ich wollte nur mal in die Mine.","J'ai juste voulu regarder dans la mine.","","","DIA_SLD_752_OKYL_INMINE.description","",""
"Scripts/content/Story/MISSIONS/DIA_Sld_752_Okyl.d:105","Ich wollte nur mal in die Mine.","J'ai juste voulu regarder dans la mine.","","","DIA_SLD_752_OKYL_INMINE_INFO_15_01","",""
"Scripts/content/Story/MISSIONS/DIA_Sld_752_Okyl.d:106","Ach so, du wolltest nur mal kurz in die Mine.","Ah, tu as juste voulu flâner dans la mine.","","","DIA_SLD_752_OKYL_INMINE_INFO_11_02","",""
"Scripts/content/Story/MISSIONS/DIA_Sld_752_Okyl.d:107","Ich glaube, du weisst nicht, wie das hier läuft. Keiner kommt in die Mine ohne meine Erlaubnis.","Suppose que tu n'as pas un indice sur ce qui se passe ici. Personne ne met un pied dans la mine sans ma permission.","","","DIA_SLD_752_OKYL_INMINE_INFO_11_03","",""
"Scripts/content/Story/MISSIONS/DIA_Sld_752_Okyl.d:108","Schreib dir das hinter die Ohren. Wer ohne meine Erlaubnis die Mine oder das Torhaus betritt, ist ein toter Mann!","Et n'oublie jamais : Celui qui entre dans la mine ou dans le poste de garde sans ma permission est un homme mort !","","","DIA_SLD_752_OKYL_INMINE_INFO_11_04","",""
"Scripts/content/Story/MISSIONS/DIA_Sld_752_Okyl.d:118","Krieg ich die Erlaubnis?","Me permettra-t-on d'entrer ?","","","DIA_SLD_752_OKYL_PERMIT.description","",""
"Scripts/content/Story/MISSIONS/DIA_Sld_752_Okyl.d:131","Krieg ich die Erlaubnis?","Me permettra-t-on d'entrer ?","","","DIA_SLD_752_OKYL_PERMIT_INFO_15_01","",""
"Scripts/content/Story/MISSIONS/DIA_Sld_752_Okyl.d:132","Ich kenn' dich nicht einmal. Wieso sollte ich dir erlauben in die Mine zu gehen.","Je ne te connais même pas. Pourquoi devrais-je te laisser entrer dans la mine ?","","","DIA_SLD_752_OKYL_PERMIT_INFO_11_02","",""
"Scripts/content/Story/MISSIONS/DIA_Sld_752_Okyl.d:133","Jetzt verschwinde, ich hab' zu tun.","Fiche le camp maintenant, j'ai des choses à voir.","","","DIA_SLD_752_OKYL_PERMIT_INFO_11_03","",""
"Scripts/content/Story/MISSIONS/DIA_Sld_753_Baloro.d:26","Hey, du! Was ist los?","Hé, toi ! Qu'est-ce que tu fais ?","","","DIA_SLD_753_Baloro_Intro_08_01","",""
"Scripts/content/Story/MISSIONS/DIA_Sld_753_Baloro.d:36","Hi!","Salut !","","","DIA_SLD_753_Baloro_Wasmeinstdu.description","",""
"Scripts/content/Story/MISSIONS/DIA_Sld_753_Baloro.d:46","Hi!","Salut !","","","DIA_SLD_753_Baloro_Wasmeinstdu_Info_15_01","",""
"Scripts/content/Story/MISSIONS/DIA_Sld_753_Baloro.d:47","Du läufst hier rum, als würdest du was suchen!","Tu marches comme si tu cherchais quelque chose !","","","DIA_SLD_753_Baloro_Wasmeinstdu_Info_08_02","",""
"Scripts/content/Story/MISSIONS/DIA_Sld_753_Baloro.d:48","Tatsächlich? Mmh, stimmt vielleicht. Wieso?","Vraiment ? Mmh, peut-être as-tu raison. Pourquoi ?","","","DIA_SLD_753_Baloro_Wasmeinstdu_Info_15_03","",""
"Scripts/content/Story/MISSIONS/DIA_Sld_753_Baloro.d:49","Wunderbar! Frag mich! Ich kann dir vielleicht weiterhelfen!","Magnifique ! Interroge-moi ! Je pourrais peut-être t'aider !","","","DIA_SLD_753_Baloro_Wasmeinstdu_Info_08_04","",""
"Scripts/content/Story/MISSIONS/DIA_Sld_753_Baloro.d:59","Woran hast du dabei gedacht?","Qu'as-tu entendu ?","","","DIA_SLD_753_Baloro_Worumgehts.description","",""
"Scripts/content/Story/MISSIONS/DIA_Sld_753_Baloro.d:72","Woran hast du dabei gedacht?","Qu'as-tu entendu ?","","","DIA_SLD_753_Baloro_Worumgehts_Info_15_01","",""
"Scripts/content/Story/MISSIONS/DIA_Sld_753_Baloro.d:73","Was brauchst du denn?","De quoi as-tu besoin ?","","","DIA_SLD_753_Baloro_Worumgehts_Info_08_01","",""
"Scripts/content/Story/MISSIONS/DIA_Sld_753_Baloro.d:74","Wie wär's mit einem guten Schwert, einer starken Rüstung oder dem Zugang zur Mine?","Que dis-tu d'une bonne épée, d'une armure solide ou d'un accès à la mine ?","","","DIA_SLD_753_Baloro_Worumgehts_Info_15_02","",""
"Scripts/content/Story/MISSIONS/DIA_Sld_753_Baloro.d:75","Ach was! Das ist alles noch viel zu schlapp!","Non ! Ce n'est rien !","","","DIA_SLD_753_Baloro_Worumgehts_Info_08_02","",""
"Scripts/content/Story/MISSIONS/DIA_Sld_753_Baloro.d:76","Ich hab' dir was anzubieten, da werden dir die Augen übergehen! Ich kann dir eine Waffe besorgen, mit der du jeden Gegner besiegst!","Je peux te donner quelque chose qui te fera sortir les yeux des orbites ! Une arme avec laquelle tu pourras battre n'importe qui !","","","DIA_SLD_753_Baloro_Worumgehts_Info_08_03","",""
"Scripts/content/Story/MISSIONS/DIA_Sld_753_Baloro.d:77","Das einzige, was du tun musst, um sie zu bekommen, ist mir einen kleinen Gefallen zu erweisen. Und sie gehört dir! Was sagst du?","Tu dois seulement me faire une petite faveur. Alors elle sera à toi ! Qu'en dis-tu ?","","","DIA_SLD_753_Baloro_Worumgehts_Info_08_04","",""
"Scripts/content/Story/MISSIONS/DIA_Sld_753_Baloro.d:80","Will ich unbedingt haben","Je dois l'avoir.","","","DIA_SLD_753_Baloro_Worumgehts.DIA_SLD_753_Baloro_Worumgehts_ja","Info_AddChoice",""
"Scripts/content/Story/MISSIONS/DIA_Sld_753_Baloro.d:81","Ich glaub ihm kein Wort","Je ne crois pas un seul mot de ce qu'il a dit.","","","DIA_SLD_753_Baloro_Worumgehts_Info.DIA_SLD_753_Baloro_Worumgehts.DIA_SLD_753_Baloro_Exit_Info","Info_AddChoice",""
"Scripts/content/Story/MISSIONS/DIA_Sld_753_Baloro.d:86","Was müsste ich denn dafür tun?","Qu'est-ce que je devrai faire pour ça ?","","","DIA_SLD_753_Baloro_Worumgehts_ja_15_05","",""
"Scripts/content/Story/MISSIONS/DIA_Sld_753_Baloro.d:87","Ganz einfach!","Très simple !","","","DIA_SLD_753_Baloro_Worumgehts_ja_08_03","",""
"Scripts/content/Story/MISSIONS/DIA_Sld_753_Baloro.d:88","Bring mir 5 Äpfel, 2 Flaschen Reisschnaps, 5 Flaschen Bier, 3 Laibe Brot, 2 Käsestücke und 2 Weintraubenreben und wir kommen ins Geschäft!","Trouve-moi 5 pommes, 2 bouteilles d'alcool de riz, 5 bouteilles de bière, 3 miches de pain, 2 morceaux de fromage et 2 grappes de raisins, et nous ferons affaire !","","","DIA_SLD_753_Baloro_Worumgehts_ja_08_04","",""
"Scripts/content/Story/MISSIONS/DIA_Sld_753_Baloro.d:89","Glaub mir, du wirst es nicht bereuen. Wie ich schon sagte: Wirklich jeden Gegner machst du damit platt!","Crois-moi, tu ne dois pas être désolé. J'ai dit seulement : Tu vaincras vraiment n'importe quel ennemi avec ça !","","","DIA_SLD_753_Baloro_Worumgehts_ja_08_05","",""
"Scripts/content/Story/MISSIONS/DIA_Sld_753_Baloro.d:92","Muss ich haben","Je dois l'avoir.","","","DIA_SLD_753_Baloro_Worumgehts.DIA_SLD_753_Baloro_Worumgehts_jaklar","Info_AddChoice",""
"Scripts/content/Story/MISSIONS/DIA_Sld_753_Baloro.d:93","Der Typ will mich doch verarschen!","Le gars le prend mal.","","","DIA_SLD_753_Baloro_Worumgehts_ja.DIA_SLD_753_Baloro_Worumgehts.DIA_SLD_753_Baloro_Exit_Info","Info_AddChoice",""
"Scripts/content/Story/MISSIONS/DIA_Sld_753_Baloro.d:98","Na gut! Ich werde sehen, was ich tun kann!","Ok ! Je verrai ce que je peux faire alors !","","","DIA_SLD_753_Baloro_Worumgehts_ja_15_06","",""
"Scripts/content/Story/MISSIONS/DIA_Sld_753_Baloro.d:99","Sehr schön! Aber beeil dich!","Très bon ! Mais dépêche-toi !","","","DIA_SLD_753_Baloro_Worumgehts_ja_08_06","",""
"Scripts/content/Story/MISSIONS/DIA_Sld_753_Baloro.d:100","Vergiss es nicht: 5 Äpfel, 2 Flaschen Reisschnaps, 5 Flaschen Bier, 3 Laibe Brot, 2 Käsestücke und 2 Weintraubenreben! Klar?","ne pas oublier : 5 pommes, 2 bouteilles d'alcool de riz, 5 bouteilles de bière, 3 miches de pain, 2 morceaux de fromage et 2 grappes de raisins ! Ok ?","","","DIA_SLD_753_Baloro_Worumgehts_ja_08_07","",""
"Scripts/content/Story/MISSIONS/DIA_Sld_753_Baloro.d:101","Klar!","Bien sûr !","","","DIA_SLD_753_Baloro_Worumgehts_ja_15_07","",""
"Scripts/content/Story/MISSIONS/DIA_Sld_753_Baloro.d:122","Ich konnte deinen Kram noch nicht besorgen!","Je n'ai pas encore pu obtenir tes trucs !","","","DIA_SLD_753_Baloro_habsnichtdabei.description","",""
"Scripts/content/Story/MISSIONS/DIA_Sld_753_Baloro.d:135","Ich konnte deinen Kram nicht besorgen! Was war das noch mal? Es war so viel Verschiedenes!","Je n'ai pas pu encore trouver ta marchandise ! C'était quoi déjà ? Il y avait tant de choses différentes !","","","DIA_SLD_753_Baloro_habsnichtdabei_Info_15_01","",""
"Scripts/content/Story/MISSIONS/DIA_Sld_753_Baloro.d:136","Na schön! Noch mal zum Mitschreiben. Also, ich will von dir ...","D'accord ! Je vais le répéter lentement. Bien, je veux que tu me rapportes...","","","DIA_SLD_753_Baloro_habsnichtdabei_Info_08_01","",""
"Scripts/content/Story/MISSIONS/DIA_Sld_753_Baloro.d:137","5 Äpfel, 2 Flaschen Reisschnaps, 5 Flaschen Bier, 3 Laib Brot, 2 Käsestücke und 2 Weintraubenreben! Hast du's jetzt?","5 pommes, 2 bouteilles d'alcool de riz, 5 bouteilles de bière, 3 miches de pain, 2 morceaux de fromage et 2 grappes de raisins ! Tu as bien noté cette fois ?","","","DIA_SLD_753_Baloro_habsnichtdabei_Info_08_02","",""
"Scripts/content/Story/MISSIONS/DIA_Sld_753_Baloro.d:138","Ach ja! Sicher! Ich beeil mich!","Bien ! Sûr ! Je vais faire vite !","","","DIA_SLD_753_Baloro_habsnichtdabei_Info_15_02","",""
"Scripts/content/Story/MISSIONS/DIA_Sld_753_Baloro.d:150","Ich hab' den ganzen Kram dabei!","J'ai tous les trucs sur moi !","","","DIA_SLD_753_Baloro_habsdabei.description","",""
"Scripts/content/Story/MISSIONS/DIA_Sld_753_Baloro.d:171","Ich hab' den ganzen Kram dabei! Jetzt machen wir den Deal mit der ultimativen Waffe, ja?","J'ai toute la marchandise sur moi ! Maintenant on peut échanger contre cette arme superbe, pas vrai ?","","","DIA_SLD_753_Baloro_habsdabei_Info_15_01","",""
"Scripts/content/Story/MISSIONS/DIA_Sld_753_Baloro.d:172","Dann zeig doch erst mal her!","Montre-moi la marchandise d'abord !","","","DIA_SLD_753_Baloro_habsdabei_Info_08_01","",""
"Scripts/content/Story/MISSIONS/DIA_Sld_753_Baloro.d:191","Hier hast du!","Voici !","","","DIA_SLD_753_Baloro_habsdabei_Info_15_02","",""
"Scripts/content/Story/MISSIONS/DIA_Sld_753_Baloro.d:192","Ja, klasse!","Ouais, magnifique !","","","DIA_SLD_753_Baloro_habsdabei_Info_08_02","",""
"Scripts/content/Story/MISSIONS/DIA_Sld_753_Baloro.d:193","So, nun her mit dem Ding!!","Bien, donne-moi l'arme maintenant ! !","","","DIA_SLD_753_Baloro_habsdabei_Info_15_03","",""
"Scripts/content/Story/MISSIONS/DIA_Sld_753_Baloro.d:194","Vergiss es!","N'y pense pas !","","","DIA_SLD_753_Baloro_habsdabei_Info_08_03","",""
"Scripts/content/Story/MISSIONS/DIA_Sld_753_Baloro.d:195","Was?","Quoi??","","","DIA_SLD_753_Baloro_habsdabei_Info_15_04","",""
"Scripts/content/Story/MISSIONS/DIA_Sld_753_Baloro.d:196","Glaubst du echt, da kommt jetzt noch was? Ich meine, wer so dämlich ist, sich auf so einen Quatsch einzulassen, der hat's auch nicht besser verdient!!","Tu as vraiment pensé que tu pourrais l'échanger contre quelque chose ? Je pense que si tu es assez stupide pour croire ça, tu ne la mérites pas ! !","","","DIA_SLD_753_Baloro_habsdabei_Info_08_04","",""
"Scripts/content/Story/MISSIONS/DIA_Sld_753_Baloro.d:197","Wundert mich, dass du überhaupt noch lebst! Wenn du so leichtgläubig hier in der Gegend rumrennst, machst du's nicht mehr lange!","Je suis stupéfait de voir que tu es encore vivant ! Si tu crois tout ce disent les gens, tu ne survivras pas longtemps ici !","","","DIA_SLD_753_Baloro_habsdabei_Info_08_05","",""
"Scripts/content/Story/MISSIONS/DIA_Sld_753_Baloro.d:198","Macht aber nichts! Jetzt haben wir Jungs wenigstens genügend Fressalien zum Feiern! Schönen Dank auch! Und vielleicht sehen wir uns ja noch mal. He he he!","Mais ça n'a pas d'importance ! Maintenant nous avons suffisamment de nourriture pour une soirée ! Merci beaucoup ! Au plaisir de te revoir. Hi hi hi !","","","DIA_SLD_753_Baloro_habsdabei_Info_08_06","",""
"Scripts/content/Story/MISSIONS/DIA_Sld_753_Baloro.d:216","Hey, Mann! Das kannst du mit mir nicht machen!","Hé mec ! Tu ne peux pas me faire ça !","","","DIA_SLD_753_Baloro_letztes_Wort.description","",""
"Scripts/content/Story/MISSIONS/DIA_Sld_753_Baloro.d:229","Hey, Mann! Das kannst du mit mir nicht machen!","Hé mec ! Tu ne peux pas me faire ça !","","","DIA_SLD_753_Baloro_letztes_Wort_Info_15_01","",""
"Scripts/content/Story/MISSIONS/DIA_Sld_753_Baloro.d:230","Was willst du denn noch! Verschwinde! Geh jemand anders auf die Nerven, sonst setzt's was! Kapiert?","Qu'est-ce que tu veux encore ! Fous le camp ! Va énerver quelqu'un d'autre, ou tu vas en prendre une ! Compris ?","","","DIA_SLD_753_Baloro_letztes_Wort_Info_08_01","",""
"Scripts/content/Story/MISSIONS/DIA_Sld_753_Baloro.d:244","Ich glaube, ich muss dir jetzt leider die Fresse polieren!","J'ai peur de devoir te donner de grands coups dans la tronche !","","","DIA_SLD_753_Baloro_SC_wills_wissen.description","",""
"Scripts/content/Story/MISSIONS/DIA_Sld_753_Baloro.d:265","Ich glaube, ich muss dir jetzt leider die Fresse polieren!","J'ai peur de devoir te donner de grands coups dans la tronche !","","","DIA_SLD_753_Baloro_SC_wills_wissen_Info_15_01","",""
"Scripts/content/Story/MISSIONS/DIA_Sld_753_Baloro.d:266","Wir haben unseren Spaß gehabt! Jetzt zieh´ Leine, Mann!","Nous nous sommes suffisamment amusé ! Fous le camp maintenant, l'ami !","","","DIA_SLD_753_Baloro_SC_wills_wissen_Info_08_01","",""
"Scripts/content/Story/MISSIONS/DIA_Sld_753_Baloro.d:267","Ich glaube, du hast mich nicht verstanden!","Je crois que tu ne m'as pas compris !","","","DIA_SLD_753_Baloro_SC_wills_wissen_Info_15_02","",""
"Scripts/content/Story/MISSIONS/DIA_Sld_753_Baloro.d:268","Na gut! Du willst es ja nicht anders! Ich hab' dich gewarnt!","D'accord ! Tu lui as demandé ! Tu as été averti !","","","DIA_SLD_753_Baloro_SC_wills_wissen_Info_08_02","",""
"Scripts/content/Story/MISSIONS/DIA_Sld_753_Baloro.d:281","Ich muss weiter!","Je dois continuer.","","","DIA_SLD_753_Baloro_Exit.description","",""
"Scripts/content/Story/MISSIONS/DIA_Sld_753_Baloro.d:296","Nee, nee! Lass mal! Kein Interesse!","Non, non ! Va-t-en ! Je ne suis pas intéressé !","","","DIA_SLD_753_Baloro_Exit_Info_15_01","",""
"Scripts/content/Story/MISSIONS/DIA_Sld_753_Baloro.d:297","Na gut! Wie du willst! Du hattest deine Chance!","Bon, comme tu veux ! Tu as eu ta chance !","","","DIA_SLD_753_Baloro_Exit_Info_08_02","",""
"Scripts/content/Story/MISSIONS/DIA_Sld_753_Baloro.d:303","Tut mir Leid! Ich hab' leider keine Zeit für ein Pläuschchen!","Je suis désolé ! Malheureusement je n'ai pas le temps de bavarder !","","","DIA_SLD_753_Baloro_Exit_Info_15_03","",""
"Scripts/content/Story/MISSIONS/DIA_Sld_753_Baloro.d:304","Oh, haben wir es eilig! Na dann! Wir sehen uns!","Ah, tu es occupé ! Je te verrai plus tard !","","","DIA_SLD_753_Baloro_Exit_Info_08_04","",""
"Scripts/content/Story/MISSIONS/DIA_Sld_753_Baloro.d:317","Ich hab's mir überlegt. Ich möchte dein Angebot doch annehmen.","J'y ai pensé. Je voudrais revenir à ton offre maintenant.","","","DIA_SLD_753_Baloro_Angebotdochannehmen.description","",""
"Scripts/content/Story/MISSIONS/DIA_Sld_753_Baloro.d:330","Ich hab's mir überlegt. Ich möchte dein Angebot doch annehmen.","J'ai pensé ça. J'ai eu envie de revenir pour ton offre.","","","DIA_SLD_753_Baloro_Angebotdochannehmen_Info_15_01","",""
"Scripts/content/Story/MISSIONS/DIA_Sld_753_Baloro.d:331","Dafür ist es jetzt zu spät! Du hattest deine Chance!","Il est trop tard maintenant ! Tu as eu ta chance !","","","DIA_SLD_753_Baloro_Angebotdochannehmen_Info_08_01","",""
"Scripts/content/Story/MISSIONS/DIA_Sld_760_Soeldner.d:21","Was scharwenzelst du hier rum? Ich sag dir eins: Finger weg von der Tür.","Pourquoi t'accroches-tu ici ? Juste une chose : enlève tes mains de la porte.","","","DIA_SLD_760_Soeldner_INTRO_INFO_13_01","",""
"Scripts/content/Story/MISSIONS/DIA_Sld_760_Soeldner.d:31","Ich geh dann mal.","Je ferais mieux d'y aller.","","","DIA_SLD_760_Soeldner_EXIT_1.description","",""
"Scripts/content/Story/MISSIONS/DIA_Sld_760_Soeldner.d:41","Ich geh' dann mal.","Je ferais mieux d'y aller.","","","DIA_SLD_760_Soeldner_EXIT_1_INFO_15_01","",""
"Scripts/content/Story/MISSIONS/DIA_Sld_760_Soeldner.d:42","Ich hoffe, wir verstehen uns.","J'espère que nous nous comprenons.","","","DIA_SLD_760_Soeldner_EXIT_1_INFO_13_02","",""
"Scripts/content/Story/MISSIONS/DIA_Sld_760_Soeldner.d:54","Ich muss weiter.","Je dois continuer.","","","DIA_SLD_760_Soeldner_EXIT_2.description","",""
"Scripts/content/Story/MISSIONS/DIA_Sld_760_Soeldner.d:67","Ich muss weiter.","Je dois continuer.","","","DIA_SLD_760_Soeldner_EXIT_2_INFO_15_01","",""
"Scripts/content/Story/MISSIONS/DIA_Sld_760_Soeldner.d:68","Dann geh mal.","Vas-y alors.","","","DIA_SLD_760_Soeldner_EXIT_2_INFO_13_02","",""
"Scripts/content/Story/MISSIONS/DIA_Sld_760_Soeldner.d:79","Ich will mich hier nur mal umsehen.","Je veux juste jeter un oeil.","","","DIA_SLD_760_Soeldner_UMSEHEN.description","",""
"Scripts/content/Story/MISSIONS/DIA_Sld_760_Soeldner.d:89","Ich will mich hier nur mal umsehen.","Je veux juste jeter un oeil.","","","DIA_SLD_760_Soeldner_UMSEHEN_INFO_15_01","",""
"Scripts/content/Story/MISSIONS/DIA_Sld_760_Soeldner.d:90","Dann lass deine Finger bei dir, sonst werde ich sie dir anschneiden.","Laisser tes mains dans tes poches ou je te les couperai.","","","DIA_SLD_760_Soeldner_UMSEHEN_INFO_13_02","",""
"Scripts/content/Story/MISSIONS/DIA_Sld_760_Soeldner.d:100","Ich will in die Mine.","Je veux entrer dans la mine.","","","DIA_SLD_760_Soeldner_INMINE.description","",""
"Scripts/content/Story/MISSIONS/DIA_Sld_760_Soeldner.d:110","Ich will in die Mine.","Je veux entrer dans la mine.","","","DIA_SLD_760_Soeldner_INMINE_INFO_15_01","",""
"Scripts/content/Story/MISSIONS/DIA_Sld_760_Soeldner.d:111","In die Mine? Ich lass' hier gar keinen rein ohne die ausdrückliche Erlaubnis von Okyl.","Dans la mine ? Je ne laisserais pas quelqu'un ici sans la permission exprès d'Okyl.","","","DIA_SLD_760_Soeldner_INMINE_INFO_13_02","",""
"Scripts/content/Story/MISSIONS/DIA_Sld_760_Soeldner.d:115","Wer ist dieser Okyl?","Qui est cet Okyl ?","","","DIA_SLD_760_Soeldner_INMINE_INFO_15_03","",""
"Scripts/content/Story/MISSIONS/DIA_Sld_760_Soeldner.d:119","Okyl, ist das nicht dieser Typ mit der dicken Axt und der schweren Rüstung?","Okyl, ce n'est pas que le type avec la grande hache et l'armure lourde ?","","","DIA_SLD_760_Soeldner_INMINE_INFO_15_08","",""
"Scripts/content/Story/MISSIONS/DIA_Sld_760_Soeldner.d:122","Pass auf, was du sagst und wie du von unserem Anführer sprichst.","Fais attention à ce que tu dis et comment tu parles de notre patron.","","","DIA_SLD_760_Soeldner_INMINE_INFO_13_04","",""
"Scripts/content/Story/MISSIONS/DIA_Sld_760_Soeldner.d:123","Ich werde dir mal was über Okyl erzählen, er ist der härteste Hund, den wir hier haben. Er ist soger mal in die Burg des Alten Lagers geschlichen und hat den Erzbaronen eine Ladung Erz unterm Hintern weggeklaut.","Je vais te dire une chose au sujet d'Okyl, c'est le type le plus costaud de tout le camp. Même qu'une fois il est allé silencieusement dans le château du Vieux camp et a volé du minerai des Barons.","","","DIA_SLD_760_Soeldner_INMINE_INFO_13_05","",""
"Scripts/content/Story/MISSIONS/DIA_Sld_760_Soeldner.d:124","Also ein wenig mehr Respekt, wenn ich bitten darf.","Alors un peu de respect.","","","DIA_SLD_760_Soeldner_INMINE_INFO_13_06","",""
"Scripts/content/Story/MISSIONS/DIA_Sld_760_Soeldner.d:125","Ich weiß zwar nicht, wo er gerade ist, aber wenn du ihm begegnest. solltest du das immer im Hinterkopf haben.","Je ne sais pas où il est, mais si tu le rencontres tu devrais garder cette histoire présente à l'esprit.","","","DIA_SLD_760_Soeldner_INMINE_INFO_13_07","",""
"Scripts/content/Story/MISSIONS/DIA_Sld_761_Soeldner.d:21","Was machst du hier an der Mine?","Que fais-tu ici, à la mine ?","","","DIA_SLD_761_Soeldner_INTRO_INFO_03_01","",""
"Scripts/content/Story/MISSIONS/DIA_Sld_761_Soeldner.d:31","Ich hab' noch was zu erledigen.","J'ai encore quelques affaires en cours.","","","DIA_SLD_761_Soeldner_EXIT_1.description","",""
"Scripts/content/Story/MISSIONS/DIA_Sld_761_Soeldner.d:41","Ich hab' noch was zu erledigen.","J'ai encore quelques affaires en cours.","","","DIA_SLD_761_Soeldner_EXIT_1_INFO_15_01","",""
"Scripts/content/Story/MISSIONS/DIA_Sld_761_Soeldner.d:42","Das denke ich auch.","C'est ce à quoi je pense aussi.","","","DIA_SLD_761_Soeldner_EXIT_1_INFO_03_02","",""
"Scripts/content/Story/MISSIONS/DIA_Sld_761_Soeldner.d:54","Ich geh dann mal.","Je ferais mieux d'y aller.","","","DIA_SLD_761_Soeldner_EXIT_2.description","",""
"Scripts/content/Story/MISSIONS/DIA_Sld_761_Soeldner.d:67","Ich geh' dann mal.","Je ferais mieux d'y aller.","","","DIA_SLD_761_Soeldner_EXIT_2_INFO_15_01","",""
"Scripts/content/Story/MISSIONS/DIA_Sld_761_Soeldner.d:68","Okay.","D'accord","","","DIA_SLD_761_Soeldner_EXIT_2_INFO_03_02","",""
