"location","source","target","id","fuzzy","context","translator_comments","developer_comments"
"Scripts/content/Story/MISSIONS/DIA_Sld_761_Soeldner.d:79","Ich wollte mir nur mal das Camp ansehen.","J'ai juste voulu jeter un oeil autour du Camp.","","","DIA_SLD_761_Soeldner_UMSEHEN.description","",""
"Scripts/content/Story/MISSIONS/DIA_Sld_761_Soeldner.d:89","Ich wollte mir nur mal das Camp ansehen.","J'ai juste voulu jeter un oeil autour du Camp.","","","DIA_SLD_761_Soeldner_UMSEHEN_INFO_15_01","",""
"Scripts/content/Story/MISSIONS/DIA_Sld_761_Soeldner.d:90","Dann bist du hier wohl falsch, hier ist der Mineneingang, und der ist tabu für dich.","Alors tu n'es pas venu au bon endroit, parce que c'est l'entrée de la mine et tu n'es pas admis ici.","","","DIA_SLD_761_Soeldner_UMSEHEN_INFO_03_02","",""
"Scripts/content/Story/MISSIONS/DIA_Sld_761_Soeldner.d:100","Ich wollte mir nur mal die Mine ansehen.","J'ai juste voulu voir la mine.","","","DIA_SLD_761_Soeldner_INMINE.description","",""
"Scripts/content/Story/MISSIONS/DIA_Sld_761_Soeldner.d:110","Ich wollte mir nur mal die Mine ansehen.","J'ai juste voulu voir la mine.","","","DIA_SLD_761_Soeldner_INMINE_INFO_15_01","",""
"Scripts/content/Story/MISSIONS/DIA_Sld_761_Soeldner.d:111","Du siehst doch, dass die Mine abgeschlossen ist, also hier gibt´s nichts zu sehen.","Je suppose que tu peux voir que la mine est fermée à clef, alors il n'y a absolument rien à voir pour toi.","","","DIA_SLD_761_Soeldner_INMINE_INFO_03_02","",""
"Scripts/content/Story/MISSIONS/DIA_Sld_761_Soeldner.d:121","Kann man da gar nichts machen?","N'y a-t-il rien que nous pouvons faire ?","","","DIA_SLD_761_Soeldner_Bribe.description","",""
"Scripts/content/Story/MISSIONS/DIA_Sld_761_Soeldner.d:134","Kann man da gar nichts machen?","N'y a-t-il rien que nous pouvons faire ?","","","DIA_SLD_761_Soeldner_Bribe_INFO_15_01","",""
"Scripts/content/Story/MISSIONS/DIA_Sld_761_Soeldner.d:135","Was sollte man da machen können?","Que faudrait-il faire pour ça ?","","","DIA_SLD_761_Soeldner_Bribe_INFO_03_02","",""
"Scripts/content/Story/MISSIONS/DIA_Sld_761_Soeldner.d:136","Moment mal, wenn du versucht, mich zu bestechen, dann bist du hier an der falschen Adresse.","Un moment, si tu essayes de me soudoyer, tu as tout faux.","","","DIA_SLD_761_Soeldner_Bribe_INFO_03_03","",""
"Scripts/content/Story/MISSIONS/DIA_Sld_761_Soeldner.d:137","Nein, ich wollte niemanden bestechen, ich dachte nur..","Non, je n'essayais pas de soudoyer qui que ce soit, j'ai juste pensé que...","","","DIA_SLD_761_Soeldner_Bribe_INFO_15_04","",""
"Scripts/content/Story/MISSIONS/DIA_Sld_761_Soeldner.d:138","Ich glaub', ich geh' dann besser.","Je devine que je ferais mieux d'y aller.","","","DIA_SLD_761_Soeldner_Bribe_INFO_15_05","",""
