"location","source","target","id","fuzzy","context","translator_comments","developer_comments"
"Scripts/content/Story/MISSIONS/DIA_EBR_105_Raven.d:361","Was belästigst du mich dann?","Alors pourquoi me tracasses-tu?","","","DIA_Raven_SpyBericht_10_06","",""
"Scripts/content/Story/MISSIONS/DIA_EBR_106_Bartholo.d:33","Wer bist du?","Qui es-tu ?","","","Info_Bartholo_HAllo.description","",""
"Scripts/content/Story/MISSIONS/DIA_EBR_106_Bartholo.d:43","Wer bist du?","Qui es-tu ?","","","Info_Bartholo_HAllo_15_00","",""
"Scripts/content/Story/MISSIONS/DIA_EBR_106_Bartholo.d:44","Ich bin Bartholo. Ich kümmere mich um die Versorgung der Erzbarone.","Mon nom est Bartholo. Je vois que les Barons du minerai ont leurs approvisionnements.","","","Info_Bartholo_HAllo_12_01","",""
"Scripts/content/Story/MISSIONS/DIA_EBR_106_Bartholo.d:45","Ich regele alles - von Krautlieferungen, über Essen bis hin zur Versorgung der Frauen.","Je suis responsable de pas mal de choses - des approvisionnements d'Herbe à la nourriture en passant par les provisions pour les femmes","","","Info_Bartholo_HAllo_12_02","",""
"Scripts/content/Story/MISSIONS/DIA_EBR_106_Bartholo.d:46","Außerdem sorge ich dafür, dass die beiden idiotischen Köche ihre Arbeit gut machen.","En outre, je m'assure que ces idiots de cuisiniers font bien leur travail.","","","Info_Bartholo_HAllo_12_03","",""
"Scripts/content/Story/MISSIONS/DIA_EBR_106_Bartholo.d:47","Sie sollten mir dafür dankbar sein. Gomez lässt sich nicht jeden Fraß gefallen. Die letzten beiden hat er an die Snapper im Fluss verfüttert.","Ils devraient être reconnaissants. Gomez n'accepterait pas qu'on lui serve de la merde. Il a jeté en pâture les deux derniers cuisiniers aux bêtes du fleuve.","","","Info_Bartholo_HAllo_12_04","",""
"Scripts/content/Story/MISSIONS/DIA_EBR_106_Bartholo.d:60","Ich will mit dir handeln.","Je veux passer un marché avec toi.","","","Info_Bartholo_PERM.description","",""
"Scripts/content/Story/MISSIONS/DIA_EBR_106_Bartholo.d:74","Ich will mit dir handeln.","Je veux faire affaire avec toi.","","","Info_Bartholo_PERM_15_00","",""
"Scripts/content/Story/MISSIONS/DIA_EBR_106_Bartholo.d:75","Ich habe einiges da - wenn du genug Erz hast.","Je peux faire une grosse offre - si tu possèdes assez de minerai.","","","Info_Bartholo_PERM_12_01","",""
"Scripts/content/Story/MISSIONS/DIA_EBR_106_Bartholo.d:88","Ich habe ne Ladung Kraut von Cor Kalom für Gomez.","J'ai de l'Herbe ici pour Gomez. Cor Kalom l'envoie.","","","Info_Bartholo_Krautbote.description","",""
"Scripts/content/Story/MISSIONS/DIA_EBR_106_Bartholo.d:101","Ich habe 'ne Ladung Kraut von Cor Kalom für Gomez.","J'ai de l'Herbe ici pour Gomez. Cor Kalom l'envoie.","","","Info_Bartholo_Krautbote_15_00","",""
"Scripts/content/Story/MISSIONS/DIA_EBR_106_Bartholo.d:102","Zeig her!","Montre moi!","","","Info_Bartholo_Krautbote_12_01","",""
"Scripts/content/Story/MISSIONS/DIA_EBR_106_Bartholo.d:106","Hmmmmmmm ...","Hmmmmmmm...","","","Info_Bartholo_Krautbote_12_02","",""
"Scripts/content/Story/MISSIONS/DIA_EBR_106_Bartholo.d:107","Gut! Gomez ist beinahe ungeduldig geworden. Sei froh, dass du es heute noch abgeliefert hast!","Bien ! Gomez était devenu impatient. Une chance pour toi que tu l'as livré aujourd'hui !","","","Info_Bartholo_Krautbote_12_03","",""
"Scripts/content/Story/MISSIONS/DIA_EBR_106_Bartholo.d:108","Was ist mit der Bezahlung?","Quel est le salaire?","","","Info_Bartholo_Krautbote_15_04","",""
"Scripts/content/Story/MISSIONS/DIA_EBR_106_Bartholo.d:109","Nicht so eilig ... Hier, nimm. 500 Erz waren abgemacht.","Pas si vite... Prends ça. 500 minerais, c'est ce dont nous avons convenu.","","","Info_Bartholo_Krautbote_12_05","",""
"Scripts/content/Story/MISSIONS/DIA_EBR_106_Bartholo.d:123","Du hast zu wenig Kraut für einen Boten! Ich will für dich nicht hoffen, dass du das Zeug verscherbelt hast! Komm wieder, wenn du die richtige Menge dabei hast!","Tu n'as pas assez de Herbe pour être un coursier ! J'espère pour toi que tu n'as pas vendu la marchandise ailleurs ! Reviens quand tu auras la bonne quantité !","","","Info_Bartholo_Krautbote_NoKraut_12_00","",""
"Scripts/content/Story/MISSIONS/DIA_EBR_106_Bartholo.d:150","Ich hatte mir fast gedacht, dass es jemand durch das Pentagramm versuchen würde!","J'ai su que quelqu'un essayerait de nous nuire à travers le pentacle !","","","Info_Bartholo_12_01","",""
"Scripts/content/Story/MISSIONS/DIA_EBR_106_Bartholo.d:151","Aber im Gegensatz zu diesem verräterischen Schmied Stone brauchen wir dich nicht mehr!","Mais, à la différence de ce fourbe de Stone le forgeron,on n'a plus besoin de toi !","","","Info_Bartholo_12_02","",""
"Scripts/content/Story/MISSIONS/DIA_EBR_106_Bartholo.d:152","Wo ist Stone?","Ou est Stone ?","","","Info_Bartholo_15_03","",""
"Scripts/content/Story/MISSIONS/DIA_EBR_106_Bartholo.d:153","Hinter Gittern! Aber dafür wirst du gleich unter der Erde liegen!","En prison ! Mais tu vas être six pieds sous terre dans une minute !","","","Info_Bartholo_12_04","",""
"Scripts/content/Story/MISSIONS/DIA_EBR_106_Bartholo.d:154","Schnappt ihn euch, Jungs, und macht ihn kalt!","Prenez-le, les gars, et découpez-le en rondelles !","","","Info_Bartholo_12_05","",""
