"location","source","target","id","fuzzy","context","translator_comments","developer_comments"
"Scripts/content/Story/MISSIONS/DIA_Pc_Psionic.d:23","Dem Ziel entgegen!","Allons-y !","","","Info_Lester_EXIT_05_01","",""
"Scripts/content/Story/MISSIONS/DIA_Pc_Psionic.d:27","Der Schläfer möge dich behüten!","Puisse le Dormeur te protéger !","","","Info_Lester_EXIT_05_02","",""
"Scripts/content/Story/MISSIONS/DIA_Pc_Psionic.d:55","Du hast einen Guru angesprochen!! Tu das nie wieder! Es ist ein Sakrileg! Wenn der Meister es für richtig hält, mit dir zu reden, wird ER dich ansprechen.","Tu t'es adressé à un Sage ! Ne fait plus jamais cela ! C'est un sacrilège ! Si un maître veut te parler, IL s'adressera à TOI.","","","DIA_Lester_Sakrileg_05_00","",""
"Scripts/content/Story/MISSIONS/DIA_Pc_Psionic.d:67","Wer bist du?","Qui es-tu ?","","","DIA_Lester_Hallo.description","",""
"Scripts/content/Story/MISSIONS/DIA_Pc_Psionic.d:80","Wer bist du?","Qui es-tu ?","","","DIA_Lester_Hallo_15_00","",""
"Scripts/content/Story/MISSIONS/DIA_Pc_Psionic.d:81","Ich bin Lester. Ich kümmere mich um die Fremden, die hier ankommen.","Je suis Lester. Je m'occupe des étrangers qui arrivent ici.","","","DIA_Lester_Hallo_05_01","",""
"Scripts/content/Story/MISSIONS/DIA_Pc_Psionic.d:84","Gut, dass du nicht Baal Namib angesprochen hast. Kein Fremder darf die Gurus ansprechen.","Tu as de la chance de ne pas avoir parlé à Baal Namib. On ne permet à aucun étranger de parler aux Sages.","","","DIA_Lester_Hallo_05_02","",""
"Scripts/content/Story/MISSIONS/DIA_Pc_Psionic.d:97","Ich will aber mit deinem Meister reden.","Mais je veux parler à ton maître.","","","DIA_Lester_WannaTalkToMaster.description","",""
"Scripts/content/Story/MISSIONS/DIA_Pc_Psionic.d:112","Ich will aber mit deinem Meister reden.","Mais je veux parler à ton maître.","","","DIA_Lester_WannaTalkToMaster_15_00","",""
"Scripts/content/Story/MISSIONS/DIA_Pc_Psionic.d:113","Vergiss es! Ich bin sicher, ICH kann dir bei all deinen Problemen weiterhelfen.","N'y pense pas ! Je suis sûr que je peux t'aider pour n'importe lequel de tes problèmes.","","","DIA_Lester_WannaTalkToMaster_05_01","",""
"Scripts/content/Story/MISSIONS/DIA_Pc_Psionic.d:126","Erzähl mir was über das Lager.","Dit-moi quelque chose à propos du Camp.","","","DIA_Lester_CampInfo.description","",""
"Scripts/content/Story/MISSIONS/DIA_Pc_Psionic.d:140","Erzähl mir was über das Lager.","Dit-moi quelque chose à propos du Camp.","","","DIA_Lester_CampInfo_15_00","",""
"Scripts/content/Story/MISSIONS/DIA_Pc_Psionic.d:141","Was willst du wissen?","Que veux-tu savoir ?","","","DIA_Lester_CampInfo_05_01","",""
"Scripts/content/Story/MISSIONS/DIA_Pc_Psionic.d:144","Erzähl mir was über die Gilden.","Parle-moi des guildes.","","","DIA_Lester_CampInfo.DIA_Lester_CampInfo_GIL","Info_AddChoice",""
"Scripts/content/Story/MISSIONS/DIA_Pc_Psionic.d:145","Was hat es mit dem Schläfer auf sich?","Que peux-tu me dire à propos du Dormeur ?","","","DIA_Lester_CampInfo.DIA_Lester_CampInfo_SLEEPER","Info_AddChoice",""
"Scripts/content/Story/MISSIONS/DIA_Pc_Psionic.d:146","Was weißt du über das Kraut?","Que sais-tu de l'Herbe ?","","","DIA_Lester_CampInfo.DIA_Lester_CampInfo_HERB","Info_AddChoice",""
"Scripts/content/Story/MISSIONS/DIA_Pc_Psionic.d:156","Erzähl mir was über die Gilden.","Parle-moi des guildes.","","","DIA_Lester_CampInfo_GIL_15_00","",""
"Scripts/content/Story/MISSIONS/DIA_Pc_Psionic.d:157","Die Gurus bilden die oberste Gilde. Sie sind der Geist des Lagers, denn ihre Macht ist groß. Die Templer benutzen ihre geistige Stärke im Kampf.","Les Sages forment la guilde la plus élevée. Ils sont l'esprit de ce camp, parce que ils possèdent une grande puissance. Les templiers emploient leur puissance spirituelle dans la bataille.","","","DIA_Lester_CampInfo_GIL_05_01","",""
"Scripts/content/Story/MISSIONS/DIA_Pc_Psionic.d:158","Sie haben einen unbezwingbaren Willen. Leg dich besser NIE mit ihnen an. Ich selber gehöre zu den Novizen. Wir beten zum Schläfer und verrichten die Arbeiten, die hier im Lager anfallen.","Ils ont un pouvoir invincible. Tu ferais mieux de ne jamais avoir d'ennuis avec eux. Quant à moi, je suis un novice. Nous prions le Dormeur et effectuons tout les travaux du camp.","","","DIA_Lester_CampInfo_GIL_05_02","",""
"Scripts/content/Story/MISSIONS/DIA_Pc_Psionic.d:159","Einige der Novizen werden als Gurus aufgenommen, aber dazu gehört eine viele Jahre lange Ausbildung.","Certains des novices ont la permission de rejoindre les Sages, mais pour cela il leurs faut étudier pendant de longues d'années.","","","DIA_Lester_CampInfo_GIL_05_03","",""
"Scripts/content/Story/MISSIONS/DIA_Pc_Psionic.d:164","Was hat es mit dem Schläfer auf sich?","Que peux-tu me dire à propos du Dormeur ?","","","DIA_Lester_CampInfo_SLEEPER_15_00","",""
"Scripts/content/Story/MISSIONS/DIA_Pc_Psionic.d:165","Der Schläfer ist ein göttliches Wesen. Er schenkt uns Visionen - zumindest den Gurus.","Le Dormeur est une créature divine. Il donne des visions - du moins il en donne aux Sages.","","","DIA_Lester_CampInfo_SLEEPER_05_01","",""
"Scripts/content/Story/MISSIONS/DIA_Pc_Psionic.d:166","Wir beten zu ihm, denn er wird uns allen die Freiheit schenken.","Nous le prions, parce qu'il nous donnera la liberté.","","","DIA_Lester_CampInfo_SLEEPER_05_02","",""
"Scripts/content/Story/MISSIONS/DIA_Pc_Psionic.d:167","Und daran glaubst du?","Et tu crois cela ?","","","DIA_Lester_CampInfo_SLEEPER_15_03","",""
"Scripts/content/Story/MISSIONS/DIA_Pc_Psionic.d:168","Hey, ich bin seit zwei Jahren in der Barriere. Weißt du überhaupt wie lange ZWEI JAHRE sein können?","Hé, j'ai été à l'intérieur de la Barrière pendant deux ans. Sais-tu combien de temps ça représente DEUX ANS ?","","","DIA_Lester_CampInfo_SLEEPER_05_04","",""
"Scripts/content/Story/MISSIONS/DIA_Pc_Psionic.d:169","Du kannst dir nicht vorstellen, was ich alles bereit bin zu glauben und zu machen, damit ich hier wieder raus komme!","Tu ne peux pas imaginer ce que je suis disposé à croire et à faire juste pour sortir encore d'ici !","","","DIA_Lester_CampInfo_SLEEPER_05_05","",""
"Scripts/content/Story/MISSIONS/DIA_Pc_Psionic.d:174","Was weißt du über das Kraut?","Que sais-tu de l'Herbe ?","","","DIA_Lester_CampInfo_HERB_15_00","",""
"Scripts/content/Story/MISSIONS/DIA_Pc_Psionic.d:175","Nun, das Kraut wächst im Sumpf. Es muss natürlich noch verarbeitet werden, damit man es rauchen kann. Das machen wir Novizen.","Et Bien, l'Herbe pousse dans le marais. Naturellement elle doit être traitée pour qu'elle puisse être fumée. C'est le travail des novices.","","","DIA_Lester_CampInfo_HERB_05_01","",""
"Scripts/content/Story/MISSIONS/DIA_Pc_Psionic.d:176","Das Kraut hat eine beruhigende und entspannende Wirkung. Es hilft dir, dich auf das Wesentliche zu konzentrieren und dein Bewusstsein zu öffnen.","L'Herbe a un effet tranquillisant et favorise la détente. Elle t'aide à te concentrer sur l'essentiel et à augmenter ton niveau de conscience.","","","DIA_Lester_CampInfo_HERB_05_02","",""
"Scripts/content/Story/MISSIONS/DIA_Pc_Psionic.d:177","Wir tauschen es gegen Waren aus den anderen Lagern und benutzen es, um neue Leute anzuwerben.","Nous les échangeons avec des marchandises du Vieux camp et nous les employons aussi pour recruter de nouvelles personnes.","","","DIA_Lester_CampInfo_HERB_05_03","",""
"Scripts/content/Story/MISSIONS/DIA_Pc_Psionic.d:178","Das führt natürlich dazu, dass viele Leute nur wegen des Krauts zu uns kommen. Na ja, immerhin helfen sie bei den anfallenden Arbeiten.","Évidement, le résultat est que certains nous rejoignent seulement pour l'Herbe. Et bien, au moins ils nous aident dans les travaux du camp.","","","DIA_Lester_CampInfo_HERB_05_04","",""
"Scripts/content/Story/MISSIONS/DIA_Pc_Psionic.d:190","Ich will mich der Bruderschaft anschließen!","Je veux devenir un membre de la Confrérie !","","","DIA_Lester_WannaJoin.description","",""
"Scripts/content/Story/MISSIONS/DIA_Pc_Psionic.d:204","Ich will mich der Bruderschaft anschließen!","Je veux devenir un membre de la Confrérie !","","","DIA_Lester_WannaJoin_15_00","",""
"Scripts/content/Story/MISSIONS/DIA_Pc_Psionic.d:205","Cor Kalom entscheidet, ob du bereit bist, in die Bruderschaft einzutreten.","Cor Kalom décide si tu es prêt à rejoindre la Confrérie.","","","DIA_Lester_WannaJoin_05_01","",""
"Scripts/content/Story/MISSIONS/DIA_Pc_Psionic.d:206","Aber er verlässt sich auf den Rat der anderen Gurus. Baal Namib hier ist einer von ihnen.","Mais il tiens compte de l'avis d'autres Sages. Baal Namib, là-bas, est l'un d'entre eux.","","","DIA_Lester_WannaJoin_05_02","",""
"Scripts/content/Story/MISSIONS/DIA_Pc_Psionic.d:207","Du wirst dich erst als würdig erweisen müssen, dann wird dich einer der Gurus zu Cor Kalom schicken.","D'abord tu devras montrer que tu es digne, et c'est seulement qu'un des Sages t'enverra à Cor Kalom.","","","DIA_Lester_WannaJoin_05_03","",""
"Scripts/content/Story/MISSIONS/DIA_Pc_Psionic.d:219","Wie soll das funktionieren, wenn keiner der Gurus mit mir redet?","Comment veux-tu que je travaille si aucun des Sages ne me parle ?","","","DIA_Lester_HowProofWorthy.description","",""
"Scripts/content/Story/MISSIONS/DIA_Pc_Psionic.d:233","Wie soll das funktionieren, wenn keiner der Gurus mit mir redet?","Comment veux-tu que je travaille si aucun des Sages ne me parle ?","","","DIA_Lester_HowProofWorthy_15_00","",""
"Scripts/content/Story/MISSIONS/DIA_Pc_Psionic.d:234","Es hat vielleicht nicht den Anschein, aber die Gurus beobachten genau, was du hier im Lager tust.","Les Sages observent tout ce que tu fais ici dans le camp.","","","DIA_Lester_HowProofWorthy_05_01","",""
"Scripts/content/Story/MISSIONS/DIA_Pc_Psionic.d:235","Wenn sie der Meinung sind, dass du dich um unsere Gemeinschaft verdient gemacht hast, werden sie dich ansprechen.","S'ils pensent que tu mérites de devenir un membre de la communauté, ils te parleront.","","","DIA_Lester_HowProofWorthy_05_02","",""
"Scripts/content/Story/MISSIONS/DIA_Pc_Psionic.d:236","Hier im Lager werden sich sicher Gelegenheiten bieten, dich als würdig zu erweisen.","Tu es obligé de trouver dans le camp des occasions de montrer que tu es digne.","","","DIA_Lester_HowProofWorthy_05_03","",""
"Scripts/content/Story/MISSIONS/DIA_Pc_Psionic.d:254","Wie bringe ich deinen Meister dazu, mit mir zu reden?","Comment puis-je faire pour que ton maître me parle ?","","","DIA_Lester_WeitWeg.description","",""
"Scripts/content/Story/MISSIONS/DIA_Pc_Psionic.d:270","Wie bringe ich deinen Meister dazu, mit mir zu reden?","Comment puis-je faire pour que ton maître me parle ?","","","DIA_Lester_WeitWeg_15_00","",""
"Scripts/content/Story/MISSIONS/DIA_Pc_Psionic.d:271","Du musst wissen, was er hören will.","Tu dois savoir ce qu'il veut entendre.","","","DIA_Lester_WeitWeg_05_01","",""
"Scripts/content/Story/MISSIONS/DIA_Pc_Psionic.d:272","Nämlich?","Et c'est ?","","","DIA_Lester_WeitWeg_15_02","",""
"Scripts/content/Story/MISSIONS/DIA_Pc_Psionic.d:273","Pass auf: Wenn wir beide das nächste Mal bei ihm sind, sprichst du mich an, und wir unterhalten uns ein bisschen.","Écoute : Quand nous serons avec lui la prochaine fois, tu t'adresseras à moi et nous aurons un entretien.","","","DIA_Lester_WeitWeg_05_03","",""
"Scripts/content/Story/MISSIONS/DIA_Pc_Psionic.d:274","Baal Namib macht sich zurzeit große Sorgen, weil viele Novizen nicht nur zum Schläfer beten, sondern auch noch zu ihren alten Göttern.","Baal Namib est inquiet parce que plusieurs des novices prient non seulement le Dormeur, mais également leurs anciens dieux.","","","DIA_Lester_WeitWeg_05_04","",""
"Scripts/content/Story/MISSIONS/DIA_Pc_Psionic.d:275","Du erzählst mir, dass du den alten Göttern abgeschworen hast, und jetzt nur noch den Schläfer anrufst.","Tu me diras que tu as renoncé aux anciens dieux et que, à l'avenir, tu prieras seulement le Dormeur.","","","DIA_Lester_WeitWeg_05_05","",""
"Scripts/content/Story/MISSIONS/DIA_Pc_Psionic.d:276","Daraufhin werde ich dich fragen, was dich dazu bewogen hat, und du sagst, du hattest eine Vision, in der der Schläfer dich zu sich gerufen hat.","Alors je te demanderai pourquoi tu as pris cette décision et tu diras que tu as eu une vision dans laquelle le Dormeur t'a appelé.","","","DIA_Lester_WeitWeg_05_06","",""
"Scripts/content/Story/MISSIONS/DIA_Pc_Psionic.d:277","Das sollte sein Interesse wecken. Denkst du, du kriegst das hin?","Il sera alors intéressé. Tu penses pouvoir faire ça ?","","","DIA_Lester_WeitWeg_05_07","",""
"Scripts/content/Story/MISSIONS/DIA_Pc_Psionic.d:278","Kein Problem.","Aucun problème.","","","DIA_Lester_WeitWeg_15_08","",""
"Scripts/content/Story/MISSIONS/DIA_Pc_Psionic.d:311","AH! GUT, DICH WIEDER ZU TREFFEN. WIE IST ES DIR ERGANGEN?","OH ! C'EST BON DE TE REVOIR. COMMENT VAS-TU ?","","","DIA_Lester_ShowHallo_05_00","",""
"Scripts/content/Story/MISSIONS/DIA_Pc_Psionic.d:323","Ich habe den alten Göttern abgeschworen.","J'ai renoncé aux vieux dieux.","","","DIA_Lester_Show.description","",""
"Scripts/content/Story/MISSIONS/DIA_Pc_Psionic.d:337","ICH HABE DEN ALTEN GÖTTERN ABGESCHWOREN.","J'AI RENONCÉ AUX ANCIENS DIEUX.","","","DIA_Lester_Show_15_00","",""
"Scripts/content/Story/MISSIONS/DIA_Pc_Psionic.d:338","EHRLICH? WIE KOMMST DU ZU DIESR ENTSCHEIDUNG?","VRAIMENT ? POURQUOI AVOIR FAIT CELA ?","","","DIA_Lester_Show_05_01","",""
"Scripts/content/Story/MISSIONS/DIA_Pc_Psionic.d:339","ICH HATTE EINE VISION. DER SCHLÄFER HAT ZU MIR GESPROCHEN.","J'AI EU UNE VISION : LE DORMEUR M'A PARLÉ.","","","DIA_Lester_Show_15_02","",""
"Scripts/content/Story/MISSIONS/DIA_Pc_Psionic.d:340","WAS HAT ER GESAGT?","QU'A-T-IL DIT ?","","","DIA_Lester_Show_05_03","",""
"Scripts/content/Story/MISSIONS/DIA_Pc_Psionic.d:341","ER SAGTE, GEH IN DAS LAGER IM SUMPF UND SCHLIESS DICH DER BRUDERSCHAFT AN.","IL A DIT : VA AU CAMP DANS LE MARAIS ET REJOINS LA CONFRÉRIE.","","","DIA_Lester_Show_15_04","",""
"Scripts/content/Story/MISSIONS/DIA_Pc_Psionic.d:342","DU BIST EIN SEHR REICHER MANN, FREMDER, DER SCHLÄFER BELOHNT NICHT VIELE AUF DIESE WEISE.","TU ES TRES CHANCEUX, ÉTRANGER : LE DORMEUR NE RÉCOMPENSE PAS BEAUCOUP DE GENS COMME TOI.","","","DIA_Lester_Show_05_05","",""
"Scripts/content/Story/MISSIONS/DIA_Pc_Psionic.d:358","Wie kann ich mich hier im Lager zurechtfinden?","Comment puis-je trouver mon chemin par ici, dans le Camp ?","","","DIA_Lester_GuideOffer.description","",""
"Scripts/content/Story/MISSIONS/DIA_Pc_Psionic.d:372","Wie kann ich mich hier im Lager zurechtfinden?","Comment puis-je trouver mon chemin par ici, dans le Camp ?","","","DIA_Lester_GuideOffer_15_00","",""
"Scripts/content/Story/MISSIONS/DIA_Pc_Psionic.d:373","Ich kann dir die wichtigen Orte zeigen.","Je peux te montrer les endroits les plus importants.","","","DIA_Lester_GuideOffer_05_01","",""
"Scripts/content/Story/MISSIONS/DIA_Pc_Psionic.d:388","Sind wir gleich da?","Nous y sommes presque ?","","","PC_Psionic_SOON.description","",""
"Scripts/content/Story/MISSIONS/DIA_Pc_Psionic.d:403","Sind wir gleich da?","Nous y sommes presque ?","","","PC_Psionic_SOON_Info_15_01","",""
"Scripts/content/Story/MISSIONS/DIA_Pc_Psionic.d:404","Wenn du aufhörst, mich zu fragen, geht es schneller.","Si tu cessais de me questionner, nous serions beaucoup plus rapide.","","","PC_Psionic_SOON_Info_05_02","",""
"Scripts/content/Story/MISSIONS/DIA_Pc_Psionic.d:416","Ich habe es mir anders überlegt","J'ai changé d'avis.","","","PC_Psionic_CHANGE.description","",""
"Scripts/content/Story/MISSIONS/DIA_Pc_Psionic.d:431","Ich habe es mir anders überlegt.","J'ai changé d'avis.","","","PC_Psionic_CHANGE_Info_15_01","",""
"Scripts/content/Story/MISSIONS/DIA_Pc_Psionic.d:432","Du weißt ja, wo du mich finden kannst.","Je suppose que tu sais où me trouver.","","","PC_Psionic_CHANGE_Info_05_02","",""
"Scripts/content/Story/MISSIONS/DIA_Pc_Psionic.d:446","Zeig mir den Weg...","Montre-moi le chemin...","","","PC_Psionic_GUIDEFIRST.description","",""
"Scripts/content/Story/MISSIONS/DIA_Pc_Psionic.d:461","Zeig mir den Weg ...","Montre-moi le chemin...","","","PC_Psionic_GUIDEFIRST_Info_15_01","",""
"Scripts/content/Story/MISSIONS/DIA_Pc_Psionic.d:467","zurück zum Hauptor","retour à la porte principale","","","PC_Psionic_GUIDEFIRST.PC_Psionic_GUIDEFIRST_MAINGATE","Info_AddChoice",""
"Scripts/content/Story/MISSIONS/DIA_Pc_Psionic.d:468","zur Schmiede","Vers la forge","","","PC_Psionic_GUIDEFIRST.PC_Psionic_GUIDEFIRST_SMITH","Info_AddChoice",""
"Scripts/content/Story/MISSIONS/DIA_Pc_Psionic.d:469","zum Tempel","Vers le temple","","","PC_Psionic_GUIDEFIRST.PC_Psionic_GUIDEFIRST_TEMPEL","Info_AddChoice",""
"Scripts/content/Story/MISSIONS/DIA_Pc_Psionic.d:470","zu den Lehrern","Vers les professeurs privés","","","PC_Psionic_GUIDEFIRST.PC_Psionic_GUIDEFIRST_TRAIN","Info_AddChoice",""
"Scripts/content/Story/MISSIONS/DIA_Pc_Psionic.d:471","zum Alchemielabor","Vers l'alchimie des Magiciens de l'Eau.","","","PC_Psionic_GUIDEFIRST.PC_Psionic_GUIDEFIRST_HERB","Info_AddChoice",""
"Scripts/content/Story/MISSIONS/DIA_Pc_Psionic.d:485","... zur Schmiede.","... au magasin de forgeron.","","","PC_Psionic_GUIDEFIRST_SMITH_Info_15_01","",""
"Scripts/content/Story/MISSIONS/DIA_Pc_Psionic.d:486","folge mir!","Suis moi!","","","PC_Psionic_GUIDEFIRST_SMITH_Info_05_02","",""
"Scripts/content/Story/MISSIONS/DIA_Pc_Psionic.d:494","... zum Tempel.","... au temple.","","","PC_Psionic_GUIDEFIRST_TEMPEL_Info_15_01","",""
"Scripts/content/Story/MISSIONS/DIA_Pc_Psionic.d:495","folge mir!","Suis moi!","","","PC_Psionic_GUIDEFIRST_TEMPEL_Info_05_02","",""
"Scripts/content/Story/MISSIONS/DIA_Pc_Psionic.d:503","... zu den Lehrern.","... aux précepteurs.","","","PC_Psionic_GUIDEFIRST_TRAIN_Info_15_01","",""
"Scripts/content/Story/MISSIONS/DIA_Pc_Psionic.d:504","folge mir!","Suis moi!","","","PC_Psionic_GUIDEFIRST_TARIN_Info_05_02","",""
"Scripts/content/Story/MISSIONS/DIA_Pc_Psionic.d:512","... zum Alchemielabor!","... au laboratoire d'alchimie !","","","PC_Psionic_GUIDEFIRST_HERB_Info_15_01","",""
"Scripts/content/Story/MISSIONS/DIA_Pc_Psionic.d:513","folge mir!","Suis moi!","","","PC_Psionic_GUIDEFIRST_HERB_Info_05_02","",""
"Scripts/content/Story/MISSIONS/DIA_Pc_Psionic.d:545","Hier unten findest du Baal Cadar. Er unterrichtet die Novizen.","En bas tu trouveras Baal Cadar. Il enseigne les novices.","","","PC_Psionic_TRAIN_Info_05_01","",""
"Scripts/content/Story/MISSIONS/DIA_Pc_Psionic.d:548","Die Leiter rauf kommst du zum Übungsplatz der Templer. Ich warte hier auf dich. Wenn du trödelst, dann triffst du mich wieder bei Baal Namib am Eingang des Lagers.","Grimper à cette échelle te portera au au niveau de la formation des templiers. Je t'attendrai juste ici. Si tu tombes derrière, je serai encore avec Baal Namib à l'entrée au camp.","","","PC_Psionic_TRAIN_Info_05_02","",""
"Scripts/content/Story/MISSIONS/DIA_Pc_Psionic.d:578","Hier ist der Tempel! Ich werde auf dich warten, aber wenn du dir zu viel Zeit lässt, dann gehe ich zurück zu Baal Namib.","C'est le temple ! Je t'attendrai, mais si tu es trop long, je serais de nouveau avec Baal Namib.","","","PC_Psionic_TEMPEL_Info_05_01","",""
"Scripts/content/Story/MISSIONS/DIA_Pc_Psionic.d:609","Hier ist die Schmiede! Schau dich um, ich warte etwa eine Stunde, dann haue ich wieder ab.","Voilà la forge ! Va faire un tour ; j'attendrai ici environ une heure, puis je partirai.","","","PC_Psionic_SMITH_Info_05_01","",""
"Scripts/content/Story/MISSIONS/DIA_Pc_Psionic.d:639","Wenn du die Leiter raufsteigst, dann kommst du zu Kalom, dem Alchemisten. Hier unten steht Fortuno, der Krauthändler.","Si tu grimpe à cette échelle tu rencontreras Kalom, l'alchimiste. En bas se trouve Fortuno, le négociant d'Herbe.","","","PC_Psionic_HERB_Info_05_01","",""
"Scripts/content/Story/MISSIONS/DIA_Pc_Psionic.d:640","Ich warte hier auf dich, aber lass dir nicht zu viel Zeit, sonst gehe ich wieder zurück.","Je t'attendrai juste ici. Mais ne sois pas trop long, autrement je m'en retournerai.","","","PC_Psionic_HERB_Info_05_02","",""
"Scripts/content/Story/MISSIONS/DIA_Pc_Psionic.d:688","Gut, dass du da bist. Ich habe Neuigkeiten.","Je suis heureux de te voir ici. J'ai des nouvelles pour toi.","","","PC_Psionic_SEND_Info_05_00","",""
"Scripts/content/Story/MISSIONS/DIA_Pc_Psionic.d:689","Ich hoffe, gute Neuigkeiten.","De bonnes nouvelles, j'espère.","","","PC_Psionic_SEND_Info_15_01","",""
"Scripts/content/Story/MISSIONS/DIA_Pc_Psionic.d:692","Unsere Bruderschaft plant etwas ganz Großes.","Notre Confrérie projette quelque chose de vraiment important.","","","PC_Psionic_SEND_Info_05_02","",""
"Scripts/content/Story/MISSIONS/DIA_Pc_Psionic.d:693","Was plant ihr denn? Den Ausbruch?","Quel est ce plan ? Pour tout éclater ?","","","PC_Psionic_SEND_Info_15_03","",""
"Scripts/content/Story/MISSIONS/DIA_Pc_Psionic.d:694","Die Gurus versuchen, Kontakt zum Schläfer herzustellen. Aber sie brauchen etwas, um ihre Kräfte zu bündeln.","Les Sages essayent d'entrer en contact avec le Dormeur. Mais ils ont besoin de quelque chose pour unir leurs puissances.","","","PC_Psionic_SEND_Info_05_04","",""
"Scripts/content/Story/MISSIONS/DIA_Pc_Psionic.d:695","Ja, und?","Ah, et ?","","","PC_Psionic_SEND_Info_15_05","",""
"Scripts/content/Story/MISSIONS/DIA_Pc_Psionic.d:696","Sie brauchen einen magischen Gegenstand, einen Fokus.","Ils ont besoin d'un objet magique, une pierre focale.","","","PC_Psionic_SEND_Info_05_06","",""
"Scripts/content/Story/MISSIONS/DIA_Pc_Psionic.d:710","Was kann ich dabei tun?","Que vas-tu obtenir de moi ?","","","PC_Psionic_BROTHERHOOD_TODO.description","",""
"Scripts/content/Story/MISSIONS/DIA_Pc_Psionic.d:723","Was kann ich dabei tun?","Que vas-tu obtenir de moi ?","","","PC_Psionic_BROTHERHOOD_TODO_15_01","",""
"Scripts/content/Story/MISSIONS/DIA_Pc_Psionic.d:724","Sprich mit Y'Berion. Er ist der mächtigste Mann hier. Dies ist die Gelegenheit, seine Gunst zu erringen.","Parle à Y'Bérion. Il est l'homme le plus puissant dans le coin. C'est l'occasion d'avoir sa faveur.","","","PC_Psionic_BROTHERHOOD_TODO_05_02","",""
"Scripts/content/Story/MISSIONS/DIA_Pc_Psionic.d:725","Wo finde ich ihn?","Où est-il ?","","","PC_Psionic_BROTHERHOOD_TODO_15_03","",""
"Scripts/content/Story/MISSIONS/DIA_Pc_Psionic.d:726","Geh zum Tempel. Er kommt selten dort heraus. Wahrscheinlich fühlt er sich in diesem kalten Gemäuer dem Schläfer näher.","Va au temple. Il le quitte rarement. Il se sent probablement plus près du Dormeur dans ces ruines froides.","","","PC_Psionic_BROTHERHOOD_TODO_05_04","",""
"Scripts/content/Story/MISSIONS/DIA_Pc_Psionic.d:772","Hey, was machst du denn hier?","Hé, que fais-tu ici ?","","","PC_Psionic_FOLLOWME_Info_05_01","",""
"Scripts/content/Story/MISSIONS/DIA_Pc_Psionic.d:773","Ich bin im Auftrag der Wassermagier unterwegs. Ich suche magische Artefakte, sogenannte Fokussteine.","Je suis envoyé ici sur l'ordre des Magiciens de l'Eau. Je suis à la recherche d'artefacts magiques, appelés pierres focales.","","","PC_Psionic_FOLLOWME_Info_15_02","",""
"Scripts/content/Story/MISSIONS/DIA_Pc_Psionic.d:774","Du bist auf der Suche nach den Fokussteinen? Das ist verdammt mutig.","tu recherches les pierres focales ? tu es vraiment courageux.","","","PC_Psionic_FOLLOWME_Info_05_03","",""
"Scripts/content/Story/MISSIONS/DIA_Pc_Psionic.d:775","Saturas und die anderen Magier aus dem Neuen Lager wollen damit die Barriere sprengen, die uns alle gefangen hält.","Saturas et les autres magiciens du Nouveau camp veulent l'utiliser pour exploser la barrière afin de nous libérer de cet emprisonnement.","","","PC_Psionic_FOLLOWME_Info_15_04","",""
"Scripts/content/Story/MISSIONS/DIA_Pc_Psionic.d:776","Das glaube ich erst, wenn ich es gesehen habe.","Je croirais cela quand je le verrais de mes propres yeux.","","","PC_Psionic_FOLLOWME_Info_05_05","",""
"Scripts/content/Story/MISSIONS/DIA_Pc_Psionic.d:777","Das geht mir ähnlich, aber erzähl, was führt dich her?","Je suis de ton avis. Mais dis-moi, pourquoi es-tu venu ici ?","","","PC_Psionic_FOLLOWME_Info_15_06","",""
"Scripts/content/Story/MISSIONS/DIA_Pc_Psionic.d:778","Ich wäge gerade ab, ob es sich lohnt, der Festung einen Besuch abzustatten.","Je me demande si ça vaut la peine de visiter le fort de la montagne.","","","PC_Psionic_FOLLOWME_Info_05_07","",""
"Scripts/content/Story/MISSIONS/DIA_Pc_Psionic.d:779","Es gibt nämlich eine alte Urkunde, die ich gerne in meiner Tasche hätte. Andererseits ist es nicht ganz ungefährlich, dort hineinzugehen.","Tu sais... il y a un document que j'ai eu comme ça. D'autre part c'est risqué d'entrer là- bas.","","","PC_Psionic_FOLLOWME_Info_05_08","",""
"Scripts/content/Story/MISSIONS/DIA_Pc_Psionic.d:789","Wie bist du eigentlich an dem wandelnden Steinhaufen vorbeigekommen?","Comment as-tu réussi passer cette montagne vivante ?","","","PC_Psionic_GOLEM.description","",""
"Scripts/content/Story/MISSIONS/DIA_Pc_Psionic.d:803","Wie bist du eigentlich an dem wandelnden Steinhaufen vorbeigekommen?","Comment as-tu réussi passer cette montagne vivante ?","","","PC_Psionic_NORMAL_Info_15_01","",""
"Scripts/content/Story/MISSIONS/DIA_Pc_Psionic.d:804","Ich habe einiges von den Gurus gelernt. Vor allem ihre Magie erweist sich immer wieder als sehr hilfreich.","J'ai appris beaucoup des Sages. Leur magie peut être vraiment utile.","","","PC_Psionic_NORMAL_Info_05_02","",""
"Scripts/content/Story/MISSIONS/DIA_Pc_Psionic.d:814","Was ist das für eine Urkunde, die du suchst?","Ce document que tu recherches... Qu'est-ce que c'est ?","","","PC_Psionic_STORY.description","",""
"Scripts/content/Story/MISSIONS/DIA_Pc_Psionic.d:827","Was ist das für eine Urkunde, die du suchst?","Ce document que tu recherches... Qu'est-ce que c'est ?","","","PC_Psionic_STORY_Info_15_01","",""
