"location","source","target","id","fuzzy","context","translator_comments","developer_comments"
"Scripts/content/Story/MISSIONS/DIA_Kdw_604_Cronos.d:298","Sicher ist die Bruderschaft ohne ihn besser dran!","La Confrérie est plus à l'aise sans lui !","","","Info_Cronos_KALOM_08_04","",""
"Scripts/content/Story/MISSIONS/DIA_Kdw_604_Cronos.d:299","Ich werde Saturas bei Gelegenheit davon berichten. Geh nun!","Je parlerais de lui à Saturas dès que j'en aurais la chance. Part maintenant !","","","Info_Cronos_KALOM_08_05","",""
"Scripts/content/Story/MISSIONS/DIA_Kdw_604_Cronos.d:313","Y'Berion, der Anführer des Sektenlagers, ist tot!","Y'Bérion, le chef du camp de la Secte, est mort !","","","Info_Cronos_YBERION.description","",""
"Scripts/content/Story/MISSIONS/DIA_Kdw_604_Cronos.d:326","Y'Berion, der Anführer des Sektenlagers, ist tot!","Y'Bérion, le chef du camp de la Secte, est mort !","","","Info_Cronos_YBERION_15_01","",""
"Scripts/content/Story/MISSIONS/DIA_Kdw_604_Cronos.d:327","WAAAS??? Wie konnte das geschehen?","HEIN ? ? ? Comment cela a t'il pu se produire ?","","","Info_Cronos_YBERION_08_02","",""
"Scripts/content/Story/MISSIONS/DIA_Kdw_604_Cronos.d:328","Die Bruderschaft führte ein Ritual durch, eine Anrufung ihres Gottes.","La Confrérie a exécuté un rituel, appelant leur dieu.","","","Info_Cronos_YBERION_15_03","",""
"Scripts/content/Story/MISSIONS/DIA_Kdw_604_Cronos.d:329","Die mentalen Anstrengungen waren wohl zu viel für Y'Berion.","Il semble que Y'Bérion n'a pas supporté cet effort mental.","","","Info_Cronos_YBERION_15_04","",""
"Scripts/content/Story/MISSIONS/DIA_Kdw_604_Cronos.d:330","Das ist sehr traurig. Y'Berion war ein zuverlässiger Verbündeter.","C'est très triste. Y'Bérion était un allié digne de confiance.","","","Info_Cronos_YBERION_08_05","",""
"Scripts/content/Story/MISSIONS/DIA_Kdw_604_Cronos.d:331","Aber es rechtfertigt nicht die Störung der Studien von Saturas.","Mais cela ne justifie pas l'interruption des études de Saturas.","","","Info_Cronos_YBERION_08_06","",""
"Scripts/content/Story/MISSIONS/DIA_Kdw_604_Cronos.d:345","Die Gurus haben erkannt, dass sie einen üblen Erzdämonen anbeten!","Les Sages ont reconnu qu'ils prient un démon de l'Archimonde !","","","Info_Cronos_SLEEPER.description","",""
"Scripts/content/Story/MISSIONS/DIA_Kdw_604_Cronos.d:358","Die Gurus haben erkannt, dass sie einen üblen Erzdämonen anbeten!","Les Sages ont reconnu qu'ils prient un démon de l'Archimonde !","","","Info_Cronos_SLEEPER_15_01","",""
"Scripts/content/Story/MISSIONS/DIA_Kdw_604_Cronos.d:359","Sie halten ihren Schläfer jetzt plötzlich für einen Dämonen?","Tout d'un coup ils se mettent à penser que leur Dormeur est un démon ?","","","Info_Cronos_SLEEPER_08_02","",""
"Scripts/content/Story/MISSIONS/DIA_Kdw_604_Cronos.d:360","Hört sich nach einer weiteren Verworrenheit der Bruderschaft an, aber ...","Cela ressemble à une autre idée folle de la Confrérie, mais...","","","Info_Cronos_SLEEPER_08_03","",""
"Scripts/content/Story/MISSIONS/DIA_Kdw_604_Cronos.d:361","... Sollten sie Recht haben ... könnten wir alle hier in der Kolonie in großer Gefahr sein.","... s'ils ont raison... nous pourrions tous ici dans la colonie courir un grave danger.","","","Info_Cronos_SLEEPER_08_04","",""
"Scripts/content/Story/MISSIONS/DIA_Kdw_604_Cronos.d:362","Das musst du sofort Saturas berichten. Er muss entscheiden, was zu tun ist.","Tu dois rapporter immédiatement cela à Saturas. Lui seul doit décider de ce qui doit être fait.","","","Info_Cronos_SLEEPER_08_05","",""
"Scripts/content/Story/MISSIONS/DIA_Kdw_604_Cronos.d:363","Wo finde ich Saturas?","Où puis-je trouver Saturas ?","","","Info_Cronos_SLEEPER_15_06","",""
"Scripts/content/Story/MISSIONS/DIA_Kdw_604_Cronos.d:364","Begib dich zur obersten Ebene. Sage den Wachen dort, du hast meine Erlaubnis zum passieren.","Va au niveau supérieur. Là, dis aux gardes que tu as mon autorisation pour passer.","","","Info_Cronos_SLEEPER_08_07","",""
"Scripts/content/Story/MISSIONS/DIA_Kdw_604_Cronos.d:365","Die Parole lautet TETRIANDOCH.","Le mot de passe est TETRIANDOCH.","","","Info_Cronos_SLEEPER_08_08","",""
"Scripts/content/Story/MISSIONS/DIA_Kdw_604_Cronos.d:366","Saturas findest du beim großen Pentagramm.","Saturas est au pentacle.","","","Info_Cronos_SLEEPER_08_09","",""
"Scripts/content/Story/MISSIONS/DIA_Kdw_604_Cronos.d:367","Er gibt sich dort fast den ganzen Tag seinen Studien über die Sprengung des großen Erzhaufens hin.","Il passe presque toute la journée là, étudiant la façon de faire sauter le grand tas de minerai.","","","Info_Cronos_SLEEPER_08_10","",""
"Scripts/content/Story/MISSIONS/DIA_Kdw_604_Cronos.d:385","Wie war die Parole nochmal?","Quel était le mot de passe déjà ?","","","Info_Cronos_PAROLE.description","",""
"Scripts/content/Story/MISSIONS/DIA_Kdw_604_Cronos.d:398","Wie war die Parole noch mal?","Quel était le mot de passe déjà ?","","","Info_Cronos_PAROLE_15_01","",""
"Scripts/content/Story/MISSIONS/DIA_Kdw_604_Cronos.d:399","Du bist vergesslicher als meine Großmutter. Sie lautet 'TETRIANDOCH","Tu es plus écervelé que ma grand-mère. C'est 'TETRIANDOCH'","","False","Info_Cronos_PAROLE_08_02","",""
"Scripts/content/Story/MISSIONS/DIA_Kdw_604_Cronos.d:411","Saturas sagte, du hättest eine Belohnung für mich.","Saturas a dit que vous aviez une récompense pour moi.","","","Info_Cronos_REWARD.description","",""
"Scripts/content/Story/MISSIONS/DIA_Kdw_604_Cronos.d:424","Saturas sagte, du hättest eine Belohnung für mich.","Saturas a dit que vous aviez une récompense pour moi.","","","Info_Cronos_REWARD_15_01","",""
"Scripts/content/Story/MISSIONS/DIA_Kdw_604_Cronos.d:425","Als Hüter des Erzes möchte ich für deine großen Dienste für unser Lager einen kleinen Teil des Erzes in deine Hände geben.","En tant que gardien du minerai, j'aimerai t'offrir une petite partie de notre minerai pour te remercier de tes grandes actions au nom du camp.","","","Info_Cronos_REWARD_08_02","",""
"Scripts/content/Story/MISSIONS/DIA_Kdw_604_Cronos.d:426","Ich hoffe, du hast eine ebenso sinnvolle Verwendung wie wir dafür!","J'espère que tu en feras un aussi bon usage que nous !","","","Info_Cronos_REWARD_08_03","",""
"Scripts/content/Story/MISSIONS/DIA_Kdw_604_Cronos.d:459","Deine Entscheidung, zu den Wassermagiern zu kommen, war richtig. Willkommen, Bruder!","Ta décision de rejoindre les Magiciens de l'Eau était bonne. Sois le bienvenu, mon frère !","","","KDW_604_Cronos_WELCOME_Info_08_01","",""
"Scripts/content/Story/MISSIONS/DIA_Kdw_604_Cronos.d:474","Ich benötige mehr magische Kraft","J'ai besoin de plus de pouvoir magique.","","False","KDW_604_Cronos_MANA.description","",""
"Scripts/content/Story/MISSIONS/DIA_Kdw_604_Cronos.d:488","Ich benötige mehr magische Kraft","J'ai besoin de plus de pouvoir magique.","","False","KDW_604_Cronos_MANA_Info_15_01","",""
"Scripts/content/Story/MISSIONS/DIA_Kdw_604_Cronos.d:489","Ich kann dir helfen, deine Kraft zu steigern. Setze sie mit Bedacht ein!","Je peux t'aider à augmenter ton pouvoir. Utilise-le avec sagesse.","","","KDW_604_Cronos_MANA_Info_08_02","",""
"Scripts/content/Story/MISSIONS/DIA_Kdw_604_Cronos.d:545","Ich möchte Schriften über Magie erwerben.","Je veux acquérir des écrits magiques.","","","KDW_604_Cronos_SELLSTUFF_Info_15_01","",""
"Scripts/content/Story/MISSIONS/DIA_Kdw_604_Cronos.d:557","Ich grüße dich, Magier","Salutations, Magicien.","","False","KDW_604_Cronos_GREET.description","",""
"Scripts/content/Story/MISSIONS/DIA_Kdw_604_Cronos.d:567","Ich grüße dich, Magier.","Salutations, Magicien.","","","KDW_604_Cronos_GREET_Info_15_01","",""
"Scripts/content/Story/MISSIONS/DIA_Kdw_604_Cronos.d:568","Der Segen Adanos sei mit dir. Ich kann dir helfen, deine geistige Kraft zu stärken oder dir ein paar nützliche Dinge anbieten.","Puisse la bénédiction d'Adanos soit sur toi. Je peux t'aider à augmenter tes pouvoirs magiques ou te donner quelques objets utiles.","","","KDW_604_Cronos_GREET_Info_08_02","",""
"Scripts/content/Story/MISSIONS/DIA_Kdw_604_Cronos.d:569","Was kann ich für dich tun?","Qu'est-ce que je peux faire pour toi ?","","","KDW_604_Cronos_GREET_Info_08_03","",""
"Scripts/content/Story/MISSIONS/DIA_Kdw_605_Riordian.d:44","Saturas schickt mich.","Saturas m'a envoyé.","","","Info_Riordian_NEWS.description","",""
"Scripts/content/Story/MISSIONS/DIA_Kdw_605_Riordian.d:57","Saturas schickt mich.","Saturas m'a envoyé.","","","Info_Riordian_NEWS_15_01","",""
"Scripts/content/Story/MISSIONS/DIA_Kdw_605_Riordian.d:58","Ahhh, komm näher. Ich bin bereits informiert.","Ahhh, viens ici. J'étais déjà au courant.","","","Info_Riordian_NEWS_14_02","",""
"Scripts/content/Story/MISSIONS/DIA_Kdw_605_Riordian.d:59","Hier nimm diese Tränke, da ist von jedem was dabei.","Là, prends ces potions, il y en a de toutes sortes.","","","Info_Riordian_NEWS_14_03","",""
"Scripts/content/Story/MISSIONS/DIA_Kdw_605_Riordian.d:60","Nun geh und bring uns die Fokussteine. Diese Artefakte sind unsere einzige Hoffnung.","Va maintenant, et rapporte-nous les pierres focales. Ces artefacts sont notre seul espoir.","","","Info_Riordian_NEWS_14_04","",""
"Scripts/content/Story/MISSIONS/DIA_Kdw_605_Riordian.d:85","Saturas sagt, du hättest eine Belohnung für mich?","Saturas a dit que tu avais une récompense pour moi ?","","","Info_Riordian_REWARD.description","",""
"Scripts/content/Story/MISSIONS/DIA_Kdw_605_Riordian.d:98","Saturas sagt, du hättest eine Belohnung für mich?","Saturas a dit que tu avais une récompense pour moi ?","","","Info_Riordian_REWARD_15_01","",""
"Scripts/content/Story/MISSIONS/DIA_Kdw_605_Riordian.d:99","Ahhhh, komm näher, komm näher.","Ahhhh, viens ici, viens ici.","","","Info_Riordian_REWARD_14_02","",""
"Scripts/content/Story/MISSIONS/DIA_Kdw_605_Riordian.d:100","Unser spiritueller Führer hat mir von deinen Heldentaten berichtet.","Notre chef spirituel m'a parlé de tes actes héroïques.","","","Info_Riordian_REWARD_14_03","",""
"Scripts/content/Story/MISSIONS/DIA_Kdw_605_Riordian.d:101","Wir alle hier im Lager, ja in der ganzen Kolonie sind dir zu großem Dank verpflichtet.","Toutes les personnes dans le camp - non, toute la colonie - te doivent beaucoup..","","","Info_Riordian_REWARD_14_04","",""
"Scripts/content/Story/MISSIONS/DIA_Kdw_605_Riordian.d:102","Nimm dies als einen bescheidenen Ausgleich für all deine Mühen.","Prends ceci en modeste récompense de tous tes efforts.","","","Info_Riordian_REWARD_14_05","",""
"Scripts/content/Story/MISSIONS/DIA_Kdw_605_Riordian.d:153","Gut, dass du kommst! Ich habe schon auf dich gewartet!","Je suis heureux que tu sois venu ! Je t'attendais !","","","Info_Riordian_MESSAGE_14_01","",""
"Scripts/content/Story/MISSIONS/DIA_Kdw_605_Riordian.d:165","Du hast auf mich gewartet? Warum?","Tu m'as attendu ? Pourquoi ?","","","Info_Riordian_MESSAGEWHY.description","",""
"Scripts/content/Story/MISSIONS/DIA_Kdw_605_Riordian.d:178","Du hast auf mich gewartet? Warum?","Tu m'as attendu ? Pourquoi ?","","","Info_Riordian_MESSAGEWHY_15_01","",""
"Scripts/content/Story/MISSIONS/DIA_Kdw_605_Riordian.d:179","Gorn bat mich, dich bei deinem Auftauchen hier sofort zu ihm zu schicken!","Gorn m'a demandé de t'envoyer à lui dès ton arrivée !","","","Info_Riordian_MESSAGEWHY_14_02","",""
"Scripts/content/Story/MISSIONS/DIA_Kdw_605_Riordian.d:180","Was ist los?","Ca va ?","","","Info_Riordian_MESSAGEWHY_15_03","",""
"Scripts/content/Story/MISSIONS/DIA_Kdw_605_Riordian.d:181","Er hat einen Plan zur Befreiung der besetzten Mine.","Il a un plan pour libérer la mine occupée.","","","Info_Riordian_MESSAGEWHY_14_04","",""
"Scripts/content/Story/MISSIONS/DIA_Kdw_605_Riordian.d:182","Bewacht er noch den Zugang zur Mine?","Garde-t-il encore l'entrée de la mine ?","","","Info_Riordian_MESSAGEWHY_15_05","",""
"Scripts/content/Story/MISSIONS/DIA_Kdw_605_Riordian.d:183","Ja! Bitte suche ihn so schnell wie möglich auf!","Oui ! Va le voir le plus vite possible !","","","Info_Riordian_MESSAGEWHY_14_06","",""
"Scripts/content/Story/MISSIONS/DIA_Kdw_605_Riordian.d:207","Gut, dass du uns beigetreten bist.","Je suis content de te voir que tu nous as rejoints.","","","KDW_605_Riordian_WELCOME_Info_14_01","",""
"Scripts/content/Story/MISSIONS/DIA_Kdw_605_Riordian.d:230","Wenn du verletzt bist, werde ich dich heilen.","Si tu es blessé, je te soignerai.","","","KDW_605_Riordian_HEAL_Info_14_01","",""
"Scripts/content/Story/MISSIONS/DIA_Kdw_605_Riordian.d:241","Ich bin verletzt. Kannst du mich heilen?","Je suis blessé. Pouvez-vous me guérir ?","","","KDW_605_Riordian_HEALINFO.description","",""
"Scripts/content/Story/MISSIONS/DIA_Kdw_605_Riordian.d:255","Ich bin verletzt. Kannst du mich heilen?","Je suis blessé. Pouvez-vous me guérir ?","","","KDW_605_Riordian_HEALINFO_Info_15_01","",""
"Scripts/content/Story/MISSIONS/DIA_Kdw_605_Riordian.d:256","Durch mein Wort rufe ich die Kraft der Heilung und lasse diesen Körper und den Geist gesunden!","Par mes mots,  j'appelle les puissances de guérison, ta corps et l'esprit vont aller mieux !","","","KDW_605_Riordian_HEALINFO_Info_14_02","",""
"Scripts/content/Story/MISSIONS/DIA_Kdw_605_Riordian.d:271","Ich grüße dich Magier","Salutations, Magicien !","","False","KDW_605_Riordian_GREET.description","",""
"Scripts/content/Story/MISSIONS/DIA_Kdw_605_Riordian.d:281","Ich grüße dich Magier!","Salutations, Magicien !","","","KDW_605_Riordian_GREET_Info_15_01","",""
"Scripts/content/Story/MISSIONS/DIA_Kdw_605_Riordian.d:282","Ich bin Riordian, der Alchemist. Du willst bestimmt einen Trank?","Je suis Riordian, l'alchimiste. Je suppose que tu veux une potion ?","","","KDW_605_Riordian_GREET_Info_14_02","",""
"Scripts/content/Story/MISSIONS/DIA_Kdw_605_Riordian.d:298","Zeig mir deine Ware","Montre moi tes marchandises.","","False","KDW_605_Riordian_TRADE.description","",""
"Scripts/content/Story/MISSIONS/DIA_Kdw_605_Riordian.d:311","Zeig mir deine Ware.","Montre moi tes marchandises.","","","KDW_605_Riordian_TRADE_Info_15_01","",""
