"location","source","target","id","fuzzy","context","translator_comments","developer_comments"
"Scripts/content/Story/MISSIONS/DIA_Kdw_604_Cronos.d:296","Er will unbedingt den Schläfer auf eigene Faust finden und ihn erwecken.","He wants to find the Sleeper on his own and wake him up at all costs.","","","Info_Cronos_KALOM_15_02","",""
"Scripts/content/Story/MISSIONS/DIA_Kdw_604_Cronos.d:297","Ich habe ihm noch nie getraut. Zweiter Guru hin oder her, er ist verblendet, hinterhältig und zu allem fähig.","I've never trusted him. Second Guru or not, he's vain, insidious and he's capable of anything.","","","Info_Cronos_KALOM_08_03","",""
"Scripts/content/Story/MISSIONS/DIA_Kdw_604_Cronos.d:298","Sicher ist die Bruderschaft ohne ihn besser dran!","The Brotherhood is better off without him!","","","Info_Cronos_KALOM_08_04","",""
"Scripts/content/Story/MISSIONS/DIA_Kdw_604_Cronos.d:299","Ich werde Saturas bei Gelegenheit davon berichten. Geh nun!","I'll tell Saturas about it as soon as I get the chance. Leave now!","","","Info_Cronos_KALOM_08_05","",""
"Scripts/content/Story/MISSIONS/DIA_Kdw_604_Cronos.d:313","Y'Berion, der Anführer des Sektenlagers, ist tot!","Y'Berion, the leader of the Sect Camp, is dead!","","","Info_Cronos_YBERION.description","",""
"Scripts/content/Story/MISSIONS/DIA_Kdw_604_Cronos.d:326","Y'Berion, der Anführer des Sektenlagers, ist tot!","Y'Berion, the leader of the Sect Camp, is dead!","","","Info_Cronos_YBERION_15_01","",""
"Scripts/content/Story/MISSIONS/DIA_Kdw_604_Cronos.d:327","WAAAS??? Wie konnte das geschehen?","WHAAAAT??? How could that happen?","","","Info_Cronos_YBERION_08_02","",""
"Scripts/content/Story/MISSIONS/DIA_Kdw_604_Cronos.d:328","Die Bruderschaft führte ein Ritual durch, eine Anrufung ihres Gottes.","The Brotherhood performed a ritual, invoking their god.","","","Info_Cronos_YBERION_15_03","",""
"Scripts/content/Story/MISSIONS/DIA_Kdw_604_Cronos.d:329","Die mentalen Anstrengungen waren wohl zu viel für Y'Berion.","It seems the mental strain was too much for Y'Berion.","","","Info_Cronos_YBERION_15_04","",""
"Scripts/content/Story/MISSIONS/DIA_Kdw_604_Cronos.d:330","Das ist sehr traurig. Y'Berion war ein zuverlässiger Verbündeter.","That's very sad. Y'Berion was a reliable ally.","","","Info_Cronos_YBERION_08_05","",""
"Scripts/content/Story/MISSIONS/DIA_Kdw_604_Cronos.d:331","Aber es rechtfertigt nicht die Störung der Studien von Saturas.","But it's no reason to justify interrupting Saturas' studies.","","","Info_Cronos_YBERION_08_06","",""
"Scripts/content/Story/MISSIONS/DIA_Kdw_604_Cronos.d:345","Die Gurus haben erkannt, dass sie einen üblen Erzdämonen anbeten!","The Gurus have recognized that they're praying to an evil arch demon!","","","Info_Cronos_SLEEPER.description","",""
"Scripts/content/Story/MISSIONS/DIA_Kdw_604_Cronos.d:358","Die Gurus haben erkannt, dass sie einen üblen Erzdämonen anbeten!","The Gurus have recognized that they're praying to an evil arch demon!","","","Info_Cronos_SLEEPER_15_01","",""
"Scripts/content/Story/MISSIONS/DIA_Kdw_604_Cronos.d:359","Sie halten ihren Schläfer jetzt plötzlich für einen Dämonen?","All of a sudden they now think their Sleeper is a demon?","","","Info_Cronos_SLEEPER_08_02","",""
"Scripts/content/Story/MISSIONS/DIA_Kdw_604_Cronos.d:360","Hört sich nach einer weiteren Verworrenheit der Bruderschaft an, aber ...","Sounds like another mad idea of the Brotherhood, but...","","","Info_Cronos_SLEEPER_08_03","",""
"Scripts/content/Story/MISSIONS/DIA_Kdw_604_Cronos.d:361","... Sollten sie Recht haben ... könnten wir alle hier in der Kolonie in großer Gefahr sein.","... should they be right... all of us in the colony here might be in grave danger.","","","Info_Cronos_SLEEPER_08_04","",""
"Scripts/content/Story/MISSIONS/DIA_Kdw_604_Cronos.d:362","Das musst du sofort Saturas berichten. Er muss entscheiden, was zu tun ist.","You must report to Saturas at once. He must decide what is to be done.","","","Info_Cronos_SLEEPER_08_05","",""
"Scripts/content/Story/MISSIONS/DIA_Kdw_604_Cronos.d:363","Wo finde ich Saturas?","Where can I find Saturas?","","","Info_Cronos_SLEEPER_15_06","",""
"Scripts/content/Story/MISSIONS/DIA_Kdw_604_Cronos.d:364","Begib dich zur obersten Ebene. Sage den Wachen dort, du hast meine Erlaubnis zum passieren.","Go to the upper level. Tell the guards there that you have my permission to pass.","","","Info_Cronos_SLEEPER_08_07","",""
"Scripts/content/Story/MISSIONS/DIA_Kdw_604_Cronos.d:365","Die Parole lautet TETRIANDOCH.","The password is TETRIANDOCH.","","","Info_Cronos_SLEEPER_08_08","",""
"Scripts/content/Story/MISSIONS/DIA_Kdw_604_Cronos.d:366","Saturas findest du beim großen Pentagramm.","Saturas is by the pentagram.","","","Info_Cronos_SLEEPER_08_09","",""
"Scripts/content/Story/MISSIONS/DIA_Kdw_604_Cronos.d:367","Er gibt sich dort fast den ganzen Tag seinen Studien über die Sprengung des großen Erzhaufens hin.","He spends almost all day there, studying how to blow up the big ore mound.","","","Info_Cronos_SLEEPER_08_10","",""
"Scripts/content/Story/MISSIONS/DIA_Kdw_604_Cronos.d:385","Wie war die Parole nochmal?","What was the password again?","","","Info_Cronos_PAROLE.description","",""
"Scripts/content/Story/MISSIONS/DIA_Kdw_604_Cronos.d:398","Wie war die Parole noch mal?","What was the password again?","","","Info_Cronos_PAROLE_15_01","",""
"Scripts/content/Story/MISSIONS/DIA_Kdw_604_Cronos.d:399","Du bist vergesslicher als meine Großmutter. Sie lautet 'TETRIANDOCH","You're more of a scatterbrain than my old granny. It is ''TETRIANDOCH","","","Info_Cronos_PAROLE_08_02","",""
"Scripts/content/Story/MISSIONS/DIA_Kdw_604_Cronos.d:411","Saturas sagte, du hättest eine Belohnung für mich.","Saturas said you had a reward for me.","","","Info_Cronos_REWARD.description","",""
"Scripts/content/Story/MISSIONS/DIA_Kdw_604_Cronos.d:424","Saturas sagte, du hättest eine Belohnung für mich.","Saturas said you had a reward for me.","","","Info_Cronos_REWARD_15_01","",""
"Scripts/content/Story/MISSIONS/DIA_Kdw_604_Cronos.d:425","Als Hüter des Erzes möchte ich für deine großen Dienste für unser Lager einen kleinen Teil des Erzes in deine Hände geben.","As the keeper of the ore, I'd like to give you a small portion of our ore for your great deeds on behalf of the Camp.","","","Info_Cronos_REWARD_08_02","",""
"Scripts/content/Story/MISSIONS/DIA_Kdw_604_Cronos.d:426","Ich hoffe, du hast eine ebenso sinnvolle Verwendung wie wir dafür!","I hope you'll make as good use of it as we do!","","","Info_Cronos_REWARD_08_03","",""
"Scripts/content/Story/MISSIONS/DIA_Kdw_604_Cronos.d:459","Deine Entscheidung, zu den Wassermagiern zu kommen, war richtig. Willkommen, Bruder!","Your decision to join the Magicians of Water was right. Be welcome, brother!","","","KDW_604_Cronos_WELCOME_Info_08_01","",""
"Scripts/content/Story/MISSIONS/DIA_Kdw_604_Cronos.d:474","Ich benötige mehr magische Kraft","I need more magic power.","","","KDW_604_Cronos_MANA.description","",""
"Scripts/content/Story/MISSIONS/DIA_Kdw_604_Cronos.d:488","Ich benötige mehr magische Kraft","I need more magic power.","","","KDW_604_Cronos_MANA_Info_15_01","",""
"Scripts/content/Story/MISSIONS/DIA_Kdw_604_Cronos.d:489","Ich kann dir helfen, deine Kraft zu steigern. Setze sie mit Bedacht ein!","I can help you to increase your power. Use it wisely.","","","KDW_604_Cronos_MANA_Info_08_02","",""
"Scripts/content/Story/MISSIONS/DIA_Kdw_604_Cronos.d:545","Ich möchte Schriften über Magie erwerben.","I want to acquire magic writings.","","","KDW_604_Cronos_SELLSTUFF_Info_15_01","",""
"Scripts/content/Story/MISSIONS/DIA_Kdw_604_Cronos.d:557","Ich grüße dich, Magier","Greetings, Magician.","","","KDW_604_Cronos_GREET.description","",""
"Scripts/content/Story/MISSIONS/DIA_Kdw_604_Cronos.d:567","Ich grüße dich, Magier.","Greetings, Magician.","","","KDW_604_Cronos_GREET_Info_15_01","",""
"Scripts/content/Story/MISSIONS/DIA_Kdw_604_Cronos.d:568","Der Segen Adanos sei mit dir. Ich kann dir helfen, deine geistige Kraft zu stärken oder dir ein paar nützliche Dinge anbieten.","May the blessing of Adanos be with you. I can help you to increase your magic powers or give you some useful items.","","","KDW_604_Cronos_GREET_Info_08_02","",""
"Scripts/content/Story/MISSIONS/DIA_Kdw_604_Cronos.d:569","Was kann ich für dich tun?","What can I do for you?","","","KDW_604_Cronos_GREET_Info_08_03","",""
"Scripts/content/Story/MISSIONS/DIA_Kdw_605_Riordian.d:44","Saturas schickt mich.","Saturas sent me.","","","Info_Riordian_NEWS.description","",""
"Scripts/content/Story/MISSIONS/DIA_Kdw_605_Riordian.d:57","Saturas schickt mich.","Saturas sent me.","","","Info_Riordian_NEWS_15_01","",""
"Scripts/content/Story/MISSIONS/DIA_Kdw_605_Riordian.d:58","Ahhh, komm näher. Ich bin bereits informiert.","Ahhh, come here. I've already been informed.","","","Info_Riordian_NEWS_14_02","",""
"Scripts/content/Story/MISSIONS/DIA_Kdw_605_Riordian.d:59","Hier nimm diese Tränke, da ist von jedem was dabei.","Here, take these potions, they're potions of all kinds.","","","Info_Riordian_NEWS_14_03","",""
"Scripts/content/Story/MISSIONS/DIA_Kdw_605_Riordian.d:60","Nun geh und bring uns die Fokussteine. Diese Artefakte sind unsere einzige Hoffnung.","Now go and bring us the focus stones. These artefacts are our only hope.","","","Info_Riordian_NEWS_14_04","",""
"Scripts/content/Story/MISSIONS/DIA_Kdw_605_Riordian.d:85","Saturas sagt, du hättest eine Belohnung für mich?","Saturas said you had a reward for me?","","","Info_Riordian_REWARD.description","",""
"Scripts/content/Story/MISSIONS/DIA_Kdw_605_Riordian.d:98","Saturas sagt, du hättest eine Belohnung für mich?","Saturas said you had a reward for me?","","","Info_Riordian_REWARD_15_01","",""
"Scripts/content/Story/MISSIONS/DIA_Kdw_605_Riordian.d:99","Ahhhh, komm näher, komm näher.","Ahhhh, come here, come here.","","","Info_Riordian_REWARD_14_02","",""
"Scripts/content/Story/MISSIONS/DIA_Kdw_605_Riordian.d:100","Unser spiritueller Führer hat mir von deinen Heldentaten berichtet.","Our spiritual leader has told me about your heroic deeds.","","","Info_Riordian_REWARD_14_03","",""
"Scripts/content/Story/MISSIONS/DIA_Kdw_605_Riordian.d:101","Wir alle hier im Lager, ja in der ganzen Kolonie sind dir zu großem Dank verpflichtet.","All the people in the Camp - no, the whole colony -are deeply indebted to you.","","","Info_Riordian_REWARD_14_04","",""
"Scripts/content/Story/MISSIONS/DIA_Kdw_605_Riordian.d:102","Nimm dies als einen bescheidenen Ausgleich für all deine Mühen.","Take this as a modest reward for all your efforts.","","","Info_Riordian_REWARD_14_05","",""
"Scripts/content/Story/MISSIONS/DIA_Kdw_605_Riordian.d:153","Gut, dass du kommst! Ich habe schon auf dich gewartet!","I'm glad you've come! I've been expecting you!","","","Info_Riordian_MESSAGE_14_01","",""
"Scripts/content/Story/MISSIONS/DIA_Kdw_605_Riordian.d:165","Du hast auf mich gewartet? Warum?","You've been expecting me? Why?","","","Info_Riordian_MESSAGEWHY.description","",""
"Scripts/content/Story/MISSIONS/DIA_Kdw_605_Riordian.d:178","Du hast auf mich gewartet? Warum?","You've been expecting me? Why?","","","Info_Riordian_MESSAGEWHY_15_01","",""
"Scripts/content/Story/MISSIONS/DIA_Kdw_605_Riordian.d:179","Gorn bat mich, dich bei deinem Auftauchen hier sofort zu ihm zu schicken!","Gorn asked me to send you to him as soon as you arrived!","","","Info_Riordian_MESSAGEWHY_14_02","",""
"Scripts/content/Story/MISSIONS/DIA_Kdw_605_Riordian.d:180","Was ist los?","What's up?","","","Info_Riordian_MESSAGEWHY_15_03","",""
"Scripts/content/Story/MISSIONS/DIA_Kdw_605_Riordian.d:181","Er hat einen Plan zur Befreiung der besetzten Mine.","He has a plan to free the occupied mine.","","","Info_Riordian_MESSAGEWHY_14_04","",""
"Scripts/content/Story/MISSIONS/DIA_Kdw_605_Riordian.d:182","Bewacht er noch den Zugang zur Mine?","Is he still guarding the entrance to the mine?","","","Info_Riordian_MESSAGEWHY_15_05","",""
"Scripts/content/Story/MISSIONS/DIA_Kdw_605_Riordian.d:183","Ja! Bitte suche ihn so schnell wie möglich auf!","Yes! Please see him as soon as possible!","","","Info_Riordian_MESSAGEWHY_14_06","",""
"Scripts/content/Story/MISSIONS/DIA_Kdw_605_Riordian.d:207","Gut, dass du uns beigetreten bist.","I'm glad you've joined us.","","","KDW_605_Riordian_WELCOME_Info_14_01","",""
"Scripts/content/Story/MISSIONS/DIA_Kdw_605_Riordian.d:230","Wenn du verletzt bist, werde ich dich heilen.","If you're injured, I will heal you.","","","KDW_605_Riordian_HEAL_Info_14_01","",""
"Scripts/content/Story/MISSIONS/DIA_Kdw_605_Riordian.d:241","Ich bin verletzt. Kannst du mich heilen?","I'm injured. Can you heal me?","","","KDW_605_Riordian_HEALINFO.description","",""
"Scripts/content/Story/MISSIONS/DIA_Kdw_605_Riordian.d:255","Ich bin verletzt. Kannst du mich heilen?","I'm injured. Can you heal me?","","","KDW_605_Riordian_HEALINFO_Info_15_01","",""
"Scripts/content/Story/MISSIONS/DIA_Kdw_605_Riordian.d:256","Durch mein Wort rufe ich die Kraft der Heilung und lasse diesen Körper und den Geist gesunden!","Through my words I call upon the powers of healing, your body and spirit shall be well!","","","KDW_605_Riordian_HEALINFO_Info_14_02","",""
"Scripts/content/Story/MISSIONS/DIA_Kdw_605_Riordian.d:271","Ich grüße dich Magier","Greetings, Magician!","","","KDW_605_Riordian_GREET.description","",""
"Scripts/content/Story/MISSIONS/DIA_Kdw_605_Riordian.d:281","Ich grüße dich Magier!","Greetings, Magician!","","","KDW_605_Riordian_GREET_Info_15_01","",""
"Scripts/content/Story/MISSIONS/DIA_Kdw_605_Riordian.d:282","Ich bin Riordian, der Alchemist. Du willst bestimmt einen Trank?","I am Riordian, the alchemist. I gather you want a potion?","","","KDW_605_Riordian_GREET_Info_14_02","",""
"Scripts/content/Story/MISSIONS/DIA_Kdw_605_Riordian.d:298","Zeig mir deine Ware","Show me your goods.","","","KDW_605_Riordian_TRADE.description","",""
"Scripts/content/Story/MISSIONS/DIA_Kdw_605_Riordian.d:311","Zeig mir deine Ware.","Show me your goods.","","","KDW_605_Riordian_TRADE_Info_15_01","",""
