"location","source","target","id","fuzzy","context","translator_comments","developer_comments"
"Scripts/content/Story/MISSIONS/DIA_Kdw_600_Saturas.d:19","Mögest du in einem Stück zurückkehren!","May you return in one piece!","","","Info_Saturas_EXIT_14_01","",""
"Scripts/content/Story/MISSIONS/DIA_Kdw_600_Saturas.d:45","Was machst du hier? Du hast hier nichts zu suchen! Verschwinde!","What are you doing here? You've no business here! Scram!","","","Info_Saturas_Intruder_14_00","",""
"Scripts/content/Story/MISSIONS/DIA_Kdw_600_Saturas.d:67","Ich habe wichtige Neuigkeiten aus dem Lager der Bruderschaft!","I have important news from the Brotherhood's camp!","","","Info_Saturas_NEWS.description","",""
"Scripts/content/Story/MISSIONS/DIA_Kdw_600_Saturas.d:80","Ich habe wichtige Neuigkeiten aus dem Lager der Bruderschaft!","I have important news from the Brotherhood's camp!","","","Info_Saturas_NEWS_15_01","",""
"Scripts/content/Story/MISSIONS/DIA_Kdw_600_Saturas.d:81","Wenn dir Cronos die Erlaubnis gab, mich aufzusuchen, müssen es in der Tat wichtige Nachrichten sein!","If Cronos gave you permission to visit me, it must be important news indeed!","","","Info_Saturas_NEWS_14_02","",""
"Scripts/content/Story/MISSIONS/DIA_Kdw_600_Saturas.d:93","Y'Berion ist tot","Y'Berion is dead!","","","Info_Saturas_YBERION.description","",""
"Scripts/content/Story/MISSIONS/DIA_Kdw_600_Saturas.d:106","Y'Berion ist tot! Er starb bei einer großen rituellen Anrufung des Schläfers.","Y'Berion is dead! He died during the ritual invocation of the Sleeper.","","","Info_Saturas_YBERION_15_01","",""
"Scripts/content/Story/MISSIONS/DIA_Kdw_600_Saturas.d:107","Y'Berion tot? Das sind schlechte Nachrichten, sehr schlechte Nachrichten!","Y'Berion dead? That's bad news, very bad news indeed!","","","Info_Saturas_YBERION_14_02","",""
"Scripts/content/Story/MISSIONS/DIA_Kdw_600_Saturas.d:108","Wer hat die Führung der Bruderschaft übernommen? Dieser machtgierige, verschlagene Cor Kalom?","Who's leading the Brotherhood now? That power-hungry and deceitful Cor Kalom?","","","Info_Saturas_YBERION_14_03","",""
"Scripts/content/Story/MISSIONS/DIA_Kdw_600_Saturas.d:109","Nein! Kalom hat der Bruderschaft den Rücken gekehrt. Er hat einige Templer mitgenommen. Niemand weiß, wohin sie aufgebrochen sind.","No! Kalom has turned his back on the Brotherhood. He's taken some templars with him. Nobody knows where they've gone.","","","Info_Saturas_YBERION_15_04","",""
"Scripts/content/Story/MISSIONS/DIA_Kdw_600_Saturas.d:110","Warum das? Er war doch der zweite Mann nach Y'Berion!","Why is that? He was in second place after Y'Berion!","","","Info_Saturas_YBERION_14_05","",""
"Scripts/content/Story/MISSIONS/DIA_Kdw_600_Saturas.d:111","Gewisse Ereignisse haben die Gurus davon überzeugt, dass der Weg ihres Gottes der falsche ist. Er scheint ein Erzdämon zu sein, der nur Böses im Schilde führt.","Certain events have convinced the Gurus that their way is the wrong one. Their god seems to be an evil arch demon.","","","Info_Saturas_YBERION_15_06","",""
"Scripts/content/Story/MISSIONS/DIA_Kdw_600_Saturas.d:112","Einer der Gurus hat mich unter dem Einfluss des Schläfers fast umgebracht, obwohl ich eben diesem Mann kurz zuvor das Leben gerettet hatte.","One of the Gurus nearly killed me under the influence of the Sleeper, although I had saved his life just briefly beforehand.","","","Info_Saturas_YBERION_15_07","",""
"Scripts/content/Story/MISSIONS/DIA_Kdw_600_Saturas.d:113","Cor Kalom war der einzige Guru, der die wahre Natur der Höllenkreatur nicht sehen wollte und hat daher das Lager im Sumpf verlassen.","Cor Kalom was the only Guru who didn't want to admit the true nature of the hellish creature, that's why he's left the camp in the swamp.","","","Info_Saturas_YBERION_15_08","",""
"Scripts/content/Story/MISSIONS/DIA_Kdw_600_Saturas.d:114","Ich verstehe! Nun, das ist Glück im Unglück, denn Cor Angar ist ein guter Mann. Hart, aber ehrlich.","I see! Well, at least we are lucky in this regard. Cor Angar is a good man. He's tough, but honest.","","","Info_Saturas_YBERION_14_09","",""
"Scripts/content/Story/MISSIONS/DIA_Kdw_600_Saturas.d:115","Wenn jemand den Zerfall der Bruderschaft nach dieser spirituellen Katastrophe verhindern kann, ist er es.","If anybody could prevent the Brotherhood from falling apart after this spiritual catastrophe, he can.","","","Info_Saturas_YBERION_14_10","",""
"Scripts/content/Story/MISSIONS/DIA_Kdw_600_Saturas.d:129","Ich habe diesen Almanach hier","I have this almanac...","","","Info_Saturas_BOOK.description","",""
"Scripts/content/Story/MISSIONS/DIA_Kdw_600_Saturas.d:142","Ich habe diesen Almanach hier ...","I have this almanac...","","","Info_Saturas_BOOK_15_01","",""
"Scripts/content/Story/MISSIONS/DIA_Kdw_600_Saturas.d:143","Y'Berion hatte ihn benutzt, um den Fokus aufzuladen.","Y'Berion used it to charge the focus.","","","Info_Saturas_BOOK_15_02","",""
"Scripts/content/Story/MISSIONS/DIA_Kdw_600_Saturas.d:144","Sehr gut. Wir benötigen das Wissen aus diesem Buch, um alle fünf der ursprünglichen Fokussteine aufzuladen.","Very good. We need the knowledge contained in this book to charge the five original focus stones.","","","Info_Saturas_BOOK_14_03","",""
"Scripts/content/Story/MISSIONS/DIA_Kdw_600_Saturas.d:145","Ich werde den Almanach an mich nehmen!","I'll take the almanac!","","","Info_Saturas_BOOK_14_04","",""
"Scripts/content/Story/MISSIONS/DIA_Kdw_600_Saturas.d:161","Ich habe diesen Fokus hier","I have this focus...","","","Info_Saturas_FOCUS.description","",""
"Scripts/content/Story/MISSIONS/DIA_Kdw_600_Saturas.d:174","Ich habe diesen Fokus hier ...","I have this focus...","","","Info_Saturas_FOCUS_15_01","",""
"Scripts/content/Story/MISSIONS/DIA_Kdw_600_Saturas.d:175","Du hältst einen der Schlüssel für die Zerstörung unser aller Fesseln in Händen.","You're holding the key that can unlock all our bonds.","","","Info_Saturas_FOCUS_14_02","",""
"Scripts/content/Story/MISSIONS/DIA_Kdw_600_Saturas.d:176","Es handelt sich um einen der fünf Fokussteine, mit deren Hilfe die magische Barriere erschaffen wurde.","It is one of the five focus stones which were used to create the Magic Barrier.","","","Info_Saturas_FOCUS_14_03","",""
"Scripts/content/Story/MISSIONS/DIA_Kdw_600_Saturas.d:177","Und mit der fokussierenden Kraft genau dieser Steine werden wir die Mauern aus Energie auch wieder niederreißen.","And with the help of the very same focusing power of these stones, we will tear down the great wall of energy.","","","Info_Saturas_FOCUS_14_04","",""
"Scripts/content/Story/MISSIONS/DIA_Kdw_600_Saturas.d:178","Aber kostet das nicht unglaublich viel magische Energie?","But won't that use up an awful lot of power?","","","Info_Saturas_FOCUS_15_05","",""
"Scripts/content/Story/MISSIONS/DIA_Kdw_600_Saturas.d:179","Richtig, doch wir haben über all die Jahre unermüdlich Erz gesammelt, anstatt es mit unseren Kerkermeistern gegen Annehmlichkeiten zu tauschen.","True, but in all these years we have untiringly collected ore instead of trading it for luxuries with our jailers.","","","Info_Saturas_FOCUS_14_06","",""
"Scripts/content/Story/MISSIONS/DIA_Kdw_600_Saturas.d:180","Wie du sicher schon weißt, enthält jeder Erzbrocken etwas magische Energie. Mit Hilfe dieser Energie, die in unserem großen Erzhaufen schlummert, können wir die magische Barriere in Fetzen sprengen.","As you must know, each ore nugget contains a certain amount of magic power. With the aid of the energy thus amassed in the ore mound, we'll be able to destroy the Magic Barrier.","","","Info_Saturas_FOCUS_14_07","",""
"Scripts/content/Story/MISSIONS/DIA_Kdw_600_Saturas.d:181","Das hört sich gefährlich an.","Sounds dangerous.","","","Info_Saturas_FOCUS_15_08","",""
"Scripts/content/Story/MISSIONS/DIA_Kdw_600_Saturas.d:182","Die Explosion wird rein magischer Natur sein und wird ausschließlich alles magisch Veränderte innerhalb der Barriere zerstören. Für uns Menschen besteht keine Gefahr.","The explosion will be merely of a magical nature, it will only destroy everything that's been modified by the magic inside the Barrier. There is no danger to us human beings.","","","Info_Saturas_FOCUS_14_09","",""
"Scripts/content/Story/MISSIONS/DIA_Kdw_600_Saturas.d:183","Hier, nimm den Fokus. Hoffentlich hilft er dem Plan mit dem Erzhaufen auch wirklich!","Here, take the focus. I hope it really will be of some use to your plans with the ore mound!","","","Info_Saturas_FOCUS_15_10","",""
"Scripts/content/Story/MISSIONS/DIA_Kdw_600_Saturas.d:199","Was machst du jetzt mit Fokus und Almanach?","What are you going to do with the focus and the almanac now?","","","Info_Saturas_WHATNOW.description","",""
"Scripts/content/Story/MISSIONS/DIA_Kdw_600_Saturas.d:212","Was machst du jetzt mit Fokus und Almanach?","What are you going to do with the focus and the almanac now?","","","Info_Saturas_WHATNOW_15_01","",""
"Scripts/content/Story/MISSIONS/DIA_Kdw_600_Saturas.d:213","Nichts. Wir benötigen vorher die vier restlichen Fokussteine!","Nothing. We need the four remaining focus stones first!","","","Info_Saturas_WHATNOW_14_03","",""
"Scripts/content/Story/MISSIONS/DIA_Kdw_600_Saturas.d:214","Dummerweise befindet sich kein einziger dieser vier magischen Steine in unserem Besitz.","Unfortunately we don't have any of these four magic stones.","","","Info_Saturas_WHATNOW_14_04","",""
"Scripts/content/Story/MISSIONS/DIA_Kdw_600_Saturas.d:226","Ich bin bereit diese vier Foki für euch zu suchen!","I'm willing to find the four remaining focus stones for you!","","","Info_Saturas_OFFER.description","",""
"Scripts/content/Story/MISSIONS/DIA_Kdw_600_Saturas.d:239","Ich bin bereit diese vier Foki für euch zu suchen!","I'm willing to find the four remaining focus stones for you!","","","Info_Saturas_OFFER_15_01","",""
"Scripts/content/Story/MISSIONS/DIA_Kdw_600_Saturas.d:240","Schließlich will ich auch hier irgendwann wieder raus.","After all, I'm quite keen on getting out of here sometime myself.","","","Info_Saturas_OFFER_15_02","",""
"Scripts/content/Story/MISSIONS/DIA_Kdw_600_Saturas.d:241","Ich muss dich warnen. Die Suche wird gleichermaßen schwierig und gefährlich.","I must warn you. Searching for them will prove as difficult as it will be dangerous.","","","Info_Saturas_OFFER_14_03","",""
"Scripts/content/Story/MISSIONS/DIA_Kdw_600_Saturas.d:242","Da die Spannungen mit dem Alten Lager immer stärker werden, kann ich hier auch keinen der Söldner entbehren.","Since conflict with the Old Camp is getting worse every day, I cannot give you any mercenary either.","","","Info_Saturas_OFFER_14_04","",""
"Scripts/content/Story/MISSIONS/DIA_Kdw_600_Saturas.d:243","Du wärest ganz auf dich alleine gestellt.","You'll be totally on your own.","","","Info_Saturas_OFFER_14_05","",""
"Scripts/content/Story/MISSIONS/DIA_Kdw_600_Saturas.d:244","Na ja ... Das ist nun wirklich nichts Neues! Ich werde diese Dinger schon irgendwo auftreiben.","Well... That's nothing unusual for me! I'll find a way to organize these things.","","","Info_Saturas_OFFER_15_06","",""
"Scripts/content/Story/MISSIONS/DIA_Kdw_600_Saturas.d:245","Deine Zuversicht ehrt dich, aber du wirst einige Gegenstände benötigen.","Your confidence does you credit, but you'll need some items to assist you.","","","Info_Saturas_OFFER_14_07","",""
"Scripts/content/Story/MISSIONS/DIA_Kdw_600_Saturas.d:246","Nimm diese Karte hier. Sie ist alt, aber auf ihr sind die ursprünglichen Standorte der Fokussteine während der Erschaffung der Barriere verzeichnet.","Take this map here. It's old, but on it you'll see the original locations of the focus stones when the Barrier was created.","","","Info_Saturas_OFFER_14_08","",""
"Scripts/content/Story/MISSIONS/DIA_Kdw_600_Saturas.d:247","Darüber hinaus sollte diese Spruchrolle dir eine schnellere Reise zurück in unser Lager ermöglichen.","Also, this spell scroll will enable you to travel back to our camp faster.","","","Info_Saturas_OFFER_14_09","",""
"Scripts/content/Story/MISSIONS/DIA_Kdw_600_Saturas.d:248","Zu guter Letzt sprich mit Riordian. Er braut die Tränke für das Lager.","Finally, you need to speak to Riordian. He brews the potions for the Camp.","","","Info_Saturas_OFFER_14_10","",""
"Scripts/content/Story/MISSIONS/DIA_Kdw_600_Saturas.d:249","Du findest ihn in seiner Hütte hier auf der obersten Ebene.","You'll find him in his hut, here, on the upper level.","","","Info_Saturas_OFFER_14_11","",""
"Scripts/content/Story/MISSIONS/DIA_Kdw_600_Saturas.d:262","Hm, das ist ein Anfang. Du schlägst dich gut.","Hm, that's a start. You're doing well.","","","Info_Saturas_BRINGFOCUS_14_01","",""
"Scripts/content/Story/MISSIONS/DIA_Kdw_600_Saturas.d:263","Es fehlen noch drei Fokussteine, um unseren großen Plan durchzuführen.","There are still three focus stones missing to accomplish our plan.","","","Info_Saturas_BRINGFOCUS_14_02","",""
"Scripts/content/Story/MISSIONS/DIA_Kdw_600_Saturas.d:264","Gehe nun und suche die restlichen Fokussteine.","Now go and look out for the remaining focus stones.","","","Info_Saturas_BRINGFOCUS_14_03","",""
"Scripts/content/Story/MISSIONS/DIA_Kdw_600_Saturas.d:272","Gut, das ist schon der zweite Fokusstein, den du uns bringst.","Good, that's the second focus stone you've brought us.","","","Info_Saturas_BRINGFOCUS_14_04","",""
"Scripts/content/Story/MISSIONS/DIA_Kdw_600_Saturas.d:273","Wir kommen unserem großen Ziel immer näher.","We're getting closer and closer to our target.","","","Info_Saturas_BRINGFOCUS_14_05","",""
"Scripts/content/Story/MISSIONS/DIA_Kdw_600_Saturas.d:274","Schlag dich tapfer und suche nun die restlichen zwei Fokussteine.","Be brave and fetch the two remaining focus stones.","","","Info_Saturas_BRINGFOCUS_14_06","",""
"Scripts/content/Story/MISSIONS/DIA_Kdw_600_Saturas.d:282","Unglaublich, nun haben wir schon insgesamt vier Fokussteine.","Unbelievable, now we have four focus stones altogether.","","","Info_Saturas_BRINGFOCUS_14_07","",""
"Scripts/content/Story/MISSIONS/DIA_Kdw_600_Saturas.d:283","Nur noch ein Einziger fehlt uns, dann haben wir alle ursprünglichen Steine in unserem Besitz.","There's only one more missing, then we'll have them all.","","","Info_Saturas_BRINGFOCUS_14_08","",""
"Scripts/content/Story/MISSIONS/DIA_Kdw_600_Saturas.d:284","Du hast unserer Gemeinschaft schon jetzt sehr viel Ehre erwiesen. Finde den letzten Fokusstein und unsere Befreiung steht kurz bevor.","You have already done our community a great service. Get the last focus stone, and we'll soon be able to free ourselves.","","","Info_Saturas_BRINGFOCUS_14_09","",""
"Scripts/content/Story/MISSIONS/DIA_Kdw_600_Saturas.d:292","Fantastisch, nun haben wir alle fünf Fokussteine in unserem Besitz.","Brilliant, now we have all five focus stones.","","","Info_Saturas_BRINGFOCUS_14_10","",""
"Scripts/content/Story/MISSIONS/DIA_Kdw_600_Saturas.d:293","Deine Taten sind von unschätzbarem Wert für unser Lager. Sei dir meines ewigen Dankes gewiss.","Your deeds are invaluable to our camp. Be assured of my eternal gratitude.","","","Info_Saturas_BRINGFOCUS_14_11","",""
"Scripts/content/Story/MISSIONS/DIA_Kdw_600_Saturas.d:294","Gehe nun zu Riordian. Er wird dir einen Ausgleich für deine unermesslichen Mühen geben.","Go to Riordian now. He'll give you something for your immense efforts.","","","Info_Saturas_BRINGFOCUS_14_12","",""
"Scripts/content/Story/MISSIONS/DIA_Kdw_600_Saturas.d:295","Sprich auch mit Cronos, dem Hüter des Erzes. Auch er wird dir ein Geschenk unserer Gemeinschaft überreichen.","Speak to Cronos, the keeper of the ore, as well. He will give you another gift from our community.","","","Info_Saturas_BRINGFOCUS_14_13","",""
"Scripts/content/Story/MISSIONS/DIA_Kdw_600_Saturas.d:314","Du hast die Teleport-Spruchrolle verbraucht, wie ich sehe. Hier, nimm eine neue.","I see you've used up the teleportation scroll. Here, take a new one.","","","Info_Saturas_BRINGFOCUS_14_14","",""
"Scripts/content/Story/MISSIONS/DIA_Kdw_600_Saturas.d:329","Ich habe in der Trollschlucht einen Fokus gefunden!","I've found a focus in the troll canyon!","","","Info_Saturas_BRINGFOCUS2.description","",""
"Scripts/content/Story/MISSIONS/DIA_Kdw_600_Saturas.d:342","Ich habe in der Trollschlucht einen Fokus gefunden!","I've found a focus in the troll canyon!","","","Info_Saturas_BRINGFOCUS2_15_01","",""
"Scripts/content/Story/MISSIONS/DIA_Kdw_600_Saturas.d:362","Ich habe in der Bergfestung einen Fokus gefunden!","I've found a focus in the mountain fort!","","","Info_Saturas_BRINGFOCUS3.description","",""
"Scripts/content/Story/MISSIONS/DIA_Kdw_600_Saturas.d:375","Ich habe in der Bergfestung einen Fokus gefunden!","I've found a focus in the mountain fort!","","","Info_Saturas_BRINGFOCUS3_15_01","",""
"Scripts/content/Story/MISSIONS/DIA_Kdw_600_Saturas.d:395","Ich habe in der Klosterruine einen Fokus gefunden!","I've found a focus in the ruined monastery!","","","Info_Saturas_BRINGFOCUS4.description","",""
"Scripts/content/Story/MISSIONS/DIA_Kdw_600_Saturas.d:408","Ich habe in der Klosterruine einen Fokus gefunden!","I've found a focus in the ruined monastery!","","","Info_Saturas_BRINGFOCUS4_15_01","",""
"Scripts/content/Story/MISSIONS/DIA_Kdw_600_Saturas.d:409","Gorn, der Söldner, war dort und hat mich bei der Suche unterstützt.","Gorn the mercenary was there, he gave me a hand in searching.","","","Info_Saturas_BRINGFOCUS4_15_02","",""
"Scripts/content/Story/MISSIONS/DIA_Kdw_600_Saturas.d:429","Ich habe unter dem Stonehenge einen Fokus gefunden!","I've found a focus under the ring of stone!","","","Info_Saturas_BRINGFOCUS5.description","",""
"Scripts/content/Story/MISSIONS/DIA_Kdw_600_Saturas.d:442","Ich habe unter dem Stonehenge einen Fokus gefunden!","I've found a focus under the ring of stone!","","","Info_Saturas_BRINGFOCUS5_15_01","",""
"Scripts/content/Story/MISSIONS/DIA_Kdw_600_Saturas.d:462","Kann nun die Sprengung des Erzhaufens beginnen?","Can you blast the ore mound now?","","","Info_Saturas_ALLFOCI.description","",""
"Scripts/content/Story/MISSIONS/DIA_Kdw_600_Saturas.d:476","Kann nun die Sprengung des Erzhaufens beginnen?","Can you blast the ore mound now?","","","Info_Saturas_ALLFOCI_15_01","",""
"Scripts/content/Story/MISSIONS/DIA_Kdw_600_Saturas.d:477","Wir haben jetzt alle Artefakte zusammen, die unser großes Vorhaben benötigt.","We now have all the artefacts we need to fulfill our plan.","","","Info_Saturas_ALLFOCI_14_02","",""
"Scripts/content/Story/MISSIONS/DIA_Kdw_600_Saturas.d:478","Doch die Erschaffung der Barriere wurde von zwölf Magiern durchgeführt.","But the Barrier was created by twelve magicians.","","","Info_Saturas_ALLFOCI_14_03","",""
"Scripts/content/Story/MISSIONS/DIA_Kdw_600_Saturas.d:479","Um die gewaltigen Energien zu kontrollieren und in die richtigen Bahnen lenken zu können, sind wir Wassermagier nicht genug.","There are not enough magicians in the Circle of Water to control the powerful energies and to guide them onto the right course.","","","Info_Saturas_ALLFOCI_14_04","",""
"Scripts/content/Story/MISSIONS/DIA_Kdw_600_Saturas.d:480","Was machen wir dann?","What can we do?","","","Info_Saturas_ALLFOCI_15_05","",""
"Scripts/content/Story/MISSIONS/DIA_Kdw_600_Saturas.d:481","Mir ist bewusst, dass du schon sehr viel für unsere Gemeinschaft getan hast und wir stehen tief in deiner Schuld ...","I am aware that you have already done much for our community, we owe you greatly...","","","Info_Saturas_ALLFOCI_14_06","",""
"Scripts/content/Story/MISSIONS/DIA_Kdw_600_Saturas.d:482","... Doch im Interesse aller Koloniebewohner muss ich dich noch um einen weiteren Gefallen bitten.","... but in the interest of all the inhabitants of the colony, I need to ask one more favor of you.","","","Info_Saturas_ALLFOCI_14_07","",""
"Scripts/content/Story/MISSIONS/DIA_Kdw_600_Saturas.d:494","Ein weiterer Gefallen?","One more favor?","","","Info_Saturas_FAVOR.description","",""
"Scripts/content/Story/MISSIONS/DIA_Kdw_600_Saturas.d:507","Ein weiterer Gefallen?","One more favor?","","","Info_Saturas_FAVOR_15_01","",""
"Scripts/content/Story/MISSIONS/DIA_Kdw_600_Saturas.d:508","Ja. Begib dich ins Alte Lager und versuche, einige der Feuermagier für unsere Sache zu gewinnen.","Yes. Go to the Old Camp and try to win some of the Magicians of the Circle of Fire for our cause.","","","Info_Saturas_FAVOR_14_02","",""
"Scripts/content/Story/MISSIONS/DIA_Kdw_600_Saturas.d:509","DIE FEUERMAGIER??? Warum sollten die Maden den Speck verlassen wollen?","MAGICIANS OF FIRE??? Why should they want to give up their easy life?","","","Info_Saturas_FAVOR_15_03","",""
"Scripts/content/Story/MISSIONS/DIA_Kdw_600_Saturas.d:510","Ein Zusammenbruch der Barriere würde ihre Machtposition zunichte machen!","The destruction of the Barrier would rob them of their powerful position!","","","Info_Saturas_FAVOR_15_04","",""
"Scripts/content/Story/MISSIONS/DIA_Kdw_600_Saturas.d:511","Genau aus diesem Grunde musst DU dich um diese schwierige Mission kümmern. Du kennst Leute aus allen Lagern der Kolonie.","That is the exact reason why YOU must accomplish this mission. You know people from all the camps of the colony.","","","Info_Saturas_FAVOR_14_05","",""
"Scripts/content/Story/MISSIONS/DIA_Kdw_600_Saturas.d:512","Erinnere die Feuermagier an die alten Zeiten, als wir noch gemeinsam die magischen Künste studierten.","Remind the Magicians of Fire of the old times, when we studied the arts of magic together.","","","Info_Saturas_FAVOR_14_06","",""
"Scripts/content/Story/MISSIONS/DIA_Kdw_600_Saturas.d:524","Nun gut, ich werde versuchen, die Feuermagier zu überreden!","Alright then, I'll try to convince the Magicians of Fire!","","","Info_Saturas_ACCEPT.description","",""
"Scripts/content/Story/MISSIONS/DIA_Kdw_600_Saturas.d:537","Nun gut, ich werde versuchen, die Feuermagier zu überreden!","Alright then, I'll try to convince the Magicians of Fire!","","","Info_Saturas_ACCEPT_15_01","",""
"Scripts/content/Story/MISSIONS/DIA_Kdw_600_Saturas.d:538","Aber ich kann nichts versprechen! Es scheint mir fast unmöglich.","But I can't promise anything! It seems nearly impossible to me.","","","Info_Saturas_ACCEPT_15_02","",""
"Scripts/content/Story/MISSIONS/DIA_Kdw_600_Saturas.d:539","Du musst es versuchen. Wenn du keinen Erfolg hast, dann gibt es nur noch einen ...","You must try. If you do not succeed in this, there is only one other...","","","Info_Saturas_ACCEPT_14_03","",""
"Scripts/content/Story/MISSIONS/DIA_Kdw_600_Saturas.d:540","Einen ...","Just one...","","","Info_Saturas_ACCEPT_14_04","",""
"Scripts/content/Story/MISSIONS/DIA_Kdw_600_Saturas.d:541","... Einen WAS?","... one WHAT?","","","Info_Saturas_ACCEPT_15_05","",""
"Scripts/content/Story/MISSIONS/DIA_Kdw_600_Saturas.d:542","Vergiss das! Du MUSST Erfolg haben!","Forget it! You MUST succeed!","","","Info_Saturas_ACCEPT_14_06","",""
"Scripts/content/Story/MISSIONS/DIA_Kdw_600_Saturas.d:543","Hier, nimm diese Zauberrune. Überbringe sie Corristo, dem obersten Feuermagier, als Zeichen unseres Vertrauens.","Here, take this magic rune. Hand it over to Corristo, the High Magician of the Circle of Fire, as a sign of our trust.","","","Info_Saturas_ACCEPT_14_07","",""
"Scripts/content/Story/MISSIONS/DIA_Kdw_600_Saturas.d:544","Damit kann er sich jederzeit vorbei an allen Wachen mitten in diesen Raum teleportieren.","With this he can teleport into this room without passing the guards anytime he wants.","","","Info_Saturas_ACCEPT_14_08","",""
"Scripts/content/Story/MISSIONS/DIA_Kdw_600_Saturas.d:545","Ich hoffe, das überzeugt unsere ehemaligen Freunde von unseren guten Absichten.","I hope that'll convince our former friends of our good intentions.","","","Info_Saturas_ACCEPT_14_09","",""
"Scripts/content/Story/MISSIONS/DIA_Kdw_600_Saturas.d:584","Gut, dass du wieder zurück bist. Es ist etwas Schreckliches passiert!","I'm glad you returned. Something terrible's happened!","","","Info_Saturas_AMBUSH_14_01","",""
"Scripts/content/Story/MISSIONS/DIA_Kdw_600_Saturas.d:585","Lass mich raten, die Freie Mine wurde von Gardisten aus dem Alten Lager überfallen, die niemand kommen sah?","Let me guess, the Free Mine has been assaulted by the guards from the Old Camp. Nobody saw them coming...?","","","Info_Saturas_AMBUSH_15_02","",""
"Scripts/content/Story/MISSIONS/DIA_Kdw_600_Saturas.d:586","Moment ... woher ... aber natürlich ... Du hast es im Alten Lager erfahren!","Hang on... how... but of course... You found out about it in the Old Camp!","","","Info_Saturas_AMBUSH_14_03","",""
"Scripts/content/Story/MISSIONS/DIA_Kdw_600_Saturas.d:587","Gorn kam kurz vor dir hier an.","Gorn arrived here just before you did.","","","Info_Saturas_AMBUSH_14_04","",""
"Scripts/content/Story/MISSIONS/DIA_Kdw_600_Saturas.d:588","Was kann Gomez nur veranlasst haben, solch einen aggressiven Schritt zu wagen?","What could have caused Gomez to dare to take such an aggressive step?","","","Info_Saturas_AMBUSH_14_05","",""
"Scripts/content/Story/MISSIONS/DIA_Kdw_600_Saturas.d:589","Ihm müsste klar sein, dass dieser hinterhältige Überfall einen Krieg heraufbeschwört.","He should be aware that such a heinous act can only provoke war.","","","Info_Saturas_AMBUSH_14_06","",""
"Scripts/content/Story/MISSIONS/DIA_Kdw_600_Saturas.d:601","Die Alte Mine wurde nach einem Wassereinbruch verschüttet!","The Old Mine collapsed after water seeped in!","","","Info_Saturas_COLLAPSE.description","",""
"Scripts/content/Story/MISSIONS/DIA_Kdw_600_Saturas.d:614","Die Alte Mine wurde nach einem Wassereinbruch verschüttet!","The Old Mine collapsed after water seeped in!","","","Info_Saturas_COLLAPSE_15_01","",""
"Scripts/content/Story/MISSIONS/DIA_Kdw_600_Saturas.d:615","... Verschüttet ... natürlich ... dann gibt das Ganze langsam einen Sinn.","... Collapsed... of course... then the whole thing makes sense.","","","Info_Saturas_COLLAPSE_14_02","",""
