"location","source","target","id","fuzzy","context","translator_comments","developer_comments"
"Scripts/content/Story/MISSIONS/DIA_Kdw_600_Saturas.d:616","Gomez steht mit dem Rücken zur Wand. Er ist gefährlicher denn je geworden, denn nun, wo er nichts mehr zu verlieren hat, wird er zu allem fähig sein!","Gomez has his back to the wall. He's more dangerous than ever. Now that he doesn't have anything left to lose, he'll do anything!","","","Info_Saturas_COLLAPSE_14_03","",""
"Scripts/content/Story/MISSIONS/DIA_Kdw_600_Saturas.d:628","Gomez hat alle Feuermagier töten lassen!","Gomez has had all the Magicians of Fire killed!","","","Info_Saturas_MURDER.description","",""
"Scripts/content/Story/MISSIONS/DIA_Kdw_600_Saturas.d:641","Gomez hat alle Feuermagier töten lassen!","Gomez has had all the Magicians of Fire killed!","","","Info_Saturas_MURDER_15_01","",""
"Scripts/content/Story/MISSIONS/DIA_Kdw_600_Saturas.d:642","TÖTEN LASSEN??? Wieso bei Beliar hat er so etwas getan?","HAD THEM KILLED??? Why in Beliar's name would he do a thing like that?","","","Info_Saturas_MURDER_14_02","",""
"Scripts/content/Story/MISSIONS/DIA_Kdw_600_Saturas.d:643","Sie waren gegen den Überfall auf die Freie Mine und stellten sich gegen Gomez.","They were against the attack on the Free Mine, and opposed Gomez.","","","Info_Saturas_MURDER_15_03","",""
"Scripts/content/Story/MISSIONS/DIA_Kdw_600_Saturas.d:644","Dann sind wir alle verloren. Ohne die anderen sechs Magier werden wir die geballte Kraft des großen Erzhaufens nicht kontrollieren können.","Then we're all doomed. Without the other six magicians, we'll never be able to control the concentrated power of the massive ore mound.","","","Info_Saturas_MURDER_14_04","",""
"Scripts/content/Story/MISSIONS/DIA_Kdw_600_Saturas.d:645","Ich danke dir trotzdem dafür, dass du diese gefährliche Botschaft an mich überbracht hast.","But in spite of that, I thank you for passing this dangerous message on to me.","","","Info_Saturas_MURDER_14_05","",""
"Scripts/content/Story/MISSIONS/DIA_Kdw_600_Saturas.d:662","Das Alte Lager hat mich verbannt, weil ich euch geholfen habe!","I have been exiled from the Old Camp because I have helped you!","","","KDW_600_Saturas_NOMOREOC.description","",""
"Scripts/content/Story/MISSIONS/DIA_Kdw_600_Saturas.d:676","Das Alte Lager hat mich verbannt, weil ich euch geholfen habe!","I have been exiled from the Old Camp because I have helped you!","","","KDW_600_Saturas_NOMOREOC_Info_15_01","",""
"Scripts/content/Story/MISSIONS/DIA_Kdw_600_Saturas.d:677","Du gehörst nicht länger zum Alten Lager?","You don't belong to the Old Camp any longer?","","","KDW_600_Saturas_NOMOREOC_Info_14_02","",""
"Scripts/content/Story/MISSIONS/DIA_Kdw_600_Saturas.d:678","Dann heiße ich dich in unserer Gemeinschaft willkommen.","Then I welcome you to our community.","","","KDW_600_Saturas_NOMOREOC_Info_14_03","",""
"Scripts/content/Story/MISSIONS/DIA_Kdw_600_Saturas.d:694","Heißt das, die Söldner werden mich aufnehmen?","Does that mean the mercenaries will take me on?","","","KDW_600_Saturas_GOTOLEE.description","",""
"Scripts/content/Story/MISSIONS/DIA_Kdw_600_Saturas.d:708","Heißt das, die Söldner werden mich aufnehmen?","Does that mean the mercenaries will take me on?","","","KDW_600_Saturas_GOTOLEE_Info_15_01","",""
"Scripts/content/Story/MISSIONS/DIA_Kdw_600_Saturas.d:709","Sprich mit Lee. Er wird sich darum kümmern. Danach komm wieder zu mir.","Talk to Lee. He'll see to it. Then come back to me.","","","KDW_600_Saturas_GOTOLEE_Info_14_02","",""
"Scripts/content/Story/MISSIONS/DIA_Kdw_600_Saturas.d:723","Heißt das, ich gehöre jetzt in die Gilde der Wassermagier?","Does that mean that I now belong to the Magicians of Water?","","","KDW_600_Saturas_OATH.description","",""
"Scripts/content/Story/MISSIONS/DIA_Kdw_600_Saturas.d:737","Heißt das, ich gehöre jetzt in die Gilde der Wassermagier?","Does that mean that I now belong to the guild of the Magicians of the Water?","","","KDW_600_Saturas_OATH_Info_15_01","",""
"Scripts/content/Story/MISSIONS/DIA_Kdw_600_Saturas.d:738","Noch nicht. Du musst erst den Eid des Wassers ablegen.","Not yet. First you need to take the oath of Water.","","","KDW_600_Saturas_OATH_Info_14_02","",""
"Scripts/content/Story/MISSIONS/DIA_Kdw_600_Saturas.d:739","Aber ich habe mich bereits dem Feuer verschworen!","But I've already taken the oath of Fire!","","","KDW_600_Saturas_OATH_Info_15_03","",""
"Scripts/content/Story/MISSIONS/DIA_Kdw_600_Saturas.d:740","Hmmm ....","Hmmm....","","","KDW_600_Saturas_OATH_Info_14_04","",""
"Scripts/content/Story/MISSIONS/DIA_Kdw_600_Saturas.d:741","Du brichst den Schwur ja nicht!","It doesn't mean you're breaking your vow!","","","KDW_600_Saturas_OATH_Info_14_05","",""
"Scripts/content/Story/MISSIONS/DIA_Kdw_600_Saturas.d:742","Ähh ... Ich verstehe nicht ...","Uhh... I don't understand...","","","KDW_600_Saturas_OATH_Info_15_06","",""
"Scripts/content/Story/MISSIONS/DIA_Kdw_600_Saturas.d:743","Du erweiterst deinen Schwur. Damit wirst du zum Magier der beiden Elemente!","You're extending your vow. That way you'll become a magician of both elements!","","","KDW_600_Saturas_OATH_Info_14_07","",""
"Scripts/content/Story/MISSIONS/DIA_Kdw_600_Saturas.d:744","Sowohl die Macht des Feuers als auch das Wissen des Wassers stehen dir dann zur Verfügung!","Then you'll have the force of Fire as well as the wisdom of Water!","","","KDW_600_Saturas_OATH_Info_14_08","",""
"Scripts/content/Story/MISSIONS/DIA_Kdw_600_Saturas.d:758","Ich bin bereit, den Eid abzulegen.","I'm ready to take the oath.","","","KDW_600_Saturas_KDWAUFNAHME.description","",""
"Scripts/content/Story/MISSIONS/DIA_Kdw_600_Saturas.d:772","Ich bin bereit, den Eid abzulegen.","I'm ready to take the oath.","","","KDW_600_Saturas_KDWAUFNAHME_Info_15_01","",""
"Scripts/content/Story/MISSIONS/DIA_Kdw_600_Saturas.d:773","Diener des Feuers, du wirst nun den Segen des Wassers empfangen!","Servant of the Fire, you shall now receive the blessing of the Water!","","","KDW_600_Saturas_KDWAUFNAHME_Info_14_02","",""
"Scripts/content/Story/MISSIONS/DIA_Kdw_600_Saturas.d:774","Sprich nun die Worte des Eides:","Now speak the words of the oath:","","","KDW_600_Saturas_KDWAUFNAHME_Info_14_03","",""
"Scripts/content/Story/MISSIONS/DIA_Kdw_600_Saturas.d:775","Ich schwöre bei den Mächten der Götter ...","I swear by the might of the gods...","","","KDW_600_Saturas_KDWAUFNAHME_Info_14_04","",""
"Scripts/content/Story/MISSIONS/DIA_Kdw_600_Saturas.d:776","Ich schwöre bei den Mächten der Götter ...","I swear by the might of the gods...","","","KDW_600_Saturas_KDWAUFNAHME_Info_15_05","",""
"Scripts/content/Story/MISSIONS/DIA_Kdw_600_Saturas.d:777","... und bei der Kraft des heiligen Wassers ...","... and by the power of the holy Water...","","","KDW_600_Saturas_KDWAUFNAHME_Info_14_06","",""
"Scripts/content/Story/MISSIONS/DIA_Kdw_600_Saturas.d:778","... und bei der Kraft des heiligen Wassers ...","... and by the power of the holy Water...","","","KDW_600_Saturas_KDWAUFNAHME_Info_15_07","",""
"Scripts/content/Story/MISSIONS/DIA_Kdw_600_Saturas.d:779","... dass mein Wissen und Handeln von nun an und auf ewig mit dem Wasser verbunden sei ...","... that my knowledge and my deeds from now on and forever shall be one with the Water...","","","KDW_600_Saturas_KDWAUFNAHME_Info_14_08","",""
"Scripts/content/Story/MISSIONS/DIA_Kdw_600_Saturas.d:780","... dass mein Wissen und Handeln von nun an und auf ewig mit dem Wasser verbunden sei ...","... that my knowledge and my deeds from now on and forever shall be one with the Water...","","","KDW_600_Saturas_KDWAUFNAHME_Info_15_09","",""
"Scripts/content/Story/MISSIONS/DIA_Kdw_600_Saturas.d:781","... bis ich einkehre in Beliars Reich und der Quell des Lebens versiegt.","... until my body shall return to the realm of Beliar and the source of my life shall dry out.","","","KDW_600_Saturas_KDWAUFNAHME_Info_14_10","",""
"Scripts/content/Story/MISSIONS/DIA_Kdw_600_Saturas.d:782","... bis ich einkehre in Beliars Reich und der Quell des Lebens versiegt.","... until my body shall return to the realm of Beliar and the source of my life shall dry out.","","","KDW_600_Saturas_KDWAUFNAHME_Info_15_11","",""
"Scripts/content/Story/MISSIONS/DIA_Kdw_600_Saturas.d:784","Mit diesem Schwur einst du die Kraft des Feuers und den Segen des Wassers in dir.","With this oath you unite the power of the Fire and the blessing of the Water within you.","","","KDW_600_Saturas_KDWAUFNAHME_Info_14_12","",""
"Scripts/content/Story/MISSIONS/DIA_Kdw_600_Saturas.d:785","Du verbindest das, was vorher getrennt war. Möge dein Leben ein Zeichen des Bundes der Elemente sein.","You have now bound together what was apart before. May your life be a sign of the unification of the elements.","","","KDW_600_Saturas_KDWAUFNAHME_Info_14_13","",""
"Scripts/content/Story/MISSIONS/DIA_Kdw_600_Saturas.d:786","Trage diese Robe als Zeichen deiner Verbundenheit zum heiligen Wasser und zu Adanos.","Wear this robe as a sign of your bond with the holy Water and with Adanos.","","","KDW_600_Saturas_KDWAUFNAHME_Info_14_14","",""
"Scripts/content/Story/MISSIONS/DIA_Kdw_600_Saturas.d:810","Kannst du mich unterrichten?","Can you instruct me?","","","KDW_600_Saturas_LESSON.description","",""
"Scripts/content/Story/MISSIONS/DIA_Kdw_600_Saturas.d:823","Kannst du mich unterrichten?","Can you instruct me?","","","KDW_600_Saturas_LESSON_Info_15_01","",""
"Scripts/content/Story/MISSIONS/DIA_Kdw_600_Saturas.d:827","Es gibt noch viel zu lernen für dich. Wenn du bereit bist, werde ich dich unterrichten.","There's much you need to learn. I shall teach you as soon as you're ready.","","","KDW_600_Saturas_LESSON_Info_14_02","",""
"Scripts/content/Story/MISSIONS/DIA_Kdw_600_Saturas.d:831","Es gibt noch einen weiteren Kreis, den du nicht kennst. Wenn du bereit bist, werde ich dich unterrichten.","There is one more Circle you don't know yet. I shall teach you as soon as you're ready.","","","KDW_600_Saturas_LESSON_Info_14_03","",""
"Scripts/content/Story/MISSIONS/DIA_Kdw_600_Saturas.d:835","Du beherrscht bereits den fünften Kreis der Magie! Du weißt alles, was ich weiß.","You have already mastered the Fifth Circle of Magic! You know all I know.","","","KDW_600_Saturas_LESSON_Info_14_04","",""
"Scripts/content/Story/MISSIONS/DIA_Kdw_600_Saturas.d:836","Ich kann dir nichts mehr beibringen!","I can't teach you any more!","","","KDW_600_Saturas_LESSON_Info_14_05","",""
"Scripts/content/Story/MISSIONS/DIA_Kdw_600_Saturas.d:868","Ich bin bereit, in den ersten Kreis aufgenommen zu werden.","I am ready to enter the First Circle.","","","KDW_600_Saturas_KREIS1_Info_15_01","",""
"Scripts/content/Story/MISSIONS/DIA_Kdw_600_Saturas.d:872","Den ersten der magischen Kreise zu betreten, bedeutet die Anwendung magischer Runen lernen.","To enter the first of the magic Circles means learning to use magic runes.","","","KDW_600_Saturas_KREIS1_Info_14_02","",""
"Scripts/content/Story/MISSIONS/DIA_Kdw_600_Saturas.d:873","Jede Rune birgt in sich die Struktur eines speziellen Zaubers.","Each rune contains the structure of a special magic spell.","","","KDW_600_Saturas_KREIS1_Info_14_03","",""
"Scripts/content/Story/MISSIONS/DIA_Kdw_600_Saturas.d:874","Durch den Einsatz deiner eigenen magischen Energie, bist du in der Lage, den Zauber der Rune zu wirken.","By using your own magic powers, you'll be able to cast the magic of the rune.","","","KDW_600_Saturas_KREIS1_Info_14_04","",""
"Scripts/content/Story/MISSIONS/DIA_Kdw_600_Saturas.d:875","Doch anders als Spruchrollen, die auch eine Zauberformel sind, sorgt die magische Kraft, die der Rune innewohnt, dafür, dass die Struktur des Zaubers erhalten bleibt.","But in contrast to the magic scrolls, which are magic formulas as well, the magic power of the rune ensures that the structure of the spell endures.","","","KDW_600_Saturas_KREIS1_Info_14_05","",""
"Scripts/content/Story/MISSIONS/DIA_Kdw_600_Saturas.d:876","Jede Rune ist eine Quelle magischer Kraft, auf die du immer wieder zurückgreifen kannst.","Every rune is a source of magic power which you can fall back on anytime.","","","KDW_600_Saturas_KREIS1_Info_14_06","",""
"Scripts/content/Story/MISSIONS/DIA_Kdw_600_Saturas.d:877","Deine eigene magische Kraft verbraucht sich beim Benutzen der Rune, wie bei einer Spruchrolle.","Your own magic power is used up when you use a rune, just as with a spell scroll.","","","KDW_600_Saturas_KREIS1_Info_14_07","",""
"Scripts/content/Story/MISSIONS/DIA_Kdw_600_Saturas.d:878","Mit jedem Kreis, den du lernst, lernst du auch die Möglichkeit, weitere Runen zu benutzen.","With every Circle you enter, you learn to use further runes as well.","","","KDW_600_Saturas_KREIS1_Info_14_08","",""
"Scripts/content/Story/MISSIONS/DIA_Kdw_600_Saturas.d:879","Nutze die Kraft der Runen, um dich selber zu erkennen.","Use the power of the runes to recognize yourself.","","","KDW_600_Saturas_KREIS1_Info_14_09","",""
"Scripts/content/Story/MISSIONS/DIA_Kdw_600_Saturas.d:909","Ich bin bereit, in den zweiten Kreis aufgenommen zu werden.","I am ready to enter the Second Circle.","","","KDW_600_Saturas_KREIS2_Info_15_01","",""
"Scripts/content/Story/MISSIONS/DIA_Kdw_600_Saturas.d:913","Du hast das Verständnis der Runen gelernt. Nun ist es an der Zeit, dieses Verständnis zu vertiefen.","You have learned to understand the runes. Now it is time to deepen this understanding.","","","KDW_600_Saturas_KREIS2_Info_14_02","",""
"Scripts/content/Story/MISSIONS/DIA_Kdw_600_Saturas.d:914","Mit dem zweiten Kreis lernst du die Grundsätze stärkerer Kampfzauber und vor allem das Geheimnis der Heilung.","When you join the Second Circle you will learn the foundations of stronger battle spells, and above all the secret of healing.","","","KDW_600_Saturas_KREIS2_Info_14_03","",""
"Scripts/content/Story/MISSIONS/DIA_Kdw_600_Saturas.d:915","Doch du musst noch viel lernen, willst du die tatsächlichen Geheimnisse der Magie ergründen.","But you need to learn much if you want to recognize the true secrets of magic.","","","KDW_600_Saturas_KREIS2_Info_14_04","",""
"Scripts/content/Story/MISSIONS/DIA_Kdw_600_Saturas.d:916","Du weißt, dass du jede Rune solange einsetzen kannst, bis deine eigene Kraft verbraucht ist.","You know that you can use every rune as often as you like until you've used up all your own powers.","","","KDW_600_Saturas_KREIS2_Info_14_05","",""
"Scripts/content/Story/MISSIONS/DIA_Kdw_600_Saturas.d:917","Aber frage dich, ob es sinnvoll ist. Du hast Macht verliehen bekommen, mit der es dir ein Leichtes ist, Tod und Verderben zu bringen.","But before you act, think about the point of your actions. You have obtained powers with which you may easily conjure up death and destruction.","","","KDW_600_Saturas_KREIS2_Info_14_06","",""
"Scripts/content/Story/MISSIONS/DIA_Kdw_600_Saturas.d:918","Doch der wahrhafte Magier zaubert nur dann, wenn es angebracht ist.","But a true magician only uses magic when it is necessary.","","","KDW_600_Saturas_KREIS2_Info_14_07","",""
"Scripts/content/Story/MISSIONS/DIA_Kdw_600_Saturas.d:919","Erkenne die Situation, dann wirst du die Macht der Runen erkennen.","Understand the situation, then you'll recognize the power of the runes.","","","KDW_600_Saturas_KREIS2_Info_14_08","",""
"Scripts/content/Story/MISSIONS/DIA_Kdw_600_Saturas.d:949","Ich bin bereit, den dritten Kreis zu betreten","Could you teach me the Third Circle?","","","KDW_600_Saturas_KREIS3_Info_15_01","",""
"Scripts/content/Story/MISSIONS/DIA_Kdw_600_Saturas.d:952","Der dritte Kreis der Magie ist einer der wichtigsten Schritte im Leben eines Magiers. Nicht länger bist du ein Suchender.","The Third Circle of Magic is one of the most important steps in the life of a magician. Once you've reached it, you cease to be a seeker.","","","KDW_600_Saturas_KREIS3_Info_14_02","",""
"Scripts/content/Story/MISSIONS/DIA_Kdw_600_Saturas.d:953","Du bist bereits ein Stück des magischen Weges gegangen. Du hast gelernt die Runen zu nutzen.","You have already come far on the path of magic. You have learned to use the runes.","","","KDW_600_Saturas_KREIS3_Info_14_03","",""
"Scripts/content/Story/MISSIONS/DIA_Kdw_600_Saturas.d:954","Dieses Wissen ist das Fundament für deinen weiteren Weg. Nutze die Runen mit Bedacht.","This knowledge is the foundation for your further path. Use the runes with deliberation.","","","KDW_600_Saturas_KREIS3_Info_14_04","",""
"Scripts/content/Story/MISSIONS/DIA_Kdw_600_Saturas.d:955","Du kannst eine Rune nutzen oder nicht. Aber entscheide dich für eine der Möglichkeiten.","You may use a rune or not. But you must decide on one of these possibilities.","","","KDW_600_Saturas_KREIS3_Info_14_05","",""
"Scripts/content/Story/MISSIONS/DIA_Kdw_600_Saturas.d:956","Zögere nicht, deine Macht einzusetzen, wenn du dich einmal entschieden hast.","Do not hesitate to use your powers as soon as you've made your choice.","","","KDW_600_Saturas_KREIS3_Info_14_06","",""
"Scripts/content/Story/MISSIONS/DIA_Kdw_600_Saturas.d:957","Erkenne deinen Weg, dann wirst du die Macht der Entscheidung erkennen.","Understand your path, then you'll recognize the power of the decision.","","","KDW_600_Saturas_KREIS3_Info_14_07","",""
"Scripts/content/Story/MISSIONS/DIA_Kdw_600_Saturas.d:987","Ich bin bereit für den vierten der Kreise.","I am ready to enter the Fourth Circle.","","","KDW_600_Saturas_KREIS4_Info_15_01","",""
"Scripts/content/Story/MISSIONS/DIA_Kdw_600_Saturas.d:990","Du hast die ersten drei Kreise durchschritten. Nun ist es an der Zeit, dass du die Geheimnisse der Magie kennen lernst.","You have completed the first three Circles. Now is the time for you to learn the secrets of magic.","","","KDW_600_Saturas_KREIS4_Info_14_02","",""
"Scripts/content/Story/MISSIONS/DIA_Kdw_600_Saturas.d:991","Die Magie der Runen ruht in ihrem Stein. Es sind magische Steine, gewonnen aus magischem Erz.","The magic of the runes is based on the stone. They are magic stones, created out of magic ore.","","","KDW_600_Saturas_KREIS4_Info_14_03","",""
"Scripts/content/Story/MISSIONS/DIA_Kdw_600_Saturas.d:992","Das gleiche Erz, das hier abgebaut wird. Dieses Erz wird in den Tempeln mit den Formeln der Magie versehen. Dort werden die Runen zu den Instrumenten unserer Macht geformt.","It is the same ore which is collected in the mines. This ore is endowed with magic formulas in the temples. There the runes are converted to the instruments of our power.","","","KDW_600_Saturas_KREIS4_Info_14_04","",""
"Scripts/content/Story/MISSIONS/DIA_Kdw_600_Saturas.d:993","Mit allen Runen, die du nun beherrschen kannst, steht dir das gesammelte Wissen der Tempel des Reiches zur Verfügung.","With the runes you control now, you have the entire knowledge of the temples of the realm at your fingertips.","","","KDW_600_Saturas_KREIS4_Info_14_05","",""
"Scripts/content/Story/MISSIONS/DIA_Kdw_600_Saturas.d:995","Erkenne die Magie, dann wirst du das Geheimnis von Macht erkennen.","Understand the magic, then you'll discover the secret of power.","","","KDW_600_Saturas_KREIS4_Info_14_07","",""
"Scripts/content/Story/MISSIONS/DIA_Kdw_600_Saturas.d:1025","Ich bin bereit für den fünften Kreis.","I am ready to enter the Fifth Circle.","","","KDW_600_Saturas_KREIS5_Info_15_01","",""
"Scripts/content/Story/MISSIONS/DIA_Kdw_600_Saturas.d:1028","So soll es geschehen. Ich werde dich die Macht des fünften Kreises lehren.","So be it. I shall teach you the power of the Fifth Circle.","","","KDW_600_Saturas_KREIS5_Info_14_02","",""
"Scripts/content/Story/MISSIONS/DIA_Kdw_600_Saturas.d:1029","Der Sturm des Feuers, die Welle aus Eis und die Macht, Untote zu vernichten, sind wahrhaft mächtige Sprüche, deren Runen dir nun untertan sind.","The Storm of Fire, the Wave of Ice and the power to destroy the undead are now spells whose runes you can use.","","","KDW_600_Saturas_KREIS5_Info_14_03","",""
"Scripts/content/Story/MISSIONS/DIA_Kdw_600_Saturas.d:1030","Doch der mächtigste Zauber des fünften Kreises ist die Welle des Todes. Solltest du in den Besitz dieser Rune gelangen, dann bist du im Besitz gefährlicher Macht.","But the mightiest spell of the Fifth Circle is the Ripple of Death. If you ever possess this rune, you'll have dangerous powers.","","","KDW_600_Saturas_KREIS5_Info_14_04","",""
"Scripts/content/Story/MISSIONS/DIA_Kdw_600_Saturas.d:1031","Hüte dich vor dem Einsatz dieser Magie. Sie ist eine Gabe des dunklen Gottes.","Be careful to use this kind of magic as little as possible. It's a gift from the god of darkness.","","","KDW_600_Saturas_KREIS5_Info_14_05","",""
"Scripts/content/Story/MISSIONS/DIA_Kdw_600_Saturas.d:1032","Du hast jetzt alles gelernt, was ich dir beibringen kann.","You have now learned everything I can teach you.","","","KDW_600_Saturas_KREIS4_Info_14_06","",""
"Scripts/content/Story/MISSIONS/DIA_Kdw_600_Saturas.d:1033","Erkenne deine Grenzen, dann wirst du deine wahre Macht erkennen","Expose your limits, then you'll recognize your true power.","","","KDW_600_Saturas_KREIS5_Info_14_06","",""
"Scripts/content/Story/MISSIONS/DIA_Kdw_600_Saturas.d:1061","Ich möchte die hohe Robe des Wassers tragen.","I'd like to wear the high robe of Water.","","","KDW_600_Saturas_HEAVYARMOR_Info_15_01","",""
"Scripts/content/Story/MISSIONS/DIA_Kdw_600_Saturas.d:1066","Es ist noch nicht an der Zeit, dass du die hohe Robe tragen kannst.","It is not yet time for you to wear the high robe.","","","KDW_600_Saturas_HEAVYARMOR_Info_14_02","",""
"Scripts/content/Story/MISSIONS/DIA_Kdw_600_Saturas.d:1070","Dein bisschen Erz deckt ja nicht mal die Herstellungskosten.","The little ore that you have won't even cover the manufacturing costs.","","","KDW_600_Saturas_HEAVYARMOR_Info_14_03","",""
"Scripts/content/Story/MISSIONS/DIA_Kdw_600_Saturas.d:1074","Die Zeit ist gekommen. Du bist würdig, die hohe Robe des Wassers zu tragen.","The time has come. You are worthy of wearing the high robe of Water.","","","KDW_600_Saturas_HEAVYARMOR_Info_14_04","",""
"Scripts/content/Story/MISSIONS/DIA_Kdw_600_Saturas.d:1110","Lee hat mich bei den Söldnern aufgenommen.","Lee has admitted me to the mercenaries.","","","Info_Saturas_NOWSLD_15_01","",""
"Scripts/content/Story/MISSIONS/DIA_Kdw_600_Saturas.d:1111","Gut. Sehr gut. Dann gehörst du nun offiziell zu unserer Gemeinschaft.","Good. Very good. Then you are now officially a part of our community.","","","Info_Saturas_NOWSLD_14_02","",""
"Scripts/content/Story/MISSIONS/DIA_Kdw_600_Saturas.d:1112","Sei herzlich willkommen!","Be welcome!","","","Info_Saturas_NOWSLD_14_03","",""
"Scripts/content/Story/MISSIONS/DIA_Kdw_600_Saturas.d:1127","Bei der Sache mit den Feuermagiern, erwähntest du einen weiteren... JEMAND","When you sent me to the Magicians of Fire, you mentioned SOMEBODY...","","","Info_Saturas_XARDAS.description","",""
"Scripts/content/Story/MISSIONS/DIA_Kdw_600_Saturas.d:1166","Als du mich zu den Feuermagiern schicktest, erwähntest du einen weiteren ... JEMAND","When you sent me to the Magicians of Fire, you mentioned there was... SOMEBODY.","","","Info_Saturas_XARDAS_15_01","",""
"Scripts/content/Story/MISSIONS/DIA_Kdw_600_Saturas.d:1167","Nun, ich hoffte wir würden ohne seine Hilfe auskommen, aber so wie die Dinge stehen ...","Well, I had hoped we could make it without his help, but the way things are developing...","","","Info_Saturas_XARDAS_14_02","",""
"Scripts/content/Story/MISSIONS/DIA_Kdw_600_Saturas.d:1168","Wer ist dieser JEMAND?","Who is HE?","","","Info_Saturas_XARDAS_15_03","",""
"Scripts/content/Story/MISSIONS/DIA_Kdw_600_Saturas.d:1169","Also gut, also gut!","Alright, alright!","","","Info_Saturas_XARDAS_14_04","",""
"Scripts/content/Story/MISSIONS/DIA_Kdw_600_Saturas.d:1170","Vor vielen, vielen Jahren ...","Many, many years ago...","","","Info_Saturas_XARDAS_14_05","",""
"Scripts/content/Story/MISSIONS/DIA_Kdw_600_Saturas.d:1171","Bitte die Kurzform!","Give me the shortened version, please!","","","Info_Saturas_XARDAS_15_06","",""
"Scripts/content/Story/MISSIONS/DIA_Kdw_600_Saturas.d:1172","Geduld! Also, als wir - die zwölf Magier - damals die Barriere erschufen, wurden unsere magischen Kräfte von einem 13. Zauberer gelenkt und geleitet.","Be patient! Well, when we - the twelve magicians - created the Barrier back then, our magic powers were directed and controlled by a thirteenth magician.","","","Info_Saturas_XARDAS_14_07","",""
"Scripts/content/Story/MISSIONS/DIA_Kdw_600_Saturas.d:1173","Ein 13. Zauberer? Ich dachte, es hätte nur zwölf gegeben!","A thirteenth magician? I thought there were only twelve!","","","Info_Saturas_XARDAS_15_08","",""
"Scripts/content/Story/MISSIONS/DIA_Kdw_600_Saturas.d:1174","Die meisten, die die ersten Tage der Kolonie nicht miterlebt haben, glauben das.","Most people who did not experience the early days of the colony believe that.","","","Info_Saturas_XARDAS_14_09","",""
"Scripts/content/Story/MISSIONS/DIA_Kdw_600_Saturas.d:1175","Dieser 13. Zauberer war einst unser Anführer. Das alles war, bevor wir uns in den Feuer- und Wasserkreis zerstritten haben.","This thirteenth magician was our leader. All this took place before we were divided into the Circles of Fire and Water.","","","Info_Saturas_XARDAS_14_10","",""
"Scripts/content/Story/MISSIONS/DIA_Kdw_600_Saturas.d:1176","Doch er verließ das Alte Lager, das damals noch das einzige Lager in der Kolonie war.","But he left the Old Camp, which was once the only camp of the colony.","","","Info_Saturas_XARDAS_14_11","",""
"Scripts/content/Story/MISSIONS/DIA_Kdw_600_Saturas.d:1188","Wie heißt dieser 13. Zauberer?","What is this thirteenth magician called?","","","Info_Saturas_XARDASWHO.description","",""
"Scripts/content/Story/MISSIONS/DIA_Kdw_600_Saturas.d:1201","Wie heißt dieser 13. Zauberer?","What is this thirteenth magician called?","","","Info_Saturas_XARDASWHO_15_01","",""
