"location","source","target","id","fuzzy","context","translator_comments","developer_comments"
"Scripts/content/Story/MISSIONS/DIA_Kdw_603_Nefarius.d:165","Was gibt es Neues von unseren Freunden aus dem alten Lager?","Есть какие-нибудь новости от наших друзей из Старого лагеря?","","False","Info_Nefarius_OCNews_04_00","",""
"Scripts/content/Story/MISSIONS/DIA_Kdw_603_Nefarius.d:166","Gomez hat alle Feuermagier töten lassen!","Гомез расправился с магами огня!","","False","Info_Nefarius_OCNews_15_01","",""
"Scripts/content/Story/MISSIONS/DIA_Kdw_603_Nefarius.d:167","Nein! Dieser Hund! Ich hatte Corristo gewarnt - ihm war noch nie zu trauen! Du mußt Saturas davon berichten!","Нет! Кретин! Я предупреждал Корристо! Ему нельзя доверять! Ты должен рассказать об этом Сатурасу!","","False","Info_Nefarius_OCNews_04_02","",""
"Scripts/content/Story/MISSIONS/DIA_Kdw_603_Nefarius.d:170","Warte!","Подожди!","","","Info_Nefarius_OCNews_04_03","",""
"Scripts/content/Story/MISSIONS/DIA_Kdw_603_Nefarius.d:171","Du hast große Gefahren auf dich genommen, um uns zu dienen.","Ради нас ты пережил много опасностей и встретил их достойно.","","","Info_Nefarius_OCNews_04_04","",""
"Scripts/content/Story/MISSIONS/DIA_Kdw_603_Nefarius.d:172","Ich denke, du bist jetzt bereit, die Robe eines Wassermagiers zu tragen.","Думаю, что теперь ты готов носить одеяние магов воды.","","False","Info_Nefarius_OCNews_04_05","",""
"Scripts/content/Story/MISSIONS/DIA_Kdw_603_Nefarius.d:173","Aber nun sprich mit Saturas! Beeile dich!","Но сейчас ты должен поговорить с Сатурасом! Торопись!","","","Info_Nefarius_OCNews_04_06","",""
"Scripts/content/Story/MISSIONS/DIA_Kdw_604_Cronos.d:66","Ich habe einen Brief für den obersten Feuermagier.","У меня письмо к верховному магу Круга огня.","","False","KDW_604_Cronos_Brief.description","",""
"Scripts/content/Story/MISSIONS/DIA_Kdw_604_Cronos.d:82","Ich habe einen Brief für den obersten Feuermagier.","У меня письмо к верховному магу Круга огня.","","False","DIA_Cronos_Brief_15_00","",""
"Scripts/content/Story/MISSIONS/DIA_Kdw_604_Cronos.d:83","Wir sind die Magier vom Kreis des Wassers. Die Magier vom Kreis des Feuers findest du im alten Lager.","Все мы здесь - маги Круга воды. Маги Круга огня живут в Старом лагере.","","False","DIA_Cronos_Brief_08_01","",""
"Scripts/content/Story/MISSIONS/DIA_Kdw_604_Cronos.d:84","Aber ich komme nicht in die Burg. Kannst du mir helfen?","Но я не могу попасть в замок. Ты можешь помочь мне?","","","DIA_Cronos_Brief_15_02","",""
"Scripts/content/Story/MISSIONS/DIA_Kdw_604_Cronos.d:85","Nun, gelegentlich senden wir Boten zu unseren Brüdern ins Alte Lager...","Ну, время от времени мы посылаем гонцов к нашим братьям в Старом лагере...","","False","DIA_Cronos_Brief_08_03","",""
"Scripts/content/Story/MISSIONS/DIA_Kdw_604_Cronos.d:86","Aber wir vertrauen diese Nachrichten nur Lares' Leuten an. Seit vielen Jahren sorgt er schon dafür, dass unsere Nachrichten sicher ankommen.","Но свои послания мы доверяем только людям Ларса. Вот уже много лет он следит за тем, чтобы наши гонцы добирались до пункта назначения.","","","DIA_Cronos_Brief_08_04","",""
"Scripts/content/Story/MISSIONS/DIA_Kdw_604_Cronos.d:98","Ihr wollt die Barriere zerstören - wie genau soll das gehen?","Вы хотите уничтожить Барьер, но как именно вы собираетесь это сделать?","","False","KDW_604_Cronos_Barrier.description","",""
"Scripts/content/Story/MISSIONS/DIA_Kdw_604_Cronos.d:111","Ihr wollt die Barriere zerstören - wie genau soll das gehen?","Вы хотите уничтожить Барьер, но как именно вы собираетесь это сделать?","","False","DIA_Cronos_Barrier_15_00","",""
"Scripts/content/Story/MISSIONS/DIA_Kdw_604_Cronos.d:112","Wir brauchen eine große Menge magisches Erz.","Нам потребуются большие запасы магической руды.","","","DIA_Cronos_Barrier_08_01","",""
"Scripts/content/Story/MISSIONS/DIA_Kdw_604_Cronos.d:113","In einem großen magischen Ritual werden wir die gesamte magische Energie freilassen und somit die Barriere sprengen.","Освободив ее силу во время особой церемонии, мы уничтожим Барьер.","","","DIA_Cronos_Barrier_08_02","",""
"Scripts/content/Story/MISSIONS/DIA_Kdw_604_Cronos.d:114","Natürlich zieht eine solch große Menge Erz allerlei Lumpen und Banditen an!","Конечно, запасы руды привлекают множество воров и мошенников!","","","DIA_Cronos_Barrier_08_03","",""
"Scripts/content/Story/MISSIONS/DIA_Kdw_604_Cronos.d:115","Also brauchen wir jeden Mann, der bereit ist unseren Plan zu verteidigen.","Именно поэтому нам нужны люди, готовые защищать наш план.","","","DIA_Cronos_Barrier_08_04","",""
"Scripts/content/Story/MISSIONS/DIA_Kdw_604_Cronos.d:127","Ich will bei euch mitmachen!","Я хочу присоединиться к вам!","","","KDW_604_Cronos_WannaJoin.description","",""
"Scripts/content/Story/MISSIONS/DIA_Kdw_604_Cronos.d:140","Ich will bei euch mitmachen!","Я хочу присоединиться к вам!","","","DIA_Cronos_WannaJoin_15_00","",""
"Scripts/content/Story/MISSIONS/DIA_Kdw_604_Cronos.d:141","Wenn du dich uns anschließen willst, solltest du zu Lee oder Lares gehen.","Если ты хочешь стать одним из нас, ты должен поговорить с Ли или с Ларсом.","","","DIA_Cronos_WannaJoin_08_01","",""
"Scripts/content/Story/MISSIONS/DIA_Kdw_604_Cronos.d:153","Ich will Magier werden!","Я хочу стать магом!","","","KDW_604_Cronos_WannaMage.description","",""
"Scripts/content/Story/MISSIONS/DIA_Kdw_604_Cronos.d:166","Ich will Magier werden!","Я хочу стать магом!","","","DIA_Cronos_WannaMage_15_00","",""
"Scripts/content/Story/MISSIONS/DIA_Kdw_604_Cronos.d:167","Wir können es uns nicht leisten unser Wissen unter unseren Feinden zu verbreiten.","Мы не можем распространять наши знания среди своих врагов.","","","DIA_Cronos_WannaMage_08_01","",""
"Scripts/content/Story/MISSIONS/DIA_Kdw_604_Cronos.d:168","Erst wenn du deine Loyalität zu uns unter Beweis gestellt hast, werden wir überhaupt in Erwägung ziehen, dich zu unterweisen.","О твоем обучении не может быть и речи до тех пор, пока ты не докажешь нам свою преданность.","","","DIA_Cronos_WannaMage_08_02","",""
"Scripts/content/Story/MISSIONS/DIA_Kdw_604_Cronos.d:186","Ich gehöre jetzt zu Lares. Hast du eine Nachricht für die Feuermagier?","Теперь я один из людей Ларса. Где послание для магов огня?","","False","KDW_604_Cronos_Bandit.description","",""
"Scripts/content/Story/MISSIONS/DIA_Kdw_604_Cronos.d:199","Ich bin jetzt einer von Lares Leuten. Hast du eine Nachricht für die Feuermagier, die ich überbringen könnte?","Теперь я один из людей Ларса. У тебя есть послание, которое ты хотел бы отправить со мной магам огня?","","False","DIA_Cronos_Bandit_15_00","",""
"Scripts/content/Story/MISSIONS/DIA_Kdw_604_Cronos.d:200","In der Tat. Aber du brauchst das Zeichen eines unserer Boten, sonst lassen dich Gomez Schergen nicht in die Burg.","Несомненно, есть. Но у тебя должен быть знак гонца, иначе люди Гомеза не пропустят тебя в замок.","","","DIA_Cronos_Bandit_08_01","",""
"Scripts/content/Story/MISSIONS/DIA_Kdw_604_Cronos.d:201","Hier, nimm Brief und Zeichen. Und nun beeile dich!","Вот, возьми письмо и этот знак. И поспеши!","","","DIA_Cronos_Bandit_08_02","",""
"Scripts/content/Story/MISSIONS/DIA_Kdw_604_Cronos.d:218","Ich habe deine Nachricht überbracht!","Я передал ваше послание!","","","KDW_604_Cronos_BriefBack.description","",""
"Scripts/content/Story/MISSIONS/DIA_Kdw_604_Cronos.d:231","Ich habe deine Nachricht überbracht!","Я передал ваше послание!","","","DIA_Cronos_BriefBack_15_00","",""
"Scripts/content/Story/MISSIONS/DIA_Kdw_604_Cronos.d:232","Ah gut! Hier ist eine kleine Entschädigung für deine Mühen...","А, хорошо! Вот тебе небольшая награда за труды...","","","DIA_Cronos_BriefBack_08_01","",""
"Scripts/content/Story/MISSIONS/DIA_Kdw_604_Cronos.d:255","Ich habe wichtige Nachrichten für Saturas!","У меня важное послание для Сатураса!","","","Info_Cronos_NEWS.description","",""
"Scripts/content/Story/MISSIONS/DIA_Kdw_604_Cronos.d:269","Ich habe wichtige Nachrichten für Saturas!","У меня важное послание для Сатураса!","","","Info_Cronos_NEWS_15_01","",""
"Scripts/content/Story/MISSIONS/DIA_Kdw_604_Cronos.d:270","Was könnte schon so wichtig sein, dass unser spiritueller Anführer seine wertvollen Studien dafür unterbrechen sollte?","Что такого важного в этом послании, чтобы наш духовный лидер отрывался ради него от своих исследований?","","","Info_Cronos_NEWS_08_02","",""
"Scripts/content/Story/MISSIONS/DIA_Kdw_604_Cronos.d:282","Cor Kalom hat die Bruderschaft verlassen!","Кор Галом покинул Братство!","","","Info_Cronos_KALOM.description","",""
"Scripts/content/Story/MISSIONS/DIA_Kdw_604_Cronos.d:295","Cor Kalom hat mit ein paar fanatischen Templern die Bruderschaft verlassen!","Кор Галом покинул Братство вместе с несколькими фанатиками-стражами!","","False","Info_Cronos_KALOM_15_01","",""
"Scripts/content/Story/MISSIONS/DIA_Kdw_604_Cronos.d:296","Er will unbedingt den Schläfer auf eigene Faust finden und ihn erwecken.","Он хочет сам найти Спящего и пробудить его во что бы то ни стало.","","","Info_Cronos_KALOM_15_02","",""
"Scripts/content/Story/MISSIONS/DIA_Kdw_604_Cronos.d:297","Ich habe ihm noch nie getraut. Zweiter Guru hin oder her, er ist verblendet, hinterhältig und zu allem fähig.","Я никогда не доверял ему. Второй гуру или нет, он всегда был коварным, тщеславным и способным на все.","","False","Info_Cronos_KALOM_08_03","",""
"Scripts/content/Story/MISSIONS/DIA_Kdw_604_Cronos.d:298","Sicher ist die Bruderschaft ohne ihn besser dran!","Братство прекрасно обойдется и без него!","","","Info_Cronos_KALOM_08_04","",""
"Scripts/content/Story/MISSIONS/DIA_Kdw_604_Cronos.d:299","Ich werde Saturas bei Gelegenheit davon berichten. Geh nun!","Как только появится возможность, я расскажу об этом Сатурасу. Теперь иди!","","","Info_Cronos_KALOM_08_05","",""
"Scripts/content/Story/MISSIONS/DIA_Kdw_604_Cronos.d:313","Y'Berion, der Anführer des Sektenlagers, ist tot!","Ю'Берион, глава лагеря сектантов, мертв!","","False","Info_Cronos_YBERION.description","",""
"Scripts/content/Story/MISSIONS/DIA_Kdw_604_Cronos.d:326","Y'Berion, der Anführer des Sektenlagers, ist tot!","Ю'Берион, глава лагеря сектантов, мертв!","","False","Info_Cronos_YBERION_15_01","",""
"Scripts/content/Story/MISSIONS/DIA_Kdw_604_Cronos.d:327","WAAAS??? Wie konnte das geschehen?","ЧТО?! Как это могло случиться?","","False","Info_Cronos_YBERION_08_02","",""
"Scripts/content/Story/MISSIONS/DIA_Kdw_604_Cronos.d:328","Die Bruderschaft führte ein Ritual durch, eine Anrufung ihres Gottes.","Братство проводило магический ритуал, призывая своего бога.","","","Info_Cronos_YBERION_15_03","",""
"Scripts/content/Story/MISSIONS/DIA_Kdw_604_Cronos.d:329","Die mentalen Anstrengungen waren wohl zu viel für Y'Berion.","Похоже, умственное напряжение оказалось слишком сильным для Ю'Бериона.","","False","Info_Cronos_YBERION_15_04","",""
"Scripts/content/Story/MISSIONS/DIA_Kdw_604_Cronos.d:330","Das ist sehr traurig. Y'Berion war ein zuverlässiger Verbündeter.","Как жаль. Ю'Берион был верным союзником.","","False","Info_Cronos_YBERION_08_05","",""
"Scripts/content/Story/MISSIONS/DIA_Kdw_604_Cronos.d:331","Aber es rechtfertigt nicht die Störung der Studien von Saturas.","Но я не вижу причины прерывать занятия Сатураса.","","","Info_Cronos_YBERION_08_06","",""
"Scripts/content/Story/MISSIONS/DIA_Kdw_604_Cronos.d:345","Die Gurus haben erkannt, dass sie einen üblen Erzdämonen anbeten!","Гуру выяснили, что все это время они молились злому демону!","","","Info_Cronos_SLEEPER.description","",""
"Scripts/content/Story/MISSIONS/DIA_Kdw_604_Cronos.d:358","Die Gurus haben erkannt, dass sie einen üblen Erzdämonen anbeten!","Гуру выяснили, что все это время они молились злому демону!","","","Info_Cronos_SLEEPER_15_01","",""
"Scripts/content/Story/MISSIONS/DIA_Kdw_604_Cronos.d:359","Sie halten ihren Schläfer jetzt plötzlich für einen Dämonen?","Значит, теперь они считают своего Спящего демоном?","","","Info_Cronos_SLEEPER_08_02","",""
"Scripts/content/Story/MISSIONS/DIA_Kdw_604_Cronos.d:360","Hört sich nach einer weiteren Verworrenheit der Bruderschaft an, aber ...","Похоже на очередную безумную идею Братства, но...","","","Info_Cronos_SLEEPER_08_03","",""
"Scripts/content/Story/MISSIONS/DIA_Kdw_604_Cronos.d:361","... Sollten sie Recht haben ... könnten wir alle hier in der Kolonie in großer Gefahr sein.","...если они действительно правы... вся колония может быть в огромной опасности.","","False","Info_Cronos_SLEEPER_08_04","",""
"Scripts/content/Story/MISSIONS/DIA_Kdw_604_Cronos.d:362","Das musst du sofort Saturas berichten. Er muss entscheiden, was zu tun ist.","Ты должен немедленно доложить об этом Сатурасу. Он решит, что делать.","","","Info_Cronos_SLEEPER_08_05","",""
"Scripts/content/Story/MISSIONS/DIA_Kdw_604_Cronos.d:363","Wo finde ich Saturas?","Где мне найти Сатураса?","","","Info_Cronos_SLEEPER_15_06","",""
"Scripts/content/Story/MISSIONS/DIA_Kdw_604_Cronos.d:364","Begib dich zur obersten Ebene. Sage den Wachen dort, du hast meine Erlaubnis zum passieren.","Поднимись на верхний уровень. Скажи стражникам, что я позволил тебе пройти.","","","Info_Cronos_SLEEPER_08_07","",""
"Scripts/content/Story/MISSIONS/DIA_Kdw_604_Cronos.d:365","Die Parole lautet TETRIANDOCH.","Пароль - 'ТЕТРИАНДОХ'.","","False","Info_Cronos_SLEEPER_08_08","",""
"Scripts/content/Story/MISSIONS/DIA_Kdw_604_Cronos.d:366","Saturas findest du beim großen Pentagramm.","Ты найдешь Сатураса у пентаграммы.","","","Info_Cronos_SLEEPER_08_09","",""
"Scripts/content/Story/MISSIONS/DIA_Kdw_604_Cronos.d:367","Er gibt sich dort fast den ganzen Tag seinen Studien über die Sprengung des großen Erzhaufens hin.","Там он проводит все дни, пытаясь понять, как можно взорвать нашу Железную гору.","","False","Info_Cronos_SLEEPER_08_10","",""
"Scripts/content/Story/MISSIONS/DIA_Kdw_604_Cronos.d:385","Wie war die Parole nochmal?","Назови мне еще раз пароль.","","","Info_Cronos_PAROLE.description","",""
"Scripts/content/Story/MISSIONS/DIA_Kdw_604_Cronos.d:398","Wie war die Parole noch mal?","Назови мне еще раз пароль.","","","Info_Cronos_PAROLE_15_01","",""
"Scripts/content/Story/MISSIONS/DIA_Kdw_604_Cronos.d:399","Du bist vergesslicher als meine Großmutter. Sie lautet 'TETRIANDOCH","Память у тебя, как у моей бабушки. Пароль - 'ТЕТРИАНДОХ'.","","False","Info_Cronos_PAROLE_08_02","",""
"Scripts/content/Story/MISSIONS/DIA_Kdw_604_Cronos.d:411","Saturas sagte, du hättest eine Belohnung für mich.","Сатурас сказал, что ты приготовил для меня награду.","","","Info_Cronos_REWARD.description","",""
"Scripts/content/Story/MISSIONS/DIA_Kdw_604_Cronos.d:424","Saturas sagte, du hättest eine Belohnung für mich.","Сатурас сказал, что ты приготовил для меня награду.","","","Info_Cronos_REWARD_15_01","",""
"Scripts/content/Story/MISSIONS/DIA_Kdw_604_Cronos.d:425","Als Hüter des Erzes möchte ich für deine großen Dienste für unser Lager einen kleinen Teil des Erzes in deine Hände geben.","Как Хранитель руды я хочу поделиться с тобой ее малой толикой в знак признательности за те великие дела, которые ты совершил для нашего лагеря.","","False","Info_Cronos_REWARD_08_02","",""
"Scripts/content/Story/MISSIONS/DIA_Kdw_604_Cronos.d:426","Ich hoffe, du hast eine ebenso sinnvolle Verwendung wie wir dafür!","Надеюсь, тебе она послужит не хуже, чем нам!","","","Info_Cronos_REWARD_08_03","",""
"Scripts/content/Story/MISSIONS/DIA_Kdw_604_Cronos.d:459","Deine Entscheidung, zu den Wassermagiern zu kommen, war richtig. Willkommen, Bruder!","Ты принял правильное решение - присоединиться к магам воды. Добро пожаловать, брат!","","False","KDW_604_Cronos_WELCOME_Info_08_01","",""
"Scripts/content/Story/MISSIONS/DIA_Kdw_604_Cronos.d:474","Ich benötige mehr magische Kraft","Я хочу увеличить силу своей магии.","","False","KDW_604_Cronos_MANA.description","",""
"Scripts/content/Story/MISSIONS/DIA_Kdw_604_Cronos.d:488","Ich benötige mehr magische Kraft","Я хочу увеличить силу своей магии.","","False","KDW_604_Cronos_MANA_Info_15_01","",""
"Scripts/content/Story/MISSIONS/DIA_Kdw_604_Cronos.d:489","Ich kann dir helfen, deine Kraft zu steigern. Setze sie mit Bedacht ein!","Я могу помочь тебе увеличить силу. Используй ее с умом.","","","KDW_604_Cronos_MANA_Info_08_02","",""
"Scripts/content/Story/MISSIONS/DIA_Kdw_604_Cronos.d:545","Ich möchte Schriften über Magie erwerben.","Я хочу овладеть магическими письменами.","","","KDW_604_Cronos_SELLSTUFF_Info_15_01","",""
"Scripts/content/Story/MISSIONS/DIA_Kdw_604_Cronos.d:557","Ich grüße dich, Magier","Приветствую тебя, Маг!","","False","KDW_604_Cronos_GREET.description","",""
"Scripts/content/Story/MISSIONS/DIA_Kdw_604_Cronos.d:567","Ich grüße dich, Magier.","Приветствую тебя, Маг!","","","KDW_604_Cronos_GREET_Info_15_01","",""
"Scripts/content/Story/MISSIONS/DIA_Kdw_604_Cronos.d:568","Der Segen Adanos sei mit dir. Ich kann dir helfen, deine geistige Kraft zu stärken oder dir ein paar nützliche Dinge anbieten.","Да пребудет с тобой благословение Аданоса! Я могу увеличить силу твоей магии или дать тебе нечто полезное.","","","KDW_604_Cronos_GREET_Info_08_02","",""
"Scripts/content/Story/MISSIONS/DIA_Kdw_604_Cronos.d:569","Was kann ich für dich tun?","Что я могу для тебя сделать?","","","KDW_604_Cronos_GREET_Info_08_03","",""
"Scripts/content/Story/MISSIONS/DIA_Kdw_605_Riordian.d:44","Saturas schickt mich.","Меня прислал Сатурас.","","False","Info_Riordian_NEWS.description","",""
"Scripts/content/Story/MISSIONS/DIA_Kdw_605_Riordian.d:57","Saturas schickt mich.","Меня прислал Сатурас.","","False","Info_Riordian_NEWS_15_01","",""
"Scripts/content/Story/MISSIONS/DIA_Kdw_605_Riordian.d:58","Ahhh, komm näher. Ich bin bereits informiert.","А-а-а-а, заходи. Мне уже доложили.","","False","Info_Riordian_NEWS_14_02","",""
"Scripts/content/Story/MISSIONS/DIA_Kdw_605_Riordian.d:59","Hier nimm diese Tränke, da ist von jedem was dabei.","Вот, возьми эти эликсиры. Здесь все, что тебе может понадобиться.","","","Info_Riordian_NEWS_14_03","",""
"Scripts/content/Story/MISSIONS/DIA_Kdw_605_Riordian.d:60","Nun geh und bring uns die Fokussteine. Diese Artefakte sind unsere einzige Hoffnung.","Теперь иди и отыщи эти камни. В них наша последняя надежда.","","False","Info_Riordian_NEWS_14_04","",""
"Scripts/content/Story/MISSIONS/DIA_Kdw_605_Riordian.d:85","Saturas sagt, du hättest eine Belohnung für mich?","Сатурас сказал, что ты приготовил для меня награду?","","","Info_Riordian_REWARD.description","",""
"Scripts/content/Story/MISSIONS/DIA_Kdw_605_Riordian.d:98","Saturas sagt, du hättest eine Belohnung für mich?","Сатурас сказал, что ты приготовил для меня награду?","","","Info_Riordian_REWARD_15_01","",""
"Scripts/content/Story/MISSIONS/DIA_Kdw_605_Riordian.d:99","Ahhhh, komm näher, komm näher.","А-а-а-а, заходи, заходи.","","False","Info_Riordian_REWARD_14_02","",""
"Scripts/content/Story/MISSIONS/DIA_Kdw_605_Riordian.d:100","Unser spiritueller Führer hat mir von deinen Heldentaten berichtet.","Наш духовный лидер рассказал мне о твоих героических подвигах.","","","Info_Riordian_REWARD_14_03","",""
"Scripts/content/Story/MISSIONS/DIA_Kdw_605_Riordian.d:101","Wir alle hier im Lager, ja in der ganzen Kolonie sind dir zu großem Dank verpflichtet.","Все обитатели лагеря - да что там, все жители колонии - в глубоком долгу перед тобой.","","False","Info_Riordian_REWARD_14_04","",""
"Scripts/content/Story/MISSIONS/DIA_Kdw_605_Riordian.d:102","Nimm dies als einen bescheidenen Ausgleich für all deine Mühen.","Прими же от нас эту скромную награду.","","","Info_Riordian_REWARD_14_05","",""
"Scripts/content/Story/MISSIONS/DIA_Kdw_605_Riordian.d:153","Gut, dass du kommst! Ich habe schon auf dich gewartet!","Рад, что ты пришел! Я ждал тебя!","","","Info_Riordian_MESSAGE_14_01","",""
"Scripts/content/Story/MISSIONS/DIA_Kdw_605_Riordian.d:165","Du hast auf mich gewartet? Warum?","Ты ждал меня? Зачем?","","","Info_Riordian_MESSAGEWHY.description","",""
"Scripts/content/Story/MISSIONS/DIA_Kdw_605_Riordian.d:178","Du hast auf mich gewartet? Warum?","Ты ждал меня? Зачем?","","","Info_Riordian_MESSAGEWHY_15_01","",""
"Scripts/content/Story/MISSIONS/DIA_Kdw_605_Riordian.d:179","Gorn bat mich, dich bei deinem Auftauchen hier sofort zu ihm zu schicken!","Горн просил отправить тебя к нему, как только ты появишься.","","","Info_Riordian_MESSAGEWHY_14_02","",""
"Scripts/content/Story/MISSIONS/DIA_Kdw_605_Riordian.d:180","Was ist los?","Что случилось?","","","Info_Riordian_MESSAGEWHY_15_03","",""
"Scripts/content/Story/MISSIONS/DIA_Kdw_605_Riordian.d:181","Er hat einen Plan zur Befreiung der besetzten Mine.","У него есть план, как освободить захваченную шахту.","","","Info_Riordian_MESSAGEWHY_14_04","",""
"Scripts/content/Story/MISSIONS/DIA_Kdw_605_Riordian.d:182","Bewacht er noch den Zugang zur Mine?","Он по-прежнему охраняет вход в шахту?","","","Info_Riordian_MESSAGEWHY_15_05","",""
"Scripts/content/Story/MISSIONS/DIA_Kdw_605_Riordian.d:183","Ja! Bitte suche ihn so schnell wie möglich auf!","Да. Прошу тебя, отправляйся к нему как можно скорее.","","","Info_Riordian_MESSAGEWHY_14_06","",""
"Scripts/content/Story/MISSIONS/DIA_Kdw_605_Riordian.d:207","Gut, dass du uns beigetreten bist.","Я рад, что ты теперь с нами.","","","KDW_605_Riordian_WELCOME_Info_14_01","",""
"Scripts/content/Story/MISSIONS/DIA_Kdw_605_Riordian.d:230","Wenn du verletzt bist, werde ich dich heilen.","Если ты ранен, я вылечу тебя.","","","KDW_605_Riordian_HEAL_Info_14_01","",""
"Scripts/content/Story/MISSIONS/DIA_Kdw_605_Riordian.d:241","Ich bin verletzt. Kannst du mich heilen?","Я ранен. Ты можешь мне помочь?","","","KDW_605_Riordian_HEALINFO.description","",""
"Scripts/content/Story/MISSIONS/DIA_Kdw_605_Riordian.d:255","Ich bin verletzt. Kannst du mich heilen?","Я ранен. Ты можешь мне помочь?","","","KDW_605_Riordian_HEALINFO_Info_15_01","",""
