"location","source","target","id","fuzzy","context","translator_comments","developer_comments"
"Scripts/content/Story/MISSIONS/DIA_PC_Fighter.d:23","Auf in den Kampf!","Защищайся!","","","Info_Gorn_EXIT_09_01","",""
"Scripts/content/Story/MISSIONS/DIA_PC_Fighter.d:27","Bis später.","Увидимся.","","","Info_Gorn_EXIT_09_02","",""
"Scripts/content/Story/MISSIONS/DIA_PC_Fighter.d:55","Hey. Ein neues Gesicht.","Эй. Новые лица.","","","DIA_Gorn_First_09_00","",""
"Scripts/content/Story/MISSIONS/DIA_PC_Fighter.d:56","Wer bist du?","Как тебя зовут?","","","DIA_Gorn_First_15_01","",""
"Scripts/content/Story/MISSIONS/DIA_PC_Fighter.d:57","Ich bin Gorn. Söldner der Magier.","Я - Горн, наемник на службе у магов.","","","DIA_Gorn_First_09_02","",""
"Scripts/content/Story/MISSIONS/DIA_PC_Fighter.d:69","Was machst du als Söldner der Magier?","И в чем заключаются твои обязанности?","","","DIA_Gorn_Leben.description","",""
"Scripts/content/Story/MISSIONS/DIA_PC_Fighter.d:82","Was machst du als Söldner der Magier?","И в чем заключаются твои обязанности?","","","DIA_Gorn_Leben_15_00","",""
"Scripts/content/Story/MISSIONS/DIA_PC_Fighter.d:83","Lee hat mit den Magiern eine Abmachung getroffen. Er heuert die besten Kämpfer an, die in der Kolonie zu finden sind. Also uns.","Ли заключил с магами сделку. Он нанял лучших бойцов в колонии - то есть нас.","","","DIA_Gorn_Leben_09_01","",""
"Scripts/content/Story/MISSIONS/DIA_PC_Fighter.d:84","Wir sorgen dafür, dass die Schürfer ungestört Erz abbauen können und halten den Magiern den Rücken frei.","Мы охраняем магов и заботимся о том, чтобы рудокопы могли работать спокойно.","","","DIA_Gorn_Leben_09_02","",""
"Scripts/content/Story/MISSIONS/DIA_PC_Fighter.d:85","Die Magier kümmern sich darum, dass wir hier rauskommen. Und einen kleinen Teil des Erzes bekommen wir als Sold.","Маги должны позаботиться о том, чтобы рано или поздно все мы смогли убраться отсюда. А еще мы получаем малую толику руды в качестве платы за службу. ","","","DIA_Gorn_Leben_09_03","",""
"Scripts/content/Story/MISSIONS/DIA_PC_Fighter.d:99","Kann ich hier irgendwo pennen?","Можно где-нибудь здесь остановиться?","","","DIA_Gorn_Hut.description","",""
"Scripts/content/Story/MISSIONS/DIA_PC_Fighter.d:112","Kann ich hier irgendwo pennen, ohne dass ich vorher jemanden aus seiner Hütte prügeln muss?","Можно где-нибудь здесь остановиться - так, чтобы не пришлось никого выкидывать из дома?","","","DIA_Gorn_Hut_15_00","",""
"Scripts/content/Story/MISSIONS/DIA_PC_Fighter.d:113","Ich fürchte nicht. Aber wenn du das wirklich vorhast, geh zu Shrike.","Не думаю. Но если так уж приспичило, поговори со Шрайком.","","","DIA_Gorn_Hut_09_01","",""
"Scripts/content/Story/MISSIONS/DIA_PC_Fighter.d:114","Er hat sich die Hütte ganz vorne am Höhleneingang geschnappt. Sie stand leer - aber eigentlich gehörte sie uns.","Он занял дом напротив, рядом со входом в пещеру. Дом был пустой - но принадлежал-то он нам.","","","DIA_Gorn_Hut_09_02","",""
"Scripts/content/Story/MISSIONS/DIA_PC_Fighter.d:115","Uns?","Нам?","","","DIA_Gorn_Hut_15_03","",""
"Scripts/content/Story/MISSIONS/DIA_PC_Fighter.d:116","Den Söldnern eben. Söldner und Banditen leben hier getrennt. Und normalerweise hat keiner aus Lares' Bande was auf dieser Seite des großen Loches zu suchen.","Ну, нам, наемникам. Наемники и воры живут раздельно, и ни один из шайки Ларса не должен появляться по эту сторону от большой дыры.","","","DIA_Gorn_Hut_09_04","",""
"Scripts/content/Story/MISSIONS/DIA_PC_Fighter.d:117","Im Grunde ist es völlig egal. Aber er hat niemanden gefragt. Und man kann den Banditen nicht alles durchgehen lassen, sonst werden sie aufmüpfig!","На самом деле, разницы никакой. Но Шрайк никого и не спрашивал. А ворам нельзя позволять делать все, что заблагорассудится, иначе они наглеют!","","","DIA_Gorn_Hut_09_05","",""
"Scripts/content/Story/MISSIONS/DIA_PC_Fighter.d:134","Shrike hat sich eine andere Hütte gesucht.","Шрайк переехал в другой дом.","","","DIA_Gorn_HutFree.description","",""
"Scripts/content/Story/MISSIONS/DIA_PC_Fighter.d:147","Shrike hat sich eine andere Hütte gesucht.","Шрайк переехал в другой дом.","","","DIA_Gorn_HutFree_15_00","",""
"Scripts/content/Story/MISSIONS/DIA_PC_Fighter.d:148","Gut. Gerade noch hat mich Torlof drauf angesprochen, dass er dem Burschen das Fell über die Ohren ziehen wollte.","Хорошо. Торлоф только что сказал мне, что хочет переговорить с парнем.","","","DIA_Gorn_HutFree_09_01","",""
"Scripts/content/Story/MISSIONS/DIA_PC_Fighter.d:165","Was muss ich tun, um im Neuen Lager aufgenommen zu werden?","Что нужно сделать, чтобы присоединиться к Новому Лагерю?","","","DIA_Gorn_BecomeSLD.description","",""
"Scripts/content/Story/MISSIONS/DIA_PC_Fighter.d:179","Was muss ich tun, um im Neuen Lager aufgenommen zu werden?","Что нужно сделать, чтобы присоединиться к Новому Лагерю?","","","DIA_Gorn_BecomeSLD_15_00","",""
"Scripts/content/Story/MISSIONS/DIA_PC_Fighter.d:180","Bevor dich Lee aufnimmt, musst du lernen, besser zu kämpfen. Egal, mit welcher Waffe, aber du musst gut sein.","Прежде чем говорить об этом с Ли, ты должен научиться хорошо драться - неважно, каким оружием.","","","DIA_Gorn_BecomeSLD_09_01","",""
"Scripts/content/Story/MISSIONS/DIA_PC_Fighter.d:181","Außerdem musst du viel Erfahrung haben mit dem Leben hier und allem.","Помимо этого, ты должен знать все про здешнюю жизнь и ее законы.","","","DIA_Gorn_BecomeSLD_09_02","",""
"Scripts/content/Story/MISSIONS/DIA_PC_Fighter.d:182","Wenn du keine Lust hast, in die anderen Lager zu gehen, solltest du dich den Banditen anschließen, bevor du als Söldner anfängst.","Если ты не собираешься появляться в других Лагерях, стоит попробовать присоединиться к воровской шайке, прежде чем пытаться стать наемником.","","","DIA_Gorn_BecomeSLD_09_03","",""
"Scripts/content/Story/MISSIONS/DIA_PC_Fighter.d:238","Hast du noch mehr von dem Zeug?","Сколько у тебя этого добра?","","","DIA_Gorn_TRADE_15_00","",""
"Scripts/content/Story/MISSIONS/DIA_PC_Fighter.d:239","Jede Menge. Willst du handeln?","Полно. Хочешь купить?","","","DIA_Gorn_TRADE_09_01","",""
"Scripts/content/Story/MISSIONS/DIA_PC_Fighter.d:251","Wie kommt es, dass du dich an einem Überfall der Bande beteiligt hast?","Зачем ты участвовал в налете?","","","DIA_Gorn_DuHehler.description","",""
"Scripts/content/Story/MISSIONS/DIA_PC_Fighter.d:264","Wie kommt es, dass du dich an einem Überfall der Bande beteiligt hast?","Зачем ты участвовал в налете?","","","DIA_Gorn_DuHehler_15_00","",""
"Scripts/content/Story/MISSIONS/DIA_PC_Fighter.d:265","Wer sagt, dass es so war?","Кто сказал, что я участвовал?","","","DIA_Gorn_DuHehler_09_01","",""
"Scripts/content/Story/MISSIONS/DIA_PC_Fighter.d:266","Warum hast du sonst so viel von diesem Zeug?","Если это не так, откуда у тебя столько товара?","","","DIA_Gorn_DuHehler_15_02","",""
"Scripts/content/Story/MISSIONS/DIA_PC_Fighter.d:267","Denk bloß nicht, dass das alles von EINEM Fischzug kommt.","Не думаешь же ты, что все это - ОДИН улов?","","","DIA_Gorn_DuHehler_09_03","",""
"Scripts/content/Story/MISSIONS/DIA_PC_Fighter.d:268","Du beteiligst dich regelmäßig an den Überfällen?","Так ты постоянно участвуешь в налетах?","","","DIA_Gorn_DuHehler_15_04","",""
"Scripts/content/Story/MISSIONS/DIA_PC_Fighter.d:269","Wenn es so wäre, könnte ich es dir nicht sagen. Lee sieht so was nämlich gar nicht gerne.","Если и так, тебе я об этом не скажу. Ли это не понравится.","","","DIA_Gorn_DuHehler_09_05","",""
"Scripts/content/Story/MISSIONS/DIA_PC_Fighter.d:270","Verstehe.","Понятно.","","","DIA_Gorn_DuHehler_15_06","",""
"Scripts/content/Story/MISSIONS/DIA_PC_Fighter.d:315","Ahh, du bist es! Mein Freund Lester aus dem Sumpflager hat mir erzählt, was du dort alles vollbracht hast.","А-а, это ты! Мой друг Лестер из Болотного Лагеря рассказал мне о твоих подвигах.","","","Info_Gorn_NCWAIT_09_01","",""
"Scripts/content/Story/MISSIONS/DIA_PC_Fighter.d:316","Für jemanden, der noch nicht so lange hier ist, hast du es schon weit gebracht.","Совсем неплохо для человека, который появился здесь не так уж давно.","","","Info_Gorn_NCWAIT_09_02","",""
"Scripts/content/Story/MISSIONS/DIA_PC_Fighter.d:317","Es hat oft nicht viel gefehlt, und ich wäre als Futter für die Würmer geendet.","Да, но несколько раз я был совсем близок к тому, чтобы отправиться на корм червям.","","","Info_Gorn_NCWAIT_15_03","",""
"Scripts/content/Story/MISSIONS/DIA_PC_Fighter.d:329","Ich habe eine wichtige Botschaft für die Wassermagier!","У меня важное послание для магов Воды!","","","Info_Gorn_MAGES.description","",""
"Scripts/content/Story/MISSIONS/DIA_PC_Fighter.d:342","Ich habe eine wichtige Botschaft für die Wassermagier!","У меня важное послание для магов Воды!","","","Info_Gorn_MAGES_15_01","",""
"Scripts/content/Story/MISSIONS/DIA_PC_Fighter.d:343","Dann sprich am besten gleich mit Saturas. Er ist der oberste Wassermagier und studiert den ganzen Tag irgendwelche Schriften.","Тогда тебе нужно поговорить с Сатурасом. Он главный среди водяных магов, все дни проводит за какими-то письменами или чем-то еще.","","","Info_Gorn_MAGES_09_02","",""
"Scripts/content/Story/MISSIONS/DIA_PC_Fighter.d:344","Aber egal, wie wichtig die Botschaft auch ist, die Wachen zur oberen Ebene werden dich nicht zu ihm durch lassen.","Но стражники на верхнем уровне не пропустят тебя к нему, каким бы важным ни было твое послание.","","","Info_Gorn_MAGES_09_03","",""
"Scripts/content/Story/MISSIONS/DIA_PC_Fighter.d:345","Kannst du nicht ein gutes Wort für mich einlegen?","Не замолвишь за меня словечко?","","","Info_Gorn_MAGES_15_04","",""
"Scripts/content/Story/MISSIONS/DIA_PC_Fighter.d:346","Ich nicht, aber Cronos, der Hüter des Erzes, kann dir vielleicht eine Erlaubnis erteilen.","Я - нет, но ты можешь получить разрешение у Кроноса, хранителя руды.","","","Info_Gorn_MAGES_09_05","",""
"Scripts/content/Story/MISSIONS/DIA_PC_Fighter.d:358","Wo finde ich diesen 'Hüter des Erzes'?","Где мне искать этого 'хранителя руды'?","","","Info_Gorn_CRONOS.description","",""
"Scripts/content/Story/MISSIONS/DIA_PC_Fighter.d:371","Wo finde ich diesen 'Hüter des Erzes'?","Где мне искать этого 'хранителя руды'?","","","Info_Gorn_CRONOS_15_01","",""
"Scripts/content/Story/MISSIONS/DIA_PC_Fighter.d:372","Wenn du von hier weitergehst, stößt du nach dem Damm auf die große Wohnhöhle.","Если пойдешь отсюда, за дамбой увидишь большую пещеру.","","","Info_Gorn_CRONOS_09_01a","",""
"Scripts/content/Story/MISSIONS/DIA_PC_Fighter.d:373","Cronos hält sich normalerweise am Gitter über dem großen Erzhaufen auf.","Кронос обычно стоит у решетки возле железной горы.","","","Info_Gorn_CRONOS_09_02","",""
"Scripts/content/Story/MISSIONS/DIA_PC_Fighter.d:374","Aber er ist ein wenig arrogant. Du wirst ihn überzeugen müssen, dass deine Botschaft wichtig ist.","Но наш хранитель - довольно высокомерный тип. Тебе придется убедить его в том, что твое послание действительно важно.","","","Info_Gorn_CRONOS_09_03","",""
"Scripts/content/Story/MISSIONS/DIA_PC_Fighter.d:409","Hallo, Neuer. Wie du siehst, ist die Kolonie ein kleiner Ort.","Привет, салага! Как видишь, этот мир тесен, и колония не является исключением.","","","Info_Gorn_RUINWAIT_09_01","",""
"Scripts/content/Story/MISSIONS/DIA_PC_Fighter.d:410","Man läuft sich hier ständig über den Weg.","Все время натыкаешься на своих знакомых.","","","Info_Gorn_RUINWAIT_09_02","",""
"Scripts/content/Story/MISSIONS/DIA_PC_Fighter.d:422","Was führt dich denn hier her?","Чем ты занимаешься?","","","Info_Gorn_RUINWHAT.description","",""
"Scripts/content/Story/MISSIONS/DIA_PC_Fighter.d:435","Was führt dich denn hierher?","Что ты здесь делаешь?","","","Info_Gorn_RUINWHAT_15_01","",""
"Scripts/content/Story/MISSIONS/DIA_PC_Fighter.d:436","Oh, ich versuche, einer alten Legende auf die Spur zu kommen.","А-а, пытаюсь поймать за хвост одну старую легенду.","","","Info_Gorn_RUINWHAT_09_02","",""
"Scripts/content/Story/MISSIONS/DIA_PC_Fighter.d:437","Einer Legende?","Легенду?","","","Info_Gorn_RUINWHAT_15_03","",""
"Scripts/content/Story/MISSIONS/DIA_PC_Fighter.d:438","Ja, Milten, mein Kumpel aus dem Alten Lager, hat mir erzählt, dass hier einst Mönche lebten.","Да, мой приятель из Старого Лагеря, Мильтен, говорил мне, что когда-то здесь жили монахи.","","","Info_Gorn_RUINWHAT_09_04","",""
"Scripts/content/Story/MISSIONS/DIA_PC_Fighter.d:439","Das war natürlich lange, bevor es die Barriere gab.","Конечно, это было задолго до того, как появился Барьер.","","","Info_Gorn_RUINWHAT_09_05","",""
"Scripts/content/Story/MISSIONS/DIA_PC_Fighter.d:440","Sie sollen einem Gott gehuldigt haben, der seinen Anhängern die Macht gab, sich in Tiere zu verwandeln.","Говорят, они молились богу, который даровал им способность превращаться в животных.","","","Info_Gorn_RUINWHAT_09_06","",""
"Scripts/content/Story/MISSIONS/DIA_PC_Fighter.d:441","Bestimmt gibt es hier noch Schätze aus der alten Zeit.","Уверен, со старых времен здесь должна была сохраниться куча сокровищ.","","","Info_Gorn_RUINWHAT_09_07","",""
"Scripts/content/Story/MISSIONS/DIA_PC_Fighter.d:445","Was führt dich hierher?","Что привело тебя сюда?","","","Info_Gorn_RUINWHAT_09_08","",""
"Scripts/content/Story/MISSIONS/DIA_PC_Fighter.d:458","Ich suche einen magischen Fokus","Я ищу юнитор.","","","Info_Gorn_RUINFOCUS.description","",""
"Scripts/content/Story/MISSIONS/DIA_PC_Fighter.d:471","Ich suche einen magischen Fokus.","Я ищу юнитор.","","","Info_Gorn_RUINFOCUS_15_01","",""
"Scripts/content/Story/MISSIONS/DIA_PC_Fighter.d:472","Er muss irgendwo in dieser Gegend sein.","Он должен быть где-то здесь.","","","Info_Gorn_RUINFOCUS_15_02","",""
"Scripts/content/Story/MISSIONS/DIA_PC_Fighter.d:473","Was du suchst, befindet sich vielleicht innerhalb der Klosterruinen dort jenseits der Schlucht.","Эта штука может быть в руинах старого монастыря по ту сторону ущелья.","","","Info_Gorn_RUINFOCUS_09_03","",""
"Scripts/content/Story/MISSIONS/DIA_PC_Fighter.d:485","Wir könnten unseren Weg gemeinsam fortsetzen.","Мы могли бы пойти вместе.","","","Info_Gorn_RUINJOIN.description","",""
"Scripts/content/Story/MISSIONS/DIA_PC_Fighter.d:498","Wir können unseren Weg gemeinsam fortsetzen.","Мы могли бы пойти вместе.","","","Info_Gorn_RUINJOIN_15_01","",""
"Scripts/content/Story/MISSIONS/DIA_PC_Fighter.d:499","Gute Idee. Hier wimmelt es nur so von Snappern.","Хорошая идея. Тут полно глорхов.","","","Info_Gorn_RUINJOIN_09_02","",""
"Scripts/content/Story/MISSIONS/DIA_PC_Fighter.d:500","Einzeln sind sie für einen geübten Kämpfer zwar kein Problem, aber sie jagen meistens in Rudeln.","Один глорх - не проблема для опытного охотника, но, к сожалению, чаще всего они охотятся стаями.","","","Info_Gorn_RUINJOIN_09_03","",""
"Scripts/content/Story/MISSIONS/DIA_PC_Fighter.d:501","So ein Rudel kann auch den gewieftesten Schwertmeister in Fetzen reißen.","А стая глорхов без труда порвет на тряпки самого опытного воина.","","","Info_Gorn_RUINJOIN_09_04","",""
"Scripts/content/Story/MISSIONS/DIA_PC_Fighter.d:502","Wir gehen also zusammen?","Так мы идем вместе?","","","Info_Gorn_RUINJOIN_15_05","",""
"Scripts/content/Story/MISSIONS/DIA_PC_Fighter.d:503","Ok, doch bevor wir über diesen Baumstamm balancieren, möchte ich die Schlucht darunter erforschen. Ich habe gerne einen freien Rücken.","Да, но прежде чем идти, я хочу осмотреть ущелье. Не люблю оставлять врага за спиной.","","","Info_Gorn_RUINJOIN_09_06","",""
"Scripts/content/Story/MISSIONS/DIA_PC_Fighter.d:504","Komm mit, ich habe einen Weg entdeckt, der uns dorthin führt.","Идем, я нашел дорогу.","","","Info_Gorn_RUINJOIN_09_07","",""
"Scripts/content/Story/MISSIONS/DIA_PC_Fighter.d:539","Das nenne ich Glück. Hier scheint eine Vorratshöhle gewesen zu sein.","Вот это я называю удачей. Похоже, эту пещеру использовали как склад.","","","Info_Gorn_RUINABYSS_09_01","",""
"Scripts/content/Story/MISSIONS/DIA_PC_Fighter.d:540","Übernimm du jetzt die Führung, ich wollte nur sicherstellen, dass bei unserer Rückkehr hier keine Überraschung auf uns wartet.","Почему бы тебе не пойти вперед? Хочу убедиться, что никто не будет поджидать нас на обратном пути.","","","Info_Gorn_RUINABYSS_09_02","",""
"Scripts/content/Story/MISSIONS/DIA_PC_Fighter.d:573","Du scheinst doch nicht mehr an der Klosterruine interessiert zu sein.","Кажется, ты потерял интерес к монастырским руинам.","","","Info_Gorn_RUINLEAVE_09_01","",""
"Scripts/content/Story/MISSIONS/DIA_PC_Fighter.d:574","Ich werde alleine weitergehen.","Я пойду один.","","","Info_Gorn_RUINLEAVE_09_02","",""
"Scripts/content/Story/MISSIONS/DIA_PC_Fighter.d:575","Komm einfach nach, wenn du es dir anders überlegst.","Если передумаешь, ступай следом.","","","Info_Gorn_RUINLEAVE_09_03","",""
"Scripts/content/Story/MISSIONS/DIA_PC_Fighter.d:606","Dieses verfluchte Tor. Man erzählt sich, dass bisher kein Mensch in der Kolonie es öffnen konnte.","Эти чертовы ворота! Говорят, что еще никому в колонии не удавалось открыть их.","","","Info_Gorn_RUINWALL_09_01","",""
"Scripts/content/Story/MISSIONS/DIA_PC_Fighter.d:607","Die kleinen Biester da drüben scheinen die Einzigen zu sein, die es geschafft haben, in den Innenhof zu gelangen.","Только этим мелким тварям удается без труда проникать во внутренний двор.","","","Info_Gorn_RUINWALL_09_02","",""
"Scripts/content/Story/MISSIONS/DIA_PC_Fighter.d:625","Wie geht es nun weiter?","Что теперь?","","","Info_Gorn_RUINWALLWHAT.description","",""
"Scripts/content/Story/MISSIONS/DIA_PC_Fighter.d:639","Wie geht es nun weiter?","Что теперь?","","","Info_Gorn_RUINWALLWHAT_15_01","",""
"Scripts/content/Story/MISSIONS/DIA_PC_Fighter.d:640","Du musst einen Weg finden, auf die andere Seite des Tors zu gelangen.","Нужно найти способ, как перебраться через ворота.","","","Info_Gorn_RUINWALLWHAT_09_02","",""
"Scripts/content/Story/MISSIONS/DIA_PC_Fighter.d:668","Dort oben ist eine Art Plattform. Aber es scheint zu hoch zu sein, um zu klettern.","Видишь эту площадку, вон там? Но она высоко, не забраться.","","","Info_Gorn_RUINLEDGE_09_01","",""
"Scripts/content/Story/MISSIONS/DIA_PC_Fighter.d:669","Wir müssen einen anderen Weg finden.","Придется поискать другой путь.","","","Info_Gorn_RUINLEDGE_09_02","",""
"Scripts/content/Story/MISSIONS/DIA_PC_Fighter.d:699","Sieht aus wie ein Podest für irgendetwas.","Похоже на какой-то пьедестал.","","","Info_Gorn_RUINPLATFORM_09_01","",""
"Scripts/content/Story/MISSIONS/DIA_PC_Fighter.d:700","Vielleicht lag hier mal das Artefakt, dass du suchst.","Похоже, тот артефакт, который ты ищешь, лежал здесь.","","","Info_Gorn_RUINPLATFORM_09_02","",""
"Scripts/content/Story/MISSIONS/DIA_PC_Fighter.d:729","Du hast es tatsächlich geschafft, das Tor zu öffnen. Das mit dem Zauber war wirklich clever.","Ты все-таки открыл эти ворота! Хитрое заклинание!","","","Info_Gorn_RUINGATE_09_01","",""
"Scripts/content/Story/MISSIONS/DIA_PC_Fighter.d:730","Los, weiter geht's.","Идем дальше.","","","Info_Gorn_RUINGATE_15_02","",""
"Scripts/content/Story/MISSIONS/DIA_PC_Fighter.d:765","Du scheinst doch nicht mehr an der Klosterruine interessiert zu sein.","Кажется, ты потерял интерес к монастырским руинам.","","","Info_Gorn_RUINLEAVEINSIDE_09_01","",""
"Scripts/content/Story/MISSIONS/DIA_PC_Fighter.d:766","Ich werde alleine weitersuchen.","Я пойду один.","","","Info_Gorn_RUINLEAVEINSIDE_09_02","",""
"Scripts/content/Story/MISSIONS/DIA_PC_Fighter.d:767","Komm einfach nach, wenn du es dir anders überlegst.","Если передумаешь, ступай следом.","","","Info_Gorn_RUINLEAVEINSIDE_09_03","",""
"Scripts/content/Story/MISSIONS/DIA_PC_Fighter.d:798","Du hast dein magisches Artefakt also gefunden!","Ты все-таки нашел свой артефакт!","","","Info_Gorn_RUINSUCCESS_09_01","",""
"Scripts/content/Story/MISSIONS/DIA_PC_Fighter.d:799","Ja. Ich muss den Fokus zu den Wassermagiern bringen. Sie brauchen ihn.","Ага. Я должен отнести его магам Воды. ","","","Info_Gorn_RUINSUCCESS_15_02","",""
"Scripts/content/Story/MISSIONS/DIA_PC_Fighter.d:800","Ich werde dich noch etwas begleiten.","Я составлю тебе кампанию еще на какое-то время.","","","Info_Gorn_RUINSUCCESS_09_03","",""
"Scripts/content/Story/MISSIONS/DIA_PC_Fighter.d:834","ACH DU SCHEISSE!!! Was ist das für ein Riesenvieh dort drüben?","О, ЧЕРТ!!! Что это за тварь там?","","","Info_Gorn_RUINTROLL_09_01","",""
"Scripts/content/Story/MISSIONS/DIA_PC_Fighter.d:835","Wo kommt DAS denn her???","Откуда взялось ЭТО?","","","Info_Gorn_RUINTROLL_15_02","",""
"Scripts/content/Story/MISSIONS/DIA_PC_Fighter.d:836","Sieht aus wie einer dieser fast unverwundbaren Trolle. Allerdings etwas kleiner!","Похоже на одного из этих неуязвимых троллей, только размером поменьше!","","","Info_Gorn_RUINTROLL_09_03","",""
"Scripts/content/Story/MISSIONS/DIA_PC_Fighter.d:837","Wie auch immer, wenn wir hier raus wollen, müssen wie an diesem Biest vorbei.","Что бы это ни было, если мы хотим убраться отсюда, нам придется разделаться с этой тварью.","","","Info_Gorn_RUINTROLL_09_04","",""
"Scripts/content/Story/MISSIONS/DIA_PC_Fighter.d:873","Das war ein hartes Stück Arbeit.","Непростая работенка.","","","Info_Gorn_RUINVICTORY_09_01","",""
"Scripts/content/Story/MISSIONS/DIA_PC_Fighter.d:874","Ja, wir haben das Monster bezwungen. Doch wenn das nur ein junger Troll war ...","Уф! С чудовищем мы разобрались, но если это был всего лишь МОЛОДОЙ тролль...","","","Info_Gorn_RUINVICTORY_15_02","",""
"Scripts/content/Story/MISSIONS/DIA_PC_Fighter.d:875","... dann willst du wohl einem ausgewachsenen Exemplar lieber nicht zwischen die Finger geraten.","…тогда нам лучше не попадаться на глаза его родителям, верно?","","","Info_Gorn_RUINVICTORY_09_03","",""
"Scripts/content/Story/MISSIONS/DIA_PC_Fighter.d:876","So in etwa.","Что-то вроде того.","","","Info_Gorn_RUINVICTORY_15_04","",""
