"location","source","target","id","fuzzy","context","translator_comments","developer_comments"
"Scripts/content/Story/MISSIONS/DIA_GUR_1200_YBerion.d:45","Was machst du hier? Wer hat dich hereingelassen? Wache!","Что ты здесь делаешь? Кто тебя впустил? Стража!","","","DIA_YBerion_Wache_12_00","",""
"Scripts/content/Story/MISSIONS/DIA_GUR_1200_YBerion.d:57","Sei gegrüßt, Meister Y'Berion.","Приветствую вас, господин Ю`Берион!","","","DIA_YBerion_Kennen.description","",""
"Scripts/content/Story/MISSIONS/DIA_GUR_1200_YBerion.d:70","Sei gegrüßt, Meister Y'Berion.","Приветствую вас, господин Ю`Берион!","","","DIA_YBerion_Kennen_15_00","",""
"Scripts/content/Story/MISSIONS/DIA_GUR_1200_YBerion.d:71","Ah! Du kommst mir bekannt vor!","А! Я тебя знаю!","","","DIA_YBerion_Kennen_12_01","",""
"Scripts/content/Story/MISSIONS/DIA_GUR_1200_YBerion.d:72","Unmöglich. Wir haben uns noch nie gesehen.","Это невозможно. Мы никогда не встречались прежде.","","","DIA_YBerion_Kennen_15_02","",""
"Scripts/content/Story/MISSIONS/DIA_GUR_1200_YBerion.d:73","Und ich dachte ... Nun gut - was willst du?","Но мне казалось... Хорошо - что тебе нужно?","","","DIA_YBerion_Kennen_12_03","",""
"Scripts/content/Story/MISSIONS/DIA_GUR_1200_YBerion.d:86","Mir kam zu Ohren, du suchst etwas","Я слышал, вы кое-что ищете.","","","Info_YBerion_BringFocus.description","",""
"Scripts/content/Story/MISSIONS/DIA_GUR_1200_YBerion.d:102","Mir kam zu Ohren, du suchst etwas.","Я слышал, вы кое-что ищете.","","","Sit_2_PSI_Yberion_BringFocus_Info_15_01","",""
"Scripts/content/Story/MISSIONS/DIA_GUR_1200_YBerion.d:103","Das ist richtig. Wir brauchen einen magischen Fokus.","Верно. Нам нужен магический юнитор.","","","Sit_2_PSI_Yberion_BringFocus_Info_12_02","",""
"Scripts/content/Story/MISSIONS/DIA_GUR_1200_YBerion.d:104","Wir haben den Novizen Nyras losgeschickt, um den Fokus zu holen. Doch er ist bisher nicht zurückgekehrt.","Мы послали одного из новичков - Нираса - забрать его, но он до сих пор не вернулся.","","","Sit_2_PSI_Yberion_BringFocus_Info_12_03","",""
"Scripts/content/Story/MISSIONS/DIA_GUR_1200_YBerion.d:105","Du könntest für mich nachsehen, was passiert ist!","Не мог бы ты узнать, что произошло?","","","Sit_2_PSI_Yberion_BringFocus_Info_12_04","",""
"Scripts/content/Story/MISSIONS/DIA_GUR_1200_YBerion.d:109","Ich werde den Fokus zurückbringen!","Я принесу вам юнитор.","","","Info_YBerion_BringFocus.Info_YBerion_BringFocus_OK","Info_AddChoice",""
"Scripts/content/Story/MISSIONS/DIA_GUR_1200_YBerion.d:110","Wo soll ich suchen?","Откуда я должен начать поиски?","","","Info_YBerion_BringFocus.Info_YBerion_BringFocus_WO","Info_AddChoice",""
"Scripts/content/Story/MISSIONS/DIA_GUR_1200_YBerion.d:111","Was hat es mit dem Fokus auf sich?","Почему этот юнитор так важен?","","","Info_YBerion_BringFocus.Info_YBerion_BringFocus_FOKUS","Info_AddChoice",""
"Scripts/content/Story/MISSIONS/DIA_GUR_1200_YBerion.d:121","Ich werde den Fokus zurückbringen!","Я принесу вам юнитор.","","","Sit_2_PSI_Yberion_BringFocus_OK_15_01","",""
"Scripts/content/Story/MISSIONS/DIA_GUR_1200_YBerion.d:122","Nimm diese Karte hier, dort ist der Ort des Fokus verzeichnet.","Возьми эту карту. На ней отмечено место, где находится юнитор.","","","Sit_2_PSI_Yberion_BringFocus_OK_12_02","",""
"Scripts/content/Story/MISSIONS/DIA_GUR_1200_YBerion.d:131","Wo soll ich suchen?","Откуда я должен начать поиски?","","","Sit_2_PSI_Yberion_BringFocus_WO_15_01","",""
"Scripts/content/Story/MISSIONS/DIA_GUR_1200_YBerion.d:132","Wenn du das Lager verlässt, wende dich nach rechts und steige hinauf zur großen Klippe. Dort, hinter dem Wald, wo du das Meer sehen kannst, wirst du den Fokus finden.","На выходе из лагеря поверни направо и поднимайся на высокую скалу. За лесом ты увидишь море, и там ты найдешь юнитор.","","False","Sit_2_PSI_Yberion_BringFocus_WO_12_02","",""
"Scripts/content/Story/MISSIONS/DIA_GUR_1200_YBerion.d:137","Was hat es mit dem Fokus auf sich?","Почему этот юнитор так важен?","","","Sit_2_PSI_Yberion_BringFocus_FOKUS_15_01","",""
"Scripts/content/Story/MISSIONS/DIA_GUR_1200_YBerion.d:138","Es ist ein magischer Gegenstand, der unsere geistigen Kräfte vereinigen wird.","Этот магический артефакт способен концентрировать нашу силу.","","","Sit_2_PSI_Yberion_BringFocus_FOKUS_12_02","",""
"Scripts/content/Story/MISSIONS/DIA_GUR_1200_YBerion.d:139","Es handelt sich dabei um einen der fünf Fokussteine, den die Magier zum Errichten der Barriere benutzt haben.","Это один из пяти камней, с помощью которых маги сотворили Барьер.","","","Sit_2_PSI_Yberion_BringFocus_FOKUS_12_03","",""
"Scripts/content/Story/MISSIONS/DIA_GUR_1200_YBerion.d:140","In einer Vision sah ich, dass wir uns die Kraft eines Fokus zu Nutze machen müssen.","Мне было видение о том, что мы должны использовать силу этого камня.","","","Sit_2_PSI_Yberion_BringFocus_FOKUS_12_04","",""
"Scripts/content/Story/MISSIONS/DIA_GUR_1200_YBerion.d:141","War wohl eine ziemlich spannende Vision.","Какое интересное видение!","","","Sit_2_PSI_Yberion_BringFocus_FOKUS_15_05","",""
"Scripts/content/Story/MISSIONS/DIA_GUR_1200_YBerion.d:142","Meine Vision war ein Zeichen vom Schläfer. Mit dem Fokus können wir ihn erreichen!","Мое видение было ниспослано Спящим. Мы сможем призвать его с помощью юнитора!","","","Sit_2_PSI_Yberion_BringFocus_FOKUS_12_06","",""
"Scripts/content/Story/MISSIONS/DIA_GUR_1200_YBerion.d:152","Ich habe den Fokus immer noch nicht gefunden.","Я так и не нашел юнитор.","","","Info_YBerion_BringFocus_RUNNING.description","",""
"Scripts/content/Story/MISSIONS/DIA_GUR_1200_YBerion.d:165","Ich habe den Fokus immer noch nicht gefunden.","Я так и не нашел юнитор.","","","Info_YBerion_BringFocus_RUNNING_15_01","",""
"Scripts/content/Story/MISSIONS/DIA_GUR_1200_YBerion.d:166","Dann suche weiter. Der Schläfer wird dir den Weg weisen.","Ну так ищи его! Спящий укажет тебе путь.","","","Info_YBerion_BringFocus_RUNNING_12_02","",""
"Scripts/content/Story/MISSIONS/DIA_GUR_1200_YBerion.d:176","Ich habe den Fokus gefunden","Я нашел юнитор.","","","Info_YBerion_BringFocus_Success.description","",""
"Scripts/content/Story/MISSIONS/DIA_GUR_1200_YBerion.d:189","Ich habe den Fokus gefunden.","Я нашел юнитор.","","","Info_YBerion_BringFocus_Success_15_01","",""
"Scripts/content/Story/MISSIONS/DIA_GUR_1200_YBerion.d:190","Hervorragend. Du hast uns einen großen Dienst erwiesen.","Превосходно! Ты оказал нам всем неоценимую услугу.","","","Info_YBerion_BringFocus_Success_12_02","",""
"Scripts/content/Story/MISSIONS/DIA_GUR_1200_YBerion.d:191","Bring nun den Fokus zu Cor Kalom. Er wird wissen, was zu tun ist.","Теперь отнеси юнитор Кор Галому. Он знает, что делать.","","","Info_YBerion_BringFocus_Success_12_03","",""
"Scripts/content/Story/MISSIONS/DIA_GUR_1200_YBerion.d:194","Wo kann ich diesen Cor Kalom finden?","Где я могу найти этого Кор Галома?","","","Info_YBerion_BringFocus_Success_15_04","",""
"Scripts/content/Story/MISSIONS/DIA_GUR_1200_YBerion.d:195","Er hält sich die meiste Zeit im Alchemielabor auf der oberen Stegebene auf.","Большую часть времени он проводит в своей лаборатории в верхней части платформ.","","","Info_YBerion_BringFocus_Success_12_05","",""
"Scripts/content/Story/MISSIONS/DIA_GUR_1200_YBerion.d:196","Frag Lester am Eingang des Lagers ... Er führt öfter Neulinge herum.","У входа в лагерь ты найдешь Лестера. Он обычно показывает новичкам, где что находится.","","False","Info_YBerion_BringFocus_Success_12_06","",""
"Scripts/content/Story/MISSIONS/DIA_GUR_1200_YBerion.d:217","Der Novize Nyras hat den Verstand verloren!","Этот новичок, Нирас, - он сошел с ума!","","","Info_YBerion_NYRAS.description","",""
"Scripts/content/Story/MISSIONS/DIA_GUR_1200_YBerion.d:230","Der Novize Nyras hat den Verstand verloren!","Этот новичок, Нирас, - он сошел с ума!","","","Info_YBerion_NYRAS_15_01","",""
"Scripts/content/Story/MISSIONS/DIA_GUR_1200_YBerion.d:231","Er faselte davon, dass der Schläfer zu ihm gesprochen habe und ihn als einzigen Diener auserwählte!","Он твердит, что с ним говорил Спящий и избрал его своим единственным слугой!","","","Info_YBerion_NYRAS_15_02","",""
"Scripts/content/Story/MISSIONS/DIA_GUR_1200_YBerion.d:232","Dann griff er mich sogar an und wollte mich töten!","А затем он попытался убить меня!","","","Info_YBerion_NYRAS_15_03","",""
"Scripts/content/Story/MISSIONS/DIA_GUR_1200_YBerion.d:233","Die Macht des Schläfers ist so gewaltig, dass sie unvorbereitete Seelen in Verwirrung stürzen kann.","Могущество Спящего слишком велико для разума непосвященных.","","","Info_YBerion_NYRAS_12_04","",""
"Scripts/content/Story/MISSIONS/DIA_GUR_1200_YBerion.d:234","Nur wir Gurus haben durch jahrelanges Meditieren die seelische Stärke gewonnen, die Stimme des allmächtigen Schläfers zu ertragen!","Лишь мы, гуру, после долгих лет медитации смогли достичь той силы духа, что позволяет нам выносить голос всемогущего Спящего.","","False","Info_YBerion_NYRAS_12_05","",""
"Scripts/content/Story/MISSIONS/DIA_GUR_1200_YBerion.d:244","Wie siehts mit einer Belohnung aus?","А как насчет небольшой награды?","","","GUR_1200_Yberion_EARN.description","",""
"Scripts/content/Story/MISSIONS/DIA_GUR_1200_YBerion.d:257","Wie sieht's mit einer Belohnung aus?","А как насчет небольшой награды?","","","GUR_1200_Yberion_EARN_Info_15_01","",""
"Scripts/content/Story/MISSIONS/DIA_GUR_1200_YBerion.d:258","Da du kein Bruder unserer Gemeinschaft bist, werde ich dich entlohnen.","Поскольку ты не являешься членом Братства, я награжу тебя.","","","GUR_1200_Yberion_EARN_Info_12_02","",""
"Scripts/content/Story/MISSIONS/DIA_GUR_1200_YBerion.d:259","Nimm dieses Amulett als Zeichen meiner Dankbarkeit.","Прими этот амулет в знак моей благодарности.","","","GUR_1200_Yberion_EARN_Info_12_03","",""
"Scripts/content/Story/MISSIONS/DIA_GUR_1201_CorKalom.d:24","Was willst du?","Что тебе нужно?","","","GUR_1201_CorKalom_FIRST_10_00","",""
"Scripts/content/Story/MISSIONS/DIA_GUR_1201_CorKalom.d:37","Ich will in die Bruderschaft aufgenommen werden.","Я хочу стать одним из членов Братства.","","","GUR_1201_CorKalom_WannaJoin.description","",""
"Scripts/content/Story/MISSIONS/DIA_GUR_1201_CorKalom.d:50","Ich will in die Bruderschaft aufgenommen werden.","Я хочу стать одним из членов Братства.","","","GUR_1201_CorKalom_WannaJoin_15_00","",""
"Scripts/content/Story/MISSIONS/DIA_GUR_1201_CorKalom.d:51","Ich habe gehört, du bist der Meister der Novizen, und entscheidest, wer aufgenommen wird.","Я слышал, ты командуешь послушниками и выбираешь среди них достойных.","","","GUR_1201_CorKalom_WannaJoin_15_01","",""
"Scripts/content/Story/MISSIONS/DIA_GUR_1201_CorKalom.d:52","Ich habe keine Zeit! Meine Experimente sind zu wichtig, als dass ich mich um neue Novizen kümmern könnte.","У меня нет времени! Мои эксперименты слишком важны, я не могу сейчас тратить время на новичков.","","","GUR_1201_CorKalom_WannaJoin_10_02","",""
"Scripts/content/Story/MISSIONS/DIA_GUR_1201_CorKalom.d:53","Ich verlasse mich auf das Urteil der Baals. Wenn sie sagen, dass du bereit bist, die Robe eines Novizen zu tragen, kehre zu mir zurück.","Я соглашусь с решением Идолов. Возвращайся, когда они скажут, что ты готов носить робу послушника.","","False","GUR_1201_CorKalom_WannaJoin_10_03","",""
"Scripts/content/Story/MISSIONS/DIA_GUR_1201_CorKalom.d:70","Einer der Händler aus dem alten Lager will ein Rezept von dir haben.","Один торговец из Старого лагеря ищет рецепт.","","False","GUR_1201_CorKalom_Recipe.description","",""
"Scripts/content/Story/MISSIONS/DIA_GUR_1201_CorKalom.d:83","Einer der Händler aus dem Alten Lager will das Rezept für einen Heiltrank von dir haben.","Один торговец из Старого лагеря ищет рецепт лечебного эликсира.","","False","GUR_1201_CorKalom_Recipe_15_00","",""
"Scripts/content/Story/MISSIONS/DIA_GUR_1201_CorKalom.d:84","Meine Rezepte sind unverkäuflich!","Мои рецепты не продаются!","","","GUR_1201_CorKalom_Recipe_10_01","",""
"Scripts/content/Story/MISSIONS/DIA_GUR_1201_CorKalom.d:99","Was machst du für Experimente?","Что за эксперименты ты проводишь?","","","GUR_1201_CorKalom_Experimente.description","",""
"Scripts/content/Story/MISSIONS/DIA_GUR_1201_CorKalom.d:112","Was machst du für Experimente?","Что за эксперименты ты проводишь?","","","GUR_1201_CorKalom_Experimente_15_00","",""
"Scripts/content/Story/MISSIONS/DIA_GUR_1201_CorKalom.d:113","Meine Forschung befindet sich auf einer Ebene, von der du nichts verstehst, Bursche. Also verschwende nicht meine Zeit!","Мои исследования находятся на уровне, недоступном для твоего понимания, мальчик. Не трать попусту мое время!","","","GUR_1201_CorKalom_Experimente_10_01","",""
"Scripts/content/Story/MISSIONS/DIA_GUR_1201_CorKalom.d:126","Ich bringe die tägliche Sumpfkrauternte!","Я принес дневной сбор болотника!","","","GUR_1201_CorKalom_BRINGWEED.description","",""
"Scripts/content/Story/MISSIONS/DIA_GUR_1201_CorKalom.d:139","Ich bringe die tägliche Sumpfkrauternte!","Я принес дневной сбор болотника!","","","GUR_1201_CorKalom_BRINGWEED_15_00","",""
"Scripts/content/Story/MISSIONS/DIA_GUR_1201_CorKalom.d:143","Und DAS soll alles sein??? Ich erwarte die KOMPLETTE Ernte, das sind mindestens 100 Stengel!!!","И ЭТО - все?! Мне нужен ПОЛНЫЙ сбор - минимум сотня стеблей!!!","","","GUR_1201_CorKalom_BRINGWEED_10_01","",""
"Scripts/content/Story/MISSIONS/DIA_GUR_1201_CorKalom.d:148","Ah, gib her. Und verzieh dich wieder!","А, давай сюда. И убирайся с глаз моих!","","","GUR_1201_CorKalom_BRINGWEED_10_02","",""
"Scripts/content/Story/MISSIONS/DIA_GUR_1201_CorKalom.d:172","Ich habe Crawlerzangen für dich...","Я принес тебе жвалы ползунов...","","","GUR_1201_CorKalom_Crawlerzangen.description","",""
"Scripts/content/Story/MISSIONS/DIA_GUR_1201_CorKalom.d:185","Ich habe Crawlerzangen für dich...","Я принес тебе жвалы ползунов...","","","GUR_1201_CorKalom_Crawlerzangen_15_00","",""
"Scripts/content/Story/MISSIONS/DIA_GUR_1201_CorKalom.d:189","Sehr gut. Nimm einige meiner besten Tränke als Belohnung.","Очень хорошо. В награду я дам тебе несколько лучших эликсиров.","","","GUR_1201_CorKalom_Crawlerzangen_10_01","",""
"Scripts/content/Story/MISSIONS/DIA_GUR_1201_CorKalom.d:195","Gut. Nimm ein paar Tränke als Belohnung.","Хорошо. В награду я дам тебе несколько эликсиров.","","","GUR_1201_CorKalom_Crawlerzangen_10_02","",""
"Scripts/content/Story/MISSIONS/DIA_GUR_1201_CorKalom.d:201","Hm. Das soll alles sein? Hier, nimm einen Manatrank und verschwinde.","Х-м. И это все? Вот, забирай магический эликсир и проваливай.","","","GUR_1201_CorKalom_Crawlerzangen_10_03","",""
"Scripts/content/Story/MISSIONS/DIA_GUR_1201_CorKalom.d:220","Ich glaube, ich habe die Baals überzeugt!","Похоже, мне удалось убедить Идолов!","","","GUR_1201_CorKalom_JoinPSI.description","",""
"Scripts/content/Story/MISSIONS/DIA_GUR_1201_CorKalom.d:237","Ich glaube, ich habe die Baals überzeugt!","Похоже, мне удалось убедить Идолов!","","","GUR_1201_CorKalom_JoinPSI_15_00","",""
"Scripts/content/Story/MISSIONS/DIA_GUR_1201_CorKalom.d:241","Baal Orun sagt, ich habe mich als würdiger Diener des Schläfers erwiesen.","Идол Оран сказал, что я достоин стать верным слугой Спящего.","","","GUR_1201_CorKalom_JoinPSI_15_01","",""
"Scripts/content/Story/MISSIONS/DIA_GUR_1201_CorKalom.d:247","Weiter ...","Продолжай...","","","GUR_1201_CorKalom_JoinPSI_10_02","",""
"Scripts/content/Story/MISSIONS/DIA_GUR_1201_CorKalom.d:248","Baal Cadar hält mich für einen gelehrigen Schüler.","Идол Кадар считает меня способным учеником.","","","GUR_1201_CorKalom_JoinPSI_15_03","",""
"Scripts/content/Story/MISSIONS/DIA_GUR_1201_CorKalom.d:254","Baal Namib ist überzeugt, dass ich ein wahrer Anhänger des Glaubens bin.","Идол Намиб называет меня истинно верующим.","","","GUR_1201_CorKalom_JoinPSI_15_04","",""
"Scripts/content/Story/MISSIONS/DIA_GUR_1201_CorKalom.d:260","Baal Tyon hatte dank mir eine Vision.","Благодаря мне Идола Тиона посетило видение.","","","GUR_1201_CorKalom_JoinPSI_15_05","",""
"Scripts/content/Story/MISSIONS/DIA_GUR_1201_CorKalom.d:266","Und?","И?","","","GUR_1201_CorKalom_JoinPSI_10_06","",""
"Scripts/content/Story/MISSIONS/DIA_GUR_1201_CorKalom.d:267","Baal Tondral sagt, ich soll die Robe erhalten. Ich habe einen neuen Schüler zu ihm geführt.","Идол Тондрал сказал, что я должен получить робу. Я привел к нему нового ученика.","","","GUR_1201_CorKalom_JoinPSI_15_07","",""
"Scripts/content/Story/MISSIONS/DIA_GUR_1201_CorKalom.d:276","Gut. Wenn die Baals für dich sprechen, dann soll mir das reichen.","Хорошо. Для меня вполне достаточно того, что тебя поддерживают Идолы.","","","GUR_1201_CorKalom_JoinPSI_10_08","",""
"Scripts/content/Story/MISSIONS/DIA_GUR_1201_CorKalom.d:277","Hier, zieh das an. Und jetzt geh und mach dich nützlich.","Вот, надень это. А теперь ступай и постарайся приносить пользу.","","","GUR_1201_CorKalom_JoinPSI_10_09","",""
"Scripts/content/Story/MISSIONS/DIA_GUR_1201_CorKalom.d:307","Und?","И?","","","GUR_1201_CorKalom_JoinPSI_NOT_10_00","",""
"Scripts/content/Story/MISSIONS/DIA_GUR_1201_CorKalom.d:308","Das war alles.","Это все.","","","GUR_1201_CorKalom_JoinPSI_NOT_15_01","",""
"Scripts/content/Story/MISSIONS/DIA_GUR_1201_CorKalom.d:309","Du stiehlst mir meine kostbare Zeit! Komm wieder, wenn mindestens vier der Baals dich für würdig erachten!","Ты попусту тратишь мое драгоценное время. Возвращайся, когда хотя бы четверо Идолов признают тебя достойным!","","","GUR_1201_CorKalom_JoinPSI_NOT_10_02","",""
"Scripts/content/Story/MISSIONS/DIA_GUR_1201_CorKalom.d:327","Das war alles? Kein 'Herzlich Willkommen', kein gar nichts?","Значит, так? Ни приветствий, ни добрых пожеланий - ничего?!","","","GUR_1201_CorKalom_JoinPSI2.description","",""
"Scripts/content/Story/MISSIONS/DIA_GUR_1201_CorKalom.d:340","Das war alles? Kein 'Herzlich Willkommen', kein gar nichts?","Значит, так? Ни тебе 'добро пожаловать', ни добрых пожеланий - ничего?!","","","GUR_1201_CorKalom_JoinPSI_15_10","",""
"Scripts/content/Story/MISSIONS/DIA_GUR_1201_CorKalom.d:341","Herzlich willkommen.","Добро пожаловать.","","","GUR_1201_CorKalom_JoinPSI_10_11","",""
"Scripts/content/Story/MISSIONS/DIA_GUR_1201_CorKalom.d:342","Gefällt mir schon viel besser.","Уже лучше.","","","GUR_1201_CorKalom_JoinPSI_15_12","",""
"Scripts/content/Story/MISSIONS/DIA_GUR_1201_CorKalom.d:343","Steh hier nicht rum! Tu was. Hier, nimm dieses Kraut und bring es zu Gomez ins alte Lager.","Перестань шляться без дела! Займись чем-нибудь. Вот, возьми этот болотник и отнеси его в Старый лагерь, Гомезу.","","False","GUR_1201_CorKalom_JoinPSI_10_13","",""
"Scripts/content/Story/MISSIONS/DIA_GUR_1201_CorKalom.d:344","Wenn dich seine Schergen nicht durchlassen wollen, sag ihnen Cor Kalom schickt dich.","Если его головорезы откажутся пропустить тебя, скажи им, что тебя послал Кор Галом.","","","GUR_1201_CorKalom_JoinPSI_10_14","",""
"Scripts/content/Story/MISSIONS/DIA_GUR_1201_CorKalom.d:354","Du bist ja immer noch hier!","Как, ты еще здесь?","","","GUR_1201_CorKalom_JoinPSI_10_15","",""
"Scripts/content/Story/MISSIONS/DIA_GUR_1201_CorKalom.d:369","Hast DU noch eine Aufgabe für mich?","У тебя есть для меня другое задание?","","","Info_Kalom_DrugMonopol.description","",""
"Scripts/content/Story/MISSIONS/DIA_GUR_1201_CorKalom.d:382","Hast DU noch eine Aufgabe für mich?","У тебя есть для меня другое задание?","","","Mis_1_Psi_Kalom_DrugMonopol_15_00","",""
"Scripts/content/Story/MISSIONS/DIA_GUR_1201_CorKalom.d:383","Im Neuen Lager gibt es eine kleine Gruppe von Männern, die ihre eigene Krautproduktion angefangen haben.","Несколько умников в Новом лагере начали сами добывать болотник.","","False","Mis_1_Psi_Kalom_DrugMonopol_10_01","",""
"Scripts/content/Story/MISSIONS/DIA_GUR_1201_CorKalom.d:385","Kümmere dich darum, dass sie die Produktion einstellen.","Проследи за тем, чтобы они прекратили производство.","","","Mis_1_Psi_Kalom_DrugMonopol_10_03","",""
"Scripts/content/Story/MISSIONS/DIA_GUR_1201_CorKalom.d:386","Und wie ...","Как...","","","Mis_1_Psi_Kalom_DrugMonopol_15_04","",""
"Scripts/content/Story/MISSIONS/DIA_GUR_1201_CorKalom.d:387","Belästige mich nicht mit Details!","Детали меня не интересуют!","","","Mis_1_Psi_Kalom_DrugMonopol_10_05","",""
"Scripts/content/Story/MISSIONS/DIA_GUR_1201_CorKalom.d:388","Die Krautmischer müssen ihr Lager irgendwo außerhalb des Neuen Lagers haben. Du weißt, was du zu tun hast.","Их лагерь должен находиться где-то за пределами Нового лагеря. Ты знаешь, что делать.","","False","Mis_1_Psi_Kalom_DrugMonopol_10_06","",""
"Scripts/content/Story/MISSIONS/DIA_GUR_1201_CorKalom.d:414","Wegen der Krautherstellung im Neuen Lager...","По поводу болотника в Новом лагере...","","False","Info_Kalom_Success.description","",""
"Scripts/content/Story/MISSIONS/DIA_GUR_1201_CorKalom.d:431","Wegen der Krautherstellung im Neuen Lager ...","По поводу болотника в Новом лагере...","","False","Mis_1_Psi_Kalom_Success_15_00","",""
"Scripts/content/Story/MISSIONS/DIA_GUR_1201_CorKalom.d:432","Ja?","Да?","","","Mis_1_Psi_Kalom_Success_10_01","",""
"Scripts/content/Story/MISSIONS/DIA_GUR_1201_CorKalom.d:436","Ich finde die Männer nicht.","Я не нашел этих людей.","","","Mis_1_Psi_Kalom_Success_15_02","",""
"Scripts/content/Story/MISSIONS/DIA_GUR_1201_CorKalom.d:437","Ich hatte nichts anderes von dir erwartet.","Ничего другого я от тебя и не ожидал.","","","Mis_1_Psi_Kalom_Success_10_03","",""
"Scripts/content/Story/MISSIONS/DIA_GUR_1201_CorKalom.d:442","Es gibt sie nicht mehr.","Вопрос решен.","","","Mis_1_Psi_Kalom_Success_15_04","",""
"Scripts/content/Story/MISSIONS/DIA_GUR_1201_CorKalom.d:443","Du überraschst mich. Ich hatte dich unterschätzt. Vielleicht könntest du uns doch zu etwas nützen.","Ты удивляешь меня. Я недооценивал твои способности. Похоже, ты можешь быть полезным.","","","Mis_1_Psi_Kalom_Success_10_05","",""
"Scripts/content/Story/MISSIONS/DIA_GUR_1201_CorKalom.d:463","Ich habe das Kraut abgeliefert.","Я доставил болотник.","","","Info_Kalom_KrautboteBACK.description","",""
"Scripts/content/Story/MISSIONS/DIA_GUR_1201_CorKalom.d:476","Ich habe das Kraut abgeliefert.","Я доставил болотник.","","","Mis_1_Psi_Kalom_KrautboteBACK_15_00","",""
