"location","source","target","id","fuzzy","context","translator_comments","developer_comments"
"Scripts/content/Story/MISSIONS/DIA_Grd_200_Thorus.d:100","Diego sagt, DU entscheidest, wer Gomez interessiert.","Диего сказал, что решать это будешь ты.","","","Info_Thorus_DiegoSentMe_15_00","",""
"Scripts/content/Story/MISSIONS/DIA_Grd_200_Thorus.d:101","Hm ... Wenn Diego denkt, du taugst was, kann ER sich auch mit dir rumschlagen.","Х-мм... Если Диего считает, что ты нам подходишь, почему он САМ не занимается тобой?","","","Info_Thorus_DiegoSentMe_09_01","",""
"Scripts/content/Story/MISSIONS/DIA_Grd_200_Thorus.d:102","Ich werde dir jetzt erklären, wie das läuft: Diego wird dich auf die Probe stellen. Wenn ER denkt, dass du gut genug bist, werde ich dich zu Gomez in die Burg lassen.","Позволь объяснить: Диего должен испытать тебя. Если ОН решит, что ты нам подходишь, я позволю тебе войти в замок и встретиться с Гомезом.","","","Info_Thorus_DiegoSentMe_09_02","",""
"Scripts/content/Story/MISSIONS/DIA_Grd_200_Thorus.d:103","Was dann passiert, liegt an dir. Kapiert?","Ну а все остальное уже зависит от тебя, понял?","","","Info_Thorus_DiegoSentMe_09_03","",""
"Scripts/content/Story/MISSIONS/DIA_Grd_200_Thorus.d:104","Ich werde mit Diego reden.","Я поговорю с Диего.","","","Info_Thorus_DiegoSentMe_15_04","",""
"Scripts/content/Story/MISSIONS/DIA_Grd_200_Thorus.d:118","Warum stellst du mich nicht auf die Probe?","Почему бы тебе самому не испытать меня?","","","Info_Thorus_TryMe.description","",""
"Scripts/content/Story/MISSIONS/DIA_Grd_200_Thorus.d:131","Warum stellst du mich nicht auf die Probe?","Почему бы тебе самому не испытать меня?","","","Info_Thorus_TryMe_15_00","",""
"Scripts/content/Story/MISSIONS/DIA_Grd_200_Thorus.d:132","So läuft das hier nicht, Kleiner! Jeder Neue, der sich hier beweisen will, braucht einen Fürsprecher.","Все не так просто, малыш! Каждому новичку, который хочет чего-то добиться здесь, нужен покровитель.","","","Info_Thorus_TryMe_09_01","",""
"Scripts/content/Story/MISSIONS/DIA_Grd_200_Thorus.d:133","Der Fürsprecher muss einer von Gomez' Leuten sein. Er wird dich auf die Probe stellen.","Этот покровитель должен быть из людей Гомеза. Он сам испытает тебя.","","","Info_Thorus_TryMe_09_02","",""
"Scripts/content/Story/MISSIONS/DIA_Grd_200_Thorus.d:134","Und wenn du Mist baust, ist er für dich verantwortlich - so läuft das hier.","Покровитель будет в ответе, если ты провалишь дело. Таков закон.","","","Info_Thorus_TryMe_09_03","",""
"Scripts/content/Story/MISSIONS/DIA_Grd_200_Thorus.d:146","Es muss doch eine Aufgabe geben, die du erledigt haben willst.","Возможно, я смогу быть чем-то полезен тебе.","","","Info_Thorus_TryMeAgain.description","",""
"Scripts/content/Story/MISSIONS/DIA_Grd_200_Thorus.d:159","Es muss doch eine Aufgabe geben, die du erledigt haben willst.","Возможно, я смогу быть чем-то полезен тебе.","","","Info_Thorus_TryMeAgain_15_00","",""
"Scripts/content/Story/MISSIONS/DIA_Grd_200_Thorus.d:160","Nein. Die Dinge, um die wir Gardisten uns kümmern, sind 'ne Nummer zu groß für dich, Kleiner.","Нет. То, чем занимаемся мы, стражники, тебе немного не по плечу, малыш.","","","Info_Thorus_TryMeAgain_09_01","",""
"Scripts/content/Story/MISSIONS/DIA_Grd_200_Thorus.d:161","Halt dich lieber an die Prüfungen, die dein Fürsprecher dir stellen wird.","Ты лучше выполняй задания своего покровителя.","","","Info_Thorus_TryMeAgain_09_02","",""
"Scripts/content/Story/MISSIONS/DIA_Grd_200_Thorus.d:173","Ich kann alles schaffen, was du mir aufträgst.","Я вполне могу делать и то, что ты мне прикажешь.","","","Info_Thorus_TryMeICanDoIt.description","",""
"Scripts/content/Story/MISSIONS/DIA_Grd_200_Thorus.d:186","Ich kann alles schaffen, was du mir aufträgst.","Я вполне могу делать и то, что ты мне прикажешь.","","","Info_Thorus_TryMeICanDoIt_15_00","",""
"Scripts/content/Story/MISSIONS/DIA_Grd_200_Thorus.d:187","So? Du willst also unbedingt versagen ... Es gibt eine Sache, die nur von jemandem erledigt werden kann, der keiner von Gomez' Leuten ist.","Да ну? Вижу, не терпится стать героем, да? Есть одна задачка - как раз для того, кто не работает на Гомеза.","","","Info_Thorus_TryMeICanDoIt_09_01","",""
"Scripts/content/Story/MISSIONS/DIA_Grd_200_Thorus.d:188","Aber ich warne dich. Wenn du das Ding vermasselst, bekommst du mächtigen Ärger.","Но предупреждаю тебя - если провалишь дело, то заработаешь чертову уйму неприятностей.","","","Info_Thorus_TryMeICanDoIt_09_02","",""
"Scripts/content/Story/MISSIONS/DIA_Grd_200_Thorus.d:204","Ich bin bereit für deine Aufgabe.","Я готов выполнить твое задание.","","","Info_Thorus_MordragKo_Offer.description","",""
"Scripts/content/Story/MISSIONS/DIA_Grd_200_Thorus.d:217","Ich bin bereit für deine Aufgabe.","Я готов выполнить твое задание.","","","Info_Thorus_MordragKo_Offer_15_00","",""
"Scripts/content/Story/MISSIONS/DIA_Grd_200_Thorus.d:218","Was ich dir jetzt sage, bleibt unter uns, und niemand außer uns beiden wird je von dieser Sache erfahren, verstanden?","То, что я тебе сейчас скажу, должно остаться между нами, никто другой не должен знать об этом. Понял?","","","Info_Thorus_MordragKo_Offer_09_01","",""
"Scripts/content/Story/MISSIONS/DIA_Grd_200_Thorus.d:219","Ja.","Конечно.","","","Info_Thorus_MordragKo_Offer_15_02","",""
"Scripts/content/Story/MISSIONS/DIA_Grd_200_Thorus.d:220","Wir haben Ärger mit einem Typen aus dem Neuen Lager. Mordrag ist sein Name. Er hat Eigentum der Erzbarone gestohlen.","У нас возникла проблема с одним типом из Нового Лагеря. Его зовут Мордраг. Он крадет у Баронов.","","","Info_Thorus_MordragKo_Offer_09_03","",""
"Scripts/content/Story/MISSIONS/DIA_Grd_200_Thorus.d:221","Es gibt viele Banditen im Neuen Lager, auf die das zutrifft, aber dieser Junge kommt in UNSER Lager und verkauft UNSERE gestohlene Ware an UNSERE Jungs zurück!","Разумеется, то же можно сказать и о большинстве воров из Нового Лагеря, но у этого типа хватает наглости приходить к НАМ и продавать НАШИ же вещи НАШИМ же людям!","","","Info_Thorus_MordragKo_Offer_09_04","",""
"Scripts/content/Story/MISSIONS/DIA_Grd_200_Thorus.d:222","Damit ist er eindeutig zu weit gegangen. Aber er weiß ganz genau, dass ich nichts machen kann.","Это зашло слишком далеко. Но он знает, что я не могу ничего сделать.","","","Info_Thorus_MordragKo_Offer_09_05","",""
"Scripts/content/Story/MISSIONS/DIA_Grd_200_Thorus.d:223","Warum?","Почему?","","","Info_Thorus_MordragKo_Offer_15_06","",""
"Scripts/content/Story/MISSIONS/DIA_Grd_200_Thorus.d:224","Weil er unter dem Schutz der Magier steht.","Его защищают сами маги.","","","Info_Thorus_MordragKo_Offer_09_07","",""
"Scripts/content/Story/MISSIONS/DIA_Grd_200_Thorus.d:227","Ich kümmere mich drum.","Я позабочусь об этом.","","","Info_Thorus_MordragKo_Offer.Info_Thorus_MordragKo_OFFER_BACK","Info_AddChoice",""
"Scripts/content/Story/MISSIONS/DIA_Grd_200_Thorus.d:228","Soll ich den Kerl umbringen?","Ты хочешь, чтобы я прикончил этого типа?","","","Info_Thorus_MordragKo_Offer.Info_Thorus_MordragKo_KillHim","Info_AddChoice",""
"Scripts/content/Story/MISSIONS/DIA_Grd_200_Thorus.d:229","Wo finde ich Mordrag?","Где я могу найти Мордрага?","","","Info_Thorus_MordragKo_Offer.Info_Thorus_MordragKo_Where","Info_AddChoice",""
"Scripts/content/Story/MISSIONS/DIA_Grd_200_Thorus.d:230","Wieso beschützen die Magier diesen Mordrag?","Почему маги защищают этого Мордрага?","","","Info_Thorus_MordragKo_Offer.Info_Thorus_MordragKo_MagesProtect","Info_AddChoice",""
"Scripts/content/Story/MISSIONS/DIA_Grd_200_Thorus.d:231","Klingt eher als wären die Magier dein Problem...","Похоже на то, что главной проблемой для тебя являются маги...","","","Info_Thorus_MordragKo_Offer.Info_Thorus_MordragKo_MageProblem","Info_AddChoice",""
"Scripts/content/Story/MISSIONS/DIA_Grd_200_Thorus.d:245","Ich kümmere mich darum.","Я позабочусь об этом.","","","Info_Thorus_MordragKo_OFFER_BACK_15_00","",""
"Scripts/content/Story/MISSIONS/DIA_Grd_200_Thorus.d:251","Soll ich den Kerl umbringen?","Ты хочешь, чтобы я прикончил этого типа?","","","Info_Thorus_MordragKo_KillHim_15_00","",""
"Scripts/content/Story/MISSIONS/DIA_Grd_200_Thorus.d:252","Du sollst dafür sorgen, dass ich ihn hier nie wieder sehen muss. Wie du das anstellst, ist deine Sache.","Я просто не хочу больше видеть здесь его рожу. Как ты этого добьешься - мне все равно.","","","Info_Thorus_MordragKo_KillHim_09_01","",""
"Scripts/content/Story/MISSIONS/DIA_Grd_200_Thorus.d:257","Wo finde ich Mordrag?","Где я могу найти Мордрага?","","","Info_Thorus_MordragKo_Where_15_00","",""
"Scripts/content/Story/MISSIONS/DIA_Grd_200_Thorus.d:258","Du findest ihn am Südtor, auf der anderen Seite der Burg, direkt hinter dem Eingang. Weiter traut sich dieser Halunke nicht ins Lager.","Ты найдешь его возле южных ворот на другой стороне замка. Этот ублюдок не смеет заходить дальше в Лагерь.","","","Info_Thorus_MordragKo_Where_09_01","",""
"Scripts/content/Story/MISSIONS/DIA_Grd_200_Thorus.d:264","Wieso beschützen die Magier diesen Mordrag?","Почему маги защищают этого Мордрага?","","","Info_Thorus_MordragKo_MagesProtect_15_00","",""
"Scripts/content/Story/MISSIONS/DIA_Grd_200_Thorus.d:265","Weil er als Bote für sie arbeitet. Unsere Magier stehen mit den Magiern des Neuen Lagers in Kontakt. Sie schicken regelmäßig Boten hin und her.","Они используют его в роли посыльного. Наши маги поддерживают связь с магами из Нового Лагеря и часто отправляют друг другу гонцов.","","","Info_Thorus_MordragKo_MagesProtect_09_01","",""
"Scripts/content/Story/MISSIONS/DIA_Grd_200_Thorus.d:266","Wenn ich einen ihrer Boten aus dem Lager werfe oder umlegen lasse, könnten sie SEHR unangenehm werden.","Скорее всего, им ОЧЕНЬ не понравится, если я вышвырну одного из гонцов за ворота Лагеря или убью его.","","","Info_Thorus_MordragKo_MagesProtect_09_02","",""
"Scripts/content/Story/MISSIONS/DIA_Grd_200_Thorus.d:267","Was ist mit MIR? Was glaubst du machen die Magier mit MIR?","А что насчет МЕНЯ? Что маги сделают со МНОЙ?","","","Info_Thorus_MordragKo_MagesProtect_15_03","",""
"Scripts/content/Story/MISSIONS/DIA_Grd_200_Thorus.d:268","Du bist neu. Dir passiert gar nichts. ICH dagegen bin für das verantwortlich, was meine Jungs tun. Deswegen ist es ja so wichtig, dass du die Klappe hältst.","Ты здесь новенький. Все будет нормально. Но я отвечаю за своих людей. Вот почему очень важно, чтобы ты держал свой рот на замке.","","","Info_Thorus_MordragKo_MagesProtect_09_04","",""
"Scripts/content/Story/MISSIONS/DIA_Grd_200_Thorus.d:274","Klingt eher, als wären die Magier dein Problem ...","Похоже на то, что главной проблемой для тебя являются маги...","","","Info_Thorus_MordragKo_MageProblem_15_00","",""
"Scripts/content/Story/MISSIONS/DIA_Grd_200_Thorus.d:275","Ja, aber eines, das sich schwer lösen lässt. Vor ein paar Jahren hat mal einer der Schatten versucht, den Obersten Magier des Feuers im Schlaf zu erdolchen.","Да, и эту проблему не так-то легко решить. Несколько лет назад один из Призраков попытался прирезать Верховного Мага Круга Огня, пока тот спал.","","","Info_Thorus_MordragKo_MageProblem_09_01","",""
"Scripts/content/Story/MISSIONS/DIA_Grd_200_Thorus.d:276","Er wurde später im Außenring gefunden - an VERSCHIEDENEN Stellen im Außenring.","Этого бедолагу потом нашли во Внешнем Кольце... Точнее, то, что от него осталось, было разбросано по всему Внешнему Кольцу...","","","Info_Thorus_MordragKo_MageProblem_09_02","",""
"Scripts/content/Story/MISSIONS/DIA_Grd_200_Thorus.d:289","Wegen Mordrag...","По поводу Мордрага...","","","Info_Thorus_MordragKo_Analyze.description","",""
"Scripts/content/Story/MISSIONS/DIA_Grd_200_Thorus.d:303","Ich kümmere mich drum.","Я позабочусь об этом.","","","Info_Thorus_MordragKo_Analyze.Info_Thorus_MordragKo_ANALYZE_BACK","Info_AddChoice",""
"Scripts/content/Story/MISSIONS/DIA_Grd_200_Thorus.d:304","Wo finde ich Mordrag?","Где я могу найти Мордрага?","","","Info_Thorus_MordragKo_Analyze.Info_Thorus_MordragKo_Where","Info_AddChoice",""
"Scripts/content/Story/MISSIONS/DIA_Grd_200_Thorus.d:308","Mordrag wird nie wieder irgendwen bestehlen!","Считай, что Мордраг совершил свою последнюю кражу!","","","Info_Thorus_MordragKo_Analyze.Info_Thorus_MordragKo_MordragDead","Info_AddChoice",""
"Scripts/content/Story/MISSIONS/DIA_Grd_200_Thorus.d:312","Der Typ wird sich hier nie wieder blicken lassen!","Больше он не осмелится появиться здесь!","","","Info_Thorus_MordragKo_Analyze.Info_Thorus_MordragKo_MordragGone","Info_AddChoice",""
"Scripts/content/Story/MISSIONS/DIA_Grd_200_Thorus.d:318","Ich kümmere mich drum.","Я позабочусь об этом.","","","Info_Thorus_MordragKo_ANALYZE_BACK_15_00","",""
"Scripts/content/Story/MISSIONS/DIA_Grd_200_Thorus.d:324","Mordrag wird nie wieder irgendwen bestehlen!","Считай, что Мордраг совершил свою последнюю кражу!","","","Info_Thorus_MordragKo_MordragDead_15_00","",""
"Scripts/content/Story/MISSIONS/DIA_Grd_200_Thorus.d:325","Du hast ihn geschafft? Nicht schlecht, Kleiner.","Хочешь сказать, ты победил его? Неплохо, малыш!","","","Info_Thorus_MordragKo_MordragDead_09_01","",""
"Scripts/content/Story/MISSIONS/DIA_Grd_200_Thorus.d:335","Der Typ wird sich hier nie wieder blicken lassen!","Больше он не осмелится появиться здесь!","","","Info_Thorus_MordragKo_MordragGone_15_00","",""
"Scripts/content/Story/MISSIONS/DIA_Grd_200_Thorus.d:336","Lieber wär' mir gewesen, du hättest ihn umgelegt.","Было бы лучше, если бы ты убил его.","","","Info_Thorus_MordragKo_MordragGone_09_01","",""
"Scripts/content/Story/MISSIONS/DIA_Grd_200_Thorus.d:366","Du Versager! Ich sagte doch: NENN MEINEN NAMEN NICHT!!!","Ты провалил все дело! Я говорил тебе НЕ НАЗЫВАТЬ МОЕГО ИМЕНИ!!!","","","Info_Thorus_MordragFailed_09_00","",""
"Scripts/content/Story/MISSIONS/DIA_Grd_200_Thorus.d:367","Du hast es vermasselt! Die Sache kannst du vergessen! Versuche ja nicht, noch weiter daran rumzupfuschen!","Ты провалил задание! Забудь обо всем, что я тебе говорил! Больше не смей совать нос в это дело!","","","Info_Thorus_MordragFailed_09_01","",""
"Scripts/content/Story/MISSIONS/DIA_Grd_200_Thorus.d:385","Würdest du mich für eine entsprechende Menge Erz in die Burg lassen?","Если я поделюсь рудой, ты позволишь войти в замок?","","","Info_Thorus_BribeGuard.description","",""
"Scripts/content/Story/MISSIONS/DIA_Grd_200_Thorus.d:398","Würdest du mich für eine entsprechende Menge Erz in die Burg lassen?","Если бы я поделился с тобой своим запасом руды, ты бы позволил мне войти в замок?","","","Info_Thorus_BribeGuard_15_00","",""
"Scripts/content/Story/MISSIONS/DIA_Grd_200_Thorus.d:399","Für eine entsprechende Menge ...","Своим запасом...","","","Info_Thorus_BribeGuard_09_01","",""
"Scripts/content/Story/MISSIONS/DIA_Grd_200_Thorus.d:400","Wie viel?","Сколько?","","","Info_Thorus_BribeGuard_15_02","",""
"Scripts/content/Story/MISSIONS/DIA_Grd_200_Thorus.d:401","Nun - es müsste 'ne Weile dauern, das Erz zu zählen. So lange würden die Jungs am Tor und ich dann wegsehen.","Ну... Пересчет этой руды должен занять много времени. Мы с ребятами должны считать достаточно долго, чтобы ты успел проскочить незамеченным.","","","Info_Thorus_BribeGuard_09_02","",""
"Scripts/content/Story/MISSIONS/DIA_Grd_200_Thorus.d:402","Sag schon, wie viel?","А поконкретней?","","","Info_Thorus_BribeGuard_15_03","",""
"Scripts/content/Story/MISSIONS/DIA_Grd_200_Thorus.d:403","1000 Brocken dürften genügen.","Тысячи кусков должно быть достаточно.","","","Info_Thorus_BribeGuard_09_03","",""
"Scripts/content/Story/MISSIONS/DIA_Grd_200_Thorus.d:404","1000 Brocken?","Тысяча кусков?!","","","Info_Thorus_BribeGuard_15_04","",""
"Scripts/content/Story/MISSIONS/DIA_Grd_200_Thorus.d:405","Nun, du könntest dich Gomez' Leuten anschließen, dann kommst du auch in die Burg - ganz umsonst.","Ну, ты можешь стать одним из людей Гомеза и пройти в замок задаром.","","","Info_Thorus_BribeGuard_09_04","",""
"Scripts/content/Story/MISSIONS/DIA_Grd_200_Thorus.d:418","Ich hab' die 1000 Brocken Erz. Lass mich in die Burg!","У меня есть тысяча кусков руды. Пропусти меня!","","","Info_Thorus_Give1000Ore.description","",""
"Scripts/content/Story/MISSIONS/DIA_Grd_200_Thorus.d:431","Ich hab' die 1000 Brocken Erz. Lass mich in die Burg!","У меня есть тысяча кусков руды. Пропусти меня!","","","Info_Thorus_Give1000Ore_15_00","",""
"Scripts/content/Story/MISSIONS/DIA_Grd_200_Thorus.d:436","Gut, wegen mir. Du kommst in die Burg, aber mach keine Dummheiten, klar!","Хорошо, проходи. Пока ты в замке, постарайся не делать никаких глупостей, ладно?","","","Info_Thorus_Give1000Ore_09_01","",""
"Scripts/content/Story/MISSIONS/DIA_Grd_200_Thorus.d:444","Verarsch mich nicht, Kleiner, du hast keine 1000 Brocken Erz!","Не пытайся надуть меня, малыш! У тебя нет тысячи кусков!","","","Info_Thorus_Give1000Ore_09_02","",""
"Scripts/content/Story/MISSIONS/DIA_Grd_200_Thorus.d:458","Ich muss in die Burg! Ich habe einen Brief für den obersten Feuermagier.","Мне нужно попасть в замок. У меня есть письмо.","","","Info_Thorus_LetterForMages.description","",""
"Scripts/content/Story/MISSIONS/DIA_Grd_200_Thorus.d:472","Ich muss in die Burg! Ich habe einen Brief für den obersten Feuermagier.","Мне нужно попасть в замок. У меня есть письмо для Верховного Мага Круга Огня.","","","Info_Thorus_LetterForMages_15_00","",""
"Scripts/content/Story/MISSIONS/DIA_Grd_200_Thorus.d:473","Und ich soll dich jetzt in die Burg spazieren lassen, damit du ihn abgeben und deine Belohnung kassieren kannst?","И ты надеешься, что я просто пропущу тебя в замок, чтобы ты мог получить свою награду?","","","Info_Thorus_LetterForMages_09_01","",""
"Scripts/content/Story/MISSIONS/DIA_Grd_200_Thorus.d:474","Ja.","Да.","","","Info_Thorus_LetterForMages_15_02","",""
"Scripts/content/Story/MISSIONS/DIA_Grd_200_Thorus.d:475","Na gut, zeig her den Brief.","Ладно, покажи мне письмо.","","","Info_Thorus_LetterForMages_09_03","",""
"Scripts/content/Story/MISSIONS/DIA_Grd_200_Thorus.d:476","Den geb' ich nicht aus der Hand - vergiss es!","Забудь об этом - я не позволю ТЕБЕ прикарманить его!","","","Info_Thorus_LetterForMages_15_04","",""
"Scripts/content/Story/MISSIONS/DIA_Grd_200_Thorus.d:477","Schon vergessen.","Ладно, уже забыл.","","","Info_Thorus_LetterForMages_09_05","",""
"Scripts/content/Story/MISSIONS/DIA_Grd_200_Thorus.d:489","Diego sagt, ich bin bereit für Gomez!","Диего сказал, что я могу увидеть Гомеза!","","","Info_Thorus_ReadyForGomez.description","",""
"Scripts/content/Story/MISSIONS/DIA_Grd_200_Thorus.d:502","Diego sagt, ich bin bereit für Gomez!","Диего сказал, что я могу увидеть Гомеза!","","","Info_Thorus_ReadyForGomez_15_00","",""
"Scripts/content/Story/MISSIONS/DIA_Grd_200_Thorus.d:503","Das entscheide immer noch ich!","Это буду решать я!","","","Info_Thorus_ReadyForGomez_09_01","",""
"Scripts/content/Story/MISSIONS/DIA_Grd_200_Thorus.d:504","Und wie lautet deine Entscheidung?","И что ты решил?","","","Info_Thorus_ReadyForGomez_15_02","",""
"Scripts/content/Story/MISSIONS/DIA_Grd_200_Thorus.d:505","Hmmm ...","Х-ммм...","","","Info_Thorus_ReadyForGomez_09_03","",""
"Scripts/content/Story/MISSIONS/DIA_Grd_200_Thorus.d:506","Du hast wohl die meisten Sachen gut gemacht, so viel muss man sagen.","Должен признать, что до сих пор ты справлялся неплохо.","","","Info_Thorus_ReadyForGomez_09_04","",""
"Scripts/content/Story/MISSIONS/DIA_Grd_200_Thorus.d:507","Gut! Du kannst zu Gomez gehen. Er allein bestimmt, wer aufgenommen wird und wer nicht.","Хорошо! Я позволю тебе встретиться с Гомезом. Сможешь ты стать одним из нас или нет - решать ему. ","","","Info_Thorus_ReadyForGomez_09_05","",""
"Scripts/content/Story/MISSIONS/DIA_Grd_200_Thorus.d:508","Ab jetzt bist du auf dich allein gestellt, Kleiner.","С этой минуты, парень, все зависит только от тебя.","","","Info_Thorus_ReadyForGomez_09_06","",""
"Scripts/content/Story/MISSIONS/DIA_Grd_200_Thorus.d:527","Ich habe ne Ladung Kraut von Cor Kalom für Gomez.","Я должен доставить груз болотника Гомезу от Кор Галома.","","","Info_Thorus_Krautbote.description","",""
"Scripts/content/Story/MISSIONS/DIA_Grd_200_Thorus.d:540","Ich habe 'ne Ladung Kraut von Cor Kalom für Gomez.","Я должен доставить груз болотника Гомезу от Кор Галома.","","","Info_Thorus_Krautbote_15_00","",""
"Scripts/content/Story/MISSIONS/DIA_Grd_200_Thorus.d:541","Zeig her!","Покажи!","","","Info_Thorus_Krautbote_09_01","",""
"Scripts/content/Story/MISSIONS/DIA_Grd_200_Thorus.d:545","Hmmmmmmm ...","Х-ммммммм...","","","Info_Thorus_Krautbote_09_02","",""
"Scripts/content/Story/MISSIONS/DIA_Grd_200_Thorus.d:546","Gut! Du kannst durch. Geh direkt zum Haus der Erzbarone. Bartholo wird dich empfangen.","Хорошо! Ты можешь пройти. Отправляйся к дому Баронов - там тебя встретит Бартоло.","","","Info_Thorus_Krautbote_09_03","",""
"Scripts/content/Story/MISSIONS/DIA_Grd_200_Thorus.d:557","Du hast zu wenig Kraut für einen Boten! Ich will für dich nicht hoffen, dass du das Zeug verscherbelt hast! Komm wieder, wenn du die richtige Menge dabei hast!","Для посыльного у тебя слишком мало болотника! Надеюсь, что ты не продал его на сторону. Возвращайся с нормальным запасом!","","","Info_Thorus_Krautbote_09_04","",""
"Scripts/content/Story/MISSIONS/DIA_Grd_200_Thorus.d:573","Ich bin Bote der Wassermagier. Ich muss in die Burg!","Я по поручению магов Воды. Мне нужно попасть в замок!","","","Info_Thorus_KdWSiegel.description","",""
"Scripts/content/Story/MISSIONS/DIA_Grd_200_Thorus.d:588","Ich bin Bote der Wassermagier. Ich muss in die Burg!","Я по поручению магов Воды. Мне нужно попасть в замок!","","","Info_Thorus_KdWSiegel_15_00","",""
