"location","source","target","id","fuzzy","context","translator_comments","developer_comments"
"Scripts/content/Story/MISSIONS/DIA_GUR_1201_CorKalom.d:1002","Ich hab' das Buch gefunden","Я нашел книгу.","","","Info_CorKalom_BringBook_Success_15_01","",""
"Scripts/content/Story/MISSIONS/DIA_GUR_1201_CorKalom.d:1003","Gute Arbeit. Du hast alles besorgt, was wir brauchen.","Отличная работа! Теперь у нас есть все, что нужно.","","","Info_CorKalom_BringBook_Success_10_02","",""
"Scripts/content/Story/MISSIONS/DIA_GUR_1201_CorKalom.d:1004","Ich werde jetzt die letzten Vorbereitungen treffen.","Сейчас я завершу последние приготовления.","","","Info_CorKalom_BringBook_Success_10_03","",""
"Scripts/content/Story/MISSIONS/DIA_GUR_1201_CorKalom.d:1005","Wo wird die Anrufung stattfinden?","Где состоится церемония?","","","Info_CorKalom_BringBook_Success_15_04","",""
"Scripts/content/Story/MISSIONS/DIA_GUR_1201_CorKalom.d:1006","Komme bei Nacht zum Tempelvorplatz. Dort werden wir uns versammeln, um den allmächtigen Schläfer zu rufen.","Дождись ночи и приходи во двор храма. Мы соберемся там, для того чтобы призвать великого Спящего.","","","Info_CorKalom_BringBook_Success_10_05","",""
"Scripts/content/Story/MISSIONS/DIA_GUR_1201_CorKalom.d:1029","Wie sieht es mit einer Belohnung aus?","Как насчет оплаты?","","","Info_CorKalom_Belohnung.description","",""
"Scripts/content/Story/MISSIONS/DIA_GUR_1201_CorKalom.d:1042","Wie sieht es mit einer Belohnung aus?","Как насчет оплаты?","","","Info_CorKalom_Belohnung_15_00","",""
"Scripts/content/Story/MISSIONS/DIA_GUR_1201_CorKalom.d:1043","Was willst du haben?","Чего ты хочешь?","","","Info_CorKalom_Belohnung_10_01","",""
"Scripts/content/Story/MISSIONS/DIA_GUR_1201_CorKalom.d:1046","Eine Spruchrolle","Магический свиток.","","","Info_CorKalom_Belohnung.Info_CorKalom_Belohnung_SCROLL","Info_AddChoice",""
"Scripts/content/Story/MISSIONS/DIA_GUR_1201_CorKalom.d:1047","Erz","Руда.","","","Info_CorKalom_Belohnung.Info_CorKalom_Belohnung_ORE","Info_AddChoice",""
"Scripts/content/Story/MISSIONS/DIA_GUR_1201_CorKalom.d:1048","Manatrank","Магический эликсир.","","","Info_CorKalom_Belohnung.Info_CorKalom_Belohnung_MANA","Info_AddChoice",""
"Scripts/content/Story/MISSIONS/DIA_GUR_1201_CorKalom.d:1053","Gib mir die Spruchrollen.","Отдай мне эти свитки с заклинаниями.","","","Info_CorKalom_Belohnung_SCROLL_15_00","",""
"Scripts/content/Story/MISSIONS/DIA_GUR_1201_CorKalom.d:1054","Setze diese Zauber hier mit Bedacht ein!","Используй эти заклинания мудро.","","","Info_CorKalom_Belohnung_SCROLL_10_01","",""
"Scripts/content/Story/MISSIONS/DIA_GUR_1201_CorKalom.d:1062","Gib mir Erz.","Мне бы пригодилась руда.","","","Info_CorKalom_Belohnung_ORE_15_00","",""
"Scripts/content/Story/MISSIONS/DIA_GUR_1201_CorKalom.d:1063","Dies soll deine Gier nach Erz zufrieden stellen!","Это удовлетворит твою страсть к богатству.","","False","Info_CorKalom_Belohnung_ORE_10_01","",""
"Scripts/content/Story/MISSIONS/DIA_GUR_1201_CorKalom.d:1071","Manatränke.","Мне нужны магические эликсиры.","","","Info_CorKalom_Belohnung_MANA_15_00","",""
"Scripts/content/Story/MISSIONS/DIA_GUR_1201_CorKalom.d:1072","Mögen diese Tränke dir Kraft schenken!","Да придадут они тебе силы!","","","Info_CorKalom_Belohnung_MANA_10_01","",""
"Scripts/content/Story/MISSIONS/DIA_GUR_1201_CorKalom.d:1096","Wir sehen uns.","До встречи!","","","GUR_1201_CorKalom_Exit_15_01","",""
"Scripts/content/Story/MISSIONS/DIA_GUR_1201_CorKalom.d:1097","Möge der Schläfer dich erleuchten.","Да просветит тебя Спящий!","","","GUR_1201_CorKalom_Exit_10_02","",""
"Scripts/content/Story/MISSIONS/DIA_GUR_1202_CorAngar.d:39","Kannst du mich trainieren?","Ты можешь чему-нибудь научить меня?","","","DIA_CorAngar_LaterTrainer.description","",""
"Scripts/content/Story/MISSIONS/DIA_GUR_1202_CorAngar.d:49","Kannst du mich trainieren?","Ты будешь учить меня?","","","GUR_1202_CorAngar_LaterTrainer_15_00","",""
"Scripts/content/Story/MISSIONS/DIA_GUR_1202_CorAngar.d:50","Du willst ein starker Kämpfer werden und bist auf der Suche nach jemandem, der dich unterweist.","Ты хочешь стать хорошим воином и потому ищешь себе наставника.","","","GUR_1202_CorAngar_LaterTrainer_08_01","",""
"Scripts/content/Story/MISSIONS/DIA_GUR_1202_CorAngar.d:51","Das ist gut. Aber ich bin NICHT derjenige, den du suchst.","Похвально. Но я не тот, кто тебе нужен.","","","GUR_1202_CorAngar_LaterTrainer_08_02","",""
"Scripts/content/Story/MISSIONS/DIA_GUR_1202_CorAngar.d:52","Ich opfere meine Zeit nur denen, die dem heiligen Kreis der Templer angehören.","Я занимаюсь лишь с теми, кто принадлежит к Священному Кругу стражей.","","False","GUR_1202_CorAngar_LaterTrainer_08_03","",""
"Scripts/content/Story/MISSIONS/DIA_GUR_1202_CorAngar.d:65","Wie werde ich in den Kreis der Templer aufgenommen?","Как стать стражем?","","False","DIA_CorAngar_WieTempler.description","",""
"Scripts/content/Story/MISSIONS/DIA_GUR_1202_CorAngar.d:78","Wie werde ich in den Kreis der Templer aufgenommen?","Как стать стражем?","","False","GUR_1202_CorAngar_WieTempler_15_00","",""
"Scripts/content/Story/MISSIONS/DIA_GUR_1202_CorAngar.d:79","Du musst eine Zeit lang als Novize gedient haben, um deinen Glauben an den Schläfer unter Beweis zu stellen.","Прежде всего, ты должен стать послушником и доказать, что ты действительно веришь в Спящего.","","","GUR_1202_CorAngar_WieTempler_08_01","",""
"Scripts/content/Story/MISSIONS/DIA_GUR_1202_CorAngar.d:80","Dann kehre zu mir zurück, und ich werde dich unterweisen.","Потом возвращайся ко мне, и я буду учить тебя.","","","GUR_1202_CorAngar_WieTempler_08_02","",""
"Scripts/content/Story/MISSIONS/DIA_GUR_1202_CorAngar.d:100","Kannst du meine Stärke und mein Geschick trainieren?","Ты можешь развить мою силу и ловкость?","","","GUR_1202_CorAngar_Teach.description","",""
"Scripts/content/Story/MISSIONS/DIA_GUR_1202_CorAngar.d:113","Kannst du meine Stärke und mein Geschick trainieren?","Ты можешь развить мою силу и ловкость?","","","GUR_1202_CorAngar_Teach_15_00","",""
"Scripts/content/Story/MISSIONS/DIA_GUR_1202_CorAngar.d:114","Kampfkraft und Wendigkeit sind die Vorraussetzungen für jeden Kämpfer.","Каждый воин нуждается в силе и ловкости.","","True","GUR_1202_CorAngar_Teach_08_01","",""
"Scripts/content/Story/MISSIONS/DIA_GUR_1202_CorAngar.d:183","Ich möchte Templer werden","Я хочу стать стражем!","","False","GUR_1202_CorAngar_WANNABETPL.description","",""
"Scripts/content/Story/MISSIONS/DIA_GUR_1202_CorAngar.d:197","Ich möchte Templer werden!","Я хочу стать стражем!","","False","GUR_1202_CorAngar_WANNABETPL_Info_15_01","",""
"Scripts/content/Story/MISSIONS/DIA_GUR_1202_CorAngar.d:201","Du bist noch nicht bereit. Wenn du erfahrener geworden bist, werde ich dich aufnehmen.","Ты еще не готов. Ты сможешь присоединиться к нам, когда у тебя будет больше опыта.","","","GUR_1202_CorAngar_WANNABETPL_Info_08_02","",""
"Scripts/content/Story/MISSIONS/DIA_GUR_1202_CorAngar.d:206","Die Zeit ist gekommen, da du aufgenommen wirst.","Пришло время тебе присоединиться к нам.","","","GUR_1202_CorAngar_WANNABETPL_Info_08_03","",""
"Scripts/content/Story/MISSIONS/DIA_GUR_1202_CorAngar.d:207","Du solltest eins wissen: Templer zu sein, bedeutet nicht nur gut kämpfen zu können und das Lager zu beschützen. Wir sind die auserwählte Wache des Schläfers. Die Hüter des Geistes.","Помни, что стражи - это не просто хорошие воины и охранники лагеря. Мы - избранные стражи Спящего, стражи духа.","","False","GUR_1202_CorAngar_WANNABETPL_Info_08_04","",""
"Scripts/content/Story/MISSIONS/DIA_GUR_1202_CorAngar.d:208","Wir nutzen unsere geistige und unsere körperliche Kraft zu gleichen Teilen. Nur ein Mann, dessen Körper und Geist sich in Einklang befinden, kann ein aufrechter Templer sein.","Мы находим применение и физической, и духовной силе. Лишь те, чье тело и дух представляют единое целое, могут стать истинными стражами.","","False","GUR_1202_CorAngar_WANNABETPL_Info_08_05","",""
"Scripts/content/Story/MISSIONS/DIA_GUR_1202_CorAngar.d:209","Es freut mich, dass du es in so kurzer Zeit geschafft hast, so weit zu kommen, dass du nun bereit bist, einer der Unseren zu werden.","Я искренне рад тому, что ты добился столь впечатляющих результатов за столь короткое время. Теперь ты готов стать одним из нас.","","False","GUR_1202_CorAngar_WANNABETPL_Info_08_06","",""
"Scripts/content/Story/MISSIONS/DIA_GUR_1202_CorAngar.d:210","Und vergiss nicht: ein konzentrierter Geist in einem gestählten Körper widersteht jeder Bedrohung.","Запомни: невозмутимый дух и тренированное тело помогут тебе выстоять против любого врага.","","","GUR_1202_CorAngar_WANNABETPL_Info_08_07","",""
"Scripts/content/Story/MISSIONS/DIA_GUR_1202_CorAngar.d:211","Gehe nun zu Gor Na Toth am Übungsplatz. Er wird dir deine neue Rüstung geben.","Отправляйся к Гор на Тофу на тренировочную площадку. Он даст тебе новые доспехи.","","False","GUR_1202_CorAngar_WANNABETPL_Info_08_08","",""
"Scripts/content/Story/MISSIONS/DIA_GUR_1202_CorAngar.d:248","Ich möchte den Umgang mit dem Zweihänder lernen.","Я хочу научиться владеть двуручным мечом.","","","GUR_1202_CorAngar_ZWEIHAND1_Info_15_01","",""
"Scripts/content/Story/MISSIONS/DIA_GUR_1202_CorAngar.d:252","Der Kampf mit zweihändigen Waffen setzt nicht nur ein Mindestmaß an Stärke und Geschick voraus.","Бой с двуручным оружием требует определенной силы и ловкости.","","","GUR_1202_CorAngar_ZWEIHAND1_Info_08_02","",""
"Scripts/content/Story/MISSIONS/DIA_GUR_1202_CorAngar.d:253","Um eine zweihändige Waffe zu führen, musst du nicht nur deinen Körper, sondern auch deinen Geist beherrschen.","Для того чтобы овладеть им, ты должен тренировать не только свое тело, но и свой разум.","","","GUR_1202_CorAngar_ZWEIHAND1_Info_08_03","",""
"Scripts/content/Story/MISSIONS/DIA_GUR_1202_CorAngar.d:254","Nur wenn du Körper und Geist ganz beherrscht, kannst du das Talent lernen.","Лишь достигнув контроля над своей физической и духовной силой, ты сможешь получить этот навык.","","","GUR_1202_CorAngar_ZWEIHAND1_Info_08_04","",""
"Scripts/content/Story/MISSIONS/DIA_GUR_1202_CorAngar.d:255","Konzentration ist der Schlüssel. Körper und Geist verschmelzen in Konzentration zusammen.","Суть кроется в концентрации. В концентрации объединяются тело и разум.","","","GUR_1202_CorAngar_ZWEIHAND1_Info_08_05","",""
"Scripts/content/Story/MISSIONS/DIA_GUR_1202_CorAngar.d:288","Ich möchte mehr über den zweihändigen Kampf lernen.","Я хочу узнать что-нибудь еще про двуручное оружие.","","","GUR_1202_CorAngar_ZWEIHAND2_Info_15_01","",""
"Scripts/content/Story/MISSIONS/DIA_GUR_1202_CorAngar.d:292","Den Tanz mit der Klinge beherrscht du nun. Jetzt werde ich dir die Meisterschaft des Kampfes zeigen.","Ты уже вполне освоил танец с клинком. Теперь я расскажу тебе про настоящий бой.","","","GUR_1202_CorAngar_ZWEIHAND2_Info_08_02","",""
"Scripts/content/Story/MISSIONS/DIA_GUR_1202_CorAngar.d:293","Nutze deine geistige Kraft, um die Bewegungen des Gegners vor dem Angriff zu erkennen.","Используй свою духовную силу для того, чтобы предугадать движение противника, прежде чем он нанесет удар.","","False","GUR_1202_CorAngar_ZWEIHAND2_Info_08_03","",""
"Scripts/content/Story/MISSIONS/DIA_GUR_1202_CorAngar.d:294","Zu wissen, wie dein Gegner kämpft, ist der halbe Sieg über ihn.","Если ты знаешь, как дерется твой враг, то ты уже наполовину победил.","","","GUR_1202_CorAngar_ZWEIHAND2_Info_08_04","",""
"Scripts/content/Story/MISSIONS/DIA_GUR_1202_CorAngar.d:295","Sei schnell, deine Bewegungen müssen überraschend und fließend sein, deine Schläge präzise und hart.","Будь быстр, твои движения должны быть плавными и неожиданными, а удары - сильными и точными.","","","GUR_1202_CorAngar_ZWEIHAND2_Info_08_05","",""
"Scripts/content/Story/MISSIONS/DIA_GUR_1202_CorAngar.d:296","Lerne den Schmerz zu ignorieren. Dein Wille ist es, der letztendlich über den Ausgang des Kampfes entscheidet.","Учись терпеть боль. Твоя сила воли в конечном счете решает исход боя.","","","GUR_1202_CorAngar_ZWEIHAND2_Info_08_06","",""
"Scripts/content/Story/MISSIONS/DIA_GUR_1202_CorAngar.d:297","Bewahre die Ruhe. Nur wenn du ruhig und konzentriert in einen Kampf gehst, wirst du ihn auch überleben.","Оставайся спокоен. Ты сможешь уцелеть, только если будешь вступать в бой спокойным и сосредоточенным.","","","GUR_1202_CorAngar_ZWEIHAND2_Info_08_07","",""
"Scripts/content/Story/MISSIONS/DIA_GUR_1202_CorAngar.d:298","Setze dein Talent mit Vorsicht ein. Und denke daran: Wer den Kampf fordert, kommt durch den Kampf um.","Используй свои навыки с умом. И помни: спровоцировать бой - значит проиграть его.","","False","GUR_1202_CorAngar_ZWEIHAND2_Info_08_08","",""
"Scripts/content/Story/MISSIONS/DIA_GUR_1202_CorAngar.d:324","Wie geht es jetzt weiter?","Что теперь?","","","GUR_1202_CorAngar_SENDS.description","",""
"Scripts/content/Story/MISSIONS/DIA_GUR_1202_CorAngar.d:338","Wie geht es jetzt weiter?","Что еще случилось?","","","GUR_1202_CorAngar_SENDS_Info_15_01","",""
"Scripts/content/Story/MISSIONS/DIA_GUR_1202_CorAngar.d:339","Die Vision war sehr verschwommen und gab mehr Rätsel auf, als dass sie uns Antworten brachte.","Видение было очень неясным, оно принесло больше вопросов, нежели ответов на них.","","","GUR_1202_CorAngar_SENDS_Info_08_02","",""
"Scripts/content/Story/MISSIONS/DIA_GUR_1202_CorAngar.d:340","Aber eines war klar. Mann konnte einen Ork in einer Höhle erkennen. Es gibt eine alte verlassene Kultstätte der Orks ganz hier in der Nähe.","Одно я знаю точно: я видел орка в пещере. Это было заброшенное оркское капище здесь, неподалеку.","","False","GUR_1202_CorAngar_SENDS_Info_08_03","",""
"Scripts/content/Story/MISSIONS/DIA_GUR_1202_CorAngar.d:341","Früher haben dort die Orks ihre Verstorbenen beigesetzt, daher nennen wir dieses Höhlensystem den Ork-Friedhof.","Когда-то орки хоронили там своих умерших, вот почему мы называем эти пещеры оркским кладбищем.","","","GUR_1202_CorAngar_SENDS_Info_08_04","",""
"Scripts/content/Story/MISSIONS/DIA_GUR_1202_CorAngar.d:342","Der Guru Baal Lukor ist mit einigen Templern dorthin aufgebrochen. Vielleicht finden wir dort etwas, das uns hilft, die Vision besser zu verstehen.","Гуру Идол Люкор отправился туда с несколькими стражами. Возможно, ему удастся отыскать что-то, что поможет нам понять это видение.","","False","GUR_1202_CorAngar_SENDS_Info_08_05","",""
"Scripts/content/Story/MISSIONS/DIA_GUR_1202_CorAngar.d:343","Ich brauche jemanden, der dort nach dem Rechten sieht und mir von der Situation berichtet.","Мне нужно, чтобы кто-нибудь отправился туда и затем доложил мне о ситуации.","","","GUR_1202_CorAngar_SENDS_Info_08_06","",""
"Scripts/content/Story/MISSIONS/DIA_GUR_1202_CorAngar.d:344","Warum gehst du nicht selber? Du bist doch der Anführer der Templer!","Почему ты не пойдешь сам? Ведь ты же командуешь всеми стражами!","","False","GUR_1202_CorAngar_SENDS_Info_15_07","",""
"Scripts/content/Story/MISSIONS/DIA_GUR_1202_CorAngar.d:345","Meine Aufgabe ist es, den Erleuchteten zu schützen. Ich bleibe hier bei Y'Berion und wache über ihn.","Моя задача - защищать Просвещенного. Я должнен оставаться здесь, с Ю`Берионом, и охранять его.","","","GUR_1202_CorAngar_SENDS_Info_08_08","",""
"Scripts/content/Story/MISSIONS/DIA_GUR_1202_CorAngar.d:346","Du hast dem Lager schon große Dienste erwiesen. Ich vertraue dir mehr als jedem anderen hier.","Ты хорошо послужил нашему лагерю. Я доверяю тебе больше, чем кому-либо еще.","","False","GUR_1202_CorAngar_SENDS_Info_08_09","",""
"Scripts/content/Story/MISSIONS/DIA_GUR_1202_CorAngar.d:347","Ich bitte dich, gehe zum Ork-Friedhof und berichte mir, was die Templer dort gefunden haben.","Я прошу тебя отправиться на оркское кладбище и выяснить, что удалось найти стражам.","","False","GUR_1202_CorAngar_SENDS_Info_08_10","",""
"Scripts/content/Story/MISSIONS/DIA_GUR_1202_CorAngar.d:350","Was springt für mich dabei raus?","Что я получу взамен?","","","GUR_1202_CorAngar_SENDS.GUR_1202_CorAngar_SENDS_EARN","Info_AddChoice",""
"Scripts/content/Story/MISSIONS/DIA_GUR_1202_CorAngar.d:351","Ich mache mich sofort auf den Weg!","Я отправляюсь в путь прямо сейчас!","","","GUR_1202_CorAngar_SENDS.GUR_1202_CorAngar_SENDS_KNOW","Info_AddChoice",""
"Scripts/content/Story/MISSIONS/DIA_GUR_1202_CorAngar.d:356","Was springt für mich dabei raus?","Что я получу взамен?","","","GUR_1202_CorAngar_SENDS_EARN_Info_15_01","",""
"Scripts/content/Story/MISSIONS/DIA_GUR_1202_CorAngar.d:357","Du willst Erz? Anscheinend habe ich mich in dir getäuscht. Aber ich brauche dich. Hier, 100 Erz. Mehr gibt es nicht!","Тебе нужна руда? Похоже, я переоценил тебя. Но все равно, ты мне нужен. Вот, возьми сотню кусков руды. Больше ты не получишь!","","","GUR_1202_CorAngar_SENDS_EARN_Info_08_02","",""
"Scripts/content/Story/MISSIONS/DIA_GUR_1202_CorAngar.d:364","Ich mache mich sofort auf den Weg!","Я отправляюсь в путь прямо сейчас!","","","GUR_1202_CorAngar_SENDS_KNOW_Info_15_01","",""
"Scripts/content/Story/MISSIONS/DIA_GUR_1202_CorAngar.d:365","Bevor du losgehst, nimm diesen Ring. Er möge dich im Kampf schützen!","Прежде возьми это кольцо. Оно защитит тебя в бою.","","","GUR_1202_CorAngar_SENDS_KNOW_Info_08_02","",""
"Scripts/content/Story/MISSIONS/DIA_GUR_1202_CorAngar.d:379","Wo ist der Ork Friedhof?","Где находится кладбище орков?","","","GUR_1202_CorAngar_WHERE.description","",""
"Scripts/content/Story/MISSIONS/DIA_GUR_1202_CorAngar.d:392","Wo ist der Ork-Friedhof?","Где находится кладбище орков?","","","GUR_1202_CorAngar_WHERE_Info_15_01","",""
"Scripts/content/Story/MISSIONS/DIA_GUR_1202_CorAngar.d:393","Nicht weit von hier. Der Novize Talas kennt den Weg. Du findest ihn unten auf dem Vorplatz des Tempels. Er wird dich dort hinführen.","Недалеко отсюда. Дорогу тебе покажет послушник Талас. Ты найдешь его во дворе храма.","","","GUR_1202_CorAngar_WHERE_Info_08_02","",""
"Scripts/content/Story/MISSIONS/DIA_GUR_1202_CorAngar.d:407","Ich war im Ork Friedhof","Я был на кладбище орков.","","False","GUR_1202_CorAngar_AFTER.description","",""
"Scripts/content/Story/MISSIONS/DIA_GUR_1202_CorAngar.d:420","Ich war im Ork-Friedhof. Dort gibt es NICHTS. Keinen Schläfer, kein Zeichen, gar nichts.","Я был на кладбище орков. Там нет НИЧЕГО. Ни Спящего, ни зацепки, вообще ничего.","","","GUR_1202_CorAngar_AFTER_Info_15_01","",""
"Scripts/content/Story/MISSIONS/DIA_GUR_1202_CorAngar.d:421","Was ist mit Baal Lukor und den Templern?","А Идол Люкор и его стражи?","","False","GUR_1202_CorAngar_AFTER_Info_08_02","",""
"Scripts/content/Story/MISSIONS/DIA_GUR_1202_CorAngar.d:422","Sie sind alle tot.","Они все мертвы.","","","GUR_1202_CorAngar_AFTER_Info_15_03","",""
"Scripts/content/Story/MISSIONS/DIA_GUR_1202_CorAngar.d:423","Tot? Aber warum, was ist dort vorgefallen?","Мертвы? Но почему, что произошло?","","","GUR_1202_CorAngar_AFTER_Info_08_04","",""
"Scripts/content/Story/MISSIONS/DIA_GUR_1202_CorAngar.d:424","Im gesamten Höhlensystem wimmelte es von Orks. Sie haben alle Templer getötet.","Пещеры кишмя кишат орками. Они перебили всех стражей.","","False","GUR_1202_CorAngar_AFTER_Info_15_05","",""
"Scripts/content/Story/MISSIONS/DIA_GUR_1202_CorAngar.d:425","Baal Lukor und ich, wir haben überlebt, aber auf einmal drehte Baal Lukor völlig durch.","Мне и Люкору удалось выжить, но он при этом сошел с ума.","","","GUR_1202_CorAngar_AFTER_Info_15_06","",""
"Scripts/content/Story/MISSIONS/DIA_GUR_1202_CorAngar.d:426","Er schrie, der Schläfer hätte ihm befohlen, mich zu töten, und das wollte er dann auch tun.","Он кричал, что Спящий приказал ему убить меня, и искренне пытался выполнить этот приказ.","","","GUR_1202_CorAngar_AFTER_Info_15_07","",""
"Scripts/content/Story/MISSIONS/DIA_GUR_1202_CorAngar.d:427","Offensichtlich kam er mit der großen Enttäuschung, nichts gefunden zu haben, nicht zurecht.","Похоже, он просто не мог смириться с мыслью о том, что ему так и не удалось ничего найти.","","","GUR_1202_CorAngar_AFTER_Info_08_08","",""
"Scripts/content/Story/MISSIONS/DIA_GUR_1202_CorAngar.d:428","Ich glaube nicht, dass der Einfluss des Schläfers solch grausame Taten verursacht.","Я не верю, что воля Спящего подвигла его на столь ужасный поступок.","","","GUR_1202_CorAngar_AFTER_Info_08_09","",""
"Scripts/content/Story/MISSIONS/DIA_GUR_1202_CorAngar.d:429","Es darf nicht ... darf nicht ... EGAL!","Этого не может... не может... ЭТО НЕ ОТНОСИТСЯ К ДЕЛУ!","","","GUR_1202_CorAngar_AFTER_Info_08_10","",""
"Scripts/content/Story/MISSIONS/DIA_GUR_1202_CorAngar.d:430","Die Hauptsache ist, dass Baal Lukor in seinem Wahn keinen Erfolg hatte.","Важнее всего то, что Идол Люкор еще не зашел слишком далеко в своем безумии.","","","GUR_1202_CorAngar_AFTER_Info_08_11","",""
"Scripts/content/Story/MISSIONS/DIA_GUR_1202_CorAngar.d:431","Y'Berion ist nun unsere einzige Hoffnung.","Теперь вся наша надежда на Ю`Бериона.","","","GUR_1202_CorAngar_AFTER_Info_08_12","",""
"Scripts/content/Story/MISSIONS/DIA_GUR_1202_CorAngar.d:446","Wie steht es um Y'Berion?","Как поживает Ю`Берион?","","","Info_CorAngar_FindHerb.description","",""
"Scripts/content/Story/MISSIONS/DIA_GUR_1202_CorAngar.d:459","Wie steht es um Y'Berion?","Как поживает Ю`Берион?","","","Mis_3_NC_CorAngar_FindHerb_15_01","",""
"Scripts/content/Story/MISSIONS/DIA_GUR_1202_CorAngar.d:460","Er wird nicht von alleine erwachen. Und er wird immer schwächer. Ich weiß, wie ich ihn wachbekommen kann, aber dazu brauche ich deine Hilfe.","Он не очнется, если мы не поможем ему. Видишь - он слабеет с каждой минутой. Я знаю, как разбудить его, но для этого мне понадобится твоя помощь.","","True","Mis_3_NC_CorAngar_FindHerb_08_02","",""
"Scripts/content/Story/MISSIONS/DIA_GUR_1202_CorAngar.d:461","Was ist zu tun?","Что я должен сделать?","","","Mis_3_NC_CorAngar_FindHerb_15_03","",""
