"location","source","target","id","fuzzy","context","translator_comments","developer_comments"
"Scripts/content/Story/MISSIONS/DIA_GRD_219_Stone.d:160","Nur die höchsten Gardisten dürfen so eine Rüstung tragen. Und du bist noch nicht lange genug dabei, fürchte ich.","Такие доспехи получают только стражники высшего класса и я боюсь тебе до них еще далеко, малыш.","","","GRD_219_Stone_BETTERARMOR_Info_H_06_02","",""
"Scripts/content/Story/MISSIONS/DIA_GRD_219_Stone.d:166","Ich hab' es mir anders überlegt!","Я передумал.","","","GRD_219_Stone_BETTERARMOR_Info_BACK_15_01","",""
"Scripts/content/Story/MISSIONS/DIA_GRD_219_Stone.d:167","Wie du meinst. Du weißt, wo du mich findest!","Делай, как хочешь. Ты знаешь, где меня найти.","","","GRD_219_Stone_BETTERARMOR_Info_BACK_06_02","",""
"Scripts/content/Story/MISSIONS/DIA_GRD_219_Stone.d:204","Wir sehen uns.","Увидимся.","","","Info_EXIT_06_02","",""
"Scripts/content/Story/MISSIONS/DIA_GRD_219_Stone.d:209","Wir sehen uns.","Увидимся.","","","Info_EXIT_06_03","",""
"Scripts/content/Story/MISSIONS/DIA_GRD_219_Stone.d:244","Was willst du, du siehst nicht aus wie einer von Gomez' Schergen?","Что тебе нужно? Ты не похож на прихвостней Гомеза.","","","DIA_GRD_219_Stone_06_01","",""
"Scripts/content/Story/MISSIONS/DIA_GRD_219_Stone.d:256","Stimmt, ich gehöre nicht zu Gomez","Ты прав, я не служу Гомезу.","","","DIA_GRD_219_Stone1.description","",""
"Scripts/content/Story/MISSIONS/DIA_GRD_219_Stone.d:269","Stimmt, ich gehöre nicht zu Gomez.","Ты прав, я не служу Гомезу.","","","DIA_GRD_219_Stone1_15_01","",""
"Scripts/content/Story/MISSIONS/DIA_GRD_219_Stone.d:270","Wie bist du dann hier rein gekommen? Gomez hatte den Schlüssel zum Kerker.","Тогда что ты здесь делаешь? Ключи от камер находятся у Гомеза...","","","DIA_GRD_219_Stone1_06_02","",""
"Scripts/content/Story/MISSIONS/DIA_GRD_219_Stone.d:271","Er hat ihn mir überlassen.","Он дал их мне.","","","DIA_GRD_219_Stone1_15_03","",""
"Scripts/content/Story/MISSIONS/DIA_GRD_219_Stone.d:272","Du willst doch nicht andeuten, dass DU Gomez aus dem Weg geräumt hast?","Уж не хочешь ли ты сказать, что это ты тот парень, который уделал Гомеза?","","","DIA_GRD_219_Stone1_06_04","",""
"Scripts/content/Story/MISSIONS/DIA_GRD_219_Stone.d:273","Doch, will ich.","Точно так.","","","DIA_GRD_219_Stone1_15_05","",""
"Scripts/content/Story/MISSIONS/DIA_GRD_219_Stone.d:274","Junge, das hätte ich dir gar nicht zugetraut, es freut mich aber, dass dieser dreckige Halsabschneider endlich das bekommen hat, was er verdient.","Парень, вот уж никогда бы не подумал! Но я рад, что этот паршивый головорез наконец-то получил по заслугам!","","","DIA_GRD_219_Stone1_06_06","",""
"Scripts/content/Story/MISSIONS/DIA_GRD_219_Stone.d:275","Aber warum hast du mich befreit?","Но зачем ты спасаешь меня?","","","DIA_GRD_219_Stone1_06_07","",""
"Scripts/content/Story/MISSIONS/DIA_GRD_219_Stone.d:276","Ich habe gehört, dass du im Kerker bist, und habe die Gelegenheit genutzt, um Gomez ruhig zu stellen und dich zu befreien.","Я слышал, что ты угодил за решетку, и воспользовался удобным случаем, чтобы избавиться от Гомеза и освободить тебя.","","","DIA_GRD_219_Stone1_15_08","",""
"Scripts/content/Story/MISSIONS/DIA_GRD_219_Stone.d:277","Habe Dank ...","Спасибо...","","","DIA_GRD_219_Stone1_06_09","",""
"Scripts/content/Story/MISSIONS/DIA_GRD_219_Stone.d:278","... ich stehe in deiner Schuld, triff mich in der Schmiede, dort reden wir weiter.","…За мной должок. Заходи ко мне в кузницу, поговорим.","","","DIA_GRD_219_Stone1_06_10","",""
"Scripts/content/Story/MISSIONS/DIA_GRD_219_Stone.d:304","Da bist du ja. Da du mich aus diesem Rattenloch befreit hast, hast du was gut bei mir, Mann!","А вот и ты. Я должен как-то отблагодарить тебя, за то что ты вытащил меня из той крысиной дыры!","","","DIA_GRD_219_Stone3_06_01","",""
"Scripts/content/Story/MISSIONS/DIA_GRD_219_Stone.d:305","Ich habe mir überlegt, da es nicht viel gibt, was ich dir geben kann, werde ich dir etwas schmieden.","И знаешь, я подумал: мне ведь совсем нечего подарить тебе, так лучше я что-нибудь для тебя скую.","","","DIA_GRD_219_Stone3_06_02","",""
"Scripts/content/Story/MISSIONS/DIA_GRD_219_Stone.d:306","Könnte ein Ring sein oder etwas Vergleichbares ...","Кольцо или что-то вроде того...","","","DIA_GRD_219_Stone3_06_03","",""
"Scripts/content/Story/MISSIONS/DIA_GRD_219_Stone.d:319","Warum hat man dich in den Kerker geworfen?","Как ты угодил за решетку?","","","DIA_GRD_219_Stone2.description","",""
"Scripts/content/Story/MISSIONS/DIA_GRD_219_Stone.d:332","Warum hat man dich in den Kerker geworfen?","Как ты угодил за решетку?","","","DIA_GRD_219_Stone2_15_01","",""
"Scripts/content/Story/MISSIONS/DIA_GRD_219_Stone.d:333","Gomez! Der Bastard hat mir unterstellt, dass ich gemeinsame Sache mit den Feuermagiern machen würde. Nur weil ich der beste Schmied im Alten Lager bin, konnte ich meinen Kopf retten.","Гомез! Этот ублюдок обвинил меня в сговоре с магами Огня. Он и не убил-то меня только потому, что я лучший кузнец во всем Старом Лагере. ","","","DIA_GRD_219_Stone2_06_02","",""
"Scripts/content/Story/MISSIONS/DIA_GRD_219_Stone.d:334","Er hat mich in dieses Rattenloch werfen lassen und immer nur dann rausgelassen, wenn er meine Fähigkeiten gebraucht hat.","Меня швырнули в эту крысиную дыру и доставали оттуда, только когда нужно было сделать что-то для Гомеза.","","","DIA_GRD_219_Stone2_06_03","",""
"Scripts/content/Story/MISSIONS/DIA_GRD_219_Stone.d:347","Kannst du mir diese Erzrüstung verstärken?","Ты можешь укрепить эти доспехи?","","","DIA_GRD_219_Stone4.description","",""
"Scripts/content/Story/MISSIONS/DIA_GRD_219_Stone.d:360","Kannst du mir diese Erzrüstung verstärken?","Ты можешь укрепить эти доспехи?","","","DIA_GRD_219_Stone4_15_01","",""
"Scripts/content/Story/MISSIONS/DIA_GRD_219_Stone.d:361","Natürlich kann ich sie verstärken? Gib sie mir und warte kurz.","Конечно. Давай их сюда и подожди минутку.","","","DIA_GRD_219_Stone4_06_02","",""
"Scripts/content/Story/MISSIONS/DIA_GRD_219_Stone.d:380","Hier ist die verstärkte Rüstung, damit habe ich meine Schuld beglichen.","Вот тебе усиленные доспехи. Теперь мы в расчете.","","","DIA_GRD_219_Stone4_06_03","",""
"Scripts/content/Story/MISSIONS/DIA_GRD_219_Stone.d:392","Ich könnte einen Ring gebrauchen, der meine Lebenskraft steigert.","С помощью кольца я мог бы повысить запас здоровья.","","","DIA_GRD_219_Stone5.description","",""
"Scripts/content/Story/MISSIONS/DIA_GRD_219_Stone.d:405","Ich könnte einen Ring gebrauchen, der meine Lebenskraft steigert.","С помощью кольца я мог бы повысить запас здоровья.","","","DIA_GRD_219_Stone5_15_01","",""
"Scripts/content/Story/MISSIONS/DIA_GRD_219_Stone.d:406","Das ist nicht so schwer, warte kurz.","Это совсем не сложно, подожди минутку.","","","DIA_GRD_219_Stone5_06_02","",""
"Scripts/content/Story/MISSIONS/DIA_GRD_219_Stone.d:418","Dieser Ring verleiht dir Lebenskraft, damit müsste meine Schuld mehr als beglichen sein.","Кольцо Здоровья даст тебе дополнительный запас жизненных сил. Теперь мы в расчете - этого должно быть более чем достаточно.","","","DIA_GRD_219_Stone5_06_03","",""
"Scripts/content/Story/MISSIONS/DIA_GRD_219_Stone.d:433","Ich will einen Schutzring geschmiedet haben","Кольцо пригодилось бы мне для защиты.","","","DIA_GRD_219_Stone6.description","",""
"Scripts/content/Story/MISSIONS/DIA_GRD_219_Stone.d:446","Ich will einen Schutzring geschmiedet haben.","Кольцо пригодилось бы мне для защиты.","","","DIA_GRD_219_Stone6_15_01","",""
"Scripts/content/Story/MISSIONS/DIA_GRD_219_Stone.d:447","Einen Schutzring, dann gehe ich an die Arbeit. Warte solange.","Кольцо Защиты? Хорошо, я начну прямо сейчас. Подожди немного. ","","","DIA_GRD_219_Stone6_06_02","",""
"Scripts/content/Story/MISSIONS/DIA_GRD_219_Stone.d:459","Einen Schutzring wolltest du, hier ist er, jetzt sind wir quitt.","Тебе было нужно Кольцо Защиты - ты его получил, так что теперь мы в расчете.","","","DIA_GRD_219_Stone6_06_03","",""
"Scripts/content/Story/MISSIONS/DIA_GRD_219_Stone.d:472","Schmiede mir einen Gegenstand, der meine magische Energie vermehrt.","Мне нужно что-нибудь, чтобы повысить мою магическую силу.","","","DIA_GRD_219_Stone7.description","",""
"Scripts/content/Story/MISSIONS/DIA_GRD_219_Stone.d:485","Schmiede mir einen Gegenstand, der meine magische Energie vermehrt.","Мне нужно что-нибудь, чтобы повысить мою магическую силу.","","","DIA_GRD_219_Stone7_15_01","",""
"Scripts/content/Story/MISSIONS/DIA_GRD_219_Stone.d:486","... Einen Gegenstand, der magische Energie vermehrt ... ein Amulett, ich schmiede dir ein Amulett. Das dauert nicht lange.","...Что-нибудь, чтобы повысить магическую силу?.. Амулет! Хорошо, я скую для тебя Амулет Магии. Это не займет много времени.","","","DIA_GRD_219_Stone7_06_02","",""
"Scripts/content/Story/MISSIONS/DIA_GRD_219_Stone.d:498","So, das Amulett ist fertig, und ich muss sagen, es ist mir gut gelungen. Somit ist die Schuld beglichen.","Ну вот, амулет готов. Скажу без лишней скромности - это хорошая работа. Теперь мы в расчете.","","","DIA_GRD_219_Stone7_06_03","",""
"Scripts/content/Story/MISSIONS/DIA_GRD_233_Bloodwyn.d:24","Wir sehen uns.","Увидимся.","","","Info_Bloodwyn_EXIT_Schutzgeld_15_00","",""
"Scripts/content/Story/MISSIONS/DIA_GRD_233_Bloodwyn.d:27","Pass gut auf dich auf, Kleiner!","Береги себя, малыш.","","","Info_Bloodwyn_EXIT_Schutzgeld_08_01","",""
"Scripts/content/Story/MISSIONS/DIA_GRD_233_Bloodwyn.d:31","Mach dir keine Sorgen, während du hier im Lager bist! Wir passen auf dich auf.","Ты теперь ни о чем не волнуйся. Мы приглядим за тобой.","","","Info_Bloodwyn_EXIT_Schutzgeld_08_02","",""
"Scripts/content/Story/MISSIONS/DIA_GRD_233_Bloodwyn.d:59","Hey du!","Эй, ты!","","","Info_Bloodwyn_Hello_08_00","",""
"Scripts/content/Story/MISSIONS/DIA_GRD_233_Bloodwyn.d:60","Redest du mit mir?","Это ты мне говоришь?","","","Info_Bloodwyn_Hello_15_01","",""
"Scripts/content/Story/MISSIONS/DIA_GRD_233_Bloodwyn.d:61","Ich will dich warnen! Jemand wie du hat hier schnell Ärger am Hals!","Я предупреждаю тебя! Такие типы, как ты, очень быстро попадают здесь в неприятности!","","","Info_Bloodwyn_Hello_08_02","",""
"Scripts/content/Story/MISSIONS/DIA_GRD_233_Bloodwyn.d:62","Und die meisten, die sie hier reingeworfen haben, sind Arschlöcher!","Сюда бросают, в основном, законченных ублюдков.","","","Info_Bloodwyn_Hello_08_03","",""
"Scripts/content/Story/MISSIONS/DIA_GRD_233_Bloodwyn.d:63","Sie denken, dass sie mit dir machen können, was sie wollen. Aber das lassen wir nicht zu.","И они думают, что могут делать с тобой все, что хотят. Но мы им этого не позволим.","","","Info_Bloodwyn_Hello_08_04","",""
"Scripts/content/Story/MISSIONS/DIA_GRD_233_Bloodwyn.d:64","Gomez will, dass Ruhe im Lager herrscht. Und wir Gardisten sorgen dafür. Aber so eine Aufgabe ist extrem kostspielig.","Гомез хочет, чтобы в Лагере был мир, и мы, стражники, следим за этим. Но эта работа обходится нам недешево.","","","Info_Bloodwyn_Hello_08_05","",""
"Scripts/content/Story/MISSIONS/DIA_GRD_233_Bloodwyn.d:65","Darum bitte ich dich um etwas Erz. Du musst das als Freundschaftsdienst verstehen. Du hilfst uns und wir helfen dir. Wenn du mal Ärger hast, sind wir da.","Вот почему я предлагаю тебе поделиться запасом руды. Скажем так, в знак дружбы. Ты помогаешь нам, мы помогаем тебе. И если у тебя будут проблемы, мы придем на помощь.","","","Info_Bloodwyn_Hello_08_06","",""
"Scripts/content/Story/MISSIONS/DIA_GRD_233_Bloodwyn.d:68","Warum nicht. An wieviel Erz hattest du denn gedacht?","Почему бы и нет? Сколько ты хочешь получить?","","","Info_Bloodwyn_Hello.Info_Bloodwyn_Hello_HowMuch","Info_AddChoice",""
"Scripts/content/Story/MISSIONS/DIA_GRD_233_Bloodwyn.d:69","Ich soll Schutzgeld zahlen? Ich kann auf mich selbst aufpassen!","Я сам могу о себе позаботиться!","","","Info_Bloodwyn_Hello.Info_Bloodwyn_Hello_ForgetIt","Info_AddChoice",""
"Scripts/content/Story/MISSIONS/DIA_GRD_233_Bloodwyn.d:70","Soll das eine Drohung sein?","Это угроза?","","","Info_Bloodwyn_Hello.Info_Bloodwyn_Hello_SollDrohungSein","Info_AddChoice",""
"Scripts/content/Story/MISSIONS/DIA_GRD_233_Bloodwyn.d:75","Ich soll Schutzgeld zahlen? Ich kann auf mich selbst aufpassen!","Ты предлагаешь мне платить деньги за защиту? Нет, спасибо, я сам могу о себе позаботиться!","","","Info_Bloodwyn_ForgetIt_15_00","",""
"Scripts/content/Story/MISSIONS/DIA_GRD_233_Bloodwyn.d:76","Wie du meinst, Kleiner. Wirst schon sehen, was du davon hast, ein Freundschaftsangebot abzulehnen!","Решать тебе, малыш. Скоро ты пожалеешь о том, что отверг мое дружеское предложение.","","","Info_Bloodwyn_ForgetIt_08_01","",""
"Scripts/content/Story/MISSIONS/DIA_GRD_233_Bloodwyn.d:86","Soll das eine Drohung sein?","Это угроза?","","","Info_Bloodwyn_SollDrohungSein_15_00","",""
"Scripts/content/Story/MISSIONS/DIA_GRD_233_Bloodwyn.d:87","Im Gegenteil! Es ist ein Freundschaftsangebot!","Совсем наоборот! Это предложение дружбы!","","","Info_Bloodwyn_SollDrohungSein_08_01","",""
"Scripts/content/Story/MISSIONS/DIA_GRD_233_Bloodwyn.d:92","Warum nicht. An wie viel Erz hast du denn gedacht?","Почему бы и нет? Сколько ты хочешь получить?","","","Info_Bloodwyn_Hello_HowMuch_15_01","",""
"Scripts/content/Story/MISSIONS/DIA_GRD_233_Bloodwyn.d:93","Nicht viel. 10 Erz, mehr brauche ich nicht.","Немного. Десять кусков будет вполне достаточно.","","","Info_Bloodwyn_Hello_HowMuch_08_02","",""
"Scripts/content/Story/MISSIONS/DIA_GRD_233_Bloodwyn.d:96","Ich habe gerade keine 10 Erz.","У меня нет десяти кусков руды.","","","Info_Bloodwyn_Hello.Info_Bloodwyn_Hello_NotNow","Info_AddChoice",""
"Scripts/content/Story/MISSIONS/DIA_GRD_233_Bloodwyn.d:99","Hier hast du das Erz. Ich kann Freunde brauchen.","Вот твоя руда. Дружба всегда в цене.","","","Info_Bloodwyn_Hello.Info_Bloodwyn_Hello_OkTakeIt","Info_AddChoice",""
"Scripts/content/Story/MISSIONS/DIA_GRD_233_Bloodwyn.d:106","Hier hast du das Erz. Ich kann Freunde gebrauchen.","Вот твоя руда. Дружба всегда в цене.","","","Info_Bloodwyn_Hello_OkTakeIt_15_00","",""
"Scripts/content/Story/MISSIONS/DIA_GRD_233_Bloodwyn.d:107","Du scheinst mir ein kluges Bürschchen zu sein. Von nun an werden wir auf dich aufpassen.","Похоже, ты умный парень. С этого момента мы будем защищать тебя.","","","Info_Bloodwyn_Hello_OkTakeIt_08_01","",""
"Scripts/content/Story/MISSIONS/DIA_GRD_233_Bloodwyn.d:108","Aber das heißt nicht, dass du hier machen kannst, was du willst, verstanden?","Но это не значит, что ты можешь делать все, что захочешь - из некоторых неприятностей даже мы не сможем тебя вытащить.","","","Info_Bloodwyn_Hello_OkTakeIt_08_02","",""
"Scripts/content/Story/MISSIONS/DIA_GRD_233_Bloodwyn.d:121","Ich habe gerade keine 10 Erz.","У меня нет десяти кусков руды.","","","Info_Bloodwyn_Hello_NotNow_15_00","",""
"Scripts/content/Story/MISSIONS/DIA_GRD_233_Bloodwyn.d:122","Dann nehme ich das, was du hast - ist schon okay. Du kannst ja beim nächsten Mal die volle Summe zahlen.","Давай сколько есть, а остальное отдашь потом.","","","Info_Bloodwyn_Hello_NotNow_08_01","",""
"Scripts/content/Story/MISSIONS/DIA_GRD_233_Bloodwyn.d:124","Lass mal sehen ...","Посмотрим...","","","Info_Bloodwyn_Hello_NotNow_08_02","",""
"Scripts/content/Story/MISSIONS/DIA_GRD_233_Bloodwyn.d:130","Na, was haben wir denn da? Kann da jemand nicht bis 10 zählen?","Ты только поглади на это... Похоже, кто-то не умеет считать до десяти, а?","","","Info_Bloodwyn_Hello_NotNow_TenOreMore_08_00","",""
"Scripts/content/Story/MISSIONS/DIA_GRD_233_Bloodwyn.d:131","Ich werd einfach alles nehmen, was du hast. Dafür vergesse ich, dass du mich belogen hast.","Пожалуй, я заберу все, что у тебя есть. Может быть тогда я сумею забыть, что ты пытался обмануть меня.","","","Info_Bloodwyn_Hello_NotNow_TenOreMore_08_01","",""
"Scripts/content/Story/MISSIONS/DIA_GRD_233_Bloodwyn.d:135","Ich nehme auch kleine Spenden, es ist der gute Wille, der zählt! Danke für das Erz, Kleiner!","Мало - лучше, чем ничего. Спасибо за руду, малыш!","","","Info_Bloodwyn_Hello_NotNow_LessThanTen_08_00","",""
"Scripts/content/Story/MISSIONS/DIA_GRD_233_Bloodwyn.d:136","Von jetzt an werden wir ein Auge auf dich haben, solange du im Lager bist.","С этого момента я буду приглядывать за тобой, пока ты находишься в Лагере.","","","Info_Bloodwyn_Hello_NotNow_LessThanTen_08_01","",""
"Scripts/content/Story/MISSIONS/DIA_GRD_233_Bloodwyn.d:141","Du hast ja wirklich nichts ... Na, wie gesagt, beim nächsten Mal ...","Похоже, у тебя сейчас не лучшие времена, приятель. Ну ничего, как-нибудь в другой раз...","","","Info_Bloodwyn_Hello_NotNow_NoOre_08_00","",""
"Scripts/content/Story/MISSIONS/DIA_GRD_233_Bloodwyn.d:178","Gut, dass ich dich treffe, mein Freund!","А, рад тебя видеть, дружище!","","","Info_Bloodwyn_PayDay_08_00","",""
"Scripts/content/Story/MISSIONS/DIA_GRD_233_Bloodwyn.d:179","Wie sieht's mit deiner täglichen Unterstützung aus? Deine 10 Erz sind wieder mal fällig.","Как насчет дневной платы? Ты должен десять кусков, помнишь?","","","Info_Bloodwyn_PayDay_08_01","",""
"Scripts/content/Story/MISSIONS/DIA_GRD_233_Bloodwyn.d:182","Hier, nimm - 10 Erz sind nicht viel unter Freuden.","Вот, возьми. Для друга и 10 кусков не жалко.","","","Info_Bloodwyn_PayDay.Info_Bloodwyn_PayDay_PayAgain","Info_AddChoice",""
"Scripts/content/Story/MISSIONS/DIA_GRD_233_Bloodwyn.d:183","Ich werde nicht mehr zahlen - du hast schon genug gekriegt.","Я не буду платить.","","","Info_Bloodwyn_PayDay.Info_Bloodwyn_PayDay_PayNoMore","Info_AddChoice",""
"Scripts/content/Story/MISSIONS/DIA_GRD_233_Bloodwyn.d:187","Hey du!","Эй, ты!","","","Info_Bloodwyn_PayDay_Den_08_00","",""
"Scripts/content/Story/MISSIONS/DIA_GRD_233_Bloodwyn.d:188","Was denn jetzt schon wieder?","Что еще?","","","Info_Bloodwyn_PayDay_Den_15_01","",""
"Scripts/content/Story/MISSIONS/DIA_GRD_233_Bloodwyn.d:189","Es ist eine neue Gelegenheit für dich gekommen, dich als Freund zu erweisen.","Пришло время доказать, что мы на самом деле друзья.","","","Info_Bloodwyn_PayDay_Den_08_02","",""
"Scripts/content/Story/MISSIONS/DIA_GRD_233_Bloodwyn.d:190","Mit nur 10 Erz bist du dabei - wie sieht's aus?","Всего десять кусков руды - что скажешь?","","","Info_Bloodwyn_PayDay_Den_08_03","",""
"Scripts/content/Story/MISSIONS/DIA_GRD_233_Bloodwyn.d:198","Hier, nimm - 10 Erz sind nicht viel unter Freunden","Вот, возьми. Для друга и десяти кусков не жалко.","","","Info_Bloodwyn_PayDay_PayAgain_15_00","",""
"Scripts/content/Story/MISSIONS/DIA_GRD_233_Bloodwyn.d:199","Genau so sehe ich das auch.","Я так и думал - мы друзья!","","","Info_Bloodwyn_PayDay_PayAgain_08_01","",""
"Scripts/content/Story/MISSIONS/DIA_GRD_233_Bloodwyn.d:210","Ich werde nicht mehr zahlen - du hast schon genug gekriegt.","Я не буду платить - ты и так получил с меня более чем достаточно.","","","Info_Bloodwyn_PayDay_PayNoMore_15_00","",""
"Scripts/content/Story/MISSIONS/DIA_GRD_233_Bloodwyn.d:211","Du enttäuschst mich! Von nun an sind wir keine Freunde mehr. Du wirst selber aufpassen müssen, dass du nicht von üblen Halunken niedergeschlagen und ausgeraubt wirst.","Ты меня разочаровал. Больше мы не друзья. Сам гляди теперь, чтобы никто тебя не обидел и не ограбил.","","","Info_Bloodwyn_PayDay_PayNoMore_08_01","",""
"Scripts/content/Story/MISSIONS/DIA_GRD_233_Bloodwyn.d:212","Ich kann ganz gut auf mich selbst aufpassen.","Не волнуйся, я могу о себе позаботиться.","","","Info_Bloodwyn_PayDay_PayNoMore_15_02","",""
"Scripts/content/Story/MISSIONS/DIA_GRD_233_Bloodwyn.d:213","Das werden wir ja sehen ...","Посмотрим...","","","Info_Bloodwyn_PayDay_PayNoMore_08_03","",""
"Scripts/content/Story/MISSIONS/DIA_GRD_233_Bloodwyn.d:232","Ich hab's mir überlegt - ich würde DOCH gern die 10 Erz bezahlen.","Я передумал. Вот десять кусков руды. ","","","Info_Bloodwyn_Doch.description","",""
"Scripts/content/Story/MISSIONS/DIA_GRD_233_Bloodwyn.d:245","Ich hab's mir überlegt - ich würde DOCH gern die 10 Erz bezahlen.","Я передумал. Вот десять кусков руды. ","","","Info_Bloodwyn_Doch_15_00","",""
"Scripts/content/Story/MISSIONS/DIA_GRD_233_Bloodwyn.d:248","Na siehst du! Du kannst ja DOCH die richtige Entscheidung treffen.","Вот это другое дело! Видишь - ты МОЖЕШЬ принимать правильные решения.","","","Info_Bloodwyn_Doch_08_01","",""
"Scripts/content/Story/MISSIONS/DIA_GRD_233_Bloodwyn.d:249","Und von jetzt an zahlen wir schön brav täglich unsere Unterstützung, ja?","Теперь ты будешь платить мне каждый день, так?","","","Info_Bloodwyn_Doch_08_02","",""
"Scripts/content/Story/MISSIONS/DIA_GRD_233_Bloodwyn.d:258","Dann komm wieder, wenn du sie hast.","Возвращайся, когда у тебя будет чем заплатить.","","","Info_Bloodwyn_Doch_NoOre_08_00","",""
"Scripts/content/Story/MISSIONS/DIA_GRD_233_Bloodwyn.d:269","Jesse schickt mich - ich will seine 10 Erz für ihn zahlen.","Джесс просил заплатить за него десять кусков руды.","","","Info_Bloodwyn_PayForJesse.description","",""
"Scripts/content/Story/MISSIONS/DIA_GRD_233_Bloodwyn.d:282","Jesse schickt mich - ich will seine 10 Erz für ihn zahlen.","Джесс просил заплатить за него десять кусков руды.","","","Info_Bloodwyn_PayForJesse_15_00","",""
"Scripts/content/Story/MISSIONS/DIA_GRD_233_Bloodwyn.d:285","Du solltest lieber DEINE 10 Erz zahlen.","Мне кажется, прежде ты должен заплатить СВОИ десять кусков.","","","Info_Bloodwyn_PayForJesse_08_01","",""
"Scripts/content/Story/MISSIONS/DIA_GRD_233_Bloodwyn.d:288","Vergiss Jesse. Er ist ein Verlierer und wird sowieso bald draufgehen.","Забудь про Джесса. Он неудачник и все равно долго не протянет.","","","Info_Bloodwyn_PayForJesse_08_02","",""
"Scripts/content/Story/MISSIONS/DIA_GRD_233_Bloodwyn.d:291","Nein - ich werde für ihn zahlen - hier nimm die 10 Erz und jetzt lass ihn in Ruhe!","Нет, я заплачу за него. Возьми десять кусков и оставь его в покое.","","","Info_Bloodwyn_PayForJesse_15_03","",""
