"location","source","target","id","fuzzy","context","translator_comments","developer_comments"
"Scripts/content/Story/MISSIONS/DIA_PC_Fighter.d:877","Unsere Wege trennen sich hier. Ich werde noch eine Weile bleiben und herumstöbern.","Здесь наши пути расходятся. Я еще ненадолго останусь - хочу осмотреть окрестности.","","","Info_Gorn_RUINVICTORY_09_05","",""
"Scripts/content/Story/MISSIONS/DIA_PC_Fighter.d:878","Doch wir werden uns sicher wiedersehen. Bis dann, mein Freund.","Но думаю, мы еще встретимся. Увидимся, друг мой!","","","Info_Gorn_RUINVICTORY_09_06","",""
"Scripts/content/Story/MISSIONS/DIA_PC_Fighter.d:905","Ich habe Diego und Milten vor dem Alten Lager getroffen!","Возле Старого Лагеря я встретил Диего и Мильтена!","","","Info_Gorn_DIEGOMILTEN.description","",""
"Scripts/content/Story/MISSIONS/DIA_PC_Fighter.d:918","Ich habe Diego und Milten vor dem Alten Lager getroffen!","Возле Старого Лагеря я встретил Диего и Мильтена!","","","Info_Gorn_DIEGOMILTEN_15_01","",""
"Scripts/content/Story/MISSIONS/DIA_PC_Fighter.d:919","Eine gute Nachricht!","Хорошие новости!","","","Info_Gorn_DIEGOMILTEN_09_02","",""
"Scripts/content/Story/MISSIONS/DIA_PC_Fighter.d:920","Sie wollen sich mit dir und Lester treffen. An eurem üblichen Treffpunkt.","Они хотят встретиться с тобой и с Лестером. Там же, где и всегда.","","","Info_Gorn_DIEGOMILTEN_15_03","",""
"Scripts/content/Story/MISSIONS/DIA_PC_Fighter.d:921","Danke. In diesen turbulenten Zeiten sind gute Freunde unersetzlich.","Спасибо. В наши времена нет ничего ценнее друзей.","","","Info_Gorn_DIEGOMILTEN_09_04","",""
"Scripts/content/Story/MISSIONS/DIA_PC_Fighter.d:922","Auch du gehörst mittlerweile schon fast zu uns. Auf dich ist Verlass!","Ты уже почти стал одним из нас. На тебя можно положиться!","","","Info_Gorn_DIEGOMILTEN_09_05","",""
"Scripts/content/Story/MISSIONS/DIA_PC_Fighter.d:946","Was hast du in der Freien Mine gesehen?","Что происходит в Свободной Шахте?","","","Info_Gorn_FREEMINE.description","",""
"Scripts/content/Story/MISSIONS/DIA_PC_Fighter.d:960","Was hast du in der Freien Mine gesehen?","Что происходит в Свободной Шахте?","","","Info_Gorn_FREEMINE_15_01","",""
"Scripts/content/Story/MISSIONS/DIA_PC_Fighter.d:961","Nachdem ich von der Klosterruine zurückkam, wollte ich einen Abstecher zu Okyl, dem Boss der Freien Mine, machen.","После того как я вернулся с монастырских руин, я захотел заглянуть к Окилу, хозяину Свободной Шахты.","","","Info_Gorn_FREEMINE_09_02","",""
"Scripts/content/Story/MISSIONS/DIA_PC_Fighter.d:962","Doch als ich ankam, lagen überall Leichen herum.","Но там я нашел только трупы...","","","Info_Gorn_FREEMINE_09_03","",""
"Scripts/content/Story/MISSIONS/DIA_PC_Fighter.d:963","Ich konnte gerade noch sehen, wie sich einige Gardisten im Mineneingang verschanzten.","Я видел, как стражники строят укрепления неподалеку от входа в шахту.","","","Info_Gorn_FREEMINE_09_04","",""
"Scripts/content/Story/MISSIONS/DIA_PC_Fighter.d:964","Wie konnten so viele Söldner zwei Dutzend Gardisten unterliegen?","Как могли два десятка стражников справиться со всеми наемниками?","","","Info_Gorn_FREEMINE_15_05","",""
"Scripts/content/Story/MISSIONS/DIA_PC_Fighter.d:965","Sah mir sehr nach einem Angriff aus dem Hinterhalt aus! Niemand hätte erwartet, dass Angreifer über die Berge kommen würden.","Это похоже на засаду. Никто не ожидал атаки со стороны гор.","","","Info_Gorn_FREEMINE_09_06","",""
"Scripts/content/Story/MISSIONS/DIA_PC_Fighter.d:966","Das Überraschungsmoment kann die Stärke einer Truppe vervielfachen.","Ты же знаешь: внезапность увеличивает силу нападающих.","","","Info_Gorn_FREEMINE_09_07","",""
"Scripts/content/Story/MISSIONS/DIA_PC_Fighter.d:978","Was hast du jetzt vor?","Что ты теперь собираешься делать?","","","Info_Gorn_GUARDNC.description","",""
"Scripts/content/Story/MISSIONS/DIA_PC_Fighter.d:991","Was hast du jetzt vor?","Что ты теперь собираешься делать?","","","Info_Gorn_GUARDNC_15_01","",""
"Scripts/content/Story/MISSIONS/DIA_PC_Fighter.d:992","Die gesamte Verteidigung unseres Lagers muss nun umgestellt werden. Das braucht Zeit.","Придется пересмотреть всю нашу систему обороны. На это потребуется время.","","","Info_Gorn_GUARDNC_09_02","",""
"Scripts/content/Story/MISSIONS/DIA_PC_Fighter.d:993","Bis Lee und seine Leute so weit sind, werde ich mich erst mal Cords provisorischen Wachposten anschließen.","До тех пор пока не подтянется Ли со своими ребятами, я присоединюсь к отряду Корда.","","","Info_Gorn_GUARDNC_09_03","",""
"Scripts/content/Story/MISSIONS/DIA_PC_Fighter.d:994","Plant ihr einen Gegenschlag?","Не собираетесь в контратаку?","","","Info_Gorn_GUARDNC_15_04","",""
"Scripts/content/Story/MISSIONS/DIA_PC_Fighter.d:995","Noch nicht, aber der Tag wird kommen!","Пока еще нет, но дай срок.","","","Info_Gorn_GUARDNC_09_05","",""
"Scripts/content/Story/MISSIONS/DIA_PC_Fighter.d:996","Wenn du mich suchst, gehe von hier in Richtung Mine. Dort werde ich meinen Posten beziehen.","Если я тебе зачем-то понадоблюсь, иди отсюда по направлению к шахте. Я буду там, на страже.","","","Info_Gorn_GUARDNC_09_06","",""
"Scripts/content/Story/MISSIONS/DIA_PC_Fighter.d:1013","Wie ist die Lage?","Как дела?","","","Info_Gorn_GUARDNCRUNNING.description","",""
"Scripts/content/Story/MISSIONS/DIA_PC_Fighter.d:1027","Wie ist die Lage?","Как дела?","","","Info_Gorn_GUARDNCRUNNING_15_01","",""
"Scripts/content/Story/MISSIONS/DIA_PC_Fighter.d:1028","Alles ruhig. In der Freien Mine rührt sich nichts.","Все тихо. Свободная Шахта словно вымерла.","","","Info_Gorn_GUARDNCRUNNING_09_02","",""
"Scripts/content/Story/MISSIONS/DIA_PC_Fighter.d:1029","Lee ist noch damit beschäftigt, unsere Verteidigung zu organisieren!","Ли по-прежнему занят организацией обороны.","","","Info_Gorn_GUARDNCRUNNING_09_03","",""
"Scripts/content/Story/MISSIONS/DIA_PC_Fighter.d:1055","Du kommst gerade richtig! Wir bereiten uns auf den Gegenschlag vor.","Ты как раз вовремя! Мы готовимся к контратаке.","","","Info_Gorn_POST_09_01","",""
"Scripts/content/Story/MISSIONS/DIA_PC_Fighter.d:1056","Die Rückeroberung der Freien Mine ist der erste Schritt!","Первый шаг - отвоевать Свободную Шахту.","","","Info_Gorn_POST_09_02","",""
"Scripts/content/Story/MISSIONS/DIA_PC_Fighter.d:1068","Eine Rückeroberung mit vier Mann? Wo sind all die anderen Söldner?","Ты планируешь захватить ее с отрядом из четырех человек?","","","Info_Gorn_TAKEBACK.description","",""
"Scripts/content/Story/MISSIONS/DIA_PC_Fighter.d:1081","Eine Rückeroberung mit vier Mann? Wo sind all die anderen Söldner?","Ты планируешь захватить ее с отрядом из четырех человек?","","","Info_Gorn_TAKEBACK_15_01","",""
"Scripts/content/Story/MISSIONS/DIA_PC_Fighter.d:1082","Ein frontaler Angriff bringt nichts! Dafür sind Gomez' Leute zu gut verschanzt!","Атаковать в лоб не годится. Люди Гомеза слишком хорошо подготовились к этому!","","","Info_Gorn_TAKEBACK_09_02","",""
"Scripts/content/Story/MISSIONS/DIA_PC_Fighter.d:1083","Aber eine verdeckte Operation, bei der wir Mann für Mann ausschalten, könnte gelingen!","Но мы собираемся проделать все незаметно. Будем снимать врагов одного за другим - это может сработать. ","","","Info_Gorn_TAKEBACK_09_03","",""
"Scripts/content/Story/MISSIONS/DIA_PC_Fighter.d:1084","Lee bat mich, dir etwas auszurichten.","Ли просил меня передать тебе кое-что.","","","Info_Gorn_TAKEBACK_09_04","",""
"Scripts/content/Story/MISSIONS/DIA_PC_Fighter.d:1090","Als einer unserer besten Söldner wurdest du bestimmt, die Operation durchzuführen!","Ты был избран для этого задания как один из лучших наемников.","","","Info_Gorn_TAKEBACK_09_05","",""
"Scripts/content/Story/MISSIONS/DIA_PC_Fighter.d:1094","Als Wassermagier mit sehr viel Kampferfahrung wurdest du bestimmt, die Operation durchzuführen!","Ты был избран для этого задания как опытный воин и один из магов Круга Воды.","","","Info_Gorn_TAKEBACK_09_06","",""
"Scripts/content/Story/MISSIONS/DIA_PC_Fighter.d:1098","Als einer unserer besten Banditen wurdest du bestimmt, die Operation durchzuführen!","Ты был избран для этого задания как один из лучших воров.","","","Info_Gorn_TAKEBACK_09_07","",""
"Scripts/content/Story/MISSIONS/DIA_PC_Fighter.d:1102","Obwohl du nicht zu uns gehörst, hast du unserem Lager schon große Dienste erwiesen und dich mehr als bewährt.","Несмотря на то что ты не один из нас, ты не раз помогал нашему Лагерю и всецело доказал свою преданность.","","","Info_Gorn_TAKEBACK_09_08","",""
"Scripts/content/Story/MISSIONS/DIA_PC_Fighter.d:1103","Wir bieten dir die Durchführung der Operation an!","Мы даем тебе шанс выполнить еще одно задание!","","","Info_Gorn_TAKEBACK_09_09","",""
"Scripts/content/Story/MISSIONS/DIA_PC_Fighter.d:1106","Ich werde mit dir gehen. Gemeinsam können wir es schaffen!","Я пойду с тобой. Вместе мы сможем сделать это!","","","Info_Gorn_TAKEBACK_09_10","",""
"Scripts/content/Story/MISSIONS/DIA_PC_Fighter.d:1118","Der erste Schritt? Was wird denn der zweite sein?","Это первый шаг. А второй?","","","Info_Gorn_SECOND.description","",""
"Scripts/content/Story/MISSIONS/DIA_PC_Fighter.d:1131","Der erste Schritt? Was wird denn der Zweite sein?","Это первый шаг. А второй?","","","Info_Gorn_SECOND_15_01","",""
"Scripts/content/Story/MISSIONS/DIA_PC_Fighter.d:1132","Sobald die Mine wieder in unserem Besitz ist, werden wir den Pass über die Berge suchen, den Gomez' Leute für den Überfall benutzt haben!","Как только шахта снова будет у нас, мы начнем искать проход в горах, которым воспользовались люди Гомеза.","","","Info_Gorn_SECOND_09_02","",""
"Scripts/content/Story/MISSIONS/DIA_PC_Fighter.d:1133","Wenn der Pass dicht gemacht wurde, haben wir die Situation wieder im Griff.","Когда этот путь будет отрезан, ситуация снова будет у нас под контролем.","","","Info_Gorn_SECOND_09_03","",""
"Scripts/content/Story/MISSIONS/DIA_PC_Fighter.d:1134","Verstehe.","Понятно.","","","Info_Gorn_SECOND_15_04","",""
"Scripts/content/Story/MISSIONS/DIA_PC_Fighter.d:1146","Warum gerade ich?","Почему вы выбрали именно меня?","","","Info_Gorn_WHYME.description","",""
"Scripts/content/Story/MISSIONS/DIA_PC_Fighter.d:1159","Warum gerade ich?","Почему вы выбрали именно меня?","","","Info_Gorn_WHYME_15_01","",""
"Scripts/content/Story/MISSIONS/DIA_PC_Fighter.d:1160","Du hast schon mehrmals bewiesen, dass du Mut hast und gleichzeitig denken kannst!","Ты уже не раз доказывал, что тебе присущи одновременно и трезвость ума, и бесшабашная храбрость!","","","Info_Gorn_WHYME_09_02","",""
"Scripts/content/Story/MISSIONS/DIA_PC_Fighter.d:1161","Außerdem kennst du das Alte Lager und die Gardisten besser als die meisten von uns.","Помимо этого, ты знаешь Старый Лагерь и его стражников лучше, чем кто-либо из нас.","","","Info_Gorn_WHYME_09_03","",""
"Scripts/content/Story/MISSIONS/DIA_PC_Fighter.d:1162","Du bist der beste Mann für diesen schwierigen Job!","Ты лучше всех можешь справиться с этим непростым заданием.","","","Info_Gorn_WHYME_09_04","",""
"Scripts/content/Story/MISSIONS/DIA_PC_Fighter.d:1174","Lass uns den ungebetenen Gästen in der Mine kräftig in den Hintern treten!","Ладно, пойдем покажем, на что способны свободные люди!","","","Info_Gorn_KICKBUTT.description","",""
"Scripts/content/Story/MISSIONS/DIA_PC_Fighter.d:1188","Okay, lass uns den ungebetenen Gästen in der Mine kräftig in den Hintern treten!","Ладно, пойдем покажем непрошенным гостям, на что способны свободные люди!","","","Info_Gorn_KICKBUTT_15_01","",""
"Scripts/content/Story/MISSIONS/DIA_PC_Fighter.d:1189","Nichts anderes habe ich von dir erwartet!","Ничего другого я от тебя и не ожидал!","","","Info_Gorn_KICKBUTT_09_02","",""
"Scripts/content/Story/MISSIONS/DIA_PC_Fighter.d:1190","Hier, nimm diesen Schlüssel. Er öffnet das Torhaus vor dem Eingang der Mine.","Вот, возьми этот ключ. Он от двери караульной у входа в шахту.","","","Info_Gorn_KICKBUTT_09_03","",""
"Scripts/content/Story/MISSIONS/DIA_PC_Fighter.d:1204","Warum nicht. Ich muss ohnehin in die Mine!","Почему бы и нет. Мне же все равно нужно попасть в шахту!","","","Info_Gorn_MYWAY.description","",""
"Scripts/content/Story/MISSIONS/DIA_PC_Fighter.d:1218","Warum nicht. Ich muss ohnehin in die Mine!","Почему бы и нет. Мне же все равно нужно попасть в шахту!","","","Info_Gorn_MYWAY_15_01","",""
"Scripts/content/Story/MISSIONS/DIA_PC_Fighter.d:1219","Was immer auch DEINE Gründe sein mögen, ich bin froh, dass wir diese Sache gemeinsam erledigen!","Понимаю, что у тебя на то есть СВОИ причины, но все-таки я рад, что мы вместе!","","","Info_Gorn_MYWAY_09_02","",""
"Scripts/content/Story/MISSIONS/DIA_PC_Fighter.d:1220","Hier, nimm diesen Schlüssel. Er öffnet das Torhaus vor dem Eingang der Mine.","Вот, возьми этот ключ. Он от двери караульной у входа в шахту.","","","Info_Gorn_MYWAY_09_03","",""
"Scripts/content/Story/MISSIONS/DIA_PC_Fighter.d:1249","Fast hätte ich es vergessen!","Да, чуть не забыл!","","","Info_Gorn_WOLF_09_01","",""
"Scripts/content/Story/MISSIONS/DIA_PC_Fighter.d:1250","Der Bandit Wolf will dich unbedingt sprechen, bevor wir zur Mine aufbrechen!","До отхода с тобой хотел поговорить один из воров, Волк.","","","Info_Gorn_WOLF_09_02","",""
"Scripts/content/Story/MISSIONS/DIA_PC_Fighter.d:1253","Er kann warten, wir haben jetzt wichtigeres zu tun!","Он может подождать, у нас сейчас есть дела поважнее.","","","Info_Gorn_WOLF.Info_Gorn_WOLF_FM","Info_AddChoice",""
"Scripts/content/Story/MISSIONS/DIA_PC_Fighter.d:1254","Dann werde ihn besser noch vorher aufsuchen!","Тогда я лучше пойду к нему.","","","Info_Gorn_WOLF.Info_Gorn_WOLF_WOLF","Info_AddChoice",""
"Scripts/content/Story/MISSIONS/DIA_PC_Fighter.d:1262","Er kann warten, wir haben jetzt Wichtigeres zu tun!","Он может подождать, у нас сейчас есть дела поважнее.","","","Info_Gorn_WOLF_15_04","",""
"Scripts/content/Story/MISSIONS/DIA_PC_Fighter.d:1263","Wie du meinst!","Как скажешь!","","","Info_Gorn_WOLF_09_05","",""
"Scripts/content/Story/MISSIONS/DIA_PC_Fighter.d:1269","Dann werde ich ihn besser noch vorher aufsuchen!","Тогда я лучше пойду к нему.","","","Info_Gorn_WOLF_15_06","",""
"Scripts/content/Story/MISSIONS/DIA_PC_Fighter.d:1270","Tu das. Ich warte hier am Wachposten auf dich!","Хорошо. Я буду ждать тебя здесь.","","","Info_Gorn_WOLF_09_07","",""
"Scripts/content/Story/MISSIONS/DIA_PC_Fighter.d:1306","Du scheinst doch noch mit Wolf sprechen zu wollen!","Похоже, ты все-таки хочешь поговорить с Волком!","","","Info_Gorn_LEAVEFORPOST_09_01","",""
"Scripts/content/Story/MISSIONS/DIA_PC_Fighter.d:1310","Du läufst in die falsche Richtung! Wir müssen zur Mine!","Не туда! Мы должны идти к шахте!","","","Info_Gorn_LEAVEFORPOST_09_02","",""
"Scripts/content/Story/MISSIONS/DIA_PC_Fighter.d:1313","Ich warte am provisorischen Wachposten auf dich!","Я буду ждать тебя у поста.","","","Info_Gorn_LEAVEFORPOST_09_03","",""
"Scripts/content/Story/MISSIONS/DIA_PC_Fighter.d:1331","Es kann losgehen! Auf zur Mine!","Отправляемся в шахту!","","","Info_Gorn_REJOINFORFM.description","",""
"Scripts/content/Story/MISSIONS/DIA_PC_Fighter.d:1346","Es kann losgehen! Auf zur Mine!","Отправляемся в шахту!","","","Info_Gorn_REJOINFORFM_15_01","",""
"Scripts/content/Story/MISSIONS/DIA_PC_Fighter.d:1347","Höchste Zeit, dass wir die Gardisten von dort vertreiben!","Настало время выбить оттуда стражников!","","","Info_Gorn_REJOINFORFM_09_02","",""
"Scripts/content/Story/MISSIONS/DIA_PC_Fighter.d:1348","Geh du vor, ich folge dir!","Иди вперед, я пойду следом!","","","Info_Gorn_REJOINFORFM_09_03","",""
"Scripts/content/Story/MISSIONS/DIA_PC_Fighter.d:1380","VORSICHT, RAZORS!!!","БЕРЕГИСЬ!!!","","","Info_Gorn_RAZOR_09_01","",""
"Scripts/content/Story/MISSIONS/DIA_PC_Fighter.d:1381","Die arbeiten genauso in Rudeln wie die Snapper, nur dass sie viel heftiger zubeißen!","Они охотятся стаями, как и глорхи, но их укусы будут пострашнее!","","","Info_Gorn_RAZOR_09_02","",""
"Scripts/content/Story/MISSIONS/DIA_PC_Fighter.d:1382","Wir sollten sie aus dem Weg räumen! Du weißt ja, ich habe gerne einen freien Rücken!","Мы должны избавиться от них. Ты меня знаешь, я не люблю оставлять врага за спиной.","","","Info_Gorn_RAZOR_09_03","",""
"Scripts/content/Story/MISSIONS/DIA_PC_Fighter.d:1411","Warte mal, siehst du all die Leichen hier?","Постой-ка, ты видишь эти тела?","","","Info_Gorn_FMCENTRANCE_09_01","",""
"Scripts/content/Story/MISSIONS/DIA_PC_Fighter.d:1412","Geh du runter zum Mineneingang, ich bleib' erst mal hier oben und stelle sicher, dass es keine Überraschung von hinten gibt.","Иди ко входу в шахту, а я останусь здесь и прослежу за тем, чтобы никто не напал сзади.","","","Info_Gorn_FMCENTRANCE_09_02","",""
"Scripts/content/Story/MISSIONS/DIA_PC_Fighter.d:1413","Wenn du unten bist, komme ich nach.","Я подойду, когда ты спустишься.","","","Info_Gorn_FMCENTRANCE_09_03","",""
"Scripts/content/Story/MISSIONS/DIA_PC_Fighter.d:1444","Ich hörte dich kämpfen, da bin ich sofort hinterher.","Я услышал звуки боя и сразу пошел за тобой.","","","Info_Gorn_FMGATE_09_01","",""
"Scripts/content/Story/MISSIONS/DIA_PC_Fighter.d:1445","Ein alter Bekannter ... aber die Rechnung ist beglichen.","Старый знакомый... Но этот счет уже оплачен.","","","Info_Gorn_FMGATE_15_02","",""
"Scripts/content/Story/MISSIONS/DIA_PC_Fighter.d:1446","Gut, öffne du das Tor, ich pass' hier auf!","Хорошо. Открывай ворота, я прикрою.","","","Info_Gorn_FMGATE_09_03","",""
"Scripts/content/Story/MISSIONS/DIA_PC_Fighter.d:1475","Oh, Mann. Das war ein wirklich beinharter Kampf.","Ох, парень. Это был непростой бой.","","","Info_Gorn_AFTERFM_09_01","",""
"Scripts/content/Story/MISSIONS/DIA_PC_Fighter.d:1476","Hätte nicht gedacht, dass Gomez' Gardisten so viel Widerstand leisten.","Никогда бы не подумал, что люди Гомеза способны так драться.","","","Info_Gorn_AFTERFM_09_02","",""
"Scripts/content/Story/MISSIONS/DIA_PC_Fighter.d:1477","Die Hauptsache ist, dass wir sie wieder aus unserer Mine vertrieben haben!","Главное - это то, что мы все-таки выбили их из шахты.","","","Info_Gorn_AFTERFM_15_03","",""
"Scripts/content/Story/MISSIONS/DIA_PC_Fighter.d:1478","Ich werde hier bleiben und dafür sorgen, dass das auch so bleibt!","Я останусь здесь и прослежу, чтобы они не вернулись.","","","Info_Gorn_AFTERFM_09_04","",""
"Scripts/content/Story/MISSIONS/DIA_PC_Fighter.d:1497","Wie ist die Lage?","Как дела?","","","Info_Gorn_FMWATCH.description","",""
"Scripts/content/Story/MISSIONS/DIA_PC_Fighter.d:1510","Wie ist die Lage?","Как дела?","","","Info_Gorn_FMWATCH_15_01","",""
"Scripts/content/Story/MISSIONS/DIA_PC_Fighter.d:1511","Alles ruhig. In der Freien Mine rührt sich nichts.","Все тихо. Свободная Шахта словно вымерла.","","","Info_Gorn_FMWATCH_09_02","",""
"Scripts/content/Story/MISSIONS/DIA_PC_Fighter.d:1512","Es kann nicht mehr lange dauern, bis Lee die Verstärkung hier hoch schickt.","Но долго это не продлится, если Ли не пошлет сюда подкрепление.","","","Info_Gorn_FMWATCH_09_03","",""
"Scripts/content/Story/MISSIONS/DIA_PC_Fighter.d:1513","So lange werde ich es mir hier gemütlich machen.","Ну а пока я попробую расположиться поудобнее.","","","Info_Gorn_FMWATCH_09_04","",""
"Scripts/content/Story/MISSIONS/DIA_PC_Fighter.d:1539","Eine interessante Ork-Standarte, die du da hast.","Забавная у тебя штуковина. Похоже, это орочья работа.","","","Info_Gorn_FOUNDULUMULU_09_01","",""
"Scripts/content/Story/MISSIONS/DIA_PC_Fighter.d:1540","Stammt sie von dem befreiten Ork-Sklaven in der Mine?","Тебе его дал раб из шахты?","","","Info_Gorn_FOUNDULUMULU_09_02","",""
"Scripts/content/Story/MISSIONS/DIA_PC_Fighter.d:1541","Es ist ein orkisches Symbol für Freundschaft. Ich will damit die Stadt der Orks betreten.","Это оркский знак дружбы. С ним я хочу войти в город орков.","","","Info_Gorn_FOUNDULUMULU_15_03","",""
"Scripts/content/Story/MISSIONS/DIA_PC_Fighter.d:1542","Ich hoffe für dich, die Orks respektieren dieses ... ETWAS!","Надеюсь, что орки поймут этот... ЗНАК!","","","Info_Gorn_FOUNDULUMULU_09_04","",""
"Scripts/content/Story/MISSIONS/DIA_PC_FighterFM.d:23","Auf in den Kampf!","Защищайся!","","","Info_GornFM_EXIT_09_01","",""
"Scripts/content/Story/MISSIONS/DIA_PC_FighterFM.d:27","Bis später.","Увидимся.","","","Info_GornFM_EXIT_09_02","",""
"Scripts/content/Story/MISSIONS/DIA_PC_FighterFM.d:51","Halt die Stellung, ich werde erst mal die Lage prüfen!","Никуда не уходи, я посмотрю, что там происходит!","","","Info_GornFM_WAIT.description","",""
"Scripts/content/Story/MISSIONS/DIA_PC_FighterFM.d:64","Halt die Stellung, ich werde erst mal die Lage prüfen!","Никуда не уходи, я посмотрю, что там происходит!","","","Info_GornFM_WAIT_15_01","",""
"Scripts/content/Story/MISSIONS/DIA_PC_FighterFM.d:65","Ist gut. Ich warte am Mineneingang und sorge dafür, dass dir niemand in den Rücken fällt!","Хорошо. Я буду ждать у входа в шахту и прослежу за тем, чтобы все было тихо.","","","Info_GornFM_WAIT_09_02","",""
"Scripts/content/Story/MISSIONS/DIA_PC_FighterFM.d:81","Komm mit, ich brauche deine Unterstützung!","Идем, мне нужна твоя помощь.","","","Info_GornFM_FOLLOW.description","",""
"Scripts/content/Story/MISSIONS/DIA_PC_FighterFM.d:94","Komm mit, ich brauche deine Unterstützung!","Идем, мне нужна твоя помощь.","","","Info_GornFM_FOLLOW_15_01","",""
"Scripts/content/Story/MISSIONS/DIA_PC_FighterFM.d:95","Endlich geht es weiter! Geh voraus, ich folge dir!","Наконец-то мы двигаемся! Иди первым, я пойду сзади.","","","Info_GornFM_FOLLOW_09_02","",""
