"location","source","target","id","fuzzy","context","translator_comments","developer_comments"
"Scripts/content/Story/MISSIONS/DIA_GUR_1202_CorAngar.d:462","Besorge mir die Heilkräuter aus dem Sumpf. Fünf von der stärksten Sorte sollten genügen!","Принеси мне целебные травы с болота. Пяти кустов самого сильного сорта должно быть достаточно.","","","Mis_3_NC_CorAngar_FindHerb_08_04","",""
"Scripts/content/Story/MISSIONS/DIA_GUR_1202_CorAngar.d:463","Und bitte beeile dich!","Прошу тебя, поторопись!","","","Mis_3_NC_CorAngar_FindHerb_08_05","",""
"Scripts/content/Story/MISSIONS/DIA_GUR_1202_CorAngar.d:479","Wo findet man solche Pflanzen ?","Где я смогу найти эти травы?","","","Info_CorAngar_FindHerb_WHERE.description","",""
"Scripts/content/Story/MISSIONS/DIA_GUR_1202_CorAngar.d:492","Wo findet man solche Pflanzen ?","Где я смогу найти эти травы?","","","Info_CorAngar_FindHerb_WHERE_15_01","",""
"Scripts/content/Story/MISSIONS/DIA_GUR_1202_CorAngar.d:493","Suche im Sumpf hinter dem Lager. Du musst sehr tief hineingehen aber pass auf, dass dich die Sumpfhaie nicht erwischen.","Ищи их на болоте позади лагеря. Тебе придется зайти далеко вглубь болота - постарайся не попасться болотожорам!","","False","Info_CorAngar_FindHerb_WHERE_08_02","",""
"Scripts/content/Story/MISSIONS/DIA_GUR_1202_CorAngar.d:494","Und jetzt verliere nicht noch mehr Zeit. Geh!","И хватит тратить время впустую. Иди!","","","Info_CorAngar_FindHerb_WHERE_08_03","",""
"Scripts/content/Story/MISSIONS/DIA_GUR_1202_CorAngar.d:507","Wie kann ich diese Kräuter erkennen?","Как я узнаю, что это именно те травы, которые мне нужны?","","","Info_CorAngar_FindHerb_LOOK.description","",""
"Scripts/content/Story/MISSIONS/DIA_GUR_1202_CorAngar.d:520","Wie kann ich diese Kräuter erkennen?","Как я узнаю, что это именно те травы, которые мне нужны?","","","Info_CorAngar_FindHerb_LOOK_15_01","",""
"Scripts/content/Story/MISSIONS/DIA_GUR_1202_CorAngar.d:521","Sie sehen aus wie ein Stern und tragen acht grüne und orangefarbene Blätter.","Они похожи на звезды с восемью зелеными и оранжевыми листьями.","","","Info_CorAngar_FindHerb_LOOK_08_02","",""
"Scripts/content/Story/MISSIONS/DIA_GUR_1202_CorAngar.d:522","Nun geh aber los.","В путь!","","","Info_CorAngar_FindHerb_LOOK_08_03","",""
"Scripts/content/Story/MISSIONS/DIA_GUR_1202_CorAngar.d:536","Ich habe noch nicht genug Heilkräuter gefunden","Я еще не собрал достаточно трав.","","","Info_CorAngar_FindHerb_Running.description","",""
"Scripts/content/Story/MISSIONS/DIA_GUR_1202_CorAngar.d:552","Ich habe noch nicht genug Heilkräuter gefunden","Я еще не собрал достаточно трав.","","","Info_CorAngar_FindHerb_Running_15_01","",""
"Scripts/content/Story/MISSIONS/DIA_GUR_1202_CorAngar.d:553","Vielleicht hat auch Fortuno, der Kräuterhändler, zurzeit einige davon in seinen Regalen.","Возможно, у Фортуно, травника, есть что-нибудь в запасе.","","","Info_CorAngar_FindHerb_Running_08_02","",""
"Scripts/content/Story/MISSIONS/DIA_GUR_1202_CorAngar.d:554","Beeil dich. Ich brauche fünf Stück. Y'Berion bleibt nicht mehr viel Zeit.","Торопись. Мне нужно пять кустов. У Ю`Бериона осталось не так уж много времени.","","","Info_CorAngar_FindHerb_Running_08_03","",""
"Scripts/content/Story/MISSIONS/DIA_GUR_1202_CorAngar.d:576","Ich habe die Heilkräuter für Y'Berion.","Вот целебные травы для Ю`Бериона.","","","Info_CorAngar_FindHerb_Success.description","",""
"Scripts/content/Story/MISSIONS/DIA_GUR_1202_CorAngar.d:589","Ich habe die Heilkräuter für Y'Berion.","Вот целебные травы для Ю`Бериона.","","","Info_CorAngar_FindHerb_Success_15_01","",""
"Scripts/content/Story/MISSIONS/DIA_GUR_1202_CorAngar.d:590","Gut gemacht. Als du unterwegs warst, ist Y'Berion kurzzeitig erwacht.","Отличная работа. Пока ты уходил, Ю`Берион ненадолго пришел в себя.","","","Info_CorAngar_FindHerb_Success_08_02","",""
"Scripts/content/Story/MISSIONS/DIA_GUR_1202_CorAngar.d:591","Hat er was gesagt?","Он что-нибудь говорил?","","","Info_CorAngar_FindHerb_Success_15_03","",""
"Scripts/content/Story/MISSIONS/DIA_GUR_1202_CorAngar.d:592","Ja, er sagte, das der Schläfer nicht der ist, für den wir ihn halten. Wir dürfen nicht weiter versuchen, ihn zu erwecken.","Да, он сказал, что Спящий - не то, что мы думаем. Мы больше не должны пытаться пробудить его.","","","Info_CorAngar_FindHerb_Success_08_04","",""
"Scripts/content/Story/MISSIONS/DIA_GUR_1202_CorAngar.d:593","Jetzt können wir nur noch hoffen, das es noch nicht zu spät für Y'Berion ist.","Нам остается только надеяться, что для Ю`Бериона еще не все потеряно.","","","Info_CorAngar_FindHerb_Success_08_05","",""
"Scripts/content/Story/MISSIONS/DIA_GUR_1202_CorAngar.d:616","Y'BERION IST TOT. Unser geistiger Anführer ist von uns gegangen!","Ю`Берион мертв. Наш духовный наставник покинул нас!","","","GUR_1202_CorAngar_DEATH_Info_08_00","",""
"Scripts/content/Story/MISSIONS/DIA_GUR_1202_CorAngar.d:618","Selbst deine schnelle Hilfe konnte seinen Tod nicht mehr verhindern!","Даже с твоей помощью нам не удалось спасти его!","","","GUR_1202_CorAngar_DEATH_Info_08_01","",""
"Scripts/content/Story/MISSIONS/DIA_GUR_1202_CorAngar.d:619","Was jetzt, Cor Angar?","Что же теперь, Кор Ангар?","","","GUR_1202_CorAngar_DEATH_Info_15_02","",""
"Scripts/content/Story/MISSIONS/DIA_GUR_1202_CorAngar.d:620","Ich habe Y'Berion immer vertraut. Kurz bevor er starb, legte er all seine Hoffnungen in den Ausbruchsplan der Wassermagier.","Я всегда доверял Ю`Бериону. Незадолго до конца, он возложил все свои надежды на план спасения, разработанный магами Воды.","","","GUR_1202_CorAngar_DEATH_Info_08_03","",""
"Scripts/content/Story/MISSIONS/DIA_GUR_1202_CorAngar.d:621","Dann sollten wir die Wassermagier bei ihrem Vorhaben unterstützen.","Так что теперь мы должны поддерживать магов Воды и их идеи.","","","GUR_1202_CorAngar_DEATH_Info_15_04","",""
"Scripts/content/Story/MISSIONS/DIA_GUR_1202_CorAngar.d:622","Sie werden den Fokus und den Almanach benötigen. Beides befindet sich noch in Cor Kaloms Besitz.","Им понадобятся магический юнитор и альманах. И тем, и другим владеет Кор Галом.","","","GUR_1202_CorAngar_DEATH_Info_08_05","",""
"Scripts/content/Story/MISSIONS/DIA_GUR_1202_CorAngar.d:623","Wo ist Cor Kalom?","Где сейчас Кор Галом?","","","GUR_1202_CorAngar_DEATH_Info_15_06","",""
"Scripts/content/Story/MISSIONS/DIA_GUR_1202_CorAngar.d:624","Er ist mit einigen Templern völlig zornerfüllt aufgebrochen, um einen eigenen Weg zum Schläfer zu finden.","Он был в ярости - забрал нескольких стражей и отправился искать свой собственный путь к Спящему.","","False","GUR_1202_CorAngar_DEATH_Info_08_07","",""
"Scripts/content/Story/MISSIONS/DIA_GUR_1202_CorAngar.d:625","Verdammt, wie sollen wir jetzt an den Fokus kommen?","Проклятье, как же нам теперь добыть юнитор?","","","GUR_1202_CorAngar_DEATH_Info_15_08","",""
"Scripts/content/Story/MISSIONS/DIA_GUR_1202_CorAngar.d:626","Ich schätze, er ließ Buch und Fokus in seinem Labor zurück. Hier ist der Schlüssel für seine Truhe.","Я думаю, что он оставил книгу и юнитор в своей лаборатории. Вот ключ от сундука.","","","GUR_1202_CorAngar_DEATH_Info_08_09","",""
"Scripts/content/Story/MISSIONS/DIA_GUR_1202_CorAngar.d:652","Einen Moment noch!","Минуту!","","","Info_CorAngar_TELEPORT_08_01","",""
"Scripts/content/Story/MISSIONS/DIA_GUR_1202_CorAngar.d:653","Ja?","Да?","","","Info_CorAngar_TELEPORT_15_02","",""
"Scripts/content/Story/MISSIONS/DIA_GUR_1202_CorAngar.d:654","Nimm diese Zauberrune als Zeichen unseres Dankes für deine großen Taten.","Прими эту магическую руну в знак благодарности за твои добрые дела.","","","Info_CorAngar_TELEPORT_08_03","",""
"Scripts/content/Story/MISSIONS/DIA_GUR_1202_CorAngar.d:655","Damit kannst du dich jederzeit schnell und bequem auf unseren Tempelvorplatz teleportieren.","Она позволит тебе легко и быстро переноситься во двор нашего храма, когда в этом возникнет необходимость.","","","Info_CorAngar_TELEPORT_08_04","",""
"Scripts/content/Story/MISSIONS/DIA_GUR_1202_CorAngar.d:656","Ich danke dir!","Благодарю тебя!","","","Info_CorAngar_TELEPORT_15_05","",""
"Scripts/content/Story/MISSIONS/DIA_GUR_1204_BaalNamib.d:50","Alles, klar, Alter?","Все в порядке, приятель?","","","DIA_BaalNamib_NoTalk.DIA_BaalNamib_NoTalk_Imp","Info_AddChoice",""
"Scripts/content/Story/MISSIONS/DIA_GUR_1204_BaalNamib.d:51","Der Schläfer sei mit dir!","Да пребудет с тобой Спящий!","","","DIA_BaalNamib_NoTalk.DIA_BaalNamib_NoTalk_Sleeper","Info_AddChoice",""
"Scripts/content/Story/MISSIONS/DIA_GUR_1204_BaalNamib.d:52","Hi! Ich bin neu hier!","Привет! Я здесь новенький.","","","DIA_BaalNamib_NoTalk.DIA_BaalNamib_NoTalk_Hi","Info_AddChoice",""
"Scripts/content/Story/MISSIONS/DIA_GUR_1204_BaalNamib.d:57","Hi! Ich bin neu hier!","Привет! Я здесь новенький!","","","DIA_BaalNamib_NoTalk_Hi_15_00","",""
"Scripts/content/Story/MISSIONS/DIA_GUR_1204_BaalNamib.d:58","(verärgertes Schnauben)","(вздох)","","","DIA_BaalNamib_NoTalk_Hi_02_01","",""
"Scripts/content/Story/MISSIONS/DIA_GUR_1204_BaalNamib.d:64","Der Schläfer sei mit dir!","Да пребудет с тобой Спящий!","","","DIA_BaalNamib_NoTalk_Sleeper_15_00","",""
"Scripts/content/Story/MISSIONS/DIA_GUR_1204_BaalNamib.d:65","(verärgertes Schnauben)","(вздох)","","","DIA_BaalNamib_NoTalk_Sleeper_02_01","",""
"Scripts/content/Story/MISSIONS/DIA_GUR_1204_BaalNamib.d:71","Alles, klar, Alter?","Все в порядке, приятель?","","","DIA_BaalNamib_NoTalk_Imp_15_00","",""
"Scripts/content/Story/MISSIONS/DIA_GUR_1204_BaalNamib.d:72","(verärgertes Schnauben)","(вздох)","","","DIA_BaalNamib_NoTalk_Imp_02_01","",""
"Scripts/content/Story/MISSIONS/DIA_GUR_1204_BaalNamib.d:103","(seufzt)","(вздох)","","","DIA_BaalNamib_FirstTalk_02_00","",""
"Scripts/content/Story/MISSIONS/DIA_GUR_1204_BaalNamib.d:104","Der Schläfer hat dich erwählt. Ist es dir wirklich ernst mit deinem Wunsch, uns beizutreten?","Спящий избрал тебя. Ты и в самом деле хочешь присоединиться к нам?","","","DIA_BaalNamib_FirstTalk_02_01","",""
"Scripts/content/Story/MISSIONS/DIA_GUR_1204_BaalNamib.d:107","NICHTS SAGEN","НИЧЕГО НЕ ГОВОРИ.","","","DIA_BaalNamib_FirstTalk.DIA_BaalNamib_FirstTalk_Mute","Info_AddChoice",""
"Scripts/content/Story/MISSIONS/DIA_GUR_1204_BaalNamib.d:108","Ja, ich will den Weg des Schläfers beschreiten!","Да, я хочу стать последователем Спящего.","","","DIA_BaalNamib_FirstTalk.DIA_BaalNamib_FirstTalk_Sleeper","Info_AddChoice",""
"Scripts/content/Story/MISSIONS/DIA_GUR_1204_BaalNamib.d:113","(seufzt)","(вздох)","","","DIA_BaalNamib_FirstTalk_Mute_15_00","",""
"Scripts/content/Story/MISSIONS/DIA_GUR_1204_BaalNamib.d:114","Nun?","Ну?","","","DIA_BaalNamib_FirstTalk_Mute_02_01","",""
"Scripts/content/Story/MISSIONS/DIA_GUR_1204_BaalNamib.d:119","Ja, ich will den Weg des Schläfers beschreiten!","Да, я хочу стать последователем Спящего.","","","DIA_BaalNamib_FirstTalk_Sleeper_15_00","",""
"Scripts/content/Story/MISSIONS/DIA_GUR_1204_BaalNamib.d:120","Geh zu Cor Kalom. Sag ihm, ich schicke ihm einen wahren Anhänger des Glaubens!","Иди к Кор Галому. Скажи ему, что я считаю тебя истинно верующим!","","","DIA_BaalNamib_FirstTalk_Sleeper_02_01","",""
"Scripts/content/Story/MISSIONS/DIA_GUR_1204_BaalNamib.d:137","Ich möchte eine bessere Rüstung haben.","Мне нужны доспехи получше.","","","GUR_1204_BaalNamib_ARMOR.description","",""
"Scripts/content/Story/MISSIONS/DIA_GUR_1204_BaalNamib.d:151","Ich möchte eine bessere Rüstung haben.","Мне нужны доспехи получше.","","","GUR_1204_BaalNamib_ARMOR_Info_15_01","",""
"Scripts/content/Story/MISSIONS/DIA_GUR_1204_BaalNamib.d:155","Es ist noch nicht an der Zeit für dich, die schwere Rüstung der Novizen zu tragen.","Тебе еще рано носить тяжелые доспехи послушника.","","","GUR_1204_BaalNamib_ARMOR_Info_02_02","",""
"Scripts/content/Story/MISSIONS/DIA_GUR_1204_BaalNamib.d:159","Komm wieder, wenn du genug Erz hast.","Возвращайся, когда соберешь достаточно руды.","","","GUR_1204_BaalNamib_ARMOR_Info_02_03","",""
"Scripts/content/Story/MISSIONS/DIA_GUR_1204_BaalNamib.d:163","Diese Rüstung schützt deinen Körper, wie der Schläfer deinen Geist schützt!","Эти доспехи защитят тело твое, так же как Спящий защищает твою душу!","","","GUR_1204_BaalNamib_ARMOR_Info_02_04","",""
"Scripts/content/Story/MISSIONS/DIA_GUR_1204_BaalNamib.d:185","Gibt es Aufgaben, die ich für die Bruderschaft erledigen kann?","Могу ли я что-нибудь сделать для Братства?","","","Info_BaalNamib_BROTHERHOOD.description","",""
"Scripts/content/Story/MISSIONS/DIA_GUR_1204_BaalNamib.d:195","Gibt es Aufgaben, die ich für die Bruderschaft erledigen kann?","Могу ли я что-нибудь сделать для Братства?","","","Info_BaalNamib_BROTHERHOOD_15_01","",""
"Scripts/content/Story/MISSIONS/DIA_GUR_1204_BaalNamib.d:196","Unser Meister, der weise Y'Berion, schickt nach einem Novizen. Nun, da du ein Bruder der Gemeinschaft geworden bist, geh zu ihm und biete ihm deine Hilfe an.","Нашему Мастеру, мудрейшему Ю`Бериону, нужен послушник. Иди к нему и предложи свои услуги.","","False","Info_BaalNamib_BROTHERHOOD_02_02","",""
"Scripts/content/Story/MISSIONS/DIA_GUR_1204_BaalNamib.d:198","In Ordnung, ich werde ihn sofort aufsuchen","Хорошо, я отправлюсь к нему прямо сейчас.","","","Info_BaalNamib_BROTHERHOOD.Info_BaalNamib_BROTHERHOOD_OK","Info_AddChoice",""
"Scripts/content/Story/MISSIONS/DIA_GUR_1204_BaalNamib.d:199","Wo finde ich Y'Berion?","Где я могу найти Ю`Бериона?","","","Info_BaalNamib_BROTHERHOOD.Info_BaalNamib_BROTHERHOOD_YBWO","Info_AddChoice",""
"Scripts/content/Story/MISSIONS/DIA_GUR_1204_BaalNamib.d:200","Weißt du, was ich für Y'berion erledigen soll?","Не знаешь ли ты, какое поручение даст мне Ю`Берион?","","False","Info_BaalNamib_BROTHERHOOD.Info_BaalNamib_BROTHERHOOD_YBWAS","Info_AddChoice",""
"Scripts/content/Story/MISSIONS/DIA_GUR_1204_BaalNamib.d:209","Wo finde ich Y'Berion?","Где я могу найти Ю`Бериона?","","","Info_BaalNamib_BROTHERHOOD_YBWO_15_01","",""
"Scripts/content/Story/MISSIONS/DIA_GUR_1204_BaalNamib.d:210","Er hält sich im Inneren des Tempelbergs auf. Wie immer.","Холм. Как и всегда, впрочем.","","","Info_BaalNamib_BROTHERHOOD_YBWO_02_02","",""
"Scripts/content/Story/MISSIONS/DIA_GUR_1204_BaalNamib.d:215","Weißt du, was ich für Y'Berion erledigen soll?","Не знаешь ли ты, какое поручение даст мне Ю`Берион?","","False","Info_BaalNamib_BROTHERHOOD_YBWAS_15_01","",""
"Scripts/content/Story/MISSIONS/DIA_GUR_1204_BaalNamib.d:216","Eine große Beschwörung wird stattfinden. Allerdings brauchen wir dafür einen magischen Gegenstand.","Все мы ждем Великой Церемонии. Но прежде чем она начнется, нам потребуется магический артефакт.","","False","Info_BaalNamib_BROTHERHOOD_YBWAS_02_02","",""
"Scripts/content/Story/MISSIONS/DIA_GUR_1204_BaalNamib.d:217","Y'Berion sucht Männer, die mutig genug sind, ihm dieses Artefakt zu bringen.","Ю`Берион ищет храбреца, который найдет его.","","","Info_BaalNamib_BROTHERHOOD_YBWAS_02_03","",""
"Scripts/content/Story/MISSIONS/DIA_GUR_1204_BaalNamib.d:218","Klingt einfach.","Ну, это просто.","","","Info_BaalNamib_BROTHERHOOD_YBWAS_15_04","",""
"Scripts/content/Story/MISSIONS/DIA_GUR_1204_BaalNamib.d:219","Wenn es einfach wäre, hätten wir den Gegenstand schon. Sprich erst mal mit Y'Berion. Er wird dir alles erklären.","Если бы это было так просто, артефакт был бы уже у нас. Прежде поговори с Ю`Берионом. Он тебе все объяснит.","","","Info_BaalNamib_BROTHERHOOD_YBWAS_02_05","",""
"Scripts/content/Story/MISSIONS/DIA_GUR_1204_BaalNamib.d:224","In Ordnung, ich werde ihn sofort aufsuchen.","Я обращусь к нему немедленно.","","","Info_BaalNamib_BROTHERHOOD_OK_15_01","",""
"Scripts/content/Story/MISSIONS/DIA_GUR_1204_BaalNamib.d:225","Möge der Schläfer dich beschützen","Да хранит тебя Спящий!","","","Info_BaalNamib_BROTHERHOOD_OK_02_02","",""
"Scripts/content/Story/MISSIONS/DIA_GUR_1211_BaalLukor.d:42","Danke für deine Hilfe. Du bist wirklich in letzter Sekunde gekommen.","Благодарю за помощь. Ты прибыл как раз вовремя.","","","Info_BaalLukor_MEET_13_01","",""
"Scripts/content/Story/MISSIONS/DIA_GUR_1211_BaalLukor.d:56","Ich habe tote Templer auf dem Weg hierher gefunden!","По дороге сюда я видел мертвых стражей. Что случилось?","","False","Info_BaalLukor_DEAD.description","",""
"Scripts/content/Story/MISSIONS/DIA_GUR_1211_BaalLukor.d:66","Ich habe tote Templer auf dem Weg hierher gefunden! Was ist passiert?","По дороге сюда я видел нескольких мертвых стражей. Что случилось?","","False","Info_BaalLukor_DEAD_15_01","",""
"Scripts/content/Story/MISSIONS/DIA_GUR_1211_BaalLukor.d:67","Meister Cor Angar hat uns hierhin entsandt, um die Höhlen zu erforschen.","Господин Кор Ангар отправил нас обследовать пещеры.","","","Info_BaalLukor_DEAD_13_02","",""
"Scripts/content/Story/MISSIONS/DIA_GUR_1211_BaalLukor.d:68","Wir hatte nichts als muffige Grabnischen und halbzerfallene Mumien erwartet.","Мы ожидали увидеть ряды могил и полуразложившиеся мумии.","","","Info_BaalLukor_DEAD_13_03","",""
"Scripts/content/Story/MISSIONS/DIA_GUR_1211_BaalLukor.d:69","Dann plötzlich bewegte sich die Dunkelheit und überall waren Orks. Ich weiß nicht, was sie hier suchen, aber ihr Auftauchen hier ist mehr als ungewöhnlich!","Но внезапно тьма рассеялась, и орки были повсюду! Я не знаю, чего они искали здесь, но их появление было более чем неожиданным.","","","Info_BaalLukor_DEAD_13_04","",""
"Scripts/content/Story/MISSIONS/DIA_GUR_1211_BaalLukor.d:70","Wo sind die anderen Templer?","А где остальные стражи?","","False","Info_BaalLukor_DEAD_15_05","",""
"Scripts/content/Story/MISSIONS/DIA_GUR_1211_BaalLukor.d:71","Tot! Ich habe sie unwissend ins Verderben geführt. Ich hoffe, der Schläfer wird mir das verzeihen.","Мертвы! Я невольно стал причиной их гибели. Надеюсь, Спящий простит меня за это.","","","Info_BaalLukor_DEAD_13_06","",""
"Scripts/content/Story/MISSIONS/DIA_GUR_1211_BaalLukor.d:85","Cor Angar schickt mich!","Меня прислал Кор Ангар!","","False","Info_BaalLukor_SUMMONING.description","",""
"Scripts/content/Story/MISSIONS/DIA_GUR_1211_BaalLukor.d:95","Cor Angar schickt mich! Habt ihr irgendein Zeichen des Schläfers gefunden?","Меня прислал Кор Ангар! Вы нашли что-нибудь?","","","Info_BaalLukor_SUMMONING_15_01","",""
"Scripts/content/Story/MISSIONS/DIA_GUR_1211_BaalLukor.d:96","Bisher noch nicht. Aber was ist mit Y'Berion? Ist er wieder zu sich gekommen?","Пока еще нет. Что с Ю`Берионом? Он пришел в себя?","","","Info_BaalLukor_SUMMONING_13_02","",""
"Scripts/content/Story/MISSIONS/DIA_GUR_1211_BaalLukor.d:97","Nein, er ist immer noch ohnmächtig.","Нет, он все еще без сознания.","","","Info_BaalLukor_SUMMONING_15_03","",""
"Scripts/content/Story/MISSIONS/DIA_GUR_1211_BaalLukor.d:98","Wir müssen dem Rätsel dieser Höhlen auf den Grund gehen. Nach all den schrecklichen Verlusten kann ich nicht mit leeren Händen zur Gemeinschaft zurückkehren.","Мы должны разгадать загадку этих пещер. После таких чудоищных потерь я не могу вернуться к братьям с пустыми руками.","","","Info_BaalLukor_SUMMONING_13_04","",""
"Scripts/content/Story/MISSIONS/DIA_GUR_1211_BaalLukor.d:99","Doch meine Kampfkünste sind sehr begrenzt und die Orks sprechen nicht auf meine magischen Kräfte an, so wie es die leichtgläubigen Menschen aus dem Alten Lager tun.","Но я не слишком силен в бою, а орки не так поддаются моей магии, как эти доверчивые глупцы из Старого лагеря.","","False","Info_BaalLukor_SUMMONING_13_05","",""
"Scripts/content/Story/MISSIONS/DIA_GUR_1211_BaalLukor.d:100","Wenn dich schon unsere Bruderschaft schickt, vielleicht könntest du mir bei der restlichen Erforschung dieser Gruft helfen.","Если ты служишь Братству, ты должен помочь мне исследовать эту гробницу.","","","Info_BaalLukor_SUMMONING_13_06","",""
"Scripts/content/Story/MISSIONS/DIA_GUR_1211_BaalLukor.d:112","Ich werde dir helfen","Я помогу тебе.","","","Info_BaalLukor_HELP.description","",""
"Scripts/content/Story/MISSIONS/DIA_GUR_1211_BaalLukor.d:122","Ich werde dir helfen.","Я помогу тебе.","","","Info_BaalLukor_HELP_15_01","",""
"Scripts/content/Story/MISSIONS/DIA_GUR_1211_BaalLukor.d:123","Gut. Sehr gut. Aus dieser Halle führen drei Stollen. Wir sollten sie alle durchsuchen.","Хорошо. Отлично. От этого зала отходят три туннеля. Мы должны осмотреть их все.","","","Info_BaalLukor_HELP_13_02","",""
"Scripts/content/Story/MISSIONS/DIA_GUR_1211_BaalLukor.d:124","Geh voraus. Ich folge dir!","Иди вперед. Я пойду следом!","","","Info_BaalLukor_HELP_13_03","",""
"Scripts/content/Story/MISSIONS/DIA_GUR_1211_BaalLukor.d:142","Ich kann keinen Hinweis finden!","Я ничего не могу найти!","","","Info_BaalLukor_FOUNDNONE.description","",""
"Scripts/content/Story/MISSIONS/DIA_GUR_1211_BaalLukor.d:158","Ich kann keinen Hinweis finden!","Я ничего не могу найти!","","","Info_BaalLukor_FOUNDNONE_15_01","",""
"Scripts/content/Story/MISSIONS/DIA_GUR_1211_BaalLukor.d:159","Wir müssen die drei Stollen durchsuchen.","Мы должны осмотреть все три туннеля.","","","Info_BaalLukor_FOUNDNONE_13_02","",""
"Scripts/content/Story/MISSIONS/DIA_GUR_1211_BaalLukor.d:174","Es scheint hier keine andere Pergamenthälfte zu geben!","Очевидно, второй половины свитка попросту не существует!","","","Info_BaalLukor_FOUNDONE.description","",""
"Scripts/content/Story/MISSIONS/DIA_GUR_1211_BaalLukor.d:188","Es scheint hier keine andere Pergamenthälfte zu geben!","Очевидно, второй половины свитка попросту не существует!","","","Info_BaalLukor_FOUNDONE_15_01","",""
"Scripts/content/Story/MISSIONS/DIA_GUR_1211_BaalLukor.d:189","Es muss eine zweite Hälfte geben. Wir sollten alle drei Stollen gründlich durchsuchen!","Должна быть вторая половина. Давай осмотрим все три туннеля!","","","Info_BaalLukor_FOUNDONE_13_02","",""
"Scripts/content/Story/MISSIONS/DIA_GUR_1211_BaalLukor.d:219","Hier geht es nicht weiter! Vielleicht bergen die Nischen hier Hinweise.","Мы в тупике! Возможно, разгадка кроется в этих нишах.","","","Info_BaalLukor_FIRSTWAIT_13_01","",""
"Scripts/content/Story/MISSIONS/DIA_GUR_1211_BaalLukor.d:234","Ich habe dieses Stück Pergament hier gefunden!","Я нашел свиток!","","","Info_BaalLukor_FIRSTSCROLL.description","",""
"Scripts/content/Story/MISSIONS/DIA_GUR_1211_BaalLukor.d:248","Ich habe dieses Stück Pergament hier gefunden!","Я нашел свиток!","","","Info_BaalLukor_FIRSTSCROLL_15_01","",""
