"location","source","target","id","fuzzy","context","translator_comments","developer_comments"
"Scripts/content/Story/MISSIONS/DIA_Grd_201_Jackal.d:237","Sieh mal einer an. Der Typ aus dem Neuen Lager, der uns schon so viel Ärger gemacht hat!","Эй, ты только посмотри! Это тот самый тип из Нового Лагеря, из-за которого и разгорелся весь сыр-бор!","","","Info_Jackal_PAYDAY_07_03","",""
"Scripts/content/Story/MISSIONS/DIA_Grd_201_Jackal.d:238","Wenn du damals schlauer gewesen wärst, würdest du heute zu uns - den Siegern - gehören!","Если бы тогда ты хоть немного пошевелил мозгами, сейчас бы ты был на нашей стороне - на стороне победителей!","","","Info_Jackal_PAYDAY_07_04","",""
"Scripts/content/Story/MISSIONS/DIA_Grd_201_Jackal.d:243","Sieh mal einer an. Der Typ aus dem Sumpflager.","Нет, ты только погляди на это. Это парень из Болотного Лагеря.","","","Info_Jackal_PAYDAY_07_05","",""
"Scripts/content/Story/MISSIONS/DIA_Grd_201_Jackal.d:244","Du hast dich zu lange bei diesen Spinnern aufgehalten, die haben dein Hirn weich gekocht!","Ты общался с этими придурками так долго, что и у тебя явно съехала крыша!","","","Info_Jackal_PAYDAY_07_06","",""
"Scripts/content/Story/MISSIONS/DIA_Grd_201_Jackal.d:249","Da hilft dir auch nicht, dass du mir Schutzgeld bezahlt hast.","Даже та руда, которую ты заплатил мне за защиту, теперь тебе не поможет.","","","Info_Jackal_PAYDAY_07_07","",""
"Scripts/content/Story/MISSIONS/DIA_Grd_201_Jackal.d:253","Hättest mich damals bezahlen sollen, als es noch Zeit war.","Тебе стоило заплатить мне, пока у тебя еще была такая возможность.","","","Info_Jackal_PAYDAY_07_08","",""
"Scripts/content/Story/MISSIONS/DIA_Grd_201_Jackal.d:256","Ihr seid zu weit gegangen! Der Überfall auf die Mine war dumm von euch!","Ты зарвался! Тебе не стоило нападать на меня!","","","Info_Jackal_PAYDAY_15_09","",""
"Scripts/content/Story/MISSIONS/DIA_Grd_201_Jackal.d:257","Scheint aber funktioniert zu haben. Und du wirst daran auch nichts ändern, dafür werde ich persönlich Sorge tragen!","И тем не менее, все получилось как нельзя лучше. Этого тебе уже не изменить, поверь!","","","Info_Jackal_PAYDAY_07_10","",""
"Scripts/content/Story/MISSIONS/DIA_Grd_201_Jackal.d:258","LOS, WIR MACHEN IHN KALT, JUNGS!!!","ЭЙ, ПАРНИ! ВЗЯТЬ ЕГО!!!","","","Info_Jackal_PAYDAY_07_11","",""
"Scripts/content/Story/MISSIONS/DIA_Grd_212_GuardPassage.d:45","HALT!","СТОЙ!","","","Info_Grd_212_FirstWarn_Info_13_01","",""
"Scripts/content/Story/MISSIONS/DIA_Grd_212_GuardPassage.d:46","Was ist?","Что такое?","","","Info_Grd_212_FirstWarn_Info_15_02","",""
"Scripts/content/Story/MISSIONS/DIA_Grd_212_GuardPassage.d:47","Die Burg darf nur mit Genehmigung betreten werden! Mach, dass du verschwindest!","Ты не можешь зайти в замок без разрешения! Убирайся отсюда!","","","Info_Grd_212_FirstWarn_Info_13_03","",""
"Scripts/content/Story/MISSIONS/DIA_Grd_212_GuardPassage.d:82","Bist du taub? Noch ein Schritt und du bist Futter für die Würmer!","Ты что, оглох? Еще один шаг, и ты станешь кормом для червей!","","","Info_Grd_212_LastWarn_13_01","",""
"Scripts/content/Story/MISSIONS/DIA_Grd_212_GuardPassage.d:161","Ich will in die Burg.","Мне нужно попасть в замок!","","","Info_Grd_212_Abblitzen.description","",""
"Scripts/content/Story/MISSIONS/DIA_Grd_212_GuardPassage.d:174","Ich will in die Burg!","Мне нужно попасть в замок!","","","Info_Grd_212_Abblitzen_15_00","",""
"Scripts/content/Story/MISSIONS/DIA_Grd_212_GuardPassage.d:175","Das ist ja interessant! ICH will raus aus der verdammten Kolonie!","Как интересно! А я хочу убраться из этой проклятой колонии!","","","Info_Grd_212_Abblitzen_13_01","",""
"Scripts/content/Story/MISSIONS/DIA_Grd_212_GuardPassage.d:176","Kann mir nämlich was Besseres vorstellen, als Pennern wie dir den Eintritt zu verbieten.","И уж во всяком случае у меня есть дела поважнее, чем следить, чтоб такие бездельники, как ты, не совали свой нос куда не следует.","","","Info_Grd_212_Abblitzen_13_02","",""
"Scripts/content/Story/MISSIONS/DIA_Grd_212_GuardPassage.d:177","Du könntest mich auch reinlassen.","Ты можешь просто впустить меня...","","","Info_Grd_212_Abblitzen_15_03","",""
"Scripts/content/Story/MISSIONS/DIA_Grd_212_GuardPassage.d:178","Kann ich nicht! Thorus kann das.","Нет, не могу! Только Торус может.","","","Info_Grd_212_Abblitzen_13_04","",""
"Scripts/content/Story/MISSIONS/DIA_Grd_212_GuardPassage.d:204","Halt!","СТОЙ!","","","Info_Grd_212_FirstIn_13_00","",""
"Scripts/content/Story/MISSIONS/DIA_Grd_212_GuardPassage.d:205","Entspann dich! Ich hab' mit Thorus geredet. Ich kann rein.","Расслабься! Я поговорил с Торусом. Он мне разрешил.","","","Info_Grd_212_FirstIn_15_01","",""
"Scripts/content/Story/MISSIONS/DIA_Grd_212_GuardPassage.d:206","Ich werd' mir deine Visage merken. Wenn du Ärger machst, bist du dran!","Я запомнил твое лицо, парень! У тебя будут неприятности, и так легко от них ты не отделаешься.","","","Info_Grd_212_FirstIn_13_02","",""
"Scripts/content/Story/MISSIONS/DIA_Grd_212_GuardPassage.d:220","Kann ich immer noch rein?","Я все-таки могу войти?","","","Info_Grd_212_Passgate.description","",""
"Scripts/content/Story/MISSIONS/DIA_Grd_212_GuardPassage.d:233","Kann ich immer noch rein?","Я все-таки могу войти?","","","Info_Grd_212_Passgate_15_00","",""
"Scripts/content/Story/MISSIONS/DIA_Grd_212_GuardPassage.d:234","Wenn du noch mal so dämlich fragst, nicht mehr.","Да, если перестанешь задавать глупые вопросы.","","","Info_Grd_212_Passgate_13_01","",""
"Scripts/content/Story/MISSIONS/DIA_Grd_213_GuardPassage.d:45","HALT!","СТОЙ!","","","Info_Grd_213_FirstWarn_Info_07_01","",""
"Scripts/content/Story/MISSIONS/DIA_Grd_213_GuardPassage.d:46","Was ist?","Что такое?","","","Info_Grd_213_FirstWarn_Info_15_02","",""
"Scripts/content/Story/MISSIONS/DIA_Grd_213_GuardPassage.d:47","Du darfst nicht in die Burg! Hau ab!","Ты не можешь зайти в замок! Проваливай!","","","Info_Grd_213_FirstWarn_Info_07_03","",""
"Scripts/content/Story/MISSIONS/DIA_Grd_213_GuardPassage.d:82","Bist du taub? Noch ein Schritt und du bist Futter für die Würmer!","Ты что, оглох? Еще один шаг, и станешь пищей для червей!","","","Info_Grd_213_LastWarn_07_01","",""
"Scripts/content/Story/MISSIONS/DIA_Grd_213_GuardPassage.d:149","Ich hab' gehört, du bist jetzt einer von uns? Nicht schlecht in so kurzer Zeit.","Я слышал, теперь ты один из нас? Совсем неплохо для новичка.","","","Grd_213_Torwache_WELCOME_Info_07_01","",""
"Scripts/content/Story/MISSIONS/DIA_Grd_213_GuardPassage.d:185","Lass doch mal zur Abwechslung jemanden in die Burg.","Мне кажется, в жизни порой нужно совершать безумные поступки...","","False","Info_Grd_213_Abblitzen.description","",""
"Scripts/content/Story/MISSIONS/DIA_Grd_213_GuardPassage.d:198","Du könntest mal ein bisschen Abwechslung in dein Leben bringen. Lass doch mal jemanden in die Burg.","Мне кажется, в жизни порой нужно совершать безумные поступки - иначе ей не хватает остроты. Например, ты можешь впустить меня в замок.","","","Info_Grd_213_Abblitzen_15_00","",""
"Scripts/content/Story/MISSIONS/DIA_Grd_213_GuardPassage.d:199","Abwechslung? Ist schon 'ne gute Idee - einen wie dich hab' ich schon lange nicht mehr verprügelt.","Безумные поступки? Неплохая идея - я уже давным-давно не надирал задницу бездельникам вроде тебя.","","","Info_Grd_213_Abblitzen_07_01","",""
"Scripts/content/Story/MISSIONS/DIA_Grd_213_GuardPassage.d:213","Na, alles klar?","Эй, все нормально?","","","Info_Grd_213_Passgate.description","",""
"Scripts/content/Story/MISSIONS/DIA_Grd_213_GuardPassage.d:226","Na, alles klar?","Эй, все нормально?","","","Info_Grd_213_Passgate_15_00","",""
"Scripts/content/Story/MISSIONS/DIA_Grd_213_GuardPassage.d:227","Lunger hier nicht rum - geh rein.","Хватит бродить вокруг да около - заходи.","","","Info_Grd_213_Passgate_07_01","",""
"Scripts/content/Story/MISSIONS/DIA_Grd_214_Torwache.d:34","Was machst du hier?","Чем ты занимаешься?","","","DIA_Grd_214_Torwache_job.description","",""
"Scripts/content/Story/MISSIONS/DIA_Grd_214_Torwache.d:44","Was machst du hier?","Чем ты занимаешься весь день?","","","DIA_Grd_214_Torwache_job_15_00","",""
"Scripts/content/Story/MISSIONS/DIA_Grd_214_Torwache.d:45","Ich passe auf, dass hier keiner reinkommt, der von Gomez nicht erwünscht ist.","Слежу за тем, чтобы никто не заходил внутрь без приказа Гомеза.","","","DIA_Grd_214_Torwache_job_07_01","",""
"Scripts/content/Story/MISSIONS/DIA_Grd_214_Torwache.d:46","Also mach keinen Ärger, wenn du drin bist, sonst bist du das letzte Mal hier gewesen.","Так что постарайся без глупостей, а то никуда не пойдешь.","","","DIA_Grd_214_Torwache_job_07_02","",""
"Scripts/content/Story/MISSIONS/DIA_Grd_214_Torwache.d:73","Hey, gut dass du da bist. Thorus will dich sprechen!","Эй, хорошо что ты здесь. Тебя искал Торус!","","","Grd_214_Torwache_SEETHORUS_Info_07_01","",""
"Scripts/content/Story/MISSIONS/DIA_Grd_214_Torwache.d:74","Was will er denn?","Что ему нужно?","","","Grd_214_Torwache_SEETHORUS_Info_15_02","",""
"Scripts/content/Story/MISSIONS/DIA_Grd_214_Torwache.d:75","Das wird er dir schon selber sagen.","Уверен, он сам тебе скажет.","","","Grd_214_Torwache_SEETHORUS_Info_07_03","",""
"Scripts/content/Story/MISSIONS/DIA_Grd_214_Torwache.d:102","HEY DU!!! Versuchst wohl Dusty hier herauszuschmuggeln, was?","ЭЙ! Ты же не собираешься утащить его отсюда, верно?!","","","Grd_214_Torwache_NODUSTY_Info_07_01","",""
"Scripts/content/Story/MISSIONS/DIA_Grd_214_Torwache.d:103","Wir wollen doch nur...","Мы просто хотели...","","","Grd_214_Torwache_NODUSTY_Info_15_02","",""
"Scripts/content/Story/MISSIONS/DIA_Grd_214_Torwache.d:104","Du willst gleich gar nichts mehr!","Скоро ты уже ничего не захочешь!","","","Grd_214_Torwache_NODUSTY_Info_07_03","",""
"Scripts/content/Story/MISSIONS/DIA_Grd_215_Torwache.d:47","Wo soll's denn hingehen?","Куда это ты направляешься?","","","DIA_Grd_215_Torwache_First_06_00","",""
"Scripts/content/Story/MISSIONS/DIA_Grd_215_Torwache.d:48","Ich will ins Lager.","В Лагерь.","","","DIA_Grd_215_Torwache_First_15_01","",""
"Scripts/content/Story/MISSIONS/DIA_Grd_215_Torwache.d:49","Du bist doch nicht hergekommen, um Ärger zu machen, oder?","От тебя не будет проблем, ведь так?","","","DIA_Grd_215_Torwache_First_06_02","",""
"Scripts/content/Story/MISSIONS/DIA_Grd_215_Torwache.d:52","Klar, ich hatte mir vorgenommen, das ganze Lager auseinanderzunehmen!","Вообще-то я планировал взорвать весь Лагерь...","","","DIA_Grd_215_Torwache_First.DIA_Grd_215_Torwache_First_Trouble","Info_AddChoice",""
"Scripts/content/Story/MISSIONS/DIA_Grd_215_Torwache.d:53","Ich will mich nur ein bißchen umsehen.","Просто хотел немного осмотреться.","","","DIA_Grd_215_Torwache_First.DIA_Grd_215_Torwache_First_JustLooking","Info_AddChoice",""
"Scripts/content/Story/MISSIONS/DIA_Grd_215_Torwache.d:56","Diego hat gesagt, ich soll ihn im Lager treffen.","Диего сказал, что я должен встретиться с ним в Лагере.","","","DIA_Grd_215_Torwache_First.DIA_Grd_215_Torwache_First_Diego","Info_AddChoice",""
"Scripts/content/Story/MISSIONS/DIA_Grd_215_Torwache.d:62","Klar, ich hatte mir vorgenommen, das ganze Lager auseinander zu nehmen!","Вообще-то я планировал взорвать весь Лагерь...","","","DIA_Grd_215_Torwache_First_Trouble_15_00","",""
"Scripts/content/Story/MISSIONS/DIA_Grd_215_Torwache.d:63","Ein witziger Kerl ... Ich mag keine witzigen Kerle.","Эй, да ты забавный парень... Не люблю забавных парней.","","","DIA_Grd_215_Torwache_First_Trouble_06_01","",""
"Scripts/content/Story/MISSIONS/DIA_Grd_215_Torwache.d:73","Ich will mich nur ein bisschen umsehen.","Просто хотел немного осмотреться.","","","DIA_Grd_215_Torwache_First_JustLooking_15_00","",""
"Scripts/content/Story/MISSIONS/DIA_Grd_215_Torwache.d:74","Umsehen kostet 10 Erz.","Это обойдется тебе в десять кусков руды.","","","DIA_Grd_215_Torwache_First_JustLooking_06_01","",""
"Scripts/content/Story/MISSIONS/DIA_Grd_215_Torwache.d:77","Vergiß es.","Забудь об этом.","","","DIA_Grd_215_Torwache_First.DIA_Grd_215_Torwache_First_NoPay","Info_AddChoice",""
"Scripts/content/Story/MISSIONS/DIA_Grd_215_Torwache.d:78","Gut, hier sind deine 10 Erz.","Ладно, вот тебе десять кусков.","","","DIA_Grd_215_Torwache_First.DIA_Grd_215_Torwache_First_Pay","Info_AddChoice",""
"Scripts/content/Story/MISSIONS/DIA_Grd_215_Torwache.d:83","Diego hat gesagt, ich soll ihn im Lager treffen.","Диего сказал, что я должен встретиться с ним в Лагере.","","","DIA_Grd_215_Torwache_First_Diego_15_00","",""
"Scripts/content/Story/MISSIONS/DIA_Grd_215_Torwache.d:84","Gut - du kannst reingehen.","Ладно, тогда проходи.","","","DIA_Grd_215_Torwache_First_Diego_06_01","",""
"Scripts/content/Story/MISSIONS/DIA_Grd_215_Torwache.d:90","Vergiss es.","Да я просто так.","","","DIA_Grd_215_Torwache_First_NoPay_15_00","",""
"Scripts/content/Story/MISSIONS/DIA_Grd_215_Torwache.d:91","Dann zisch ab.","Тогда проваливай.","","","DIA_Grd_215_Torwache_First_NoPay_06_01","",""
"Scripts/content/Story/MISSIONS/DIA_Grd_215_Torwache.d:99","Gut, hier sind deine 10 Erz.","Ладно, вот тебе десять кусков.","","","DIA_Grd_215_Torwache_First_Pay_15_00","",""
"Scripts/content/Story/MISSIONS/DIA_Grd_215_Torwache.d:100","Dann mal immer rein mit dir.","Ну заходи.","","","DIA_Grd_215_Torwache_First_Pay_06_01","",""
"Scripts/content/Story/MISSIONS/DIA_Grd_215_Torwache.d:105","So viel hab' ich nicht.","У меня с собой столько нет.","","","DIA_Grd_215_Torwache_First_Pay_NoOre_15_00","",""
"Scripts/content/Story/MISSIONS/DIA_Grd_215_Torwache.d:106","Diesmal mach' ich noch 'ne Ausnahme - weil du neu bist .","Я могу сделать исключение - только один раз и только потому, что ты здесь новенький.","","","DIA_Grd_215_Torwache_First_Pay_NoOre_06_01","",""
"Scripts/content/Story/MISSIONS/DIA_Grd_215_Torwache.d:123","Irgendwas Neues passiert?","Есть новости?","","","DIA_Grd_215_Torwache_PERM.description","",""
"Scripts/content/Story/MISSIONS/DIA_Grd_215_Torwache.d:133","Irgendwas Neues passiert?","Есть новости?","","","DIA_Grd_215_Torwache_PERM_15_00","",""
"Scripts/content/Story/MISSIONS/DIA_Grd_215_Torwache.d:134","Nein. Alles wie immer.","Не-а. Все, как обычно.","","","DIA_Grd_215_Torwache_PERM_06_01","",""
"Scripts/content/Story/MISSIONS/DIA_Grd_218_GuardPassage.d:46","Halt! Was willst du hier?","Стой! Что ты делаешь?","","","DIA_Grd_218_FirstIn_07_00","",""
"Scripts/content/Story/MISSIONS/DIA_Grd_218_GuardPassage.d:47","Ich will hier rein.","Просто хочу зайти.","","","DIA_Grd_218_FirstIn_15_01","",""
"Scripts/content/Story/MISSIONS/DIA_Grd_218_GuardPassage.d:48","Machst du Witze?","Ты что, шутишь?","","","DIA_Grd_218_FirstIn_07_02","",""
"Scripts/content/Story/MISSIONS/DIA_Grd_218_GuardPassage.d:49","Frag das doch mal Thorus.","Почему бы тебе не спросить об этом Торуса?","","","DIA_Grd_218_FirstIn_15_03","",""
"Scripts/content/Story/MISSIONS/DIA_Grd_218_GuardPassage.d:50","Werde ich. Wenn du gelogen hast, bist du tot!","Будь уверен, я так и сделаю. И если ты врешь, считай, что ты покойник.","","","DIA_Grd_218_FirstIn_07_04","",""
"Scripts/content/Story/MISSIONS/DIA_Grd_218_GuardPassage.d:51","Soll das heißen, ich kann jetzt reingehen.","Я не расслышал - ты предложил мне войти?","","","DIA_Grd_218_FirstIn_15_05","",""
"Scripts/content/Story/MISSIONS/DIA_Grd_218_GuardPassage.d:52","Ja. Geh schon!","Да, шевелись!","","","DIA_Grd_218_FirstIn_07_06","",""
"Scripts/content/Story/MISSIONS/DIA_Grd_218_GuardPassage.d:98","HALT! Keinen Schritt weiter!","Стой! Ни шагу дальше!","","","Info_Grd_218_FirstWarn_Info_07_01","",""
"Scripts/content/Story/MISSIONS/DIA_Grd_218_GuardPassage.d:99","Warum?","Почему?","","","Info_Grd_218_FirstWarn_Info_15_02","",""
"Scripts/content/Story/MISSIONS/DIA_Grd_218_GuardPassage.d:100","Das Haus der Erzbarone ist tabu für Abschaum wie dich!","Такому уроду нечего делать в доме Баронов!","","","Info_Grd_218_FirstWarn_Info_07_03","",""
"Scripts/content/Story/MISSIONS/DIA_Grd_224_Pacho.d:49","Hey, du!","Эй, ты! ","","","Info_Pacho_STOP_13_01","",""
"Scripts/content/Story/MISSIONS/DIA_Grd_224_Pacho.d:50","Wer? Ich?","Кто? Я?","","","Info_Pacho_STOP_15_02","",""
"Scripts/content/Story/MISSIONS/DIA_Grd_224_Pacho.d:51","Nein, ich mein deine Großmutter ... Natürlich mein ich dich!","Нет, твоя бабушка... К кому еще я могу обращаться?!","","","Info_Pacho_STOP_13_03","",""
"Scripts/content/Story/MISSIONS/DIA_Grd_224_Pacho.d:52","Wenn ich du wäre, dann würde ich diesen Weg hier nicht weitergehen!","На твоем месте я бы не ходил туда!","","","Info_Pacho_STOP_13_04","",""
"Scripts/content/Story/MISSIONS/DIA_Grd_224_Pacho.d:53","Warum nicht?","Почему нет?","","","Info_Pacho_STOP_15_05","",""
"Scripts/content/Story/MISSIONS/DIA_Grd_224_Pacho.d:54","Du scheinst wirklich neu hier zu sein!","Сразу видно, что ты новичок.","","","Info_Pacho_STOP_13_06","",""
"Scripts/content/Story/MISSIONS/DIA_Grd_224_Pacho.d:55","Mann, hier geht es ins Orkgebiet!","Парень, эта дорога ведет к землям орков...","","","Info_Pacho_STOP_13_07","",""
"Scripts/content/Story/MISSIONS/DIA_Grd_224_Pacho.d:56","Die machen Kleinholz aus dir!","Они с радостью приготовят из тебя закуску к шнапсу!","","","Info_Pacho_STOP_13_08","",""
"Scripts/content/Story/MISSIONS/DIA_Grd_224_Pacho.d:57","Oh.","Ох...","","","Info_Pacho_STOP_15_09","",""
"Scripts/content/Story/MISSIONS/DIA_Grd_224_Pacho.d:58","Gern geschehen!","Не за что!","","","Info_Pacho_STOP_13_10","",""
"Scripts/content/Story/MISSIONS/DIA_Grd_237_GuardPassage.d:36","Verschwinde hier lieber. Hinter dieser Barrikade beginnt das Orkgebiet!","Лучше тебе не разгуливать здесь. Вот там уже начинаются земли орков.","","","Info_Grd_237_FirstWarn_07_01","",""
"Scripts/content/Story/MISSIONS/DIA_Grd_237_GuardPassage.d:37","Ist das gefährlich?","Это опасно?","","","Info_Grd_237_FirstWarn_15_02","",""
"Scripts/content/Story/MISSIONS/DIA_Grd_237_GuardPassage.d:38","Sagen wir's mal so: Da dich die Orks sowieso in Fetzen reißen werden, kannst du uns auch genauso gut all dein Erz geben!","Скажем так: лучше отдай МНЕ всю свою руду, потому что орки все равно порубят тебя на куски.","","","Info_Grd_237_FirstWarn_07_03","",""
"Scripts/content/Story/MISSIONS/DIA_Grd_237_GuardPassage.d:43","Ich glaube nicht, dass ich das will!","Как-нибудь в другой раз.","","","Info_Grd_237_FirstWarn.Info_Grd_237_FirstWarn_Info_NO","Info_AddChoice",""
"Scripts/content/Story/MISSIONS/DIA_Grd_237_GuardPassage.d:44","Na klar, hier ist mein Erz!","Ладно, возьми за совет!","","","Info_Grd_237_FirstWarn.Info_Grd_237_FirstWarn_Info_YES","Info_AddChoice",""
"Scripts/content/Story/MISSIONS/DIA_Grd_237_GuardPassage.d:45","Ist wohl besser wenn ich wieder umdrehe!","Я думаю, мне стоит вернуться назад.","","","Info_Grd_237_FirstWarn.Info_Grd_237_FirstWarn_Info_RETREAT","Info_AddChoice",""
"Scripts/content/Story/MISSIONS/DIA_Grd_237_GuardPassage.d:52","Ist wohl besser, wenn ich wieder umdrehe!","Я думаю, мне стоит вернуться назад.","","","Info_Grd_237_FirstWarn_15_04","",""
"Scripts/content/Story/MISSIONS/DIA_Grd_237_GuardPassage.d:53","Schade, hätte dein Erz gerne verwahrt.","Жаль, я уже начал думать о том, как потратить твою руду.","","","Info_Grd_237_FirstWarn_07_05","",""
"Scripts/content/Story/MISSIONS/DIA_Grd_237_GuardPassage.d:64","Na klar, hier ist mein Erz!","Ладно, возьми за совет!","","","Info_Grd_237_FirstWarn_15_06","",""
"Scripts/content/Story/MISSIONS/DIA_Grd_237_GuardPassage.d:65","Oh, das ist aber sehr umsichtig von dir.","Это было очень щедро с твоей стороны.","","","Info_Grd_237_FirstWarn_07_07","",""
"Scripts/content/Story/MISSIONS/DIA_Grd_237_GuardPassage.d:81","Ich glaube nicht, dass ich das will!","Как-нибудь в другой раз.","","","Info_Grd_237_FirstWarn_15_08","",""
"Scripts/content/Story/MISSIONS/DIA_Grd_237_GuardPassage.d:82","Dann solltest du besser keinen Schritt mehr weiter tun!","Тогда лучше стой там, где стоишь.","","","Info_Grd_237_FirstWarn_07_09","",""
"Scripts/content/Story/MISSIONS/DIA_Grd_237_GuardPassage.d:115","Bist du taub? Noch ein Schritt und du bist Futter für die Würmer!","Ты что, оглох? Еще один шаг, и ты станешь пищей для червей!","","","Info_Grd_237_LastWarn_07_01","",""
"Scripts/content/Story/MISSIONS/DIA_Grd_245_GuardPassage.d:34","Was ist in diesem Haus?","Что в этом доме?","","","DIA_GRD_245_Hello.description","",""
"Scripts/content/Story/MISSIONS/DIA_Grd_245_GuardPassage.d:44","Was ist in diesem Haus?","Что в этом доме?","","","DIA_GRD_245_Hello_15_00","",""
"Scripts/content/Story/MISSIONS/DIA_Grd_245_GuardPassage.d:45","Das ist das Haus der Erzbarone. Also wenn du hier reingehst, benimm dich!","Это дом Баронов. Веди себя повежливей, если когда-нибудь попадешь туда.","","","DIA_GRD_245_Hello_13_01","",""
"Scripts/content/Story/MISSIONS/DIA_Grd_255_Fletcher.d:46","Hey, du!","Эй, ты!","","","DIA_Fletcher_First_06_00","",""
"Scripts/content/Story/MISSIONS/DIA_Grd_255_Fletcher.d:47","Wer? Ich?","Кто? Я?","","","DIA_Fletcher_First_15_01","",""
"Scripts/content/Story/MISSIONS/DIA_Grd_255_Fletcher.d:48","Du weißt genau, mit wem ich rede, Bürschchen!","Ты сам знаешь, к кому я обращаюсь!","","","DIA_Fletcher_First_06_02","",""
"Scripts/content/Story/MISSIONS/DIA_Grd_255_Fletcher.d:49","Ich will dir mal was sagen: Das hier ist MEIN Viertel. Und ich will hier keinen Ärger!","Вот что я тебе скажу, сынок - это МОЙ район. И мне не нужны неприятности!","","","DIA_Fletcher_First_06_03","",""
"Scripts/content/Story/MISSIONS/DIA_Grd_255_Fletcher.d:50","Aber neue Typen wie du bedeuten immer Ärger. Vor allem, wenn sie hier mitten in der Nacht rumlaufen.","Но новички, вроде тебя, всегда становятся их причиной - особенно когда шляются без дела по ночам.","","","DIA_Fletcher_First_06_04","",""
"Scripts/content/Story/MISSIONS/DIA_Grd_255_Fletcher.d:51","Also, warum sorgst du nicht dafür, dass ich dich hier nicht mehr sehe. Die Hütte gegenüber der Arena mit dem Vordach ist frei. Leg dich 'ne Runde ins Bett.","Так почему бы тебе не отправиться домой и не позаботиться о том чтобы я больше тебя здесь не видел? Как раз напротив арены есть пустой дом - ты узнаешь его по навесу. Отправляйся спать.","","","DIA_Fletcher_First_06_05","",""
