"location","source","target","id","fuzzy","context","translator_comments","developer_comments"
"Scripts/content/Story/MISSIONS/DIA_Kdw_600_Saturas.d:19","Mögest du in einem Stück zurückkehren!","Надеюсь, ты вернешься целым и невредимым!","","","Info_Saturas_EXIT_14_01","",""
"Scripts/content/Story/MISSIONS/DIA_Kdw_600_Saturas.d:45","Was machst du hier? Du hast hier nichts zu suchen! Verschwinde!","Что ты здесь делаешь? Тебе здесь нечего делать! Убирайся!","","","Info_Saturas_Intruder_14_00","",""
"Scripts/content/Story/MISSIONS/DIA_Kdw_600_Saturas.d:67","Ich habe wichtige Neuigkeiten aus dem Lager der Bruderschaft!","У меня есть важные новости из лагеря Братства!","","False","Info_Saturas_NEWS.description","",""
"Scripts/content/Story/MISSIONS/DIA_Kdw_600_Saturas.d:80","Ich habe wichtige Neuigkeiten aus dem Lager der Bruderschaft!","У меня есть важные новости из лагеря Братства!","","False","Info_Saturas_NEWS_15_01","",""
"Scripts/content/Story/MISSIONS/DIA_Kdw_600_Saturas.d:81","Wenn dir Cronos die Erlaubnis gab, mich aufzusuchen, müssen es in der Tat wichtige Nachrichten sein!","Это должны быть действительно важные новости, если Кронос позволил тебе встретиться со мной!","","","Info_Saturas_NEWS_14_02","",""
"Scripts/content/Story/MISSIONS/DIA_Kdw_600_Saturas.d:93","Y'Berion ist tot","Ю'Берион мертв!","","False","Info_Saturas_YBERION.description","",""
"Scripts/content/Story/MISSIONS/DIA_Kdw_600_Saturas.d:106","Y'Berion ist tot! Er starb bei einer großen rituellen Anrufung des Schläfers.","Ю'Берион мертв! Он умер во время церемонии вызова Спящего!","","False","Info_Saturas_YBERION_15_01","",""
"Scripts/content/Story/MISSIONS/DIA_Kdw_600_Saturas.d:107","Y'Berion tot? Das sind schlechte Nachrichten, sehr schlechte Nachrichten!","Ю'Берион умер? Поистине это худшая новость из тех, что ты мог принести!","","False","Info_Saturas_YBERION_14_02","",""
"Scripts/content/Story/MISSIONS/DIA_Kdw_600_Saturas.d:108","Wer hat die Führung der Bruderschaft übernommen? Dieser machtgierige, verschlagene Cor Kalom?","Кто же теперь возглавляет Братство? Этот властолюбец и лжец Кор Галом?","","","Info_Saturas_YBERION_14_03","",""
"Scripts/content/Story/MISSIONS/DIA_Kdw_600_Saturas.d:109","Nein! Kalom hat der Bruderschaft den Rücken gekehrt. Er hat einige Templer mitgenommen. Niemand weiß, wohin sie aufgebrochen sind.","Нет! Галом отрекся от Братства. Он забрал нескольких cтражей, и никто не знает, где они теперь.","","False","Info_Saturas_YBERION_15_04","",""
"Scripts/content/Story/MISSIONS/DIA_Kdw_600_Saturas.d:110","Warum das? Er war doch der zweite Mann nach Y'Berion!","Но зачем? Ведь после гибели Ю'Бериона он должен был стать главным!","","False","Info_Saturas_YBERION_14_05","",""
"Scripts/content/Story/MISSIONS/DIA_Kdw_600_Saturas.d:111","Gewisse Ereignisse haben die Gurus davon überzeugt, dass der Weg ihres Gottes der falsche ist. Er scheint ein Erzdämon zu sein, der nur Böses im Schilde führt.","События последних дней убедили гуру в том, что они избрали неправильный путь. Похоже, их бог оказался всего лишь злым демоном.","","False","Info_Saturas_YBERION_15_06","",""
"Scripts/content/Story/MISSIONS/DIA_Kdw_600_Saturas.d:112","Einer der Gurus hat mich unter dem Einfluss des Schläfers fast umgebracht, obwohl ich eben diesem Mann kurz zuvor das Leben gerettet hatte.","Под влиянием Спящего один из гуру чуть не убил меня, несмотря на то, что незадолго до этого я спас ему жизнь.","","False","Info_Saturas_YBERION_15_07","",""
"Scripts/content/Story/MISSIONS/DIA_Kdw_600_Saturas.d:113","Cor Kalom war der einzige Guru, der die wahre Natur der Höllenkreatur nicht sehen wollte und hat daher das Lager im Sumpf verlassen.","Единственным из гуру, кто отказался признать истинную сущность этого адского создания, был Кор Галом. Вот почему он покинул Болотный лагерь.","","False","Info_Saturas_YBERION_15_08","",""
"Scripts/content/Story/MISSIONS/DIA_Kdw_600_Saturas.d:114","Ich verstehe! Nun, das ist Glück im Unglück, denn Cor Angar ist ein guter Mann. Hart, aber ehrlich.","Понятно. Что ж, для нас это только к лучшему. Кор Ангар - хороший человек. Упрямый, но честный.","","False","Info_Saturas_YBERION_14_09","",""
"Scripts/content/Story/MISSIONS/DIA_Kdw_600_Saturas.d:115","Wenn jemand den Zerfall der Bruderschaft nach dieser spirituellen Katastrophe verhindern kann, ist er es.","Никто кроме него не сможет удержать Братство от распада после этой духовной катастрофы.","","","Info_Saturas_YBERION_14_10","",""
"Scripts/content/Story/MISSIONS/DIA_Kdw_600_Saturas.d:129","Ich habe diesen Almanach hier","У меня есть альманах...","","False","Info_Saturas_BOOK.description","",""
"Scripts/content/Story/MISSIONS/DIA_Kdw_600_Saturas.d:142","Ich habe diesen Almanach hier ...","У меня есть альманах...","","","Info_Saturas_BOOK_15_01","",""
"Scripts/content/Story/MISSIONS/DIA_Kdw_600_Saturas.d:143","Y'Berion hatte ihn benutzt, um den Fokus aufzuladen.","Ю'Берион использовал его, для того чтобы зарядить юнитор.","","False","Info_Saturas_BOOK_15_02","",""
"Scripts/content/Story/MISSIONS/DIA_Kdw_600_Saturas.d:144","Sehr gut. Wir benötigen das Wissen aus diesem Buch, um alle fünf der ursprünglichen Fokussteine aufzuladen.","Отлично! Знание, которое содержится в этой книге, поможет нам зарядить пять главных камней-юниторов.","","","Info_Saturas_BOOK_14_03","",""
"Scripts/content/Story/MISSIONS/DIA_Kdw_600_Saturas.d:145","Ich werde den Almanach an mich nehmen!","Я возьму этот альманах.","","","Info_Saturas_BOOK_14_04","",""
"Scripts/content/Story/MISSIONS/DIA_Kdw_600_Saturas.d:161","Ich habe diesen Fokus hier","У меня есть юнитор...","","False","Info_Saturas_FOCUS.description","",""
"Scripts/content/Story/MISSIONS/DIA_Kdw_600_Saturas.d:174","Ich habe diesen Fokus hier ...","У меня есть юнитор...","","","Info_Saturas_FOCUS_15_01","",""
"Scripts/content/Story/MISSIONS/DIA_Kdw_600_Saturas.d:175","Du hältst einen der Schlüssel für die Zerstörung unser aller Fesseln in Händen.","Ты держишь ключ от наших оков.","","","Info_Saturas_FOCUS_14_02","",""
"Scripts/content/Story/MISSIONS/DIA_Kdw_600_Saturas.d:176","Es handelt sich um einen der fünf Fokussteine, mit deren Hilfe die magische Barriere erschaffen wurde.","Это один из пяти камней-юниторов, с помощью которых был создан магический барьер.","","False","Info_Saturas_FOCUS_14_03","",""
"Scripts/content/Story/MISSIONS/DIA_Kdw_600_Saturas.d:177","Und mit der fokussierenden Kraft genau dieser Steine werden wir die Mauern aus Energie auch wieder niederreißen.","Их же сила поможет нам обрушить эту гигантскую стену.","","","Info_Saturas_FOCUS_14_04","",""
"Scripts/content/Story/MISSIONS/DIA_Kdw_600_Saturas.d:178","Aber kostet das nicht unglaublich viel magische Energie?","Но для этого же потребуется чертова уйма энергии?!","","","Info_Saturas_FOCUS_15_05","",""
"Scripts/content/Story/MISSIONS/DIA_Kdw_600_Saturas.d:179","Richtig, doch wir haben über all die Jahre unermüdlich Erz gesammelt, anstatt es mit unseren Kerkermeistern gegen Annehmlichkeiten zu tauschen.","Верно. Все эти годы мы неустанно копили руду, вместо того чтобы выменивать на нее предметы роскоши у наших тюремщиков.","","","Info_Saturas_FOCUS_14_06","",""
"Scripts/content/Story/MISSIONS/DIA_Kdw_600_Saturas.d:180","Wie du sicher schon weißt, enthält jeder Erzbrocken etwas magische Energie. Mit Hilfe dieser Energie, die in unserem großen Erzhaufen schlummert, können wir die magische Barriere in Fetzen sprengen.","Тебе должно быть известно, что в каждом куске руды заключена небольшая частица магии. Силы, которая содержится в нашей Железной горе, должно быть достаточно, чтобы уничтожить Барьер.","","False","Info_Saturas_FOCUS_14_07","",""
"Scripts/content/Story/MISSIONS/DIA_Kdw_600_Saturas.d:181","Das hört sich gefährlich an.","Это рискованно.","","","Info_Saturas_FOCUS_15_08","",""
"Scripts/content/Story/MISSIONS/DIA_Kdw_600_Saturas.d:182","Die Explosion wird rein magischer Natur sein und wird ausschließlich alles magisch Veränderte innerhalb der Barriere zerstören. Für uns Menschen besteht keine Gefahr.","Это будет магический взрыв, не обычный, и опасен он лишь для магии внутри Барьера. Нам, людям, он не причинит вреда.","","","Info_Saturas_FOCUS_14_09","",""
"Scripts/content/Story/MISSIONS/DIA_Kdw_600_Saturas.d:183","Hier, nimm den Fokus. Hoffentlich hilft er dem Plan mit dem Erzhaufen auch wirklich!","Вот, возьми юнитор. Надеюсь, ты найдешь ему применение в своих планах.","","","Info_Saturas_FOCUS_15_10","",""
"Scripts/content/Story/MISSIONS/DIA_Kdw_600_Saturas.d:199","Was machst du jetzt mit Fokus und Almanach?","Как ты собираешься использовать юнитор и альманах?","","","Info_Saturas_WHATNOW.description","",""
"Scripts/content/Story/MISSIONS/DIA_Kdw_600_Saturas.d:212","Was machst du jetzt mit Fokus und Almanach?","Как ты собираешься использовать юнитор и альманах?","","","Info_Saturas_WHATNOW_15_01","",""
"Scripts/content/Story/MISSIONS/DIA_Kdw_600_Saturas.d:213","Nichts. Wir benötigen vorher die vier restlichen Fokussteine!","Пока никак. Нам нужны еще четыре камня-юнитора.","","","Info_Saturas_WHATNOW_14_03","",""
"Scripts/content/Story/MISSIONS/DIA_Kdw_600_Saturas.d:214","Dummerweise befindet sich kein einziger dieser vier magischen Steine in unserem Besitz.","К сожалению, пока у нас нет ни одного.","","","Info_Saturas_WHATNOW_14_04","",""
"Scripts/content/Story/MISSIONS/DIA_Kdw_600_Saturas.d:226","Ich bin bereit diese vier Foki für euch zu suchen!","Я готов найти для тебя четыре камня-юнитора!","","","Info_Saturas_OFFER.description","",""
"Scripts/content/Story/MISSIONS/DIA_Kdw_600_Saturas.d:239","Ich bin bereit diese vier Foki für euch zu suchen!","Я готов найти для тебя четыре камня-юнитора!","","","Info_Saturas_OFFER_15_01","",""
"Scripts/content/Story/MISSIONS/DIA_Kdw_600_Saturas.d:240","Schließlich will ich auch hier irgendwann wieder raus.","Ведь я и сам не прочь убраться отсюда.","","","Info_Saturas_OFFER_15_02","",""
"Scripts/content/Story/MISSIONS/DIA_Kdw_600_Saturas.d:241","Ich muss dich warnen. Die Suche wird gleichermaßen schwierig und gefährlich.","Должен предупредить тебя: поиски будут нелегкими и даже опасными.","","","Info_Saturas_OFFER_14_03","",""
"Scripts/content/Story/MISSIONS/DIA_Kdw_600_Saturas.d:242","Da die Spannungen mit dem Alten Lager immer stärker werden, kann ich hier auch keinen der Söldner entbehren.","Наши отношения со Старым лагерем портятся с каждым днем, и каждый человек на счету. Я не могу дать никого тебе в помощь.","","False","Info_Saturas_OFFER_14_04","",""
"Scripts/content/Story/MISSIONS/DIA_Kdw_600_Saturas.d:243","Du wärest ganz auf dich alleine gestellt.","Тебе придется действовать в одиночку.","","","Info_Saturas_OFFER_14_05","",""
"Scripts/content/Story/MISSIONS/DIA_Kdw_600_Saturas.d:244","Na ja ... Das ist nun wirklich nichts Neues! Ich werde diese Dinger schon irgendwo auftreiben.","Ну... Ничего нового. Обычно я справлялся и так.","","","Info_Saturas_OFFER_15_06","",""
"Scripts/content/Story/MISSIONS/DIA_Kdw_600_Saturas.d:245","Deine Zuversicht ehrt dich, aber du wirst einige Gegenstände benötigen.","Твоя уверенность делает тебе честь, но кое-что тебе все-таки понадобится.","","","Info_Saturas_OFFER_14_07","",""
"Scripts/content/Story/MISSIONS/DIA_Kdw_600_Saturas.d:246","Nimm diese Karte hier. Sie ist alt, aber auf ihr sind die ursprünglichen Standorte der Fokussteine während der Erschaffung der Barriere verzeichnet.","Возьми эту старую карту. На ней отмечены места, где находились юниторы в момент сотворения Барьера.","","","Info_Saturas_OFFER_14_08","",""
"Scripts/content/Story/MISSIONS/DIA_Kdw_600_Saturas.d:247","Darüber hinaus sollte diese Spruchrolle dir eine schnellere Reise zurück in unser Lager ermöglichen.","Кроме того, заклинание, записанное в этом магическом свитке, поможет тебе быстро вернуться в наш лагерь.","","False","Info_Saturas_OFFER_14_09","",""
"Scripts/content/Story/MISSIONS/DIA_Kdw_600_Saturas.d:248","Zu guter Letzt sprich mit Riordian. Er braut die Tränke für das Lager.","Наконец поговори с Риорданом. Он готовит для нашего лагеря эликсиры.","","False","Info_Saturas_OFFER_14_10","",""
"Scripts/content/Story/MISSIONS/DIA_Kdw_600_Saturas.d:249","Du findest ihn in seiner Hütte hier auf der obersten Ebene.","Ты найдешь его дом здесь же, на верхнем уровне.","","","Info_Saturas_OFFER_14_11","",""
"Scripts/content/Story/MISSIONS/DIA_Kdw_600_Saturas.d:262","Hm, das ist ein Anfang. Du schlägst dich gut.","Хм, дело продвигается. Ты молодец!","","False","Info_Saturas_BRINGFOCUS_14_01","",""
"Scripts/content/Story/MISSIONS/DIA_Kdw_600_Saturas.d:263","Es fehlen noch drei Fokussteine, um unseren großen Plan durchzuführen.","Для осуществления нашего плана нужны еще три камня.","","","Info_Saturas_BRINGFOCUS_14_02","",""
"Scripts/content/Story/MISSIONS/DIA_Kdw_600_Saturas.d:264","Gehe nun und suche die restlichen Fokussteine.","Принеси мне оставшиеся юниторы.","","","Info_Saturas_BRINGFOCUS_14_03","",""
"Scripts/content/Story/MISSIONS/DIA_Kdw_600_Saturas.d:272","Gut, das ist schon der zweite Fokusstein, den du uns bringst.","Хорошо! Ты принес нам второй камень.","","","Info_Saturas_BRINGFOCUS_14_04","",""
"Scripts/content/Story/MISSIONS/DIA_Kdw_600_Saturas.d:273","Wir kommen unserem großen Ziel immer näher.","Мы все ближе и ближе к цели.","","","Info_Saturas_BRINGFOCUS_14_05","",""
"Scripts/content/Story/MISSIONS/DIA_Kdw_600_Saturas.d:274","Schlag dich tapfer und suche nun die restlichen zwei Fokussteine.","Наберись храбрости и терпения и достань еще два юнитора.","","","Info_Saturas_BRINGFOCUS_14_06","",""
"Scripts/content/Story/MISSIONS/DIA_Kdw_600_Saturas.d:282","Unglaublich, nun haben wir schon insgesamt vier Fokussteine.","Невероятно! Теперь у нас есть уже четыре камня!","","False","Info_Saturas_BRINGFOCUS_14_07","",""
"Scripts/content/Story/MISSIONS/DIA_Kdw_600_Saturas.d:283","Nur noch ein Einziger fehlt uns, dann haben wir alle ursprünglichen Steine in unserem Besitz.","Осталось найти всего один, и тогда у нас будет все необходимое для осуществления нашего плана.","","","Info_Saturas_BRINGFOCUS_14_08","",""
"Scripts/content/Story/MISSIONS/DIA_Kdw_600_Saturas.d:284","Du hast unserer Gemeinschaft schon jetzt sehr viel Ehre erwiesen. Finde den letzten Fokusstein und unsere Befreiung steht kurz bevor.","Ты уже оказал всем нам великую услугу. Найди же и пятый камень, и тогда вскоре все мы будем свободны.","","","Info_Saturas_BRINGFOCUS_14_09","",""
"Scripts/content/Story/MISSIONS/DIA_Kdw_600_Saturas.d:292","Fantastisch, nun haben wir alle fünf Fokussteine in unserem Besitz.","Великолепно! Теперь у нас есть все пять камней!","","False","Info_Saturas_BRINGFOCUS_14_10","",""
"Scripts/content/Story/MISSIONS/DIA_Kdw_600_Saturas.d:293","Deine Taten sind von unschätzbarem Wert für unser Lager. Sei dir meines ewigen Dankes gewiss.","Ты оказал нашему лагерю неоценимую помощь. Прими же уверения в моей бесконечной признательности.","","False","Info_Saturas_BRINGFOCUS_14_11","",""
"Scripts/content/Story/MISSIONS/DIA_Kdw_600_Saturas.d:294","Gehe nun zu Riordian. Er wird dir einen Ausgleich für deine unermesslichen Mühen geben.","И загляни к Риордану. Он знает, чем вознаградить тебя за труды.","","","Info_Saturas_BRINGFOCUS_14_12","",""
"Scripts/content/Story/MISSIONS/DIA_Kdw_600_Saturas.d:295","Sprich auch mit Cronos, dem Hüter des Erzes. Auch er wird dir ein Geschenk unserer Gemeinschaft überreichen.","Еще поговори с Кроносом, Хранителем руды. У него также приготовлен для тебя подарок.","","False","Info_Saturas_BRINGFOCUS_14_13","",""
"Scripts/content/Story/MISSIONS/DIA_Kdw_600_Saturas.d:314","Du hast die Teleport-Spruchrolle verbraucht, wie ich sehe. Hier, nimm eine neue.","Я вижу, ты воспользовался свитком с заклинанием 'Портал'. Вот, возьми еще один.","","False","Info_Saturas_BRINGFOCUS_14_14","",""
"Scripts/content/Story/MISSIONS/DIA_Kdw_600_Saturas.d:329","Ich habe in der Trollschlucht einen Fokus gefunden!","Я нашел юнитор в ущелье троллей!","","","Info_Saturas_BRINGFOCUS2.description","",""
"Scripts/content/Story/MISSIONS/DIA_Kdw_600_Saturas.d:342","Ich habe in der Trollschlucht einen Fokus gefunden!","Я нашел юнитор в ущелье троллей!","","","Info_Saturas_BRINGFOCUS2_15_01","",""
"Scripts/content/Story/MISSIONS/DIA_Kdw_600_Saturas.d:362","Ich habe in der Bergfestung einen Fokus gefunden!","Я нашел юнитор в форте на горе!","","","Info_Saturas_BRINGFOCUS3.description","",""
"Scripts/content/Story/MISSIONS/DIA_Kdw_600_Saturas.d:375","Ich habe in der Bergfestung einen Fokus gefunden!","Я нашел юнитор в форте на горе!","","","Info_Saturas_BRINGFOCUS3_15_01","",""
"Scripts/content/Story/MISSIONS/DIA_Kdw_600_Saturas.d:395","Ich habe in der Klosterruine einen Fokus gefunden!","Я нашел юнитор в разрушенном монастыре!","","","Info_Saturas_BRINGFOCUS4.description","",""
"Scripts/content/Story/MISSIONS/DIA_Kdw_600_Saturas.d:408","Ich habe in der Klosterruine einen Fokus gefunden!","Я нашел юнитор в разрушенном монастыре!","","","Info_Saturas_BRINGFOCUS4_15_01","",""
"Scripts/content/Story/MISSIONS/DIA_Kdw_600_Saturas.d:409","Gorn, der Söldner, war dort und hat mich bei der Suche unterstützt.","Там был Горн, наемник, он помогал мне в поисках.","","","Info_Saturas_BRINGFOCUS4_15_02","",""
"Scripts/content/Story/MISSIONS/DIA_Kdw_600_Saturas.d:429","Ich habe unter dem Stonehenge einen Fokus gefunden!","Я нашел юнитор под каменным кольцом!","","","Info_Saturas_BRINGFOCUS5.description","",""
"Scripts/content/Story/MISSIONS/DIA_Kdw_600_Saturas.d:442","Ich habe unter dem Stonehenge einen Fokus gefunden!","Я нашел юнитор под каменным кольцом!","","","Info_Saturas_BRINGFOCUS5_15_01","",""
"Scripts/content/Story/MISSIONS/DIA_Kdw_600_Saturas.d:462","Kann nun die Sprengung des Erzhaufens beginnen?","Теперь ты можешь взорвать Железную гору?","","False","Info_Saturas_ALLFOCI.description","",""
"Scripts/content/Story/MISSIONS/DIA_Kdw_600_Saturas.d:476","Kann nun die Sprengung des Erzhaufens beginnen?","Теперь ты можешь взорвать Железную гору?","","False","Info_Saturas_ALLFOCI_15_01","",""
"Scripts/content/Story/MISSIONS/DIA_Kdw_600_Saturas.d:477","Wir haben jetzt alle Artefakte zusammen, die unser großes Vorhaben benötigt.","Теперь у нас есть все для осуществления нашего плана.","","","Info_Saturas_ALLFOCI_14_02","",""
"Scripts/content/Story/MISSIONS/DIA_Kdw_600_Saturas.d:478","Doch die Erschaffung der Barriere wurde von zwölf Magiern durchgeführt.","Но Барьер был сотворен двенадцатью магами.","","","Info_Saturas_ALLFOCI_14_03","",""
"Scripts/content/Story/MISSIONS/DIA_Kdw_600_Saturas.d:479","Um die gewaltigen Energien zu kontrollieren und in die richtigen Bahnen lenken zu können, sind wir Wassermagier nicht genug.","В Круге воды недостаточно магов, чтобы управлять столь могущественной силой и направлять ее в нужное русло.","","False","Info_Saturas_ALLFOCI_14_04","",""
"Scripts/content/Story/MISSIONS/DIA_Kdw_600_Saturas.d:480","Was machen wir dann?","Что мы можем сделать?","","","Info_Saturas_ALLFOCI_15_05","",""
"Scripts/content/Story/MISSIONS/DIA_Kdw_600_Saturas.d:481","Mir ist bewusst, dass du schon sehr viel für unsere Gemeinschaft getan hast und wir stehen tief in deiner Schuld ...","Я понимаю, что мы уже и так в неоплатном долгу перед тобой за все, что ты для нас сделал...","","","Info_Saturas_ALLFOCI_14_06","",""
"Scripts/content/Story/MISSIONS/DIA_Kdw_600_Saturas.d:482","... Doch im Interesse aller Koloniebewohner muss ich dich noch um einen weiteren Gefallen bitten.","...но в интересах всех жителей колонии я должен попросить тебя оказать нам еще одну услугу.","","False","Info_Saturas_ALLFOCI_14_07","",""
"Scripts/content/Story/MISSIONS/DIA_Kdw_600_Saturas.d:494","Ein weiterer Gefallen?","Еще одну услугу?","","","Info_Saturas_FAVOR.description","",""
"Scripts/content/Story/MISSIONS/DIA_Kdw_600_Saturas.d:507","Ein weiterer Gefallen?","Еще одну услугу?","","","Info_Saturas_FAVOR_15_01","",""
"Scripts/content/Story/MISSIONS/DIA_Kdw_600_Saturas.d:508","Ja. Begib dich ins Alte Lager und versuche, einige der Feuermagier für unsere Sache zu gewinnen.","Да. Отправляйся в Старый лагерь и попытайся убедить магов Круга огня помочь нам.","","False","Info_Saturas_FAVOR_14_02","",""
"Scripts/content/Story/MISSIONS/DIA_Kdw_600_Saturas.d:509","DIE FEUERMAGIER??? Warum sollten die Maden den Speck verlassen wollen?","МАГОВ ОГНЯ?! Почему ты думаешь, что они будут рисковать своим положением ради кого-то еще?","","False","Info_Saturas_FAVOR_15_03","",""
"Scripts/content/Story/MISSIONS/DIA_Kdw_600_Saturas.d:510","Ein Zusammenbruch der Barriere würde ihre Machtposition zunichte machen!","Уничтожив Барьер, они потеряют все, к чему так привыкли, лишатся своей силы и власти!","","","Info_Saturas_FAVOR_15_04","",""
"Scripts/content/Story/MISSIONS/DIA_Kdw_600_Saturas.d:511","Genau aus diesem Grunde musst DU dich um diese schwierige Mission kümmern. Du kennst Leute aus allen Lagern der Kolonie.","Именно поэтому ТЫ должен взяться за выполнение этой миссии. У тебя есть друзья во всех лагерях колонии.","","False","Info_Saturas_FAVOR_14_05","",""
"Scripts/content/Story/MISSIONS/DIA_Kdw_600_Saturas.d:512","Erinnere die Feuermagier an die alten Zeiten, als wir noch gemeinsam die magischen Künste studierten.","Напомни магам огня про то старое доброе время, когда мы вместе постигали искусство магии.","","False","Info_Saturas_FAVOR_14_06","",""
"Scripts/content/Story/MISSIONS/DIA_Kdw_600_Saturas.d:524","Nun gut, ich werde versuchen, die Feuermagier zu überreden!","Ладно, я постараюсь убедить магов огня.","","False","Info_Saturas_ACCEPT.description","",""
