"location","source","target","id","fuzzy","context","translator_comments","developer_comments"
"Scripts/content/Story/MISSIONS/DIA_Kdw_600_Saturas.d:990","Du hast die ersten drei Kreise durchschritten. Nun ist es an der Zeit, dass du die Geheimnisse der Magie kennen lernst.","Ты завершил первые три круга. Пришло время постичь секреты магии.","","False","KDW_600_Saturas_KREIS4_Info_14_02","",""
"Scripts/content/Story/MISSIONS/DIA_Kdw_600_Saturas.d:991","Die Magie der Runen ruht in ihrem Stein. Es sind magische Steine, gewonnen aus magischem Erz.","Основа магии рун - камень. Магический камень, добытый из магической руды.","","","KDW_600_Saturas_KREIS4_Info_14_03","",""
"Scripts/content/Story/MISSIONS/DIA_Kdw_600_Saturas.d:992","Das gleiche Erz, das hier abgebaut wird. Dieses Erz wird in den Tempeln mit den Formeln der Magie versehen. Dort werden die Runen zu den Instrumenten unserer Macht geformt.","Это та самая руда, которую добывают в шахтах. В храмах она наделяется магическими формулами, и там же руны превращаются в орудия нашей силы.","","","KDW_600_Saturas_KREIS4_Info_14_04","",""
"Scripts/content/Story/MISSIONS/DIA_Kdw_600_Saturas.d:993","Mit allen Runen, die du nun beherrschen kannst, steht dir das gesammelte Wissen der Tempel des Reiches zur Verfügung.","С рунами, которыми ты сейчас владеешь, ты обрел знание храмов этого мира.","","","KDW_600_Saturas_KREIS4_Info_14_05","",""
"Scripts/content/Story/MISSIONS/DIA_Kdw_600_Saturas.d:995","Erkenne die Magie, dann wirst du das Geheimnis von Macht erkennen.","Пойми магию, и ты откроешь для себя секрет силы.","","","KDW_600_Saturas_KREIS4_Info_14_07","",""
"Scripts/content/Story/MISSIONS/DIA_Kdw_600_Saturas.d:1025","Ich bin bereit für den fünften Kreis.","Я готов вступить в пятый круг.","","False","KDW_600_Saturas_KREIS5_Info_15_01","",""
"Scripts/content/Story/MISSIONS/DIA_Kdw_600_Saturas.d:1028","So soll es geschehen. Ich werde dich die Macht des fünften Kreises lehren.","Да будет так. Я открою тебе истинный смысл пятого круга.","","False","KDW_600_Saturas_KREIS5_Info_14_02","",""
"Scripts/content/Story/MISSIONS/DIA_Kdw_600_Saturas.d:1029","Der Sturm des Feuers, die Welle aus Eis und die Macht, Untote zu vernichten, sind wahrhaft mächtige Sprüche, deren Runen dir nun untertan sind.","'Огненный шторм' и 'Ледяная волна' - так называются руны, магия которых отныне подвластна тебе, как и способность истреблять нежить.","","False","KDW_600_Saturas_KREIS5_Info_14_03","",""
"Scripts/content/Story/MISSIONS/DIA_Kdw_600_Saturas.d:1030","Doch der mächtigste Zauber des fünften Kreises ist die Welle des Todes. Solltest du in den Besitz dieser Rune gelangen, dann bist du im Besitz gefährlicher Macht.","Но самое сильное заклинание пятого круга - 'Смертельная зыбь'. Завладев этой руной, ты получишь великую и очень опасную силу.","","False","KDW_600_Saturas_KREIS5_Info_14_04","",""
"Scripts/content/Story/MISSIONS/DIA_Kdw_600_Saturas.d:1031","Hüte dich vor dem Einsatz dieser Magie. Sie ist eine Gabe des dunklen Gottes.","Используй ее как можно реже, ибо дар этот - от богов тьмы.","","False","KDW_600_Saturas_KREIS5_Info_14_05","",""
"Scripts/content/Story/MISSIONS/DIA_Kdw_600_Saturas.d:1032","Du hast jetzt alles gelernt, was ich dir beibringen kann.","Теперь ты научился всему, что знаю я сам.","","","KDW_600_Saturas_KREIS4_Info_14_06","",""
"Scripts/content/Story/MISSIONS/DIA_Kdw_600_Saturas.d:1033","Erkenne deine Grenzen, dann wirst du deine wahre Macht erkennen","Познай предел своих возможностей, и ты познаешь свою истинную силу.","","False","KDW_600_Saturas_KREIS5_Info_14_06","",""
"Scripts/content/Story/MISSIONS/DIA_Kdw_600_Saturas.d:1061","Ich möchte die hohe Robe des Wassers tragen.","Я хочу носить облачение высших магов воды.","","False","KDW_600_Saturas_HEAVYARMOR_Info_15_01","",""
"Scripts/content/Story/MISSIONS/DIA_Kdw_600_Saturas.d:1066","Es ist noch nicht an der Zeit, dass du die hohe Robe tragen kannst.","Твое время еще не пришло.","","","KDW_600_Saturas_HEAVYARMOR_Info_14_02","",""
"Scripts/content/Story/MISSIONS/DIA_Kdw_600_Saturas.d:1070","Dein bisschen Erz deckt ja nicht mal die Herstellungskosten.","Твоих запасов руды не хватит даже на то, чтобы заплатить за ткань.","","","KDW_600_Saturas_HEAVYARMOR_Info_14_03","",""
"Scripts/content/Story/MISSIONS/DIA_Kdw_600_Saturas.d:1074","Die Zeit ist gekommen. Du bist würdig, die hohe Robe des Wassers zu tragen.","Время пришло. Ты достоин носить облачение высших магов воды.","","False","KDW_600_Saturas_HEAVYARMOR_Info_14_04","",""
"Scripts/content/Story/MISSIONS/DIA_Kdw_600_Saturas.d:1097","Lee hat mich bei den Söldnern aufgenommen.","Ли принял меня в наемники.","","","Info_Saturas_NOWSLD.description","",""
"Scripts/content/Story/MISSIONS/DIA_Kdw_600_Saturas.d:1110","Lee hat mich bei den Söldnern aufgenommen.","Ли принял меня в наемники.","","","Info_Saturas_NOWSLD_15_01","",""
"Scripts/content/Story/MISSIONS/DIA_Kdw_600_Saturas.d:1111","Gut. Sehr gut. Dann gehörst du nun offiziell zu unserer Gemeinschaft.","Хорошо. Очень хорошо. Теперь ты стал членом нашего лагеря.","","False","Info_Saturas_NOWSLD_14_02","",""
"Scripts/content/Story/MISSIONS/DIA_Kdw_600_Saturas.d:1112","Sei herzlich willkommen!","Добро пожаловать!","","","Info_Saturas_NOWSLD_14_03","",""
"Scripts/content/Story/MISSIONS/DIA_Kdw_600_Saturas.d:1127","Bei der Sache mit den Feuermagiern, erwähntest du einen weiteren... JEMAND","Отправляя меня к магам огня, ты упомянул... КОЕ-КОГО.","","False","Info_Saturas_XARDAS.description","",""
"Scripts/content/Story/MISSIONS/DIA_Kdw_600_Saturas.d:1166","Als du mich zu den Feuermagiern schicktest, erwähntest du einen weiteren ... JEMAND","Отправляя меня к магам огня, ты упомянул... КОЕ-КОГО.","","False","Info_Saturas_XARDAS_15_01","",""
"Scripts/content/Story/MISSIONS/DIA_Kdw_600_Saturas.d:1167","Nun, ich hoffte wir würden ohne seine Hilfe auskommen, aber so wie die Dinge stehen ...","Ну, я надеялся, что мы справимся и без его помощи. Но судя по тому, как развиваются события...","","False","Info_Saturas_XARDAS_14_02","",""
"Scripts/content/Story/MISSIONS/DIA_Kdw_600_Saturas.d:1168","Wer ist dieser JEMAND?","Кто ОН?","","","Info_Saturas_XARDAS_15_03","",""
"Scripts/content/Story/MISSIONS/DIA_Kdw_600_Saturas.d:1169","Also gut, also gut!","Хорошо, хорошо!","","","Info_Saturas_XARDAS_14_04","",""
"Scripts/content/Story/MISSIONS/DIA_Kdw_600_Saturas.d:1170","Vor vielen, vielen Jahren ...","Много, много лет назад...","","","Info_Saturas_XARDAS_14_05","",""
"Scripts/content/Story/MISSIONS/DIA_Kdw_600_Saturas.d:1171","Bitte die Kurzform!","Нельзя ли подсократить историю, а?","","","Info_Saturas_XARDAS_15_06","",""
"Scripts/content/Story/MISSIONS/DIA_Kdw_600_Saturas.d:1172","Geduld! Also, als wir - die zwölf Magier - damals die Barriere erschufen, wurden unsere magischen Kräfte von einem 13. Zauberer gelenkt und geleitet.","Терпение! Итак, когда все мы, двенадцать магов, создавали магический барьер, наша сила направлялась и контролировалась тринадцатым.","","False","Info_Saturas_XARDAS_14_07","",""
"Scripts/content/Story/MISSIONS/DIA_Kdw_600_Saturas.d:1173","Ein 13. Zauberer? Ich dachte, es hätte nur zwölf gegeben!","Тринадцатый маг? Я думал, вас была только дюжина!","","","Info_Saturas_XARDAS_15_08","",""
"Scripts/content/Story/MISSIONS/DIA_Kdw_600_Saturas.d:1174","Die meisten, die die ersten Tage der Kolonie nicht miterlebt haben, glauben das.","Большинство из тех, кто не застал основания колонии, думают точно так же.","","","Info_Saturas_XARDAS_14_09","",""
"Scripts/content/Story/MISSIONS/DIA_Kdw_600_Saturas.d:1175","Dieser 13. Zauberer war einst unser Anführer. Das alles war, bevor wir uns in den Feuer- und Wasserkreis zerstritten haben.","Тринадцатый маг руководил нами, и было это еще до того, как мы разделились на Круги огня и воды.","","False","Info_Saturas_XARDAS_14_10","",""
"Scripts/content/Story/MISSIONS/DIA_Kdw_600_Saturas.d:1176","Doch er verließ das Alte Lager, das damals noch das einzige Lager in der Kolonie war.","Но он покинул Старый лагерь, который когда-то был единственным лагерем в колонии.","","False","Info_Saturas_XARDAS_14_11","",""
"Scripts/content/Story/MISSIONS/DIA_Kdw_600_Saturas.d:1188","Wie heißt dieser 13. Zauberer?","Как зовут этого тринадцатого мага?","","","Info_Saturas_XARDASWHO.description","",""
"Scripts/content/Story/MISSIONS/DIA_Kdw_600_Saturas.d:1201","Wie heißt dieser 13. Zauberer?","Как зовут этого тринадцатого мага?","","","Info_Saturas_XARDASWHO_15_01","",""
"Scripts/content/Story/MISSIONS/DIA_Kdw_600_Saturas.d:1202","Sein Name ist Xardas. Kaum einer kennt noch die alten Geschichten über ihn!","Его имя Ксардас. Едва ли сейчас кто-нибудь помнит о нем.","","False","Info_Saturas_XARDASWHO_14_02","",""
"Scripts/content/Story/MISSIONS/DIA_Kdw_600_Saturas.d:1203","Die, die es tun, nennen ihn nur den DÄMONENBESCHWÖRER!","А те, кто помнит, называют его не иначе как НЕКРОМАНТОМ!","","","Info_Saturas_XARDASWHO_14_03","",""
"Scripts/content/Story/MISSIONS/DIA_Kdw_600_Saturas.d:1215","Warum verließ er das Alte Lager?","Почему он покинул Старый лагерь?","","False","Info_Saturas_XARDASWHY.description","",""
"Scripts/content/Story/MISSIONS/DIA_Kdw_600_Saturas.d:1228","Warum verließ er das Alte Lager?","Почему он покинул Старый лагерь?","","False","Info_Saturas_XARDASWHY_15_01","",""
"Scripts/content/Story/MISSIONS/DIA_Kdw_600_Saturas.d:1229","Er begann sich intensiv mit der Beschwörung untoter und magischer Wesen zu beschäftigen.","Он начал изучать магию, позволявшую призывать магических существ... нежить.","","","Info_Saturas_XARDASWHY_14_02","",""
"Scripts/content/Story/MISSIONS/DIA_Kdw_600_Saturas.d:1230","Das beunruhigte nicht nur Gomez. Selbst die meisten der anderen Magier lehnten sich gegen ihn und sein unheiliges Treiben auf.","Гомез был не единственным из тех, кто начал беспокоиться. Большинство других магов выступило против Ксардаса и его нечестивых экспериментов.","","","Info_Saturas_XARDASWHY_14_03","",""
"Scripts/content/Story/MISSIONS/DIA_Kdw_600_Saturas.d:1231","Was passierte dann?","И что было потом?","","","Info_Saturas_XARDASWHY_15_04","",""
"Scripts/content/Story/MISSIONS/DIA_Kdw_600_Saturas.d:1232","Er war - anders als Gomez - kein Schlächter, also ging er dem Konflikt aus dem Weg und verließ die anderen.","В отличие от мясника Гомеза, Ксардас решил избежать конфликта и просто ушел.","","False","Info_Saturas_XARDASWHY_14_05","",""
"Scripts/content/Story/MISSIONS/DIA_Kdw_600_Saturas.d:1244","Wo kann man diesen Zauberer finden?","Где этот маг теперь?","","","Info_Saturas_XARDASWHERE.description","",""
"Scripts/content/Story/MISSIONS/DIA_Kdw_600_Saturas.d:1257","Wo kann man diesen Zauberer finden?","Где этот маг теперь?","","","Info_Saturas_XARDASWHERE_15_01","",""
"Scripts/content/Story/MISSIONS/DIA_Kdw_600_Saturas.d:1258","Er lebt heute zurückgezogen in seinem Turm mitten im Orkgebiet.","Он живет в уединении в своей башне посреди земель орков.","","","Info_Saturas_XARDASWHERE_14_02","",""
"Scripts/content/Story/MISSIONS/DIA_Kdw_600_Saturas.d:1259","Das ist so ziemlich der südlichste Ort der Kolonie.","Она находится в самой южной части колонии.","","","Info_Saturas_XARDASWHERE_14_03","",""
"Scripts/content/Story/MISSIONS/DIA_Kdw_600_Saturas.d:1271","Ich werde zu Xardas aufbrechen und ihn um Hilfe bitten!","Я отправлюсь к Ксардасу и попрошу его о помощи!","","","Info_Saturas_XARDASHELP.description","",""
"Scripts/content/Story/MISSIONS/DIA_Kdw_600_Saturas.d:1286","Ich werde zu Xardas aufbrechen und ihn um Hilfe bitten!","Я отправлюсь к Ксардасу и попрошу его о помощи!","","","Info_Saturas_XARDASHELP_15_01","",""
"Scripts/content/Story/MISSIONS/DIA_Kdw_600_Saturas.d:1287","Er ist der einzige, der uns jetzt noch helfen kann.","Он единственный, кто теперь может нам помочь.","","","Info_Saturas_XARDASHELP_14_02","",""
"Scripts/content/Story/MISSIONS/DIA_Kdw_600_Saturas.d:1288","Wenn er keinen Rat weiß oder uns nicht helfen will ...","Но если он не знает способа или не захочет помогать нам...","","","Info_Saturas_XARDASHELP_14_03","",""
"Scripts/content/Story/MISSIONS/DIA_Kdw_600_Saturas.d:1289","ER WIRD!","ЗАХОЧЕТ!","","","Info_Saturas_XARDASHELP_15_04","",""
"Scripts/content/Story/MISSIONS/DIA_Kdw_600_Saturas.d:1290","Da wäre noch ein Problem ...","Есть и другая проблема...","","","Info_Saturas_XARDASHELP_14_05","",""
"Scripts/content/Story/MISSIONS/DIA_Kdw_600_Saturas.d:1304","Ein Problem?","Проблема?","","","Info_Saturas_XARDASPROBLEM.description","",""
"Scripts/content/Story/MISSIONS/DIA_Kdw_600_Saturas.d:1317","Ein Problem?","Проблема?","","","Info_Saturas_XARDASPROBLEM_15_01","",""
"Scripts/content/Story/MISSIONS/DIA_Kdw_600_Saturas.d:1318","Ja. Wir haben in den vergangenen Jahren öfters versucht, mit Xardas Kontakt aufzunehmen.","Да. За прошедшие годы мы несколько раз пытались связаться с Ксардасом.","","","Info_Saturas_XARDASPROBLEM_14_02","",""
"Scripts/content/Story/MISSIONS/DIA_Kdw_600_Saturas.d:1319","Doch er scheint wohl lieber ungestört zu bleiben.","Похоже, он не хочет, чтобы его беспокоили.","","","Info_Saturas_XARDASPROBLEM_14_03","",""
"Scripts/content/Story/MISSIONS/DIA_Kdw_600_Saturas.d:1320","Was bedeutet das?","Что это значит?","","","Info_Saturas_XARDASPROBLEM_15_04","",""
"Scripts/content/Story/MISSIONS/DIA_Kdw_600_Saturas.d:1321","Keiner der Boten kehrte je von seinem Turm zurück.","Никто из гонцов не вернулся из его башни.","","","Info_Saturas_XARDASPROBLEM_14_05","",""
"Scripts/content/Story/MISSIONS/DIA_Kdw_600_Saturas.d:1322","Du wirst einen Weg finden müssen, an seinen Kreaturen vorbeizukommen.","Тебе придется найти способ, как обмануть его созданий.","","","Info_Saturas_XARDASPROBLEM_14_06","",""
"Scripts/content/Story/MISSIONS/DIA_Kdw_600_Saturas.d:1323","Es scheint also weiterhin interessant zu bleiben!","Это должно быть забавно!","","","Info_Saturas_XARDASPROBLEM_15_07","",""
"Scripts/content/Story/MISSIONS/DIA_Kdw_600_Saturas.d:1337","Wie werde ich mit seinen Kreaturen fertig?","Как пройти мимо этих тварей?","","","Info_Saturas_XARDASGO.description","",""
"Scripts/content/Story/MISSIONS/DIA_Kdw_600_Saturas.d:1350","Wie werde ich mit seinen Kreaturen fertig?","Как пройти мимо этих тварей?","","","Info_Saturas_XARDASGO_15_01","",""
"Scripts/content/Story/MISSIONS/DIA_Kdw_600_Saturas.d:1351","Wenn ich es wüsste, würde ich es dir sagen!","Если бы я знал, то непременно сказал бы тебе!","","","Info_Saturas_XARDASGO_14_02","",""
"Scripts/content/Story/MISSIONS/DIA_Kdw_600_Saturas.d:1352","Am besten, du betreibst etwas Nachforschung in unserer Bibliothek.","Советую тебе поискать ответ в нашей библиотеке.","","","Info_Saturas_XARDASGO_14_03","",""
"Scripts/content/Story/MISSIONS/DIA_Kdw_600_Saturas.d:1353","Vielleicht wissen die alten Bücher etwas über Stärken und Schwächen von magisch beschwörten Kreaturen.","Быть может, в старых книгах есть упоминания о сильных и слабых сторонах существ, порожденных магией.","","False","Info_Saturas_XARDASGO_14_04","",""
"Scripts/content/Story/MISSIONS/DIA_Kdw_600_Saturas.d:1354","Ich werde die Bibliothek durchstöbern. Und mach dir keine Sorgen ...","Я перерою всю библиотеку. И не волнуйся...","","","Info_Saturas_XARDASGO_15_05","",""
"Scripts/content/Story/MISSIONS/DIA_Kdw_600_Saturas.d:1355","Ich komme wieder!","Я вернусь!","","","Info_Saturas_XARDASGO_15_06","",""
"Scripts/content/Story/MISSIONS/DIA_Kdw_600_Saturas.d:1382","Hast du mit Xardas gesprochen?","Ты говорил с Ксардасом?","","","KDW_600_Saturas_TIMESUP_Info_14_00","",""
"Scripts/content/Story/MISSIONS/DIA_Kdw_600_Saturas.d:1384","Nun...","Ну...","","","KDW_600_Saturas_TIMESUP.KDW_600_Saturas_TIMESUP_JA1","Info_AddChoice",""
"Scripts/content/Story/MISSIONS/DIA_Kdw_600_Saturas.d:1385","Nein...","Нет...","","","KDW_600_Saturas_TIMESUP.KDW_600_Saturas_TIMESUP_JA2","Info_AddChoice",""
"Scripts/content/Story/MISSIONS/DIA_Kdw_600_Saturas.d:1386","Die ganze Sache ist anders, als du denkst...","Все не так, как ты думаешь...","","","KDW_600_Saturas_TIMESUP.KDW_600_Saturas_TIMESUP_JA3","Info_AddChoice",""
"Scripts/content/Story/MISSIONS/DIA_Kdw_600_Saturas.d:1391","Nun ...","Ну...","","","KDW_600_Saturas_TIMESUP_Info_15_01","",""
"Scripts/content/Story/MISSIONS/DIA_Kdw_600_Saturas.d:1392","Nun ..? Nun was?","Ну?.. Ну что?","","False","KDW_600_Saturas_TIMESUP_Info_14_02","",""
"Scripts/content/Story/MISSIONS/DIA_Kdw_600_Saturas.d:1401","Nein...","Нет...","","","KDW_600_Saturas_TIMESUP_Info_15_05","",""
"Scripts/content/Story/MISSIONS/DIA_Kdw_600_Saturas.d:1402","Warum nicht?","Почему?","","","KDW_600_Saturas_TIMESUP_Info_14_06","",""
"Scripts/content/Story/MISSIONS/DIA_Kdw_600_Saturas.d:1403","Ich kam bisher nicht in diese Gegend ...","Я еще не добрался до башни...","","","KDW_600_Saturas_TIMESUP_Info_15_07","",""
"Scripts/content/Story/MISSIONS/DIA_Kdw_600_Saturas.d:1404","Du musst ihn finden und um Rat fragen!","Ты должен найти его и спросить у него совета!","","","KDW_600_Saturas_TIMESUP_Info_14_08","",""
"Scripts/content/Story/MISSIONS/DIA_Kdw_600_Saturas.d:1411","Die ganze Sache ist anders, als du denkst ...","Все не так, как ты думаешь...","","","KDW_600_Saturas_TIMESUP_Info_15_09","",""
"Scripts/content/Story/MISSIONS/DIA_Kdw_600_Saturas.d:1412","Was heißt anders? Er muss einen Weg finden, wie wir den Erzhaufen sprengen können!","О чем это ты? Он должен знать, как взорвать Железную гору!","","False","KDW_600_Saturas_TIMESUP_Info_14_10","",""
"Scripts/content/Story/MISSIONS/DIA_Kdw_600_Saturas.d:1413","Der Erzhaufen ... äh ... äh ... ist mittlerweile sehr groß!","Железная гора... ох... ух... Она уже очень высокая!","","False","KDW_600_Saturas_TIMESUP_Info_15_11","",""
"Scripts/content/Story/MISSIONS/DIA_Kdw_600_Saturas.d:1414","Suche Xardas, er muss uns helfen!","Найди Ксардаса! Нам нужна его помощь!","","False","KDW_600_Saturas_TIMESUP_Info_14_12","",""
"Scripts/content/Story/MISSIONS/DIA_Kdw_600_Saturas.d:1434","Nefarius sagte, ich sei bereit die Robe der Wassermagier zu tragen.","Нефариус сказал, что я готов носить облачение Мага Воды.","","","KDW_600_Saturas_HogeAUFNAHME.description","",""
"Scripts/content/Story/MISSIONS/DIA_Kdw_600_Saturas.d:1447","Nefarius sagte, ich sei bereit die Robe der Wassermagier zu tragen.","Нефариус сказал, что я готов носить облачение Мага Воды.","","","KDW_600_Saturas_HogeAUFNAHME_15_00","",""
"Scripts/content/Story/MISSIONS/DIA_Kdw_600_Saturas.d:1465","Ich bin bereit, den Eid abzulegen.","Я готов принести клятву.","","","KDW_600_Saturas_HogeAUFNAHMETeil2.description","",""
"Scripts/content/Story/MISSIONS/DIA_Kdw_603_Nefarius.d:33","Wer bist du?","Кто ты?","","False","Info_Nefarius_Hallo.description","",""
"Scripts/content/Story/MISSIONS/DIA_Kdw_603_Nefarius.d:43","Wer bist du?","Кто ты?","","","Info_Nefarius_Hallo_15_00","",""
"Scripts/content/Story/MISSIONS/DIA_Kdw_603_Nefarius.d:44","Ich bin Nefarius. Magier vom Kreis des Wassers.","Я Нефариус, маг Круга воды.","","False","Info_Nefarius_Hallo_04_01","",""
"Scripts/content/Story/MISSIONS/DIA_Kdw_603_Nefarius.d:56","Wo finde ich Saturas?","Где мне найти Сатураса?","","","Info_Nefarius_WoSaturas.description","",""
"Scripts/content/Story/MISSIONS/DIA_Kdw_603_Nefarius.d:66","Wo finde ich Saturas?","Где мне найти Сатураса?","","","Info_Nefarius_WoSaturas_15_00","",""
"Scripts/content/Story/MISSIONS/DIA_Kdw_603_Nefarius.d:67","Geh durch das große runde Tor. Dort wirst du ihn finden.","Иди в большие круглые ворота. Там ты и найдешь его.","","","Info_Nefarius_WoSaturas_04_01","",""
"Scripts/content/Story/MISSIONS/DIA_Kdw_603_Nefarius.d:79","Ich will ein Magier vom Kreis des Wassers werden!","Я хочу стать магом Круга воды!","","False","Info_Nefarius_WannaMage.description","",""
"Scripts/content/Story/MISSIONS/DIA_Kdw_603_Nefarius.d:92","Ich will ein Magier vom Kreis des Wassers werden!","Я хочу стать магом Круга воды!","","False","Info_Nefarius_WannaMage_15_00","",""
"Scripts/content/Story/MISSIONS/DIA_Kdw_603_Nefarius.d:93","(lacht) Nicht so schnell, mein Junge!","(со смехом) Не так быстро, мой мальчик!","","","Info_Nefarius_WannaMage_04_01","",""
"Scripts/content/Story/MISSIONS/DIA_Kdw_603_Nefarius.d:94","Bevor wir einen jungen Mann in unsere Reihen aufnehmen, muss er etwas Großes vollbracht haben.","Прежде чем мы позволим новичку присоединиться к нам, он должен проявить себя в каком-нибудь великом деянии.","","","Info_Nefarius_WannaMage_04_02","",""
"Scripts/content/Story/MISSIONS/DIA_Kdw_603_Nefarius.d:95","Und er muss uns eine Zeit lang gedient haben.","И он должен служить нам какое-то время.","","","Info_Nefarius_WannaMage_04_03","",""
"Scripts/content/Story/MISSIONS/DIA_Kdw_603_Nefarius.d:96","Wenn es dir wirklich ernst ist, solltest du zu unseren Söldnern gehen. Dort kannst du uns dienen.","Если ты серьезен в своих намерениях, ты должен стать одним из наших наемников. Так ты сможешь служить нам.","","","Info_Nefarius_WannaMage_04_04","",""
"Scripts/content/Story/MISSIONS/DIA_Kdw_603_Nefarius.d:97","Und vielleicht erhältst du eines Tages die Chance, etwas Großes zu vollbringen.","И может быть, однажды тебе представится шанс сделать что-то большое.","","False","Info_Nefarius_WannaMage_04_05","",""
"Scripts/content/Story/MISSIONS/DIA_Kdw_603_Nefarius.d:110","Bin ich bereit für den Kreis des Wassers?","Я готов присоединиться к Кругу воды?","","False","Info_Nefarius_NowReady.description","",""
"Scripts/content/Story/MISSIONS/DIA_Kdw_603_Nefarius.d:123","Bin ich bereit für den Kreis des Wassers?","Я готов присоединиться к Кругу воды?","","False","Info_Nefarius_NowReady_15_00","",""
"Scripts/content/Story/MISSIONS/DIA_Kdw_603_Nefarius.d:127","Werde einer unserer Söldner, dann sehen wir weiter...","Стань одним из наших наемников, а там посмотрим...","","","Info_Nefarius_NowReady_04_01","",""
"Scripts/content/Story/MISSIONS/DIA_Kdw_603_Nefarius.d:131","Ich sehe, du bist einer unserer Söldner geworden. Sehr gut, sehr gut...","Вижу, ты стал одним из наших наемников. Очень хорошо, очень хорошо...","","","Info_Nefarius_NowReady_04_02","",""
"Scripts/content/Story/MISSIONS/DIA_Kdw_603_Nefarius.d:132","Alles Weitere wird sich mit der Zeit zeigen...","Теперь дело за временем...","","","Info_Nefarius_NowReady_04_03","",""
