"location","source","target","id","fuzzy","context","translator_comments","developer_comments"
"Scripts/content/Story/MISSIONS/DIA_GUR_1211_BaalLukor.d:252","Sehr gut! Dies ist die andere Hälfte der orkischen Spruchrolle.","Очень хорошо! Это вторая половина магического заклинания орков.","","","Info_BaalLukor_FIRSTSCROLL_13_02","",""
"Scripts/content/Story/MISSIONS/DIA_GUR_1211_BaalLukor.d:257","Das sieht aus wie eine orkische Zauberspruchrolle, aber sie ist mittendurch gerissen.","Это похоже на свиток с заклинанием орков, порванный на две части.","","","Info_BaalLukor_FIRSTSCROLL_13_03","",""
"Scripts/content/Story/MISSIONS/DIA_GUR_1211_BaalLukor.d:258","Es muss noch eine andere Hälfte davon geben.","Где-то должна быть вторая часть.","","","Info_BaalLukor_FIRSTSCROLL_13_04","",""
"Scripts/content/Story/MISSIONS/DIA_GUR_1211_BaalLukor.d:291","Hmmm ... Dieser Stollen ist eine Sackgasse! Vielleicht findest du hier irgendwelche Hinweise, die uns weiterhelfen.","Х-ммм... этот туннель заканчивается тупиком. Возможно, здесь ты найдешь что-то, что пригодится нам в дальнейшем.","","","Info_BaalLukor_SECONDWAIT_13_01","",""
"Scripts/content/Story/MISSIONS/DIA_GUR_1211_BaalLukor.d:309","Hier ist ein zerrissenes Stück Pergament!","Здесь лежит обрывок свитка!","","","Info_BaalLukor_SECONDSCROLL.description","",""
"Scripts/content/Story/MISSIONS/DIA_GUR_1211_BaalLukor.d:326","Hier ist ein zerrissenes Stück Pergament!","Здесь лежит обрывок свитка!","","","Info_BaalLukor_SECONDSCROLL_15_01","",""
"Scripts/content/Story/MISSIONS/DIA_GUR_1211_BaalLukor.d:330","Sehr gut! Dies ist die andere Hälfte der orkischen Spruchrolle.","Очень хорошо! Это вторая половина магического заклинания орков.","","","Info_BaalLukor_SECONDSCROLL_13_02","",""
"Scripts/content/Story/MISSIONS/DIA_GUR_1211_BaalLukor.d:335","Das sieht aus wie eine orkische Zauberspruchrolle, aber sie ist mittendurch gerissen.","Это похоже на свиток с заклинанием орков, порванный на две части.","","","Info_BaalLukor_SECONDSCROLL_13_03","",""
"Scripts/content/Story/MISSIONS/DIA_GUR_1211_BaalLukor.d:336","Es muss noch eine andere Hälfte davon geben.","Где-то должна быть вторая часть.","","","Info_BaalLukor_SECONDSCROLL_13_04","",""
"Scripts/content/Story/MISSIONS/DIA_GUR_1211_BaalLukor.d:353","Was fangen wir jetzt mit den beiden Stücken an?","Что мы будем делать с этими двумя частями?","","","Info_BaalLukor_BOTHSCROLLS.description","",""
"Scripts/content/Story/MISSIONS/DIA_GUR_1211_BaalLukor.d:367","Was fangen wir jetzt mit diesen beiden Stücken an?","Что мы будем делать с этими двумя частями?","","","Info_BaalLukor_BOTHSCROLLS_15_01","",""
"Scripts/content/Story/MISSIONS/DIA_GUR_1211_BaalLukor.d:368","Die beiden Hälften passen zusammen. Doch ich kann die orkischen Zeichen nicht übersetzen.","Обрывки свитка совпадают друг с другом. Но я не могу расшифровать эти оркские символы.","","","Info_BaalLukor_BOTHSCROLLS_13_02","",""
"Scripts/content/Story/MISSIONS/DIA_GUR_1211_BaalLukor.d:400","Warte mal! Das ist interessant ...","Минутку! Это уже интересно...","","","Info_BaalLukor_RUNES_13_01","",""
"Scripts/content/Story/MISSIONS/DIA_GUR_1211_BaalLukor.d:401","Also ich kann diesem Ort beim besten Willen nichts Interessantes abgewinnen.","Ну, я не вижу здесь ничего интересного.","","","Info_BaalLukor_RUNES_15_02","",""
"Scripts/content/Story/MISSIONS/DIA_GUR_1211_BaalLukor.d:402","Schweig und betrachte die Runenornamente in dieser Höhle hier.","Помолчи немного и присмотрись к рунам в этой пещере.","","","Info_BaalLukor_RUNES_13_03","",""
"Scripts/content/Story/MISSIONS/DIA_GUR_1211_BaalLukor.d:403","Das sollte ausreichend Material geben, um die geteilten Pergamenthälften zu übersetzen.","Да, этого должно быть достаточно для того, чтобы перевести обе половины свитка.","","","Info_BaalLukor_RUNES_13_04","",""
"Scripts/content/Story/MISSIONS/DIA_GUR_1211_BaalLukor.d:406","Das ist es! Es handelt sich um einen Teleportzauber. Er scheint aber nur an einem gewissen Ort seine Kraft entfalten zu können.","Получилось! Это Заклинание Портала. Похоже, оно срабатывает только в определенных местах.","","","Info_BaalLukor_RUNES_13_06","",""
"Scripts/content/Story/MISSIONS/DIA_GUR_1211_BaalLukor.d:407","Seltsam!","Странно!","","","Info_BaalLukor_RUNES_13_07","",""
"Scripts/content/Story/MISSIONS/DIA_GUR_1211_BaalLukor.d:428","Was für ein 'gewisser' Ort!","В каких это 'определенных' местах?","","","Info_BaalLukor_WHATNOW.description","",""
"Scripts/content/Story/MISSIONS/DIA_GUR_1211_BaalLukor.d:443","Was für ein 'gewisser' Ort!","В каких это 'определенных' местах?","","","Info_BaalLukor_WHATNOW_15_01","",""
"Scripts/content/Story/MISSIONS/DIA_GUR_1211_BaalLukor.d:444","Die große Halle vorhin, kam mir sehr ... seltsam ... vor. Lass uns noch mal dorthin zurück!","Большой зал, через который мы проходили, показался мне очень... странным... местом. Вернемся туда!","","","Info_BaalLukor_WHATNOW_13_02","",""
"Scripts/content/Story/MISSIONS/DIA_GUR_1211_BaalLukor.d:475","Dieser Ort ... ich kann es nicht erklären, aber dieser Ort hier ...","Это место... Я не могу этого объяснить, но это место...","","","Info_BaalLukor_HALLWITHOUT_13_01","",""
"Scripts/content/Story/MISSIONS/DIA_GUR_1211_BaalLukor.d:476","Ach vergiss es. Es ist bestimmt nur Einbildung.","О, не обращай внимания. Должно быть, у меня разыгралось воображение.","","","Info_BaalLukor_HALLWITHOUT_13_02","",""
"Scripts/content/Story/MISSIONS/DIA_GUR_1211_BaalLukor.d:509","Dieser Ort hat eine besondere Ausstrahlung ... Die Ausstrahlung des Verborgenen.","У этого места особая аура... Аура чего-то тайного.","","","Info_BaalLukor_HALLWITH_13_01","",""
"Scripts/content/Story/MISSIONS/DIA_GUR_1211_BaalLukor.d:510","Diese Halle erinnert mich an das Bild aus der Vision.","Этот зал напомнил мне образ из моего видения.","","","Info_BaalLukor_HALLWITH_15_02","",""
"Scripts/content/Story/MISSIONS/DIA_GUR_1211_BaalLukor.d:511","Die Vision ... Wir sind unserem Ziel sehr nahe ...","Видение... Мы очень близки к цели...","","","Info_BaalLukor_HALLWITH_13_03","",""
"Scripts/content/Story/MISSIONS/DIA_GUR_1211_BaalLukor.d:545","Hinter dieser Wand ... Das muss es sein!","За этой стеной... Кажется, здесь!","","","Info_BaalLukor_DOOR_13_01","",""
"Scripts/content/Story/MISSIONS/DIA_GUR_1211_BaalLukor.d:546","Meine magische Kraft ist noch immer geschwächt.","Я пока не набрал достаточной магической силы.","","","Info_BaalLukor_DOOR_13_02","",""
"Scripts/content/Story/MISSIONS/DIA_GUR_1211_BaalLukor.d:547","Benutze den orkischen Teleportzauber hier vor dieser Wand.","Используй Заклинание Портала здесь, перед этой стеной.","","","Info_BaalLukor_DOOR_13_03","",""
"Scripts/content/Story/MISSIONS/DIA_GUR_1211_BaalLukor.d:582","Du hast den verborgenen Ort gefunden. Meine Instinkte haben mich nicht getäuscht.","Оно приведет тебя в какое-то тайное место. Моя интуиция еще никогда не подводила меня.","","","Info_BaalLukor_TELEPORT_13_01","",""
"Scripts/content/Story/MISSIONS/DIA_GUR_1211_BaalLukor.d:583","Und hier liegt die Antwort auf die rätselhafte Anrufung des Schläfers???","Неужели мы действительно найдем здесь ответ на вопрос, как призвать Спящего???","","","Info_BaalLukor_TELEPORT_15_02","",""
"Scripts/content/Story/MISSIONS/DIA_GUR_1211_BaalLukor.d:584","Sieht mir eher nach einer weiteren Grabkammer aus.","Это место больше похоже на похоронный зал.","","","Info_BaalLukor_TELEPORT_15_03","",""
"Scripts/content/Story/MISSIONS/DIA_GUR_1211_BaalLukor.d:585","Wir müssen weiter.","Идем дальше.","","","Info_BaalLukor_TELEPORT_13_04","",""
"Scripts/content/Story/MISSIONS/DIA_GUR_1211_BaalLukor.d:622","NEIN! Das darf nicht wahr sein! Hier gibt es nichts außer ... außer Staub und ... und Gebeinen.","НЕТ! Этого не может быть! Здесь ничего нет... ничего, кроме костей... и пыли.","","","Info_BaalLukor_ALTAR_13_01","",""
"Scripts/content/Story/MISSIONS/DIA_GUR_1211_BaalLukor.d:628","NEIN!","НЕТ!","","","Info_BaalLukor_ALTAR_13_02","",""
"Scripts/content/Story/MISSIONS/DIA_GUR_1211_BaalLukor.d:629","MEISTER, SPRICH ZU MIR!!!","ГОСПОДИН, ОТВЕТЬ МНЕ!!!","","","Info_BaalLukor_ALTAR_13_03","",""
"Scripts/content/Story/MISSIONS/DIA_GUR_1211_BaalLukor.d:630","SCHLÄFER, OFFENBARE DICH!!!","ЯВИ СЕБЯ, СПЯЩИЙ!!!","","","Info_BaalLukor_ALTAR_13_04","",""
"Scripts/content/Story/MISSIONS/DIA_GUR_1211_BaalLukor.d:631","NEEEEEIIIIIINNNNN!!!","НЕЕЕЕЕЕТ!!!","","","Info_BaalLukor_ALTAR_13_05","",""
"Scripts/content/Story/MISSIONS/DIA_GUR_1211_BaalLukor.d:633","Das war's. Jetzt ist er völlig übergeschnappt!","Ну вот. Он окончательно сошел с ума!","","","Info_BaalLukor_ALTAR_15_06","",""
"Scripts/content/Story/MISSIONS/DIA_GUR_1211_BaalLukor.d:637","Das ist alles nur deine Schuld. Deine unheilige Präsenz hat den allmächtigen Schläfer erzürnt!","Это все твоя вина. Твое нечестивое присутствие разозлило всемогущего Спящего!","","","Info_BaalLukor_ALTAR_13_07","",""
"Scripts/content/Story/MISSIONS/DIA_GUR_1211_BaalLukor.d:638","Jetzt muss ich für dein frevelhaftes Verhalten büßen!","И теперь я должен расплачиваться за твое святотатство!","","","Info_BaalLukor_ALTAR_13_08","",""
"Scripts/content/Story/MISSIONS/DIA_GUR_1211_BaalLukor.d:639","Ich werde unserem Meister ein Opfer darbringen. Ein MENSCHENOPFER!!!","Я должен принести жертву своему господину. ЧЕЛОВЕЧЕСКУЮ ЖЕРТВУ!!!","","","Info_BaalLukor_ALTAR_13_09","",""
"Scripts/content/Story/MISSIONS/DIA_GUR_1211_BaalLukor.d:640","Bestimmt wird er mich dann erleuchten und zu seiner rechten Hand machen.","И тогда он точно просвятит меня и сделает меня своим слугой.","","","Info_BaalLukor_ALTAR_13_10","",""
"Scripts/content/Story/MISSIONS/DIA_GUR_1211_BaalLukor.d:641","STIRB, UNGLÄUBIGER!!!!","УМРИ, НЕВЕРНЫЙ!!!","","","Info_BaalLukor_ALTAR_13_11","",""
"Scripts/content/Story/MISSIONS/DIA_GUR_1211_BaalLukor.d:642","AIIIEEEEHHHHHH!!!!!!","АЙЙЙЕЕЕЕХХХХХХ!!!!!!","","","Info_BaalLukor_ALTAR_13_12","",""
"Scripts/content/Story/MISSIONS/DIA_GUR_1212_MadCorKalom.d:19","Schließlich sehen wir uns also wieder!","Наконец-то мы снова встретились!","","","GUR_1212_MadCorKalom_Talk2SC_10_01","",""
"Scripts/content/Story/MISSIONS/DIA_GUR_1212_MadCorKalom.d:20","Mein Meister hat mir bereits von deiner Ankunft berichtet!","Мой господин сообщил мне о твоем прибытии!","","","GUR_1212_MadCorKalom_Talk2SC_10_02","",""
"Scripts/content/Story/MISSIONS/DIA_GUR_1212_MadCorKalom.d:21","Er kann deine Nähe spüren.","Он чувствует, что ты рядом.","","","GUR_1212_MadCorKalom_Talk2SC_10_03","",""
"Scripts/content/Story/MISSIONS/DIA_GUR_1212_MadCorKalom.d:22","Schon bald werde ich ihm näher sein, als ihm lieb ist!","Скоро я буду ближе к нему, ближе, чем ему хотелось бы!","","","GUR_1212_MadCorKalom_Talk2SC_15_04","",""
"Scripts/content/Story/MISSIONS/DIA_GUR_1212_MadCorKalom.d:23","Wir werden nicht zulassen, dass du unsere Pläne durchkreuzt.","Мы не позволим тебе расстроить наши планы.","","","GUR_1212_MadCorKalom_Talk2SC_10_05","",""
"Scripts/content/Story/MISSIONS/DIA_GUR_1212_MadCorKalom.d:24","Die Welt steht kurz vor dem Erwachen des Erlösers und keiner kann ihn aufhalten.","Мир вот-вот станет свидетелем пробуждения Избавителя, и никто не в силах остановить его.","","","GUR_1212_MadCorKalom_Talk2SC_10_06","",""
"Scripts/content/Story/MISSIONS/DIA_GUR_1212_MadCorKalom.d:25","All die Ungläubigen da draußen werden ihren Preis bezahlen .","Всех неверных ждет расплата за их грехи.","","False","GUR_1212_MadCorKalom_Talk2SC_10_07","",""
"Scripts/content/Story/MISSIONS/DIA_GUR_1212_MadCorKalom.d:26","Und du hast die Ehre, der Erste zu sein, der diesen Preis bezahlen darf .","И тебе уготована честь стать первым из них.","","","GUR_1212_MadCorKalom_Talk2SC_10_08","",""
"Scripts/content/Story/MISSIONS/DIA_GUR_1212_MadCorKalom.d:27","SCHLÄÄÄÄÄÄÄÄÄÄFEEEEEEEEEEEER ERWAAAAAAAAAAAACHEEEEEEEEEEEEE !!!!!!!!!","ППРРРОООООООООООБББУУУУУУДДИСЬ, СССППППППЯЯЯЯЯЯЯЯЯЯЯЩЩЩИИИИИИЙЙЙЙ!!!!!!!!!","","","GUR_1212_MadCorKalom_Talk2SC_10_09","",""
"Scripts/content/Story/MISSIONS/DIA_Gur_1203_BaalTondral.d:10","Nichts sagen","Ничего не говори.","","","DIA_BaalTondral_MuteExit.description","",""
"Scripts/content/Story/MISSIONS/DIA_Gur_1203_BaalTondral.d:71","Du siehst nicht aus wie einer, der sein Leben bereits unter die Knechtschaft der Erzbarone gestellt hat.","Ты не похож на тех рабов, что покорились воле баронов.","","False","DIA_BaalTondral_FanaticTeacher_13_00","",""
"Scripts/content/Story/MISSIONS/DIA_Gur_1203_BaalTondral.d:72","Du siehst aus wie ein Suchender. Du siehst aus wie einer, der den wahren Glauben sucht. Spürst du nicht das Feuer in dir, das dir nachts den Schlaf raubt?","Ты больше похож на искателя - искателя истинной веры. Разве не ощущаешь ты внутри бушующее пламя - то, что не дает тебе спать по ночам?","","","DIA_BaalTondral_FanaticTeacher_13_01","",""
"Scripts/content/Story/MISSIONS/DIA_Gur_1203_BaalTondral.d:73","Ich sehe, dass du an dem zweifelst, was dir die Knechte der Erzbarone als wahr und gerecht verkaufen wollen. Du weißt auch warum. Weil es Lügen sind!","Вижу, тебя терзают сомнения - есть ли правда в том, что пытаются навязать тебе прислужники баронов? И ты знаешь, откуда берутся эти сомнения. Они все лгут!","","False","DIA_BaalTondral_FanaticTeacher_13_02","",""
"Scripts/content/Story/MISSIONS/DIA_Gur_1203_BaalTondral.d:74","Es sind Lügen, mit denen sie den Geist derer beherrschen, die schwach sind. Dein Glaube ist stärker als ihre Lügen!","Ложь эта дает власть над теми, кто слаб духом. Но твой дух намного сильнее этой лжи!","","","DIA_BaalTondral_FanaticTeacher_13_03","",""
"Scripts/content/Story/MISSIONS/DIA_Gur_1203_BaalTondral.d:75","Fühlst du nicht jeden Tag den Wunsch nach Freiheit? Fühlst du wie er jeden Tag wächst? Er lenkt deinen Geist. Lass es geschehen!","Разве не ощущаешь ты стремление к свободе - ежесекундно, ежечасно? Разве не чувствуешь ты, как день ото дня оно становится все сильнее, как направляет оно твой дух? Освободи его!","","","DIA_BaalTondral_FanaticTeacher_13_04","",""
"Scripts/content/Story/MISSIONS/DIA_Gur_1203_BaalTondral.d:76","Weißt du, was du tust, wenn du ihn beherrscht? Du verleugnest deine Seele. Du verleugnest dich selbst! Hör auf, im Schatten deiner Ängste zu leben.","Знаешь, что ты делаешь, когда пытаешься подавить его? Ты отвергаешь собственную душу, отвергаешь себя! Не позволяй страху властвовать над твоей жизнью!","","","DIA_BaalTondral_FanaticTeacher_13_05","",""
"Scripts/content/Story/MISSIONS/DIA_Gur_1203_BaalTondral.d:77","Mach dich frei. Verstehe! Der Schläfer WIRD erwachen, er wird dir die Freiheit bringen, und das ganze ungläubige Pack wegschwemmen.","Освободи себя. Ты должен понять! Спящий ПРОБУДИТСЯ! Он освободит тебя и сметет всех язычников-неверных!","","False","DIA_BaalTondral_FanaticTeacher_13_06","",""
"Scripts/content/Story/MISSIONS/DIA_Gur_1203_BaalTondral.d:78","Wie Unrat, der vom Regen weggespült wird, werden sie vom Antlitz dieser Welt verschwinden und sie werden klagen und jammern und bereuen, aber dann ist es zu spät.","Как пыль, смытая дождем, исчезнут они из этого мира. Они будут рыдать и горько раскаиваться во всем, но будет уже слишком поздно.","","","DIA_BaalTondral_FanaticTeacher_13_07","",""
"Scripts/content/Story/MISSIONS/DIA_Gur_1203_BaalTondral.d:79","Dann werden sie zahlen. Mit ihrem Blut. Und ihrem Leben.","Они заплатят цену. Заплатят своей кровью. И своими жизнями.","","","DIA_BaalTondral_FanaticTeacher_13_08","",""
"Scripts/content/Story/MISSIONS/DIA_Gur_1203_BaalTondral.d:91","Hey! Du hast mich angesprochen. Heißt das, ich kann jetzt mit dir reden?","Эй! Ты заговорил со мной. Могу я обратиться к тебе?","","","DIA_BaalTondral_YouTalked.description","",""
"Scripts/content/Story/MISSIONS/DIA_Gur_1203_BaalTondral.d:101","Hey! Du hast mich angesprochen. Heißt das, ich kann jetzt mit dir reden?","Эй! Ты заговорил со мной. Не значит ли это, что теперь и я могу обратиться к тебе?","","","DIA_BaalTondral_YouTalked_15_00","",""
"Scripts/content/Story/MISSIONS/DIA_Gur_1203_BaalTondral.d:102","Ich sehe, du hast dich mit unseren Regeln vertraut gemacht. Das ist gut.","Ты постигаешь наши правила. Это похвально.","","","DIA_BaalTondral_YouTalked_13_01","",""
"Scripts/content/Story/MISSIONS/DIA_Gur_1203_BaalTondral.d:103","Ich spüre große geistige Kraft in dir! Du kannst schon bald ein Mitglied unserer Gemeinschaft sein.","Я ощущаю в тебе великую духовную силу! Скоро ты будешь допущен в круг избранных.","","","DIA_BaalTondral_YouTalked_13_02","",""
"Scripts/content/Story/MISSIONS/DIA_Gur_1203_BaalTondral.d:104","Ich habe dich angesprochen weil ich dir Gelegenheit geben will, uns deine Loyalität zu beweisen.","Я заговорил с тобой, дабы дать тебе шанс проявить себя.","","","DIA_BaalTondral_YouTalked_13_03","",""
"Scripts/content/Story/MISSIONS/DIA_Gur_1203_BaalTondral.d:118","Wie kann ich dir meine Loyalität beweisen?","Как я могу доказать свою преданность?","","","DIA_BaalTondral_Loyality.description","",""
"Scripts/content/Story/MISSIONS/DIA_Gur_1203_BaalTondral.d:131","Wie kann ich dir meine Loyalität beweisen?","Как я могу доказать свою преданность?","","","DIA_BaalTondral_Loyality_15_00","",""
"Scripts/content/Story/MISSIONS/DIA_Gur_1203_BaalTondral.d:132","Was wir am dringendsten brauchen, sind neue Seelen, die sich unserer Gemeinschaft anschließen.","Больше всего мы нуждаемся в новых душах, постигших истину и вступивших в круг Братства.","","","DIA_BaalTondral_Loyality_13_01","",""
"Scripts/content/Story/MISSIONS/DIA_Gur_1203_BaalTondral.d:133","Wenn du dafür sorgst, dass ein weiterer Mann unserem Lager beitritt, hast du deinen Willen, unsere Gemeinschaft zu bereichern, unter Beweis gestellt.","Если ты убедишь одного из неверных присоединиться к нашему лагерю, этим ты докажешь свое стремление служить Братству.","","False","DIA_BaalTondral_Loyality_13_02","",""
"Scripts/content/Story/MISSIONS/DIA_Gur_1203_BaalTondral.d:152","Wo kann ich neue Leute für die Bruderschaft anwerben?","Где мне найти такого человека?","","","DIA_BaalTondral_NewMember.description","",""
"Scripts/content/Story/MISSIONS/DIA_Gur_1203_BaalTondral.d:165","Wo kann ich neue Leute für die Bruderschaft anwerben?","Где мне найти такого человека?","","","DIA_BaalTondral_NewMember_15_00","",""
"Scripts/content/Story/MISSIONS/DIA_Gur_1203_BaalTondral.d:166","Das alte Lager ist ein guter Ort dafür. Denn viele, die dort leben, sind der Angst und der Lügen überdrüssig, sie müssen nur ein wenig unterstützt werden.","Лучше всего для этого подходит Старый лагерь. Люди там устали от страха и лжи. Души их жаждут просветления и поддержки.","","False","DIA_BaalTondral_NewMember_13_01","",""
"Scripts/content/Story/MISSIONS/DIA_Gur_1203_BaalTondral.d:167","Im Neuen Lager wirst du wahrscheinlich weniger Glück haben. Die Männer, die dort leben sind Barbaren.","Я думаю, что в Новом лагере ты едва ли добьешься успеха. Там живут настоящие варвары.","","False","DIA_BaalTondral_NewMember_13_02","",""
"Scripts/content/Story/MISSIONS/DIA_Gur_1203_BaalTondral.d:179","Wieso braucht ihr so dringend neue Leute?","Почему вам так нужны новые люди?","","","DIA_BaalTondral_NewMember2.description","",""
"Scripts/content/Story/MISSIONS/DIA_Gur_1203_BaalTondral.d:192","Wieso braucht ihr so dringend neue Leute?","Почему вам так нужны новые люди?","","","DIA_BaalTondral_NewMember2_15_00","",""
"Scripts/content/Story/MISSIONS/DIA_Gur_1203_BaalTondral.d:193","Der Schläfer hat unserem Meister offenbart, dass er eine wichtige Nachricht für uns hat.","Нашему Мастеру было видение - с ним говорил Спящий. У всемогущего есть для нас важное сообщение.","","","DIA_BaalTondral_NewMember2_13_01","",""
"Scripts/content/Story/MISSIONS/DIA_Gur_1203_BaalTondral.d:194","Aber er ist noch nicht zu seiner vollen Stärke erwacht, und so braucht er UNSERE Kraft, um mit uns in Kontakt treten zu können.","Но он еще не вошел в полную силу. Вот почему ему нужна НАША помощь, для того чтобы говорить с нами.","","","DIA_BaalTondral_NewMember2_13_02","",""
"Scripts/content/Story/MISSIONS/DIA_Gur_1203_BaalTondral.d:195","Deswegen bereiten wir eine große Anrufung vor und je mehr Männer daran teilnehmen, umso eher werden wir Erfolg haben.","Все мы готовимся к Великой Церемонии, и чем больше людей примет в ней участие, тем больше наши шансы на успех.","","","DIA_BaalTondral_NewMember2_13_03","",""
"Scripts/content/Story/MISSIONS/DIA_Gur_1203_BaalTondral.d:196","Wenn du mehr darüber erfahren willst, geh zum großen Platz vor dem Tempelberg. Aber störe nicht den Meister bei der Meditation!","Если ты хочешь узнать больше, иди на площадь перед Холмом. Но не отвлекай Мастера от его размышлений!","","","DIA_BaalTondral_NewMember2_13_04","",""
"Scripts/content/Story/MISSIONS/DIA_Gur_1203_BaalTondral.d:208","Ich habe hier jemanden, der dich kennen lernen möchte, Meister!","Этот человек ищет твоего расположения, господин мой!","","","DIA_BaalTondral_DustySuccess.description","",""
"Scripts/content/Story/MISSIONS/DIA_Gur_1203_BaalTondral.d:224","Ich habe hier jemanden, der dich kennen lernen möchte, Meister!","Этот человек ищет твоего расположения, господин мой!","","","DIA_BaalTondral_DustySuccess_15_00","",""
"Scripts/content/Story/MISSIONS/DIA_Gur_1203_BaalTondral.d:225","Wen bringst du zu mir? Ist er würdig?","Кого ты привел ко мне? Достоин ли он?","","","DIA_BaalTondral_DustySuccess_13_01","",""
"Scripts/content/Story/MISSIONS/DIA_Gur_1203_BaalTondral.d:226","Er bedarf sicherlich noch eurer geistigen Führung, Meister.","Вне сомнений, он нуждается в духовном наставнике, господин.","","","DIA_BaalTondral_DustySuccess_15_02","",""
