"location","source","target","id","fuzzy","context","translator_comments","developer_comments"
"Scripts/content/Story/MISSIONS/DIA_Kdw_600_Saturas.d:537","Nun gut, ich werde versuchen, die Feuermagier zu überreden!","Ладно, я постараюсь убедить магов огня.","","False","Info_Saturas_ACCEPT_15_01","",""
"Scripts/content/Story/MISSIONS/DIA_Kdw_600_Saturas.d:538","Aber ich kann nichts versprechen! Es scheint mir fast unmöglich.","Но я ничего не обещаю! Я по-прежнему считаю эту затею чистым безумием.","","","Info_Saturas_ACCEPT_15_02","",""
"Scripts/content/Story/MISSIONS/DIA_Kdw_600_Saturas.d:539","Du musst es versuchen. Wenn du keinen Erfolg hast, dann gibt es nur noch einen ...","Ты должен попробовать. Если ты не добьешься успеха, останется только один...","","","Info_Saturas_ACCEPT_14_03","",""
"Scripts/content/Story/MISSIONS/DIA_Kdw_600_Saturas.d:540","Einen ...","Только один...","","","Info_Saturas_ACCEPT_14_04","",""
"Scripts/content/Story/MISSIONS/DIA_Kdw_600_Saturas.d:541","... Einen WAS?","...один ЧТО?","","False","Info_Saturas_ACCEPT_15_05","",""
"Scripts/content/Story/MISSIONS/DIA_Kdw_600_Saturas.d:542","Vergiss das! Du MUSST Erfolg haben!","Неважно. У тебя ДОЛЖНО получиться!","","False","Info_Saturas_ACCEPT_14_06","",""
"Scripts/content/Story/MISSIONS/DIA_Kdw_600_Saturas.d:543","Hier, nimm diese Zauberrune. Überbringe sie Corristo, dem obersten Feuermagier, als Zeichen unseres Vertrauens.","Вот, возьми эту магическую руну. Передай ее Корристо, верховному магу Круга огня, в знак нашего доверия.","","False","Info_Saturas_ACCEPT_14_07","",""
"Scripts/content/Story/MISSIONS/DIA_Kdw_600_Saturas.d:544","Damit kann er sich jederzeit vorbei an allen Wachen mitten in diesen Raum teleportieren.","С ее помощью он сможет в любой момент, минуя стражу, перенестись сюда, в эту комнату.","","","Info_Saturas_ACCEPT_14_08","",""
"Scripts/content/Story/MISSIONS/DIA_Kdw_600_Saturas.d:545","Ich hoffe, das überzeugt unsere ehemaligen Freunde von unseren guten Absichten.","Это должно убедить наших бывших друзей в наших добрых намерениях.","","","Info_Saturas_ACCEPT_14_09","",""
"Scripts/content/Story/MISSIONS/DIA_Kdw_600_Saturas.d:584","Gut, dass du wieder zurück bist. Es ist etwas Schreckliches passiert!","Я рад, что ты вернулся. Случилось нечто ужасное!","","","Info_Saturas_AMBUSH_14_01","",""
"Scripts/content/Story/MISSIONS/DIA_Kdw_600_Saturas.d:585","Lass mich raten, die Freie Mine wurde von Gardisten aus dem Alten Lager überfallen, die niemand kommen sah?","Дай-ка я угадаю: на Свободную шахту напали стражники из Старого лагеря. Никто не видел, откуда они появились?..","","False","Info_Saturas_AMBUSH_15_02","",""
"Scripts/content/Story/MISSIONS/DIA_Kdw_600_Saturas.d:586","Moment ... woher ... aber natürlich ... Du hast es im Alten Lager erfahren!","Постой... как... но конечно... Ты узнал об этом еще в Старом лагере!","","False","Info_Saturas_AMBUSH_14_03","",""
"Scripts/content/Story/MISSIONS/DIA_Kdw_600_Saturas.d:587","Gorn kam kurz vor dir hier an.","Горн прибыл сюда незадолго до тебя.","","","Info_Saturas_AMBUSH_14_04","",""
"Scripts/content/Story/MISSIONS/DIA_Kdw_600_Saturas.d:588","Was kann Gomez nur veranlasst haben, solch einen aggressiven Schritt zu wagen?","Что заставило Гомеза пойти на столь агрессивный шаг?","","False","Info_Saturas_AMBUSH_14_05","",""
"Scripts/content/Story/MISSIONS/DIA_Kdw_600_Saturas.d:589","Ihm müsste klar sein, dass dieser hinterhältige Überfall einen Krieg heraufbeschwört.","Он должен отдавать себе отчет в том, что этот гнусный поступок станет причиной войны!","","","Info_Saturas_AMBUSH_14_06","",""
"Scripts/content/Story/MISSIONS/DIA_Kdw_600_Saturas.d:601","Die Alte Mine wurde nach einem Wassereinbruch verschüttet!","Старую Шахту залило водой, и она обрушилась!","","","Info_Saturas_COLLAPSE.description","",""
"Scripts/content/Story/MISSIONS/DIA_Kdw_600_Saturas.d:614","Die Alte Mine wurde nach einem Wassereinbruch verschüttet!","Старую шахту залило водой, и она обрушилась!","","False","Info_Saturas_COLLAPSE_15_01","",""
"Scripts/content/Story/MISSIONS/DIA_Kdw_600_Saturas.d:615","... Verschüttet ... natürlich ... dann gibt das Ganze langsam einen Sinn.","Обрушилась... конечно же... это проясняет дело.","","False","Info_Saturas_COLLAPSE_14_02","",""
"Scripts/content/Story/MISSIONS/DIA_Kdw_600_Saturas.d:616","Gomez steht mit dem Rücken zur Wand. Er ist gefährlicher denn je geworden, denn nun, wo er nichts mehr zu verlieren hat, wird er zu allem fähig sein!","Мы загнали Гомеза в угол, и теперь он опаснее, чем когда бы то ни было. Ему нечего терять, и он пойдет на все!","","","Info_Saturas_COLLAPSE_14_03","",""
"Scripts/content/Story/MISSIONS/DIA_Kdw_600_Saturas.d:628","Gomez hat alle Feuermagier töten lassen!","Гомез избавился от всех магов огня!","","False","Info_Saturas_MURDER.description","",""
"Scripts/content/Story/MISSIONS/DIA_Kdw_600_Saturas.d:641","Gomez hat alle Feuermagier töten lassen!","Гомез избавился от всех магов огня!","","False","Info_Saturas_MURDER_15_01","",""
"Scripts/content/Story/MISSIONS/DIA_Kdw_600_Saturas.d:642","TÖTEN LASSEN??? Wieso bei Beliar hat er so etwas getan?","УБИЛ ИХ?! Но во имя Бельджара, зачем ему это понадобилось?","","False","Info_Saturas_MURDER_14_02","",""
"Scripts/content/Story/MISSIONS/DIA_Kdw_600_Saturas.d:643","Sie waren gegen den Überfall auf die Freie Mine und stellten sich gegen Gomez.","Они выступили против нападения на Свободную шахту, против Гомеза.","","False","Info_Saturas_MURDER_15_03","",""
"Scripts/content/Story/MISSIONS/DIA_Kdw_600_Saturas.d:644","Dann sind wir alle verloren. Ohne die anderen sechs Magier werden wir die geballte Kraft des großen Erzhaufens nicht kontrollieren können.","Тогда все мы обречены. Без этих шестерых магов мы не сможем контролировать магическую силу при взрыве Железной горы.","","False","Info_Saturas_MURDER_14_04","",""
"Scripts/content/Story/MISSIONS/DIA_Kdw_600_Saturas.d:645","Ich danke dir trotzdem dafür, dass du diese gefährliche Botschaft an mich überbracht hast.","Но несмотря ни на что, я благодарю тебя за скорбную весть, которую ты, невзирая на опасность, принес в нашу обитель.","","","Info_Saturas_MURDER_14_05","",""
"Scripts/content/Story/MISSIONS/DIA_Kdw_600_Saturas.d:662","Das Alte Lager hat mich verbannt, weil ich euch geholfen habe!","За помощь вам меня изгнали из Старого лагеря!","","False","KDW_600_Saturas_NOMOREOC.description","",""
"Scripts/content/Story/MISSIONS/DIA_Kdw_600_Saturas.d:676","Das Alte Lager hat mich verbannt, weil ich euch geholfen habe!","За помощь вам меня изгнали из Старого лагеря!","","False","KDW_600_Saturas_NOMOREOC_Info_15_01","",""
"Scripts/content/Story/MISSIONS/DIA_Kdw_600_Saturas.d:677","Du gehörst nicht länger zum Alten Lager?","Ты больше не принадлежишь к Старому лагерю?","","False","KDW_600_Saturas_NOMOREOC_Info_14_02","",""
"Scripts/content/Story/MISSIONS/DIA_Kdw_600_Saturas.d:678","Dann heiße ich dich in unserer Gemeinschaft willkommen.","Тогда добро пожаловать к нам!","","","KDW_600_Saturas_NOMOREOC_Info_14_03","",""
"Scripts/content/Story/MISSIONS/DIA_Kdw_600_Saturas.d:694","Heißt das, die Söldner werden mich aufnehmen?","Ты хочешь сказать, что наемники примут меня к себе?","","","KDW_600_Saturas_GOTOLEE.description","",""
"Scripts/content/Story/MISSIONS/DIA_Kdw_600_Saturas.d:708","Heißt das, die Söldner werden mich aufnehmen?","Ты хочешь сказать, что наемники примут меня к себе?","","","KDW_600_Saturas_GOTOLEE_Info_15_01","",""
"Scripts/content/Story/MISSIONS/DIA_Kdw_600_Saturas.d:709","Sprich mit Lee. Er wird sich darum kümmern. Danach komm wieder zu mir.","Поговори с Ли. Он будет решать. А затем возвращайся ко мне.","","","KDW_600_Saturas_GOTOLEE_Info_14_02","",""
"Scripts/content/Story/MISSIONS/DIA_Kdw_600_Saturas.d:723","Heißt das, ich gehöre jetzt in die Gilde der Wassermagier?","Означает ли это, что теперь я принадлежу к гильдии магов воды?","","False","KDW_600_Saturas_OATH.description","",""
"Scripts/content/Story/MISSIONS/DIA_Kdw_600_Saturas.d:737","Heißt das, ich gehöre jetzt in die Gilde der Wassermagier?","Означает ли это, что теперь я принадлежу к гильдии магов воды?","","False","KDW_600_Saturas_OATH_Info_15_01","",""
"Scripts/content/Story/MISSIONS/DIA_Kdw_600_Saturas.d:738","Noch nicht. Du musst erst den Eid des Wassers ablegen.","Пока еще нет. Прежде ты должен принести Клятву воде.","","False","KDW_600_Saturas_OATH_Info_14_02","",""
"Scripts/content/Story/MISSIONS/DIA_Kdw_600_Saturas.d:739","Aber ich habe mich bereits dem Feuer verschworen!","Но я уже приносил Клятву огню!","","False","KDW_600_Saturas_OATH_Info_15_03","",""
"Scripts/content/Story/MISSIONS/DIA_Kdw_600_Saturas.d:740","Hmmm ....","Хм-м-м...","","False","KDW_600_Saturas_OATH_Info_14_04","",""
"Scripts/content/Story/MISSIONS/DIA_Kdw_600_Saturas.d:741","Du brichst den Schwur ja nicht!","Это не значит, что ты должен нарушить старый обет!","","","KDW_600_Saturas_OATH_Info_14_05","",""
"Scripts/content/Story/MISSIONS/DIA_Kdw_600_Saturas.d:742","Ähh ... Ich verstehe nicht ...","Ух... Я не понимаю...","","","KDW_600_Saturas_OATH_Info_15_06","",""
"Scripts/content/Story/MISSIONS/DIA_Kdw_600_Saturas.d:743","Du erweiterst deinen Schwur. Damit wirst du zum Magier der beiden Elemente!","Твой обет просто расширится, и ты станешь магом сразу двух стихий!","","","KDW_600_Saturas_OATH_Info_14_07","",""
"Scripts/content/Story/MISSIONS/DIA_Kdw_600_Saturas.d:744","Sowohl die Macht des Feuers als auch das Wissen des Wassers stehen dir dann zur Verfügung!","Тебе будут подвластны и сила Огня, и мудрость Воды!","","","KDW_600_Saturas_OATH_Info_14_08","",""
"Scripts/content/Story/MISSIONS/DIA_Kdw_600_Saturas.d:758","Ich bin bereit, den Eid abzulegen.","Я готов принести клятву.","","","KDW_600_Saturas_KDWAUFNAHME.description","",""
"Scripts/content/Story/MISSIONS/DIA_Kdw_600_Saturas.d:772","Ich bin bereit, den Eid abzulegen.","Я готов принести клятву.","","","KDW_600_Saturas_KDWAUFNAHME_Info_15_01","",""
"Scripts/content/Story/MISSIONS/DIA_Kdw_600_Saturas.d:773","Diener des Feuers, du wirst nun den Segen des Wassers empfangen!","Верный служитель Огня, отныне ты получишь благословение Воды!","","","KDW_600_Saturas_KDWAUFNAHME_Info_14_02","",""
"Scripts/content/Story/MISSIONS/DIA_Kdw_600_Saturas.d:774","Sprich nun die Worte des Eides:","Повторяй за мной слова клятвы...","","False","KDW_600_Saturas_KDWAUFNAHME_Info_14_03","",""
"Scripts/content/Story/MISSIONS/DIA_Kdw_600_Saturas.d:775","Ich schwöre bei den Mächten der Götter ...","Мощью богов я клянусь...","","","KDW_600_Saturas_KDWAUFNAHME_Info_14_04","",""
"Scripts/content/Story/MISSIONS/DIA_Kdw_600_Saturas.d:776","Ich schwöre bei den Mächten der Götter ...","Мощью богов я клянусь...","","","KDW_600_Saturas_KDWAUFNAHME_Info_15_05","",""
"Scripts/content/Story/MISSIONS/DIA_Kdw_600_Saturas.d:777","... und bei der Kraft des heiligen Wassers ...","...и силой священной Воды...","","False","KDW_600_Saturas_KDWAUFNAHME_Info_14_06","",""
"Scripts/content/Story/MISSIONS/DIA_Kdw_600_Saturas.d:778","... und bei der Kraft des heiligen Wassers ...","...и силой священной Воды...","","False","KDW_600_Saturas_KDWAUFNAHME_Info_15_07","",""
"Scripts/content/Story/MISSIONS/DIA_Kdw_600_Saturas.d:779","... dass mein Wissen und Handeln von nun an und auf ewig mit dem Wasser verbunden sei ...","...что знания мои и поступки мои с этого дня и вовеки веков будут едины с Водой...","","False","KDW_600_Saturas_KDWAUFNAHME_Info_14_08","",""
"Scripts/content/Story/MISSIONS/DIA_Kdw_600_Saturas.d:780","... dass mein Wissen und Handeln von nun an und auf ewig mit dem Wasser verbunden sei ...","...что знания мои и поступки мои с этого дня и вовеки веков будут едины с Водой...","","False","KDW_600_Saturas_KDWAUFNAHME_Info_15_09","",""
"Scripts/content/Story/MISSIONS/DIA_Kdw_600_Saturas.d:781","... bis ich einkehre in Beliars Reich und der Quell des Lebens versiegt.","...до тех пор пока тело мое не вернется в чертоги Бельджара и не иссякнет источник моей жизни.","","False","KDW_600_Saturas_KDWAUFNAHME_Info_14_10","",""
"Scripts/content/Story/MISSIONS/DIA_Kdw_600_Saturas.d:782","... bis ich einkehre in Beliars Reich und der Quell des Lebens versiegt.","...до тех пор пока тело мое не вернется в чертоги Бельджара и не иссякнет источник моей жизни.","","False","KDW_600_Saturas_KDWAUFNAHME_Info_15_11","",""
"Scripts/content/Story/MISSIONS/DIA_Kdw_600_Saturas.d:784","Mit diesem Schwur einst du die Kraft des Feuers und den Segen des Wassers in dir.","Этой клятвой ты объединил в себе силу Огня и благословение Воды.","","","KDW_600_Saturas_KDWAUFNAHME_Info_14_12","",""
"Scripts/content/Story/MISSIONS/DIA_Kdw_600_Saturas.d:785","Du verbindest das, was vorher getrennt war. Möge dein Leben ein Zeichen des Bundes der Elemente sein.","Ты связал воедино две противоположности. Так пусть же жизнь твоя послужит знаком объединения стихий!","","","KDW_600_Saturas_KDWAUFNAHME_Info_14_13","",""
"Scripts/content/Story/MISSIONS/DIA_Kdw_600_Saturas.d:786","Trage diese Robe als Zeichen deiner Verbundenheit zum heiligen Wasser und zu Adanos.","Носи это облачение в знак связи со священной Водой и Аданосом.","","","KDW_600_Saturas_KDWAUFNAHME_Info_14_14","",""
"Scripts/content/Story/MISSIONS/DIA_Kdw_600_Saturas.d:810","Kannst du mich unterrichten?","Ты будешь моим наставником?","","","KDW_600_Saturas_LESSON.description","",""
"Scripts/content/Story/MISSIONS/DIA_Kdw_600_Saturas.d:823","Kannst du mich unterrichten?","Ты будешь моим наставником?","","","KDW_600_Saturas_LESSON_Info_15_01","",""
"Scripts/content/Story/MISSIONS/DIA_Kdw_600_Saturas.d:827","Es gibt noch viel zu lernen für dich. Wenn du bereit bist, werde ich dich unterrichten.","Тебе предстоит многому научиться. Мы приступим, как только ты будешь готов.","","","KDW_600_Saturas_LESSON_Info_14_02","",""
"Scripts/content/Story/MISSIONS/DIA_Kdw_600_Saturas.d:831","Es gibt noch einen weiteren Kreis, den du nicht kennst. Wenn du bereit bist, werde ich dich unterrichten.","Есть еще один круг, до сих пор не пройденный тобою. Мы приступим, как только ты будешь готов.","","False","KDW_600_Saturas_LESSON_Info_14_03","",""
"Scripts/content/Story/MISSIONS/DIA_Kdw_600_Saturas.d:835","Du beherrscht bereits den fünften Kreis der Magie! Du weißt alles, was ich weiß.","Ты уже прошел пятый круг магии. Ты знаешь то же, что знаю я.","","False","KDW_600_Saturas_LESSON_Info_14_04","",""
"Scripts/content/Story/MISSIONS/DIA_Kdw_600_Saturas.d:836","Ich kann dir nichts mehr beibringen!","Я не могу больше учить тебя.","","","KDW_600_Saturas_LESSON_Info_14_05","",""
"Scripts/content/Story/MISSIONS/DIA_Kdw_600_Saturas.d:868","Ich bin bereit, in den ersten Kreis aufgenommen zu werden.","Я готов вступить в первый круг.","","False","KDW_600_Saturas_KREIS1_Info_15_01","",""
"Scripts/content/Story/MISSIONS/DIA_Kdw_600_Saturas.d:872","Den ersten der magischen Kreise zu betreten, bedeutet die Anwendung magischer Runen lernen.","Вступив в первый круг, ты научишься использовать магические руны.","","False","KDW_600_Saturas_KREIS1_Info_14_02","",""
"Scripts/content/Story/MISSIONS/DIA_Kdw_600_Saturas.d:873","Jede Rune birgt in sich die Struktur eines speziellen Zaubers.","Каждая руна содержит структуру особого магического заклинания.","","","KDW_600_Saturas_KREIS1_Info_14_03","",""
"Scripts/content/Story/MISSIONS/DIA_Kdw_600_Saturas.d:874","Durch den Einsatz deiner eigenen magischen Energie, bist du in der Lage, den Zauber der Rune zu wirken.","Использовав свою собственную магическую силу, ты сможешь высвободить магию руны.","","","KDW_600_Saturas_KREIS1_Info_14_04","",""
"Scripts/content/Story/MISSIONS/DIA_Kdw_600_Saturas.d:875","Doch anders als Spruchrollen, die auch eine Zauberformel sind, sorgt die magische Kraft, die der Rune innewohnt, dafür, dass die Struktur des Zaubers erhalten bleibt.","Но в отличие от свитков, которые по сути являются магическими формулами, магия рун поддерживает структуру заклинания всегда.","","False","KDW_600_Saturas_KREIS1_Info_14_05","",""
"Scripts/content/Story/MISSIONS/DIA_Kdw_600_Saturas.d:876","Jede Rune ist eine Quelle magischer Kraft, auf die du immer wieder zurückgreifen kannst.","Каждая руна таит в себе магическую силу, воспользоваться которой ты можешь в любой момент.","","","KDW_600_Saturas_KREIS1_Info_14_06","",""
"Scripts/content/Story/MISSIONS/DIA_Kdw_600_Saturas.d:877","Deine eigene magische Kraft verbraucht sich beim Benutzen der Rune, wie bei einer Spruchrolle.","Так же, как и со свитком, в момент, когда ты используешь руну, расходуется твоя собственная магическая сила.","","","KDW_600_Saturas_KREIS1_Info_14_07","",""
"Scripts/content/Story/MISSIONS/DIA_Kdw_600_Saturas.d:878","Mit jedem Kreis, den du lernst, lernst du auch die Möglichkeit, weitere Runen zu benutzen.","С каждым новым кругом ты будешь узнавать о рунах все больше и больше.","","False","KDW_600_Saturas_KREIS1_Info_14_08","",""
"Scripts/content/Story/MISSIONS/DIA_Kdw_600_Saturas.d:879","Nutze die Kraft der Runen, um dich selber zu erkennen.","Используй их силу для того, чтобы познать себя.","","False","KDW_600_Saturas_KREIS1_Info_14_09","",""
"Scripts/content/Story/MISSIONS/DIA_Kdw_600_Saturas.d:909","Ich bin bereit, in den zweiten Kreis aufgenommen zu werden.","Я готов вступить во второй круг.","","False","KDW_600_Saturas_KREIS2_Info_15_01","",""
"Scripts/content/Story/MISSIONS/DIA_Kdw_600_Saturas.d:913","Du hast das Verständnis der Runen gelernt. Nun ist es an der Zeit, dieses Verständnis zu vertiefen.","Ты уже научился понимать руны. Пришло время углубить твои познания.","","","KDW_600_Saturas_KREIS2_Info_14_02","",""
"Scripts/content/Story/MISSIONS/DIA_Kdw_600_Saturas.d:914","Mit dem zweiten Kreis lernst du die Grundsätze stärkerer Kampfzauber und vor allem das Geheimnis der Heilung.","Вступив во второй круг, ты постигнешь основы мощных боевых заклятий и познаешь все секреты целительства.","","False","KDW_600_Saturas_KREIS2_Info_14_03","",""
"Scripts/content/Story/MISSIONS/DIA_Kdw_600_Saturas.d:915","Doch du musst noch viel lernen, willst du die tatsächlichen Geheimnisse der Magie ergründen.","Но для того чтобы познать истинные секреты магии, тебе предстоит многому научиться.","","","KDW_600_Saturas_KREIS2_Info_14_04","",""
"Scripts/content/Story/MISSIONS/DIA_Kdw_600_Saturas.d:916","Du weißt, dass du jede Rune solange einsetzen kannst, bis deine eigene Kraft verbraucht ist.","Ты уже знаешь о том, что можешь использовать любую руну бессчетное число раз, но лишь до тех пор, пока не израсходуешь всю свою магическую силу.","","","KDW_600_Saturas_KREIS2_Info_14_05","",""
"Scripts/content/Story/MISSIONS/DIA_Kdw_600_Saturas.d:917","Aber frage dich, ob es sinnvoll ist. Du hast Macht verliehen bekommen, mit der es dir ein Leichtes ist, Tod und Verderben zu bringen.","Но прежде чем сделать что-либо, подумай о том, есть ли в этом смысл. Ты обладаешь силой, которая позволяет с легкостью сеять смерть и разрушения.","","False","KDW_600_Saturas_KREIS2_Info_14_06","",""
"Scripts/content/Story/MISSIONS/DIA_Kdw_600_Saturas.d:918","Doch der wahrhafte Magier zaubert nur dann, wenn es angebracht ist.","Но истинный маг использует ее лишь по необходимости.","","","KDW_600_Saturas_KREIS2_Info_14_07","",""
"Scripts/content/Story/MISSIONS/DIA_Kdw_600_Saturas.d:919","Erkenne die Situation, dann wirst du die Macht der Runen erkennen.","Научись оценивать ситуацию, и ты познаешь истинную силу рун.","","","KDW_600_Saturas_KREIS2_Info_14_08","",""
"Scripts/content/Story/MISSIONS/DIA_Kdw_600_Saturas.d:949","Ich bin bereit, den dritten Kreis zu betreten","Какие знания сопутствуют третьему кругу?","","False","KDW_600_Saturas_KREIS3_Info_15_01","",""
"Scripts/content/Story/MISSIONS/DIA_Kdw_600_Saturas.d:952","Der dritte Kreis der Magie ist einer der wichtigsten Schritte im Leben eines Magiers. Nicht länger bist du ein Suchender.","Третий круг является одним из важнейших этапов в жизни каждого мага. Достигнув его, ты завершаешь свой поиск.","","False","KDW_600_Saturas_KREIS3_Info_14_02","",""
"Scripts/content/Story/MISSIONS/DIA_Kdw_600_Saturas.d:953","Du bist bereits ein Stück des magischen Weges gegangen. Du hast gelernt die Runen zu nutzen.","Ты уже преодолел значительный этап на пути магии. Ты научился использовать руны.","","","KDW_600_Saturas_KREIS3_Info_14_03","",""
"Scripts/content/Story/MISSIONS/DIA_Kdw_600_Saturas.d:954","Dieses Wissen ist das Fundament für deinen weiteren Weg. Nutze die Runen mit Bedacht.","Это знание послужит основой для следующего этапа. Используй руны осмотрительно.","","","KDW_600_Saturas_KREIS3_Info_14_04","",""
"Scripts/content/Story/MISSIONS/DIA_Kdw_600_Saturas.d:955","Du kannst eine Rune nutzen oder nicht. Aber entscheide dich für eine der Möglichkeiten.","Ты можешь использовать их или нет. Но ты должен определиться с выбором.","","","KDW_600_Saturas_KREIS3_Info_14_05","",""
"Scripts/content/Story/MISSIONS/DIA_Kdw_600_Saturas.d:956","Zögere nicht, deine Macht einzusetzen, wenn du dich einmal entschieden hast.","Сделав выбор, используй свою силу без колебаний.","","","KDW_600_Saturas_KREIS3_Info_14_06","",""
"Scripts/content/Story/MISSIONS/DIA_Kdw_600_Saturas.d:957","Erkenne deinen Weg, dann wirst du die Macht der Entscheidung erkennen.","Найди свой путь, и тогда ты познаешь силу решения.","","","KDW_600_Saturas_KREIS3_Info_14_07","",""
"Scripts/content/Story/MISSIONS/DIA_Kdw_600_Saturas.d:987","Ich bin bereit für den vierten der Kreise.","Я готов вступить в четвертый круг.","","False","KDW_600_Saturas_KREIS4_Info_15_01","",""
