"location","source","target","id","fuzzy","context","translator_comments","developer_comments"
"Scripts/content/Story/MISSIONS/DIA_GRD_203_Bullit.d:43","Wen haben wir denn da? Du bist doch der Typ, den ich getauft habe? Was willst du? Noch mehr Schläge?","Так, кто у нас здесь? Уж не тебя ли я окрестил давеча? Что тебе нужно? Хочешь еще?","","","DIA_Bullit_First_06_00","",""
"Scripts/content/Story/MISSIONS/DIA_GRD_203_Bullit.d:55","Ich bin gekommen, um dir dein großes Maul zu stopfen.","Я пришел заткнуть твою поганую пасть!","","","DIA_Bullit_AufsMAul.description","",""
"Scripts/content/Story/MISSIONS/DIA_GRD_203_Bullit.d:65","Ich bin gekommen, um dir dein großes Maul zu stopfen.","Я пришел заткнуть твою поганую пасть!","","","DIA_Bullit_AufsMAul_15_00","",""
"Scripts/content/Story/MISSIONS/DIA_GRD_203_Bullit.d:66","Ja, dann komm mal her, Bürschchen!","Ха, подойди и попробуй, сынок!","","","DIA_Bullit_AufsMAul_06_01","",""
"Scripts/content/Story/MISSIONS/DIA_GRD_203_Bullit.d:98","Du schon wieder. Ich hätte dich schon am ersten Tag im See versenken sollen!","Снова ты?! Стоило утопить тебя, как только я тебя увидел!","","","DIA_GRD_203_Bullit_Wait4SC_06_01","",""
"Scripts/content/Story/MISSIONS/DIA_GRD_203_Bullit.d:99","Damals hatte ich keine Chance - jetzt ist genau das Gegenteil der Fall.","Да, второго шанса у тебя уже не будет - теперь мы поменялись местами.","","","DIA_GRD_203_Bullit_Wait4SC_15_02","",""
"Scripts/content/Story/MISSIONS/DIA_GRD_203_Bullit.d:100","Du Wurm! Ich hoffe, dass du es mir nicht so einfach machst, wie beim ersten Mal!","Червяк! Я надеюсь, для меня это будет хотя бы сложнее, чем в прошлый раз.","","","DIA_GRD_203_Bullit_Wait4SC_06_03","",""
"Scripts/content/Story/MISSIONS/DIA_GRD_205_Scorpio.d:47","Wer hat DICH denn reingelassen?","Кто впустил ТЕБЯ?","","","DIA_Scorpio_Hello_13_00","",""
"Scripts/content/Story/MISSIONS/DIA_GRD_205_Scorpio.d:48","Thorus.","Торус.","","","DIA_Scorpio_Hello_15_01","",""
"Scripts/content/Story/MISSIONS/DIA_GRD_205_Scorpio.d:49","Und was willst du hier?","И какого черта ты здесь делаешь?","","","DIA_Scorpio_Hello_13_02","",""
"Scripts/content/Story/MISSIONS/DIA_GRD_205_Scorpio.d:52","Ich wollte mal wissen, wie's hier drin aussieht.","Просто зашел посмотреть.","","","DIA_Scorpio_Hello.DIA_Scorpio_Hello_JustLooking","Info_AddChoice",""
"Scripts/content/Story/MISSIONS/DIA_GRD_205_Scorpio.d:53","Ich habe eine Botschaft für die Magier.","У меня есть послание для магов.","","","DIA_Scorpio_Hello.DIA_Scorpio_Hello_Mages","Info_AddChoice",""
"Scripts/content/Story/MISSIONS/DIA_GRD_205_Scorpio.d:56","Ich habe eine Ladung Kraut für Gomez.","Я принес болотник для Гомеза.","","","DIA_Scorpio_Hello.DIA_Scorpio_Hello_Kraut","Info_AddChoice",""
"Scripts/content/Story/MISSIONS/DIA_GRD_205_Scorpio.d:61","Ich bin auf dem Weg zu Gomez. Ich will mich euch anschließen.","Я собираюсь встретиться с Гомезом. Хочу присоединиться к вам.","","","DIA_Scorpio_Hello.DIA_Scorpio_Hello_Join","Info_AddChoice",""
"Scripts/content/Story/MISSIONS/DIA_GRD_205_Scorpio.d:67","Ich wollte mal wissen, wie's hier drin aussieht.","Просто зашел посмотреть.","","","DIA_Scorpio_Hello_JustLooking_15_00","",""
"Scripts/content/Story/MISSIONS/DIA_GRD_205_Scorpio.d:68","Sehr witzig.","Очень смешно.","","","DIA_Scorpio_Hello_JustLooking_13_01","",""
"Scripts/content/Story/MISSIONS/DIA_GRD_205_Scorpio.d:74","Ich habe eine Botschaft für die Magier.","У меня есть послание для магов.","","","DIA_Scorpio_Hello_Mages_15_00","",""
"Scripts/content/Story/MISSIONS/DIA_GRD_205_Scorpio.d:75","Du arbeitest für die Magier? Damit will ich nichts zu tun haben ...","Ты работаешь на магов? Я не хочу с ними связываться...","","","DIA_Scorpio_Hello_Mages_13_01","",""
"Scripts/content/Story/MISSIONS/DIA_GRD_205_Scorpio.d:81","Ich habe eine Ladung Kraut für Gomez.","Я принес болотник для Гомеза.","","","DIA_Scorpio_Hello_Kraut_15_00","",""
"Scripts/content/Story/MISSIONS/DIA_GRD_205_Scorpio.d:82","Dann bring sie in das Haus mit den beiden Wachen vor der Tür.","Отнеси его в дом, который охраняют двое стражников.","","","DIA_Scorpio_Hello_Kraut_13_01","",""
"Scripts/content/Story/MISSIONS/DIA_GRD_205_Scorpio.d:88","Ich bin auf dem Weg zu Gomez. Ich will mich euch anschließen.","Я собираюсь встретиться с Гомезом. Хочу присоединиться к вам.","","","DIA_Scorpio_Hello_Join_15_00","",""
"Scripts/content/Story/MISSIONS/DIA_GRD_205_Scorpio.d:89","Du? Hast du überhaupt schon was für uns geleistet?","Ты? И что такого ты для нас сделал?","","","DIA_Scorpio_Hello_Join_13_01","",""
"Scripts/content/Story/MISSIONS/DIA_GRD_205_Scorpio.d:90","Die Schatten waren zufrieden.","Призраки были мною довольны...","","","DIA_Scorpio_Hello_Join_15_02","",""
"Scripts/content/Story/MISSIONS/DIA_GRD_205_Scorpio.d:91","Von Schatten will hier keiner was hören. Hier drin geben WIR den Ton an.","Никто здесь не желает слышать о Призраках. Здесь МЫ решаем.","","","DIA_Scorpio_Hello_Join_13_03","",""
"Scripts/content/Story/MISSIONS/DIA_GRD_205_Scorpio.d:105","Kannst du mir beibringen zu kämpfen?","Ты можешь научить меня драться?","","","DIA_Scorpio_REFUSETRAIN.description","",""
"Scripts/content/Story/MISSIONS/DIA_GRD_205_Scorpio.d:118","Kannst du mir beibringen zu kämpfen?","Ты можешь научить меня драться?","","","DIA_Scorpio_REFUSETRAIN_15_00","",""
"Scripts/content/Story/MISSIONS/DIA_GRD_205_Scorpio.d:119","Ich unterrichte nur Gardisten. Bis Thorus dich nicht zum Gardisten gemacht hat, musst du dir jemand anderen suchen.","Я тренирую только стражников. Пока Торус не назначит тебя одним из них, ищи кого-нибудь другого.","","","DIA_Scorpio_REFUSETRAIN_13_01","",""
"Scripts/content/Story/MISSIONS/DIA_GRD_205_Scorpio.d:149","War die beste Entscheidung von dir, zu uns zu kommen!","Это лучший выбор, который ты только мог сделать!","","","GRD_205_Scorpio_WELCOME_Info_13_01","",""
"Scripts/content/Story/MISSIONS/DIA_GRD_205_Scorpio.d:163","Kann ich von dir lernen?","Ты можешь чему-нибудь научить меня?","","","GRD_205_Scorpio_CROSSBOW.description","",""
"Scripts/content/Story/MISSIONS/DIA_GRD_205_Scorpio.d:177","Kann ich von dir lernen?","Ты будешь учить меня?","","","GRD_205_Scorpio_CROSSBOW_Info_15_01","",""
"Scripts/content/Story/MISSIONS/DIA_GRD_205_Scorpio.d:178","Wenn du genug Erz hast, zeige ich dir den Umgang mit der Armbrust. Gib mir einfach 200 Erz.","Если у тебя есть руда, я научи тебя пользоваться арбалетом. Но сначала заплати две сотни. ","","","GRD_205_Scorpio_CROSSBOW_Info_13_02","",""
"Scripts/content/Story/MISSIONS/DIA_GRD_205_Scorpio.d:206","Einverstanden. Zeig mir den Umgang mit der Armbrust.","По рукам. Покажи, как нужно с ним обращаться.","","","GRD_205_Scorpio_CROSSBOW_OK_15_01","",""
"Scripts/content/Story/MISSIONS/DIA_GRD_205_Scorpio.d:211","Gut, fangen wir direkt an.","Ладно, начнем.","","","GRD_205_Scorpio_CROSSBOW_OK_13_02","",""
"Scripts/content/Story/MISSIONS/DIA_GRD_205_Scorpio.d:212","Fasse die Armbrust am Schaft an, um ruhig zielen zu können, drücke sie an deine Schulter.","Ты берешься за рукоятку и упираешь ее в плечо. Это поможет тебе лучше прицелиться.","","","GRD_205_Scorpio_CROSSBOW_OK_13_03","",""
"Scripts/content/Story/MISSIONS/DIA_GRD_205_Scorpio.d:213","In den ersten paar Tagen wirst du ein Gefühl haben, als ob dir die Schulter abfällt.","Первые несколько дней тебе будет казаться, что плечо вот-вот отвалится.","","","GRD_205_Scorpio_CROSSBOW_OK_13_04","",""
"Scripts/content/Story/MISSIONS/DIA_GRD_205_Scorpio.d:214","Aber schon nach einer Woche hast du eine Schulter wie aus Stein!","Но через неделю оно будет как камень!","","","GRD_205_Scorpio_CROSSBOW_OK_13_05","",""
"Scripts/content/Story/MISSIONS/DIA_GRD_205_Scorpio.d:215","Visier dein Ziel an und zieh durch. Der Bolzen bekommt mehr Kraft als ein Pfeil durch einen gespannten Bogen, von daher richtest du mehr Schaden an!","Наводи точно на цель и оттягивай стрелу назад. Она полетит куда сильнее, чем из лука, а значит, нанесет больший урон!","","","GRD_205_Scorpio_CROSSBOW_OK_13_06","",""
"Scripts/content/Story/MISSIONS/DIA_GRD_205_Scorpio.d:222","ZWEIHUNDERT ERZ. Jeder einzelne Brocken in meine Hand. Wenn du das Erz nicht hast, dann besorge es dir!","Я сказал - ДВЕ СОТНИ КУСКОВ РУДЫ, здесь, у меня в руках. Возвращайся, когда у тебя будет чем заплатить!","","","GRD_205_Scorpio_CROSSBOW_OK_13_07","",""
"Scripts/content/Story/MISSIONS/DIA_GRD_205_Scorpio.d:236","Zeige mir mehr über den Umgang mit der Armbrust","Расскажи мне еще что-нибудь об арбалете.","","","GRD_205_Scorpio_CROSSBOW2.description","",""
"Scripts/content/Story/MISSIONS/DIA_GRD_205_Scorpio.d:249","Zeige mir mehr über den Umgang mit der Armbrust","Расскажи мне еще что-нибудь об арбалете.","","","GRD_205_Scorpio_CROSSBOW2_Info_15_01","",""
"Scripts/content/Story/MISSIONS/DIA_GRD_205_Scorpio.d:250","Kostet dich 300 Erz.","Это обойдется тебе в три сотни кусков руды.","","","GRD_205_Scorpio_CROSSBOW2_Info_13_02","",""
"Scripts/content/Story/MISSIONS/DIA_GRD_205_Scorpio.d:264","Lass uns direkt anfangen.","Начнем прямо сейчас.","","","GRD_205_Scorpio_CROSSBOW2_OK_15_01","",""
"Scripts/content/Story/MISSIONS/DIA_GRD_205_Scorpio.d:269","Gut. Du bekommst mehr Treffsicherheit und Ruhe, wenn du beim Schuss in die Knie gehst","Ладно. Твои выстрелы будут более точными, если перед стрельбой ты немного присядешь на колено.","","False","GRD_205_Scorpio_CROSSBOW2_OK_13_02","",""
"Scripts/content/Story/MISSIONS/DIA_GRD_205_Scorpio.d:270","Lerne die Geschwindigkeit von beweglichen Zielen einzuschätzen.","Тебе предстоит научиться рассчитывать скорость, с которой движется цель.","","","GRD_205_Scorpio_CROSSBOW2_OK_13_03","",""
"Scripts/content/Story/MISSIONS/DIA_GRD_205_Scorpio.d:271","Schieß in die Laufbahn des Zieles, dann wirst du es treffen und es dadurch auch in seiner Bewegung aufhalten.","Выпускай стрелу с должным упреждением по пути движущейся цели, чтобы замедлить или остановить ее.","","","GRD_205_Scorpio_CROSSBOW2_OK_13_04","",""
"Scripts/content/Story/MISSIONS/DIA_GRD_205_Scorpio.d:272","Wenn du mehrere Ziele hast, dann verschwende keine Zeit, sondern nagel' alle Ziele mit gezielten Schüssen fest und strecke sie abwechselnd nieder.","Если целей несколько, не трать зря времени - снимай их одну за другой непрерывной серией выстрелов.","","","GRD_205_Scorpio_CROSSBOW2_OK_13_05","",""
"Scripts/content/Story/MISSIONS/DIA_GRD_205_Scorpio.d:273","Du hast jetzt alles gelernt, was ich dir beibringen kann.","Теперь я научил тебя всему, что знал сам.","","","GRD_205_Scorpio_CROSSBOW2_OK_13_06","",""
"Scripts/content/Story/MISSIONS/DIA_GRD_205_Scorpio.d:280","Junge, sieh erst mal zu, dass du irgendwo DREIHUNDERT Erz auftreibst.","Прежде найди где-нибудь ТРИ СОТНИ кусков руды.","","","GRD_205_Scorpio_CROSSBOW2_OK_13_07","",""
"Scripts/content/Story/MISSIONS/DIA_GRD_205_Scorpio.d:309","Hey, keine Angst, Mann, komm mal rüber!","Эй, не бойся, парень. Иди сюда!","","","GRD_205_Scorpio_HeyPC_Info_13_01","",""
"Scripts/content/Story/MISSIONS/DIA_GRD_205_Scorpio.d:321","Alles klar bei dir?","Все в порядке?","","","GRD_205_Scorpio_BANISHED.description","",""
"Scripts/content/Story/MISSIONS/DIA_GRD_205_Scorpio.d:334","Alles klar bei dir?","С тобой все в порядке?","","","GRD_205_Scorpio_BANISHED_Info_15_01","",""
"Scripts/content/Story/MISSIONS/DIA_GRD_205_Scorpio.d:335","Ich habe mich hier her verzogen. Für den Mist, den die Gardisten gerade abziehen, habe ich nichts übrig.","Я здесь прячусь. Меня не волнует барахло, которое растаскивают эти стражники.","","","GRD_205_Scorpio_BANISHED_Info_13_02","",""
"Scripts/content/Story/MISSIONS/DIA_GRD_205_Scorpio.d:336","Aber ich habe mir ein paar gute Stücke aus der Waffenkammer mitgenommen. Wenn du eine Waffe brauchst, sag mir Bescheid.","Но я прихватил несколько отличных вещичек из арсенала. Если тебе понадобится оружие, обращайся ко мне.","","","GRD_205_Scorpio_BANISHED_Info_13_03","",""
"Scripts/content/Story/MISSIONS/DIA_GRD_205_Scorpio.d:356","Zeig mir deine Ware","Покажи мне, что у тебя есть.","","","GRD_205_Scorpio_TRADE.description","",""
"Scripts/content/Story/MISSIONS/DIA_GRD_205_Scorpio.d:369","Zeig mir deine Ware.","Покажи, что у тебя есть.","","","GRD_205_Scorpio_TRADE_Info_15_01","",""
"Scripts/content/Story/MISSIONS/DIA_GRD_208_Cutter.d:33","Ihr habt ganz schön viel Platz hier in der Burg.","Какой большой замок.","","","DIA_Cutter_Hello.description","",""
"Scripts/content/Story/MISSIONS/DIA_GRD_208_Cutter.d:46","Ihr habt ganz schön viel Platz hier in der Burg.","Какой большой замок.","","","DIA_Cutter_Hello_15_00","",""
"Scripts/content/Story/MISSIONS/DIA_GRD_208_Cutter.d:47","Ich habe dich hier noch nie gesehen. Wer bist du?","Кажется, раньше я тебя не видел. Ты кто?","","","DIA_Cutter_Hello_08_01","",""
"Scripts/content/Story/MISSIONS/DIA_GRD_208_Cutter.d:48","Ich bin neu hier. Wollte mich mal ein bisschen umsehen.","Я новенький. Просто хотел немного осмотреться.","","","DIA_Cutter_Hello_15_02","",""
"Scripts/content/Story/MISSIONS/DIA_GRD_208_Cutter.d:61","Was kannst du mir über die Burg sagen?","Ты можешь рассказать мне о замке?","","","DIA_Cutter_Burg.description","",""
"Scripts/content/Story/MISSIONS/DIA_GRD_208_Cutter.d:74","Was kannst du mir über die Burg sagen?","Ты можешь рассказать мне о замке?","","","DIA_Cutter_Burg_15_00","",""
"Scripts/content/Story/MISSIONS/DIA_GRD_208_Cutter.d:75","Nach dem großen Aufstand haben sich Gomez und seine Jungs die Burg unter den Nagel gerissen.","После Восстания его занял Гомез со своей шайкой.","","","DIA_Cutter_Burg_08_01","",""
"Scripts/content/Story/MISSIONS/DIA_GRD_208_Cutter.d:76","Ich hab' damals schnell gemerkt, dass es besser ist, sich ihm anzuschließen.","Сейчас лучше быть на их стороне - это я знаю точно.","","","DIA_Cutter_Burg_08_02","",""
"Scripts/content/Story/MISSIONS/DIA_GRD_208_Cutter.d:77","Schon als wir damals noch alle im Kerker eingepfercht waren, und in den Minen schuften mussten hatte er unter den Gefangenen am meisten zu sagen.","Даже когда мы сидели в подземельях и горбатились в шахтах, большинство каторжников подчинялось его приказам.","","","DIA_Cutter_Burg_08_03","",""
"Scripts/content/Story/MISSIONS/DIA_GRD_208_Cutter.d:78","Es gibt Kerker unter der Burg?","Значит, под замком есть подземелья?","","","DIA_Cutter_Burg_15_04","",""
"Scripts/content/Story/MISSIONS/DIA_GRD_208_Cutter.d:79","Ja, aber sie sind heute leer. Seit dem großen Aufstand will da niemand mehr rein.","Да, но сейчас они пустуют. Туда даже никто не спускался после Восстания.","","","DIA_Cutter_Burg_08_05","",""
"Scripts/content/Story/MISSIONS/DIA_GRD_208_Cutter.d:92","Wie ist das Leben als Gardist?","Каково это - быть стражником?","","","DIA_Cutter_PERM.description","",""
"Scripts/content/Story/MISSIONS/DIA_GRD_208_Cutter.d:105","Wie ist das Leben als Gardist?","Каково это - быть стражником?","","","DIA_Cutter_PERM_15_00","",""
"Scripts/content/Story/MISSIONS/DIA_GRD_208_Cutter.d:106","Ruhig. Wir sind das größte und stärkste Lager in der Kolonie - mit uns legt sich keiner an.","Довольно тихое местечко. Мы живем в самом большом и сильном Лагере колонии. Никто не смеет напасть на нас.","","","DIA_Cutter_PERM_08_01","",""
"Scripts/content/Story/MISSIONS/DIA_GRD_208_Cutter.d:107","Verstehe.","Понятно.","","","DIA_Cutter_PERM_15_02","",""
"Scripts/content/Story/MISSIONS/DIA_GRD_208_Cutter.d:132","Du hast die richtige Entscheidung getroffen. Das Leben als Gardist wird dir gefallen!","Ты сделал правильный выбор. Тебе понравится быть стражником!","","","GRD_208_Cutter_WELCOME_Info_08_01","",""
"Scripts/content/Story/MISSIONS/DIA_GRD_210_Scatty.d:33","Was machst du hier?","Чем ты занимаешься?","","","DIA_Scatty_WhatDoYouDo.description","",""
"Scripts/content/Story/MISSIONS/DIA_GRD_210_Scatty.d:43","Was machst du hier?","В чем заключается твоя работа?","","","DIA_Scatty_WhatDoYouDo_15_00","",""
"Scripts/content/Story/MISSIONS/DIA_GRD_210_Scatty.d:44","Ich kümmere mich um die Arena. Organisiere die Wetten, heuere neue Kämpfer an und so weiter ...","Я отвечаю за арену - организую ставки, нанимаю новых бойцов... и все такое.","","","DIA_Scatty_WhatDoYouDo_01_01","",""
"Scripts/content/Story/MISSIONS/DIA_GRD_210_Scatty.d:60","Ich will mich dem Lager anschließen. Kannst du mir dabei helfen?","Я хочу присоединиться к этому Лагерю. Ты можешь мне помочь?","","","DIA_Scatty_JoinOC.description","",""
"Scripts/content/Story/MISSIONS/DIA_GRD_210_Scatty.d:73","Ich will mich dem Lager anschließen. Kannst du mir dabei helfen?","Я хочу присоединиться к этому Лагерю. Ты можешь мне помочь?","","","DIA_Scatty_JoinOC_15_00","",""
"Scripts/content/Story/MISSIONS/DIA_GRD_210_Scatty.d:74","Wenn du es schaffst, mich zu beeindrucken - vielleicht.","Мог бы, если тебе удастся произвести на меня впечатление.","","","DIA_Scatty_JoinOC_01_01","",""
"Scripts/content/Story/MISSIONS/DIA_GRD_210_Scatty.d:75","Einige der besten Kämpfer aller drei Lager kommen hier her um sich zu messen.","Здесь соревнуются лучшие бойцы всех трех Лагерей.","","","DIA_Scatty_JoinOC_01_02","",""
"Scripts/content/Story/MISSIONS/DIA_GRD_210_Scatty.d:76","Fordere einen von ihnen heraus und kämpfe gegen ihn. Je nachdem, wie gut du dich schlägst, wird mein Urteil über dich ausfallen.","Вызови на бой одного из них. Поглядим, насколько ты хорош, и, может быть, я подумаю о твоей просьбе.","","","DIA_Scatty_JoinOC_01_03","",""
"Scripts/content/Story/MISSIONS/DIA_GRD_210_Scatty.d:97","Ich habe gegen Kirgo gekämpft!","Я дрался с Кирго!","","","DIA_Scatty_KirgoSuccess.description","",""
"Scripts/content/Story/MISSIONS/DIA_GRD_210_Scatty.d:114","Ich habe gegen Kirgo gekämpft!","Я дрался с Кирго!","","","DIA_Scatty_KirgoSuccess_15_00","",""
"Scripts/content/Story/MISSIONS/DIA_GRD_210_Scatty.d:117","Und du hast dich besiegen lassen!","Да, и проиграл!","","","DIA_Scatty_KirgoSuccess_01_01","",""
"Scripts/content/Story/MISSIONS/DIA_GRD_210_Scatty.d:118","Du erwartest hoffentlich nicht, dass ich durch dein Versagen beeindruckt bin ...","Думаю, ты не надеялся удивить меня этим...","","","DIA_Scatty_KirgoSuccess_01_02","",""
"Scripts/content/Story/MISSIONS/DIA_GRD_210_Scatty.d:125","Und du hast ihn geschafft! Nicht schlecht für einen Anfänger wie dich! Ich bin beeindruckt!","И ты победил его! Совсем неплохо для новичка! Я удивлен!","","","DIA_Scatty_KirgoSuccess_01_03","",""
"Scripts/content/Story/MISSIONS/DIA_GRD_210_Scatty.d:142","Ich bin gegen Kharim angetreten!","Я сражался с Харимом!","","","DIA_Scatty_KHARIMSuccess.description","",""
"Scripts/content/Story/MISSIONS/DIA_GRD_210_Scatty.d:159","Ich bin gegen Kharim angetreten!","Я сражался с Харимом!","","","DIA_Scatty_KHARIMSuccess_15_00","",""
"Scripts/content/Story/MISSIONS/DIA_GRD_210_Scatty.d:162","Er hat dir ganz schön in den Arsch getreten.","Да, и он надрал тебе задницу!","","","DIA_Scatty_KHARIMSuccess_01_01","",""
"Scripts/content/Story/MISSIONS/DIA_GRD_210_Scatty.d:165","Trotzdem hast du dir den richtigen Gegner gewählt! Ich kann diese Bastarde aus dem Neuen Lager nicht ausstehen.","Ты правильно выбрал противника. Нельзя терпеть этих ублюдков из Нового Лагеря.","","","DIA_Scatty_KHARIMSuccess_01_02","",""
"Scripts/content/Story/MISSIONS/DIA_GRD_210_Scatty.d:166","Scheint dir ja genauso zu gehen - so jemanden können wir hier brauchen!","Похоже, ты это понимаешь - как раз такие люди нужны нам!","","","DIA_Scatty_KHARIMSuccess_01_03","",""
"Scripts/content/Story/MISSIONS/DIA_GRD_210_Scatty.d:175","Und du hast ihn umgehauen! Ich muss schon sagen, nicht schlecht. Er war immer einer der besten Kämpfer hier.","И ты победил его! Должен признать, это было неплохо. Его всегда считали одним из лучших бойцов.","","","DIA_Scatty_KHARIMSuccess_01_04","",""
"Scripts/content/Story/MISSIONS/DIA_GRD_210_Scatty.d:176","Du hast mich schwer beeindruckt!","Ты удивил меня!","","","DIA_Scatty_KHARIMSuccess_01_05","",""
"Scripts/content/Story/MISSIONS/DIA_GRD_210_Scatty.d:193","Wieso lasst ihr die Leute aus den anderen Lagern hier kämpfen?","Почему ты позволяешь бойцам из других Лагерей драться здесь?","","","DIA_Scatty_OtherCamps.description","",""
"Scripts/content/Story/MISSIONS/DIA_GRD_210_Scatty.d:206","Ich dachte, das Alte und das Neue Lager verstehen sich nicht besonders gut - wieso lasst ihr ihre Leute hier kämpfen?","Мне казалось, что Новый Лагерь и Старый Лагерь не очень-то ладят между собой - так почему же ты позволяешь этим людям сражаться здесь?","","","DIA_Scatty_OtherCamps_15_00","",""
"Scripts/content/Story/MISSIONS/DIA_GRD_210_Scatty.d:207","Ganz einfach: Wenn es hier einmal die Woche einen Kampf gibt, sehen es die Buddler am liebsten, wenn einer der Banditen aus dem Neuen Lager was aufs Maul bekommt.","Все очень просто: они дерутся здесь один раз в неделю, и рудокопам очень нравится смотреть, как раскатывают по земле воров из Нового Лагеря.","","","DIA_Scatty_OtherCamps_01_01","",""
"Scripts/content/Story/MISSIONS/DIA_GRD_210_Scatty.d:208","Wenn einer von denen kämpft, wird mehr gewettet - das ist gut!","Когда дерется один из них, люди делают больше ставок - и это, как ты понимаешь, совсем не плохо.","","","DIA_Scatty_OtherCamps_01_02","",""
"Scripts/content/Story/MISSIONS/DIA_GRD_210_Scatty.d:209","Ich persönlich kann die Schweine aus dem Neuen Lager ja nicht ausstehen - aber Geschäft ist nun mal Geschäft ...","Лично я терпеть не могу этих наглецов из Нового Лагеря - но бизнес есть бизнес...","","","DIA_Scatty_OtherCamps_01_03","",""
"Scripts/content/Story/MISSIONS/DIA_GRD_210_Scatty.d:222","Ich will wetten!","Я хочу сделать ставку.","","","DIA_Scatty_WannaBet.description","",""
"Scripts/content/Story/MISSIONS/DIA_GRD_210_Scatty.d:235","Ich will wetten.","Я хочу сделать ставку.","","","DIA_Scatty_WannaBet_15_00","",""
"Scripts/content/Story/MISSIONS/DIA_GRD_210_Scatty.d:236","Aber im Moment findet kein Kampf statt.","Но сейчас же никто не дерется.","","","DIA_Scatty_WannaBet_01_01","",""
