"location","source","target","id","fuzzy","context","translator_comments","developer_comments"
"Scripts/content/Story/MISSIONS/DIA_XardasDemon.d:20","... Sterblicher? ... Wer, ich? ... Ich geh ja schon!","... Marwol? ... Pwy, fi? ... Dwi'n mynd yn barod!","","False","Info_Saturas_EXIT_15_01","",""
"Scripts/content/Story/MISSIONS/DIA_XardasDemon.d:55","Moment... Wer... Wer spricht hier.","Eiliad... Pwy... Pwy sy'n siarad yma.","","False","Info_XardasDemon_INTRO_15_01","",""
"Scripts/content/Story/MISSIONS/DIA_XardasDemon.d:57","DUUUU sprichst zu mir ??? Wie ... wie kommst du in meinen Kopf?","WYT TI'n siarad â mi ??? Sut ... sut wyt ti'n dod i mewn i'm pen?","","False","Info_XardasDemon_INTRO_15_02","",""
"Scripts/content/Story/MISSIONS/DIA_XardasDemon.d:59","Du bist was? ... der Diener deines Herren?","Wyt ti beth? ... gwas i'th feistr?","","False","Info_XardasDemon_INTRO_15_03","",""
"Scripts/content/Story/MISSIONS/DIA_XardasDemon.d:60","Du erscheinst mir eher wie eine Kreatur der Hölle!","Wyt ti'n ymddangos i mi fel creadur o uffern!","","False","Info_XardasDemon_INTRO_15_04","",""
"Scripts/content/Story/MISSIONS/DIA_XardasDemon.d:62","Ich soll schweigen?","Ddylwn i fod yn dawel?","","False","Info_XardasDemon_INTRO_15_05","",""
"Scripts/content/Story/MISSIONS/DIA_XardasDemon.d:74","Heißt Dein Herr und Meister zufällig Xardas?","Oes enw dy feistr Xardas?","","False","Info_XardasDemon_MASTERWHO.description","",""
"Scripts/content/Story/MISSIONS/DIA_XardasDemon.d:87","Heißt dein Herr und Meister zufällig Xardas?","Oes enw dy feistr Xardas?","","False","Info_XardasDemon_MASTERWHO_15_01","",""
"Scripts/content/Story/MISSIONS/DIA_XardasDemon.d:89","Aha ... Namen sind also unwichtig ... Okay.","Aha ... felly mae enwau yn ddi-nod ... Iawn.","","False","Info_XardasDemon_MASTERWHO_15_02","",""
"Scripts/content/Story/MISSIONS/DIA_XardasDemon.d:90","Ich gehe einfach mal davon aus, dass das hier der Turm von Xardas ist.","Dw i'n cymryd yn ganiataol bod hwn yma'n dwr Xardas.","","False","Info_XardasDemon_MASTERWHO_15_03","",""
"Scripts/content/Story/MISSIONS/DIA_XardasDemon.d:102","Ich muss mit deinem Meister sprechen!","Rhaid i mi siarad â'th feistr!","","False","Info_XardasDemon_MASTERHOW.description","",""
"Scripts/content/Story/MISSIONS/DIA_XardasDemon.d:115","Ich muss mit deinem Meister sprechen!","Rhaid i mi siarad â'th feistr!","","False","Info_XardasDemon_MASTERHOW_15_01","",""
"Scripts/content/Story/MISSIONS/DIA_XardasDemon.d:117","... Ich? ... unwürdig?? ... Was für ein Test???","... Fi? ... annheilwng?? ... Beth am brofiad???","","False","Info_XardasDemon_MASTERHOW_15_02","",""
"Scripts/content/Story/MISSIONS/DIA_XardasDemon.d:119","... Aaahhhh ... Ich verstehe ... wer deinen Meister sprechen will, muss sich würdig erweisen!","... Aaahhhh ... Dw i'n deall ... rhaid i unrhyw un sy'n dymuno siarad â'th feistr brofi ei fod yn haeddiannol!","","False","Info_XardasDemon_MASTERHOW_15_03","",""
"Scripts/content/Story/MISSIONS/DIA_XardasDemon.d:120","... Moment, wie war das? ... Der Beweis? ... Sieg über was? ... Sieg über die Elemente?","... Eiliad, sut oedd hynny? ... Y dystiolaeth? ... Buddugoliaeth dros beth? ... Buddugoliaeth dros yr elfennau?","","False","Info_XardasDemon_MASTERHOW_15_04","",""
"Scripts/content/Story/MISSIONS/DIA_XardasDemon.d:121","... Stein? ... Eis? ... Feuer?","... Carreg? ... Iâ? ... Tân?","","False","Info_XardasDemon_MASTERHOW_15_05","",""
"Scripts/content/Story/MISSIONS/DIA_XardasDemon.d:138","Du sprichst in Rätseln!","Wyt ti'n siarad mewn dirgelion!","","False","Info_XardasDemon_NOHEART.description","",""
"Scripts/content/Story/MISSIONS/DIA_XardasDemon.d:155","Du sprichst in Rätseln!","Wyt ti'n siarad mewn dirgelion!","","False","Info_XardasDemon_NOHEART_15_01","",""
"Scripts/content/Story/MISSIONS/DIA_XardasDemon.d:157","... Das hast du schon mal gesagt, du wiederholst dich!","... Wyt ti wedi dweud hynny o'r blaen, wyt ti'n ailadrodd dy hun!","","False","Info_XardasDemon_NOHEART_15_02","",""
"Scripts/content/Story/MISSIONS/DIA_XardasDemon.d:158","... Du willst Beweise für den Sieg über die Elemente Feuer, Eis und Stein!","... Wyt ti eisiau tystiolaeth o'r fuddugoliaeth dros yr elfennau tân, iâ a cherrig!","","False","Info_XardasDemon_NOHEART_15_03","",""
"Scripts/content/Story/MISSIONS/DIA_XardasDemon.d:169","... Was? ... Aha! ... Ein würdiger Beweis!","... Beth? ... Aha! ... Tystiolaeth gwerth chweil!","","False","Info_XardasDemon_GIVEHEART_15_01","",""
"Scripts/content/Story/MISSIONS/DIA_XardasDemon.d:170","... Fehlen? ... Zwei fehlen noch?","... Methu? ... Mae dau ar goll eto?","","False","Info_XardasDemon_GIVEHEART_15_02","",""
"Scripts/content/Story/MISSIONS/DIA_XardasDemon.d:176","... Die Dualität? ... Der zweite Beweis?","... Y ddwyoliaeth? ... Y ail dystiolaeth?","","False","Info_XardasDemon_GIVEHEART_15_03","",""
"Scripts/content/Story/MISSIONS/DIA_XardasDemon.d:177","... Einer bleibt noch?","... Un yn dal i fynd?","","False","Info_XardasDemon_GIVEHEART_15_04","",""
"Scripts/content/Story/MISSIONS/DIA_XardasDemon.d:183","... Vollkommenheit? ... Ich bin würdig?","... Perffeithrwydd? ... Dw i'n haeddu?","","False","Info_XardasDemon_GIVEHEART_15_05","",""
"Scripts/content/Story/MISSIONS/DIA_XardasDemon.d:184","Wenn das so ist, dann wünsche ich jetzt, deinen Meister zu sprechen!","Os dyna yw'r achos, hoffwn siarad â'th feistr nawr!","","False","Info_XardasDemon_GIVEHEART_15_06","",""
"Scripts/content/Story/MISSIONS/DIA_XardasDemon.d:185","... Gegenbeweis? ... Was für einen Gegenbeweis? ... Eine Rune? ... Eine Rune für mich?","... Gwrthddystiolaeth? ... Pa fath o wrthddystiolaeth? ... Rhŵn? ... Rhŵn i mi?","","False","Info_XardasDemon_GIVEHEART_15_07","",""
"Scripts/content/Story/MISSIONS/DIA_XardasDemon.d:186","Nun, dann nehme ich die Rune der Teleportation als Zeichen der Würde an mich!","Wel, yna dw i'n derbyn y Rhŵn telebortio fel arwydd o urddas!","","False","Info_XardasDemon_GIVEHEART_15_08","",""
"Scripts/content/Story/MISSIONS/DIA_XardasDemon.d:201","Ich habe hier das Herz eines Steingolems!","Mae gen i galon golem carreg yma!","","False","Info_XardasDemon_STONEHEART.description","",""
"Scripts/content/Story/MISSIONS/DIA_XardasDemon.d:215","Ich habe hier das Herz eines Steingolems!","Mae gen i galon golem carreg yma!","","False","Info_XardasDemon_STONEHEART_15_01","",""
"Scripts/content/Story/MISSIONS/DIA_XardasDemon.d:232","Ist dieses Herz eines Eisgolems ein Beweis?","Ai'r galon hon o golem iâ yw'r dystiolaeth?","","False","Info_XardasDemon_ICEHEART.description","",""
"Scripts/content/Story/MISSIONS/DIA_XardasDemon.d:246","Ist dieses Herz eines Eisgolems ein Beweis?","Ai'r galon hon o golem iâ yw'r dystiolaeth?","","False","Info_XardasDemon_ICEHEART_15_01","",""
"Scripts/content/Story/MISSIONS/DIA_XardasDemon.d:262","Was ist mit diesem Herz des Feuergolems?","Beth am y galon hon o Golem Tân?","","False","Info_XardasDemon_FIREHEART.description","",""
"Scripts/content/Story/MISSIONS/DIA_XardasDemon.d:276","Was ist mit diesem Herz des Feuergolems?","Beth am y galon hon o Golem Tân?","","False","Info_XardasDemon_FIREHEART_15_01","",""
