"location","source","target","id","fuzzy","context","translator_comments","developer_comments"
"Scripts/content/Story/MISSIONS/DIA_Sld_761_Soeldner.d:89","Ich wollte mir nur mal das Camp ansehen.","Chciałem się trochę rozejrzeć po Obozie.","","","DIA_SLD_761_Soeldner_UMSEHEN_INFO_15_01","",""
"Scripts/content/Story/MISSIONS/DIA_Sld_761_Soeldner.d:90","Dann bist du hier wohl falsch, hier ist der Mineneingang, und der ist tabu für dich.","To trafiłeś w niewłaściwe miejsce. To jest wejście do kopalni. Nie możesz się tutaj kręcić.","","","DIA_SLD_761_Soeldner_UMSEHEN_INFO_03_02","",""
"Scripts/content/Story/MISSIONS/DIA_Sld_761_Soeldner.d:100","Ich wollte mir nur mal die Mine ansehen.","Chciałem tylko obejrzeć kopalnię.","","","DIA_SLD_761_Soeldner_INMINE.description","",""
"Scripts/content/Story/MISSIONS/DIA_Sld_761_Soeldner.d:110","Ich wollte mir nur mal die Mine ansehen.","Chciałem tylko obejrzeć kopalnię.","","","DIA_SLD_761_Soeldner_INMINE_INFO_15_01","",""
"Scripts/content/Story/MISSIONS/DIA_Sld_761_Soeldner.d:111","Du siehst doch, dass die Mine abgeschlossen ist, also hier gibt´s nichts zu sehen.","Jak widzisz, kopalnia jest zamknięta. Nie ma tu nic ciekawego do oglądania.","","","DIA_SLD_761_Soeldner_INMINE_INFO_03_02","",""
"Scripts/content/Story/MISSIONS/DIA_Sld_761_Soeldner.d:121","Kann man da gar nichts machen?","Może się jakoś dogadamy?","","","DIA_SLD_761_Soeldner_Bribe.description","",""
"Scripts/content/Story/MISSIONS/DIA_Sld_761_Soeldner.d:134","Kann man da gar nichts machen?","Może się jakoś dogadamy?","","","DIA_SLD_761_Soeldner_Bribe_INFO_15_01","",""
"Scripts/content/Story/MISSIONS/DIA_Sld_761_Soeldner.d:135","Was sollte man da machen können?","A o czym tu niby gadać?","","","DIA_SLD_761_Soeldner_Bribe_INFO_03_02","",""
"Scripts/content/Story/MISSIONS/DIA_Sld_761_Soeldner.d:136","Moment mal, wenn du versucht, mich zu bestechen, dann bist du hier an der falschen Adresse.","Sekundę, jeśli próbujesz mnie przekupić, to trafiłeś na niewłaściwego człowieka.","","","DIA_SLD_761_Soeldner_Bribe_INFO_03_03","",""
"Scripts/content/Story/MISSIONS/DIA_Sld_761_Soeldner.d:137","Nein, ich wollte niemanden bestechen, ich dachte nur..","Nie próbuję nikogo przekupić. Pomyślałem tylko...","","","DIA_SLD_761_Soeldner_Bribe_INFO_15_04","",""
"Scripts/content/Story/MISSIONS/DIA_Sld_761_Soeldner.d:138","Ich glaub', ich geh' dann besser.","Lepiej już sobie pójdę.","","","DIA_SLD_761_Soeldner_Bribe_INFO_15_05","",""
