"location","source","target","id","fuzzy","context","translator_comments","developer_comments"
"Scripts/content/Story/MISSIONS/DIA_Non_1500_Gilbert.d:46","Was machst du denn hier? Hab nicht oft Besuch hier oben, hehe!","Co tu robisz? Nie miewam tu zbyt często gości, he he!","","False","DIA_Gilbert_First_04_00","",""
"Scripts/content/Story/MISSIONS/DIA_Non_1500_Gilbert.d:47","War ne gute Leistung von dir, mein Versteck zu finden.","Widzę, że niezły cwaniak z ciebie. Tak znaleźć moją kryjówkę, no no!","","False","DIA_Gilbert_First_04_01","",""
"Scripts/content/Story/MISSIONS/DIA_Non_1500_Gilbert.d:62","Was machst du hier?","Co tu robisz?","","False","DIA_Gilbert_Hallo.description","",""
"Scripts/content/Story/MISSIONS/DIA_Non_1500_Gilbert.d:72","Was machst du hier?","Co tu robisz?","","False","DIA_Gilbert_Hallo_15_00","",""
"Scripts/content/Story/MISSIONS/DIA_Non_1500_Gilbert.d:73","Ich hatte die Schnauze voll vom alten Lager. Hatte Ärger mit Gomez Leuten. Ist aber schon ne Weile her.","Miałem już dość Starego Obozu. Podpadłem paru ludziom Gomeza. To było dawno temu.","","False","DIA_Gilbert_Hallo_04_01","",""
"Scripts/content/Story/MISSIONS/DIA_Non_1500_Gilbert.d:74","Schätze, jetzt kräht kein Hahn mehr danach. Aber ich bleibe hier. Im alten Lager rennen mir zu viele Schwachköpfe rum.","Teraz pewnie nikt już o mnie nie pamięta, ale ja się stąd nie ruszam. Jak na mój gust - w Starym Obozie wciąż jest za dużo tępych osiłków.","","False","DIA_Gilbert_Hallo_04_02","",""
"Scripts/content/Story/MISSIONS/DIA_SfB_1000_Senyan.d:33","Du kommst aus der Freien Mine, richtig?","Przybywasz z Wolnej Kopalni, tak?","","False","DIA_Senyan_Hello.description","",""
"Scripts/content/Story/MISSIONS/DIA_SfB_1000_Senyan.d:43","Du kommst aus der Freien Mine, richtig?","Przybywasz z Wolnej Kopalni, tak?","","False","DIA_Senyan_Hello_15_00","",""
"Scripts/content/Story/MISSIONS/DIA_SfB_1000_Senyan.d:44","Richtig. Wie hast du das bloß rausgefunden?","Tak. Skąd wiesz?","","False","DIA_Senyan_Hello_01_01","",""
"Scripts/content/Story/MISSIONS/DIA_SfB_1000_Senyan.d:58","Ich will nur mit dir reden.","Chcę z tobą chwilę porozmawiać.","","False","DIA_Senyan_JustTalk.description","",""
"Scripts/content/Story/MISSIONS/DIA_SfB_1000_Senyan.d:71","Ich will nur mit dir reden.","Chcę z tobą chwilę porozmawiać.","","False","DIA_Senyan_JustTalk_15_00","",""
"Scripts/content/Story/MISSIONS/DIA_SfB_1000_Senyan.d:72","Ich bin nicht zum Reden hier.","Nie przyszedłem tutaj, żeby gadać.","","False","DIA_Senyan_JustTalk_01_01","",""
"Scripts/content/Story/MISSIONS/DIA_SfB_1001_Schuerfer.d:34","Na, wie steht's in der Mine?","Co słychać w kopalni?","","False","DIA_Sfb_1001_Hello.description","",""
"Scripts/content/Story/MISSIONS/DIA_SfB_1001_Schuerfer.d:44","Na, wie steht's in der Mine?","Co słychać w kopalni?","","False","DIA_Sfb_1001_Hello_15_00","",""
"Scripts/content/Story/MISSIONS/DIA_SfB_1001_Schuerfer.d:45","Wir haben das Meiste hinter uns. Nur noch wenige Wochen, dann haben wir genug.","Większość roboty mamy już za sobą. Jeszcze tylko kilka tygodni i będziemy mieli dość.","","False","DIA_Sfb_1001_Hello_02_01","",""
"Scripts/content/Story/MISSIONS/DIA_SfB_1037_Swiney.d:33","Wer bist du?","Kim jesteś?","","False","Info_Swiney_Hello.description","",""
"Scripts/content/Story/MISSIONS/DIA_SfB_1037_Swiney.d:43","Wer bist du?","Kim jesteś?","","False","Info_Swiney_Hello_15_00","",""
"Scripts/content/Story/MISSIONS/DIA_SfB_1037_Swiney.d:44","Ich bin der beste Bergbauer, den diese verdammte Kolonie jemals gesehen hat, mein Junge.","Jestem najlepszym inżynierem, jakiego ta przeklęta Kolonia kiedykolwiek widziała, chłopcze.","","False","Info_Swiney_Hello_09_01","",""
"Scripts/content/Story/MISSIONS/DIA_SfB_1037_Swiney.d:45","Ich passe auf, dass nicht die Hälfte unserer Jungs von Steinen erschlagen werden, weil sie zu dumm sind, an der richtigen Stelle zu schürfen.","Pilnuję, żeby nasi chłopcy nie ściągnęli sobie na głowy sterty kamieni, kopiąc w niewłaściwym miejscu.","","False","Info_Swiney_Hello_09_02","",""
"Scripts/content/Story/MISSIONS/DIA_SfB_1037_Swiney.d:57","Ich will bei euch als Schürfer mitmachen!","Chciałbym do was dołączyć, jako Kret!","","False","Info_Swiney_Schuerfer.description","",""
"Scripts/content/Story/MISSIONS/DIA_SfB_1037_Swiney.d:70","Ich will bei euch als Schürfer mitmachen!","Chciałbym do was dołączyć, jako Kret!","","False","Info_Swiney_Schuerfer_15_00","",""
"Scripts/content/Story/MISSIONS/DIA_SfB_1037_Swiney.d:71","So? Denk bloß nicht, du kannst hier viel erwarten. Jeden Tag gibt's 3 Portionen Reis und für den Rest musst du selber sorgen.","Czyżby? Tylko nie oczekuj zbyt wiele po tej robocie. Trzy porcje ryżu na dzień. Resztę musisz sobie sam załatwić.","","False","Info_Swiney_Schuerfer_09_01","",""
"Scripts/content/Story/MISSIONS/DIA_SfB_1037_Swiney.d:72","Du weißt, warum wir das hier machen? Wir machen die Arbeit, damit alle hier eines Tages wieder rausspazieren können.","Wiesz, dlaczego odwalamy całą tę brudną robotę? Żeby pewnego dnia móc wyjść na wolność z tego przeklętego więzienia.","","False","Info_Swiney_Schuerfer_09_02","",""
"Scripts/content/Story/MISSIONS/DIA_SfB_1037_Swiney.d:73","Das heißt, alles Erz wird abgegeben und kommt auf den großen Haufen. Und einmal im Monat kriegt jeder, der hier hart gearbeitet hat, 50 Brocken Erz zum Versaufen.","Cały nasz urobek jest składowany na wielkim kopcu. Raz w miesiącu każdy z nas dostaje 50 bryłek, żeby móc się porządnie upić.","","False","Info_Swiney_Schuerfer_09_03","",""
"Scripts/content/Story/MISSIONS/DIA_SfB_1037_Swiney.d:74","Das waren auch schon die wichtigsten Sachen, die du wissen musst.","To najważniejsze rzeczy, które powinieneś wiedzieć.","","False","Info_Swiney_Schuerfer_09_04","",""
"Scripts/content/Story/MISSIONS/DIA_SfB_1037_Swiney.d:75","Kennst du dich wenigstens mit der Arbeit aus?","Masz chociaż jakieś doświadczenie w tej robocie?","","False","Info_Swiney_Schuerfer_09_05","",""
"Scripts/content/Story/MISSIONS/DIA_SfB_1037_Swiney.d:78","Nein.","Nie.","","False","Info_Swiney_Schuerfer.Info_Swiney_Schuerfer_Nein","Info_AddChoice",""
"Scripts/content/Story/MISSIONS/DIA_SfB_1037_Swiney.d:79","Ja.","Tak.","","False","Info_Swiney_Schuerfer.Info_Swiney_Schuerfer_Ja","Info_AddChoice",""
"Scripts/content/Story/MISSIONS/DIA_SfB_1037_Swiney.d:84","Ja.","Tak.","","False","Info_Swiney_Schuerfer_Ja_15_00","",""
"Scripts/content/Story/MISSIONS/DIA_SfB_1037_Swiney.d:85","Gut! Dann weißt du ja, worauf du zu achten hast. Hier ist Schutzkleidung. 'Ne Spitzhacke musst du dir suchen. Viel Spaß.","To świetnie! Zatem wiesz, na co należy uważać. Masz tu swój strój roboczy. Kilof musisz znaleźć sobie sam. Miłej zabawy.","","False","Info_Swiney_Schuerfer_Ja_09_01","",""
"Scripts/content/Story/MISSIONS/DIA_SfB_1037_Swiney.d:94","Nein.","Nie.","","False","Info_Swiney_Schuerfer_Nein_15_00","",""
"Scripts/content/Story/MISSIONS/DIA_SfB_1037_Swiney.d:95","Natürlich nicht! Warum immer ich? Gut. Pass auf. Du nimmst jetzt diese Klamotten und ziehst sie dir an - hier.","No jasne! Dlaczego to zawsze ja muszę was uświadamiać. Słuchaj uważnie: weź te ciuchy i załóż je na siebie - tutaj.","","False","Info_Swiney_Schuerfer_Nein_09_01","",""
"Scripts/content/Story/MISSIONS/DIA_SfB_1037_Swiney.d:96","Wenn dir ein Erzbrocken auf den Fuß fällt und du keine Schutzkleidung trägst, bist du ein Krüppel und nur noch die Hälfte für uns wert.","Gdyby kawałek rudy spadł ci na bosą stopę, zostałbyś kaleką do końca życia. Oczywiście wtedy byłbyś dla nas znacznie mniej przydatny.","","False","Info_Swiney_Schuerfer_Nein_09_02","",""
"Scripts/content/Story/MISSIONS/DIA_SfB_1037_Swiney.d:97","'Ne Spitzhacke liegt hier bestimmt irgendwo noch rum.","Gdzieś w pobliżu powinien leżeć jakiś kilof.","","False","Info_Swiney_Schuerfer_Nein_09_03","",""
"Scripts/content/Story/MISSIONS/DIA_SfB_1037_Swiney.d:98","Aber viel anfangen kannst du damit sowieso nicht - na ja - was soll's ...","Oczywiście wiele z nim nie zdziałasz... Mówi się trudno...","","False","Info_Swiney_Schuerfer_Nein_09_04","",""
"Scripts/content/Story/MISSIONS/DIA_SfB_1037_Swiney.d:116","Wieviel Erz habt ihr schon gesammelt?","Jak dużo rudy udało się wam uzbierać do tej pory?","","False","Info_Swiney_PERM.description","",""
"Scripts/content/Story/MISSIONS/DIA_SfB_1037_Swiney.d:129","Wie viel Erz habt ihr schon gesammelt?","Jak dużo rudy udało się wam uzbierać do tej pory?","","False","Info_Swiney_PERM_15_00","",""
"Scripts/content/Story/MISSIONS/DIA_SfB_1037_Swiney.d:130","Die Magier sagen, viel brauchen wir nicht mehr. Geh ins Neue Lager und sieh dir den Haufen an.","Magowie mówią, że mamy już niemal całą potrzebną ilość. Kiedy będziesz w Nowym Obozie, rzuć okiem na kopiec.","","False","Info_Swiney_PERM_09_01","",""
"Scripts/content/Story/MISSIONS/DIA_IE_397_Announcer.d:43","Hochverehrte Erzbarone, geehrte Gardisten, Schatten und Buddler ...","Moi szanowni magnaci, drodzy strażnicy, Cienie i Kopacze...","","False","Info_Announcer_ANNOUNCE_11_01","",""
"Scripts/content/Story/MISSIONS/DIA_IE_397_Announcer.d:44","Ich präsentiere ihnen ...","Z prawdziwą przyjemnością przedstawiam wam...","","False","Info_Announcer_ANNOUNCE_11_02","",""
"Scripts/content/Story/MISSIONS/DIA_IE_397_Announcer.d:45","!!! IN EXTREMO !!!!","!!! IN EXTREMO !!!!","","False","Info_Announcer_ANNOUNCE_11_03","",""
"Scripts/content/Story/ZS/ZS_Meditate.d:44","Omm...","Omm...","","False","ZS_Meditate_Om","",""
"Scripts/content/Story/ZS/pers/ZS_Preach_YBerion.d:34","Der Schläfer hat zu mir gesprochen.","Śniący przemówił do mnie.","","False","ZS_Preach_YBerion01","",""
"Scripts/content/Story/ZS/pers/ZS_Preach_YBerion.d:38","Der Schläfer wird uns alle befreien.","Śniący uwolni nas wszystkich.","","False","ZS_Preach_YBerion02","",""
"Scripts/content/Story/ZS/pers/ZS_Preach_YBerion.d:42","Der Schläfer erwache!","Śniący, zbudź się!","","False","ZS_Preach_YBerion03","",""
