"location","source","target","id","fuzzy","context","translator_comments","developer_comments"
"Scripts/content/Story/MISSIONS/DIA_Sld_702_Soeldner.d:75","WIR sind nur hier, falls er uns braucht.","MY jesteśmy tu tylko na wypadek, gdyby nas potrzebował.","","","DIA_Sld_702_PERM_04_04","",""
"Scripts/content/Story/MISSIONS/DIA_Sld_723_GuardPassage.d:44","HALT! Niemand darf ohne Parole passieren!","STAĆ! Nikt nie przejdzie bez podania hasła.","","","Info_SLD_723_FirstWarn_11_01","",""
"Scripts/content/Story/MISSIONS/DIA_Sld_723_GuardPassage.d:52","Cronos hat mir die Erlaubnis gegeben!","Cronos udzielił mi pozwolenia!","","","Info_SLD_723_FirstWarn.Info_SLD_723_Parole_CRONOS","Info_AddChoice",""
"Scripts/content/Story/MISSIONS/DIA_Sld_723_GuardPassage.d:53","Keine Ahnung, hab' sie vergessen!","Cholera. Chyba zapomniałem...","","","Info_SLD_723_FirstWarn.Info_SLD_723_Parole_FORGOT","Info_AddChoice",""
"Scripts/content/Story/MISSIONS/DIA_Sld_723_GuardPassage.d:54","Die Parole lautet TERIANTROCH","Hasło brzmi TERIANTROCH.","","","Info_SLD_723_FirstWarn.Info_SLD_723_Parole_FALSE2","Info_AddChoice",""
"Scripts/content/Story/MISSIONS/DIA_Sld_723_GuardPassage.d:55","Die Parole lautet TETRIANDOCH","Hasło brzmi TETRIANDOCH.","","","Info_SLD_723_FirstWarn.Info_SLD_723_Parole_TRUE","Info_AddChoice",""
"Scripts/content/Story/MISSIONS/DIA_Sld_723_GuardPassage.d:56","Die Parole lautet TETRIDANOCH","Hasło brzmi TETRIDANOCH.","","","Info_SLD_723_FirstWarn.Info_SLD_723_Parole_FALSE1","Info_AddChoice",""
"Scripts/content/Story/MISSIONS/DIA_Sld_723_GuardPassage.d:66","Cronos hat mir die Erlaubnis gegeben!","Cronos udzielił mi pozwolenia!","","","Info_SLD_723_Parole_CRONOS_15_01","",""
"Scripts/content/Story/MISSIONS/DIA_Sld_723_GuardPassage.d:67","Wenn das so wäre, hätte er dir die Parole genannt. Verzieh dich, du Lügner!","W takim wypadku podałby ci również hasło. Zejdź mi z oczu, kłamco.","","","Info_SLD_723_Parole_CRONOS_11_02","",""
"Scripts/content/Story/MISSIONS/DIA_Sld_723_GuardPassage.d:73","Keine Ahnung, hab' sie vergessen!","Cholera. Chyba zapomniałem...","","","Info_SLD_723_Parole_FORGOT_15_01","",""
"Scripts/content/Story/MISSIONS/DIA_Sld_723_GuardPassage.d:74","Dann komm wieder, wenn sie dir eingefallen ist und stiehl mir nicht länger meine Zeit!","To wróć, jak tylko sobie przypomnisz i przestań zawracać mi głowę!","","","Info_SLD_723_Parole_FORGOT_11_02","",""
"Scripts/content/Story/MISSIONS/DIA_Sld_723_GuardPassage.d:80","Die Parole lautet TETRIDANOCH.","Hasło brzmi TETRIDANOCH.","","","Info_SLD_723_Parole_FALSE1_15_01","",""
"Scripts/content/Story/MISSIONS/DIA_Sld_723_GuardPassage.d:81","FALSCH!","BŁĄD!","","","Info_SLD_723_Parole_FALSE1_11_02","",""
"Scripts/content/Story/MISSIONS/DIA_Sld_723_GuardPassage.d:87","Die Parole lautet TERIANTROCH.","Hasło brzmi TERIANTROCH.","","","Info_SLD_723_Parole_FALSE2_15_01","",""
"Scripts/content/Story/MISSIONS/DIA_Sld_723_GuardPassage.d:88","FALSCH!","BŁĄD!","","","Info_SLD_723_Parole_FALSE2_11_02","",""
"Scripts/content/Story/MISSIONS/DIA_Sld_723_GuardPassage.d:94","Die Parole lautet TETRIANDOCH.","Hasło brzmi TETRIANDOCH.","","","Info_SLD_723_Parole_TRUE_15_01","",""
"Scripts/content/Story/MISSIONS/DIA_Sld_723_GuardPassage.d:95","Das stimmt! Du kannst passieren!","Zgadza się. Możesz przejść.","","","Info_SLD_723_Parole_TRUE_11_02","",""
"Scripts/content/Story/MISSIONS/DIA_Sld_723_GuardPassage.d:132","Ich sage es nicht noch einmal! KEINEN SCHRITT WEITER!","Nie będę się powtarzał. ANI KROKU DALEJ!","","","Info_SLD_723_LastWarn_11_01","",""
"Scripts/content/Story/MISSIONS/DIA_Sld_723_GuardPassage.d:187","(Parole sagen)","(podaj hasło)","","","Info_SLD_723_PAROLE.description","",""
"Scripts/content/Story/MISSIONS/DIA_Sld_723_GuardPassage.d:202","Cronos hat mir die Erlaubnis gegeben!","Cronos udzielił mi pozwolenia!","","","Info_SLD_723_PAROLE.Info_SLD_723_Parole_CRONOS","Info_AddChoice",""
"Scripts/content/Story/MISSIONS/DIA_Sld_723_GuardPassage.d:203","Keine Ahnung, hab' sie vergessen!","Cholera. Chyba zapomniałem...","","","Info_SLD_723_PAROLE.Info_SLD_723_Parole_FORGOT","Info_AddChoice",""
"Scripts/content/Story/MISSIONS/DIA_Sld_723_GuardPassage.d:204","Die Parole lautet TERIANTROCH","Hasło brzmi TERIANTROCH.","","","Info_SLD_723_PAROLE.Info_SLD_723_Parole_FALSE2","Info_AddChoice",""
"Scripts/content/Story/MISSIONS/DIA_Sld_723_GuardPassage.d:205","Die Parole lautet TETRIANDOCH","Hasło brzmi TETRIANDOCH.","","","Info_SLD_723_PAROLE.Info_SLD_723_Parole_TRUE","Info_AddChoice",""
"Scripts/content/Story/MISSIONS/DIA_Sld_723_GuardPassage.d:206","Die Parole lautet TETRIDANOCH","Hasło brzmi TETRIDANOCH.","","","Info_SLD_723_PAROLE.Info_SLD_723_Parole_FALSE1","Info_AddChoice",""
"Scripts/content/Story/MISSIONS/DIA_Sld_728_Jarvis.d:21","Pass auf deinen Rücken auf!","Uważaj na siebie!","","","DIA_Jarvis_EXIT_08_00","",""
"Scripts/content/Story/MISSIONS/DIA_Sld_728_Jarvis.d:44","Hast du vor, durch dies Tor zu gehen?","Chcesz przejść przez tę bramę?","","","DIA_Jarvis_First_08_00","",""
"Scripts/content/Story/MISSIONS/DIA_Sld_728_Jarvis.d:45","Willst du mich aufhalten?","A spróbujesz mnie powstrzymać?","","","DIA_Jarvis_First_15_01","",""
"Scripts/content/Story/MISSIONS/DIA_Sld_728_Jarvis.d:46","Nein, aber du solltest wissen, was dich erwartet. Es läuft hier nicht so wie im Alten Lager und erst recht nicht wie bei den Sektenspinnern!","Nie, ale powinieneś wiedzieć, co cię tam czeka. Nie jesteś w Starym Obozie, ani wśród tych nawiedzonych świrów!","","","DIA_Jarvis_First_08_02","",""
"Scripts/content/Story/MISSIONS/DIA_Sld_728_Jarvis.d:47","Und wie läuft es hier?","No i co mnie tam czeka?","","","DIA_Jarvis_First_15_03","",""
"Scripts/content/Story/MISSIONS/DIA_Sld_728_Jarvis.d:48","Es gibt hier keine Gardisten oder Templer, die auf dich aufpassen. Jeder ist sich selbst der Nächste, und die einzigen, die zusammenhalten, sind wir Söldner.","Tutaj nie ma Cieni ani Świątynnych Strażników, którzy wyciągną cię z kłopotów. W Nowym Obozie każdy musi radzić sobie sam. Tylko my - Najemnicy - trzymamy się razem.","","","DIA_Jarvis_First_08_04","",""
"Scripts/content/Story/MISSIONS/DIA_Sld_728_Jarvis.d:60","Was machen die Söldner?","Czym zajmują się Najemnicy?","","","DIA_Jarvis_SldInfo.description","",""
"Scripts/content/Story/MISSIONS/DIA_Sld_728_Jarvis.d:73","Was machen die Söldner?","Czym zajmują się Najemnicy?","","","DIA_Jarvis_SldInfo_15_00","",""
"Scripts/content/Story/MISSIONS/DIA_Sld_728_Jarvis.d:74","Wir - wir sind die Söldner der Wassermagier.","Jesteśmy żołnierzami w służbie Magów Wody.","","","DIA_Jarvis_SldInfo_08_01","",""
"Scripts/content/Story/MISSIONS/DIA_Sld_728_Jarvis.d:75","Unser Ziel ist es, hier auszubrechen. Wir arbeiten hart dafür und wir wollen uns hier keinen Lenz machen, wie die Lumpen aus dem Alten Lager, die sich nur auf den Schultern der Buddler ausruhen.","Naszym celem jest wyrwanie się z tej przeklętej kolonii. Musimy ciężko pracować, bo nie chcieliśmy iść na łatwiznę, jak Magnaci ze Starego Obozu, którzy żerują na niewolniczej pracy Kopaczy.","","","DIA_Jarvis_SldInfo_08_02","",""
"Scripts/content/Story/MISSIONS/DIA_Sld_728_Jarvis.d:76","Und wir alle folgen Lee. Er ist ein großer Mann. Nur er hält dieses verdammte Lager zusammen.","I wszyscy jesteśmy posłuszni Lee. To wspaniały człowiek. Tylko dzięki niemu ten cholerny obóz jeszcze się nie rozpadł.","","","DIA_Jarvis_SldInfo_08_03","",""
"Scripts/content/Story/MISSIONS/DIA_Sld_728_Jarvis.d:88","Was machen die Magier?","Co robią magowie?","","","DIA_Jarvis_Magier.description","",""
"Scripts/content/Story/MISSIONS/DIA_Sld_728_Jarvis.d:101","Was machen die Magier?","Co robią magowie?","","","DIA_Jarvis_Magier_15_00","",""
"Scripts/content/Story/MISSIONS/DIA_Sld_728_Jarvis.d:102","Sie erforschen die magischen Eigenschafen des Erzes, das unsere Schürfer aus der Mine holen.","Badają magiczne właściwości wydobywanej przez Krety rudy.","","","DIA_Jarvis_Magier_08_01","",""
"Scripts/content/Story/MISSIONS/DIA_Sld_728_Jarvis.d:103","Soweit ich das verstanden habe, wollen sie den ganzen verdammten Erzhaufen in die Luft jagen, um die Barriere wegzusprengen.","O ile się orientuję, zamierzają wysadzić w powietrze cały ten piekielny kopiec i zniszczyć Barierę.","","","DIA_Jarvis_Magier_08_02","",""
"Scripts/content/Story/MISSIONS/DIA_Sld_728_Jarvis.d:104","Klingt gefährlich.","To chyba niebezpiecznie.","","","DIA_Jarvis_Magier_15_03","",""
"Scripts/content/Story/MISSIONS/DIA_Sld_728_Jarvis.d:105","Sie sagen, wir sollen uns keine Sorgen machen.","Magowie twierdzą, że nie mamy się czego obawiać.","","","DIA_Jarvis_Magier_08_04","",""
"Scripts/content/Story/MISSIONS/DIA_Sld_728_Jarvis.d:117","Ihr habt einen riesigen Haufen Erz hier?","Macie tutaj wielką hałdę rudy?","","","DIA_Jarvis_Erzhaufen.description","",""
"Scripts/content/Story/MISSIONS/DIA_Sld_728_Jarvis.d:130","Ihr habt einen riesigen Haufen Erz hier?","Macie tutaj wielką hałdę rudy?","","","DIA_Jarvis_Erzhaufen_15_00","",""
"Scripts/content/Story/MISSIONS/DIA_Sld_728_Jarvis.d:131","Kann man wohl sagen. Wenn wir den mit der Außenwelt tauschen würden, würde uns der König seine Frau dafür verkaufen .","Aha, można tak powiedzieć. Za taką ilość rudy Rhobar sprzedałby własną żonę.","","","DIA_Jarvis_Erzhaufen_08_01","",""
"Scripts/content/Story/MISSIONS/DIA_Sld_728_Jarvis.d:132","Aber wir werden einen Dreck tun, dem alten Sack das Erz zu geben. Wir wollen hier RAUS!","Ale my mamy gdzieś tego starego pierdziela. Chcemy się stąd wydostać!","","","DIA_Jarvis_Erzhaufen_08_02","",""
"Scripts/content/Story/MISSIONS/DIA_Sld_728_Jarvis.d:144","Wo ist der Erzhaufen?","Gdzie jest ten kopiec?","","","DIA_Jarvis_WoHaufen.description","",""
"Scripts/content/Story/MISSIONS/DIA_Sld_728_Jarvis.d:157","Wo ist der Erzhaufen?","Gdzie jest ten kopiec?","","","DIA_Jarvis_WoHaufen_15_00","",""
"Scripts/content/Story/MISSIONS/DIA_Sld_728_Jarvis.d:158","Willst mal richtig viel Erz sehen, was? In der Mitte der Höhle ist ein Loch, da kippen sie alles rein.","Chcesz zobaczyć wielką górę rudy, co? Na środku jaskini jest dziura. Tam wszystko zrzucają.","","","DIA_Jarvis_WoHaufen_08_01","",""
"Scripts/content/Story/MISSIONS/DIA_Sld_728_Jarvis.d:159","Aber ran kommst du da nicht, das kann ich dir gleich sagen. Die Magier und unsere Leute bewachen das Erz Tag und Nacht.","Ale nie pozwolą ci się do niej zbliżyć, mówię ci. Magowie i nasi ludzie pilnują rudy dniem i nocą.","","","DIA_Jarvis_WoHaufen_08_02","",""
"Scripts/content/Story/MISSIONS/DIA_Sld_728_Jarvis.d:160","Ich war nur neugierig.","Pytałem z ciekawości.","","","DIA_Jarvis_WoHaufen_15_03","",""
"Scripts/content/Story/MISSIONS/DIA_Sld_728_Jarvis.d:172","Was ist mit dem Rest der Leute?","A co z innymi ludźmi?","","","DIA_Jarvis_Rest.description","",""
"Scripts/content/Story/MISSIONS/DIA_Sld_728_Jarvis.d:185","Was ist mit dem Rest der Leute?","A co z innymi ludźmi?","","","DIA_Jarvis_Rest_15_00","",""
"Scripts/content/Story/MISSIONS/DIA_Sld_728_Jarvis.d:186","Alles Banditen. Sie kümmern sich keinen Deut um das Lager. Ich würde sie nicht mal das Vortor bewachen lassen, wahrscheinlich wäre es sinnvoller, dort ein paar Bauern hinzustellen.","Szumowiny, bez wyjątku. Mają gdzieś ten Obóz. Już wolałbym, żeby byle zbieracze ryżu pilnowali bramy.","","","DIA_Jarvis_Rest_08_01","",""
"Scripts/content/Story/MISSIONS/DIA_Sld_728_Jarvis.d:199","Wie ist die Lage zur Zeit?","Co słychać w Obozie?","","","DIA_Jarvis_PERM.description","",""
"Scripts/content/Story/MISSIONS/DIA_Sld_728_Jarvis.d:212","Wie ist die Lage zur Zeit?","Co słychać w Obozie?","","","DIA_Jarvis_PERM_15_00","",""
"Scripts/content/Story/MISSIONS/DIA_Sld_728_Jarvis.d:213","Die Schürfer sammeln noch. Wenn sie genug Erz haben, jagen wir den Haufen in die Luft.","Krety nadal pracują. Kiedy uzbierają dość rudy, wysadzimy ją w powietrze.","","","DIA_Jarvis_PERM_08_01","",""
"Scripts/content/Story/MISSIONS/DIA_Sld_728_Jarvis.d:240","Hey, ich habe gehört, du hast die Crawler in der Mine ganz schön aufgemischt.","Hej, słyszałem, że nieźle dałeś popalić pełzaczom z kopalni!","","","Sld_728_Jarvis_AUFNAHMESOLDIER_Info_08_01","",""
"Scripts/content/Story/MISSIONS/DIA_Sld_728_Jarvis.d:241","Lee ist bestimmt bereit, dich als Söldner aufzunehmen. Sprich doch einfach mal mit ihm.","Lee pewnie zgodzi się przyjąć cię do Najemników. Powinieneś z nim pogadać.","","","Sld_728_Jarvis_AUFNAHMESOLDIER_Info_08_02","",""
"Scripts/content/Story/MISSIONS/DIA_Sld_729_Kharim.d:33","Ich bin neu hier. Wer bist du?","Jestem tu nowy. A ty kim jesteś?","","","Info_Kharim_What.description","",""
"Scripts/content/Story/MISSIONS/DIA_Sld_729_Kharim.d:43","Ich bin neu hier. Wer bist du?","Jestem tu nowy. A ty kim jesteś?","","","Info_Kharim_What_15_00","",""
"Scripts/content/Story/MISSIONS/DIA_Sld_729_Kharim.d:44","Ich bin Kharim! Du bist wohl wirklich gerade erst reingeworfen worden - sonst hättest du schon von mir gehört!","Jestem Kharim! Widzę, że trafiłeś tu niedawno, inaczej już byś o mnie usłyszał!","","","Info_Kharim_What_09_01","",""
"Scripts/content/Story/MISSIONS/DIA_Sld_729_Kharim.d:45","Ich bin der beste Kämpfer, den dieses dreckige Lager je gesehen hat.","Jestem najlepszym wojownikiem jakiego ten zawszony Obóz kiedykolwiek oglądał.","","","Info_Kharim_What_09_02","",""
"Scripts/content/Story/MISSIONS/DIA_Sld_729_Kharim.d:60","Ich fordere dich heraus! Lass es uns in der Arena austragen!","Wyzywam cię na pojedynek! Chodźmy na arenę!","","","Info_Kharim_Charge.description","",""
"Scripts/content/Story/MISSIONS/DIA_Sld_729_Kharim.d:73","Ich fordere dich heraus! Lass es uns in der Arena austragen!","Wyzywam cię na pojedynek! Chodźmy na arenę!","","","Info_Kharim_Charge_15_00","",""
"Scripts/content/Story/MISSIONS/DIA_Sld_729_Kharim.d:74","DU?! Ich fress' dich zum Frühstück, Kleiner!","TY?! Takich jak ty zjadam na śniadanie!","","","Info_Kharim_Charge_09_01","",""
"Scripts/content/Story/MISSIONS/DIA_Sld_729_Kharim.d:75","Tu dir selber einen Gefallen und mach, dass du wegkommst!","Dobrze ci radzę, chłoptasiu - SPADAJ STĄD!","","","Info_Kharim_Charge_09_02","",""
"Scripts/content/Story/MISSIONS/DIA_Sld_729_Kharim.d:78","Okay, okay, vergessen wir die Sache.","Dobra, spokojnie. Zapomnijmy o całej sprawie!","","","Info_Kharim_Charge.Info_Kharim_Charge_BACK","Info_AddChoice",""
"Scripts/content/Story/MISSIONS/DIA_Sld_729_Kharim.d:79","Damit du ungeschoren davonkommst, du feiges Schwein?!","Boisz się, że oberwiesz, tchórzu?!","","","Info_Kharim_Charge.Info_Kharim_Charge_Insult","Info_AddChoice",""
"Scripts/content/Story/MISSIONS/DIA_Sld_729_Kharim.d:84","Okay, okay, vergessen wir die Sache.","Dobra, spokojnie. Zapomnijmy o całej sprawie!","","","Info_Kharim_Charge_BACK_15_00","",""
"Scripts/content/Story/MISSIONS/DIA_Sld_729_Kharim.d:93","Damit du ungeschoren davonkommst, du feiges Schwein?!","Boisz się, że oberwiesz, tchórzu?!","","","Info_Kharim_Charge_Insult_15_00","",""
"Scripts/content/Story/MISSIONS/DIA_Sld_729_Kharim.d:94","Fällt dir nichts besseres ein, Kleiner?","Nie stać cię na nic lepszego, chłopcze?","","","Info_Kharim_Charge_Insult_09_01","",""
"Scripts/content/Story/MISSIONS/DIA_Sld_729_Kharim.d:97","Du bist doch nur hier, um Gomez in den Arsch zu kriechen!","Przyszedłeś tutaj tylko dlatego, żeby móc pocałować Gomeza w dupę!","","","Info_Kharim_Charge.Info_Kharim_Charge_Insult_GomezAss","Info_AddChoice",""
"Scripts/content/Story/MISSIONS/DIA_Sld_729_Kharim.d:98","Wie wär's mit: Deine Mutter treibt's mit Ziegen...","To może tak: Twój ojciec zabawiał się z owcami...","","","Info_Kharim_Charge.Info_Kharim_Charge_Insult_Goats","Info_AddChoice",""
"Scripts/content/Story/MISSIONS/DIA_Sld_729_Kharim.d:99","Nein, mir fällt nichts ein, das du begreifen würdest.","Nie przychodzi mi do głowy nic, co byłbyś w stanie zrozumieć.","","","Info_Kharim_Charge.Info_Kharim_Charge_Insult_Stupid","Info_AddChoice",""
"Scripts/content/Story/MISSIONS/DIA_Sld_729_Kharim.d:100","Deine dürren Ärmchen sind nichts gegen deine häßliche Visage.","Chciałem powiedzieć coś o twoich ramionach, ale zobaczyłem twoją mordę.","","","Info_Kharim_Charge.Info_Kharim_Charge_Insult_Face","Info_AddChoice",""
"Scripts/content/Story/MISSIONS/DIA_Sld_729_Kharim.d:108","Wie wär's mit: Deine Mutter treibt's mit Ziegen ...","To może tak: twój ojciec zabawiał się z owcami...","","","Info_Kharim_Charge_Insult_Goats_15_00","",""
"Scripts/content/Story/MISSIONS/DIA_Sld_729_Kharim.d:109","Das tut sie vermutlich wirklich ...","Cóż, były takie plotki...","","","Info_Kharim_Charge_Insult_Goats_09_01","",""
"Scripts/content/Story/MISSIONS/DIA_Sld_729_Kharim.d:114","Du bist doch nur hier, damit du mal 'ne Chance bekommst, Gomez in den Arsch zu kriechen!","Powiedzmy sobie szczerze: przyszedłeś tutaj tylko dlatego, żeby móc pocałować Gomeza w dupę!","","","Info_Kharim_Charge_Insult_GomezAss_15_00","",""
"Scripts/content/Story/MISSIONS/DIA_Sld_729_Kharim.d:115","WAS!?! Du Wurm! Du weißt gar nichts über uns! Das Neue Lager ist UNABHÄNGIG von dieser ganzen Scheiße!","CO!?! Ty gnido! Nie wiesz o czym mówisz! Nowy Obóz ma was gdzieś!","","","Info_Kharim_Charge_Insult_GomezAss_09_01","",""
"Scripts/content/Story/MISSIONS/DIA_Sld_729_Kharim.d:116","Und im Übrigen gibt es nur einen Grund, warum ich hier bin: Damit ich Klugscheißern wie dir das Hirn aus dem Schädel prügeln kann.","A poza tym jest tylko jeden powód, dla którego tutaj przyszedłem: zamierzam publicznie upokorzyć każdego mięczaka, który ośmieli się wyzwać mnie na pojedynek.","","","Info_Kharim_Charge_Insult_GomezAss_09_02","",""
"Scripts/content/Story/MISSIONS/DIA_Sld_729_Kharim.d:117","Es wird mir ein Vergnügen sein, das bei DIR zu tun! Dein Schicksal erwartet dich in der Arena!","Ale ciebie załatwię z wyjątkową przyjemnością! Czekam na ciebie na arenie!","","","Info_Kharim_Charge_Insult_GomezAss_09_03","",""
"Scripts/content/Story/MISSIONS/DIA_Sld_729_Kharim.d:129","Lass mal überlegen: Nein, mir fällt nichts ein, was du begreifen würdest.","Pomyślmy... Nie, nie przychodzi mi do głowy nic, co byłbyś w stanie zrozumieć.","","","Info_Kharim_Charge_Insult_Stupid_15_00","",""
"Scripts/content/Story/MISSIONS/DIA_Sld_729_Kharim.d:130","Vielleicht solltest du es auf einen Versuch ankommen lassen.","Może jednak powinieneś spróbować.","","","Info_Kharim_Charge_Insult_Stupid_09_01","",""
"Scripts/content/Story/MISSIONS/DIA_Sld_729_Kharim.d:135","Ich wollte zuerst was über deine dürren Ärmchen sagen, aber dann fiel mir deine hässliche Fesse auf.","Z początku chciałem powiedzieć coś o twoich wątłych ramionach, ale potem zobaczyłem twoją paskudną mordę.","","","Info_Kharim_Charge_Insult_Face_15_00","",""
"Scripts/content/Story/MISSIONS/DIA_Sld_729_Kharim.d:136","Ich denke, das ist deine letzte Chance, hier ENDLICH ZU VERSCHWINDEN!","To twoja ostatnia szansa, żeby odejść stąd o własnych siłach!","","","Info_Kharim_Charge_Insult_Face_09_01","",""
"Scripts/content/Story/MISSIONS/DIA_Sld_729_Kharim.d:163","Schmerzen sind eine Frage des Willens!","Ból to tylko kwestia siły woli!","","","Info_Kharim_InArena_09_00","",""
"Scripts/content/Story/MISSIONS/DIA_Sld_732_GuardPassage.d:44","HALT! Niemand darf ohne Parole passieren!","STAĆ! Nikt nie przejdzie bez podania hasła.","","","Info_SLD_732_FirstWarn_08_01","",""
"Scripts/content/Story/MISSIONS/DIA_Sld_732_GuardPassage.d:52","Cronos hat mir die Erlaubnis gegeben!","Cronos udzielił mi pozwolenia!","","","Info_SLD_732_FirstWarn.Info_SLD_732_Parole_CRONOS","Info_AddChoice",""
"Scripts/content/Story/MISSIONS/DIA_Sld_732_GuardPassage.d:53","Keine Ahnung, hab' sie vergessen!","Cholera. Chyba zapomniałem...","","","Info_SLD_732_FirstWarn.Info_SLD_732_Parole_FORGOT","Info_AddChoice",""
"Scripts/content/Story/MISSIONS/DIA_Sld_732_GuardPassage.d:54","Die Parole lautet TERIANTROCH","Hasło brzmi TERIANTROCH.","","","Info_SLD_732_FirstWarn.Info_SLD_732_Parole_FALSE2","Info_AddChoice",""
"Scripts/content/Story/MISSIONS/DIA_Sld_732_GuardPassage.d:55","Die Parole lautet TETRIANDOCH","Hasło brzmi TETRIANDOCH.","","","Info_SLD_732_FirstWarn.Info_SLD_732_Parole_TRUE","Info_AddChoice",""
"Scripts/content/Story/MISSIONS/DIA_Sld_732_GuardPassage.d:56","Die Parole lautet TETRIDANOCH","Hasło brzmi TETRIDANOCH.","","","Info_SLD_732_FirstWarn.Info_SLD_732_Parole_FALSE1","Info_AddChoice",""
"Scripts/content/Story/MISSIONS/DIA_Sld_732_GuardPassage.d:66","Cronos hat mir die Erlaubnis gegeben!","Cronos udzielił mi pozwolenia!","","","Info_SLD_732_Parole_CRONOS_15_01","",""
"Scripts/content/Story/MISSIONS/DIA_Sld_732_GuardPassage.d:67","Wenn das so wäre, hätte er dir die Parole genannt. Verzieh dich, du Lügner!","W takim wypadku podałby ci również hasło. Zejdź mi z oczu, kłamco.","","","Info_SLD_732_Parole_CRONOS_08_02","",""
"Scripts/content/Story/MISSIONS/DIA_Sld_732_GuardPassage.d:73","Keine Ahnung, hab' sie vergessen!","Cholera. Chyba zapomniałem...","","","Info_SLD_732_Parole_FORGOT_15_01","",""
"Scripts/content/Story/MISSIONS/DIA_Sld_732_GuardPassage.d:74","Dann komm wieder, wenn sie dir wieder eingefallen ist und stiehl mir nicht länger meine Zeit!","To wróć, jak tylko sobie przypomnisz i przestań zawracać mi głowę!","","","Info_SLD_732_Parole_FORGOT_08_02","",""
"Scripts/content/Story/MISSIONS/DIA_Sld_732_GuardPassage.d:80","Die Parole lautet TETRIDANOCH.","Hasło brzmi TETRIDANOCH.","","","Info_SLD_732_Parole_FALSE1_15_01","",""
"Scripts/content/Story/MISSIONS/DIA_Sld_732_GuardPassage.d:81","FALSCH!","BŁĄD!","","","Info_SLD_732_Parole_FALSE1_08_02","",""
"Scripts/content/Story/MISSIONS/DIA_Sld_732_GuardPassage.d:87","Die Parole lautet TERIANTROCH.","Hasło brzmi TERIANTROCH.","","","Info_SLD_732_Parole_FALSE2_15_01","",""
"Scripts/content/Story/MISSIONS/DIA_Sld_732_GuardPassage.d:88","FALSCH!","BŁĄD!","","","Info_SLD_732_Parole_FALSE2_08_02","",""
"Scripts/content/Story/MISSIONS/DIA_Sld_732_GuardPassage.d:94","Die Parole lautet TETRIANDOCH.","Hasło brzmi TETRIANDOCH.","","","Info_SLD_732_Parole_TRUE_15_01","",""
"Scripts/content/Story/MISSIONS/DIA_Sld_732_GuardPassage.d:95","Das stimmt! Du kannst passieren!","Zgadza się. Możesz przejść.","","","Info_SLD_732_Parole_TRUE_08_02","",""
"Scripts/content/Story/MISSIONS/DIA_Sld_732_GuardPassage.d:132","Ich sage es nicht noch einmal! KEINEN SCHRITT WEITER!","Nie będę się powtarzał. ANI KROKU DALEJ!","","","Info_SLD_732_LastWarn_08_01","",""
"Scripts/content/Story/MISSIONS/DIA_Sld_732_GuardPassage.d:187","(Parole sagen)","(podaj hasło)","","","Info_SLD_732_PAROLE.description","",""
"Scripts/content/Story/MISSIONS/DIA_Sld_732_GuardPassage.d:202","Cronos hat mir die Erlaubnis gegeben!","Cronos udzielił mi pozwolenia!","","","Info_SLD_732_PAROLE.Info_SLD_732_Parole_CRONOS","Info_AddChoice",""
"Scripts/content/Story/MISSIONS/DIA_Sld_732_GuardPassage.d:203","Keine Ahnung, hab' sie vergessen!","Cholera. Chyba zapomniałem...","","","Info_SLD_732_PAROLE.Info_SLD_732_Parole_FORGOT","Info_AddChoice",""
"Scripts/content/Story/MISSIONS/DIA_Sld_732_GuardPassage.d:204","Die Parole lautet TERIANTROCH","Hasło brzmi TERIANTROCH.","","","Info_SLD_732_PAROLE.Info_SLD_732_Parole_FALSE2","Info_AddChoice",""
"Scripts/content/Story/MISSIONS/DIA_Sld_732_GuardPassage.d:205","Die Parole lautet TETRIANDOCH","Hasło brzmi TETRIANDOCH.","","","Info_SLD_732_PAROLE.Info_SLD_732_Parole_TRUE","Info_AddChoice",""
"Scripts/content/Story/MISSIONS/DIA_Sld_732_GuardPassage.d:206","Die Parole lautet TETRIDANOCH","Hasło brzmi TETRIDANOCH.","","","Info_SLD_732_PAROLE.Info_SLD_732_Parole_FALSE1","Info_AddChoice",""
"Scripts/content/Story/MISSIONS/DIA_Sld_737_Torlof.d:33","Wer bist du?","Kim jesteś?","","","DIA_Torlof_Hallo.description","",""
"Scripts/content/Story/MISSIONS/DIA_Sld_737_Torlof.d:43","Wer bist du?","Kim jesteś?","","","DIA_Torlof_Hallo_15_00","",""
"Scripts/content/Story/MISSIONS/DIA_Sld_737_Torlof.d:44","Ich bin Torlof.","Nazywam się Torlof.","","","DIA_Torlof_Hallo_04_01","",""
"Scripts/content/Story/MISSIONS/DIA_Sld_737_Torlof.d:45","Hab als Maat auf einem der königlichen Kriegsschiffe bei ner Meuterei mitgemacht.","Brałem udział w buncie załogi na pokładzie królewskiego okrętu.","","","DIA_Torlof_Hallo_04_02","",""
"Scripts/content/Story/MISSIONS/DIA_Sld_737_Torlof.d:46","Kam nicht so gut an. Der größte Teil der Mannschaft war auf der Seite des Käptn's.","To chyba nie był najlepszy pomysł. Większa część załogi była po stronie kapitana.","","","DIA_Torlof_Hallo_04_03","",""
"Scripts/content/Story/MISSIONS/DIA_Sld_737_Torlof.d:47","Seitdem bin ich hier.","W ten sposób wylądowałem tutaj.","","","DIA_Torlof_Hallo_04_04","",""
"Scripts/content/Story/MISSIONS/DIA_Sld_737_Torlof.d:60","Ich will bei euch mitmachen.","Chciałbym do was dołączyć.","","","DIA_Torlof_Mitmachen.description","",""
"Scripts/content/Story/MISSIONS/DIA_Sld_737_Torlof.d:74","Ich will bei euch mitmachen.","Chciałbym do was dołączyć.","","","DIA_Torlof_Mitmachen_15_00","",""
"Scripts/content/Story/MISSIONS/DIA_Sld_737_Torlof.d:75","Bevor du nicht einiges auf'm Kasten hast, wird Lee dich nicht nehmen, das sag ich dir gleich.","Lee przyjmuje tylko najlepszych ludzi, możesz mi wierzyć.","","","DIA_Torlof_Mitmachen_04_01","",""
"Scripts/content/Story/MISSIONS/DIA_Sld_737_Torlof.d:76","Und bis du besser bist, solltest du dich mit Lares und seinen Jungs gut stellen.","I dopóki nie będziesz jednym z nich radzę ci dobrze żyć z Laresem i jego zgrają.","","","DIA_Torlof_Mitmachen_04_02","",""
