"location","source","target","id","fuzzy","context","translator_comments","developer_comments"
Scripts/content/Story/MISSIONS/DIA_Sld_761_Soeldner.d:111","Du siehst doch, dass die Mine abgeschlossen ist, also hier gibt´s nichts zu sehen.","Lo capisci da solo che è chiusa, quindi non c'è nulla da vedere.","","","DIA_SLD_761_Soeldner_INMINE_INFO_03_02","",""
Scripts/content/Story/MISSIONS/DIA_Sld_761_Soeldner.d:121","Kann man da gar nichts machen?","Non posso farci nulla?","","","DIA_SLD_761_Soeldner_Bribe.description","",""
Scripts/content/Story/MISSIONS/DIA_Sld_761_Soeldner.d:134","Kann man da gar nichts machen?","Non posso farci nulla?","","","DIA_SLD_761_Soeldner_Bribe_INFO_15_01","",""
Scripts/content/Story/MISSIONS/DIA_Sld_761_Soeldner.d:135","Was sollte man da machen können?","Cosa ci sarebbe da fare?","","","DIA_SLD_761_Soeldner_Bribe_INFO_03_02","",""
Scripts/content/Story/MISSIONS/DIA_Sld_761_Soeldner.d:136","Moment mal, wenn du versucht, mich zu bestechen, dann bist du hier an der falschen Adresse.","Un attimo. Se stai cercando di corrompermi, hai scelto l'uomo sbagliato.","","","DIA_SLD_761_Soeldner_Bribe_INFO_03_03","",""
Scripts/content/Story/MISSIONS/DIA_Sld_761_Soeldner.d:137","Nein, ich wollte niemanden bestechen, ich dachte nur..","Non cercavo di corrompere nessuno, volevo solo...","","","DIA_SLD_761_Soeldner_Bribe_INFO_15_04","",""
Scripts/content/Story/MISSIONS/DIA_Sld_761_Soeldner.d:138","Ich glaub', ich geh' dann besser.","Farò meglio ad andare.","","","DIA_SLD_761_Soeldner_Bribe_INFO_15_05","",""
