"location","source","target","id","fuzzy","context","translator_comments","developer_comments"
"Scripts/content/Story/MISSIONS/DIA_EBR_100_Gomez.d:33","Ich bin gekommen, um dir meine Dienste anzubieten.","Sono venuto a offrire i miei servigi.","","","DIA_Gomez_Fault.description","",""
"Scripts/content/Story/MISSIONS/DIA_EBR_100_Gomez.d:46","Ich bin gekommen, um dir meine Dienste anzubieten.","Sono venuto a offrire i miei servizi.","","","DIA_Gomez_Fault_15_00","",""
"Scripts/content/Story/MISSIONS/DIA_EBR_100_Gomez.d:47","Du platzt hier einfach rein und erwartest, dass ich mich mit dir befasse, du Wurm? WACHE!","Vieni qui pieno di boria e ti aspetti che mi interessi a te, lurido verme? GUARDIE!","","","DIA_Gomez_Fault_11_01","",""
"Scripts/content/Story/MISSIONS/DIA_EBR_100_Gomez.d:67","Ich bin gekommen, um dir meine Dienste anzubieten.","Sono venuto a offrire i miei servigi.","","","DIA_Gomez_Hello.description","",""
"Scripts/content/Story/MISSIONS/DIA_EBR_100_Gomez.d:80","Ich bin gekommen, um dir meine Dienste anzubieten.","Sono venuto a offrire i miei servizi.","","","DIA_Gomez_Hello_15_00","",""
"Scripts/content/Story/MISSIONS/DIA_EBR_100_Gomez.d:81","Warum denkst du, dass wir an deinen Diensten interessiert sind?","Cosa ti fa pensare che io sia interessato?","","","DIA_Gomez_Hello_11_01","",""
"Scripts/content/Story/MISSIONS/DIA_EBR_100_Gomez.d:84","Ich hoffe ich muss dir nicht erst den Kopf abhacken, um mich zu beweisen.","Spero di non doverti far saltare la testa per dimostrare il mio valore.","","","DIA_Gomez_Hello.DIA_Gomez_Hello_KopfAb","Info_AddChoice",""
"Scripts/content/Story/MISSIONS/DIA_EBR_100_Gomez.d:85","Weil hier nur Schwachköpfe rumrennen.","Qui ci sono solo stupidi!","","","DIA_Gomez_Hello.DIA_Gomez_Hello_Spinner","Info_AddChoice",""
"Scripts/content/Story/MISSIONS/DIA_EBR_100_Gomez.d:86","Ich bin viel rumgekommen und habe gute Kontakte in allen Lagern.","Ho girato a lungo la colonia e ho contatti in tutti i campi.","","","DIA_Gomez_Hello.DIA_Gomez_Hello_Kontakte","Info_AddChoice",""
"Scripts/content/Story/MISSIONS/DIA_EBR_100_Gomez.d:87","Ich habe die Prüfung des Vertrauens bestanden.","Ho superato la prova della fiducia.","","","DIA_Gomez_Hello.DIA_Gomez_Hello_ThorusSays","Info_AddChoice",""
"Scripts/content/Story/MISSIONS/DIA_EBR_100_Gomez.d:92","Ich habe die Prüfung des Vertrauens bestanden und Thorus sagt, ich bin ein guter Mann.","Thorus dice che ho superato il test della fiducia.","","","DIA_Gomez_Hello_ThorusSays_15_00","",""
"Scripts/content/Story/MISSIONS/DIA_EBR_100_Gomez.d:93","Du wärst hier nicht lebend reingekommen, wenn das nicht so wäre. Ich hoffe, das war nicht schon alles.","Non saresti giunto qui vivo, se non fosse così. Spero non sia il massimo che puoi fare.","","","DIA_Gomez_Hello_ThorusSays_11_01","",""
"Scripts/content/Story/MISSIONS/DIA_EBR_100_Gomez.d:99","Ich bin viel in der Kolonie rumgekommen und habe gute Kontakte in allen Lagern.","Ho girato a lungo la colonia e ho contatti in tutti i campi.","","","DIA_Gomez_Hello_Kontakte_15_00","",""
"Scripts/content/Story/MISSIONS/DIA_EBR_100_Gomez.d:100","Das ist tatsächlich ein guter Grund. Zu wem hast du Kontakte?","Questo potrebbe tornare utile. Con chi sei in contatto?","","","DIA_Gomez_Hello_Kontakte_11_01","",""
"Scripts/content/Story/MISSIONS/DIA_EBR_100_Gomez.d:102","Das waren alle wichtigen.","Queste sono tutte le persone importanti che conosco.","","","DIA_Gomez_Hello.DIA_Gomez_Hello_Kontakte_ThatsAll","Info_AddChoice",""
"Scripts/content/Story/MISSIONS/DIA_EBR_100_Gomez.d:103","Zu einigen Hehlern im Neuen Lager.","Un paio di ricettatori di Campo Nuovo.","","","DIA_Gomez_Hello.DIA_Gomez_Hello_Kontakte_NLHehler","Info_AddChoice",""
"Scripts/content/Story/MISSIONS/DIA_EBR_100_Gomez.d:104","Zu Lares.","Da Lares.","","","DIA_Gomez_Hello.DIA_Gomez_Hello_Kontakte_Lares","Info_AddChoice",""
"Scripts/content/Story/MISSIONS/DIA_EBR_100_Gomez.d:106","Zu einigen Baals aus dem Lager der Bruderschaft.","Alcuni Baal nel campo della Fratellanza.","","","DIA_Gomez_Hello.DIA_Gomez_Hello_Kontakte_Baals","Info_AddChoice",""
"Scripts/content/Story/MISSIONS/DIA_EBR_100_Gomez.d:107","Zu Cor Kalom.","Cor Kalom.","","","DIA_Gomez_Hello.DIA_Gomez_Hello_Kontakte_Kalom","Info_AddChoice",""
"Scripts/content/Story/MISSIONS/DIA_EBR_100_Gomez.d:111","Zu Y'Berion.","Y'Berion.","","","DIA_Gomez_Hello.DIA_Gomez_Hello_Kontakte_YBerion","Info_AddChoice",""
"Scripts/content/Story/MISSIONS/DIA_EBR_100_Gomez.d:117","Weil hier nur Schwachköpfe rumrennen, die ihre Aufgaben lieber an Neulinge weitergeben, statt sie selber zu erledigen.","Qui ci sono solo stupidi! Passano tutto il tempo cercando novellini per scaricare su di loro il proprio lavoro.","","","DIA_Gomez_Hello_Spinner_15_00","",""
"Scripts/content/Story/MISSIONS/DIA_EBR_100_Gomez.d:118","Das ist zwar bis auf wenige Ausnahmen richtig, aber kein Grund einen weiteren Schwachkopf anzuheuern.","Questo può essere vero, con alcune eccezioni. In ogni caso, non è un buon motivo per assumere un altro stupido.","","","DIA_Gomez_Hello_Spinner_11_01","",""
"Scripts/content/Story/MISSIONS/DIA_EBR_100_Gomez.d:123","Ich hoffe ich muss dir nicht erst den Kopf abhacken, um dir zu beweisen, dass ich mit einer Waffe umgehen kann","Spero di non essere costretto a farti saltare la testa, per dimostrare che so maneggiare un'arma.","","False","DIA_Gomez_Hello_KopfAb_15_00","",""
"Scripts/content/Story/MISSIONS/DIA_EBR_100_Gomez.d:124","Mut und Dummheit liegen dicht beieinander ...","C'è un confine fra coraggio e stupidità.","","","DIA_Gomez_Hello_KopfAb_11_01","",""
"Scripts/content/Story/MISSIONS/DIA_EBR_100_Gomez.d:136","Zu Y'Berion.","Y'Berion.","","","DIA_Gomez_Hello_Kontakte_YBerion_15_00","",""
"Scripts/content/Story/MISSIONS/DIA_EBR_100_Gomez.d:137","Y'Berion gibt sich nicht mit Burschen wie dir ab.","Y'Berion non spreca il suo tempo con gente come te.","","","DIA_Gomez_Hello_Kontakte_YBerion_11_01","",""
"Scripts/content/Story/MISSIONS/DIA_EBR_100_Gomez.d:138","Dass du lügst, zeigt mir, dass du mich für dumm hältst.","Dalle tue menzogne capisco che mi ritieni un idiota.","","","DIA_Gomez_Hello_Kontakte_YBerion_11_02","",""
"Scripts/content/Story/MISSIONS/DIA_EBR_100_Gomez.d:139","Dass du mich für DUMM hältst, enttäuscht mich.","Mi deludi: tu pensi che io sia STUPIDO.","","","DIA_Gomez_Hello_Kontakte_YBerion_11_03","",""
"Scripts/content/Story/MISSIONS/DIA_EBR_100_Gomez.d:140","Ich hasse es, enttäuscht zu werden.","Odio essere deluso.","","","DIA_Gomez_Hello_Kontakte_YBerion_11_04","",""
"Scripts/content/Story/MISSIONS/DIA_EBR_100_Gomez.d:149","Zu Cor Kalom.","Cor Kalom.","","","DIA_Gomez_Hello_Kontakte_Kalom_15_00","",""
"Scripts/content/Story/MISSIONS/DIA_EBR_100_Gomez.d:150","Und?","E poi?","","","DIA_Gomez_Hello_Kontakte_Kalom_11_01","",""
"Scripts/content/Story/MISSIONS/DIA_EBR_100_Gomez.d:156","Zu einigen Baals aus dem Lager der Bruderschaft.","Alcuni Baal nel campo della Fratellanza.","","","DIA_Gomez_Hello_Kontakte_Baals_15_00","",""
"Scripts/content/Story/MISSIONS/DIA_EBR_100_Gomez.d:157","Und?","E poi?","","","DIA_Gomez_Hello_Kontakte_Baals_11_01","",""
"Scripts/content/Story/MISSIONS/DIA_EBR_100_Gomez.d:177","Zu Lares.","Lares.","","","DIA_Gomez_Hello_Kontakte_Lares_15_00","",""
"Scripts/content/Story/MISSIONS/DIA_EBR_100_Gomez.d:178","Und?","E poi?","","","DIA_Gomez_Hello_Kontakte_Lares_11_01","",""
"Scripts/content/Story/MISSIONS/DIA_EBR_100_Gomez.d:184","Zu einigen Hehlern im Neuen Lager.","Un paio di ricettatori di Campo Nuovo.","","","DIA_Gomez_Hello_Kontakte_NLHehler_15_00","",""
"Scripts/content/Story/MISSIONS/DIA_EBR_100_Gomez.d:185","Und?","E poi?","","","DIA_Gomez_Hello_Kontakte_NLHehler_11_01","",""
"Scripts/content/Story/MISSIONS/DIA_EBR_100_Gomez.d:191","Das waren alle wichtigen.","Queste sono tutte le persone importanti che conosco.","","","DIA_Gomez_Hello_Kontakte_ThatsAll_15_00","",""
"Scripts/content/Story/MISSIONS/DIA_EBR_100_Gomez.d:194","Beachtlich - für einen Neuling wie dich ...","Non male, per un principiante...","","False","DIA_Gomez_Hello_Kontakte_ThatsAll_11_01","",""
"Scripts/content/Story/MISSIONS/DIA_EBR_100_Gomez.d:195","Du sollst deine Chance kriegen.","Ti darò una possibilità.","","","DIA_Gomez_Hello_Kontakte_ThatsAll_11_02","",""
"Scripts/content/Story/MISSIONS/DIA_EBR_100_Gomez.d:200","DAMIT willst du mich beeindrucken? Im Lager gibt es BUDDLER, die bessere Beziehungen haben!","Ti aspetti davvero che QUESTO mi colpisca? Abbiamo MINATORI con conoscenze migliori!","","","DIA_Gomez_Hello_Kontakte_ThatsAll_INSUFF_11_00","",""
"Scripts/content/Story/MISSIONS/DIA_EBR_100_Gomez.d:214","Heißt das, ich bin dabei?","Significa che sono stato accettato?","","","DIA_Gomez_Dabei.description","",""
"Scripts/content/Story/MISSIONS/DIA_EBR_100_Gomez.d:228","Heißt das, ich bin dabei?","Significa che sono stato accettato?","","","DIA_Gomez_Dabei_15_00","",""
"Scripts/content/Story/MISSIONS/DIA_EBR_100_Gomez.d:229","Genau das heißt es. Du bist jetzt einer von uns, Kleiner.","Puoi scommetterci. Sei uno di noi, ragazzo.","","","DIA_Gomez_Dabei_11_01","",""
"Scripts/content/Story/MISSIONS/DIA_EBR_100_Gomez.d:230","Alles Weitere wird dir Raven erzählen.","Raven ti spiegherà tutto.","","","DIA_Gomez_Dabei_11_02","",""
"Scripts/content/Story/MISSIONS/DIA_EBR_100_Gomez.d:260","Ich wollte mal einen Zwischenbericht abgeben.","Pensavo di fare rapporto.","","","DIA_Gomez_NurSo.description","",""
"Scripts/content/Story/MISSIONS/DIA_EBR_100_Gomez.d:273","Ich wollte mal einen Zwischenbericht abgeben.","Pensavo di fare rapporto.","","","DIA_Gomez_NurSo_15_00","",""
"Scripts/content/Story/MISSIONS/DIA_EBR_100_Gomez.d:274","Dann geh zu Raven. Und sprich mich nie wieder an, ohne dass du dazu aufgefordert worden bist!","Allora vai da Raven e non rivolgermi più la parola se non sei stato autorizzato!","","","DIA_Gomez_NurSo_11_00","",""
"Scripts/content/Story/MISSIONS/DIA_EBR_100_Gomez.d:304","Wie bist du denn hier rein gekommen?","Come sei entrato?","","","DIA_EBR_100_Gomez_Wait4SC_11_01","",""
"Scripts/content/Story/MISSIONS/DIA_EBR_100_Gomez.d:305","Moment! Bist du nicht diese Pestzecke gewesen, die unsere Leute in der Freien Mine kalt gemacht hat?","Aspetta! Non sei quello che ha combattuto contro i miei uomini nella miniera libera?","","","DIA_EBR_100_Gomez_Wait4SC_11_02","",""
"Scripts/content/Story/MISSIONS/DIA_EBR_100_Gomez.d:306","Deine Leute hatten kein Recht, dort einzufallen. Ich habe diesen Anflug von Größenwahnsinn nur wieder korrigiert!","I tuoi uomini non avevano alcun diritto d'invaderla. Ho solo curato i loro attacchi di megalomania!","","","DIA_EBR_100_Gomez_Wait4SC_15_03","",""
"Scripts/content/Story/MISSIONS/DIA_EBR_100_Gomez.d:307","Du hast Mut, so mit mir - GOMEZ - zu sprechen, aber es war ziemlich dumm von dir, hier einfach aufzutauchen.","Parlare in questo modo a me, a GOMEZ, dimostra un certo coraggio. Ma sei stato stupido a venire qui.","","","DIA_EBR_100_Gomez_Wait4SC_11_04","",""
"Scripts/content/Story/MISSIONS/DIA_EBR_100_Gomez.d:308","Ich werde persönlich sicherstellen, dass du mir nie wieder in die Suppe spucken wirst.","Mi accerterò di persona che tu non possa più intralciare i miei piani.","","","DIA_EBR_100_Gomez_Wait4SC_11_05","",""
"Scripts/content/Story/MISSIONS/DIA_EBR_101_Scar.d:33","Wer bist du?","Chi sei?","","","DIA_SCAR_Hello.description","",""
"Scripts/content/Story/MISSIONS/DIA_EBR_101_Scar.d:43","Wer bist du?","Chi sei?","","","DIA_SCAR_Hello_15_00","",""
"Scripts/content/Story/MISSIONS/DIA_EBR_101_Scar.d:44","Sie nennen mich Scar.","Mi chiamo Scar.","","","DIA_SCAR_Hello_08_01","",""
"Scripts/content/Story/MISSIONS/DIA_EBR_101_Scar.d:56","Was ist deine Aufgabe hier?","Qual è il tuo compito?","","","DIA_SCAR_What.description","",""
"Scripts/content/Story/MISSIONS/DIA_EBR_101_Scar.d:69","Was ist deine Aufgabe hier?","Che lavoro fai?","","","DIA_SCAR_What_15_00","",""
"Scripts/content/Story/MISSIONS/DIA_EBR_101_Scar.d:70","Ich und Arto passen auf, dass Gomez niemand zu nahe kommt, der hier nicht eingeladen wurde,","Io e Arto ci assicuriamo che nessuno possa vedere Gomez senza permesso.","","False","DIA_SCAR_What_08_01","",""
"Scripts/content/Story/MISSIONS/DIA_EBR_101_Scar.d:71","Außerdem kümmere ich mich darum, dass die Frauen hier nicht zu kurz kommen .","Inoltre mi occupo di non far riposare le donne.","","","DIA_SCAR_What_08_02","",""
"Scripts/content/Story/MISSIONS/DIA_EBR_101_Scar.d:83","Als sie mich reingeworfen haben, habe ich eine Frau gesehen.","Quando mi hanno gettato qui, ho visto una donna che veniva fatta scendere...","","","DIA_SCAR_Frau.description","",""
"Scripts/content/Story/MISSIONS/DIA_EBR_101_Scar.d:96","Als sie mich reingeworfen haben, habe ich gesehen, wie eine Frau zusammen mit den Waren heruntergefahren wurde.","Quando mi hanno gettato qui, ho visto una donna che veniva fatta scendere insieme alle merci.","","","DIA_SCAR_Frau_15_00","",""
"Scripts/content/Story/MISSIONS/DIA_EBR_101_Scar.d:97","Und?","E allora?","","","DIA_SCAR_Frau_08_01","",""
"Scripts/content/Story/MISSIONS/DIA_EBR_101_Scar.d:98","Ist sie hier?","È qui?","","","DIA_SCAR_Frau_15_02","",""
"Scripts/content/Story/MISSIONS/DIA_EBR_101_Scar.d:99","Wenn du dich für sie interessierst, geb' ich dir einen guten Rat: Vergiss sie.","Se sei interessato a lei, lascia che ti dia un consiglio: dimenticala.","","","DIA_SCAR_Frau_08_03","",""
"Scripts/content/Story/MISSIONS/DIA_EBR_101_Scar.d:100","Sie ist gerade angekommen und Gomez hat sie bei sich auf dem Zimmer eingesperrt.","Appena è arrivata, Gomez l'ha chiusa a chiave nella sua camera da letto.","","","DIA_SCAR_Frau_08_04","",""
"Scripts/content/Story/MISSIONS/DIA_EBR_101_Scar.d:101","Wenn er sie 'ne Zeit lang gehabt hat, schickt er sie vielleicht runter. Aber jetzt gehört sie IHM - also verschwende besser keinen Gedanken an sie.","Quando avrà finito con lei, forse la rimanderà indietro. In ogni caso, per ora è SUA, quindi farai meglio a non pensarci.","","","DIA_SCAR_Frau_08_05","",""
"Scripts/content/Story/MISSIONS/DIA_EBR_101_Scar.d:114","Kannst du mir etwas über Gomez erzählen?","Puoi dirmi qualcosa su Gomez?","","","DIA_SCAR_PERM.description","",""
"Scripts/content/Story/MISSIONS/DIA_EBR_101_Scar.d:127","Kannst du mir etwas über Gomez erzählen?","Puoi dirmi qualcosa su Gomez?","","","DIA_SCAR_PERM_15_00","",""
"Scripts/content/Story/MISSIONS/DIA_EBR_101_Scar.d:128","Über ihn musst du nur wissen, dass er der mächtigste Mann der Kolonie ist.","Tutto ciò che devi sapere è che si tratta dell'uomo più potente della colonia.","","","DIA_SCAR_PERM_08_01","",""
"Scripts/content/Story/MISSIONS/DIA_EBR_101_Scar.d:129","Er kann alles haben, was er will, aber das einzige, was ihn WIRKLICH interessiert, ist Einfluss.","Prende quello che vuole, ma tutto ciò che desidera veramente è il potere.","","","DIA_SCAR_PERM_08_02","",""
"Scripts/content/Story/MISSIONS/DIA_EBR_102_Arto.d:33","Wer bist du?","Chi sei?","","","DIA_ARTO_Hello.description","",""
"Scripts/content/Story/MISSIONS/DIA_EBR_102_Arto.d:43","Wer bist du?","Chi sei?","","","DIA_ARTO_Hello_15_00","",""
"Scripts/content/Story/MISSIONS/DIA_EBR_102_Arto.d:44","Ich bin Arto.","Sono Arto.","","","DIA_ARTO_Hello_13_01","",""
"Scripts/content/Story/MISSIONS/DIA_EBR_102_Arto.d:56","Was machst du so?","Perché giri qui intorno?","","","DIA_ARTO_What.description","",""
"Scripts/content/Story/MISSIONS/DIA_EBR_102_Arto.d:69","Was machst du so?","Perché ti aggiri qua intorno?","","","DIA_ARTO_What_15_00","",""
"Scripts/content/Story/MISSIONS/DIA_EBR_102_Arto.d:70","Ich bin Gomez' Leibwächter.","Sono la guardia del corpo di Gomez.","","","DIA_ARTO_What_13_01","",""
"Scripts/content/Story/MISSIONS/DIA_EBR_102_Arto.d:83","Du redest nicht viel, was?","Non parli molto, vero?","","","DIA_ARTO_PERM.description","",""
"Scripts/content/Story/MISSIONS/DIA_EBR_102_Arto.d:96","Du redest nicht viel, was?","Non parli molto, vero?","","","DIA_ARTO_PERM_15_00","",""
"Scripts/content/Story/MISSIONS/DIA_EBR_102_Arto.d:97","Nein.","Già.","","","DIA_ARTO_PERM_13_01","",""
"Scripts/content/Story/MISSIONS/DIA_EBR_105_Raven.d:47","Was kann ich für dich tun?","Cosa posso fare per te?","","","DIA_Raven_FirstIn_10_00","",""
"Scripts/content/Story/MISSIONS/DIA_EBR_105_Raven.d:59","Wer bist du?","Chi sei?","","","DIA_Raven_Who.description","",""
"Scripts/content/Story/MISSIONS/DIA_EBR_105_Raven.d:69","Wer bist du?","Chi sei?","","","DIA_Raven_Who_15_00","",""
"Scripts/content/Story/MISSIONS/DIA_EBR_105_Raven.d:70","Ich bin Raven. Gomez' rechte Hand. Jeder, der hier ist, um mit Gomez zu reden, redet vorher mit MIR.","Sono Raven, il braccio destro di Gomez. Chiunque voglia incontrarlo, deve prima passare da ME.","","","DIA_Raven_Who_10_01","",""
"Scripts/content/Story/MISSIONS/DIA_EBR_105_Raven.d:82","Ich habe eine Ladung Kraut für Gomez von Cor Kalom.","Cor Kalom mi ha inviato per consegnare un po' d'erba a Gomez.","","","DIA_Raven_Krautbote.description","",""
"Scripts/content/Story/MISSIONS/DIA_EBR_105_Raven.d:95","Ich habe eine Ladung Kraut für Gomez von Cor Kalom.","Cor Kalom mi ha inviato per consegnare un po' d'erba a Gomez.","","","DIA_Raven_Krautbote_15_00","",""
"Scripts/content/Story/MISSIONS/DIA_EBR_105_Raven.d:96","Bartholo kümmert sich um diese Sachen, Gomez selbst gibt sich nicht mit Boten ab.","Gomez non tratta coi fattorini, è Bartholo che devi incontrare.","","","DIA_Raven_Krautbote_10_01","",""
"Scripts/content/Story/MISSIONS/DIA_EBR_105_Raven.d:97","Du findest ihn in der Kammer hier rechts hinter dem Eingang oder in der Küche im großen Turm.","Lo troverai nella sala a destra, dietro l'entrata, oppure nella cucina della torre grande.","","","DIA_Raven_Krautbote_10_02","",""
"Scripts/content/Story/MISSIONS/DIA_EBR_105_Raven.d:98","Nachts schläft er natürlich. Da würd' ich es nicht wagen, ihn zu stören.","Ovviamente di notte dorme: se fossi in te, non lo disturberei.","","","DIA_Raven_Krautbote_10_03","",""
"Scripts/content/Story/MISSIONS/DIA_EBR_105_Raven.d:112","Ich will zu Gomez. Thorus sagt, ich soll als Schatten aufgenommen werden.","Voglio vedere Gomez. Thorus dice che sono pronto a diventare un'Ombra.","","","DIA_Raven_Aufnahme.description","",""
"Scripts/content/Story/MISSIONS/DIA_EBR_105_Raven.d:126","Ich will zu Gomez. Thorus sagt, ich soll als Schatten aufgenommen werden.","Voglio vedere Gomez. Thorus dice che sono pronto a diventare un'Ombra.","","","DIA_Raven_Aufnahme_15_00","",""
"Scripts/content/Story/MISSIONS/DIA_EBR_105_Raven.d:127","Wir sind immer auf der Suche nach guten Leuten. Du scheinst mir nicht auf den Kopf gefallen zu sein. Du könntest es hier zu was bringen.","Siamo sempre in cerca di uomini valorosi. Sembri molto sicuro di te, potresti andare bene.","","","DIA_Raven_Aufnahme_10_01","",""
"Scripts/content/Story/MISSIONS/DIA_EBR_105_Raven.d:128","Ich werde dich zu Gomez führen. Folge mir. Und fass nichts an!","Ti scorterò da Gomez. Seguimi e non toccare nulla!","","","DIA_Raven_Aufnahme_10_02","",""
"Scripts/content/Story/MISSIONS/DIA_EBR_105_Raven.d:156","Dort hinten ist Gomez. Wenn du ihm keinen Respekt zeigst, werde ich dir persönlich welchen beibringen, ist das klar?","Gomez è laggiù. Se non gli mostrerai il dovuto rispetto, mi occuperò personalmente d'insegnarti le buone maniere. Capito?","","","DIA_Raven_There_10_01","",""
"Scripts/content/Story/MISSIONS/DIA_EBR_105_Raven.d:172","Wie steht der Erzhandel?","Come va il commercio di metallo?","","","DIA_Raven_PERM.description","",""
"Scripts/content/Story/MISSIONS/DIA_EBR_105_Raven.d:185","Wie steht der Erzhandel?","Come va il commercio di metallo?","","","DIA_Raven_PERM_15_00","",""
"Scripts/content/Story/MISSIONS/DIA_EBR_105_Raven.d:186","Die Alte Mine spuckt genug aus. Die letzte Lieferung aus der Außenwelt war ziemlich fett.","La vecchia miniera sta andando bene. L'ultimo carico di rifornimenti dal mondo esterno è stato abbondante.","","","DIA_Raven_PERM_10_01","",""
"Scripts/content/Story/MISSIONS/DIA_EBR_105_Raven.d:198","Gomez sagt, ich bin dabei.","Gomez dice che sono stato accettato.","","","DIA_Raven_BinDabei.description","",""
"Scripts/content/Story/MISSIONS/DIA_EBR_105_Raven.d:217","Gomez sagt, ich bin dabei.","Gomez dice che sono stato accettato.","","","DIA_Raven_BinDabei_15_00","",""
"Scripts/content/Story/MISSIONS/DIA_EBR_105_Raven.d:218","Gut! Du kannst dich gleich bei deinem ersten Auftrag bewähren.","Ottimo! In questo caso, puoi subito provare il tuo valore in missione.","","","DIA_Raven_BinDabei_10_01","",""
"Scripts/content/Story/MISSIONS/DIA_EBR_105_Raven.d:219","Wenn deine Verbindungen wirklich so gut sind, wie du sagst, solltest du keine Probleme damit haben.","Non dovresti avere difficoltà, se le tue conoscenze sono buone come affermi.","","","DIA_Raven_BinDabei_10_02","",""
"Scripts/content/Story/MISSIONS/DIA_EBR_105_Raven.d:235","Was soll ich für dich erledigen?","Cosa devo fare?","","","DIA_Raven_SpySect.description","",""
"Scripts/content/Story/MISSIONS/DIA_EBR_105_Raven.d:248","Was soll ich für dich erledigen?","Cosa devo fare?","","","DIA_Raven_SpySect_15_00","",""
"Scripts/content/Story/MISSIONS/DIA_EBR_105_Raven.d:249","Wir stehen mit der Bruderschaft in Handelskontakt. Das bedeutet nicht, das wir ihnen unbedingt vertrauen.","Noi commerciamo molto con la Fratellanza. Questo, ovviamente, non vuol dire che ci fidiamo di loro.","","","DIA_Raven_SpySect_10_01","",""
"Scripts/content/Story/MISSIONS/DIA_EBR_105_Raven.d:250","Mach dich auf den Weg in den Sumpf.","Vai alla palude.","","","DIA_Raven_SpySect_10_02","",""
"Scripts/content/Story/MISSIONS/DIA_EBR_105_Raven.d:251","Wenn du dort im Lager bist, halte die Ohren auf. Alles was du erfährst, kann für uns nützlich sein.","Quando avrai raggiunto il campo, tieni le orecchie ben aperte. Qualsiasi notizia riuscirai a raccogliere, potrebbe essere molto importante per noi.","","","DIA_Raven_SpySect_10_03","",""
"Scripts/content/Story/MISSIONS/DIA_EBR_105_Raven.d:252","Und je mehr du erfährst, desto besser. Das Ganze erfordert ein gewisses Feingefühl. Du weißt, was ich meine?","Più riuscirai a scoprire, meglio sarà. Dovrai usare molto tatto, non so se mi spiego.","","","DIA_Raven_SpySect_10_04","",""
"Scripts/content/Story/MISSIONS/DIA_EBR_105_Raven.d:253","Bleib ruhig, ich werde ihren Zorn nicht heraufbeschwören.","Tranquillo, non voglio farli arrabbiare.","","","DIA_Raven_SpySect_15_05","",""
"Scripts/content/Story/MISSIONS/DIA_EBR_105_Raven.d:254","Ich wusste, dass du mich verstehen würdest.","Ero certo che avresti capito.","","","DIA_Raven_SpySect_10_06","",""
"Scripts/content/Story/MISSIONS/DIA_EBR_105_Raven.d:272","Wo bekomme ich bessere Ausrüstung her?","Dove posso trovare un equipaggiamento migliore?","","","DIA_Raven_Equipment.description","",""
"Scripts/content/Story/MISSIONS/DIA_EBR_105_Raven.d:285","Wo bekomme ich bessere Ausrüstung her?","Dove posso trovare un equipaggiamento migliore?","","","DIA_Raven_Equipment_15_00","",""
"Scripts/content/Story/MISSIONS/DIA_EBR_105_Raven.d:286","Geh zu Diego, er wird dir 'ne Rüstung geben. Damit wirst du nicht so schnell umgebracht und sie dient auch gleichzeitig als Ausweis.","Vai da Diego, ti darà un'armatura. Ti aiuterà a non farti uccidere e servirà anche per identificarti.","","","DIA_Raven_Equipment_10_01","",""
"Scripts/content/Story/MISSIONS/DIA_EBR_105_Raven.d:287","Mit deiner neuen Rüstung solltest du hier überall hinkommen, wo du hin musst.","Ti permetterà l'accesso a tutti i luoghi in cui devi andare.","","","DIA_Raven_Equipment_10_02","",""
"Scripts/content/Story/MISSIONS/DIA_EBR_105_Raven.d:288","Und wenn du Waffen brauchst, geh zu Skip, er ist in der großen Scheune hinten links auf den Burgplatz.","Se hai bisogno di armi, vai a parlare con Skip. Lo troverai nel grande capanno in fondo, a sinistra del cortile del castello.","","","DIA_Raven_Equipment_10_03","",""
"Scripts/content/Story/MISSIONS/DIA_EBR_105_Raven.d:314","Ich will einen Zwischenbericht abgeben.","Pensavo di fare rapporto.","","","DIA_Raven_SpyBericht.description","",""
"Scripts/content/Story/MISSIONS/DIA_EBR_105_Raven.d:327","Ich will einen Zwischenbericht abgeben.","Pensavo di fare rapporto.","","","DIA_Raven_SpyBericht_15_00","",""
"Scripts/content/Story/MISSIONS/DIA_EBR_105_Raven.d:328","Gut. Ich bin gerne gut informiert.","Bene. Mi piace essere sempre aggiornato.","","","DIA_Raven_SpyBericht_10_01","",""
"Scripts/content/Story/MISSIONS/DIA_EBR_105_Raven.d:335","Du hast deine Sache gut gemacht.","Hai fatto un buon lavoro.","","","DIA_Raven_SpyBericht_10_04","",""
"Scripts/content/Story/MISSIONS/DIA_EBR_105_Raven.d:343","Sie wollen die Eier einer Minecrawler-Königin, um daraus ein Elixier herzustellen, durch das sie Kontakt zum Schläfer aufnehmen können. Ich habe die Eier bei mir.","Ora vogliono un uovo di regina dei pidocchi delle miniere, per creare una pozione che li metta in contatto col Dormiente. Ho le uova con me.","","","DIA_Raven_SpyBericht_15_02","",""
"Scripts/content/Story/MISSIONS/DIA_EBR_105_Raven.d:346","Interessant. Bin gespannt, ob die Sache funktioniert. Bring die Eier in den Tempel.","Molto interessante. Mi chiedo se funzionerà. Porta le uova al tempio.","","","DIA_Raven_SpyBericht_10_03","",""
"Scripts/content/Story/MISSIONS/DIA_EBR_105_Raven.d:360","Ich weiß noch nicht GENAU was sie vorhaben.","Ancora non ho idea di cosa abbiano in mente.","","","DIA_Raven_SpyBericht_15_05","",""
"Scripts/content/Story/MISSIONS/DIA_EBR_105_Raven.d:361","Was belästigst du mich dann?","Allora perché mi hai disturbato?","","","DIA_Raven_SpyBericht_10_06","",""
"Scripts/content/Story/MISSIONS/DIA_EBR_106_Bartholo.d:33","Wer bist du?","Chi sei?","","","Info_Bartholo_HAllo.description","",""
"Scripts/content/Story/MISSIONS/DIA_EBR_106_Bartholo.d:43","Wer bist du?","Chi sei?","","","Info_Bartholo_HAllo_15_00","",""
