"location","source","target","id","fuzzy","context","translator_comments","developer_comments"
"Scripts/content/Story/MISSIONS/DIA_Bau_900_Ricelord.d:33","Du kümmerst dich um die Reisfelder, richtig?","Voi vi occupate delle risaie, vero?","","","DIA_Ricelord_Hello.description","",""
"Scripts/content/Story/MISSIONS/DIA_Bau_900_Ricelord.d:43","Du kümmerst dich um die Reisfelder, richtig?","Voi vi prendete cura delle risaie, vero?","","","DIA_Ricelord_Hello_15_00","",""
"Scripts/content/Story/MISSIONS/DIA_Bau_900_Ricelord.d:44","Warum? Suchst du Arbeit?","Perché, cerchi lavoro?","","","DIA_Ricelord_Hello_12_01","",""
"Scripts/content/Story/MISSIONS/DIA_Bau_900_Ricelord.d:56","Hast du Arbeit für mich?","Hai del lavoro per me?","","","DIA_Ricelord_Arbeit.description","",""
"Scripts/content/Story/MISSIONS/DIA_Bau_900_Ricelord.d:71","Hast du Arbeit für mich?","Hai del lavoro per me?","","","DIA_Ricelord_Arbeit_15_00","",""
"Scripts/content/Story/MISSIONS/DIA_Bau_900_Ricelord.d:72","Geh zu Lefty. Er ist meistens hier vorne rechts neben der Scheune.","Vai a parlare con Lefty, di solito si trova a destra del capanno.","","","DIA_Ricelord_Arbeit_12_01","",""
"Scripts/content/Story/MISSIONS/DIA_Bau_900_Ricelord.d:86","Wir könnten handeln...","Potremmo fare un patto...","","","DIA_Ricelord_TRADE.description","",""
"Scripts/content/Story/MISSIONS/DIA_Bau_900_Ricelord.d:99","Wir könnten handeln ...","Potremmo fare un patto...","","","DIA_Ricelord_TRADE_15_00","",""
"Scripts/content/Story/MISSIONS/DIA_Bau_900_Ricelord.d:100","Was hast du denn zu bieten?","Cosa hai da offrire?","","","DIA_Ricelord_TRADE_12_01","",""
"Scripts/content/Story/MISSIONS/DIA_Bau_900_Ricelord.d:113","Lefty schickt mich.","Mi manda Lefty.","","","DIA_Ricelord_LeftySentMe.description","",""
"Scripts/content/Story/MISSIONS/DIA_Bau_900_Ricelord.d:129","Lefty schickt mich.","Mi manda Lefty.","","","DIA_Ricelord_LeftySentMe_15_00","",""
"Scripts/content/Story/MISSIONS/DIA_Bau_900_Ricelord.d:130","Ach so. Was hat er gesagt?","Cosa ha detto?","","","DIA_Ricelord_LeftySentMe_12_01","",""
"Scripts/content/Story/MISSIONS/DIA_Bau_900_Ricelord.d:144","Ich soll den Bauern Wasser bringen.","Devo portare un po' d'acqua ai contadini.","","","DIA_Ricelord_GetWater.description","",""
"Scripts/content/Story/MISSIONS/DIA_Bau_900_Ricelord.d:157","Ich soll den Bauern Wasser bringen.","Devo portare un po' d'acqua ai contadini.","","","DIA_Ricelord_GetWater_15_00","",""
"Scripts/content/Story/MISSIONS/DIA_Bau_900_Ricelord.d:161","Gut. Hier sind ein Dutzend Flaschen Wasser.","Bene. Ecco una dozzina di fiaschi.","","","DIA_Ricelord_GetWater_12_01","",""
"Scripts/content/Story/MISSIONS/DIA_Bau_900_Ricelord.d:162","Es gibt etwa doppelt so viele Bauern, also verteil sie gleichmäßig.","Ce n'è circa il doppio di quella che serve ai contadini, quindi assicurati di distribuirla equamente.","","","DIA_Ricelord_GetWater_12_02","",""
"Scripts/content/Story/MISSIONS/DIA_Bau_900_Ricelord.d:174","Das war gestern, Bursche! Geh besser zu ihm. Er hat dir was zu sagen.","Era ieri, amico! Farai meglio ad andare da lui: ha qualcosa da dirti.","","","DIA_Ricelord_GetWater_TooLate_12_00","",""
"Scripts/content/Story/MISSIONS/DIA_Bau_900_Ricelord.d:179","Das war vor einigen Tagen, Bursche! Geh besser zu ihm. Er hat dir was zu sagen.","È stato giorni fa, amico! Farai meglio ad andare da lui: ha qualcosa da dirti.","","","DIA_Ricelord_GetWater_TooLate_12_01","",""
"Scripts/content/Story/MISSIONS/DIA_Bau_901_Horatio.d:34","Lefty schickt mich. Ich hab' Wasser für dich.","Mi manda Lefty. Ti ho portato un po' d'acqua.","","","Info_Horatio_Wasser.description","",""
"Scripts/content/Story/MISSIONS/DIA_Bau_901_Horatio.d:48","Lefty schickt mich. Ich hab' Wasser für dich.","Mi manda Lefty. Ti ho portato un po' d'acqua.","","","Info_Horatio_Wasser_15_00","",""
"Scripts/content/Story/MISSIONS/DIA_Bau_901_Horatio.d:51","Danke, Mann! Ich war schon kurz davor, den Schlamm zu saufen.","Grazie, amico. Stavo per mettermi a bere il fango.","","","Info_Horatio_Wasser_09_01","",""
"Scripts/content/Story/MISSIONS/DIA_Bau_901_Horatio.d:70","Du hast nichts mehr. Ich hol mir von den anderen was.","Non ne hai più. La chiederò agli altri.","","","Info_Horatio_Wasser_NOWATER_09_00","",""
"Scripts/content/Story/MISSIONS/DIA_Bau_901_Horatio.d:97","Was machst du hier? Willst du Ärger haben?","Cosa ci fai qui? Cerchi guai?","","","DIA_Horatio_Hello_09_00","",""
"Scripts/content/Story/MISSIONS/DIA_Bau_901_Horatio.d:100","Ärger? Von wem? Von einem Bauern?","Guai? Con chi? Con un contadino?","","","DIA_Horatio_Hello.DIA_Horatio_Hello_PissOff","Info_AddChoice",""
"Scripts/content/Story/MISSIONS/DIA_Bau_901_Horatio.d:101","Entspann dich! Ich bin neu hier.","Ehi, calmati! Sono nuovo del posto.","","","DIA_Horatio_Hello.DIA_Horatio_Hello_BeCool","Info_AddChoice",""
"Scripts/content/Story/MISSIONS/DIA_Bau_901_Horatio.d:106","Entspann dich! Ich bin neu hier.","Ehi, calmati! Sono nuovo del posto.","","","DIA_Horatio_Hello_BeCool_15_00","",""
"Scripts/content/Story/MISSIONS/DIA_Bau_901_Horatio.d:107","Hm ... siehst mir ganz in Ordnung aus - hier weiß man nie. Da kommt jeden Tag ein neuer Mistkerl, der's wissen will.","Uhm... Sembri un tipo a posto. Non si sa mai. Si incontrano sempre tipi nuovi che pensano di essere in gamba.","","","DIA_Horatio_Hello_BeCool_09_01","",""
"Scripts/content/Story/MISSIONS/DIA_Bau_901_Horatio.d:113","Ärger? Von wem? Von einem Bauern?","Guai? Con chi? Con un contadino?","","","DIA_Horatio_Hello_PissOff_15_00","",""
"Scripts/content/Story/MISSIONS/DIA_Bau_901_Horatio.d:114","Nur weil ich auf den Feldern arbeite, heißt das nicht, dass ich mich nicht gegen Typen wie dich wehren kann.","Solo perché lavoro nei campi, non significa che non sappia difendermi dai tipi come te.","","","DIA_Horatio_Hello_PissOff_09_01","",""
"Scripts/content/Story/MISSIONS/DIA_Bau_901_Horatio.d:115","Also komm nur her, wenn du Ärger willst!","Fatti sotto, se cerchi guai!","","","DIA_Horatio_Hello_PissOff_09_02","",""
"Scripts/content/Story/MISSIONS/DIA_Bau_901_Horatio.d:132","Tut mir leid, der Spruch mit dem Bauern.","Mi dispiace di aver detto quelle cose sui contadini.","","","DIA_Horatio_SORRY.description","",""
"Scripts/content/Story/MISSIONS/DIA_Bau_901_Horatio.d:145","Tut mir Leid, der Spruch mit dem Bauern.","Mi dispiace di aver detto quelle cose sui contadini.","","","DIA_Horatio_SORRY_15_00","",""
"Scripts/content/Story/MISSIONS/DIA_Bau_901_Horatio.d:146","Das hättest du dir eher überlegen sollen, Junge!","Dovevi pensarci prima, ragazzo!","","","DIA_Horatio_SORRY_09_01","",""
"Scripts/content/Story/MISSIONS/DIA_Bau_901_Horatio.d:158","Was macht ein Kerl wie du bei den Bauern?","Cosa ci fa un uomo come te insieme ai contadini?","","","DIA_Horatio_Story.description","",""
"Scripts/content/Story/MISSIONS/DIA_Bau_901_Horatio.d:171","Was macht ein Kerl wie du bei den Bauern?","Cosa ci fa un uomo come te insieme ai contadini?","","","DIA_Horatio_Story_15_00","",""
"Scripts/content/Story/MISSIONS/DIA_Bau_901_Horatio.d:172","Das hat Lee mich auch gefragt, aber ich kämpfe nicht mehr - außer um mich zu verteidigen.","Me l'ha chiesto Lee. Io non combatto più, se non per difendermi.","","","DIA_Horatio_Story_09_01","",""
"Scripts/content/Story/MISSIONS/DIA_Bau_901_Horatio.d:173","Ich habe einmal getötet, das war einmal zu viel. Deswegen haben sie mich in diese gottverdammte Kolonie geworfen - und das war nur gerecht.","Una volta ho ucciso un uomo, ed è stato abbastanza. Ecco perché mi hanno sbattuto in questa fottuta colonia: come segno di giustizia.","","","DIA_Horatio_Story_09_02","",""
"Scripts/content/Story/MISSIONS/DIA_Bau_901_Horatio.d:174","Was ist passiert?","Come è accaduto?","","","DIA_Horatio_Story_15_03","",""
"Scripts/content/Story/MISSIONS/DIA_Bau_901_Horatio.d:175","Es war ein einfacher Streit in einer Kneipe. Ich wollte den Mann nicht töten, aber ich habe zu stark zugeschlagen.","Durante una rissa in una taverna. Non volevo ucciderlo... Devo averlo colpito troppo forte.","","","DIA_Horatio_Story_09_04","",""
"Scripts/content/Story/MISSIONS/DIA_Bau_901_Horatio.d:176","Ich habe damals als Schmied gearbeitet. Ich konnte meine Kraft nicht kontrollieren ...","Ero un fabbro, non mi rendevo conto della mia forza...","","","DIA_Horatio_Story_09_05","",""
"Scripts/content/Story/MISSIONS/DIA_Bau_901_Horatio.d:188","Warum bist du ausgerechnet in DIESES Lager gegangen?","Perché ti sei unito a QUESTO campo?","","","DIA_Horatio_WhyHere.description","",""
"Scripts/content/Story/MISSIONS/DIA_Bau_901_Horatio.d:201","Warum bist du ausgerechnet in DIESES Lager gegangen?","Perché ti sei unito a QUESTO campo?","","","DIA_Horatio_WhyHere_15_00","",""
"Scripts/content/Story/MISSIONS/DIA_Bau_901_Horatio.d:202","Das will ich dir sagen: Die einzig andere Wahl wären die Sektenspinner gewesen, aber ich habe keine Lust, mir von den Gurus den Kopf waschen zu lassen.","Ti dirò: l'unica alternativa era unirmi a quei pazzi della Setta e non volevo che i guru giocassero col mio cervello.","","","DIA_Horatio_WhyHere_09_01","",""
"Scripts/content/Story/MISSIONS/DIA_Bau_901_Horatio.d:203","Im Alten Lager hätte ich keine Ruhe vor den Gardisten gehabt, aber die Söldner und Banditen haben Respekt.","A Campo Vecchio avrei avuto troppi problemi con le guardie, invece mercenari e ladri mostrano un certo rispetto.","","","DIA_Horatio_WhyHere_09_02","",""
"Scripts/content/Story/MISSIONS/DIA_Bau_901_Horatio.d:204","Sie fürchten dich ...","Hanno paura di te...","","","DIA_Horatio_WhyHere_15_03","",""
"Scripts/content/Story/MISSIONS/DIA_Bau_901_Horatio.d:205","Kann schon sein. Immerhin habe ICH hier meinen Frieden gefunden. Und das solltest du auch versuchen.","Forse. In ogni caso, qui ho trovato la pace e tu dovresti fare lo stesso.","","","DIA_Horatio_WhyHere_09_04","",""
"Scripts/content/Story/MISSIONS/DIA_Bau_901_Horatio.d:219","Kannst du mir beibringen, auch so stark zuzuschlagen?","Puoi farmi diventare forte come te?","","","DIA_Horatio_PleaseTeachSTR.description","",""
"Scripts/content/Story/MISSIONS/DIA_Bau_901_Horatio.d:232","Kannst du mir beibringen, auch so stark zuzuschlagen?","Puoi farmi diventare forte come te?","","","DIA_Horatio_PleaseTeachSTR_15_00","",""
"Scripts/content/Story/MISSIONS/DIA_Bau_901_Horatio.d:233","Selbst wenn - zu WAS würde jemand wie du seine Stärke einsetzen?","Anche se potessi, in che modo useresti tale forza?","","","DIA_Horatio_PleaseTeachSTR_09_01","",""
"Scripts/content/Story/MISSIONS/DIA_Bau_901_Horatio.d:238","Damit ich Reislord und seine Schläger fertigmachen kann!","Per spazzare via il Signore del Riso e i suoi scagnozzi!","","","DIA_Horatio_PleaseTeachSTR.DIA_Horatio_PleaseTeachSTR_Ricelord","Info_AddChoice",""
"Scripts/content/Story/MISSIONS/DIA_Bau_901_Horatio.d:242","Gute Frage. Ich werde darüber nachdenken...","Bella domanda. Ci penserò su...","","","DIA_Horatio_PleaseTeachSTR.DIA_Horatio_PleaseTeachSTR_BACK","Info_AddChoice",""
"Scripts/content/Story/MISSIONS/DIA_Bau_901_Horatio.d:245","Zur Selbstverteidigung!","Autodifesa!","","","DIA_Horatio_PleaseTeachSTR.DIA_Horatio_PleaseTeachSTR_Defend","Info_AddChoice",""
"Scripts/content/Story/MISSIONS/DIA_Bau_901_Horatio.d:246","Um den Mistkerlen hier zu zeigen, wie man mit mir zu sprechen hat!","Per insegnare a questi bastardi a rivolgersi a me come si deve!","","","DIA_Horatio_PleaseTeachSTR.DIA_Horatio_PleaseTeachSTR_Attack","Info_AddChoice",""
"Scripts/content/Story/MISSIONS/DIA_Bau_901_Horatio.d:255","Um den Mistkerlen hier zu zeigen, wie man mit mir zu sprechen hat!","Per insegnare a questi bastardi a parlarmi come si deve!","","","DIA_Horatio_PleaseTeachSTR_Attack_15_00","",""
"Scripts/content/Story/MISSIONS/DIA_Bau_901_Horatio.d:256","Und bevor du dich versiehst, bist du nur ein weiterer Mistkerl mehr ... Nein! Dafür werde ich dir nichts beibringen.","E prima ancora di accorgertene, diventeresti un bastardo come loro... Nossignore, non ti addestrerò a questo scopo.","","","DIA_Horatio_PleaseTeachSTR_Attack_09_01","",""
"Scripts/content/Story/MISSIONS/DIA_Bau_901_Horatio.d:262","Zur Selbstverteidigung!","Autodifesa!","","","DIA_Horatio_PleaseTeachSTR_Defend_15_00","",""
"Scripts/content/Story/MISSIONS/DIA_Bau_901_Horatio.d:263","Dazu musst du nur schnell sein und nicht stark. Glaubst du, dass Schädel spalten besser ist als seinen Frieden zu finden?","Ciò richiede velocità, non forza. Pensi davvero che spaccare le teste sia meglio che trovare la pace?","","","DIA_Horatio_PleaseTeachSTR_Defend_09_01","",""
"Scripts/content/Story/MISSIONS/DIA_Bau_901_Horatio.d:268","Gute Frage. Ich werde drüber nachdenken ...","Bella domanda. Ci penserò su...","","","DIA_Horatio_PleaseTeachSTR_BACK_15_00","",""
"Scripts/content/Story/MISSIONS/DIA_Bau_901_Horatio.d:274","Damit ich den Reislord und seine Schläger fertig machen kann!","Per spazzare via il Signore del Riso e i suoi scagnozzi!","","","DIA_Horatio_PleaseTeachSTR_Ricelord_15_00","",""
"Scripts/content/Story/MISSIONS/DIA_Bau_901_Horatio.d:275","Hmm ... Du bist nicht der Erste, der das versucht.","Uhmm... Non saresti il primo a provarci.","","","DIA_Horatio_PleaseTeachSTR_Ricelord_09_01","",""
"Scripts/content/Story/MISSIONS/DIA_Bau_901_Horatio.d:290","Ich hab' nochmal über die Sache nachgedacht...","Ho ripensato a tutto...","","","DIA_Horatio_ThoughtSTR.description","",""
"Scripts/content/Story/MISSIONS/DIA_Bau_901_Horatio.d:303","Ich hab' noch einmal über die Sache nachgedacht ...","Ho ripensato a tutto...","","","DIA_Horatio_ThoughtSTR_15_00","",""
"Scripts/content/Story/MISSIONS/DIA_Bau_901_Horatio.d:304","Und? Ist dir was Besseres eingefallen?","E hai trovato qualcosa di meglio?","","","DIA_Horatio_ThoughtSTR_09_01","",""
"Scripts/content/Story/MISSIONS/DIA_Bau_901_Horatio.d:307","Nein.","No.","","","DIA_Horatio_ThoughtSTR.DIA_Horatio_ThoughtSTR_NoIdea","Info_AddChoice",""
"Scripts/content/Story/MISSIONS/DIA_Bau_901_Horatio.d:312","Ja. Ich will es mit Ricelord und seinen Schlägern aufnehmen können!","Sì. Voglio affrontare il Signore del Riso e i suoi scagnozzi!","","","DIA_Horatio_ThoughtSTR.DIA_Horatio_ThoughtSTR_Ricelord","Info_AddChoice",""
"Scripts/content/Story/MISSIONS/DIA_Bau_901_Horatio.d:318","Nein.","No.","","","DIA_Horatio_ThoughtSTR_NoIdea_15_00","",""
"Scripts/content/Story/MISSIONS/DIA_Bau_901_Horatio.d:319","Dachte ich mir.","Lo immaginavo.","","","DIA_Horatio_ThoughtSTR_NoIdea_09_01","",""
"Scripts/content/Story/MISSIONS/DIA_Bau_901_Horatio.d:325","Ja. Ich will es mit dem Reislord und seinen Schlägern aufnehmen können!","Sì. Voglio affrontare il Signore del Riso e i suoi scagnozzi!","","","DIA_Horatio_ThoughtSTR_Ricelord_15_00","",""
"Scripts/content/Story/MISSIONS/DIA_Bau_901_Horatio.d:326","Hmm ... Du bist nicht der Erste, der das versucht.","Uhmm... Non saresti il primo a provarci.","","","DIA_Horatio_ThoughtSTR_Ricelord_09_01","",""
"Scripts/content/Story/MISSIONS/DIA_Bau_901_Horatio.d:349","Wenn du stark zuschlagen willst, kommt es auf die richtige Technik an. Das ist das Erste, was du beim Schmieden lernst.","Se vuoi colpire con forza, devi conoscere le tattiche giuste. Questa è la prima cosa che si impara per diventare fabbri.","","","DIA_Horatio_HelpSTR_LEARN_NOW_09_00","",""
"Scripts/content/Story/MISSIONS/DIA_Bau_901_Horatio.d:350","Lerne jeden Teil deines Arms, von der Schulter bis zum Handgelenk, gleichzeitig nach vorne schnellen zu lassen.","Spingi tutto il braccio, dalla spalla fino al polso.","","","DIA_Horatio_HelpSTR_LEARN_NOW_09_01","",""
"Scripts/content/Story/MISSIONS/DIA_Bau_901_Horatio.d:351","Je besser die Technik, umso härter der Schlag. Du wirst es schnell raushaben.","Più ci riuscirai, più potente sarà il colpo. Imparerai in fretta.","","","DIA_Horatio_HelpSTR_LEARN_NOW_09_02","",""
"Scripts/content/Story/MISSIONS/DIA_Bau_901_Horatio.d:361","Ich WERDE den Reislord fertig machen - wenn du mir dabei hilfst!","Io sconfiggerò il Signore del Riso e i suoi scagnozzi, se mi aiuterai!","","","DIA_Horatio_HelpSTR.description","",""
"Scripts/content/Story/MISSIONS/DIA_Bau_901_Horatio.d:374","Ich WERDE den Reislord und seine Schläger fertig machen - wenn du mir dabei hilfst!","Io sconfiggerò il Signore del Riso e i suoi scagnozzi, se mi aiuterai!","","","DIA_Horatio_HelpSTR_15_00","",""
"Scripts/content/Story/MISSIONS/DIA_Bau_901_Horatio.d:375","Gut! Ich habe geschworen, nie wieder jemanden anzugreifen, aber NICHT, es niemandem beizubringen.","Bene! Ho giurato che non avrei mai più attaccato qualcuno, ma non ho mai detto che non avrei insegnato a qualcun altro come si fa.","","","DIA_Horatio_HelpSTR_09_01","",""
"Scripts/content/Story/MISSIONS/DIA_Bau_901_Horatio.d:376","Ich bin ganz Ohr!","Sono tutto orecchi!","","","DIA_Horatio_HelpSTR_15_02","",""
"Scripts/content/Story/MISSIONS/DIA_Bau_901_Horatio.d:393","Danke für deine Hilfe!","Grazie per l'aiuto!","","","DIA_Horatio_Thanks.description","",""
"Scripts/content/Story/MISSIONS/DIA_Bau_901_Horatio.d:406","Danke für deine Hilfe!","Grazie per il tuo aiuto!","","","DIA_Horatio_Thanks_15_00","",""
"Scripts/content/Story/MISSIONS/DIA_Bau_901_Horatio.d:407","Nutze dein Wissen für die gerechte Sache! Und NUR DAFÜR.","Usa la conoscenza per una giusta causa e NIENT'ALTRO.","","","DIA_Horatio_Thanks_09_01","",""
"Scripts/content/Story/MISSIONS/DIA_Bau_902_Pock.d:37","Lefty schickt mich. Ich hab' Wasser für dich.","Mi manda Lefty. Ti ho portato un po' d'acqua.","","","Info_Pock_Wasser.description","",""
"Scripts/content/Story/MISSIONS/DIA_Bau_902_Pock.d:51","Lefty schickt mich. Ich hab' Wasser für dich.","Mi manda Lefty. Ti ho portato un po' d'acqua.","","","Info_Pock_Wasser_15_00","",""
"Scripts/content/Story/MISSIONS/DIA_Bau_902_Pock.d:62","Danke, Junge! Das hab' ich gebraucht!","Grazie, amico! Ne avevo davvero bisogno!","","","Info_Pock_Wasser_04_01","",""
"Scripts/content/Story/MISSIONS/DIA_Bau_902_Pock.d:73","Aber du hast nichts mehr. Ist schon gut, Junge. Ich werd mich an die andern halten.","Ma non ne hai più! Non fa nulla, amico. Chiederò a qualcun altro.","","","Info_Pock_Wasser_NOWATER_04_00","",""
"Scripts/content/Story/MISSIONS/DIA_Bau_902_Pock.d:86","Hi! Ich bin neu hier.","Salve! Sono nuovo di qui.","","","DIA_Pock_Hello.description","",""
"Scripts/content/Story/MISSIONS/DIA_Bau_902_Pock.d:99","Hi! Ich bin neu hier.","Salve! Sono nuovo di qui.","","","DIA_Pock_Hello_15_00","",""
"Scripts/content/Story/MISSIONS/DIA_Bau_902_Pock.d:100","Schön mal wieder ein neues Gesicht zu sehen.","È bello vedere un volto nuovo.","","","DIA_Pock_Hello_04_01","",""
"Scripts/content/Story/MISSIONS/DIA_Bau_902_Pock.d:101","Du bist schon lange in der Kolonie, hm?","Devi essere qui da parecchio, vero?","","","DIA_Pock_Hello_15_02","",""
"Scripts/content/Story/MISSIONS/DIA_Bau_902_Pock.d:102","Stimmt genau, Junge. Ich war einer der Ersten.","Hai maledettamente ragione, ragazzo. Io sono stato uno dei primi.","","","DIA_Pock_Hello_04_03","",""
"Scripts/content/Story/MISSIONS/DIA_Bau_902_Pock.d:114","Dann weißt du bestimmt ne Menge über all das hier?","Quindi saprai molte cose su questo posto!","","","DIA_Pock_KnowMuch.description","",""
"Scripts/content/Story/MISSIONS/DIA_Bau_902_Pock.d:127","Dann weißt du bestimmt ne Menge über all das hier?","Quindi saprai molte cose su questo posto!","","","DIA_Pock_KnowMuch_15_00","",""
"Scripts/content/Story/MISSIONS/DIA_Bau_902_Pock.d:128","Tja wie man's nimmt, die meiste Zeit verbringe ich hier beim Reispflücken.","Insomma... Passo la maggior parte del tempo qui, a raccogliere riso.","","","DIA_Pock_KnowMuch_04_01","",""
"Scripts/content/Story/MISSIONS/DIA_Bau_902_Pock.d:129","Nur dadurch bin ich so alt geworden. Wir bekommen etwas Reis ab und vielleicht mal Schnaps, nicht viel, aber es reicht.","Ecco perché sono invecchiato così tanto. Tutto quello che riceviamo è un po' di riso e un goccio di grappa ogni tanto. Non è molto, ma ci accontentiamo.","","","DIA_Pock_KnowMuch_04_02","",""
"Scripts/content/Story/MISSIONS/DIA_Bau_902_Pock.d:141","Weshalb bist du hier?","Perché sei qui?","","","DIA_Pock_WhyJail.description","",""
"Scripts/content/Story/MISSIONS/DIA_Bau_902_Pock.d:154","Weshalb bist du hier?","Perché sei qui?","","","DIA_Pock_WhyJail_15_00","",""
"Scripts/content/Story/MISSIONS/DIA_Bau_902_Pock.d:155","Die Steuern, mein Junge, die Steuern. Meine Scheune war so leer wie mein Bauch, da konnte ich nicht mehr zahlen.","Tasse, ragazzo, tasse! Il mio silos era vuoto come il mio stomaco e non potevo pagare.","","","DIA_Pock_WhyJail_04_01","",""
"Scripts/content/Story/MISSIONS/DIA_Bau_902_Pock.d:156","Irgendwann kamen die Soldaten und brachten mich her. Aber hier ist es nicht schlechter als draußen. Ich werde wenigstens nicht vor Hunger sterben.","Un giorno sono venuti i soldati e mi hanno portato qui. In ogni caso, non è poi così peggio che fuori. Almeno non morirò di fame!","","","DIA_Pock_WhyJail_04_02","",""
"Scripts/content/Story/MISSIONS/DIA_Bau_902_Pock.d:157","Hab immer meine Steuern gezahlt - jahrelang. Aber das hat dem Hurensohn mit der Krone nicht gereicht!","Avevo sempre pagato regolarmente per tutta la vita. Ma questo non era sufficiente per quel figlio di puttana con la corona!","","","DIA_Pock_WhyJail_04_03","",""
"Scripts/content/Story/MISSIONS/DIA_Bau_902_Pock.d:170","Alles klar bei dir?","Tutto a posto?","","","DIA_Pock_ForgotAll.description","",""
"Scripts/content/Story/MISSIONS/DIA_Bau_902_Pock.d:183","Alles klar bei dir?","Tutto a posto?","","","DIA_Pock_ForgotAll_15_00","",""
"Scripts/content/Story/MISSIONS/DIA_Bau_902_Pock.d:184","Schön mal wieder ein neues Gesicht zu sehen.","È bello vedere un volto nuovo.","","","DIA_Pock_ForgotAll_04_01","",""
"Scripts/content/Story/MISSIONS/DIA_Bau_902_Pock.d:185","Moment mal! Wir hatten uns schon unterhalten.","Aspetta un attimo! Abbiamo già parlato.","","","DIA_Pock_ForgotAll_15_02","",""
"Scripts/content/Story/MISSIONS/DIA_Bau_902_Pock.d:186","Nein! Nein, das ist ausgeschlossen. Dich hab' ich hier noch nie gesehen.","No, non è possibile. Non ti ho mai visto prima.","","","DIA_Pock_ForgotAll_04_03","",""
"Scripts/content/Story/MISSIONS/DIA_Bau_902_Pock.d:187","Natürlich ...","Certo...","","","DIA_Pock_ForgotAll_15_04","",""
"Scripts/content/Story/MISSIONS/DIA_Bau_903_Rufus.d:34","Lefty schickt mich. Ich hab' Wasser für dich.","Mi manda Lefty. Ti ho portato un po' d'acqua.","","","Info_Rufus_Wasser.description","",""
"Scripts/content/Story/MISSIONS/DIA_Bau_903_Rufus.d:48","Lefty schickt mich. Ich hab' Wasser für dich.","Mi manda Lefty. Ti ho portato un po' d'acqua.","","","Info_Rufus_Wasser_15_00","",""
"Scripts/content/Story/MISSIONS/DIA_Bau_903_Rufus.d:51","Danke, Mann. Ich sterbe vor Durst.","Grazie, amico, ho la bocca secca come il deserto!","","","Info_Rufus_Wasser_02_01","",""
"Scripts/content/Story/MISSIONS/DIA_Bau_903_Rufus.d:70","Wasser! Hey, Mann! Du hast nichts mehr! Haben wieder alle was gekriegt bis auf mich?","Acqua! Ehi, è finita! Non dirmi che l'hanno avuta tutti tranne me ancora una volta!","","","Info_Rufus_Wasser_NOWATER_02_00","",""
"Scripts/content/Story/MISSIONS/DIA_Bau_903_Rufus.d:83","Hi! Ich bin neu hier. Wollte mal fragen, was hier so läuft.","Salve! Cosa succede da queste parti?","","","DIA_Rufus_Hello.description","",""
"Scripts/content/Story/MISSIONS/DIA_Bau_903_Rufus.d:93","Hi! Ich bin neu hier. Wollte mal fragen, was hier so läuft.","Salve! Cosa succede da queste parti?","","","DIA_Rufus_Hello_15_00","",""
"Scripts/content/Story/MISSIONS/DIA_Bau_903_Rufus.d:94","Frag jemand anderen. Ich arbeite den ganzen Tag auf den Feldern und krieg nichts von dem mit, was hier läuft.","Chiedi a qualcun altro. Io qui lavoro e basta: non so nulla.","","","DIA_Rufus_Hello_02_01","",""
"Scripts/content/Story/MISSIONS/DIA_Bau_903_Rufus.d:95","Mann, wie gerne würd' ich zum Reislord gehen und ihm sagen, er soll seinen Scheiß alleine machen!","Amico, come vorrei dire al Signore del Riso di farlo lui questo schifo di lavoro!","","","DIA_Rufus_Hello_02_02","",""
"Scripts/content/Story/MISSIONS/DIA_Bau_903_Rufus.d:107","Wenn's dir nicht gefällt, warum arbeitest du dann hier? ","Se non ti piace, perché lavori qui?","","False","DIA_Rufus_Why.description","",""
"Scripts/content/Story/MISSIONS/DIA_Bau_903_Rufus.d:120","Wenn's dir nicht gefällt, warum arbeitest du dann hier?","Se non ti piace, perché lavori qui?","","","DIA_Rufus_Why_15_00","",""
"Scripts/content/Story/MISSIONS/DIA_Bau_903_Rufus.d:121","Es war am ersten Tag als ich hier war. Lefty, einer der Schläger, die für den Reislord arbeiten, kam zu mir und fragte mich, ob ich mal kurz auf den Reisfeldern helfen könnte.","È successo il giorno che sono arrivato qui. Lefty, uno degli scagnozzi del Signore del Riso, è venuto da me e mi ha chiesto se potevo dare una mano nelle risaie.","","","DIA_Rufus_Why_02_01","",""
"Scripts/content/Story/MISSIONS/DIA_Bau_903_Rufus.d:122","Klar, hab' ich gesagt. Ich war neu und wollte mich nützlich machen.","Certo!', gli risposi. Ero nuovo e volevo rendermi utile.","","","DIA_Rufus_Why_02_02","",""
"Scripts/content/Story/MISSIONS/DIA_Bau_903_Rufus.d:123","Als ich mich am nächsten Tag von der Arbeit ausruhte, steht der Typ schon wieder vor mir.","Il giorno dopo, mentre mi stavo riposando, è tornato da me.","","","DIA_Rufus_Why_02_03","",""
"Scripts/content/Story/MISSIONS/DIA_Bau_903_Rufus.d:124","'Du willst doch nicht deine Kollegen ganz alleine schuften lassen?', hat er gesagt.","Mi ha chiesto: 'Non vorrai che i tuoi colleghi sbrighino tutto il lavoro, vero?'","","","DIA_Rufus_Why_02_04","",""
"Scripts/content/Story/MISSIONS/DIA_Bau_903_Rufus.d:125","Ich hab' ihm erklärt, dass ich kaputt bin vom Tag vorher, dass ich mich ausruhen muss und so. Aber er hat mir nicht zugehört.","Gli ho detto che ero esausto per il lavoro del giorno precedente, che avevo bisogno di riposo eccetera. Ma non mi ha ascoltato.","","","DIA_Rufus_Why_02_05","",""
