"location","source","target","id","fuzzy","context","translator_comments","developer_comments"
"Scripts/content/Story/MISSIONS/DIA_GRD_219_Stone.d:144","Ich hätte eine hier, aber du scheinst nicht genug Erz dabei zu haben! Komm wieder, wenn du sie dir leisten kannst!","Есть у меня одни в запасе, но, похоже, у тебя не хватит на них руды! Будет руда - будут доспехи!","","","GRD_219_Stone_BETTERARMOR_Info_M_06_03","",""
"Scripts/content/Story/MISSIONS/DIA_GRD_219_Stone.d:148","In Ordnung, hier ist deine neue Garderüstung! Lass sie dir nicht zu sehr von den Söldnern zerbeulen, hahaha!","Хорошо, вот держи. Специально для тебя, новенькие, только не позволяй наемникам их дырявить!","","","GRD_219_Stone_BETTERARMOR_Info_M_06_04","",""
"Scripts/content/Story/MISSIONS/DIA_GRD_219_Stone.d:159","Ich möchte eine schwere Garderüstung haben.","Мне нужны тяжелые доспехи стражника.","","","GRD_219_Stone_BETTERARMOR_Info_H_15_01","",""
"Scripts/content/Story/MISSIONS/DIA_GRD_219_Stone.d:160","Nur die höchsten Gardisten dürfen so eine Rüstung tragen. Und du bist noch nicht lange genug dabei, fürchte ich.","Такие доспехи только для матерых стражников. А ты, парень, до них не дорос.","","","GRD_219_Stone_BETTERARMOR_Info_H_06_02","",""
"Scripts/content/Story/MISSIONS/DIA_GRD_219_Stone.d:166","Ich hab' es mir anders überlegt!","Я передумал.  ","","","GRD_219_Stone_BETTERARMOR_Info_BACK_15_01","",""
"Scripts/content/Story/MISSIONS/DIA_GRD_219_Stone.d:167","Wie du meinst. Du weißt, wo du mich findest!","Твое дело. Ты знаешь, где меня найти.","","","GRD_219_Stone_BETTERARMOR_Info_BACK_06_02","",""
"Scripts/content/Story/MISSIONS/DIA_GRD_219_Stone.d:204","Wir sehen uns.","Еще увидимся.","","","Info_EXIT_06_02","",""
"Scripts/content/Story/MISSIONS/DIA_GRD_219_Stone.d:209","Wir sehen uns.","Еще увидимся.","","","Info_EXIT_06_03","",""
"Scripts/content/Story/MISSIONS/DIA_GRD_219_Stone.d:244","Was willst du, du siehst nicht aus wie einer von Gomez' Schergen?","Чего тебе? Ты не похож на прихвостней Гомеза.","","","DIA_GRD_219_Stone_06_01","",""
"Scripts/content/Story/MISSIONS/DIA_GRD_219_Stone.d:256","Stimmt, ich gehöre nicht zu Gomez","Правда, я не один из его людей.","","","DIA_GRD_219_Stone1.description","",""
"Scripts/content/Story/MISSIONS/DIA_GRD_219_Stone.d:269","Stimmt, ich gehöre nicht zu Gomez.","Правда, я не один из его людей.","","","DIA_GRD_219_Stone1_15_01","",""
"Scripts/content/Story/MISSIONS/DIA_GRD_219_Stone.d:270","Wie bist du dann hier rein gekommen? Gomez hatte den Schlüssel zum Kerker.","Тогда как ты сюда попал? Ключи от камер Гомез держит при себе...","","","DIA_GRD_219_Stone1_06_02","",""
"Scripts/content/Story/MISSIONS/DIA_GRD_219_Stone.d:271","Er hat ihn mir überlassen.","Скажем так, он сам отдал их мне.","","","DIA_GRD_219_Stone1_15_03","",""
"Scripts/content/Story/MISSIONS/DIA_GRD_219_Stone.d:272","Du willst doch nicht andeuten, dass DU Gomez aus dem Weg geräumt hast?","Хочешь сказать, что ты тот парень, который поставил Гомеза на место?","","","DIA_GRD_219_Stone1_06_04","",""
"Scripts/content/Story/MISSIONS/DIA_GRD_219_Stone.d:273","Doch, will ich.","Да, это я.","","","DIA_GRD_219_Stone1_15_05","",""
"Scripts/content/Story/MISSIONS/DIA_GRD_219_Stone.d:274","Junge, das hätte ich dir gar nicht zugetraut, es freut mich aber, dass dieser dreckige Halsabschneider endlich das bekommen hat, was er verdient.","Парень, вот уж никогда бы не подумал! Но я рад, что этот подлый головорез наконец-то получил свое!","","","DIA_GRD_219_Stone1_06_06","",""
"Scripts/content/Story/MISSIONS/DIA_GRD_219_Stone.d:275","Aber warum hast du mich befreit?","Но зачем тебе спасать меня?","","","DIA_GRD_219_Stone1_06_07","",""
"Scripts/content/Story/MISSIONS/DIA_GRD_219_Stone.d:276","Ich habe gehört, dass du im Kerker bist, und habe die Gelegenheit genutzt, um Gomez ruhig zu stellen und dich zu befreien.","Я услышал, что тебя посадили за решетку, и решил использовать эту возможность, чтобы устранить Гомеза и освободить тебя.","","","DIA_GRD_219_Stone1_15_08","",""
"Scripts/content/Story/MISSIONS/DIA_GRD_219_Stone.d:277","Habe Dank ...","Ну, спасибо...","","","DIA_GRD_219_Stone1_06_09","",""
"Scripts/content/Story/MISSIONS/DIA_GRD_219_Stone.d:278","... ich stehe in deiner Schuld, triff mich in der Schmiede, dort reden wir weiter.","... Я твой должник. Будет минутка, заходи ко мне в кузницу, поболтаем.","","","DIA_GRD_219_Stone1_06_10","",""
"Scripts/content/Story/MISSIONS/DIA_GRD_219_Stone.d:304","Da bist du ja. Da du mich aus diesem Rattenloch befreit hast, hast du was gut bei mir, Mann!","А вот и ты. Дай мне тебя отблагодарить за то, что ты меня вытащил из той крысиной норы!","","","DIA_GRD_219_Stone3_06_01","",""
"Scripts/content/Story/MISSIONS/DIA_GRD_219_Stone.d:305","Ich habe mir überlegt, da es nicht viel gibt, was ich dir geben kann, werde ich dir etwas schmieden.","Знаешь, я вот подумал: мне ведь нечего тебе подарить, может, я скую для тебя что-нибудь, а?","","","DIA_GRD_219_Stone3_06_02","",""
"Scripts/content/Story/MISSIONS/DIA_GRD_219_Stone.d:306","Könnte ein Ring sein oder etwas Vergleichbares ...","Может, кольцо или что-то в этом роде...","","","DIA_GRD_219_Stone3_06_03","",""
"Scripts/content/Story/MISSIONS/DIA_GRD_219_Stone.d:319","Warum hat man dich in den Kerker geworfen?","Кто посадил тебя за решетку? Как ты здесь оказался?","","","DIA_GRD_219_Stone2.description","",""
"Scripts/content/Story/MISSIONS/DIA_GRD_219_Stone.d:332","Warum hat man dich in den Kerker geworfen?","Кто посадил тебя за решетку? Как ты здесь оказался?","","","DIA_GRD_219_Stone2_15_01","",""
"Scripts/content/Story/MISSIONS/DIA_GRD_219_Stone.d:333","Gomez! Der Bastard hat mir unterstellt, dass ich gemeinsame Sache mit den Feuermagiern machen würde. Nur weil ich der beste Schmied im Alten Lager bin, konnte ich meinen Kopf retten.","Гомез! Эта свинья обвинила меня в сговоре с магами Огня. Я жив до сих пор, только потому, что лучший кузнец на весь Старый лагерь.","","","DIA_GRD_219_Stone2_06_02","",""
"Scripts/content/Story/MISSIONS/DIA_GRD_219_Stone.d:334","Er hat mich in dieses Rattenloch werfen lassen und immer nur dann rausgelassen, wenn er meine Fähigkeiten gebraucht hat.","Меня бросили в эту крысиную нору и выпускали, только когда нужно было поработать на Гомеза.","","","DIA_GRD_219_Stone2_06_03","",""
"Scripts/content/Story/MISSIONS/DIA_GRD_219_Stone.d:347","Kannst du mir diese Erzrüstung verstärken?","Ты можешь усилить эти железные доспехи?","","","DIA_GRD_219_Stone4.description","",""
"Scripts/content/Story/MISSIONS/DIA_GRD_219_Stone.d:360","Kannst du mir diese Erzrüstung verstärken?","Ты можешь усилить эти железные доспехи?","","","DIA_GRD_219_Stone4_15_01","",""
"Scripts/content/Story/MISSIONS/DIA_GRD_219_Stone.d:361","Natürlich kann ich sie verstärken? Gib sie mir und warte kurz.","Конечно, могу. Давай сюда, минутку и все будет готово.","","","DIA_GRD_219_Stone4_06_02","",""
"Scripts/content/Story/MISSIONS/DIA_GRD_219_Stone.d:380","Hier ist die verstärkte Rüstung, damit habe ich meine Schuld beglichen.","Держи, теперь эти доспехи мощнее и мы в расчете.","","","DIA_GRD_219_Stone4_06_03","",""
"Scripts/content/Story/MISSIONS/DIA_GRD_219_Stone.d:392","Ich könnte einen Ring gebrauchen, der meine Lebenskraft steigert.","Я хотел бы получить кольцо, чтобы повысить мою жизненную энергию.","","","DIA_GRD_219_Stone5.description","",""
"Scripts/content/Story/MISSIONS/DIA_GRD_219_Stone.d:405","Ich könnte einen Ring gebrauchen, der meine Lebenskraft steigert.","Я хотел бы получить кольцо, чтобы повысить мою жизненную энергию.","","","DIA_GRD_219_Stone5_15_01","",""
"Scripts/content/Story/MISSIONS/DIA_GRD_219_Stone.d:406","Das ist nicht so schwer, warte kurz.","Это просто. Минуту.","","","DIA_GRD_219_Stone5_06_02","",""
"Scripts/content/Story/MISSIONS/DIA_GRD_219_Stone.d:418","Dieser Ring verleiht dir Lebenskraft, damit müsste meine Schuld mehr als beglichen sein.","Кольцо здоровья даст тебе дополнительный запас жизненных сил. Думаю, теперь мы в расчете.","","","DIA_GRD_219_Stone5_06_03","",""
"Scripts/content/Story/MISSIONS/DIA_GRD_219_Stone.d:433","Ich will einen Schutzring geschmiedet haben","Наверное, мне пригодилось бы Кольцо Защиты.","","","DIA_GRD_219_Stone6.description","",""
"Scripts/content/Story/MISSIONS/DIA_GRD_219_Stone.d:446","Ich will einen Schutzring geschmiedet haben.","Наверное, мне пригодилось бы Кольцо защиты.","","","DIA_GRD_219_Stone6_15_01","",""
"Scripts/content/Story/MISSIONS/DIA_GRD_219_Stone.d:447","Einen Schutzring, dann gehe ich an die Arbeit. Warte solange.","Кольцо защиты? Хорошо, прямо сейчас и сделаю. Подожди немного.","","","DIA_GRD_219_Stone6_06_02","",""
"Scripts/content/Story/MISSIONS/DIA_GRD_219_Stone.d:459","Einen Schutzring wolltest du, hier ist er, jetzt sind wir quitt.","Хотел Кольцо защиты - получил. Так что теперь мы в расчете.","","","DIA_GRD_219_Stone6_06_03","",""
"Scripts/content/Story/MISSIONS/DIA_GRD_219_Stone.d:472","Schmiede mir einen Gegenstand, der meine magische Energie vermehrt.","Сделай мне то, что повысит мою магическую силу.","","","DIA_GRD_219_Stone7.description","",""
"Scripts/content/Story/MISSIONS/DIA_GRD_219_Stone.d:485","Schmiede mir einen Gegenstand, der meine magische Energie vermehrt.","Сделай мне то, что повысит мою магическую силу.","","","DIA_GRD_219_Stone7_15_01","",""
"Scripts/content/Story/MISSIONS/DIA_GRD_219_Stone.d:486","... Einen Gegenstand, der magische Energie vermehrt ... ein Amulett, ich schmiede dir ein Amulett. Das dauert nicht lange.","...Повысить магическую силу?.. Амулет! Точно, я скую тебе Амулет магии. Подожди немного.","","","DIA_GRD_219_Stone7_06_02","",""
"Scripts/content/Story/MISSIONS/DIA_GRD_219_Stone.d:498","So, das Amulett ist fertig, und ich muss sagen, es ist mir gut gelungen. Somit ist die Schuld beglichen.","Вот, амулет готов. Отличная вещь получилась, думаю, ты в обиде не остался.","","","DIA_GRD_219_Stone7_06_03","",""
"Scripts/content/Story/MISSIONS/DIA_GRD_233_Bloodwyn.d:24","Wir sehen uns.","Еще увидимся.","","","Info_Bloodwyn_EXIT_Schutzgeld_15_00","",""
"Scripts/content/Story/MISSIONS/DIA_GRD_233_Bloodwyn.d:27","Pass gut auf dich auf, Kleiner!","Будь осторожен здесь!","","","Info_Bloodwyn_EXIT_Schutzgeld_08_01","",""
"Scripts/content/Story/MISSIONS/DIA_GRD_233_Bloodwyn.d:31","Mach dir keine Sorgen, während du hier im Lager bist! Wir passen auf dich auf.","Ни о чем не беспокойся. Мы позаботимся о твоей безопасности.","","","Info_Bloodwyn_EXIT_Schutzgeld_08_02","",""
"Scripts/content/Story/MISSIONS/DIA_GRD_233_Bloodwyn.d:59","Hey du!","Эй, ты!","","","Info_Bloodwyn_Hello_08_00","",""
"Scripts/content/Story/MISSIONS/DIA_GRD_233_Bloodwyn.d:60","Redest du mit mir?","Ты хочешь поговорить?","","","Info_Bloodwyn_Hello_15_01","",""
"Scripts/content/Story/MISSIONS/DIA_GRD_233_Bloodwyn.d:61","Ich will dich warnen! Jemand wie du hat hier schnell Ärger am Hals!","Хочу предупредить тебя! Постарайся не делать глупостей, хорошо?","","","Info_Bloodwyn_Hello_08_02","",""
"Scripts/content/Story/MISSIONS/DIA_GRD_233_Bloodwyn.d:62","Und die meisten, die sie hier reingeworfen haben, sind Arschlöcher!","Большинство тех, кто сюда попадает, бандиты и убийцы.","","","Info_Bloodwyn_Hello_08_03","",""
"Scripts/content/Story/MISSIONS/DIA_GRD_233_Bloodwyn.d:63","Sie denken, dass sie mit dir machen können, was sie wollen. Aber das lassen wir nicht zu.","Они думают, что им все позволено. Но мы стараемся пресечь своеволие.","","","Info_Bloodwyn_Hello_08_04","",""
"Scripts/content/Story/MISSIONS/DIA_GRD_233_Bloodwyn.d:64","Gomez will, dass Ruhe im Lager herrscht. Und wir Gardisten sorgen dafür. Aber so eine Aufgabe ist extrem kostspielig.","Гомeз хочет, чтобы в лагере было спокойно, и мы следим за этим. Но эта работа не из легких.","","","Info_Bloodwyn_Hello_08_05","",""
"Scripts/content/Story/MISSIONS/DIA_GRD_233_Bloodwyn.d:65","Darum bitte ich dich um etwas Erz. Du musst das als Freundschaftsdienst verstehen. Du hilfst uns und wir helfen dir. Wenn du mal Ärger hast, sind wir da.","Вот поэтому я предлагаю тебе поделиться по- дружески рудой в награду за наши труды. Ты поможешь нам - мы поможем тебе, если у тебя возникнут проблемы.","","","Info_Bloodwyn_Hello_08_06","",""
"Scripts/content/Story/MISSIONS/DIA_GRD_233_Bloodwyn.d:68","Warum nicht. An wieviel Erz hattest du denn gedacht?","Почему бы и нет? Сколько руды тебе нужно?","","","Info_Bloodwyn_Hello.Info_Bloodwyn_Hello_HowMuch","Info_AddChoice",""
"Scripts/content/Story/MISSIONS/DIA_GRD_233_Bloodwyn.d:69","Ich soll Schutzgeld zahlen? Ich kann auf mich selbst aufpassen!","Я должен платить деньги за защиту? Нет уж...","","","Info_Bloodwyn_Hello.Info_Bloodwyn_Hello_ForgetIt","Info_AddChoice",""
"Scripts/content/Story/MISSIONS/DIA_GRD_233_Bloodwyn.d:70","Soll das eine Drohung sein?","Ты мне угрожаешь?","","","Info_Bloodwyn_Hello.Info_Bloodwyn_Hello_SollDrohungSein","Info_AddChoice",""
"Scripts/content/Story/MISSIONS/DIA_GRD_233_Bloodwyn.d:75","Ich soll Schutzgeld zahlen? Ich kann auf mich selbst aufpassen!","Я должен платить деньги за защиту? Нет уж...","","","Info_Bloodwyn_ForgetIt_15_00","",""
"Scripts/content/Story/MISSIONS/DIA_GRD_233_Bloodwyn.d:76","Wie du meinst, Kleiner. Wirst schon sehen, was du davon hast, ein Freundschaftsangebot abzulehnen!","Как хочешь. Быть может, ты еще пожалеешь, что отказался от моего дружеского предложения.","","","Info_Bloodwyn_ForgetIt_08_01","",""
"Scripts/content/Story/MISSIONS/DIA_GRD_233_Bloodwyn.d:86","Soll das eine Drohung sein?","Ты мне угрожаешь?","","","Info_Bloodwyn_SollDrohungSein_15_00","",""
"Scripts/content/Story/MISSIONS/DIA_GRD_233_Bloodwyn.d:87","Im Gegenteil! Es ist ein Freundschaftsangebot!","Наоборот! Я предлагаю тебе дружбу!","","","Info_Bloodwyn_SollDrohungSein_08_01","",""
"Scripts/content/Story/MISSIONS/DIA_GRD_233_Bloodwyn.d:92","Warum nicht. An wie viel Erz hast du denn gedacht?","Почему бы и нет? Сколько руды тебе нужно?","","","Info_Bloodwyn_Hello_HowMuch_15_01","",""
"Scripts/content/Story/MISSIONS/DIA_GRD_233_Bloodwyn.d:93","Nicht viel. 10 Erz, mehr brauche ich nicht.","Не так много. Всего десять кусков.","","","Info_Bloodwyn_Hello_HowMuch_08_02","",""
"Scripts/content/Story/MISSIONS/DIA_GRD_233_Bloodwyn.d:96","Ich habe gerade keine 10 Erz.","Сейчас у меня нет десяти кусков.","","","Info_Bloodwyn_Hello.Info_Bloodwyn_Hello_NotNow","Info_AddChoice",""
"Scripts/content/Story/MISSIONS/DIA_GRD_233_Bloodwyn.d:99","Hier hast du das Erz. Ich kann Freunde brauchen.","Вот тебе руда. Друг всегда может пригодиться.","","","Info_Bloodwyn_Hello.Info_Bloodwyn_Hello_OkTakeIt","Info_AddChoice",""
"Scripts/content/Story/MISSIONS/DIA_GRD_233_Bloodwyn.d:106","Hier hast du das Erz. Ich kann Freunde gebrauchen.","Вот тебе руда. Друг всегда может пригодиться.","","","Info_Bloodwyn_Hello_OkTakeIt_15_00","",""
"Scripts/content/Story/MISSIONS/DIA_GRD_233_Bloodwyn.d:107","Du scheinst mir ein kluges Bürschchen zu sein. Von nun an werden wir auf dich aufpassen.","А ты умный парень. Теперь ты можешь на меня положиться. Я буду защищать тебя.","","","Info_Bloodwyn_Hello_OkTakeIt_08_01","",""
"Scripts/content/Story/MISSIONS/DIA_GRD_233_Bloodwyn.d:108","Aber das heißt nicht, dass du hier machen kannst, was du willst, verstanden?","Но это еще не значит, что тебе здесь будет все позволено, это понятно? ","","","Info_Bloodwyn_Hello_OkTakeIt_08_02","",""
"Scripts/content/Story/MISSIONS/DIA_GRD_233_Bloodwyn.d:121","Ich habe gerade keine 10 Erz.","Сейчас у меня нет десяти кусков.","","","Info_Bloodwyn_Hello_NotNow_15_00","",""
"Scripts/content/Story/MISSIONS/DIA_GRD_233_Bloodwyn.d:122","Dann nehme ich das, was du hast - ist schon okay. Du kannst ja beim nächsten Mal die volle Summe zahlen.","Ну, тогда я возьму у тебя те, что есть. Остальное отдашь в следующий раз.","","","Info_Bloodwyn_Hello_NotNow_08_01","",""
"Scripts/content/Story/MISSIONS/DIA_GRD_233_Bloodwyn.d:124","Lass mal sehen ...","Ну-ка, посмотрим...","","","Info_Bloodwyn_Hello_NotNow_08_02","",""
"Scripts/content/Story/MISSIONS/DIA_GRD_233_Bloodwyn.d:130","Na, was haben wir denn da? Kann da jemand nicht bis 10 zählen?","Что у нас тут есть? Здесь кто-то не умеет считать до десяти, да?","","","Info_Bloodwyn_Hello_NotNow_TenOreMore_08_00","",""
"Scripts/content/Story/MISSIONS/DIA_GRD_233_Bloodwyn.d:131","Ich werd einfach alles nehmen, was du hast. Dafür vergesse ich, dass du mich belogen hast.","Я просто возьму все, что у тебя есть. Тогда я забуду, что ты пытался меня обмануть.","","","Info_Bloodwyn_Hello_NotNow_TenOreMore_08_01","",""
"Scripts/content/Story/MISSIONS/DIA_GRD_233_Bloodwyn.d:135","Ich nehme auch kleine Spenden, es ist der gute Wille, der zählt! Danke für das Erz, Kleiner!","Ну, у тебя мало руды, но мне хватит и этого. Главное, ты согласился платить. Спасибо.","","","Info_Bloodwyn_Hello_NotNow_LessThanTen_08_00","",""
"Scripts/content/Story/MISSIONS/DIA_GRD_233_Bloodwyn.d:136","Von jetzt an werden wir ein Auge auf dich haben, solange du im Lager bist.","Теперь я буду приглядывать за тобой, пока ты будешь в лагере.","","","Info_Bloodwyn_Hello_NotNow_LessThanTen_08_01","",""
"Scripts/content/Story/MISSIONS/DIA_GRD_233_Bloodwyn.d:141","Du hast ja wirklich nichts ... Na, wie gesagt, beim nächsten Mal ...","У тебя совсем ничего нет... Ну, как я сказал, заплатишь в следующий раз...","","","Info_Bloodwyn_Hello_NotNow_NoOre_08_00","",""
"Scripts/content/Story/MISSIONS/DIA_GRD_233_Bloodwyn.d:178","Gut, dass ich dich treffe, mein Freund!","Хорошо, что я тебя встретил!","","","Info_Bloodwyn_PayDay_08_00","",""
"Scripts/content/Story/MISSIONS/DIA_GRD_233_Bloodwyn.d:179","Wie sieht's mit deiner täglichen Unterstützung aus? Deine 10 Erz sind wieder mal fällig.","Ты должен мне десять кусков за защиту - дневную плату. Ты будешь платить?","","","Info_Bloodwyn_PayDay_08_01","",""
"Scripts/content/Story/MISSIONS/DIA_GRD_233_Bloodwyn.d:182","Hier, nimm - 10 Erz sind nicht viel unter Freuden.","Вот, возьми десять кусков. Для друга не жалко.","","","Info_Bloodwyn_PayDay.Info_Bloodwyn_PayDay_PayAgain","Info_AddChoice",""
"Scripts/content/Story/MISSIONS/DIA_GRD_233_Bloodwyn.d:183","Ich werde nicht mehr zahlen - du hast schon genug gekriegt.","Я больше не буду платить. Ты и так получил с меня слишком много.","","","Info_Bloodwyn_PayDay.Info_Bloodwyn_PayDay_PayNoMore","Info_AddChoice",""
"Scripts/content/Story/MISSIONS/DIA_GRD_233_Bloodwyn.d:187","Hey du!","Эй, ты!","","","Info_Bloodwyn_PayDay_Den_08_00","",""
"Scripts/content/Story/MISSIONS/DIA_GRD_233_Bloodwyn.d:188","Was denn jetzt schon wieder?","Что еще тебе от меня нужно?","","","Info_Bloodwyn_PayDay_Den_15_01","",""
"Scripts/content/Story/MISSIONS/DIA_GRD_233_Bloodwyn.d:189","Es ist eine neue Gelegenheit für dich gekommen, dich als Freund zu erweisen.","У тебя есть возможность доказать, что мы друзья.","","","Info_Bloodwyn_PayDay_Den_08_02","",""
"Scripts/content/Story/MISSIONS/DIA_GRD_233_Bloodwyn.d:190","Mit nur 10 Erz bist du dabei - wie sieht's aus?","Всего-то десять кусков руды, ты согласен?","","","Info_Bloodwyn_PayDay_Den_08_03","",""
"Scripts/content/Story/MISSIONS/DIA_GRD_233_Bloodwyn.d:198","Hier, nimm - 10 Erz sind nicht viel unter Freunden","Вот, возьми десять кусков. Для друга не жалко.","","","Info_Bloodwyn_PayDay_PayAgain_15_00","",""
"Scripts/content/Story/MISSIONS/DIA_GRD_233_Bloodwyn.d:199","Genau so sehe ich das auch.","Я тоже так думаю.","","","Info_Bloodwyn_PayDay_PayAgain_08_01","",""
"Scripts/content/Story/MISSIONS/DIA_GRD_233_Bloodwyn.d:210","Ich werde nicht mehr zahlen - du hast schon genug gekriegt.","Я больше не буду платить. Ты и так получил с меня слишком много.","","","Info_Bloodwyn_PayDay_PayNoMore_15_00","",""
"Scripts/content/Story/MISSIONS/DIA_GRD_233_Bloodwyn.d:211","Du enttäuschst mich! Von nun an sind wir keine Freunde mehr. Du wirst selber aufpassen müssen, dass du nicht von üblen Halunken niedergeschlagen und ausgeraubt wirst.","Ты меня разочаровал. С нашей дружбой покончено. Теперь тебе самому придется защищать себя от тех, кто захочет ограбить или убить тебя.","","","Info_Bloodwyn_PayDay_PayNoMore_08_01","",""
"Scripts/content/Story/MISSIONS/DIA_GRD_233_Bloodwyn.d:212","Ich kann ganz gut auf mich selbst aufpassen.","Я и сам смогу защитить себя.","","","Info_Bloodwyn_PayDay_PayNoMore_15_02","",""
"Scripts/content/Story/MISSIONS/DIA_GRD_233_Bloodwyn.d:213","Das werden wir ja sehen ...","Это мы посмотрим...","","","Info_Bloodwyn_PayDay_PayNoMore_08_03","",""
"Scripts/content/Story/MISSIONS/DIA_GRD_233_Bloodwyn.d:232","Ich hab's mir überlegt - ich würde DOCH gern die 10 Erz bezahlen.","Я передумал. Я заплачу тебе десять кусков руды.","","","Info_Bloodwyn_Doch.description","",""
"Scripts/content/Story/MISSIONS/DIA_GRD_233_Bloodwyn.d:245","Ich hab's mir überlegt - ich würde DOCH gern die 10 Erz bezahlen.","Я передумал. Я заплачу тебе десять кусков руды.","","","Info_Bloodwyn_Doch_15_00","",""
"Scripts/content/Story/MISSIONS/DIA_GRD_233_Bloodwyn.d:248","Na siehst du! Du kannst ja DOCH die richtige Entscheidung treffen.","Вот видишь! Ты все-таки можешь принимать правильные решения.","","","Info_Bloodwyn_Doch_08_01","",""
"Scripts/content/Story/MISSIONS/DIA_GRD_233_Bloodwyn.d:249","Und von jetzt an zahlen wir schön brav täglich unsere Unterstützung, ja?","И теперь ты будешь платить мне за защиту каждый день, да? ","","","Info_Bloodwyn_Doch_08_02","",""
"Scripts/content/Story/MISSIONS/DIA_GRD_233_Bloodwyn.d:258","Dann komm wieder, wenn du sie hast.","Так приходи, когда наступит время платить еще.","","","Info_Bloodwyn_Doch_NoOre_08_00","",""
"Scripts/content/Story/MISSIONS/DIA_GRD_233_Bloodwyn.d:269","Jesse schickt mich - ich will seine 10 Erz für ihn zahlen.","Джесс просил меня заплатить за него десять кусков руды.","","","Info_Bloodwyn_PayForJesse.description","",""
