"location","source","target","id","fuzzy","context","translator_comments","developer_comments"
"Scripts/content/Story/MISSIONS/DIA_Grd_201_Jackal.d:237","Sieh mal einer an. Der Typ aus dem Neuen Lager, der uns schon so viel Ärger gemacht hat!","Посмотрите-ка на него! Это же тот тип из Нового лагеря, который постоянно действует нам на нервы!","","","Info_Jackal_PAYDAY_07_03","",""
"Scripts/content/Story/MISSIONS/DIA_Grd_201_Jackal.d:238","Wenn du damals schlauer gewesen wärst, würdest du heute zu uns - den Siegern - gehören!","Если бы ты в свое время принял правильное решение, ты бы был один из нас - победителей!","","","Info_Jackal_PAYDAY_07_04","",""
"Scripts/content/Story/MISSIONS/DIA_Grd_201_Jackal.d:243","Sieh mal einer an. Der Typ aus dem Sumpflager.","Так, так, это еще кто? Один из сумасшедших из Болотного лагеря!","","","Info_Jackal_PAYDAY_07_05","",""
"Scripts/content/Story/MISSIONS/DIA_Grd_201_Jackal.d:244","Du hast dich zu lange bei diesen Spinnern aufgehalten, die haben dein Hirn weich gekocht!","Ты так долго с ними общался, что сам стал похож на этих безголовых!","","","Info_Jackal_PAYDAY_07_06","",""
"Scripts/content/Story/MISSIONS/DIA_Grd_201_Jackal.d:249","Da hilft dir auch nicht, dass du mir Schutzgeld bezahlt hast.","Теперь та руда, которую ты мне заплатил, тебе не поможет.","","","Info_Jackal_PAYDAY_07_07","",""
"Scripts/content/Story/MISSIONS/DIA_Grd_201_Jackal.d:253","Hättest mich damals bezahlen sollen, als es noch Zeit war.","Тебе стоило отдать мне руду тогда, когда у тебя была такая возможность.","","","Info_Jackal_PAYDAY_07_08","",""
"Scripts/content/Story/MISSIONS/DIA_Grd_201_Jackal.d:256","Ihr seid zu weit gegangen! Der Überfall auf die Mine war dumm von euch!","Ты слишком далеко зашел! Зря ты напал на шахту!","","","Info_Jackal_PAYDAY_15_09","",""
"Scripts/content/Story/MISSIONS/DIA_Grd_201_Jackal.d:257","Scheint aber funktioniert zu haben. Und du wirst daran auch nichts ändern, dafür werde ich persönlich Sorge tragen!","Но все получилось как нельзя лучше. И тебе уже ничего не удастся изменить. За это я ручаюсь!","","","Info_Jackal_PAYDAY_07_10","",""
"Scripts/content/Story/MISSIONS/DIA_Grd_201_Jackal.d:258","LOS, WIR MACHEN IHN KALT, JUNGS!!!","Эй, он не должен уйти от нас живым!","","","Info_Jackal_PAYDAY_07_11","",""
"Scripts/content/Story/MISSIONS/DIA_Grd_212_GuardPassage.d:45","HALT!","Стой!","","","Info_Grd_212_FirstWarn_Info_13_01","",""
"Scripts/content/Story/MISSIONS/DIA_Grd_212_GuardPassage.d:46","Was ist?","В чем дело?","","","Info_Grd_212_FirstWarn_Info_15_02","",""
"Scripts/content/Story/MISSIONS/DIA_Grd_212_GuardPassage.d:47","Die Burg darf nur mit Genehmigung betreten werden! Mach, dass du verschwindest!","В замок нельзя входить без разрешения. Убирайся отсюда!","","","Info_Grd_212_FirstWarn_Info_13_03","",""
"Scripts/content/Story/MISSIONS/DIA_Grd_212_GuardPassage.d:82","Bist du taub? Noch ein Schritt und du bist Futter für die Würmer!","Ты что, оглох? Еще шаг, и я прибью тебя на месте.","","","Info_Grd_212_LastWarn_13_01","",""
"Scripts/content/Story/MISSIONS/DIA_Grd_212_GuardPassage.d:161","Ich will in die Burg.","Я хочу попасть в замок!","","","Info_Grd_212_Abblitzen.description","",""
"Scripts/content/Story/MISSIONS/DIA_Grd_212_GuardPassage.d:174","Ich will in die Burg!","Я хочу попасть в замок!","","","Info_Grd_212_Abblitzen_15_00","",""
"Scripts/content/Story/MISSIONS/DIA_Grd_212_GuardPassage.d:175","Das ist ja interessant! ICH will raus aus der verdammten Kolonie!","Да, как интересно! А мне хочется убраться отсюда подальше!","","","Info_Grd_212_Abblitzen_13_01","",""
"Scripts/content/Story/MISSIONS/DIA_Grd_212_GuardPassage.d:176","Kann mir nämlich was Besseres vorstellen, als Pennern wie dir den Eintritt zu verbieten.","И, уж конечно, у меня есть и другие дела, кроме как следить за теми, кто пытается попасть в замок.","","","Info_Grd_212_Abblitzen_13_02","",""
"Scripts/content/Story/MISSIONS/DIA_Grd_212_GuardPassage.d:177","Du könntest mich auch reinlassen.","Ты можешь пропустить меня...","","","Info_Grd_212_Abblitzen_15_03","",""
"Scripts/content/Story/MISSIONS/DIA_Grd_212_GuardPassage.d:178","Kann ich nicht! Thorus kann das.","Нет, не могу! Поговори с Торусом.","","","Info_Grd_212_Abblitzen_13_04","",""
"Scripts/content/Story/MISSIONS/DIA_Grd_212_GuardPassage.d:204","Halt!","Стой!","","","Info_Grd_212_FirstIn_13_00","",""
"Scripts/content/Story/MISSIONS/DIA_Grd_212_GuardPassage.d:205","Entspann dich! Ich hab' mit Thorus geredet. Ich kann rein.","Да ладно, я поговорил с Торусом. Он разрешил мне войти.","","","Info_Grd_212_FirstIn_15_01","",""
"Scripts/content/Story/MISSIONS/DIA_Grd_212_GuardPassage.d:206","Ich werd' mir deine Visage merken. Wenn du Ärger machst, bist du dran!","Я запомню твое лицо. Если ты сделаешь хоть одну ошибку, тебе не сдобровать!","","","Info_Grd_212_FirstIn_13_02","",""
"Scripts/content/Story/MISSIONS/DIA_Grd_212_GuardPassage.d:220","Kann ich immer noch rein?","Я могу войти?","","","Info_Grd_212_Passgate.description","",""
"Scripts/content/Story/MISSIONS/DIA_Grd_212_GuardPassage.d:233","Kann ich immer noch rein?","Я могу войти?","","","Info_Grd_212_Passgate_15_00","",""
"Scripts/content/Story/MISSIONS/DIA_Grd_212_GuardPassage.d:234","Wenn du noch mal so dämlich fragst, nicht mehr.","Еще один вопрос, и я уж точно никогда тебя не впущу.","","","Info_Grd_212_Passgate_13_01","",""
"Scripts/content/Story/MISSIONS/DIA_Grd_213_GuardPassage.d:45","HALT!","Стой!","","","Info_Grd_213_FirstWarn_Info_07_01","",""
"Scripts/content/Story/MISSIONS/DIA_Grd_213_GuardPassage.d:46","Was ist?","В чем дело?","","","Info_Grd_213_FirstWarn_Info_15_02","",""
"Scripts/content/Story/MISSIONS/DIA_Grd_213_GuardPassage.d:47","Du darfst nicht in die Burg! Hau ab!","Тебе нельзя заходить в замок! Убирайся!","","","Info_Grd_213_FirstWarn_Info_07_03","",""
"Scripts/content/Story/MISSIONS/DIA_Grd_213_GuardPassage.d:82","Bist du taub? Noch ein Schritt und du bist Futter für die Würmer!","Ты что, оглох? Еще шаг, и я прибью тебя на месте.","","","Info_Grd_213_LastWarn_07_01","",""
"Scripts/content/Story/MISSIONS/DIA_Grd_213_GuardPassage.d:149","Ich hab' gehört, du bist jetzt einer von uns? Nicht schlecht in so kurzer Zeit.","Я слышал, ты стал одним из нас. Неплохо для того, кто так мало времени провел в колонии.","","","Grd_213_Torwache_WELCOME_Info_07_01","",""
"Scripts/content/Story/MISSIONS/DIA_Grd_213_GuardPassage.d:185","Lass doch mal zur Abwechslung jemanden in die Burg.","Тебе следует менять вид деятельности. Может, пустишь в замок?","","","Info_Grd_213_Abblitzen.description","",""
"Scripts/content/Story/MISSIONS/DIA_Grd_213_GuardPassage.d:198","Du könntest mal ein bisschen Abwechslung in dein Leben bringen. Lass doch mal jemanden in die Burg.","Тебе иногда следует менять вид деятельности, чтобы жизнь разнообразить. Может, пустишь меня в замок?","","","Info_Grd_213_Abblitzen_15_00","",""
"Scripts/content/Story/MISSIONS/DIA_Grd_213_GuardPassage.d:199","Abwechslung? Ist schon 'ne gute Idee - einen wie dich hab' ich schon lange nicht mehr verprügelt.","Разнообразить, говоришь? А мне нравится эта идея. Мне уже так давно не удавалось хорошо проучить такого как ты.","","","Info_Grd_213_Abblitzen_07_01","",""
"Scripts/content/Story/MISSIONS/DIA_Grd_213_GuardPassage.d:213","Na, alles klar?","Ну, все в порядке?","","","Info_Grd_213_Passgate.description","",""
"Scripts/content/Story/MISSIONS/DIA_Grd_213_GuardPassage.d:226","Na, alles klar?","Ну, все в порядке?","","","Info_Grd_213_Passgate_15_00","",""
"Scripts/content/Story/MISSIONS/DIA_Grd_213_GuardPassage.d:227","Lunger hier nicht rum - geh rein.","Хватит стоять в воротах и мешать другим, проходи.","","","Info_Grd_213_Passgate_07_01","",""
"Scripts/content/Story/MISSIONS/DIA_Grd_214_Torwache.d:34","Was machst du hier?","Что ты делаешь?","","","DIA_Grd_214_Torwache_job.description","",""
"Scripts/content/Story/MISSIONS/DIA_Grd_214_Torwache.d:44","Was machst du hier?","Что ты делаешь?","","","DIA_Grd_214_Torwache_job_15_00","",""
"Scripts/content/Story/MISSIONS/DIA_Grd_214_Torwache.d:45","Ich passe auf, dass hier keiner reinkommt, der von Gomez nicht erwünscht ist.","Охраняю замок от всяких незваных гостей, которые могут помешать Гомезу.","","","DIA_Grd_214_Torwache_job_07_01","",""
"Scripts/content/Story/MISSIONS/DIA_Grd_214_Torwache.d:46","Also mach keinen Ärger, wenn du drin bist, sonst bist du das letzte Mal hier gewesen.","Так что тебе лучше не делать глупостей, когда окажешься внутри, иначе тебя больше никто туда не пропустит.","","","DIA_Grd_214_Torwache_job_07_02","",""
"Scripts/content/Story/MISSIONS/DIA_Grd_214_Torwache.d:73","Hey, gut dass du da bist. Thorus will dich sprechen!","Рад, что ты объявился. Торус хочет поговорить с тобой!","","","Grd_214_Torwache_SEETHORUS_Info_07_01","",""
"Scripts/content/Story/MISSIONS/DIA_Grd_214_Torwache.d:74","Was will er denn?","А что ему нужно?","","","Grd_214_Torwache_SEETHORUS_Info_15_02","",""
"Scripts/content/Story/MISSIONS/DIA_Grd_214_Torwache.d:75","Das wird er dir schon selber sagen.","Он сам тебе все расскажет.","","","Grd_214_Torwache_SEETHORUS_Info_07_03","",""
"Scripts/content/Story/MISSIONS/DIA_Grd_214_Torwache.d:102","HEY DU!!! Versuchst wohl Dusty hier herauszuschmuggeln, was?","Эй, ты! Надеюсь, ты не собираешься вывести Дасти из лагеря? ","","","Grd_214_Torwache_NODUSTY_Info_07_01","",""
"Scripts/content/Story/MISSIONS/DIA_Grd_214_Torwache.d:103","Wir wollen doch nur...","Мы просто хотели...","","","Grd_214_Torwache_NODUSTY_Info_15_02","",""
"Scripts/content/Story/MISSIONS/DIA_Grd_214_Torwache.d:104","Du willst gleich gar nichts mehr!","Очень скоро ты уже ничего хотеть не будешь!","","","Grd_214_Torwache_NODUSTY_Info_07_03","",""
"Scripts/content/Story/MISSIONS/DIA_Grd_215_Torwache.d:47","Wo soll's denn hingehen?","И куда это мы идем?","","","DIA_Grd_215_Torwache_First_06_00","",""
"Scripts/content/Story/MISSIONS/DIA_Grd_215_Torwache.d:48","Ich will ins Lager.","В лагерь.","","","DIA_Grd_215_Torwache_First_15_01","",""
"Scripts/content/Story/MISSIONS/DIA_Grd_215_Torwache.d:49","Du bist doch nicht hergekommen, um Ärger zu machen, oder?","От тебя ведь не будет неприятностей, а? Парень?","","","DIA_Grd_215_Torwache_First_06_02","",""
"Scripts/content/Story/MISSIONS/DIA_Grd_215_Torwache.d:52","Klar, ich hatte mir vorgenommen, das ganze Lager auseinanderzunehmen!","Ну, я тут, знаешь ли, хотел весь лагерь взорвать...","","","DIA_Grd_215_Torwache_First.DIA_Grd_215_Torwache_First_Trouble","Info_AddChoice",""
"Scripts/content/Story/MISSIONS/DIA_Grd_215_Torwache.d:53","Ich will mich nur ein bißchen umsehen.","Да просто хотел посмотреть, что здесь есть.","","","DIA_Grd_215_Torwache_First.DIA_Grd_215_Torwache_First_JustLooking","Info_AddChoice",""
"Scripts/content/Story/MISSIONS/DIA_Grd_215_Torwache.d:56","Diego hat gesagt, ich soll ihn im Lager treffen.","Диего сказал, что я должен встретиться с ним в лагере.","","","DIA_Grd_215_Torwache_First.DIA_Grd_215_Torwache_First_Diego","Info_AddChoice",""
"Scripts/content/Story/MISSIONS/DIA_Grd_215_Torwache.d:62","Klar, ich hatte mir vorgenommen, das ganze Lager auseinander zu nehmen!","Ну, я тут, знаешь ли, хотел весь лагерь взорвать...","","","DIA_Grd_215_Torwache_First_Trouble_15_00","",""
"Scripts/content/Story/MISSIONS/DIA_Grd_215_Torwache.d:63","Ein witziger Kerl ... Ich mag keine witzigen Kerle.","А ты шутник... Не люблю шутов.","","","DIA_Grd_215_Torwache_First_Trouble_06_01","",""
"Scripts/content/Story/MISSIONS/DIA_Grd_215_Torwache.d:73","Ich will mich nur ein bisschen umsehen.","Да просто хотел посмотреть, что здесь есть.","","","DIA_Grd_215_Torwache_First_JustLooking_15_00","",""
"Scripts/content/Story/MISSIONS/DIA_Grd_215_Torwache.d:74","Umsehen kostet 10 Erz.","За это с тебя десять кусков руды.","","","DIA_Grd_215_Torwache_First_JustLooking_06_01","",""
"Scripts/content/Story/MISSIONS/DIA_Grd_215_Torwache.d:77","Vergiß es.","А, забудь об этом.","","","DIA_Grd_215_Torwache_First.DIA_Grd_215_Torwache_First_NoPay","Info_AddChoice",""
"Scripts/content/Story/MISSIONS/DIA_Grd_215_Torwache.d:78","Gut, hier sind deine 10 Erz.","Ладно, вот твои десять кусков.","","","DIA_Grd_215_Torwache_First.DIA_Grd_215_Torwache_First_Pay","Info_AddChoice",""
"Scripts/content/Story/MISSIONS/DIA_Grd_215_Torwache.d:83","Diego hat gesagt, ich soll ihn im Lager treffen.","Диего сказал, что я должен встретиться с ним в лагере.","","","DIA_Grd_215_Torwache_First_Diego_15_00","",""
"Scripts/content/Story/MISSIONS/DIA_Grd_215_Torwache.d:84","Gut - du kannst reingehen.","Ладно, раз так - проходи.","","","DIA_Grd_215_Torwache_First_Diego_06_01","",""
"Scripts/content/Story/MISSIONS/DIA_Grd_215_Torwache.d:90","Vergiss es.","А, забудь об этом.","","","DIA_Grd_215_Torwache_First_NoPay_15_00","",""
"Scripts/content/Story/MISSIONS/DIA_Grd_215_Torwache.d:91","Dann zisch ab.","Тогда убирайся.","","","DIA_Grd_215_Torwache_First_NoPay_06_01","",""
"Scripts/content/Story/MISSIONS/DIA_Grd_215_Torwache.d:99","Gut, hier sind deine 10 Erz.","Ладно, вот твои десять кусков.","","","DIA_Grd_215_Torwache_First_Pay_15_00","",""
"Scripts/content/Story/MISSIONS/DIA_Grd_215_Torwache.d:100","Dann mal immer rein mit dir.","Другой разговор, заходи.","","","DIA_Grd_215_Torwache_First_Pay_06_01","",""
"Scripts/content/Story/MISSIONS/DIA_Grd_215_Torwache.d:105","So viel hab' ich nicht.","Но у меня не так много руды.","","","DIA_Grd_215_Torwache_First_Pay_NoOre_15_00","",""
"Scripts/content/Story/MISSIONS/DIA_Grd_215_Torwache.d:106","Diesmal mach' ich noch 'ne Ausnahme - weil du neu bist .","Хорошо, сделаю исключение для тебя, как для новенького. Но только один раз.","","","DIA_Grd_215_Torwache_First_Pay_NoOre_06_01","",""
"Scripts/content/Story/MISSIONS/DIA_Grd_215_Torwache.d:123","Irgendwas Neues passiert?","Есть что-нибудь новенькое?","","","DIA_Grd_215_Torwache_PERM.description","",""
"Scripts/content/Story/MISSIONS/DIA_Grd_215_Torwache.d:133","Irgendwas Neues passiert?","Есть что-нибудь новенькое?","","","DIA_Grd_215_Torwache_PERM_15_00","",""
"Scripts/content/Story/MISSIONS/DIA_Grd_215_Torwache.d:134","Nein. Alles wie immer.","Нет. Все по-прежнему.","","","DIA_Grd_215_Torwache_PERM_06_01","",""
"Scripts/content/Story/MISSIONS/DIA_Grd_218_GuardPassage.d:46","Halt! Was willst du hier?","Стой! Что тебе здесь нужно?","","","DIA_Grd_218_FirstIn_07_00","",""
"Scripts/content/Story/MISSIONS/DIA_Grd_218_GuardPassage.d:47","Ich will hier rein.","Просто хотел зайти.","","","DIA_Grd_218_FirstIn_15_01","",""
"Scripts/content/Story/MISSIONS/DIA_Grd_218_GuardPassage.d:48","Machst du Witze?","Ты шутишь, да?","","","DIA_Grd_218_FirstIn_07_02","",""
"Scripts/content/Story/MISSIONS/DIA_Grd_218_GuardPassage.d:49","Frag das doch mal Thorus.","Лучше спроси об этом Торуса.","","","DIA_Grd_218_FirstIn_15_03","",""
"Scripts/content/Story/MISSIONS/DIA_Grd_218_GuardPassage.d:50","Werde ich. Wenn du gelogen hast, bist du tot!","Конечно, спрошу. И если ты солгал, я лично тебя убью.","","","DIA_Grd_218_FirstIn_07_04","",""
"Scripts/content/Story/MISSIONS/DIA_Grd_218_GuardPassage.d:51","Soll das heißen, ich kann jetzt reingehen.","Это значит, что я могу войти?","","","DIA_Grd_218_FirstIn_15_05","",""
"Scripts/content/Story/MISSIONS/DIA_Grd_218_GuardPassage.d:52","Ja. Geh schon!","Да, давай быстрее!","","","DIA_Grd_218_FirstIn_07_06","",""
"Scripts/content/Story/MISSIONS/DIA_Grd_218_GuardPassage.d:98","HALT! Keinen Schritt weiter!","Стой! Ни шагу дальше!","","","Info_Grd_218_FirstWarn_Info_07_01","",""
"Scripts/content/Story/MISSIONS/DIA_Grd_218_GuardPassage.d:99","Warum?","Почему?","","","Info_Grd_218_FirstWarn_Info_15_02","",""
"Scripts/content/Story/MISSIONS/DIA_Grd_218_GuardPassage.d:100","Das Haus der Erzbarone ist tabu für Abschaum wie dich!","Для таких как ты дом Баронов закрыт, понял?","","","Info_Grd_218_FirstWarn_Info_07_03","",""
"Scripts/content/Story/MISSIONS/DIA_Grd_224_Pacho.d:49","Hey, du!","Эй, ты!","","","Info_Pacho_STOP_13_01","",""
"Scripts/content/Story/MISSIONS/DIA_Grd_224_Pacho.d:50","Wer? Ich?","Кто? Я?","","","Info_Pacho_STOP_15_02","",""
"Scripts/content/Story/MISSIONS/DIA_Grd_224_Pacho.d:51","Nein, ich mein deine Großmutter ... Natürlich mein ich dich!","Нет, твоя бабуля... Конечно ты, кто ж еще?","","","Info_Pacho_STOP_13_03","",""
"Scripts/content/Story/MISSIONS/DIA_Grd_224_Pacho.d:52","Wenn ich du wäre, dann würde ich diesen Weg hier nicht weitergehen!","Я бы на твоем месте туда не ходил!","","","Info_Pacho_STOP_13_04","",""
"Scripts/content/Story/MISSIONS/DIA_Grd_224_Pacho.d:53","Warum nicht?","Почему?","","","Info_Pacho_STOP_15_05","",""
"Scripts/content/Story/MISSIONS/DIA_Grd_224_Pacho.d:54","Du scheinst wirklich neu hier zu sein!","Похоже, ты здесь недавно.","","","Info_Pacho_STOP_13_06","",""
"Scripts/content/Story/MISSIONS/DIA_Grd_224_Pacho.d:55","Mann, hier geht es ins Orkgebiet!","Парень, эта дорога ведет прямиком к оркам...","","","Info_Pacho_STOP_13_07","",""
"Scripts/content/Story/MISSIONS/DIA_Grd_224_Pacho.d:56","Die machen Kleinholz aus dir!","Они с радостью сделают из тебя котлету!","","","Info_Pacho_STOP_13_08","",""
"Scripts/content/Story/MISSIONS/DIA_Grd_224_Pacho.d:57","Oh.","Ох...","","","Info_Pacho_STOP_15_09","",""
"Scripts/content/Story/MISSIONS/DIA_Grd_224_Pacho.d:58","Gern geschehen!","Не за что!","","","Info_Pacho_STOP_13_10","",""
"Scripts/content/Story/MISSIONS/DIA_Grd_237_GuardPassage.d:36","Verschwinde hier lieber. Hinter dieser Barrikade beginnt das Orkgebiet!","Тебе лучше здесь не оставаться. За этим укреплением начинаются земли орков.","","","Info_Grd_237_FirstWarn_07_01","",""
"Scripts/content/Story/MISSIONS/DIA_Grd_237_GuardPassage.d:37","Ist das gefährlich?","Там очень опасно?","","","Info_Grd_237_FirstWarn_15_02","",""
"Scripts/content/Story/MISSIONS/DIA_Grd_237_GuardPassage.d:38","Sagen wir's mal so: Da dich die Orks sowieso in Fetzen reißen werden, kannst du uns auch genauso gut all dein Erz geben!","Скажем так: орки все равно не оставят тебя в живых, так что тебе лучше будет оставить всю свою руду у меня.","","","Info_Grd_237_FirstWarn_07_03","",""
"Scripts/content/Story/MISSIONS/DIA_Grd_237_GuardPassage.d:43","Ich glaube nicht, dass ich das will!","Не думаю, что ты получишь от меня хоть что-нибудь.","","","Info_Grd_237_FirstWarn.Info_Grd_237_FirstWarn_Info_NO","Info_AddChoice",""
"Scripts/content/Story/MISSIONS/DIA_Grd_237_GuardPassage.d:44","Na klar, hier ist mein Erz!","Ладно, вот тебе руда!","","","Info_Grd_237_FirstWarn.Info_Grd_237_FirstWarn_Info_YES","Info_AddChoice",""
"Scripts/content/Story/MISSIONS/DIA_Grd_237_GuardPassage.d:45","Ist wohl besser wenn ich wieder umdrehe!","Думаю, я лучше пойду обратно.","","","Info_Grd_237_FirstWarn.Info_Grd_237_FirstWarn_Info_RETREAT","Info_AddChoice",""
"Scripts/content/Story/MISSIONS/DIA_Grd_237_GuardPassage.d:52","Ist wohl besser, wenn ich wieder umdrehe!","Думаю, я лучше пойду обратно.","","","Info_Grd_237_FirstWarn_15_04","",""
"Scripts/content/Story/MISSIONS/DIA_Grd_237_GuardPassage.d:53","Schade, hätte dein Erz gerne verwahrt.","Жаль, я уже придумал, как бы я потратил твою руду.","","","Info_Grd_237_FirstWarn_07_05","",""
"Scripts/content/Story/MISSIONS/DIA_Grd_237_GuardPassage.d:64","Na klar, hier ist mein Erz!","Ладно, вот тебе руда!","","","Info_Grd_237_FirstWarn_15_06","",""
"Scripts/content/Story/MISSIONS/DIA_Grd_237_GuardPassage.d:65","Oh, das ist aber sehr umsichtig von dir.","О, как щедро с твоей стороны!","","","Info_Grd_237_FirstWarn_07_07","",""
"Scripts/content/Story/MISSIONS/DIA_Grd_237_GuardPassage.d:81","Ich glaube nicht, dass ich das will!","Не думаю, что ты получишь от меня хоть что-нибудь.","","","Info_Grd_237_FirstWarn_15_08","",""
"Scripts/content/Story/MISSIONS/DIA_Grd_237_GuardPassage.d:82","Dann solltest du besser keinen Schritt mehr weiter tun!","Тогда разворачивайся и уходи.","","","Info_Grd_237_FirstWarn_07_09","",""
"Scripts/content/Story/MISSIONS/DIA_Grd_237_GuardPassage.d:115","Bist du taub? Noch ein Schritt und du bist Futter für die Würmer!","Ты что, оглох? Еще шаг, и я прибью тебя на месте.","","","Info_Grd_237_LastWarn_07_01","",""
"Scripts/content/Story/MISSIONS/DIA_Grd_245_GuardPassage.d:34","Was ist in diesem Haus?","Что это за дом?","","","DIA_GRD_245_Hello.description","",""
"Scripts/content/Story/MISSIONS/DIA_Grd_245_GuardPassage.d:44","Was ist in diesem Haus?","Что это за дом?","","","DIA_GRD_245_Hello_15_00","",""
"Scripts/content/Story/MISSIONS/DIA_Grd_245_GuardPassage.d:45","Das ist das Haus der Erzbarone. Also wenn du hier reingehst, benimm dich!","Это дом Баронов. Будь паинькой, если когда-нибудь попадешь туда.","","","DIA_GRD_245_Hello_13_01","",""
"Scripts/content/Story/MISSIONS/DIA_Grd_255_Fletcher.d:46","Hey, du!","Эй, ты!","","","DIA_Fletcher_First_06_00","",""
"Scripts/content/Story/MISSIONS/DIA_Grd_255_Fletcher.d:47","Wer? Ich?","Кто? Я?","","","DIA_Fletcher_First_15_01","",""
"Scripts/content/Story/MISSIONS/DIA_Grd_255_Fletcher.d:48","Du weißt genau, mit wem ich rede, Bürschchen!","Сам знаешь кого я зову!","","","DIA_Fletcher_First_06_02","",""
"Scripts/content/Story/MISSIONS/DIA_Grd_255_Fletcher.d:49","Ich will dir mal was sagen: Das hier ist MEIN Viertel. Und ich will hier keinen Ärger!","Парень, послушай, что я тебе скажу: это мой район. И мне неприятности не нужны!","","","DIA_Fletcher_First_06_03","",""
"Scripts/content/Story/MISSIONS/DIA_Grd_255_Fletcher.d:50","Aber neue Typen wie du bedeuten immer Ärger. Vor allem, wenn sie hier mitten in der Nacht rumlaufen.","Но от новичков типа тебя всегда одни проблемы, особенно когда шныряют тут по ночам.","","","DIA_Fletcher_First_06_04","",""
"Scripts/content/Story/MISSIONS/DIA_Grd_255_Fletcher.d:51","Also, warum sorgst du nicht dafür, dass ich dich hier nicht mehr sehe. Die Hütte gegenüber der Arena mit dem Vordach ist frei. Leg dich 'ne Runde ins Bett.","Думаю, тебе стоит отправиться домой и больше не показываться мне на глаза. Кажется, возле арены есть пустующий дом с навесом. Так что иди лучше спать.","","","DIA_Fletcher_First_06_05","",""
"Scripts/content/Story/MISSIONS/DIA_Grd_255_Fletcher.d:52","Wenn ich dich in einer der anderen Hütten erwische, zieh ich dir das Fell über die Ohren.","Но если я поймаю тебя в чужом доме, будь уверен я позабочусь, чтобы ты об этом пожалел.","","","DIA_Fletcher_First_06_06","",""
