"location","source","target","id","fuzzy","context","translator_comments","developer_comments"
"Scripts/content/Story/MISSIONS/DIA_GRD_203_Bullit.d:43","Wen haben wir denn da? Du bist doch der Typ, den ich getauft habe? Was willst du? Noch mehr Schläge?","Ну, кто у нас здесь? Эй, парень, это тебя я на днях окрестил? Тебе что-то нужно? Хочешь еще? ","","","DIA_Bullit_First_06_00","",""
"Scripts/content/Story/MISSIONS/DIA_GRD_203_Bullit.d:55","Ich bin gekommen, um dir dein großes Maul zu stopfen.","Я пришел, чтобы заставить тебя замолчать!","","","DIA_Bullit_AufsMAul.description","",""
"Scripts/content/Story/MISSIONS/DIA_GRD_203_Bullit.d:65","Ich bin gekommen, um dir dein großes Maul zu stopfen.","Я пришел, чтобы заставить тебя замолчать!","","","DIA_Bullit_AufsMAul_15_00","",""
"Scripts/content/Story/MISSIONS/DIA_GRD_203_Bullit.d:66","Ja, dann komm mal her, Bürschchen!","Напугал! Ну, давай, сынок, подходи!","","","DIA_Bullit_AufsMAul_06_01","",""
"Scripts/content/Story/MISSIONS/DIA_GRD_203_Bullit.d:98","Du schon wieder. Ich hätte dich schon am ersten Tag im See versenken sollen!","Опять ты! Надо было тебя еще при первой встрече утопить!","","","DIA_GRD_203_Bullit_Wait4SC_06_01","",""
"Scripts/content/Story/MISSIONS/DIA_GRD_203_Bullit.d:99","Damals hatte ich keine Chance - jetzt ist genau das Gegenteil der Fall.","Да, ты упустил свой шанс. Теперь я смогу отомстить тебе.","","","DIA_GRD_203_Bullit_Wait4SC_15_02","",""
"Scripts/content/Story/MISSIONS/DIA_GRD_203_Bullit.d:100","Du Wurm! Ich hoffe, dass du es mir nicht so einfach machst, wie beim ersten Mal!","Слизняк! Надеюсь, ты стал покруче, чем в прошлый раз.","","","DIA_GRD_203_Bullit_Wait4SC_06_03","",""
"Scripts/content/Story/MISSIONS/DIA_GRD_205_Scorpio.d:47","Wer hat DICH denn reingelassen?","Кто пропустил тебя?","","","DIA_Scorpio_Hello_13_00","",""
"Scripts/content/Story/MISSIONS/DIA_GRD_205_Scorpio.d:48","Thorus.","Торус.","","","DIA_Scorpio_Hello_15_01","",""
"Scripts/content/Story/MISSIONS/DIA_GRD_205_Scorpio.d:49","Und was willst du hier?","И что тебе здесь нужно?","","","DIA_Scorpio_Hello_13_02","",""
"Scripts/content/Story/MISSIONS/DIA_GRD_205_Scorpio.d:52","Ich wollte mal wissen, wie's hier drin aussieht.","Просто захотелось посмотреть.","","","DIA_Scorpio_Hello.DIA_Scorpio_Hello_JustLooking","Info_AddChoice",""
"Scripts/content/Story/MISSIONS/DIA_GRD_205_Scorpio.d:53","Ich habe eine Botschaft für die Magier.","У меня есть послание для магов.","","","DIA_Scorpio_Hello.DIA_Scorpio_Hello_Mages","Info_AddChoice",""
"Scripts/content/Story/MISSIONS/DIA_GRD_205_Scorpio.d:56","Ich habe eine Ladung Kraut für Gomez.","Я принес болотник для Гомеза.","","","DIA_Scorpio_Hello.DIA_Scorpio_Hello_Kraut","Info_AddChoice",""
"Scripts/content/Story/MISSIONS/DIA_GRD_205_Scorpio.d:61","Ich bin auf dem Weg zu Gomez. Ich will mich euch anschließen.","Я хочу встретиться с Гомезом. Я собираюсь присоединиться к вам.","","","DIA_Scorpio_Hello.DIA_Scorpio_Hello_Join","Info_AddChoice",""
"Scripts/content/Story/MISSIONS/DIA_GRD_205_Scorpio.d:67","Ich wollte mal wissen, wie's hier drin aussieht.","Просто захотелось посмотреть.","","","DIA_Scorpio_Hello_JustLooking_15_00","",""
"Scripts/content/Story/MISSIONS/DIA_GRD_205_Scorpio.d:68","Sehr witzig.","Интересно.","","","DIA_Scorpio_Hello_JustLooking_13_01","",""
"Scripts/content/Story/MISSIONS/DIA_GRD_205_Scorpio.d:74","Ich habe eine Botschaft für die Magier.","У меня есть послание для магов.","","","DIA_Scorpio_Hello_Mages_15_00","",""
"Scripts/content/Story/MISSIONS/DIA_GRD_205_Scorpio.d:75","Du arbeitest für die Magier? Damit will ich nichts zu tun haben ...","Ты работаешь на магов? До них мне нет никакого дела...","","","DIA_Scorpio_Hello_Mages_13_01","",""
"Scripts/content/Story/MISSIONS/DIA_GRD_205_Scorpio.d:81","Ich habe eine Ladung Kraut für Gomez.","Я принес болотник для Гомеза.","","","DIA_Scorpio_Hello_Kraut_15_00","",""
"Scripts/content/Story/MISSIONS/DIA_GRD_205_Scorpio.d:82","Dann bring sie in das Haus mit den beiden Wachen vor der Tür.","Тогда отнеси его в дом, который охраняется двумя стражниками.","","","DIA_Scorpio_Hello_Kraut_13_01","",""
"Scripts/content/Story/MISSIONS/DIA_GRD_205_Scorpio.d:88","Ich bin auf dem Weg zu Gomez. Ich will mich euch anschließen.","Я хочу встретиться с Гомезом. Я собираюсь присоединиться к вам.","","","DIA_Scorpio_Hello_Join_15_00","",""
"Scripts/content/Story/MISSIONS/DIA_GRD_205_Scorpio.d:89","Du? Hast du überhaupt schon was für uns geleistet?","Ты? А ты уже доказал, что достоин к нам присоединиться?","","","DIA_Scorpio_Hello_Join_13_01","",""
"Scripts/content/Story/MISSIONS/DIA_GRD_205_Scorpio.d:90","Die Schatten waren zufrieden.","Призраки мной довольны...","","","DIA_Scorpio_Hello_Join_15_02","",""
"Scripts/content/Story/MISSIONS/DIA_GRD_205_Scorpio.d:91","Von Schatten will hier keiner was hören. Hier drin geben WIR den Ton an.","Призраки здесь ничего не решают. Здесь только наши слова имеют вес.","","","DIA_Scorpio_Hello_Join_13_03","",""
"Scripts/content/Story/MISSIONS/DIA_GRD_205_Scorpio.d:105","Kannst du mir beibringen zu kämpfen?","Ты можешь научить меня сражаться?","","","DIA_Scorpio_REFUSETRAIN.description","",""
"Scripts/content/Story/MISSIONS/DIA_GRD_205_Scorpio.d:118","Kannst du mir beibringen zu kämpfen?","Ты можешь научить меня сражаться?","","","DIA_Scorpio_REFUSETRAIN_15_00","",""
"Scripts/content/Story/MISSIONS/DIA_GRD_205_Scorpio.d:119","Ich unterrichte nur Gardisten. Bis Thorus dich nicht zum Gardisten gemacht hat, musst du dir jemand anderen suchen.","Я тренирую только стражников. Ты сможешь тренироваться у меня только тогда, когда Торус назначит тебя стражником.","","","DIA_Scorpio_REFUSETRAIN_13_01","",""
"Scripts/content/Story/MISSIONS/DIA_GRD_205_Scorpio.d:149","War die beste Entscheidung von dir, zu uns zu kommen!","Ты сделал хороший выбор, когда захотел присоединиться к нам.","","","GRD_205_Scorpio_WELCOME_Info_13_01","",""
"Scripts/content/Story/MISSIONS/DIA_GRD_205_Scorpio.d:163","Kann ich von dir lernen?","Ты можешь научить меня чему-нибудь?","","","GRD_205_Scorpio_CROSSBOW.description","",""
"Scripts/content/Story/MISSIONS/DIA_GRD_205_Scorpio.d:177","Kann ich von dir lernen?","Ты можешь научить меня чему-нибудь?","","","GRD_205_Scorpio_CROSSBOW_Info_15_01","",""
"Scripts/content/Story/MISSIONS/DIA_GRD_205_Scorpio.d:178","Wenn du genug Erz hast, zeige ich dir den Umgang mit der Armbrust. Gib mir einfach 200 Erz.","Если у тебя есть руда, то я могу научить тебя стрелять из арбалета. Это будет стоить 200 кусков.","","","GRD_205_Scorpio_CROSSBOW_Info_13_02","",""
"Scripts/content/Story/MISSIONS/DIA_GRD_205_Scorpio.d:206","Einverstanden. Zeig mir den Umgang mit der Armbrust.","Как скажешь. Научи меня стрелять из арбалета.","","","GRD_205_Scorpio_CROSSBOW_OK_15_01","",""
"Scripts/content/Story/MISSIONS/DIA_GRD_205_Scorpio.d:211","Gut, fangen wir direkt an.","Хорошо, начнем прямо сейчас.","","","GRD_205_Scorpio_CROSSBOW_OK_13_02","",""
"Scripts/content/Story/MISSIONS/DIA_GRD_205_Scorpio.d:212","Fasse die Armbrust am Schaft an, um ruhig zielen zu können, drücke sie an deine Schulter.","Возьми рукоятку арбалета. Ее необходимо упереть в плечо, что поможет тебе точнее прицелиться.","","","GRD_205_Scorpio_CROSSBOW_OK_13_03","",""
"Scripts/content/Story/MISSIONS/DIA_GRD_205_Scorpio.d:213","In den ersten paar Tagen wirst du ein Gefühl haben, als ob dir die Schulter abfällt.","Сначала твое плечо будет сильно уставать и болеть.","","","GRD_205_Scorpio_CROSSBOW_OK_13_04","",""
"Scripts/content/Story/MISSIONS/DIA_GRD_205_Scorpio.d:214","Aber schon nach einer Woche hast du eine Schulter wie aus Stein!","Но через неделю тренировок ты его даже не узнаешь!","","","GRD_205_Scorpio_CROSSBOW_OK_13_05","",""
"Scripts/content/Story/MISSIONS/DIA_GRD_205_Scorpio.d:215","Visier dein Ziel an und zieh durch. Der Bolzen bekommt mehr Kraft als ein Pfeil durch einen gespannten Bogen, von daher richtest du mehr Schaden an!","Прицелься и нажимай на курок. Болт летит гораздо быстрее, чем стрела, и наносит большее повреждение врагу!","","","GRD_205_Scorpio_CROSSBOW_OK_13_06","",""
"Scripts/content/Story/MISSIONS/DIA_GRD_205_Scorpio.d:222","ZWEIHUNDERT ERZ. Jeder einzelne Brocken in meine Hand. Wenn du das Erz nicht hast, dann besorge es dir!","Две сотни кусков и ни куском меньше. Если ты мне не заплатишь, я ничему тебя не научу.","","","GRD_205_Scorpio_CROSSBOW_OK_13_07","",""
"Scripts/content/Story/MISSIONS/DIA_GRD_205_Scorpio.d:236","Zeige mir mehr über den Umgang mit der Armbrust","Я хочу научиться еще лучше стрелять из арбалета.","","","GRD_205_Scorpio_CROSSBOW2.description","",""
"Scripts/content/Story/MISSIONS/DIA_GRD_205_Scorpio.d:249","Zeige mir mehr über den Umgang mit der Armbrust","Я хочу научиться еще лучше стрелять из арбалета.","","","GRD_205_Scorpio_CROSSBOW2_Info_15_01","",""
"Scripts/content/Story/MISSIONS/DIA_GRD_205_Scorpio.d:250","Kostet dich 300 Erz.","Это будет стоить 300 кусков руды.","","","GRD_205_Scorpio_CROSSBOW2_Info_13_02","",""
"Scripts/content/Story/MISSIONS/DIA_GRD_205_Scorpio.d:264","Lass uns direkt anfangen.","Начнем прямо сейчас.","","","GRD_205_Scorpio_CROSSBOW2_OK_15_01","",""
"Scripts/content/Story/MISSIONS/DIA_GRD_205_Scorpio.d:269","Gut. Du bekommst mehr Treffsicherheit und Ruhe, wenn du beim Schuss in die Knie gehst","Преимущество арбалета состоит в том, что точность стрельбы повышается при выстреле с колена.","","","GRD_205_Scorpio_CROSSBOW2_OK_13_02","",""
"Scripts/content/Story/MISSIONS/DIA_GRD_205_Scorpio.d:270","Lerne die Geschwindigkeit von beweglichen Zielen einzuschätzen.","Но тебе также предстоит научиться оценивать скорость противника.","","","GRD_205_Scorpio_CROSSBOW2_OK_13_03","",""
"Scripts/content/Story/MISSIONS/DIA_GRD_205_Scorpio.d:271","Schieß in die Laufbahn des Zieles, dann wirst du es treffen und es dadurch auch in seiner Bewegung aufhalten.","Выстрел должен быть направлен по ходу его движения, тогда ты сможешь в него попасть.","","","GRD_205_Scorpio_CROSSBOW2_OK_13_04","",""
"Scripts/content/Story/MISSIONS/DIA_GRD_205_Scorpio.d:272","Wenn du mehrere Ziele hast, dann verschwende keine Zeit, sondern nagel' alle Ziele mit gezielten Schüssen fest und strecke sie abwechselnd nieder.","Если у тебя несколько целей, не пропускай ни одной из них, но веди по ним прицельный огонь по очереди.","","","GRD_205_Scorpio_CROSSBOW2_OK_13_05","",""
"Scripts/content/Story/MISSIONS/DIA_GRD_205_Scorpio.d:273","Du hast jetzt alles gelernt, was ich dir beibringen kann.","Я научил тебя всему, что знаю сам.","","","GRD_205_Scorpio_CROSSBOW2_OK_13_06","",""
"Scripts/content/Story/MISSIONS/DIA_GRD_205_Scorpio.d:280","Junge, sieh erst mal zu, dass du irgendwo DREIHUNDERT Erz auftreibst.","Найди мне сначала триста кусков руды.","","","GRD_205_Scorpio_CROSSBOW2_OK_13_07","",""
"Scripts/content/Story/MISSIONS/DIA_GRD_205_Scorpio.d:309","Hey, keine Angst, Mann, komm mal rüber!","Эй, не бойся, подойди ко мне!","","","GRD_205_Scorpio_HeyPC_Info_13_01","",""
"Scripts/content/Story/MISSIONS/DIA_GRD_205_Scorpio.d:321","Alles klar bei dir?","Ты в порядке?","","","GRD_205_Scorpio_BANISHED.description","",""
"Scripts/content/Story/MISSIONS/DIA_GRD_205_Scorpio.d:334","Alles klar bei dir?","Ты в порядке?","","","GRD_205_Scorpio_BANISHED_Info_15_01","",""
"Scripts/content/Story/MISSIONS/DIA_GRD_205_Scorpio.d:335","Ich habe mich hier her verzogen. Für den Mist, den die Gardisten gerade abziehen, habe ich nichts übrig.","Здесь меня трудно будет найти. Меня не интересует хлам, который растаскивают стражники.","","","GRD_205_Scorpio_BANISHED_Info_13_02","",""
"Scripts/content/Story/MISSIONS/DIA_GRD_205_Scorpio.d:336","Aber ich habe mir ein paar gute Stücke aus der Waffenkammer mitgenommen. Wenn du eine Waffe brauchst, sag mir Bescheid.","Но я успел захватить кое-что из арсенала. Если тебе нужно хорошее оружие, только скажи.","","","GRD_205_Scorpio_BANISHED_Info_13_03","",""
"Scripts/content/Story/MISSIONS/DIA_GRD_205_Scorpio.d:356","Zeig mir deine Ware","Покажи мне свои товары.","","","GRD_205_Scorpio_TRADE.description","",""
"Scripts/content/Story/MISSIONS/DIA_GRD_205_Scorpio.d:369","Zeig mir deine Ware.","Покажи мне свои товары.","","","GRD_205_Scorpio_TRADE_Info_15_01","",""
"Scripts/content/Story/MISSIONS/DIA_GRD_208_Cutter.d:33","Ihr habt ganz schön viel Platz hier in der Burg.","Да, какой большой замок.","","","DIA_Cutter_Hello.description","",""
"Scripts/content/Story/MISSIONS/DIA_GRD_208_Cutter.d:46","Ihr habt ganz schön viel Platz hier in der Burg.","Да, какой большой замок.","","","DIA_Cutter_Hello_15_00","",""
"Scripts/content/Story/MISSIONS/DIA_GRD_208_Cutter.d:47","Ich habe dich hier noch nie gesehen. Wer bist du?","Раньше я тебя здесь не видел. Кто ты?","","","DIA_Cutter_Hello_08_01","",""
"Scripts/content/Story/MISSIONS/DIA_GRD_208_Cutter.d:48","Ich bin neu hier. Wollte mich mal ein bisschen umsehen.","Я здесь недавно. Хочу немного осмотреть это место.","","","DIA_Cutter_Hello_15_02","",""
"Scripts/content/Story/MISSIONS/DIA_GRD_208_Cutter.d:61","Was kannst du mir über die Burg sagen?","Ты можешь рассказать мне что-нибудь о замке?","","","DIA_Cutter_Burg.description","",""
"Scripts/content/Story/MISSIONS/DIA_GRD_208_Cutter.d:74","Was kannst du mir über die Burg sagen?","Ты можешь рассказать мне что-нибудь о замке?","","","DIA_Cutter_Burg_15_00","",""
"Scripts/content/Story/MISSIONS/DIA_GRD_208_Cutter.d:75","Nach dem großen Aufstand haben sich Gomez und seine Jungs die Burg unter den Nagel gerissen.","После великого восстания он был занят Гомезом и его людьми. Теперь никто другой не смеет приближаться к нему.","","","DIA_Cutter_Burg_08_01","",""
"Scripts/content/Story/MISSIONS/DIA_GRD_208_Cutter.d:76","Ich hab' damals schnell gemerkt, dass es besser ist, sich ihm anzuschließen.","Я еще тогда понял, что лучше всего будет присоединиться к Гомезу.","","","DIA_Cutter_Burg_08_02","",""
"Scripts/content/Story/MISSIONS/DIA_GRD_208_Cutter.d:77","Schon als wir damals noch alle im Kerker eingepfercht waren, und in den Minen schuften mussten hatte er unter den Gefangenen am meisten zu sagen.","Еще в те времена, когда все мы сидели в подземельях и работали на шахте, он был самым влиятельным среди заключенных.","","","DIA_Cutter_Burg_08_03","",""
"Scripts/content/Story/MISSIONS/DIA_GRD_208_Cutter.d:78","Es gibt Kerker unter der Burg?","Так под замком есть подземелья?","","","DIA_Cutter_Burg_15_04","",""
"Scripts/content/Story/MISSIONS/DIA_GRD_208_Cutter.d:79","Ja, aber sie sind heute leer. Seit dem großen Aufstand will da niemand mehr rein.","Да, но сейчас они пусты. Со времен восстания туда никто не спускался.","","","DIA_Cutter_Burg_08_05","",""
"Scripts/content/Story/MISSIONS/DIA_GRD_208_Cutter.d:92","Wie ist das Leben als Gardist?","Как живется здесь стражникам?","","","DIA_Cutter_PERM.description","",""
"Scripts/content/Story/MISSIONS/DIA_GRD_208_Cutter.d:105","Wie ist das Leben als Gardist?","Как живется здесь стражникам?","","","DIA_Cutter_PERM_15_00","",""
"Scripts/content/Story/MISSIONS/DIA_GRD_208_Cutter.d:106","Ruhig. Wir sind das größte und stärkste Lager in der Kolonie - mit uns legt sich keiner an.","Спокойно живется. Наш лагерь сильнейший в колонии. С нами лучше не ссориться.","","","DIA_Cutter_PERM_08_01","",""
"Scripts/content/Story/MISSIONS/DIA_GRD_208_Cutter.d:107","Verstehe.","Ясно.","","","DIA_Cutter_PERM_15_02","",""
"Scripts/content/Story/MISSIONS/DIA_GRD_208_Cutter.d:132","Du hast die richtige Entscheidung getroffen. Das Leben als Gardist wird dir gefallen!","Ты принял правильное решение. Думаю, тебе понравится быть стражником.","","","GRD_208_Cutter_WELCOME_Info_08_01","",""
"Scripts/content/Story/MISSIONS/DIA_GRD_210_Scatty.d:33","Was machst du hier?","Что ты делаешь?","","","DIA_Scatty_WhatDoYouDo.description","",""
"Scripts/content/Story/MISSIONS/DIA_GRD_210_Scatty.d:43","Was machst du hier?","Что ты делаешь?","","","DIA_Scatty_WhatDoYouDo_15_00","",""
"Scripts/content/Story/MISSIONS/DIA_GRD_210_Scatty.d:44","Ich kümmere mich um die Arena. Organisiere die Wetten, heuere neue Kämpfer an und so weiter ...","Я отвечаю за бои на арене: организую ставки, нанимаю бойцов, ну, еще что-то делаю.","","","DIA_Scatty_WhatDoYouDo_01_01","",""
"Scripts/content/Story/MISSIONS/DIA_GRD_210_Scatty.d:60","Ich will mich dem Lager anschließen. Kannst du mir dabei helfen?","Я хочу присоединиться к этому лагерю. Ты можешь мне помочь?","","","DIA_Scatty_JoinOC.description","",""
"Scripts/content/Story/MISSIONS/DIA_GRD_210_Scatty.d:73","Ich will mich dem Lager anschließen. Kannst du mir dabei helfen?","Я хочу присоединиться к этому лагерю. Ты можешь мне помочь?","","","DIA_Scatty_JoinOC_15_00","",""
"Scripts/content/Story/MISSIONS/DIA_GRD_210_Scatty.d:74","Wenn du es schaffst, mich zu beeindrucken - vielleicht.","Если ты сможешь удивить меня, то, может быть, помогу.","","","DIA_Scatty_JoinOC_01_01","",""
"Scripts/content/Story/MISSIONS/DIA_GRD_210_Scatty.d:75","Einige der besten Kämpfer aller drei Lager kommen hier her um sich zu messen.","У меня на арене состязаются лучшие бойцы трех лагерей.","","","DIA_Scatty_JoinOC_01_02","",""
"Scripts/content/Story/MISSIONS/DIA_GRD_210_Scatty.d:76","Fordere einen von ihnen heraus und kämpfe gegen ihn. Je nachdem, wie gut du dich schlägst, wird mein Urteil über dich ausfallen.","Вызови кого-нибудь из них на бой, а я посмотрю, как ты себя покажешь. Ну, а там увидим, смогу ли я тебе помочь.","","","DIA_Scatty_JoinOC_01_03","",""
"Scripts/content/Story/MISSIONS/DIA_GRD_210_Scatty.d:97","Ich habe gegen Kirgo gekämpft!","Я сразился с Кирго!","","","DIA_Scatty_KirgoSuccess.description","",""
"Scripts/content/Story/MISSIONS/DIA_GRD_210_Scatty.d:114","Ich habe gegen Kirgo gekämpft!","Я сразился с Кирго!","","","DIA_Scatty_KirgoSuccess_15_00","",""
"Scripts/content/Story/MISSIONS/DIA_GRD_210_Scatty.d:117","Und du hast dich besiegen lassen!","И ты просто так отдал ему победу?!","","","DIA_Scatty_KirgoSuccess_01_01","",""
"Scripts/content/Story/MISSIONS/DIA_GRD_210_Scatty.d:118","Du erwartest hoffentlich nicht, dass ich durch dein Versagen beeindruckt bin ...","Думаю, ты уже знаешь, что этим меня не удивить...","","","DIA_Scatty_KirgoSuccess_01_02","",""
"Scripts/content/Story/MISSIONS/DIA_GRD_210_Scatty.d:125","Und du hast ihn geschafft! Nicht schlecht für einen Anfänger wie dich! Ich bin beeindruckt!","Ты победил его! Неплохо для новичка! Ты действительно удивил меня!","","","DIA_Scatty_KirgoSuccess_01_03","",""
"Scripts/content/Story/MISSIONS/DIA_GRD_210_Scatty.d:142","Ich bin gegen Kharim angetreten!","Я сразился с Каримом!","","","DIA_Scatty_KHARIMSuccess.description","",""
"Scripts/content/Story/MISSIONS/DIA_GRD_210_Scatty.d:159","Ich bin gegen Kharim angetreten!","Я сразился с Каримом!","","","DIA_Scatty_KHARIMSuccess_15_00","",""
"Scripts/content/Story/MISSIONS/DIA_GRD_210_Scatty.d:162","Er hat dir ganz schön in den Arsch getreten.","Да, как же и он тебя избил!","","","DIA_Scatty_KHARIMSuccess_01_01","",""
"Scripts/content/Story/MISSIONS/DIA_GRD_210_Scatty.d:165","Trotzdem hast du dir den richtigen Gegner gewählt! Ich kann diese Bastarde aus dem Neuen Lager nicht ausstehen.","Хорошо, что ты выбрал именно этого противника! Я терпеть не могу этих лентяев из Нового лагеря. ","","","DIA_Scatty_KHARIMSuccess_01_02","",""
"Scripts/content/Story/MISSIONS/DIA_GRD_210_Scatty.d:166","Scheint dir ja genauso zu gehen - so jemanden können wir hier brauchen!","Мне кажется, ты тоже так думаешь. Такой человек, как ты, нам еще пригодится!","","","DIA_Scatty_KHARIMSuccess_01_03","",""
"Scripts/content/Story/MISSIONS/DIA_GRD_210_Scatty.d:175","Und du hast ihn umgehauen! Ich muss schon sagen, nicht schlecht. Er war immer einer der besten Kämpfer hier.","Ты победил его! Признаться, я от тебя такого не ожидал. Он считался одним из самых сильных бойцов.","","","DIA_Scatty_KHARIMSuccess_01_04","",""
"Scripts/content/Story/MISSIONS/DIA_GRD_210_Scatty.d:176","Du hast mich schwer beeindruckt!","Ты действительно удивил меня!","","","DIA_Scatty_KHARIMSuccess_01_05","",""
"Scripts/content/Story/MISSIONS/DIA_GRD_210_Scatty.d:193","Wieso lasst ihr die Leute aus den anderen Lagern hier kämpfen?","Почему же люди из Старого и Нового лагеря сражаются здесь?","","","DIA_Scatty_OtherCamps.description","",""
"Scripts/content/Story/MISSIONS/DIA_GRD_210_Scatty.d:206","Ich dachte, das Alte und das Neue Lager verstehen sich nicht besonders gut - wieso lasst ihr ihre Leute hier kämpfen?","Я думал, что отношения между людьми из Старого и Нового лагеря не самые дружеские. Почему же они сражаются здесь? ","","","DIA_Scatty_OtherCamps_15_00","",""
"Scripts/content/Story/MISSIONS/DIA_GRD_210_Scatty.d:207","Ganz einfach: Wenn es hier einmal die Woche einen Kampf gibt, sehen es die Buddler am liebsten, wenn einer der Banditen aus dem Neuen Lager was aufs Maul bekommt.","Все просто: раз в неделю на арене устраиваются бои, а рудокопы после тяжелой работы с удовольствием приходят посмотреть, как наши бойцы бьют лентяев из Нового лагеря.","","","DIA_Scatty_OtherCamps_01_01","",""
"Scripts/content/Story/MISSIONS/DIA_GRD_210_Scatty.d:208","Wenn einer von denen kämpft, wird mehr gewettet - das ist gut!","Обычно наши люди делают больше ставок, когда дерется кто-нибудь из них.","","","DIA_Scatty_OtherCamps_01_02","",""
"Scripts/content/Story/MISSIONS/DIA_GRD_210_Scatty.d:209","Ich persönlich kann die Schweine aus dem Neuen Lager ja nicht ausstehen - aber Geschäft ist nun mal Geschäft ...","Лично мне не нравятся люди из Нового лагеря, но дело есть дело...","","","DIA_Scatty_OtherCamps_01_03","",""
"Scripts/content/Story/MISSIONS/DIA_GRD_210_Scatty.d:222","Ich will wetten!","Я хочу сделать ставку.","","","DIA_Scatty_WannaBet.description","",""
"Scripts/content/Story/MISSIONS/DIA_GRD_210_Scatty.d:235","Ich will wetten.","Я хочу сделать ставку.","","","DIA_Scatty_WannaBet_15_00","",""
