"location","source","target","id","fuzzy","context","translator_comments","developer_comments"
"Scripts/content/Story/svm.d:1194","Du wagst es, HIER rumzulaufen? Na warte!","И ты еще смеешь появляться здесь? Ну, подожди!","","","SVM_8_NowWaitIntruder","",""
"Scripts/content/Story/svm.d:1195","Ich muss dir wohl auf die Flossen hauen!","За это я должен отрубить тебе руки!","","","SVM_8_IWillTeachYouRespectForForeignProperty","",""
"Scripts/content/Story/svm.d:1196","Das hättest du nicht klauen sollen!","Тебе не стоило воровать у меня!","","","SVM_8_DirtyThief","",""
"Scripts/content/Story/svm.d:1197","Niemand vergreift sich ungestraft an meinen Jungs!","Если будешь лезть ко мне, ты сильно пожалеешь!","","","SVM_8_YouAttackedMyCharge","",""
"Scripts/content/Story/svm.d:1198","Einen von uns umzubringen war dein letzter Fehler!","Ты совершил большую ошибку, убив одного из нас!","","","SVM_8_YouKilledOneOfUs","",""
"Scripts/content/Story/svm.d:1199","Aaargl","","","","SVM_8_Dead","",""
"Scripts/content/Story/svm.d:1200","Aargh","","","","SVM_8_Aargh_1","",""
"Scripts/content/Story/svm.d:1201","Aargh","","","","SVM_8_Aargh_2","",""
"Scripts/content/Story/svm.d:1202","Aargh","","","","SVM_8_Aargh_3","",""
"Scripts/content/Story/svm.d:1203","UUAAARRGGGHHH!!!","","","","SVM_8_Berzerk","",""
"Scripts/content/Story/svm.d:1204","Das wird dir noch sehr Leid tun!","Ты еще об этом пожалеешь!","","","SVM_8_YoullBeSorryForThis","",""
"Scripts/content/Story/svm.d:1205","Ganz ruhig. Alles in Ordnung!","Тихо, тихо. Все в порядке!","","","SVM_8_YesYes","",""
"Scripts/content/Story/svm.d:1206","Dieses Biest sehe ich mir lieber aus der Entfernung an!","По-моему, к этой твари не стоит подходить слишком близко!","","","SVM_8_ShitWhatAMonster","",""
"Scripts/content/Story/svm.d:1207","Nichts wie weg!","Пора уходить отсюда!","","","SVM_8_Help","",""
"Scripts/content/Story/svm.d:1208","Wir sehen uns wieder!","Мы с тобой еще поговорим!","","","SVM_8_WeWillMeetAgain","",""
"Scripts/content/Story/svm.d:1209","Noch einmal und du bist tot!","Еще одна такая выходка, и ты труп!","","","SVM_8_NeverTryThatAgain","",""
"Scripts/content/Story/svm.d:1210","Die Waffe gefällt mir!","Какое хорошее оружие!","","","SVM_8_ITakeYourWeapon","",""
"Scripts/content/Story/svm.d:1211","Du hast bestimmt noch keine Erzsteuern an mich entrichtet!","О, кажется, ты еще не платил пошлину. Ну, теперь мы в расчете!","","","SVM_8_ITookYourOre","",""
"Scripts/content/Story/svm.d:1212","Klar, dass ein Verlierer wie du kein Erz hat!","Да разве у такого неудачника может быть руда?!","","","SVM_8_ShitNoOre","",""
"Scripts/content/Story/svm.d:1213","Finger weg!","Убери руки!","","","SVM_8_HandsOff","",""
"Scripts/content/Story/svm.d:1214","Raus hier!","Пошел прочь!","","","SVM_8_GetOutOfHere","",""
"Scripts/content/Story/svm.d:1215","Hey, wie kommst DU hier rein?","Эй, что это ты здесь делаешь?","","","SVM_8_YouViolatedForbiddenTerritory","",""
"Scripts/content/Story/svm.d:1216","Bist ein ganz Schlauer, was?","Думаешь, ты один такой умный, да?","","","SVM_8_YouWannaFoolMe","",""
"Scripts/content/Story/svm.d:1217","Hey du! Was schleichst du da rum.","Эй, ты! Что это ты здесь делаешь?","","","SVM_8_WhatsThisSupposedToBe","",""
"Scripts/content/Story/svm.d:1218","Verschwinde, sonst ruf ich die Wachen!","Убирайся, или я позову стражу!","","","SVM_8_WhyYouAreInHere","",""
"Scripts/content/Story/svm.d:1219","Was hast du da drinnen getrieben?","Что ты здесь забыл?","","","SVM_8_WhatDidYouInThere","",""
"Scripts/content/Story/svm.d:1220","Da hast du noch mal Glück gehabt.","На этот раз тебе повезло.","","","SVM_8_WiseMove","",""
"Scripts/content/Story/svm.d:1221","Wachen, hierher!","Стража! Сюда!","","","SVM_8_Alarm","",""
"Scripts/content/Story/svm.d:1222","ALARM!!! EINDRINGLING!!!","Тревога! Здесь чужой!","","","SVM_8_IntruderAlert","",""
"Scripts/content/Story/svm.d:1223","Hinter dir!","Будь осторожен!","","","SVM_8_BehindYou","",""
"Scripts/content/Story/svm.d:1224","Mal sehen, wer da kämpft!","Ну-ка, кто это так дерется?!","","","SVM_8_TheresAFight","",""
"Scripts/content/Story/svm.d:1225","Fester!","Бей его!","","","SVM_8_HeyHeyHey","",""
"Scripts/content/Story/svm.d:1226","Ja! Weiter, weiter!","Да, так его, так!","","","SVM_8_CheerFight","",""
"Scripts/content/Story/svm.d:1227","Gut so! Nicht nachlassen!","Хорошо! Давай еще!","","","SVM_8_CheerFriend","",""
"Scripts/content/Story/svm.d:1228","Lass dir das nicht bieten! Hau ihm aufs Maul!","Да не стой как столб! Бей его!","","","SVM_8_Ooh","",""
"Scripts/content/Story/svm.d:1229","Ja, gib's ihm. Der bewegt sich noch!","Да, врежь ему! Он еще жив!","","","SVM_8_YeahWellDone","",""
"Scripts/content/Story/svm.d:1230","Lass dich hier nicht mehr blicken!","Только попробуй появиться здесь еще раз!","","","SVM_8_RunCoward","",""
"Scripts/content/Story/svm.d:1231","Langweiliger Kampf!","Это не так интересно! ","","","SVM_8_HeDefeatedHim","",""
"Scripts/content/Story/svm.d:1232","Geschieht ihm recht!","Так ему и надо!","","","SVM_8_HeDeservedIt","",""
"Scripts/content/Story/svm.d:1233","Das war unnötig. du wirst die Folgen zu tragen haben.","Зачем ты это сделал? Ты должен будешь ответить за свой поступок!","","","SVM_8_HeKilledHim","",""
"Scripts/content/Story/svm.d:1234","War'n guter Kampf!","Это был отличный бой!","","","SVM_8_ItWasAGoodFight","",""
"Scripts/content/Story/svm.d:1235","Gäääähn","","","","SVM_8_Awake","",""
"Scripts/content/Story/svm.d:1236","Hallo.","Привет.","","","SVM_8_FriendlyGreetings","",""
"Scripts/content/Story/svm.d:1237","Für Gomez!","За Гомеза!","","","SVM_8_ALGreetings","",""
"Scripts/content/Story/svm.d:1238","Magie zu Ehren!","Во имя магии!","","","SVM_8_MageGreetings","",""
"Scripts/content/Story/svm.d:1239","Erwache!","Пробудись!","","","SVM_8_SectGreetings","",""
"Scripts/content/Story/svm.d:1240","Da vorne ist er.","Все сюда.","","","SVM_8_ThereHeIs","",""
"Scripts/content/Story/svm.d:1241","Ich kann dir nichts beibringen. Du hast nicht genug Erfahrung.","Я не смогу стать твоим учителем. У тебя недостаточно практических навыков.","","","SVM_8_NoLearnNoPoints","",""
"Scripts/content/Story/svm.d:1242","Du bist am Ende deiner Möglichkeiten. Du solltest etwas anderes lernen.","Ты больше не можешь этому научиться. Тебе стоит попробовать что-то другое.","","","SVM_8_NoLearnOverMax","",""
"Scripts/content/Story/svm.d:1243","Du musst erst fortgeschritten sein, bevor du Meister werden kannst!","Тебе нужно изучить основы, прежде чем стать настоящим мастером.","","","SVM_8_NoLearnYouAlreadyKnow","",""
"Scripts/content/Story/svm.d:1244","Du bist jetzt schon besser!","Ты уже стал умнее.","","","SVM_8_NoLearnYoureBetter","",""
"Scripts/content/Story/svm.d:1245","Hey du!","Эй, ты!","","","SVM_8_HeyYou","",""
"Scripts/content/Story/svm.d:1246","Nicht jetzt.","Не сейчас!","","","SVM_8_NotNow","",""
"Scripts/content/Story/svm.d:1247","Was willst du?","Что тебе нужно?","","","SVM_8_WhatDoYouWant","",""
"Scripts/content/Story/svm.d:1248","Kann ich was für dich tun?","Что я могу для тебя сделать?","","","SVM_8_ISaidWhatDoYouWant","",""
"Scripts/content/Story/svm.d:1249","Kann ich da mal vorbei?","Я могу пройти?","","","SVM_8_MakeWay","",""
"Scripts/content/Story/svm.d:1250","Geh zur Seite!","Уйди в сторону!","","","SVM_8_OutOfMyWay","",""
"Scripts/content/Story/svm.d:1251","Soll ich's in dich reinprügeln? Weg da!","Ты не слышал меня? Дай пройти!","","","SVM_8_YouDeafOrWhat","",""
"Scripts/content/Story/svm.d:1252","Willst du dich noch mal mit mir anlegen?","Снова ищешь неприятностей?","","","SVM_8_LookingForTroubleAgain","",""
"Scripts/content/Story/svm.d:1253","Ähem ...  ... wirklich schöne Aussicht!","Хм... Как хорошо вокруг! ","","","SVM_8_LookAway","",""
"Scripts/content/Story/svm.d:1254","Gut! Es gehört dir.","Хорошо! Возьми себе!","","","SVM_8_OkayKeepIt","",""
"Scripts/content/Story/svm.d:1255","Häh? Was war das?","Эй! Что это было?","","","SVM_8_WhatsThat","",""
"Scripts/content/Story/svm.d:1256","Du trägst meine Waffe ...?","Ты забрал мое оружие...","","","SVM_8_ThatsMyWeapon","",""
"Scripts/content/Story/svm.d:1257","Her damit! Sofort!","Отдай его мне! Слышал?!","","","SVM_8_GiveItToMe","",""
"Scripts/content/Story/svm.d:1258","Behalt's, ich brauch's sowieso nicht.","Как хочешь, оставь себе. Мне оно все равно не нужно.","","","SVM_8_YouCanKeeptheCrap","",""
"Scripts/content/Story/svm.d:1259","Sie haben einen unserer Jungs erwischt. Wenn ich das Schwein kriege ...","Убит наш человек. Уж я покажу тому, кто это сделал...","","","SVM_8_TheyKilledMyFriend","",""
"Scripts/content/Story/svm.d:1260","Was ist los?","А в чем дело?","","","SVM_8_YouDisturbedMySlumber","",""
"Scripts/content/Story/svm.d:1261","Na? Haste was aufs Maul gekriegt? Geschieht dir Recht!","Ну? Ты доволен? Это будет тебе уроком!","","","SVM_8_SuckerGotSome","",""
"Scripts/content/Story/svm.d:1262","Du hast einen Erzbaron umgehauen. Er war beeindruckt!","Ты победил Барона. Как же он был удивлен!","","","SVM_8_SuckerDefeatedEBr","",""
"Scripts/content/Story/svm.d:1263","Du hast einen der Gurus besiegt. Respekt. Aber lass dir nicht einfallen, das noch einmal zu probieren.","Ты победил Гуру. Неплохо. Но только не пытайся сделать это еще раз.","","","SVM_8_SuckerDefeatedGur","",""
"Scripts/content/Story/svm.d:1264","Einen Magier zu besiegen ... Du bist ja einer!","Победить мага... ты, должно быть, отважный парень!","","","SVM_8_SuckerDefeatedMage","",""
"Scripts/content/Story/svm.d:1265","Du weißt, dass die Novizen unter meinem Schutz stehen. Und trotzdem vergreifst du dich an Ihnen?","Ты же знаешь, что все послушники находятся под моей защитой. И ты все равно пытаешься нападать на них?","","","SVM_8_SuckerDefeatedNov_Guard","",""
"Scripts/content/Story/svm.d:1266","Wenn du dich an Buddlern vergreifst, vergreifst du dich an meiner Kasse!","Если будешь лезть к рудокопам, я лично прослежу, чтобы ты был наказан как следует!","","","SVM_8_SuckerDefeatedVlk_Guard","",""
"Scripts/content/Story/svm.d:1267","Du solltest dich nicht mit meinen Freunden anlegen.","Не стоит тебе обижать моих друзей.","","","SVM_8_YouDefeatedMyComrade","",""
"Scripts/content/Story/svm.d:1268","Vergreif dich noch einmal an unseren Jungs und es wird dir Leid tun.","Только тронь послушника, и мы с тебя шкуру спустим!","","","SVM_8_YouDefeatedNOV_Guard","",""
"Scripts/content/Story/svm.d:1269","Einen meiner Schützlinge anzugreifen kann dich den Kopf kosten.","Если будешь лезть к моим подопечным, можешь лишиться головы!","","","SVM_8_YouDefeatedVLK_Guard","",""
"Scripts/content/Story/svm.d:1270","Du wagst es mir unter die Augen zu treten, dreckiger Dieb?","И ты еще смеешь заявляться сюда, грязный вор?!","","","SVM_8_YouStoleFromMe","",""
"Scripts/content/Story/svm.d:1271","Du hast einige Sachen, die uns gehören. Gib sie besser wieder her.","У тебя есть то, что принадлежит нам. Верни немедленно!","","","SVM_8_YouStoleFromUs","",""
"Scripts/content/Story/svm.d:1272","Mann! Du hast die Erzbarone beklaut! Na, die werden toben!","Вот это да! Ты обокрал Баронов! Они будут в ярости!","","","SVM_8_YouStoleFromEBr","",""
"Scripts/content/Story/svm.d:1273","Du hast die Gurus um ein paar Sachen erleichtert, was?","Ты что-то украл у Гуру, да? Не стоило этого делать!","","","SVM_8_YouStoleFromGur","",""
"Scripts/content/Story/svm.d:1274","Du hast die Magier um ein paar Sachen erleichtert, was?","Ты что-то украл у магов, правда? Ты же не станешь говорить, что это не так?","","","SVM_8_StoleFromMage","",""
"Scripts/content/Story/svm.d:1275","Du hast einen von unseren Jungs auf dem Gewissen. Noch ein kleiner Fehler und du bist dran!","Жизнь одного из наших людей на твоей совести. Еще один неверный шаг, и ты будешь следующим!","","","SVM_8_YouKilledMyFriend","",""
"Scripts/content/Story/svm.d:1276","Du hast einen Erzbaron umgelegt! Mann, du bist wohl komplett durchgedreht!?","Ты убил Барона! Только сумасшедший мог пойти на это!","","","SVM_8_YouKilledEBr","",""
"Scripts/content/Story/svm.d:1277","Du hast einen Guru getötet! Junge, das kann doch nicht wahr sein!","Ты убил Гуру! Я не могу в это поверить!","","","SVM_8_YouKilledGur","",""
"Scripts/content/Story/svm.d:1278","Du hast einen Magier umgebracht! Wie sollen wir das denn erklären?","Ты убил мага! Можешь объяснить, зачем ты это сделал?","","","SVM_8_YouKilledMage","",""
"Scripts/content/Story/svm.d:1279","Jemand aus dem Alten Lager ist verstorben und dein Name wird dabei erwähnt ...","В Старом лагере произошло убийство. Ходят слухи, что ты в этом замешан...","","","SVM_8_YouKilledOCfolk","",""
"Scripts/content/Story/svm.d:1280","Das Neue Lager hat einen tragischen Verlust erlitten, und scheinbar hast du damit zu tun!","В Новом лагере убили человека и поговаривают, что там без тебя не обошлось!","","","SVM_8_YouKilledNCfolk","",""
"Scripts/content/Story/svm.d:1281","Die Bruderschaft ist um einen Anhänger ärmer und wie es scheint, warst du das!","Убит один из приверженцев новой веры, и его смерть на твоей совести!","","","SVM_8_YouKilledPSIfolk","",""
"Scripts/content/Story/svm.d:1282","Das wieder hinzubiegen wird nicht einfach!","Не хотел бы я попасть в подобную переделку!","","","SVM_8_GetThingsRight","",""
"Scripts/content/Story/svm.d:1283","Du hast mir ganz schön aufs Maul gehauen, Mann. War ein guter Kampf. Aber jetzt ist gut!","Ты победил меня в честном бою! Но теперь все позади! Я не в обиде!","","","SVM_8_YouDefeatedMeWell","",""
"Scripts/content/Story/svm.d:1284"," ... wenn du meinst ..."," ...если ты думаешь...","","","SVM_8_Smalltalk01","",""
"Scripts/content/Story/svm.d:1285"," ... kann schon sein ..."," ..ну, может быть...","","","SVM_8_Smalltalk02","",""
"Scripts/content/Story/svm.d:1286"," ... war nicht besonders schlau ..."," ...ну, это было не слишком умно...","","","SVM_8_Smalltalk03","",""
"Scripts/content/Story/svm.d:1287"," ... ich halt mich da lieber raus ..."," ...не стоит в это ввязываться...","","","SVM_8_Smalltalk04","",""
"Scripts/content/Story/svm.d:1288"," ... das ist nun wirklich nicht mein Problem ..."," ...чужие проблемы - не мое дело...","","","SVM_8_Smalltalk05","",""
"Scripts/content/Story/svm.d:1289"," ... das war doch klar, dass das Ärger gibt ..."," ...уже тогда было ясно, что этим дело не кончится...","","","SVM_8_Smalltalk06","",""
"Scripts/content/Story/svm.d:1290"," ... aber behalt's für dich, ich meine, muss ja nicht gleich jeder wissen ..."," ...только между нами, другим необязательно знать об этом.","","","SVM_8_Smalltalk07","",""
"Scripts/content/Story/svm.d:1291"," ... das passiert mir nicht noch mal ..."," ...не хочу пережить это снова...","","","SVM_8_Smalltalk08","",""
"Scripts/content/Story/svm.d:1292"," ... an der Geschichte muss wohl doch was dran sein ..."," ...что-то не так в этой истории...","","","SVM_8_Smalltalk09","",""
"Scripts/content/Story/svm.d:1293"," ... man muss eben aufpassen, was man so rumerzählt ..."," ...нужно думать, прежде чем что-нибудь говорить...","","","SVM_8_Smalltalk10","",""
"Scripts/content/Story/svm.d:1294"," ... solange ich damit nichts zu tun habe ..."," ...пока меня не впутали...","","","SVM_8_Smalltalk11","",""
"Scripts/content/Story/svm.d:1295"," ... man darf auch nicht alles glauben, was man hört ..."," ...ты не должен верить всему...","","","SVM_8_Smalltalk12","",""
"Scripts/content/Story/svm.d:1296"," ... in seiner Haut will ich trotzdem nicht stecken ..."," ...не хотел бы оказаться на его месте...","","","SVM_8_Smalltalk13","",""
"Scripts/content/Story/svm.d:1297"," ... immer wieder dieselbe Leier ..."," ...все время одно и то же...","","","SVM_8_Smalltalk14","",""
"Scripts/content/Story/svm.d:1298"," ... manche lernen eben gar nichts dazu ..."," ...некоторых ничему нельзя научить...","","","SVM_8_Smalltalk15","",""
"Scripts/content/Story/svm.d:1299"," ... früher wäre das ganz anders gelaufen ..."," ...раньше все было совсем по-другому...","","","SVM_8_Smalltalk16","",""
"Scripts/content/Story/svm.d:1300"," ... gequatscht wird viel ..."," ...люди слишком много болтают...","","","SVM_8_Smalltalk17","",""
"Scripts/content/Story/svm.d:1301"," ... ich hör' nicht mehr auf das Gefasel ..."," ...больше не хочу это слушать...","","","SVM_8_Smalltalk18","",""
"Scripts/content/Story/svm.d:1302"," ... verlass dich auf jemanden und du bist verlassen, das ist eben so ..."," ...никому не доверяй, здесь кругом предатели...","","","SVM_8_Smalltalk19","",""
"Scripts/content/Story/svm.d:1303"," ... ich glaube kaum, dass sich daran was ändern wird ..."," ...не думаю, что здесь можно хоть что-нибудь изменить...","","","SVM_8_Smalltalk20","",""
"Scripts/content/Story/svm.d:1304"," ... wahrscheinlich hast du Recht ..."," ...быть может, ты и прав...","","","SVM_8_Smalltalk21","",""
"Scripts/content/Story/svm.d:1305"," ... erst mal abwarten. Komm, es wird ja auch nichts so heiß gegessen, wie es gekocht wird ..."," ...держись. Лучше ни на что не натыкаться...","","","SVM_8_Smalltalk22","",""
"Scripts/content/Story/svm.d:1306"," ... Ah, ich dachte, das wäre schon lange geklärt ..."," ...я думал, это уже давно решенный вопрос...","","","SVM_8_Smalltalk23","",""
"Scripts/content/Story/svm.d:1307"," ... lass uns lieber über was anderes reden ...."," ...давай поговорим о чем-нибудь другом...","","","SVM_8_Smalltalk24","",""
"Scripts/content/Story/svm.d:1308","Ommm","","","","SVM_8_Om","",""
"Scripts/content/Story/svm.d:1313","Ich will keine Magie in meiner Nähe!","Не вздумай использовать здесь магию!","","","SVM_9_StopMagic","",""
"Scripts/content/Story/svm.d:1314","Aufhören, sag' ich! Sofort!","Прекрати колдовать, я сказал!","","","SVM_9_ISaidStopMagic","",""
"Scripts/content/Story/svm.d:1315","Willst du mich angreifen?","Ты хочешь напасть на меня?","","","SVM_9_WeaponDown","",""
"Scripts/content/Story/svm.d:1316","Soll ich dir aufs Maul hauen oder steckst du das Ding weg?","Спрячь это, иначе пожалеешь!","","","SVM_9_ISaidWeaponDown","",""
"Scripts/content/Story/svm.d:1317","Pass auf, wo du hinzielst!","Не видишь куда целишься?","","","SVM_9_WatchYourAim","",""
"Scripts/content/Story/svm.d:1318","Pack das Ding weg!","Убери свое оружие!","","","SVM_9_WatchYourAimAngry","",""
"Scripts/content/Story/svm.d:1319","He! Pass auf!","Эй, ты что, совсем ослеп?","","","SVM_9_WhatAreYouDoing","",""
"Scripts/content/Story/svm.d:1320","Von mir aus können wir unseren Streit vergessen ...","Может, стоит забыть об этом...	","","","SVM_9_LetsForgetOurLittleFight","",""
"Scripts/content/Story/svm.d:1321","Zeig dich. Ich weiß, dass du mich hörst!","Давай, покажись. Я знаю, ты меня слышишь!","","","SVM_9_Strange","",""
"Scripts/content/Story/svm.d:1322","Die Biester sind wirklich saudumm!","Эти твари действительно здоровые!","","","SVM_9_DieMonster","",""
"Scripts/content/Story/svm.d:1323","Jetzt musst du dran glauben!","Тебе конец!","","","SVM_9_DieMortalEnemy","",""
"Scripts/content/Story/svm.d:1324","Jetzt wirst du mich kennen lernen!","Ты еще меня узнаешь!","","","SVM_9_NowWait","",""
"Scripts/content/Story/svm.d:1325","Du bist verdammt hartnäckig!","Какой же ты упрямый баран!","","","SVM_9_YouStillNotHaveEnough","",""
"Scripts/content/Story/svm.d:1326","Wer nicht hören will, muss fühlen!","Не хочешь слушать, так я объясню по-другому!","","","SVM_9_YouAskedForIt","",""
"Scripts/content/Story/svm.d:1327","Jetzt mach' ich Hackfleisch aus dir, Eindringling!","Вот ты и попался, зануда!","","","SVM_9_NowWaitIntruder","",""
"Scripts/content/Story/svm.d:1328","Ich habe dich gewarnt. Wer an meine Sachen geht, kriegt Ärger!","Я тебя предупредил. Пальцем тронешь мои вещи, и у тебя будут проблемы!","","","SVM_9_IWillTeachYouRespectForForeignProperty","",""
"Scripts/content/Story/svm.d:1329","Du Dieb! Ich mach dich fertig!","Вор! Ну, сейчас ты получишь!","","","SVM_9_DirtyThief","",""
"Scripts/content/Story/svm.d:1330","Niemand vergreift sich an meinen Jungs!","Никто не смеет обижать моих друзей!","","","SVM_9_YouAttackedMyCharge","",""
"Scripts/content/Story/svm.d:1331","Du hast einen meiner Jungs platt gemacht. Jetzt mach' ich DICH platt!","Ты убил одного из моих людей. Теперь твоя очередь!","","","SVM_9_YouKilledOneOfUs","",""
"Scripts/content/Story/svm.d:1332","Aaargl","","","","SVM_9_Dead","",""
"Scripts/content/Story/svm.d:1333","Aargh","","","","SVM_9_Aargh_1","",""
"Scripts/content/Story/svm.d:1334","Aargh","","","","SVM_9_Aargh_2","",""
"Scripts/content/Story/svm.d:1335","Aargh","","","","SVM_9_Aargh_3","",""
"Scripts/content/Story/svm.d:1336","UUAAARRGGGHHH!!!","","","","SVM_9_Berzerk","",""
"Scripts/content/Story/svm.d:1337","Du bist schon tot, du weißt es nur noch nicht.","Ты уже труп, правда еще не знаешь об этом.","","","SVM_9_YoullBeSorryForThis","",""
"Scripts/content/Story/svm.d:1338","Ganz ruhig. Alles in Ordnung!","Тихо, тихо. Все в порядке!","","","SVM_9_YesYes","",""
"Scripts/content/Story/svm.d:1339","Scheiße, was ein Biest!","Черт, ну и тварь!","","","SVM_9_ShitWhatAMonster","",""
"Scripts/content/Story/svm.d:1340","Nichts wie weg!","Пора уходить отсюда!","","","SVM_9_Help","",""
"Scripts/content/Story/svm.d:1341","Man sieht sich immer zweimal.","Еще увидимся!","","","SVM_9_WeWillMeetAgain","",""
"Scripts/content/Story/svm.d:1342","Beim nächsten Mal werde ich dich umbringen!","В следующий раз ты будешь мертв!","","","SVM_9_NeverTryThatAgain","",""
"Scripts/content/Story/svm.d:1343","Die Waffe gehört jetzt mir!","Это оружие теперь мое!","","","SVM_9_ITakeYourWeapon","",""
"Scripts/content/Story/svm.d:1344","Erz! Na das ist doch besser als gar nichts!","Руда! Хоть что-то, и то хорошо!","","","SVM_9_ITookYourOre","",""
"Scripts/content/Story/svm.d:1345","Der hat ja nicht mal Erz dabei!","Даже руды нет!","","","SVM_9_ShitNoOre","",""
"Scripts/content/Story/svm.d:1346","Finger weg, Freundchen!","Эй, руки прочь!","","","SVM_9_HandsOff","",""
"Scripts/content/Story/svm.d:1347","Raus hier!","Пошел прочь!","","","SVM_9_GetOutOfHere","",""
"Scripts/content/Story/svm.d:1348","Was hast du hier zu suchen?","Что тебе надо, парень?","","","SVM_9_YouViolatedForbiddenTerritory","",""
"Scripts/content/Story/svm.d:1349","Willst du mich verarschen, Mann?","Парень, ты что, пытаешься сделать из меня дурака?","","","SVM_9_YouWannaFoolMe","",""
