"location","source","target","id","fuzzy","context","translator_comments","developer_comments"
"Scripts/content/Story/svm.d:244","Hör auf mit dieser Magie-Scheiße!","Эй, никакой магии!","","","SVM_1_StopMagic","",""
"Scripts/content/Story/svm.d:245","Willst du Schläge? Hör sofort damit auf!!!","Получить захотел? Прекрати сейчас же!","","","SVM_1_ISaidStopMagic","",""
"Scripts/content/Story/svm.d:246","Steck die Waffe weg!","Убери оружие!","","","SVM_1_WeaponDown","",""
"Scripts/content/Story/svm.d:247","Steck endlich die Scheißwaffe weg!!","Убери это чертово оружие!","","","SVM_1_ISaidWeaponDown","",""
"Scripts/content/Story/svm.d:248","Nimm das Ding runter!!","Опусти оружие!","","","SVM_1_WatchYourAim","",""
"Scripts/content/Story/svm.d:249","Wenn du eine aufs Maul willst, ziel ruhig weiter auf mich!","Давай, целься в меня, если хочешь получить!","","","SVM_1_WatchYourAimAngry","",""
"Scripts/content/Story/svm.d:250","Pass auf! Noch mal und ich verpass dir eine.","Осторожно! Еще раз, и я поколочу тебя как следует!","","","SVM_1_WhatAreYouDoing","",""
"Scripts/content/Story/svm.d:251","Lass uns den kleinen Streit vergessen, okay?","Давай забудем об этой ссоре, ладно?","","","SVM_1_LetsForgetOurLittleFight","",""
"Scripts/content/Story/svm.d:252","Komm raus, du Dreckskerl!","Убирайся!","","","SVM_1_Strange","",""
"Scripts/content/Story/svm.d:253","Verdammtes Drecksvieh!","Проклятый зверь!","","","SVM_1_DieMonster","",""
"Scripts/content/Story/svm.d:254","Jetzt musst du dran glauben!","Тебе конец!","","","SVM_1_DieMortalEnemy","",""
"Scripts/content/Story/svm.d:255","Jetzt gibt's was aufs Maul ...","Ну, теперь ты точно получишь...","","","SVM_1_NowWait","",""
"Scripts/content/Story/svm.d:256","Du willst wohl noch eine aufs Maul!","Ты снова нарываешься?","","","SVM_1_YouStillNotHaveEnough","",""
"Scripts/content/Story/svm.d:257","Du wolltest so es so haben!","Ты сам напросился!","","","SVM_1_YouAskedForIt","",""
"Scripts/content/Story/svm.d:258","Jetzt sorg ich dafür, dass du in Einzelteilen hier weggeschafft wirst!","Сейчас я тебе наломаю ребра!","","","SVM_1_NowWaitIntruder","",""
"Scripts/content/Story/svm.d:259","Ich habe dich gewarnt, die Drecksfinger von meinen Sachen zu lassen!","Я же предупреждал тебя не трогать мои вещи!","","","SVM_1_IWillTeachYouRespectForForeignProperty","",""
"Scripts/content/Story/svm.d:260","Ich mach dich fertig, du Dieb!","Я прикончу тебя, вор!","","","SVM_1_DirtyThief","",""
"Scripts/content/Story/svm.d:261","Niemand vergreift sich an meinen Kumpels!","Никто не смеет лезть к моим друзьям!","","","SVM_1_YouAttackedMyCharge","",""
"Scripts/content/Story/svm.d:262","Du hast einen von uns platt gemacht. Jetzt mach' ich DICH platt!","Ты ударил нашего человека! Сейчас я ударю тебя! ","","","SVM_1_YouKilledOneOfUs","",""
"Scripts/content/Story/svm.d:263","Aaaaaargl!","","","","SVM_1_Dead","",""
"Scripts/content/Story/svm.d:264","Aargh","","","","SVM_1_Aargh_1","",""
"Scripts/content/Story/svm.d:265","Aargh","","","","SVM_1_Aargh_2","",""
"Scripts/content/Story/svm.d:266","Aargh","","","","SVM_1_Aargh_3","",""
"Scripts/content/Story/svm.d:267","UUAAARRGGGHHH!!!","","","","SVM_1_Berzerk","",""
"Scripts/content/Story/svm.d:268","Das wird dir noch Leid tun!","Ты еще об этом пожалеешь!","","","SVM_1_YoullBeSorryForThis","",""
"Scripts/content/Story/svm.d:269","Keine Panik! Hast gewonnen!","Не волнуйся! Ты победил!","","","SVM_1_YesYes","",""
"Scripts/content/Story/svm.d:270","Scheiße! Nichts wie weg!","Пора уносить ноги!","","","SVM_1_ShitWhatAMonster","",""
"Scripts/content/Story/svm.d:271","Verdammt!","Проклятье!","","","SVM_1_Help","",""
"Scripts/content/Story/svm.d:272","Wir sehen uns wieder!","Мы с тобой еще поговорим!","","","SVM_1_WeWillMeetAgain","",""
"Scripts/content/Story/svm.d:273","Noch einmal und du kannst was erleben.","Только попробуй сделать это еще раз!","","","SVM_1_NeverTryThatAgain","",""
"Scripts/content/Story/svm.d:274","Nette Waffe! Her damit!","Хорошее оружие! Я заберу его.","","","SVM_1_ITakeYourWeapon","",""
"Scripts/content/Story/svm.d:275","Danke für das Erz, du Held!","Спасибо за руду, герой!","","","SVM_1_ITookYourOre","",""
"Scripts/content/Story/svm.d:276","Du arme Wurst, hast ja nicht mal Erz dabei!","Жалкий червяк, да у тебя же нет ни куска руды!","","","SVM_1_ShitNoOre","",""
"Scripts/content/Story/svm.d:277","Flossen weg!","Убери руки!","","","SVM_1_HandsOff","",""
"Scripts/content/Story/svm.d:278","Verschwinde hier!","Убирайся отсюда!","","","SVM_1_GetOutOfHere","",""
"Scripts/content/Story/svm.d:279","Hey! Wie kommst du hier rein?","Эй! А ты откуда здесь взялся?","","","SVM_1_YouViolatedForbiddenTerritory","",""
"Scripts/content/Story/svm.d:280","Du glaubst wohl, ich bin bescheuert!","Ты думаешь, меня так легко обмануть?","","","SVM_1_YouWannaFoolMe","",""
"Scripts/content/Story/svm.d:281","Hey du! Was schleichst du da rum.","Эй, ты! Что это ты здесь делаешь?","","","SVM_1_WhatsThisSupposedToBe","",""
"Scripts/content/Story/svm.d:282","Raus aus meiner Hütte oder ich ruf die Wachen!","Убирайся из моего дома, или тебя выкинет стража!","","","SVM_1_WhyYouAreInHere","",""
"Scripts/content/Story/svm.d:283","Du hast da drinnen nichts verloren! Verschwinde!","Здесь ты ничего не найдешь! Исчезни!","","","SVM_1_WhatDidYouInThere","",""
"Scripts/content/Story/svm.d:284","Kluges Kerlchen!","Молодец, послушный мальчик!","","","SVM_1_WiseMove","",""
"Scripts/content/Story/svm.d:285","Wachen! Hierher!","Стража! Сюда!","","","SVM_1_Alarm","",""
"Scripts/content/Story/svm.d:286","ALARM!!! EINDRINGLING!!!","Тревога! Здесь чужой!","","","SVM_1_IntruderAlert","",""
"Scripts/content/Story/svm.d:287","Hinter dir!","Будь осторожен!","","","SVM_1_BehindYou","",""
"Scripts/content/Story/svm.d:288","Ah, ein Kampf!","А, драка!","","","SVM_1_TheresAFight","",""
"Scripts/content/Story/svm.d:289","Fester!","Бей его!","","","SVM_1_HeyHeyHey","",""
"Scripts/content/Story/svm.d:290","Ihr kämpft wie Frauen!","Деретесь как бабы!","","","SVM_1_CheerFight","",""
"Scripts/content/Story/svm.d:291","Mach ihn alle!!","Прикончи его!","","","SVM_1_CheerFriend","",""
"Scripts/content/Story/svm.d:292","Schlag doch zurück!","Да бей же его!","","","SVM_1_Ooh","",""
"Scripts/content/Story/svm.d:293","Gib's ihm!","Врежь ему!","","","SVM_1_YeahWellDone","",""
"Scripts/content/Story/svm.d:294","Komm zurück, du Feigling!","Куда же ты, трус!","","","SVM_1_RunCoward","",""
"Scripts/content/Story/svm.d:295","Der hat genug!","Хватит с него!","","","SVM_1_HeDefeatedHim","",""
"Scripts/content/Story/svm.d:296","Geschieht ihm recht!","Так ему и надо!","","","SVM_1_HeDeservedIt","",""
"Scripts/content/Story/svm.d:297","Warum hast du ihn kaltgemacht? Du bist so gut wie tot!","Зачем ты убил его? Теперь тебе не жить!","","","SVM_1_HeKilledHim","",""
"Scripts/content/Story/svm.d:298","Schöner Kampf!","Хороший бой!","","","SVM_1_ItWasAGoodFight","",""
"Scripts/content/Story/svm.d:299","Gäääähn","","","","SVM_1_Awake","",""
"Scripts/content/Story/svm.d:300","Hallo","Привет!","","","SVM_1_FriendlyGreetings","",""
"Scripts/content/Story/svm.d:301","Für Gomez!","За Гомеза!","","","SVM_1_ALGreetings","",""
"Scripts/content/Story/svm.d:302","Magie zu Ehren!","Во имя магии!","","","SVM_1_MageGreetings","",""
"Scripts/content/Story/svm.d:303","Erwache!","Пробудись!","","","SVM_1_SectGreetings","",""
"Scripts/content/Story/svm.d:304","Da drüben ist er.","Вот же он.","","","SVM_1_ThereHeIs","",""
"Scripts/content/Story/svm.d:305","Komm wieder, wenn du mehr Erfahrung hast.","Приходи, когда будешь более опытен.","","","SVM_1_NoLearnNoPoints","",""
"Scripts/content/Story/svm.d:306","Du bist am Ende deiner Möglichkeiten. Du solltest etwas anderes lernen.","Ты больше не можешь этому научиться. Тебе стоит попробовать что-то другое.","","","SVM_1_NoLearnOverMax","",""
"Scripts/content/Story/svm.d:307","Du musst erst fortgeschritten sein, bevor du Meister werden kannst!","Тебе нужно изучить основы, прежде чем стать настоящим мастером.","","","SVM_1_NoLearnYouAlreadyKnow","",""
"Scripts/content/Story/svm.d:308","Du bist jetzt schon besser!","Ты уже стал умнее.","","","SVM_1_NoLearnYoureBetter","",""
"Scripts/content/Story/svm.d:309","Hey, du!","Эй, ты!","","","SVM_1_HeyYou","",""
"Scripts/content/Story/svm.d:310","Nicht jetzt!","Я занят!","","","SVM_1_NotNow","",""
"Scripts/content/Story/svm.d:311","Was willst du?","Что тебе нужно?","","","SVM_1_WhatDoYouWant","",""
"Scripts/content/Story/svm.d:312","Kann ich irgendwas für dich tun?!","Так тебе что-то нужно?","","","SVM_1_ISaidWhatDoYouWant","",""
"Scripts/content/Story/svm.d:313","Lass mich mal vorbei!","Дай пройти!","","","SVM_1_MakeWay","",""
"Scripts/content/Story/svm.d:314","Mach endlich Platz, Mann!","Уйди с дороги!","","","SVM_1_OutOfMyWay","",""
"Scripts/content/Story/svm.d:315","Bist du taub? WEG DA!!","Ты глухой? С дороги!","","","SVM_1_YouDeafOrWhat","",""
"Scripts/content/Story/svm.d:316","Suchst du wieder Streit?","Ты снова ищешь неприятностей?","","","SVM_1_LookingForTroubleAgain","",""
"Scripts/content/Story/svm.d:317","Äääh! Ich hab nichts gesehen!","Э, а я ничего не видел!","","","SVM_1_LookAway","",""
"Scripts/content/Story/svm.d:318","Okay, Okay! Behalt es einfach!","Хорошо, как хочешь! Оставь себе!","","","SVM_1_OkayKeepIt","",""
"Scripts/content/Story/svm.d:319","Was war das denn?","Что это было?","","","SVM_1_WhatsThat","",""
"Scripts/content/Story/svm.d:320","Du rennst mit MEINER Waffe rum!","Ты носишь мое оружие!","","","SVM_1_ThatsMyWeapon","",""
"Scripts/content/Story/svm.d:321","Her mit dem Ding!","Отдай его мне!","","","SVM_1_GiveItToMe","",""
"Scripts/content/Story/svm.d:322","Dann behalt es eben! Ich brauch es sowieso nicht!","Да, ладно, оставляй. Мне оно все равно не нужно.","","","SVM_1_YouCanKeeptheCrap","",""
"Scripts/content/Story/svm.d:323","Sie haben einen von unseren Leuten umgebracht. Wenn ich das Schwein kriege ...","Кто-то убил одного из моих людей. Если я его найду...","","","SVM_1_TheyKilledMyFriend","",""
"Scripts/content/Story/svm.d:324","Verdammt, warum weckst du mich?","Эй, ну зачем ты меня разбудил?","","","SVM_1_YouDisturbedMySlumber","",""
"Scripts/content/Story/svm.d:325","Haste was aufs Maul gekriegt? Geschieht dir recht!","Ну, что, получил? Поделом тебе!","","","SVM_1_SuckerGotSome","",""
"Scripts/content/Story/svm.d:326","Du hast einen Erzbaron umgehauen. Er ist so richtig wütend!","Ты избил Барона! Уж он то тебе отомстит!","","","SVM_1_SuckerDefeatedEBr","",""
"Scripts/content/Story/svm.d:327","Du hast einen Guru niedergeschlagen. Irgendwie ziehst du Ärger an!","Ты ударил Гуру. Ты точно напрашиваешься на неприятности!","","","SVM_1_SuckerDefeatedGur","",""
"Scripts/content/Story/svm.d:328","Einen Magier zu besiegen ist 'ne wirklich beschissene Idee!","Ты победил мага... и как только ты додумался до этого?!","","","SVM_1_SuckerDefeatedMage","",""
"Scripts/content/Story/svm.d:329","Du kannst hier nicht rumrennen und die Novizen verprügeln!","Думаешь, ты можешь безнаказанно обижать здесь послушников?","","","SVM_1_SuckerDefeatedNov_Guard","",""
"Scripts/content/Story/svm.d:330","Lass die Finger von meinen Jungs!","Убери руки от моих людей!","","","SVM_1_SuckerDefeatedVlk_Guard","",""
"Scripts/content/Story/svm.d:331","Du hast einen Kumpel von mir umgehauen ...","Ты ударил моего напарника...","","","SVM_1_YouDefeatedMyComrade","",""
"Scripts/content/Story/svm.d:332","Das läuft nicht, dass du hier Unruhe stiftest!","От тебя здесь одни неприятности. Так дальше не может продолжаться!","","","SVM_1_YouDefeatedNOV_Guard","",""
"Scripts/content/Story/svm.d:333","Wenn du jemanden verprügelst, der unter meinem Schutz steht, hat das Konsequenzen!","Если ты тронешь кого-нибудь из моих подопечных, будешь иметь дело со мной!","","","SVM_1_YouDefeatedVLK_Guard","",""
"Scripts/content/Story/svm.d:334","Du Arsch hast mich beklaut! Versuch das nicht noch mal!","Ты обокрал меня! Только попробуй подойти ко мне еще раз!","","","SVM_1_YouStoleFromMe","",""
"Scripts/content/Story/svm.d:335","Wir wollen unsere Sachen wiederhaben! Lass sehen!","Я хочу получить свои вещи! А ну верни!","","","SVM_1_YouStoleFromUs","",""
"Scripts/content/Story/svm.d:336","Du hast die Erzbarone beklaut! Was soll der Scheiß?","Ты обокрал Баронов! Зачем ты это сделал?  ","","","SVM_1_YouStoleFromEBr","",""
"Scripts/content/Story/svm.d:337","Du hast die Gurus beklaut? Dumm nur, dass es rausgekommen ist!","Ты обокрал Гуру! А они уже знают об этом!","","","SVM_1_YouStoleFromGur","",""
"Scripts/content/Story/svm.d:338","Du hast die Magier beklaut! Eine echt dämliche Idee!","Ты обокрал магов! Какая странная идея!","","","SVM_1_StoleFromMage","",""
"Scripts/content/Story/svm.d:339","Einer unserer eigenen Leute hat ins Gras gebissen und du hast damit zu tun! Der kleinste Fehler noch und du bist Freiwild!","Один из наших людей убит. Допустишь такую ошибку еще раз, и тебе конец!","","","SVM_1_YouKilledMyFriend","",""
"Scripts/content/Story/svm.d:340","Du hast einen Erzbaron umgelegt! Mann, du bist wohl komplett durchgedreht!?","Ты убил Барона! Только сумасшедший мог пойти на это!","","","SVM_1_YouKilledEBr","",""
"Scripts/content/Story/svm.d:341","Du hast einen Guru getötet! Junge, das kann doch nicht wahr sein!","Ты убил Гуру! Я не могу в это поверить!","","","SVM_1_YouKilledGur","",""
"Scripts/content/Story/svm.d:342","Du hast einen Magier umgebracht! Wie sollen wir das denn erklären?","Ты убил мага! Можешь объяснить, зачем ты это сделал?","","","SVM_1_YouKilledMage","",""
"Scripts/content/Story/svm.d:343","Jemand aus dem Alten Lager ist verstorben und dein Name wird dabei erwähnt ...","В Старом лагере произошло убийство. Ходят слухи, что ты в этом замешан...","","","SVM_1_YouKilledOCfolk","",""
"Scripts/content/Story/svm.d:344","Das Neue Lager hat einen tragischen Verlust erlitten, und scheinbar hast du damit zu tun!","В Новом лагере убили человека и поговаривают, что там без тебя не обошлось!","","","SVM_1_YouKilledNCfolk","",""
"Scripts/content/Story/svm.d:345","Die Bruderschaft ist um einen Anhänger ärmer und wie es scheint, warst du das!","Убит один из приверженцев новой веры, и его смерть на твоей совести!","","","SVM_1_YouKilledPSIfolk","",""
"Scripts/content/Story/svm.d:346","Das wieder hinzubiegen wird nicht einfach!","Не хотел бы я попасть в подобную переделку!","","","SVM_1_GetThingsRight","",""
"Scripts/content/Story/svm.d:347","War ein guter Kampf. Du hast mir ganz schön aufs Maul gehauen, Mann!","Это был хороший бой. Тебе удалось победить меня!","","","SVM_1_YouDefeatedMeWell","",""
"Scripts/content/Story/svm.d:348"," ... der letzte Scheiß ..."," ...хуже все то, что...","","","SVM_1_Smalltalk01","",""
"Scripts/content/Story/svm.d:349"," ... kann schon sein, aber wen interessiert das? ..."," ...может быть, но кому это надо...","","","SVM_1_Smalltalk02","",""
"Scripts/content/Story/svm.d:350"," ... absolut idiotisch ..."," ...полная ерунда...","","","SVM_1_Smalltalk03","",""
"Scripts/content/Story/svm.d:351"," ... ich halt mich da lieber raus ..."," ...не стоит в это ввязываться...","","","SVM_1_Smalltalk04","",""
"Scripts/content/Story/svm.d:352"," ... das ist wirklich nicht mein Problem ..."," ...а это уже не моя проблема...","","","SVM_1_Smalltalk05","",""
"Scripts/content/Story/svm.d:353"," ... war doch klar, dass das Ärger gibt ..."," ...уже тогда было ясно, что этим дело не кончится...","","","SVM_1_Smalltalk06","",""
"Scripts/content/Story/svm.d:354"," ... warum passiert so was immer wieder? ..."," ...со мной это часто случается...","","","SVM_1_Smalltalk07","",""
"Scripts/content/Story/svm.d:355"," ... das passiert mir nicht noch mal ..."," ...не хочу пережить это снова...","","","SVM_1_Smalltalk08","",""
"Scripts/content/Story/svm.d:356"," ... an der Geschichte muss doch wohl was dran sein ..."," ...а в этой истории что-то есть...","","","SVM_1_Smalltalk09","",""
"Scripts/content/Story/svm.d:357"," ... nicht so viel quatschen, ja, ja ..."," ...да ну, хватит болтать...","","","SVM_1_Smalltalk10","",""
"Scripts/content/Story/svm.d:358"," ... so lange ich nichts damit zu tun habe ..."," ...я не имею к этому никакого отношения...","","","SVM_1_Smalltalk11","",""
"Scripts/content/Story/svm.d:359"," ... man darf auch nicht alles glauben ..."," ...нельзя верить всему, что говорят...","","","SVM_1_Smalltalk12","",""
"Scripts/content/Story/svm.d:360"," ... in seiner Haut will ich trotzdem nicht stecken ..."," ...не хотел бы оказаться на его месте...","","","SVM_1_Smalltalk13","",""
"Scripts/content/Story/svm.d:361"," ... immer wieder dieselbe Leier ..."," ...все время одно и то же...","","","SVM_1_Smalltalk14","",""
"Scripts/content/Story/svm.d:362"," ... manche lernen eben gar nichts dazu ..."," ...некоторых ничему нельзя научить...","","","SVM_1_Smalltalk15","",""
"Scripts/content/Story/svm.d:363"," ... früher wäre das ganz anders gelaufen ..."," ...раньше все было совсем по-другому...","","","SVM_1_Smalltalk16","",""
"Scripts/content/Story/svm.d:364"," ... gequatscht wird viel ..."," ...люди слишком много болтают...","","","SVM_1_Smalltalk17","",""
"Scripts/content/Story/svm.d:365"," ... ich hör' nicht mehr auf das Gefasel ..."," ...больше не хочу это слушать...","","","SVM_1_Smalltalk18","",""
"Scripts/content/Story/svm.d:366"," ... verlass dich auf jemanden und du bist verlassen, das ist eben so ..."," ...никому не доверяй, здесь кругом предатели...","","","SVM_1_Smalltalk19","",""
"Scripts/content/Story/svm.d:367"," ... ich glaube kaum, dass sich daran was ändern wird ..."," ...не думаю, что здесь можно хоть что-нибудь изменить...","","","SVM_1_Smalltalk20","",""
"Scripts/content/Story/svm.d:368"," ... wahrscheinlich hast du Recht ..."," ...быть может, ты и прав...","","","SVM_1_Smalltalk21","",""
"Scripts/content/Story/svm.d:369"," ... erst mal abwarten. Es wird nichts so heiß gegessen, wie es gekocht wird ..."," ...подожди. Не стоит принимать поспешные решения...","","","SVM_1_Smalltalk22","",""
"Scripts/content/Story/svm.d:370"," ... ich dachte, das wäre schon lange geklärt ..."," ...я думал, об этом уже все давно знают...","","","SVM_1_Smalltalk23","",""
"Scripts/content/Story/svm.d:371"," ... lass uns lieber über was anderes reden ..."," ...поговорим об этом в следующий раз...","","","SVM_1_Smalltalk24","",""
"Scripts/content/Story/svm.d:372"," Ommm"," ","","","SVM_1_Om","",""
"Scripts/content/Story/svm.d:379","Keine Magie!","Никакой магии!","","","SVM_2_StopMagic","",""
"Scripts/content/Story/svm.d:380","HEY! Keine Magie, hab' ich gesagt!","Эй! Никакой магии. Я сказал!","","","SVM_2_ISaidStopMagic","",""
"Scripts/content/Story/svm.d:381","Komm, steck das Ding weg!","Давай, убирай это!","","","SVM_2_WeaponDown","",""
"Scripts/content/Story/svm.d:382","Weg mit der Waffe!","Убери оружие!","","","SVM_2_ISaidWeaponDown","",""
"Scripts/content/Story/svm.d:383","Pass auf, wo du hinzielst!","Не видишь куда целишься?","","","SVM_2_WatchYourAim","",""
"Scripts/content/Story/svm.d:384","Wenn du weiter auf mich anlegst, muss ich das wohl persönlich nehmen!","Если ты и дальше собираешься целиться в меня, я могу это неправильно понять!","","","SVM_2_WatchYourAimAngry","",""
"Scripts/content/Story/svm.d:385","Hey, was soll denn das??","Эй, для чего это?","","","SVM_2_WhatAreYouDoing","",""
"Scripts/content/Story/svm.d:386","Lass uns die Sache vergessen, ok?","Забудем об этом, хорошо?","","","SVM_2_LetsForgetOurLittleFight","",""
"Scripts/content/Story/svm.d:387","Seltsam? Wo ist er denn hin?!","Странно! Куда он пошел?!","","","SVM_2_Strange","",""
"Scripts/content/Story/svm.d:388","Schon wieder eins!","Еще один!","","","SVM_2_DieMonster","",""
"Scripts/content/Story/svm.d:389","Ich befürchte, ich muss dich beseitigen!","Боюсь, мне придется убить тебя!","","","SVM_2_DieMortalEnemy","",""
"Scripts/content/Story/svm.d:390","Du bist selbst Schuld!","Это твоя вина!","","","SVM_2_NowWait","",""
"Scripts/content/Story/svm.d:391","Hast du noch nicht genug?","Тебе что, мало?","","","SVM_2_YouStillNotHaveEnough","",""
"Scripts/content/Story/svm.d:392","Wenn du es unbedingt willst!","Ну, если ты этого хочешь...","","","SVM_2_YouAskedForIt","",""
"Scripts/content/Story/svm.d:393","Du weißt doch, dass du hier nichts zu Suchen hast!","Ты знаешь, что тебе нечего здесь делать!","","","SVM_2_NowWaitIntruder","",""
"Scripts/content/Story/svm.d:394","Warum fummelst du auch an Sachen rum, die dir nicht gehören?!","Почему ты роешься в чужих вещах?!","","","SVM_2_IWillTeachYouRespectForForeignProperty","",""
"Scripts/content/Story/svm.d:395","Du hast mich beklaut! Das nehme ich dir echt übel!","Ты обокрал меня! Я это запомню!","","","SVM_2_DirtyThief","",""
"Scripts/content/Story/svm.d:396","Niemand vergreift sich an meinen Jungs!","Никто не смеет обижать моих друзей!","","","SVM_2_YouAttackedMyCharge","",""
"Scripts/content/Story/svm.d:397","Du hast einen von uns umgebracht! Dafür musst du büßen!","Ты убил одного из наших! Ты за это заплатишь!","","","SVM_2_YouKilledOneOfUs","",""
"Scripts/content/Story/svm.d:398","Aaargl","","","","SVM_2_Dead","",""
"Scripts/content/Story/svm.d:399","Aargh","","","","SVM_2_Aargh_1","",""
"Scripts/content/Story/svm.d:400","Aargh","","","","SVM_2_Aargh_2","",""
"Scripts/content/Story/svm.d:401","Aargh","","","","SVM_2_Aargh_3","",""
"Scripts/content/Story/svm.d:402","UUAAARRGGGHHH!!!","","","","SVM_2_Berzerk","",""
"Scripts/content/Story/svm.d:403","Das wird dir noch Leid tun!","Ты еще об этом пожалеешь!","","","SVM_2_YoullBeSorryForThis","",""
"Scripts/content/Story/svm.d:404","Langsam, langsam, du hast gewonnen!","Спокойно. Спокойно. Ты победил.","","","SVM_2_YesYes","",""
"Scripts/content/Story/svm.d:405","Ich - ähm - geh' Hilfe holen!","Я, гм... мне просто нужна была помощь!","","","SVM_2_ShitWhatAMonster","",""
"Scripts/content/Story/svm.d:406","Keine Zeit, ich muss noch was erledigen!","Нет времени - спешное дело!","","","SVM_2_Help","",""
"Scripts/content/Story/svm.d:407","Wir sehen uns bestimmt noch mal wieder!","Уверен, мы еще встретимся!","","","SVM_2_WeWillMeetAgain","",""
"Scripts/content/Story/svm.d:408","Versuch das nicht noch mal!","Больше не делай этого!","","","SVM_2_NeverTryThatAgain","",""
"Scripts/content/Story/svm.d:409","Die Waffe nehm' ich mir!","Я возьму это!","","","SVM_2_ITakeYourWeapon","",""
"Scripts/content/Story/svm.d:410","Etwas Erz kannst du doch entbehren!","В любом случае, эта руда тебе уже не пригодится!","","","SVM_2_ITookYourOre","",""
