"location","source","target","id","fuzzy","context","translator_comments","developer_comments"
"Scripts/content/Story/svm.d:1664","Einen Magier zu besiegen ... ist nicht besonders clever!","Победить мага... не самое лучшее решение!","","","SVM_11_SuckerDefeatedMage","",""
"Scripts/content/Story/svm.d:1665","Ich beschütze die Jungs hier und du hast einen von ihnen umgehauen ...","Эти люди под моей защитой. Ты ударил одного из них...","","","SVM_11_SuckerDefeatedNov_Guard","",""
"Scripts/content/Story/svm.d:1666","Wenn du dich an den Buddlern vergreifst, vergreifst du dich an meiner Kasse!","Не лезь к рудокопам, иначе тебе попадет!","","","SVM_11_SuckerDefeatedVlk_Guard","",""
"Scripts/content/Story/svm.d:1667","Wer meine Kameraden verletzt, verletzt mich.","Враг моих друзей - мой враг.","","","SVM_11_YouDefeatedMyComrade","",""
"Scripts/content/Story/svm.d:1668","Vergreif dich noch einmal an unseren Jungs und es wird dir Leid tun.","Только тронь послушника, и мы с тебя шкуру спустим!","","","SVM_11_YouDefeatedNOV_Guard","",""
"Scripts/content/Story/svm.d:1669","Meine Schützlinge anzugreifen kann dich den Kopf kosten.","Поднимаешь руку на моих подопечных? Это может стоить тебе головы.","","","SVM_11_YouDefeatedVLK_Guard","",""
"Scripts/content/Story/svm.d:1670","Du wagst es, mir unter die Augen zu treten, dreckiger Dieb?","Как ты смеешь являться сюда, грязный вор!","","","SVM_11_YouStoleFromMe","",""
"Scripts/content/Story/svm.d:1671","Du hast einige Sachen, die uns gehören. Gib sie besser wieder her.","У тебя есть то, что принадлежит нам. Верни немедленно!","","","SVM_11_YouStoleFromUs","",""
"Scripts/content/Story/svm.d:1672","Mann! Du hast die Erzbarone beklaut! Na, die werden toben!","Вот это да! Ты обокрал Баронов! Они будут в ярости!","","","SVM_11_YouStoleFromEBr","",""
"Scripts/content/Story/svm.d:1673","Du hast die Gurus um ein paar Sachen erleichtert, was?","Ты что-то украл у Гуру, да? Не стоило этого делать!","","","SVM_11_YouStoleFromGur","",""
"Scripts/content/Story/svm.d:1674","Du hast die Magier um ein paar Sachen erleichtert, was?","Ты что-то украл у магов, правда? Ты же не станешь говорить, что это не так?","","","SVM_11_StoleFromMage","",""
"Scripts/content/Story/svm.d:1675","Du hast die Regel Nr.1 gebrochen! Kein Töten!","Наше первое правило: не убивать. Ты его нарушил!","","","SVM_11_YouKilledMyFriend","",""
"Scripts/content/Story/svm.d:1676","Du hast einen Erzbaron umgelegt! Mann, du bist wohl komplett durchgedreht!?","Ты убил Барона! Только сумасшедший мог пойти на это!","","","SVM_11_YouKilledEBr","",""
"Scripts/content/Story/svm.d:1677","Du hast einen Guru getötet! Junge, das kann doch nicht wahr sein!","Ты убил Гуру! Я не могу в это поверить!","","","SVM_11_YouKilledGur","",""
"Scripts/content/Story/svm.d:1678","Du hast einen Magier umgebracht! Wie sollen wir das denn erklären?","Ты убил мага! Можешь объяснить, зачем ты это сделал?","","","SVM_11_YouKilledMage","",""
"Scripts/content/Story/svm.d:1679","Jemand aus dem Alten Lager ist verstorben und dein Name wird dabei erwähnt ...","В Старом лагере произошло убийство. Ходят слухи, что ты в этом замешан...","","","SVM_11_YouKilledOCfolk","",""
"Scripts/content/Story/svm.d:1680","Das Neue Lager hat einen tragischen Verlust erlitten, und scheinbar hast du damit zu tun!","В Новом лагере убили человека и поговаривают, что там без тебя не обошлось!","","","SVM_11_YouKilledNCfolk","",""
"Scripts/content/Story/svm.d:1681","Die Bruderschaft ist um einen Anhänger ärmer und wie es scheint, warst du das!","Убит один из приверженцев новой веры, и его смерть на твоей совести!","","","SVM_11_YouKilledPSIfolk","",""
"Scripts/content/Story/svm.d:1682","Das wieder hinzubiegen wird nicht einfach!","Не хотел бы я попасть в подобную переделку!","","","SVM_11_GetThingsRight","",""
"Scripts/content/Story/svm.d:1683","Das war ein guter Kampf. Die Schmerzen werde ich noch tagelang spüren. Aber jetzt ist gut!","Мы честно сражались. Я еще долго буду вспоминать об этом поединке. Но сейчас все позади!","","","SVM_11_YouDefeatedMeWell","",""
"Scripts/content/Story/svm.d:1684"," ... wenn du meinst ..."," ...если ты думаешь...","","","SVM_11_Smalltalk01","",""
"Scripts/content/Story/svm.d:1685"," ... kann schon sein ..."," ..ну, может быть...","","","SVM_11_Smalltalk02","",""
"Scripts/content/Story/svm.d:1686"," ... war nicht besonders schlau ..."," ...ну, это было не слишком умно...","","","SVM_11_Smalltalk03","",""
"Scripts/content/Story/svm.d:1687"," ... ich halt mich da lieber raus ..."," ...не стоит в это ввязываться...","","","SVM_11_Smalltalk04","",""
"Scripts/content/Story/svm.d:1688"," ... das ist wirklich nicht mein Problem ..."," ...а это уже не моя проблема...","","","SVM_11_Smalltalk05","",""
"Scripts/content/Story/svm.d:1689"," ... war doch klar, dass das Ärger gibt ..."," ...уже тогда было ясно, что этим дело не кончится...","","","SVM_11_Smalltalk06","",""
"Scripts/content/Story/svm.d:1690"," ... aber behalt's für dich, muss nicht gleich jeder wissen ..."," ...ну знаешь, держи это при себе, людям необязательно знать об этом.","","","SVM_11_Smalltalk07","",""
"Scripts/content/Story/svm.d:1691"," ... das passiert mir nicht noch mal ..."," ...не хочу пережить это снова...","","","SVM_11_Smalltalk08","",""
"Scripts/content/Story/svm.d:1692"," ... an der Geschichte muss wohl doch was dran sein ..."," ...что-то не так в этой истории...","","","SVM_11_Smalltalk09","",""
"Scripts/content/Story/svm.d:1693"," ... man muss eben aufpassen, was man rumerzählt ..."," ...ты должен следить за тем, что говоришь людям...","","","SVM_11_Smalltalk10","",""
"Scripts/content/Story/svm.d:1694"," ... solange ich damit nichts zu tun habe ..."," ...пока меня не впутали...","","","SVM_11_Smalltalk11","",""
"Scripts/content/Story/svm.d:1695"," ... man darf auch nicht alles glauben, was man hört ..."," ...ты не должен верить всему...","","","SVM_11_Smalltalk12","",""
"Scripts/content/Story/svm.d:1696"," ... in seiner Haut will ich trotzdem nicht stecken ..."," ...не хотел бы оказаться на его месте...","","","SVM_11_Smalltalk13","",""
"Scripts/content/Story/svm.d:1697"," ... immer wieder dieselbe Leier ..."," ...все время одно и то же...","","","SVM_11_Smalltalk14","",""
"Scripts/content/Story/svm.d:1698"," ... manche lernen eben gar nichts dazu ..."," ...некоторых ничему нельзя научить...","","","SVM_11_Smalltalk15","",""
"Scripts/content/Story/svm.d:1699"," ... früher wäre das ganz anders gelaufen ..."," ...раньше все было совсем по-другому...","","","SVM_11_Smalltalk16","",""
"Scripts/content/Story/svm.d:1700"," ... gequatscht wird viel ..."," ...люди слишком много болтают...","","","SVM_11_Smalltalk17","",""
"Scripts/content/Story/svm.d:1701"," ... ich hör' nicht mehr auf das Gefasel ..."," ...больше не хочу это слушать...","","","SVM_11_Smalltalk18","",""
"Scripts/content/Story/svm.d:1702"," ... verlass dich auf jemanden und du bist verlassen, das ist eben so ..."," ...никому не доверяй, здесь кругом предатели...","","","SVM_11_Smalltalk19","",""
"Scripts/content/Story/svm.d:1703"," ... ich glaube kaum, dass sich daran was ändern wird ..."," ...не думаю, что здесь можно хоть что-нибудь изменить...","","","SVM_11_Smalltalk20","",""
"Scripts/content/Story/svm.d:1704"," ... wahrscheinlich hast du Recht ..."," ...быть может, ты и прав...","","","SVM_11_Smalltalk21","",""
"Scripts/content/Story/svm.d:1705"," ... erst mal abwarten. Es wird nichts so heiß gegessen, wie es gekocht wird ..."," ...подожди. Не стоит принимать поспешные решения...","","","SVM_11_Smalltalk22","",""
"Scripts/content/Story/svm.d:1706"," ... ich dachte, das wäre schon lange geklärt ..."," ...я думал, об этом уже все давно знают...","","","SVM_11_Smalltalk23","",""
"Scripts/content/Story/svm.d:1707"," ... lass uns lieber über was anderes reden ..."," ...поговорим об этом в следующий раз...","","","SVM_11_Smalltalk24","",""
"Scripts/content/Story/svm.d:1708","Ommm","","","","SVM_11_Om","",""
"Scripts/content/Story/svm.d:1713","Pack die Magie weg!","Колдовать запрещено!","","","SVM_12_StopMagic","",""
"Scripts/content/Story/svm.d:1714","Wenn ich 'Magie weg' sage, dann mein' ich das auch so!","Я же сказал: колдовать запрещено!","","","SVM_12_ISaidStopMagic","",""
"Scripts/content/Story/svm.d:1715","Was hast du mit der Waffe vor, Mann!","Лучше бы ты спрятал свое оружие!","","","SVM_12_WeaponDown","",""
"Scripts/content/Story/svm.d:1716","Steck weg, das Ding!","Спрячь оружие, я сказал!","","","SVM_12_ISaidWeaponDown","",""
"Scripts/content/Story/svm.d:1717","Du zielst auf mich!","Ты собрался меня убить! Только попробуй!","","","SVM_12_WatchYourAim","",""
"Scripts/content/Story/svm.d:1718","Wenn du nicht aufhörst, gibt's Ärger!","Перестань в меня целиться, иначе у тебя будут проблемы!","","","SVM_12_WatchYourAimAngry","",""
"Scripts/content/Story/svm.d:1719","Hey, bist du blind oder was?","Эй, ты что, совсем ослеп?","","","SVM_12_WhatAreYouDoing","",""
"Scripts/content/Story/svm.d:1720","Den kleinen Streit vergessen wir, okay?","Давай забудем эту ссору, ладно?","","","SVM_12_LetsForgetOurLittleFight","",""
"Scripts/content/Story/svm.d:1721","Eben war er doch noch da!? Seltsam!","Но он только что был здесь?! Странно! ","","","SVM_12_Strange","",""
"Scripts/content/Story/svm.d:1722","Du bist fällig, Mistvieh!!","Твоя очередь, ублюдок!","","","SVM_12_DieMonster","",""
"Scripts/content/Story/svm.d:1723","Jetzt wird abgerechnet!","Настал час расплаты!","","","SVM_12_DieMortalEnemy","",""
"Scripts/content/Story/svm.d:1724","Du brauchst wohl dringend was hinter die Ohren!","Получить захотел? Сейчас я надаю тебе по шее!","","","SVM_12_NowWait","",""
"Scripts/content/Story/svm.d:1725","Hast du immer noch nicht genug?","А, тебе все еще мало!","","","SVM_12_YouStillNotHaveEnough","",""
"Scripts/content/Story/svm.d:1726","Na gut, du willst es scheinbar so!","Ну, сам виноват!","","","SVM_12_YouAskedForIt","",""
"Scripts/content/Story/svm.d:1727","Hier werden sie dich raustragen müssen!","Тебя придется уносить отсюда!","","","SVM_12_NowWaitIntruder","",""
"Scripts/content/Story/svm.d:1728","Ich hab' dich gewarnt. Wer an meine Sachen geht, kriegt Ärger!","Я тебя предупредил. Только попробуй что-нибудь украсть!","","","SVM_12_IWillTeachYouRespectForForeignProperty","",""
"Scripts/content/Story/svm.d:1729","Du Dieb! Ich bring' dir Manieren bei!","Грязный вор! Сейчас я тебя проучу!","","","SVM_12_DirtyThief","",""
"Scripts/content/Story/svm.d:1730","Niemand vergreift sich ungestraft an meinen Jungs!","Если будешь лезть ко мне, ты сильно пожалеешь!","","","SVM_12_YouAttackedMyCharge","",""
"Scripts/content/Story/svm.d:1731","Du hast einen meiner Jungs platt gemacht. Jetzt mach' ich DICH platt!","Ты убил одного из моих людей. Теперь твоя очередь!","","","SVM_12_YouKilledOneOfUs","",""
"Scripts/content/Story/svm.d:1732","Aaargl","","","","SVM_12_Dead","",""
"Scripts/content/Story/svm.d:1733","Aargh","","","","SVM_12_Aargh_1","",""
"Scripts/content/Story/svm.d:1734","Aargh","","","","SVM_12_Aargh_2","",""
"Scripts/content/Story/svm.d:1735","Aargh","","","","SVM_12_Aargh_3","",""
"Scripts/content/Story/svm.d:1736","UUAAARRGGGHHH!!!","","","","SVM_12_Berzerk","",""
"Scripts/content/Story/svm.d:1737","Das wird dir noch Leid tun!","Ты еще об этом пожалеешь!","","","SVM_12_YoullBeSorryForThis","",""
"Scripts/content/Story/svm.d:1738","Bleib locker! Hast gewonnen.","Эй, спокойно! Ты ведь победил.","","","SVM_12_YesYes","",""
"Scripts/content/Story/svm.d:1739","Das ist 'ne Nummer zu groß! Ich hau ab!","Драку придется отложить. Этот мне не по зубам!","","","SVM_12_ShitWhatAMonster","",""
"Scripts/content/Story/svm.d:1740","Verdammt!","Проклятье!","","","SVM_12_Help","",""
"Scripts/content/Story/svm.d:1741","Beim nächsten Mal sieht die Sache anders aus!","Мы еще встретимся!","","","SVM_12_WeWillMeetAgain","",""
"Scripts/content/Story/svm.d:1742","Versuch das nicht noch mal!","Больше не делай этого!","","","SVM_12_NeverTryThatAgain","",""
"Scripts/content/Story/svm.d:1743","Die Waffe gefällt mir!","Какое хорошее оружие!","","","SVM_12_ITakeYourWeapon","",""
"Scripts/content/Story/svm.d:1744","Ich sorg dafür, dass dein Erz gut angelegt wird!","Да, твоя руда очень кстати! Я потрачу ее с пользой!","","","SVM_12_ITookYourOre","",""
"Scripts/content/Story/svm.d:1745","Mist! Kein Erz!","Да у тебя же совсем нет руды?!","","","SVM_12_ShitNoOre","",""
"Scripts/content/Story/svm.d:1746","Finger weg!","Убери руки!","","","SVM_12_HandsOff","",""
"Scripts/content/Story/svm.d:1747","Raus hier!","Пошел прочь!","","","SVM_12_GetOutOfHere","",""
"Scripts/content/Story/svm.d:1748","Hey! Wo kommst du denn her?","Эй! Откуда ты здесь взялся?","","","SVM_12_YouViolatedForbiddenTerritory","",""
"Scripts/content/Story/svm.d:1749","Hältst du mich für so dämlich?!","Обмануть меня захотел? Только попробуй!","","","SVM_12_YouWannaFoolMe","",""
"Scripts/content/Story/svm.d:1750","Weshalb schleichst du hier rum?","Что тебе здесь нужно? Что ты замышляешь?","","","SVM_12_WhatsThisSupposedToBe","",""
"Scripts/content/Story/svm.d:1751","Raus hier, sonst rufe ich die Wachen!","Что ты здесь делаешь? Уходи, иначе я позову стражу!","","","SVM_12_WhyYouAreInHere","",""
"Scripts/content/Story/svm.d:1752","Du hast da drinnen nichts verloren!","Здесь тебе делать нечего!","","","SVM_12_WhatDidYouInThere","",""
"Scripts/content/Story/svm.d:1753","Du lernst schnell!","Ты все понял правильно!","","","SVM_12_WiseMove","",""
"Scripts/content/Story/svm.d:1754","Wachen, hierher!","Стража! Сюда!","","","SVM_12_Alarm","",""
"Scripts/content/Story/svm.d:1755","ALARM!!!!","Тревога!","","","SVM_12_IntruderAlert","",""
"Scripts/content/Story/svm.d:1756","Hey, pass auf!","Эй, осторожно!","","","SVM_12_BehindYou","",""
"Scripts/content/Story/svm.d:1757","Ein Kampf!","О, драка!","","","SVM_12_TheresAFight","",""
"Scripts/content/Story/svm.d:1758","Drauf!","Бей его!","","","SVM_12_HeyHeyHey","",""
"Scripts/content/Story/svm.d:1759","Gut so!","Так его!","","","SVM_12_CheerFight","",""
"Scripts/content/Story/svm.d:1760","Hau ihn endlich um!","Поддай ему!","","","SVM_12_CheerFriend","",""
"Scripts/content/Story/svm.d:1761","Pass doch auf!","Эй, будь осторожнее!","","","SVM_12_Ooh","",""
"Scripts/content/Story/svm.d:1762","Wurde aber auch Zeit!","Как удачно!","","","SVM_12_YeahWellDone","",""
"Scripts/content/Story/svm.d:1763","Der Typ verdrückt sich!","Этот трус от нас уходит!","","","SVM_12_RunCoward","",""
"Scripts/content/Story/svm.d:1764","Klarer Sieger, würde ich sagen!","Я бы сказал, чистая победа!","","","SVM_12_HeDefeatedHim","",""
"Scripts/content/Story/svm.d:1765","Es hat den Richtigen erwischt!","Так ему и надо!","","","SVM_12_HeDeservedIt","",""
"Scripts/content/Story/svm.d:1766","Einfach einen kaltmachen. Du hast jetzt echt ein Problem!","Ты убиваешь людей. Теперь у тебя большие неприятности!","","","SVM_12_HeKilledHim","",""
"Scripts/content/Story/svm.d:1767","Was für ein Kampf!","Отличная драка!","","","SVM_12_ItWasAGoodFight","",""
"Scripts/content/Story/svm.d:1768","Gäääähn","","","","SVM_12_Awake","",""
"Scripts/content/Story/svm.d:1769","Hallo, Freund!","Привет!","","","SVM_12_FriendlyGreetings","",""
"Scripts/content/Story/svm.d:1770","Für Gomez!","За Гомеза!","","","SVM_12_ALGreetings","",""
"Scripts/content/Story/svm.d:1771","Magie zu Ehren!","Во имя магии!","","","SVM_12_MageGreetings","",""
"Scripts/content/Story/svm.d:1772","Erwache!","Пробудись!","","","SVM_12_SectGreetings","",""
"Scripts/content/Story/svm.d:1773","Da drüben.","Сюда.","","","SVM_12_ThereHeIs","",""
"Scripts/content/Story/svm.d:1774","So unerfahren, wie du bist, kann ich dir nichts beibringen.","Я ничему не смогу научить тебя, тебе не хватает опыта.","","","SVM_12_NoLearnNoPoints","",""
"Scripts/content/Story/svm.d:1775","Du bist am Ende deiner Möglichkeiten. Du solltest etwas anderes lernen.","Ты больше не можешь этому научиться. Тебе стоит попробовать что-то другое.","","","SVM_12_NoLearnOverMax","",""
"Scripts/content/Story/svm.d:1776","Du musst erst fortgeschritten sein, bevor du Meister werden kannst!","Тебе нужно изучить основы, прежде чем стать настоящим мастером.","","","SVM_12_NoLearnYouAlreadyKnow","",""
"Scripts/content/Story/svm.d:1777","Du bist jetzt schon besser!","Ты уже стал умнее.","","","SVM_12_NoLearnYoureBetter","",""
"Scripts/content/Story/svm.d:1778","Hey du!","Эй, ты!","","","SVM_12_HeyYou","",""
"Scripts/content/Story/svm.d:1779","Nicht jetzt.","Не сейчас!","","","SVM_12_NotNow","",""
"Scripts/content/Story/svm.d:1780","Kann ich dir helfen?","Может, я могу тебе чем-нибудь помочь?","","","SVM_12_WhatDoYouWant","",""
"Scripts/content/Story/svm.d:1781","Was willst du?","Что тебе нужно?","","","SVM_12_ISaidWhatDoYouWant","",""
"Scripts/content/Story/svm.d:1782","Lass mich mal durch.","Дай пройти!","","","SVM_12_MakeWay","",""
"Scripts/content/Story/svm.d:1783","Na los, lass mich vorbei!","Ну же, уйди с дороги!","","","SVM_12_OutOfMyWay","",""
"Scripts/content/Story/svm.d:1784","Bist du taub oder suchst du Streit?","Тебе нужны неприятности? Я могу тебе это устроить!","","","SVM_12_YouDeafOrWhat","",""
"Scripts/content/Story/svm.d:1785","Willst du dich noch mal mit mir anlegen?","Снова ищешь неприятностей?","","","SVM_12_LookingForTroubleAgain","",""
"Scripts/content/Story/svm.d:1786","War irgendwas? Ich hab' NICHTS gesehen ...","Что-то произошло? Я ничего не видел...","","","SVM_12_LookAway","",""
"Scripts/content/Story/svm.d:1787","Schon gut, behalt es!","Ладно, забирай себе!","","","SVM_12_OkayKeepIt","",""
"Scripts/content/Story/svm.d:1788","Was war denn das?","Что это было?","","","SVM_12_WhatsThat","",""
"Scripts/content/Story/svm.d:1789","Ich würde es vorziehen, meine Waffe zurückzubekommen!","Я хочу вернуть свое оружие!","","","SVM_12_ThatsMyWeapon","",""
"Scripts/content/Story/svm.d:1790","Gib schon her!","Просто отдай его мне!","","","SVM_12_GiveItToMe","",""
"Scripts/content/Story/svm.d:1791","Na ja, auch nicht so schlimm! Ich hab' noch mehr davon!","Ну, все не так уж и плохо! У меня еще есть!","","","SVM_12_YouCanKeeptheCrap","",""
"Scripts/content/Story/svm.d:1792","Sie haben einen unserer Jungs erwischt. Wenn ich das Schwein kriege ...","Убит наш человек. Уж я покажу тому, кто это сделал...","","","SVM_12_TheyKilledMyFriend","",""
"Scripts/content/Story/svm.d:1793","Hm, was soll denn das? Warum weckst du mich?","Ну, что такое? Зачем ты меня разбудил?","","","SVM_12_YouDisturbedMySlumber","",""
"Scripts/content/Story/svm.d:1794","Na? Haste was aufs Maul gekriegt? Geschieht dir Recht!","Ну? Ты доволен? Это будет тебе уроком!","","","SVM_12_SuckerGotSome","",""
"Scripts/content/Story/svm.d:1795","Du hast einen Erzbaron umgehauen. Er war beeindruckt!","Ты победил Барона. Как же он был удивлен!","","","SVM_12_SuckerDefeatedEBr","",""
"Scripts/content/Story/svm.d:1796","Du hast einen der Gurus besiegt. Respekt. Aber lass dir nicht einfallen, das noch mal zu probieren.","Ты избил одного из Гуру. Только не думай, что тебе позволят повторить такой 'подвиг'.","","","SVM_12_SuckerDefeatedGur","",""
"Scripts/content/Story/svm.d:1797","Einen Magier zu besiegen ... Du bist ja einer!","Победить мага... ты, должно быть, отважный парень!","","","SVM_12_SuckerDefeatedMage","",""
"Scripts/content/Story/svm.d:1798","Du hast sie ja wohl nicht alle, einfach einen Novizen umzuhauen.","Не трогай послушников! Ты сошел с ума?","","","SVM_12_SuckerDefeatedNov_Guard","",""
"Scripts/content/Story/svm.d:1799","Was fällt dir eigentlich ein, einen Buddler zu verkloppen?","Думаешь, тебе позволено бить рудокопов?","","","SVM_12_SuckerDefeatedVlk_Guard","",""
"Scripts/content/Story/svm.d:1800","Du hast einen Kumpel von mir ausgeknockt, was sollte das?","Зачем ты ударил моего напарника?","","","SVM_12_YouDefeatedMyComrade","",""
"Scripts/content/Story/svm.d:1801","Vergreif dich noch einmal an unseren Jungs und es wird dir Leid tun.","Только тронь послушника, и мы с тебя шкуру спустим!","","","SVM_12_YouDefeatedNOV_Guard","",""
"Scripts/content/Story/svm.d:1802","Du bist echt zu mutig, einen meiner Schützlinge anzufassen, kann dich teuer zu stehen kommen.","Слишком ты расхрабрился. Перестань обижать моих подопечных, иначе получишь!","","","SVM_12_YouDefeatedVLK_Guard","",""
"Scripts/content/Story/svm.d:1803","Du wagst es mir unter die Augen zu treten, dreckiger Dieb?","И ты еще смеешь заявляться сюда, грязный вор?!","","","SVM_12_YouStoleFromMe","",""
"Scripts/content/Story/svm.d:1804","Du hast einige Sachen, die uns gehören. Gib sie besser wieder her.","У тебя есть то, что принадлежит нам. Верни немедленно!","","","SVM_12_YouStoleFromUs","",""
"Scripts/content/Story/svm.d:1805","Mann! Du hast die Erzbarone beklaut! Die werden toben!","Парень! Ты обокрал Баронов! Они придут в ярость!","","","SVM_12_YouStoleFromEBr","",""
"Scripts/content/Story/svm.d:1806","Du hast die Gurus beklaut! Wenn du dich wenigstens nicht erwischen lassen würdest!","Ты обокрал Гуру! Большая удача, что тебя не поймали.","","","SVM_12_YouStoleFromGur","",""
"Scripts/content/Story/svm.d:1807","Die Magier mögen es nicht, wenn man in ihren Sachen rumstöbert!","Магам вовсе не нравится, когда кто-то роется в их вещах.","","","SVM_12_StoleFromMage","",""
"Scripts/content/Story/svm.d:1808","Du hast einen von unseren Jungs auf dem Gewissen. Noch ein kleiner Fehler und du bist dran!","Жизнь одного из наших людей на твоей совести. Еще один неверный шаг, и ты будешь следующим!","","","SVM_12_YouKilledMyFriend","",""
"Scripts/content/Story/svm.d:1809","Du hast einen Erzbaron umgelegt! Mann, du bist wohl komplett durchgedreht!?","Ты убил Барона! Только сумасшедший мог пойти на это!","","","SVM_12_YouKilledEBr","",""
"Scripts/content/Story/svm.d:1810","Du hast einen Guru getötet! Junge, das kann doch nicht wahr sein!","Ты убил Гуру! Я не могу в это поверить!","","","SVM_12_YouKilledGur","",""
"Scripts/content/Story/svm.d:1811","Du hast einen Magier umgebracht! Wie sollen wir das denn erklären?","Ты убил мага! Можешь объяснить, зачем ты это сделал?","","","SVM_12_YouKilledMage","",""
