"location","source","target","id","fuzzy","context","translator_comments","developer_comments"
"Scripts/content/Story/svm.d:730","Du hast sie ja wohl nicht alle, einfach einen Novizen umhauen.","Да ты совсем из ума выжил! Нельзя бить наших послушников!","","","SVM_4_SuckerDefeatedNov_Guard","",""
"Scripts/content/Story/svm.d:731","Was fällt dir eigentlich ein, einen Buddler zu verkloppen ?","Что на тебя нашло? Думаешь, мы будем стоять в стороне, пока ты будешь бить рудокопов?","","","SVM_4_SuckerDefeatedVlk_Guard","",""
"Scripts/content/Story/svm.d:732","Du hast dich mit einem Freund von mir angelegt! Du bist wirklich unvorsichtig!","Ты ударил одного из моих друзей! Не стоило этого делать!","","","SVM_4_YouDefeatedMyComrade","",""
"Scripts/content/Story/svm.d:733","Vergreif dich noch einmal an einem Novizen und es wird dir Leid tun!","Только попробуй еще раз тронуть послушника. Ты сразу же об этом пожалеешь!","","","SVM_4_YouDefeatedNOV_Guard","",""
"Scripts/content/Story/svm.d:734","Du bist echt zu mutig, einen meiner Schützlinge anzufassen, kann dich teuer zu stehen kommen.","Слишком ты расхрабрился. Перестань обижать моих подопечных, иначе получишь!","","","SVM_4_YouDefeatedVLK_Guard","",""
"Scripts/content/Story/svm.d:735","Lass bloß die Finger von meinen Sachen, verstanden?","Держи свои грязные руки подальше от моих вещей!","","","SVM_4_YouStoleFromMe","",""
"Scripts/content/Story/svm.d:736","Du hast da etwas, was uns gehört. Gib es uns wieder!","У тебя есть наши вещи. Отдай мигом!","","","SVM_4_YouStoleFromUs","",""
"Scripts/content/Story/svm.d:737","Mann! Du hast die Erzbarone beklaut! Die werden toben!","Парень! Ты обокрал Баронов! Они придут в ярость!","","","SVM_4_YouStoleFromEBr","",""
"Scripts/content/Story/svm.d:738","Du hast die Gurus beklaut! Wenn du dich wenigstens nicht erwischen lassen würdest!","Ты обокрал Гуру! Большая удача, что тебя не поймали.","","","SVM_4_YouStoleFromGur","",""
"Scripts/content/Story/svm.d:739","Die Magier mögen es nicht, wenn man in ihren Sachen rumstöbert!","Магам вовсе не нравится, когда кто-то роется в их вещах.","","","SVM_4_StoleFromMage","",""
"Scripts/content/Story/svm.d:740","Du hast einen von unseren Jungs auf dem Gewissen. Noch ein kleiner Fehler und du bist dran!","Жизнь одного из наших людей на твоей совести. Еще один неверный шаг, и ты будешь следующим!","","","SVM_4_YouKilledMyFriend","",""
"Scripts/content/Story/svm.d:741","Du hast einen Erzbaron umgelegt! Mann, du bist wohl komplett durchgedreht!?","Ты убил Барона! Только сумасшедший мог пойти на это!","","","SVM_4_YouKilledEBr","",""
"Scripts/content/Story/svm.d:742","Du hast einen Guru getötet! Junge, das kann doch nicht wahr sein!","Ты убил Гуру! Я не могу в это поверить!","","","SVM_4_YouKilledGur","",""
"Scripts/content/Story/svm.d:743","Du hast einen Magier umgebracht! Wie sollen wir das denn erklären?","Ты убил мага! Можешь объяснить, зачем ты это сделал?","","","SVM_4_YouKilledMage","",""
"Scripts/content/Story/svm.d:744","Jemand aus dem Alten Lager ist tot und du sollst damit zu tun haben ...","Убит человек из Старого лагеря, и кое-кто связывает тебя с этим убийством...","","","SVM_4_YouKilledOCfolk","",""
"Scripts/content/Story/svm.d:745","Im Neuen Lager steht wieder 'ne Hütte leer, und scheinbar hast du damit zu tun!","В Новом лагере не досчитались одного человека, и говорят, что ты связан с этим убийством!","","","SVM_4_YouKilledNCfolk","",""
"Scripts/content/Story/svm.d:746","Die Bruderschaft ist um einen Anhänger ärmer, und wie es scheint, hast du ihn beseitigt!","В Братстве убит один из последователей. Люди думают, что ты виноват в его убийстве!","","","SVM_4_YouKilledPSIfolk","",""
"Scripts/content/Story/svm.d:747","Das wieder hinzubiegen wird nicht einfach!","Не хотел бы я попасть в подобную переделку!","","","SVM_4_GetThingsRight","",""
"Scripts/content/Story/svm.d:748","Du hast mir ganz schön aufs Maul gehauen, Mann. War ein guter Kampf. Aber jetzt ist gut!","Ты победил меня в честном бою! Но теперь все позади! Я не в обиде!","","","SVM_4_YouDefeatedMeWell","",""
"Scripts/content/Story/svm.d:749"," ... wenn du meinst ..."," ...если ты думаешь...","","","SVM_4_Smalltalk01","",""
"Scripts/content/Story/svm.d:750"," ... kann schon sein ..."," ..ну, может быть...","","","SVM_4_Smalltalk02","",""
"Scripts/content/Story/svm.d:751"," ... war nicht besonders schlau ..."," ...ну, это было не слишком умно...","","","SVM_4_Smalltalk03","",""
"Scripts/content/Story/svm.d:752"," ... ich halt mich da lieber raus ..."," ...не стоит в это ввязываться...","","","SVM_4_Smalltalk04","",""
"Scripts/content/Story/svm.d:753"," ... das ist wirklich nicht mein Problem ..."," ...а это уже не моя проблема...","","","SVM_4_Smalltalk05","",""
"Scripts/content/Story/svm.d:754"," ... war doch klar, dass das Ärger gibt ..."," ...уже тогда было ясно, что этим дело не кончится...","","","SVM_4_Smalltalk06","",""
"Scripts/content/Story/svm.d:755"," ... aber behalt's für dich, muss nicht gleich jeder wissen ..."," ...ну знаешь, держи это при себе, людям необязательно знать об этом.","","","SVM_4_Smalltalk07","",""
"Scripts/content/Story/svm.d:756"," ... das passiert mir nicht noch mal ..."," ...не хочу пережить это снова...","","","SVM_4_Smalltalk08","",""
"Scripts/content/Story/svm.d:757"," ... an der Geschichte muss wohl doch was dran sein ..."," ...что-то не так в этой истории...","","","SVM_4_Smalltalk09","",""
"Scripts/content/Story/svm.d:758"," ... man muss eben aufpassen, was man rumerzählt ..."," ...ты должен следить за тем, что говоришь людям...","","","SVM_4_Smalltalk10","",""
"Scripts/content/Story/svm.d:759"," ... solange ich damit nichts zu tun habe ..."," ...пока меня не впутали...","","","SVM_4_Smalltalk11","",""
"Scripts/content/Story/svm.d:760"," ... man darf auch nicht alles glauben, was man hört ..."," ...ты не должен верить всему...","","","SVM_4_Smalltalk12","",""
"Scripts/content/Story/svm.d:761"," ... in seiner Haut will ich trotzdem nicht stecken ..."," ...не хотел бы оказаться на его месте...","","","SVM_4_Smalltalk13","",""
"Scripts/content/Story/svm.d:762"," ... immer wieder dieselbe Leier ..."," ...все время одно и то же...","","","SVM_4_Smalltalk14","",""
"Scripts/content/Story/svm.d:763"," ... manche lernen eben gar nichts dazu ..."," ...некоторых ничему нельзя научить...","","","SVM_4_Smalltalk15","",""
"Scripts/content/Story/svm.d:764"," ... früher wäre das ganz anders gelaufen ..."," ...раньше все было совсем по-другому...","","","SVM_4_Smalltalk16","",""
"Scripts/content/Story/svm.d:765"," ... gequatscht wird viel ..."," ...люди слишком много болтают...","","","SVM_4_Smalltalk17","",""
"Scripts/content/Story/svm.d:766"," ... ich hör' nicht mehr auf das Gefasel ..."," ...больше не хочу это слушать...","","","SVM_4_Smalltalk18","",""
"Scripts/content/Story/svm.d:767"," ... verlass dich auf jemanden und du bist verlassen, das ist eben so ..."," ...никому не доверяй, здесь кругом предатели...","","","SVM_4_Smalltalk19","",""
"Scripts/content/Story/svm.d:768"," ... ich glaube kaum, dass sich daran was ändern wird ..."," ...не думаю, что здесь можно хоть что-нибудь изменить...","","","SVM_4_Smalltalk20","",""
"Scripts/content/Story/svm.d:769"," ... wahrscheinlich hast du Recht ..."," ...быть может, ты и прав...","","","SVM_4_Smalltalk21","",""
"Scripts/content/Story/svm.d:770"," ... erst mal abwarten. Es wird nichts so heiß gegessen, wie es gekocht wird ..."," ...подожди. Не стоит принимать поспешные решения...","","","SVM_4_Smalltalk22","",""
"Scripts/content/Story/svm.d:771"," ... ich dachte, das wäre schon lange geklärt ..."," ...я думал, об этом уже все давно знают...","","","SVM_4_Smalltalk23","",""
"Scripts/content/Story/svm.d:772"," ... lass uns lieber über was anderes reden ..."," ...поговорим об этом в следующий раз...","","","SVM_4_Smalltalk24","",""
"Scripts/content/Story/svm.d:773"," Ommm"," ","","","SVM_4_Om","",""
"Scripts/content/Story/svm.d:778","Pack mal lieber die Magie weg!","Здесь запрещено колдовать!","","","SVM_5_StopMagic","",""
"Scripts/content/Story/svm.d:779","Wenn ich 'Magie weg' sage, dann mein' ich das auch so!","Я же сказал: колдовать запрещено!","","","SVM_5_ISaidStopMagic","",""
"Scripts/content/Story/svm.d:780","Was hast du mit der Waffe vor, Mann!","Лучше бы ты спрятал свое оружие!","","","SVM_5_WeaponDown","",""
"Scripts/content/Story/svm.d:781","Komm schon, steck weg, das Ding!","Быстро убери оружие!","","","SVM_5_ISaidWeaponDown","",""
"Scripts/content/Story/svm.d:782","Du zielst auf mich, du Komiker!","Ты в меня целишься, да?","","","SVM_5_WatchYourAim","",""
"Scripts/content/Story/svm.d:783","Wenn du nicht aufhörst, dann übe ich gleich auch mal mit dir!","Прекрати! С моим мечом познакомиться захотел?","","","SVM_5_WatchYourAimAngry","",""
"Scripts/content/Story/svm.d:784","Hey, bist du blind oder was?","Эй, ты что, совсем ослеп?","","","SVM_5_WhatAreYouDoing","",""
"Scripts/content/Story/svm.d:785","Den kleinen Streit vergessen wir, okay?","Давай забудем об этой ссоре, ладно?		","","","SVM_5_LetsForgetOurLittleFight","",""
"Scripts/content/Story/svm.d:786","Eben war er noch da!? Seltsam!","Он же только что был здесь! Куда он делся? ","","","SVM_5_Strange","",""
"Scripts/content/Story/svm.d:787","Du bist fällig, Mistvieh!","Теперь твоя очередь, негодяй!","","","SVM_5_DieMonster","",""
"Scripts/content/Story/svm.d:788","Jetzt wird abgerechnet!","Настал час расплаты!","","","SVM_5_DieMortalEnemy","",""
"Scripts/content/Story/svm.d:789","Du brauchst wohl dringend was hinter die Ohren!","Получить захотел? Сейчас я надаю тебе по шее!","","","SVM_5_NowWait","",""
"Scripts/content/Story/svm.d:790","Hast du immer noch nicht genug?","А, тебе все еще мало!","","","SVM_5_YouStillNotHaveEnough","",""
"Scripts/content/Story/svm.d:791","Na gut, du willst es scheinbar so!","Ну, сам виноват!","","","SVM_5_YouAskedForIt","",""
"Scripts/content/Story/svm.d:792","Hier werden sie dich raustragen müssen!","Тебя придется уносить отсюда!","","","SVM_5_NowWaitIntruder","",""
"Scripts/content/Story/svm.d:793","Ich hab' dich gewarnt. Wer an meine Sachen geht, kriegt Ärger!","Я тебя предупредил. Только попробуй что-нибудь украсть!","","","SVM_5_IWillTeachYouRespectForForeignProperty","",""
"Scripts/content/Story/svm.d:794","Du Dieb! Ich bring dir Manieren bei!","Вор! Ну, сейчас ты получишь!","","","SVM_5_DirtyThief","",""
"Scripts/content/Story/svm.d:795","Niemand vergreift sich ungestraft an meinen Jungs!","Если будешь лезть ко мне, ты сильно пожалеешь!","","","SVM_5_YouAttackedMyCharge","",""
"Scripts/content/Story/svm.d:796","Du hast einen meiner Jungs platt gemacht. Jetzt mach' ich DICH platt!","Ты убил одного из моих людей. Теперь твоя очередь!","","","SVM_5_YouKilledOneOfUs","",""
"Scripts/content/Story/svm.d:797","Aaargl","","","","SVM_5_Dead","",""
"Scripts/content/Story/svm.d:798","Aargh","","","","SVM_5_Aargh_1","",""
"Scripts/content/Story/svm.d:799","Aargh","","","","SVM_5_Aargh_2","",""
"Scripts/content/Story/svm.d:800","Aargh","","","","SVM_5_Aargh_3","",""
"Scripts/content/Story/svm.d:801","UUAAARRGGGHHH!!!","","","","SVM_5_Berzerk","",""
"Scripts/content/Story/svm.d:802","Das wird dir noch Leid tun!","Ты еще об этом пожалеешь!","","","SVM_5_YoullBeSorryForThis","",""
"Scripts/content/Story/svm.d:803","Bleib locker! Hast gewonnen.","Эй, спокойно! Ты ведь победил.","","","SVM_5_YesYes","",""
"Scripts/content/Story/svm.d:804","Das ist 'ne Nummer zu groß für mich!","Мне его не одолеть!","","","SVM_5_ShitWhatAMonster","",""
"Scripts/content/Story/svm.d:805","Verdammt!","Проклятье!","","","SVM_5_Help","",""
"Scripts/content/Story/svm.d:806","Beim nächsten Mal sieht die Sache wieder anders aus!","В следующий раз я отомщу тебе!","","","SVM_5_WeWillMeetAgain","",""
"Scripts/content/Story/svm.d:807","Versuch das nicht noch mal!","Больше не делай этого!","","","SVM_5_NeverTryThatAgain","",""
"Scripts/content/Story/svm.d:808","Die Waffe gefällt mir!","Какое хорошее оружие!","","","SVM_5_ITakeYourWeapon","",""
"Scripts/content/Story/svm.d:809","Ich sorg dafür, dass dein Erz gut angelegt wird!","Да, твоя руда очень кстати! Я потрачу ее с пользой!","","","SVM_5_ITookYourOre","",""
"Scripts/content/Story/svm.d:810","So ein Pech! Kein Erz!","Не повезло! Руды нет!","","","SVM_5_ShitNoOre","",""
"Scripts/content/Story/svm.d:811","Finger weg!","Убери руки!","","","SVM_5_HandsOff","",""
"Scripts/content/Story/svm.d:812","Raus hier!","Пошел прочь!","","","SVM_5_GetOutOfHere","",""
"Scripts/content/Story/svm.d:813","Hey! Wo kommst du denn her?","Эй! Откуда ты здесь взялся?","","","SVM_5_YouViolatedForbiddenTerritory","",""
"Scripts/content/Story/svm.d:814","Guter Witz!","Удачная шутка!","","","SVM_5_YouWannaFoolMe","",""
"Scripts/content/Story/svm.d:815","Weshalb schleichst du hier rum?","Что тебе здесь нужно? Что ты замышляешь?","","","SVM_5_WhatsThisSupposedToBe","",""
"Scripts/content/Story/svm.d:816","Raus hier, sonst ruf' ich die Wachen!","Убирайся, или тебя выгонит стража!","","","SVM_5_WhyYouAreInHere","",""
"Scripts/content/Story/svm.d:817","Du hast da drinnen nichts verloren!","Здесь тебе делать нечего!","","","SVM_5_WhatDidYouInThere","",""
"Scripts/content/Story/svm.d:818","Du lernst schnell!","Ты все понял правильно!","","","SVM_5_WiseMove","",""
"Scripts/content/Story/svm.d:819","Wachen, hier her!","Стража! Сюда!","","","SVM_5_Alarm","",""
"Scripts/content/Story/svm.d:820","ALARM!!!!","Тревога!","","","SVM_5_IntruderAlert","",""
"Scripts/content/Story/svm.d:821","Hey, pass auf!","Эй, осторожно!","","","SVM_5_BehindYou","",""
"Scripts/content/Story/svm.d:822","Ein Kampf!","О, драка!","","","SVM_5_TheresAFight","",""
"Scripts/content/Story/svm.d:823","Drauf!","Бей его!","","","SVM_5_HeyHeyHey","",""
"Scripts/content/Story/svm.d:824","Gut so!","Так его!","","","SVM_5_CheerFight","",""
"Scripts/content/Story/svm.d:825","Hau ihn endlich um!","Поддай ему!","","","SVM_5_CheerFriend","",""
"Scripts/content/Story/svm.d:826","Pass doch auf!","Эй, будь осторожнее!","","","SVM_5_Ooh","",""
"Scripts/content/Story/svm.d:827","Wurde aber auch Zeit!","Как удачно!","","","SVM_5_YeahWellDone","",""
"Scripts/content/Story/svm.d:828","Der Typ verdrückt sich!","Этот трус от нас уходит!","","","SVM_5_RunCoward","",""
"Scripts/content/Story/svm.d:829","Klarer Sieger würde ich sagen!","Полная победа, да!","","","SVM_5_HeDefeatedHim","",""
"Scripts/content/Story/svm.d:830","Es hat den Richtigen erwischt!","Так ему и надо!","","","SVM_5_HeDeservedIt","",""
"Scripts/content/Story/svm.d:831","Einfach einen kalt machen. Du hast jetzt echt ein Problem!","Ты убийца! Это недопустимо! У тебя будут проблемы!","","","SVM_5_HeKilledHim","",""
"Scripts/content/Story/svm.d:832","Was für ein Kampf!","Отличная драка!","","","SVM_5_ItWasAGoodFight","",""
"Scripts/content/Story/svm.d:833","Gäääähn","","","","SVM_5_Awake","",""
"Scripts/content/Story/svm.d:834","Hi Ho Kumpel!","Привет, дружище!","","","SVM_5_FriendlyGreetings","",""
"Scripts/content/Story/svm.d:835","Für Gomez!","За Гомеза!","","","SVM_5_ALGreetings","",""
"Scripts/content/Story/svm.d:836","Magie zu Ehren!","Во имя магии!","","","SVM_5_MageGreetings","",""
"Scripts/content/Story/svm.d:837","Erwache!","Пробудись!","","","SVM_5_SectGreetings","",""
"Scripts/content/Story/svm.d:838","Da drüben.","Сюда.","","","SVM_5_ThereHeIs","",""
"Scripts/content/Story/svm.d:839","So unerfahren, wie du bist, kann ich dir nichts beibringen.","Я ничему не смогу научить тебя, тебе не хватает опыта.","","","SVM_5_NoLearnNoPoints","",""
"Scripts/content/Story/svm.d:840","Du bist am Ende deiner Möglichkeiten. Du solltest etwas anderes lernen.","Ты больше не можешь этому научиться. Тебе стоит попробовать что-то другое.","","","SVM_5_NoLearnOverMax","",""
"Scripts/content/Story/svm.d:841","Du musst erst fortgeschritten sein, bevor du Meister werden kannst!","Тебе нужно изучить основы, прежде чем стать настоящим мастером.","","","SVM_5_NoLearnYouAlreadyKnow","",""
"Scripts/content/Story/svm.d:842","Du bist jetzt schon besser!","Ты уже стал умнее.","","","SVM_5_NoLearnYoureBetter","",""
"Scripts/content/Story/svm.d:843","Hey du!","Эй, ты!","","","SVM_5_HeyYou","",""
"Scripts/content/Story/svm.d:844","Nicht jetzt.","Не сейчас!","","","SVM_5_NotNow","",""
"Scripts/content/Story/svm.d:845","Kann ich dir helfen?","Может, я могу тебе чем-нибудь помочь?","","","SVM_5_WhatDoYouWant","",""
"Scripts/content/Story/svm.d:846","Was willst du?","Что тебе нужно?","","","SVM_5_ISaidWhatDoYouWant","",""
"Scripts/content/Story/svm.d:847","Lass mich mal durch.","Дай пройти!","","","SVM_5_MakeWay","",""
"Scripts/content/Story/svm.d:848","Komm schon, ich will vorbei!","Давай, уходи с дороги!","","","SVM_5_OutOfMyWay","",""
"Scripts/content/Story/svm.d:849","Bist du taub oder suchst du Streit?","Тебе нужны неприятности? Я могу тебе это устроить!","","","SVM_5_YouDeafOrWhat","",""
"Scripts/content/Story/svm.d:850","Willst du dich noch mal mit mir anlegen?","Снова ищешь неприятностей?","","","SVM_5_LookingForTroubleAgain","",""
"Scripts/content/Story/svm.d:851","Ich hab' NICHTS gesehen ... war irgendwas?","Я ничего не видел... А что, что-то произошло?","","","SVM_5_LookAway","",""
"Scripts/content/Story/svm.d:852","Schon gut, behalt es!","Ладно, забирай себе!","","","SVM_5_OkayKeepIt","",""
"Scripts/content/Story/svm.d:853","Was war denn das?","Что это было?","","","SVM_5_WhatsThat","",""
"Scripts/content/Story/svm.d:854","Ich würde es vorziehen, meine Waffe zurückzubekommen!","Я хочу вернуть свое оружие!","","","SVM_5_ThatsMyWeapon","",""
"Scripts/content/Story/svm.d:855","Gib schon her!","Просто отдай его мне!","","","SVM_5_GiveItToMe","",""
"Scripts/content/Story/svm.d:856","Na ja, auch nicht so schlimm! Ich hab' noch mehr davon!","Ну, все не так уж и плохо! У меня еще есть!","","","SVM_5_YouCanKeeptheCrap","",""
"Scripts/content/Story/svm.d:857","Sie haben einen unserer Jungs erwischt. Wenn ich das Schwein kriege ...","Убит наш человек. Уж я покажу тому, кто это сделал...","","","SVM_5_TheyKilledMyFriend","",""
"Scripts/content/Story/svm.d:858","Hey, was soll das? Warum weckst du mich?","Эй, в чем дело? Зачем ты меня разбудил?","","","SVM_5_YouDisturbedMySlumber","",""
"Scripts/content/Story/svm.d:859","Na? Haste was aufs Maul gekriegt? Geschieht dir recht!","Ну? Ты доволен? Это будет тебе уроком!","","","SVM_5_SuckerGotSome","",""
"Scripts/content/Story/svm.d:860","Du hast einen Erzbaron umgehauen. Er war beeindruckt!","Ты победил Барона. Как же он был удивлен!","","","SVM_5_SuckerDefeatedEBr","",""
"Scripts/content/Story/svm.d:861","Du hast einen der Gurus besiegt. Respekt. Aber lass dir nicht einfallen, das noch mal zu probieren.","Ты избил одного из Гуру. Только не думай, что тебе позволят повторить такой 'подвиг'.","","","SVM_5_SuckerDefeatedGur","",""
"Scripts/content/Story/svm.d:862","Einen Magier zu besiegen ... Du bist ja einer!","Победить мага... ты, должно быть, отважный парень!","","","SVM_5_SuckerDefeatedMage","",""
"Scripts/content/Story/svm.d:863","Du hast sie ja wohl nicht alle, einfach einen Novizen umzuhauen.","Не трогай послушников! Ты сошел с ума?","","","SVM_5_SuckerDefeatedNov_Guard","",""
"Scripts/content/Story/svm.d:864","Was fällt dir eigentlich ein, einen Buddler zu verkloppen ?","Что на тебя нашло? Думаешь, мы будем стоять в стороне, пока ты будешь бить рудокопов?","","","SVM_5_SuckerDefeatedVlk_Guard","",""
"Scripts/content/Story/svm.d:865","Du hast einen Kumpel von mir ausgeknockt, was sollte das?","Зачем ты ударил моего напарника?","","","SVM_5_YouDefeatedMyComrade","",""
"Scripts/content/Story/svm.d:866","Vergreif dich noch einmal an unseren Jungs und es wird dir Leid tun.","Только тронь послушника, и мы с тебя шкуру спустим!","","","SVM_5_YouDefeatedNOV_Guard","",""
"Scripts/content/Story/svm.d:867","Du bist echt zu mutig, einen meiner Schützlinge anzufassen, kann dich teuer zu stehen kommen.","Слишком ты расхрабрился. Перестань обижать моих подопечных, иначе получишь!","","","SVM_5_YouDefeatedVLK_Guard","",""
"Scripts/content/Story/svm.d:868","Du wagst es, mir unter die Augen zu treten, dreckiger Dieb?","Как ты смеешь являться сюда, грязный вор!","","","SVM_5_YouStoleFromMe","",""
"Scripts/content/Story/svm.d:869","Du hast einige Sachen, die uns gehören. Gib sie besser wieder her.","У тебя есть то, что принадлежит нам. Верни немедленно!","","","SVM_5_YouStoleFromUs","",""
"Scripts/content/Story/svm.d:870","Mann! Du hast die Erzbarone beklaut! Die werden toben!","Парень! Ты обокрал Баронов! Они придут в ярость!","","","SVM_5_YouStoleFromEBr","",""
"Scripts/content/Story/svm.d:871","Du hast die Gurus beklaut! Wenn du dich wenigstens nicht erwischen lassen würdest!","Ты обокрал Гуру! Большая удача, что тебя не поймали.","","","SVM_5_YouStoleFromGur","",""
"Scripts/content/Story/svm.d:872","Die Magier mögen es nicht, wenn man in ihren Sachen rumstöbert!","Магам вовсе не нравится, когда кто-то роется в их вещах.","","","SVM_5_StoleFromMage","",""
"Scripts/content/Story/svm.d:873","Du hast einen von unseren Jungs auf dem Gewissen. Noch ein kleiner Fehler und du bist dran!","Жизнь одного из наших людей на твоей совести. Еще один неверный шаг, и ты будешь следующим!","","","SVM_5_YouKilledMyFriend","",""
"Scripts/content/Story/svm.d:874","Du hast einen Erzbaron umgelegt! Mann, du bist wohl komplett durchgedreht!?","Ты убил Барона! Только сумасшедший мог пойти на это!","","","SVM_5_YouKilledEBr","",""
"Scripts/content/Story/svm.d:875","Du hast einen Guru getötet! Junge, das kann doch nicht wahr sein!","Ты убил Гуру! Я не могу в это поверить!","","","SVM_5_YouKilledGur","",""
"Scripts/content/Story/svm.d:876","Du hast einen Magier umgebracht! Wie sollen wir das denn erklären?","Ты убил мага! Можешь объяснить, зачем ты это сделал?","","","SVM_5_YouKilledMage","",""
"Scripts/content/Story/svm.d:877","Jemand aus dem Alten Lager ist tot und du sollst damit zu tun haben ...","Убит человек из Старого лагеря, и кое-кто связывает тебя с этим убийством...","","","SVM_5_YouKilledOCfolk","",""
